### ISSUE TITLE
libvirt-coreos: weird bridge behavior

### ISSUE THREAD

**Issue by kayrus** [kubernetes/kubernetes#20486]
Following this doc https://github.com/kubernetes/kubernetes/blob/master/cluster/libvirt-coreos/README.md

``` sh
git clone https://github.com/kubernetes/kubernetes/
cd kubernetes
make release-skip-tests
export KUBERNETES_PROVIDER=libvirt-coreos
./cluster/kube-up.sh
ssh core@192.168.10.2
docker run -d --name nginx nginx
docker inspect  --format '{{ .NetworkSettings.IPAddress }}' nginx # i.e. returns 10.10.1.3
```

then run curl on another k8s minion:

``` sh
ssh core@192.168.10.3
curl 10.10.1.3
```

And you'll see result below:

```
core@kubernetes-minion-2 ~ $ curl 10.10.1.3
curl: (56) Recv failure: Connection reset by peer
core@kubernetes-minion-2 ~ $ curl 10.10.1.3
curl: (56) Recv failure: Connection reset by peer
core@kubernetes-minion-2 ~ $ curl 10.10.1.3
curl: (56) Recv failure: Connection reset by peer
core@kubernetes-minion-2 ~ $ curl 10.10.1.3
curl: (56) Recv failure: Connection reset by peer
core@kubernetes-minion-2 ~ $ curl 10.10.1.3
<!DOCTYPE html>
<html>
<head>
<title>Welcome to nginx!</title>
<style>
    body {
        width: 35em;
        margin: 0 auto;
        font-family: Tahoma, Verdana, Arial, sans-serif;
    }
</style>
</head>
<body>
<h1>Welcome to nginx!</h1>
<p>If you see this page, the nginx web server is successfully installed and
working. Further configuration is required.</p>

<p>For online documentation and support please refer to
<a href="http://nginx.org/">nginx.org</a>.<br/>
Commercial support is available at
<a href="http://nginx.com/">nginx.com</a>.</p>

<p><em>Thank you for using nginx.</em></p>
</body>
</html>
core@kubernetes-minion-2 ~ $ curl 10.10.1.3
curl: (56) Recv failure: Connection reset by peer
```

So looks like there is something wrong with the bridge configuration in `libvirt-coreos` provider.

Here is tcpdump:

``` sh
10:50:44.059742 IP 10.10.2.1.59138 > 10.10.1.3.http: Flags [S], seq 3020067180, win 29200, options [mss 1460,sackOK,TS val 3556468 ecr 0,nop,wscale 6], length 0
10:50:44.059777 IP 10.10.1.3.http > 10.10.2.1.59138: Flags [S.], seq 1880978123, ack 3020067181, win 28960, options [mss 1460,sackOK,TS val 3560072 ecr 3556468,nop,wscale 6], length 0
10:50:44.059793 IP 10.10.1.3.http > 10.10.2.1.59138: Flags [S.], seq 1880978123, ack 3020067181, win 28960, options [mss 1460,sackOK,TS val 3560072 ecr 3556468,nop,wscale 6], length 0
10:50:44.060083 IP 10.10.2.1.59138 > 10.10.1.3.http: Flags [.], ack 1, win 457, options [nop,nop,TS val 3556468 ecr 3560072], length 0
10:50:44.060090 IP 10.10.2.1.59138 > 10.10.1.3.http: Flags [P.], seq 1:74, ack 1, win 457, options [nop,nop,TS val 3556468 ecr 3560072], length 73
10:50:44.060110 IP 10.10.1.3.http > 10.10.2.1.59138: Flags [R], seq 1880978124, win 0, length 0
10:50:44.060114 IP 10.10.1.3.http > 10.10.2.1.59138: Flags [R], seq 1880978124, win 0, length 0
10:50:44.060131 IP 10.10.1.3.http > 10.10.2.1.59138: Flags [R], seq 1880978124, win 0, length 0
10:50:44.060133 IP 10.10.1.3.http > 10.10.2.1.59138: Flags [R], seq 1880978124, win 0, length 0
```

/cc @lhuard1A

**Comment by jlowdermilk** [comment]
cc @jmastr @thomasfricke

**Comment by dtatulea** [comment]
Something that tcpdump didn't show was the ICMP redirect packet:

```
  1 0.000000000    10.10.2.1 -> 10.10.1.2    TCP 74 46092→80 [SYN] Seq=0 Win=29200 Len=0 MSS=1460 SACK_PERM=1 TSval=924733 TSecr=0 WS=64
  2 0.000107000    10.10.1.2 -> 10.10.2.1    TCP 74 80→46092 [SYN, ACK] Seq=0 Ack=1 Win=28960 Len=0 MSS=1460 SACK_PERM=1 TSval=925621 TSecr=924733 WS=64
  3 0.000149000    10.10.1.1 -> 10.10.1.2    ICMP 102 Redirect             (Redirect for host)
  4 0.000178000    10.10.1.2 -> 10.10.2.1    TCP 74 [TCP Out-Of-Order] 80→46092 [SYN, ACK] Seq=0 Ack=1 Win=28960 Len=0 MSS=1460 SACK_PERM=1 TSval=925621 TSecr=924733 WS=64
  5 0.000477000    10.10.2.1 -> 10.10.1.2    TCP 66 46092→80 [ACK] Seq=1 Ack=1 Win=29248 Len=0 TSval=924734 TSecr=925621
  6 0.000518000    10.10.1.2 -> 10.10.2.1    TCP 54 80→46092 [RST] Seq=1 Win=0 Len=0
  7 0.000523000    10.10.1.2 -> 10.10.2.1    TCP 54 80→46092 [RST] Seq=1 Win=0 Len=0
  8 0.000591000    10.10.2.1 -> 10.10.1.2    HTTP 139 GET / HTTP/1.1 
```

If the interfaces have send_redirect disabled the ICMP the tcp connection is not reset like mentioned [here](http://unix.stackexchange.com/questions/57941/linux-always-send-icmp-redirect), the tcp connection is not reset:

```
 47 7.601384000    10.10.2.1 -> 10.10.1.2    TCP 74 46112→80 [SYN] Seq=0 Win=29200 Len=0 MSS=1460 SACK_PERM=1 TSval=932334 TSecr=0 WS=64
 48 7.601553000    10.10.1.2 -> 10.10.2.1    TCP 74 80→46112 [SYN, ACK] Seq=0 Ack=1 Win=28960 Len=0 MSS=1460 SACK_PERM=1 TSval=933222 TSecr=932334 WS=64
 49 7.601561000    10.10.1.2 -> 10.10.2.1    TCP 74 [TCP Out-Of-Order] 80→46112 [SYN, ACK] Seq=0 Ack=1 Win=28960 Len=0 MSS=1460 SACK_PERM=1 TSval=933222 TSecr=932334 WS=64
 50 7.601868000    10.10.2.1 -> 10.10.1.2    TCP 66 46112→80 [ACK] Seq=1 Ack=1 Win=29248 Len=0 TSval=932335 TSecr=933222
 51 7.602200000    10.10.2.1 -> 10.10.1.2    HTTP 139 GET / HTTP/1.1 
 52 7.602237000    10.10.1.2 -> 10.10.2.1    TCP 66 80→46112 [ACK] Seq=1 Ack=74 Win=28992 Len=0 TSval=933223 TSecr=932335
 53 7.602251000    10.10.1.2 -> 10.10.2.1    TCP 66 [TCP Dup ACK 52#1] 80→46112 [ACK] Seq=1 Ack=74 Win=28992 Len=0 TSval=933223 TSecr=932335
```

However, there are still duplicate packets coming from the actual bridge interface.

**Comment by davidopp** [comment]
cc/ @lhuard1A 

cc/ @robszumski @aaronlevy @bcwaldon

**Comment by roberthbailey** [comment]
Closing as obsolete since this hasn't been updated in over a year. Please re-open or file a new issue if you still see this with Kubernetes 1.6.
