### ISSUE TITLE
Can't access the container's resource when using several nginx proxy (svc type:nodeport)

### ISSUE THREAD

**Issue by workhardcc** [kubernetes/kubernetes#31785]
Hi all,
centos7.2, kube version:1.3.4
Found a very weird issue in my cluster:
1. Created a deployment which `replicas=1` meanwhile there is only one container in this pod. Nginx running in that container ,just a static web page(eg. "hello world").
2. Create a svc , type: nodePort: 30098.
3. minon: 10.99.1.1, 10.99.1.2; master:10.99.2.1; Using flannel .
It's very readily to access the "hello world" web page by using `curl "http://10.99.1.1:30098"` or`curl "http://10.99.1.2:30098"`
4. Set up a nginx(we called nginxA), make the nginx.conf as below:

```
user  nginx;
worker_processes  1;
error_log  /var/log/nginx/error.log warn;
pid        /var/run/nginx.pid;
events {
    worker_connections  1024;
}
http {
    include       /etc/nginx/mime.types;
    default_type  application/octet-stream;
    log_format  main  '$remote_addr - $remote_user [$time_local] "$request" '
                      '$status $body_bytes_sent "$http_referer" '
                      '"$http_user_agent" "$http_x_forwarded_for"';
    access_log  /var/log/nginx/access.log  main;
    upstream test{
        server 10.99.1.1:30098;
    }
    server {
        listen 8080;
        location / {  
            rewrite ^/proxy_test/(.*) /$1 break;
            proxy_pass http://test;
        }
    }
    sendfile        on;
    #tcp_nopush     on;
    keepalive_timeout  65;
    #gzip  on;
}
```

five. Access http://nginxA's_ip:8080/ in browser is ok! 
six.  Unfortunately when I set up another nginx(we called nginxB) which nginx.conf is  the same with nginxA, access http://nginxA's_ip:8080/ in browser is ok, then access http://nginxB's_ip:8080/ in browser is 504 Gateway Time-out. **Wait for a while**(maybe 30 secs), access http://nginxB's_ip:8080/ in browser is ok, access http://nginxB's_ip:8080/ in browser is **504 Gateway Time-out**.
Tcpdump in container when `504 Gateway Time-out` as below(172.16.66.1 is the host's bridge docker0's ip, 172.16.66.2 is the container's ip ):

> 13:17:01.896157 IP 172.16.66.1.54225 > 172.16.66.2.8000: Flags [S], seq 1070996412, win 29200, options [mss 1460,sackOK,TS val 1155815188 ecr 0,nop,wscale 7], length 0
> 13:17:02.897994 IP 172.16.66.1.54225 > 172.16.66.2.8000: Flags [S], seq 1070996412, win 29200, options [mss 1460,sackOK,TS val 1155816190 ecr 0,nop,wscale 7], length 0
> 13:17:04.899990 IP 172.16.66.1.54225 > 172.16.66.2.8000: Flags [S], seq 1070996412, win 29200, options [mss 1460,sackOK,TS val 1155818192 ecr 0,nop,wscale 7], length 0
> 13:17:08.908074 IP 172.16.66.1.54225 > 172.16.66.2.8000: Flags [S], seq 1070996412, win 29200, options [mss 1460,sackOK,TS val 1155822200 ecr 0,nop,wscale 7], length 0
> 13:17:16.916176 IP 172.16.66.1.54225 > 172.16.66.2.8000: Flags [S], seq 1070996412, win 29200, options [mss 1460,sackOK,TS val 1155830208 ecr 0,nop,wscale 7], length 0
> 13:17:32.948170 IP 172.16.66.1.54225 > 172.16.66.2.8000: Flags [S], seq 1070996412, win 29200, options [mss 1460,sackOK,TS val 1155846240 ecr 0,nop,wscale 7], length 0

It's obviously that container didn't ACK the request from  Bridge docker0.
So maybe there is a session configuration in somewhere I can modify it?

**Comment by workhardcc** [comment]
I think the root of this problem is iptables.  You can use command telnet: `telnet 10.99.1.1 30098 ` instead of nginx. It's easily reproduce it.
ps: alternate use command `telnet 10.99.1.1 30098 ` and `telnet 10.99.1.2 30098 `. You will find one is ok, the other is failed.

**Comment by workhardcc** [comment]
I found the solution!
This problem is not blame kubernetes but iptables. We should turn off the `tw_recycle` in proc.
