### ISSUE TITLE
 kube-proxy: traffic to healthcheck host ports is dropped because of iptables rule order

### ISSUE THREAD

**Issue by ffilippopoulos** [kubernetes/kubernetes#117621]
### What happened?

We are running self managed Kubernetes clusters on GCP and use Services of `type: LoadBalancer` with both public and private `EXTERNAL-IP`s to create load balancers for our clusters. Since upgrading kube-proxy to 1.26.3 (from 1.25.5) we saw that all healthchecks from GCP started to fail and traffic is now blindly load balanced across all nodes, which broke Services with
`externalTrafficPolicy` set to `Local`.
The issue seems to be introduced with this change: https://github.com/kubernetes/kubernetes/pull/108460
Here, `KUBE-IPVS-IPS` ipset is introduced and is used in iptables on chain `KUBE-IPVS-FILTER` as:
```
-A KUBE-IPVS-FILTER -m set --match-set KUBE-LOAD-BALANCER dst,dst -j RETURN
-A KUBE-IPVS-FILTER -m set --match-set KUBE-CLUSTER-IP dst,dst -j RETURN                                                                                                                                           
-A KUBE-IPVS-FILTER -m set --match-set KUBE-EXTERNAL-IP dst,dst -j RETURN
-A KUBE-IPVS-FILTER -m conntrack --ctstate NEW -m set --match-set KUBE-IPVS-IPS dst -j REJECT --reject-with icmp-port-unreachable 
```
`KUBE-IPVS-IPS` seems to include external IPs (as also noted here: https://github.com/kubernetes/kubernetes/issues/117613 and here: https://github.com/k3s-io/k3s/issues/7183#issuecomment-1491205024) so the last rule above is dropping packets to external IPs that are not routed before reaching this point.
The next chain in iptables is `KUBE-NODE-PORT` and contains a single rule:
```
-A KUBE-NODE-PORT -m comment --comment "Kubernetes health check node port" -m set --match-set KUBE-HEALTH-CHECK-NODE-PORT dst -j ACCEPT
```
which seems specific to route packets arriving to health check ports

Workarounds to get health checks to work again from GCP are to either flush `KUBE-IPVS-IPS` ipset (temporary since kube-proxy will fight back) or move the ule to route packets to health check packets on top of `KUBE-IPVS-FILTER`:
```
sudo iptables -I KUBE-IPVS-FILTER 1 -m comment --comment "Kubernetes health check node port" -m set --match-set KUBE-HEALTH-CHECK-NODE-PORT dst -j ACCEPT
```

### What did you expect to happen?

Health checks from GCP should continue to work as intended after upgrading kube-proxy from 1.25.5 to 1.26.3

### How can we reproduce it (as minimally and precisely as possible)?

Use kube-proxy v1.26.3 in a Kubernetes cluster on GCP and create a Service of type `LoadBalancer`. Health checks from GCP should fail on all nodes

### Anything else we need to know?

Rolling back to v1.25.5 seems to fix the issue, even though we have to roll to fresh nodes to clean up everything and make health checks work again.

### Kubernetes version

<details>

```console
$ kubectl version
Server Version: version.Info{Major:"1", Minor:"26", GitVersion:"v1.26.3", GitCommit:"9e644106593f3f4aa98f8a84b23db5fa378900bd", GitTreeState:"clean", BuildDate:"2023-03-15T13:33:12Z", GoVersion:"go1.19.7", Compiler:"gc", Platform:"linux/amd64"}
```

</details>

### Cloud provider

<details>
GCP
</details>

### OS version

<details>

```console
# On Linux:
$ cat /etc/os-release
NAME="Flatcar Container Linux by Kinvolk"
ID=flatcar
ID_LIKE=coreos
VERSION=3374.2.3
VERSION_ID=3374.2.3
BUILD_ID=2023-01-20-1751
SYSEXT_LEVEL=1.0
PRETTY_NAME="Flatcar Container Linux by Kinvolk 3374.2.3 (Oklo)"
ANSI_COLOR="38;5;75"
HOME_URL="https://flatcar.org/"
BUG_REPORT_URL="https://issues.flatcar.org"
FLATCAR_BOARD="amd64-usr"
CPE_NAME="cpe:2.3:o:flatcar-linux:flatcar_linux:3374.2.3:*:*:*:*:*:*:*"
$ uname -a
Linux worker-k8s-psvr.c.uw-dev.internal 5.15.86-flatcar #1 SMP Fri Jan 20 17:26:55 -00 2023 x86_64 Intel(R) Xeon(R) CPU @ 2.20GHz GenuineIntel GNU/Linux
```

</details>

### Container runtime (CRI) and version (if applicable)

<details>
containerd://1.6.8
</details>

### Related plugins (CNI, CSI, ...) and versions (if applicable)

<details>

</details>

**Comment by uablrek** [comment]
I can't recreate this problem on K8s v1.26.4. I use a simple service:
```yaml
apiVersion: v1
kind: Service
metadata:
  name: kahttp-23
spec:
  ipFamilyPolicy: PreferDualStack
  externalTrafficPolicy: Local
  selector:
    app: kahttp-23
  ports:
  - port: 80
    name: http
  - port: 443
    name: https
  type: LoadBalancer
```
And get:
```
> kubectl get svc kahttp-23 -o json | jq .spec.healthCheckNodePort
30873
> wget -q -O - http://192.168.1.2:30873
{
        "service": {
                "namespace": "default",
                "name": "kahttp-23"
        },
        "localEndpoints": 1
> wget -q -O - http://192.168.1.4:30873
wget: server returned error: HTTP/1.1 503 Service Unavailable
```
@ffilippopoulos Is this happening _in combination with_ https://github.com/kubernetes/kubernetes/issues/117613?

I.e. are you using a node-ip as loadBalancerIP?

**Comment by nberlee** [comment]
Hi @uablrek,

I have the same problem.
A packet capture reveals, in GCP the healthcheck is directed to nodes with the LB IP as destination ip.

So in order to create this problem either create a static arp entry for the loadBalancer IP, and wget http://loadBalancerIP:30873 or spinup a pod in the cluster and do a  http://loadBalancerIP:30873

**Comment by aojea** [comment]
Yeah, this is related to my comment here https://github.com/kubernetes/kubernetes/pull/115019#discussion_r1180516307 , the loadbalancer IP is added as a local route to the host

**Comment by uablrek** [comment]
@aojea @nberlee Thanks, I have treated them as separate issues. I will check again.

**Comment by ffilippopoulos** [comment]
@uablrek yes, as @nberlee pointed out, in order to reproduce this you need to make requests to the LB address. I can also curl kube-proxy on localhost fine, but gcp goes via the LB addresses to health check

**Comment by uablrek** [comment]
To use http://loadbalancerip:30873/ doesn't make sense to me unless you have a one-node cluster with loadbalancerip==nodeip. The probe is to check if an endpoint is present on _a particular node_, hence the loadbalancerip can't really be used. But the comment:

> we saw that all healthchecks from GCP started to fail and traffic is now blindly load balanced across all nodes

indicates that you have many nodes. I don't get it.

**Comment by nberlee** [comment]
It appears that GCE ILBs rely on Direct Server Return (DSR) as their load balancing mechanism. DSR only modifies the destination MAC address and is utilized during health checks across all VMs within the associated instance groups. This is likely due to K8S being just one of many use cases, and health checks may be conducted on the same port as the load-balanced service. In such cases, the destination IP serves as the distinguishing factor.

**Comment by ffilippopoulos** [comment]
@uablrek yes, I have many nodes on my clusters. Catching health check traffic on a node for the following service as an example:
```
 $ kubectl --context exp-1-gcp --namespace sys-ingress-pub get svc external-ingress-controller-v2 
NAME                             TYPE           CLUSTER-IP    EXTERNAL-IP    PORT(S)                      AGE
external-ingress-controller-v2   LoadBalancer   10.5.251.75   34.89.29.111   80:31709/TCP,443:30930/TCP   3y105d
```
gives:
```
core@worker-k8s-exp-1-2x6s ~ $ sudo tcpdump -i any -v -n net 34.89.29.111 and port 10256                                                                                                                           
tcpdump: data link type LINUX_SLL2                                                                                                                                                                                 
dropped privs to pcap                                                                                                                                                                                              
tcpdump: listening on any, link-type LINUX_SLL2 (Linux cooked v2), snapshot length 262144 bytes                                                                                                                    
08:07:24.577003 eth0  In  IP (tos 0x80, ttl 127, id 61463, offset 0, flags [DF], proto TCP (6), length 60)
    169.254.169.254.35818 > 34.89.29.111.10256: Flags [S], cksum 0xf7a4 (correct), seq 3034275463, win 65535, options [mss 1412,sackOK,TS val 1315415808 ecr 0,nop,wscale 8], length 0
08:07:24.578481 eth0  In  IP (tos 0x80, ttl 127, id 13292, offset 0, flags [DF], proto TCP (6), length 60)
    169.254.169.254.35819 > 34.89.29.111.10256: Flags [S], cksum 0x43cd (correct), seq 2042564372, win 65535, options [mss 1412,sackOK,TS val 1870447697 ecr 0,nop,wscale 8], length 0
08:07:24.637862 eth0  In  IP (tos 0x80, ttl 127, id 59383, offset 0, flags [DF], proto TCP (6), length 60)
    169.254.169.254.35820 > 34.89.29.111.10256: Flags [S], cksum 0x1eb3 (correct), seq 980255943, win 65535, options [mss 1412,sackOK,TS val 254612313 ecr 0,nop,wscale 8], length 0 
08:07:32.576592 eth0  In  IP (tos 0x80, ttl 127, id 15667, offset 0, flags [DF], proto TCP (6), length 60)
    169.254.169.254.35821 > 34.89.29.111.10256: Flags [S], cksum 0xc184 (correct), seq 3958390351, win 65535, options [mss 1412,sackOK,TS val 1315423808 ecr 0,nop,wscale 8], length 0
08:07:32.578767 eth0  In  IP (tos 0x80, ttl 127, id 4499, offset 0, flags [DF], proto TCP (6), length 60) 
    169.254.169.254.35822 > 34.89.29.111.10256: Flags [S], cksum 0x119b (correct), seq 2194872559, win 65535, options [mss 1412,sackOK,TS val 1870455697 ecr 0,nop,wscale 8], length 0
08:07:32.638349 eth0  In  IP (tos 0x80, ttl 127, id 32897, offset 0, flags [DF], proto TCP (6), length 60)
    169.254.169.254.35823 > 34.89.29.111.10256: Flags [S], cksum 0xdde5 (correct), seq 246796808, win 65535, options [mss 1412,sackOK,TS val 254620314 ecr 0,nop,wscale 8], length 0
08:07:40.576666 eth0  In  IP (tos 0x80, ttl 127, id 28266, offset 0, flags [DF], proto TCP (6), length 60)
    169.254.169.254.35824 > 34.89.29.111.10256: Flags [S], cksum 0xece8 (correct), seq 1521321195, win 65535, options [mss 1412,sackOK,TS val 1315431808 ecr 0,nop,wscale 8], length 0
08:07:40.578644 eth0  In  IP (tos 0x80, ttl 127, id 38177, offset 0, flags [DF], proto TCP (6), length 60)
    169.254.169.254.35825 > 34.89.29.111.10256: Flags [S], cksum 0xe7b5 (correct), seq 3475887926, win 65535, options [mss 1412,sackOK,TS val 1870463697 ecr 0,nop,wscale 8], length 0
08:07:40.638713 eth0  In  IP (tos 0x80, ttl 127, id 24860, offset 0, flags [DF], proto TCP (6), length 60)
    169.254.169.254.35826 > 34.89.29.111.10256: Flags [S], cksum 0xeb57 (correct), seq 755468033, win 65535, options [mss 1412,sackOK,TS val 254628314 ecr 0,nop,wscale 8], length 0
```
The controller configures a health check with 8 seconds interval on port 10256, which is also visible from the packets arriving on the node. I am not 100% on how GCP routes for those health checks but feels like @nberlee comment above is spot on.

**Comment by uablrek** [comment]
So to summarise;
GCP sends probes to "loadbalancerip:health-check-port" in intervals and explicitly set the mac address to target different nodes.

Not the cleanest solution imho, and very hard to imagine beforehand.

Here is what I suggest, add a rule before the reject in KUBE-IPVS-IPS:
```
-A KUBE-IPVS-FILTER -m set --match-set KUBE-LOAD-BALANCER dst,dst -j RETURN
-A KUBE-IPVS-FILTER -m set --match-set KUBE-CLUSTER-IP dst,dst -j RETURN                                                                                                                                           
-A KUBE-IPVS-FILTER -m set --match-set KUBE-EXTERNAL-IP dst,dst -j RETURN
-A KUBE-IPVS-FILTER -m set --match-set KUBE-HEALTH-CHECK-NODE-PORT dst -j RETURN
-A KUBE-IPVS-FILTER -m conntrack --ctstate NEW -m set --match-set KUBE-IPVS-IPS dst -j REJECT --reject-with icmp-port-unreachable 
```

**Comment by ffilippopoulos** [comment]
yes, this is a workaround that seems to do the trick (I also mention that one in the issue description). Currently, kube-proxy already adds such a rule, but this happens in `KUBE-NODE-PORT` chain which is evaluated after `KUBE-IPVS-FILTER`. I think it is a matter of ordering rules

**Comment by uablrek** [comment]
@nberlee Many thanks for your explanations

**Comment by uablrek** [comment]
> This is likely due to K8S being just one of many use cases, and health checks may be conducted on the same port as the load-balanced service.

@nberlee Would it be possible to configure GCP to use the same port as the load-balanced service also for K8s? I.e. don't use the healthCheckPort at all.

**Comment by aojea** [comment]
> @nberlee Would it be possible to configure GCP to use the same port as the load-balanced service also for K8s? I.e. don't use the healthCheckPort at all.

this is more complex since is how cloud-providers loadbalancers implemented it, using externalTraficPolicy: local, the health check is on the `HealthCheckNodePort`, for externalTraficPolicy: cluster, some cloud-providers use the applications port and others use the kube-proxy healtcheck, that it runs on any of the node ips

**Comment by uablrek** [comment]
Imo key things are:
> We are running self managed Kubernetes clusters on GCP

and:
> This is likely due to K8S being just one of many use cases, 

So from GCP perspective they are not aware of what's running on the cluster. K8s or something else. So the probing for available servers are generic, "K8S being just one of many use cases". In that case I assumed that the cluster admin may configure how probing is done. But I don't know GCP so it may not be so, but...

On the other hand if GCP is aware that this is actually a K8s system, the "K8S being just one of many use cases" doesn't hold and GCP should probe the node-ip's instead of using some MAC-hack.
