### ISSUE TITLE
Expose IP camera as service in edge node

### ISSUE THREAD

**Issue by lwmqwer** [kubernetes/kubernetes#90928]
kubenete 1.17.3

With one master and three workers
Two wokers are edge node which is just an arm64 router which has one wan port and 8 lan port.
Master(x86)
Worker1(Arm64)
eth0 192.168.100.59
br0 192.168.188.1
lan0-lan8 Ethernet ports with PoE function.
lan3 attach a IP camera with IP 192.168.188.232.

Deploy a service like this
apiVersion: v1
kind: Endpoints
metadata:
  name: camerahttp-service
subsets:
  - addresses:
      - ip: 192.168.188.192
    ports:
      - port: 80
---

apiVersion: v1
kind: Service
metadata:
  name: camerahttp-service
spec:
  type: NodePort
  ports:
    - protocol: TCP
      port: 80

Access this camera is fine in this node. But can not access it neither from outside cluster or other node.
ipvsadm -ln
TCP  192.168.100.59:32248 rr
  -> 192.168.188.192:80           Masq    1      0          0 

I capture the packet on this node which access the camera service from 192.168.100.70.

I found the TCP SYNC packet is received and SNAT and DNAT to this camera.
But the camera SYNC ACK reply packet fail do SNAT, it source still the 192.168.188.232 and this packet will be dropped.

**17:15:32.475142 IP 192.168.188.1.30648 > 192.168.188.192.80: Flags [S], seq 846827128, win 64240, options [mss 1460,sackOK,TS val 3670308438 ecr 0,nop,wscale 7], length 0**
**17:15:32.475538 IP 192.168.188.192.80 > 192.168.100.70.36572: Flags [S.], seq 1333741944, ack 846827129, win 14480, options [mss 1460,sackOK,TS val 17633307 ecr 3670308438,nop,wscale 1], length 0**
17:15:33.517416 IP 192.168.188.1.30648 > 192.168.188.192.80: Flags [S], seq 846827128, win 64240, options [mss 1460,sackOK,TS val 3670309479 ecr 0,nop,wscale 7], length 0
17:15:33.518067 IP 192.168.188.192.80 > 192.168.100.70.36572: Flags [S.], seq 1333741944, ack 846827129, win 14480, options [mss 1460,sackOK,TS val 17633412 ecr 3670308438,nop,wscale 1], length 0
17:15:35.481459 IP 192.168.188.192.80 > 192.168.100.70.36572: Flags [S.], seq 1333741944, ack 846827129, win 14480, options [mss 1460,sackOK,TS val 17633608 ecr 3670308438,nop,wscale 1], length 0
17:15:41.481428 IP 192.168.188.192.80 > 192.168.100.70.36572: Flags [S.], seq 1333741944, ack 846827129, win 14480, options [mss 1460,sackOK,TS val 17634208 ecr 3670308438,nop,wscale 1], length 0

**Comment by athenabot** [comment]
/triage unresolved

Comment `/remove-triage unresolved` when the issue is assessed and confirmed.

🤖 I am a bot run by vllry. 👩‍🔬

**Comment by khenidak** [comment]
Thanks for reporting @lwmqwer

This scenario works only if `client=>target-IP(Camera IP)` is routable. Does your Camera IP reachable from wherever your client (maybe on a different edge node). Can you please check if you can get to your camera from a different node?

**Comment by lwmqwer** [comment]
Thanks @khenidak for reply.
The client cannot directly reach this camera as the camera is behind this edge node, which will do the NAT for camera.
If test it without k8s and add ipvs rule like this  
ipvsadm -ln
TCP 192.168.100.59:32248 rr
-> 192.168.188.192:80 Masq 1 0 0
this is working fine for 192.168.100.* client to reach this camera.

I think there some rules which write by k8s hinder the packet forwarding.

**Comment by khenidak** [comment]
Yes. You are correct. One way around this is to have a pod that can forward traffic to your camera (basically each camera will have it is pod). Then you can connect to your camera via the pod.

if there is nothing, can i ask you to close this issue. It seems like it is working as intended.

**Comment by lwmqwer** [comment]
@khenidak Thanks for your reply, and I close this issue now. Currently, I add a nginx as l4 proxy, but I think it is too heavy in the  edge side as this can be done just by one rule.  Would you give me some advices about the pod your mention? Will a debian-base  with some ipvs rules could competent this job?

**Comment by khenidak** [comment]
The problem is two parts really. when you want to surface something as a service it needs to be accessible to the caller. podIPs are routable inside a cluster, but not an external IP such as camera IP (only routable from edge node). So you do need to run something (pod) with IP routable from caller. the pod can be something as simple as it writes iptables/ipvs rules to forward traffic to camera.

**Comment by lwmqwer** [comment]
khenidak, Thanks very much for your patience to answer my question.
