### ISSUE TITLE
"Connection reset by peer" appears when accessing services, but normal when accessing pod

### ISSUE THREAD

**Issue by chenlein** [kubernetes/kubernetes#112441]
### What happened?

I have a pod that serves file downloads and is using curl for testing. When testing through the cluster IP, "Connection Reset by Peer" always appears in a few minutes, and the download rate is quickly reduced to 0. However, everything is ok when using pod ip.
The above operations are all performed on the nodes where pod is located. And this situation only appears on a specific cluster.

### What did you expect to happen?

Service IP can provide services normally

### How can we reproduce it (as minimally and precisely as possible)?

This case only appears on a specific cluster.

### Anything else we need to know?

```shell
 ~]# kubectl get cm -n kube-system kube-proxy -o yaml | grep mode
    mode: ipvs

 ~]# kubectl get svc -n jhyt-system dmga-dg-fat-web
NAME              TYPE       CLUSTER-IP     EXTERNAL-IP   PORT(S)                          AGE
dmga-dg-fat-web   NodePort   11.98.73.222   <none>        8080:31525/TCP,31998:32018/TCP   34d

 ~]# kubectl describe svc -n jhyt-system dmga-dg-fat-web
Name:                     dmga-dg-fat-web
Namespace:                jhyt-system
Labels:                   app=dmga-dg-fat-web
                          operator.dameng.com/canvas=dmga-dg-fat-web
Annotations:              <none>
Selector:                 operator.dameng.com/canvas=dmga-dg-fat-web,operator.dameng.com/service=deployment-1650167271463-deployment-l22qzjmj
Type:                     NodePort
IP Family Policy:         SingleStack
IP Families:              IPv4
IP:                       11.98.73.222
IPs:                      11.98.73.222
Port:                     0xc002a6cd50-l22qzmim  8080/TCP
TargetPort:               8080/TCP
NodePort:                 0xc002a6cd50-l22qzmim  31525/TCP
Endpoints:                11.233.201.36:8080
Port:                     tcp-l6lmargd  31998/TCP
TargetPort:               31998/TCP
NodePort:                 tcp-l6lmargd  32018/TCP
Endpoints:                11.233.201.36:31998
Session Affinity:         None
External Traffic Policy:  Cluster
Events:                   <none>

 ~]# sysctl -a | grep keepalive
sysctl: reading key "net.ipv6.conf.all.stable_secret"
net.ipv4.tcp_keepalive_intvl = 75
net.ipv4.tcp_keepalive_probes = 9
net.ipv4.tcp_keepalive_time = 300

 ~]# ipvsadm -l --timeout
Timeout (tcp tcpfin udp): 900 120 300

 ~]# ipvsadm -Ln -t 11.98.73.222:8080
Prot LocalAddress:Port Scheduler Flags
  -> RemoteAddress:Port           Forward Weight ActiveConn InActConn
TCP  11.98.73.222:8080 rr
  -> 11.233.201.36:8080           Masq    1      0          0
```

tcpdump record when accessing cluster ip:
- download command
```shell
 ~]# curl -L -i --trace - --trace-time -H "Connection: close" -v http://11.98.73.222:8080/userportal/contactformYt/manage/download/b5fd12ff02b9e559b2be372598ee3b28 -o b5fd12ff02b9e559b2be372598ee3b28
Warning: -v, --verbose overrides an earlier trace/verbose option
14:52:31.557217 * About to connect() to 11.98.73.222 port 8080 (#0)
14:52:31.557964 *   Trying 11.98.73.222...
  % Total    % Received % Xferd  Average Speed   Time    Time     Time  Current
                                 Dload  Upload   Total   Spent    Left  Speed
  0     0    0     0    0     0      0      0 --:--:-- --:--:-- --:--:--     014:52:31.558480 * Connected to 11.98.73.222 (11.98.73.222) port 8080 (#0)
14:52:31.558561 > GET /userportal/contactformYt/manage/download/b5fd12ff02b9e559b2be372598ee3b28 HTTP/1.1
14:52:31.558561 > User-Agent: curl/7.29.0
14:52:31.558561 > Host: 11.98.73.222:8080
14:52:31.558561 > Accept: */*
14:52:31.558561 > Connection: close
14:52:31.558561 >
14:52:31.598092 < HTTP/1.1 200
14:52:31.627827 < content-disposition: attachment;fileName=2160_2014%E5%B9%B412%E6%9C%88%EF%BC%88%E7%84%A6%E7%9F%B3%E5%9D%9D%EF%BC%8904%EF%BC%885.83G%EF%BC%89_%E7%84%A6%E9%A1%B556-6HF_%E6%BA%90%E7%94%B5%E5%AD%90%E6%96%87%E4%BB%B6_%23%E7%84%A6%E9%A1%B556-6HF%E5%81%B6%E6%9E%81%28%E5%AE%8C%E4%BA%95%E6%AE%B5%29_%E7%84%A6%E9%A1%B556-6HF%E5%81%B6%E6%9E%81%28%E5%AE%8C%E4%BA%95%29.rar
14:52:31.627888 < Transfer-Encoding: chunked
14:52:31.627911 < Date: Wed, 14 Sep 2022 06:52:31 GMT
14:52:31.627935 < Connection: close
14:52:31.627957 <
14:52:31.627980 { [data not shown]
100  307M    0  307M    0     0  4920k      0 --:--:--  0:01:03 --:--:--     014:53:36.480776 * Recv failure: Connection reset by peer
100  307M    0  307M    0     0  4849k      0 --:--:--  0:01:04 --:--:--     0
14:53:36.481095 * Closing connection 0
curl: (56) Recv failure: Connection reset by peer
```
- tcpdump command for cluster ip
``` shell
 ~]# tcpdump -i any host 11.98.73.222 and port 8080 -vv
tcpdump: listening on any, link-type LINUX_SLL (Linux cooked), capture size 262144 bytes
13:59:29.857054 IP (tos 0x0, ttl 64, id 48714, offset 0, flags [DF], proto TCP (6), length 52)
    jhdmw02.40810 > 11.98.73.222.webcache: Flags [.], cksum 0x74e6 (incorrect -> 0xeeb2), seq 3688077821, ack 3778759142, win 24576, options [nop,nop,TS val 2474117992 ecr 2474057988], length 0
13:59:29.857093 IP (tos 0x0, ttl 64, id 24404, offset 0, flags [DF], proto TCP (6), length 40)
    11.98.73.222.webcache > 11.98.73.222.49920: Flags [R], cksum 0xf7ad (correct), seq 3778759142, win 0, length 0
^C
2 packets captured
105 packets received by filter
61 packets dropped by kernel
```
- tcpdump command for pod ip
```shell
 ~]# tcpdump -i any host 11.233.201.36 and port 8080 -vv &> tcpdump.out
 ~]# more tcpdump.out
tcpdump: listening on any, link-type LINUX_SLL (Linux cooked), capture size 262144 bytes
14:52:31.612925 IP (tos 0x0, ttl 64, id 64057, offset 0, flags [DF], proto TCP (6), length 60)
    jhdmw02.63155 > 11.233.201.36.webcache: Flags [S], cksum 0xf4bb (incorrect -> 0xd799), seq 676883806, win 43690, options [mss 65495,sackOK,TS val 2477299559 ecr 0,nop,wscale 7], length 0
14:52:31.612952 IP (tos 0x0, ttl 64, id 0, offset 0, flags [DF], proto TCP (6), length 60)
    11.233.201.36.webcache > jhdmw02.63155: Flags [S.], cksum 0xf4bb (incorrect -> 0xa243), seq 2376315363, ack 676883807, win 28560, options [mss 1440,sackOK,TS val 2477299559 ecr 2477299559,nop,wscale 7],
length 0
14:52:31.612974 IP (tos 0x0, ttl 64, id 64058, offset 0, flags [DF], proto TCP (6), length 52)
    jhdmw02.63155 > 11.233.201.36.webcache: Flags [.], cksum 0xf4b3 (incorrect -> 0x3f36), seq 1, ack 1, win 342, options [nop,nop,TS val 2477299559 ecr 2477299559], length 0
14:52:31.613307 IP (tos 0x0, ttl 64, id 64059, offset 0, flags [DF], proto TCP (6), length 225)
    jhdmw02.63155 > 11.233.201.36.webcache: Flags [P.], cksum 0xf560 (incorrect -> 0xa8a1), seq 1:174, ack 1, win 342, options [nop,nop,TS val 2477299559 ecr 2477299559], length 173: HTTP, length: 173
        GET /userportal/contactformYt/manage/download/b5fd12ff02b9e559b2be372598ee3b28 HTTP/1.1
        User-Agent: curl/7.29.0
        Host: 11.98.73.222:8080
        Accept: */*
        Connection: close

14:52:31.613317 IP (tos 0x0, ttl 64, id 9859, offset 0, flags [DF], proto TCP (6), length 52)
    11.233.201.36.webcache > jhdmw02.63155: Flags [.], cksum 0xf4b3 (incorrect -> 0x3ef7), seq 1, ack 174, win 232, options [nop,nop,TS val 2477299559 ecr 2477299559], length 0
14:52:31.652752 IP (tos 0x0, ttl 64, id 9860, offset 0, flags [DF], proto TCP (6), length 7192)
    11.233.201.36.webcache > jhdmw02.63155: Flags [.], cksum 0x1098 (incorrect -> 0xa2e9), seq 1:7141, ack 174, win 232, options [nop,nop,TS val 2477299598 ecr 2477299559], length 7140: HTTP, length: 7140
        HTTP/1.1 200
        content-disposition: attachment;fileName=2160_2014%E5%B9%B412%E6%9C%88%EF%BC%88%E7%84%A6%E7%9F%B3%E5%9D%9D%EF%BC%8904%EF%BC%885.83G%EF%BC%89_%E7%84%A6%E9%A1%B556-6HF_%E6%BA%90%E7%94%B5%E5%AD%90%E6%96
%87%E4%BB%B6_%23%E7%84%A6%E9%A1%B556-6HF%E5%81%B6%E6%9E%81%28%E5%AE%8C%E4%BA%95%E6%AE%B5%29_%E7%84%A6%E9%A1%B556-6HF%E5%81%B6%E6%9E%81%28%E5%AE%8C%E4%BA%95%29.rar
        Transfer-Encoding: chunked
        Date: Wed, 14 Sep 2022 06:52:31 GMT
        Connection: close

        2000
14:52:31.652793 IP (tos 0x0, ttl 64, id 64060, offset 0, flags [DF], proto TCP (6), length 52)
    jhdmw02.63155 > 11.233.201.36.webcache: Flags [.], cksum 0xf4b3 (incorrect -> 0x1e57), seq 174, ack 7141, win 1365, options [nop,nop,TS val 2477299599 ecr 2477299598], length 0
14:52:31.652804 IP (tos 0x0, ttl 64, id 9865, offset 0, flags [DF], proto TCP (6), length 1104)
    11.233.201.36.webcache > jhdmw02.63155: Flags [P.], cksum 0xf8cf (incorrect -> 0x1880), seq 7141:8193, ack 174, win 232, options [nop,nop,TS val 2477299599 ecr 2477299559], length 1052: HTTP
14:52:31.652829 IP (tos 0x0, ttl 64, id 64061, offset 0, flags [DF], proto TCP (6), length 52)
    jhdmw02.63155 > 11.233.201.36.webcache: Flags [.], cksum 0xf4b3 (incorrect -> 0x1a24), seq 174, ack 8193, win 1387, options [nop,nop,TS val 2477299599 ecr 2477299599], length 0
14:52:31.653265 IP (tos 0x0, ttl 64, id 9866, offset 0, flags [DF], proto TCP (6), length 8244)
    11.233.201.36.webcache > jhdmw02.63155: Flags [P.], cksum 0x14b4 (incorrect -> 0xe1e1), seq 8193:16385, ack 174, win 232, options [nop,nop,TS val 2477299599 ecr 2477299599], length 8192: HTTP
14:52:31.653284 IP (tos 0x0, ttl 64, id 64062, offset 0, flags [DF], proto TCP (6), length 52)
    jhdmw02.63155 > 11.233.201.36.webcache: Flags [.], cksum 0xf4b3 (incorrect -> 0xf624), seq 174, ack 16385, win 2410, options [nop,nop,TS val 2477299599 ecr 2477299599], length 0
14:52:31.653317 IP (tos 0x0, ttl 64, id 9872, offset 0, flags [DF], proto TCP (6), length 8244)
    11.233.201.36.webcache > jhdmw02.63155: Flags [P.], cksum 0x14b4 (incorrect -> 0xbc07), seq 16385:24577, ack 174, win 232, options [nop,nop,TS val 2477299599 ecr 2477299599], length 8192: HTTP
14:52:31.653332 IP (tos 0x0, ttl 64, id 64063, offset 0, flags [DF], proto TCP (6), length 52)
    jhdmw02.63155 > 11.233.201.36.webcache: Flags [.], cksum 0xf4b3 (incorrect -> 0xd224), seq 174, ack 24577, win 3434, options [nop,nop,TS val 2477299599 ecr 2477299599], length 0
14:52:31.653353 IP (tos 0x0, ttl 64, id 9878, offset 0, flags [DF], proto TCP (6), length 8244)
    11.233.201.36.webcache > jhdmw02.63155: Flags [P.], cksum 0x14b4 (incorrect -> 0x6b96), seq 24577:32769, ack 174, win 232, options [nop,nop,TS val 2477299599 ecr 2477299599], length 8192: HTTP
14:52:31.653364 IP (tos 0x0, ttl 64, id 64064, offset 0, flags [DF], proto TCP (6), length 52)
    jhdmw02.63155 > 11.233.201.36.webcache: Flags [.], cksum 0xf4b3 (incorrect -> 0xb15b), seq 174, ack 32769, win 3635, options [nop,nop,TS val 2477299599 ecr 2477299599], length 0
14:52:31.653664 IP (tos 0x0, ttl 64, id 9884, offset 0, flags [DF], proto TCP (6), length 8244)
    11.233.201.36.webcache > jhdmw02.63155: Flags [P.], cksum 0x14b4 (incorrect -> 0x04ad), seq 32769:40961, ack 174, win 232, options [nop,nop,TS val 2477299599 ecr 2477299599], length 8192: HTTP
14:52:31.653684 IP (tos 0x0, ttl 64, id 64065, offset 0, flags [DF], proto TCP (6), length 52)
    jhdmw02.63155 > 11.233.201.36.webcache: Flags [.], cksum 0xf4b3 (incorrect -> 0x915b), seq 174, ack 40961, win 3635, options [nop,nop,TS val 2477299599 ecr 2477299599], length 0
                               。
                               。
                               。
                               。
                               。
                               。
                               。
14:52:36.530588 IP (tos 0x0, ttl 64, id 49417, offset 0, flags [DF], proto TCP (6), length 8244)
    11.233.201.36.webcache > jhdmw02.63155: Flags [P.], cksum 0x14b4 (incorrect -> 0x99a4), seq 322527233:322535425, ack 174, win 232, options [nop,nop,TS val 2477304476 ecr 2477304476], length 8192: HTTP
14:52:36.530599 IP (tos 0x0, ttl 64, id 36280, offset 0, flags [DF], proto TCP (6), length 52)
    jhdmw02.63155 > 11.233.201.36.webcache: Flags [.], cksum 0xf4b3 (incorrect -> 0x265e), seq 174, ack 322535425, win 24541, options [nop,nop,TS val 2477304476 ecr 2477304476], length 0
14:52:36.530616 IP (tos 0x0, ttl 64, id 49423, offset 0, flags [DF], proto TCP (6), length 8244)
    11.233.201.36.webcache > jhdmw02.63155: Flags [P.], cksum 0x14b4 (incorrect -> 0xd70d), seq 322535425:322543617, ack 174, win 232, options [nop,nop,TS val 2477304476 ecr 2477304476], length 8192: HTTP
14:52:36.530627 IP (tos 0x0, ttl 64, id 36281, offset 0, flags [DF], proto TCP (6), length 52)
    jhdmw02.63155 > 11.233.201.36.webcache: Flags [.], cksum 0xf4b3 (incorrect -> 0x065e), seq 174, ack 322543617, win 24541, options [nop,nop,TS val 2477304476 ecr 2477304476], length 0
14:52:36.530645 IP (tos 0x0, ttl 64, id 49429, offset 0, flags [DF], proto TCP (6), length 8244)
    11.233.201.36.webcache > jhdmw02.63155: Flags [P.], cksum 0x14b4 (incorrect -> 0x57f8), seq 322543617:322551809, ack 174, win 232, options [nop,nop,TS val 2477304476 ecr 2477304476], length 8192: HTTP
14:52:36.530656 IP (tos 0x0, ttl 64, id 36282, offset 0, flags [DF], proto TCP (6), length 52)
    jhdmw02.63155 > 11.233.201.36.webcache: Flags [.], cksum 0xf4b3 (incorrect -> 0xe65d), seq 174, ack 322551809, win 24541, options [nop,nop,TS val 2477304476 ecr 2477304476], length 0
14:52:36.530673 IP (tos 0x0, ttl 64, id 49435, offset 0, flags [DF], proto TCP (6), length 8244)
    11.233.201.36.webcache > jhdmw02.63155: Flags [P.], cksum 0x14b4 (incorrect -> 0x9cab), seq 322551809:322560001, ack 174, win 232, options [nop,nop,TS val 2477304476 ecr 2477304476], length 8192: HTTP
14:52:36.530684 IP (tos 0x0, ttl 64, id 36283, offset 0, flags [DF], proto TCP (6), length 52)
    jhdmw02.63155 > 11.233.201.36.webcache: Flags [.], cksum 0xf4b3 (incorrect -> 0xc65d), seq 174, ack 322560001, win 24541, options [nop,nop,TS val 2477304476 ecr 2477304476], length 0
14:52:36.530702 IP (tos 0x0, ttl 64, id 49441, offset 0, flags [DF], proto TCP (6), length 8244)
    11.233.201.36.webcache > jhdmw02.63155: Flags [P.], cksum 0x14b4 (incorrect -> 0x781e), seq 322560001:322568193, ack 174, win 232, options [nop,nop,TS val 2477304476 ecr 2477304476], length 8192: HTTP
14:52:36.530713 IP (tos 0x0, ttl 64, id 36284, offset 0, flags [DF], proto TCP (6), length 52)
    jhdmw02.63155 > 11.233.201.36.webcache: Flags [.], cksum 0xf4b3 (incorrect -> 0xa65d), seq 174, ack 322568193, win 24541, options [nop,nop,TS val 2477304476 ecr 2477304476], length 0
14:52:36.530874 IP (tos 0x0, ttl 64, id 49447, offset 0, flags [DF], proto TCP (6), length 8244)
    11.233.201.36.webcache > jhdmw02.63155: Flags [P.], cksum 0x14b4 (incorrect -> 0xec41), seq 322568193:322576385, ack 174, win 232, options [nop,nop,TS val 2477304477 ecr 2477304476], length 8192: HTTP
14:52:36.530907 IP (tos 0x0, ttl 64, id 49453, offset 0, flags [DF], proto TCP (6), length 8244)
    11.233.201.36.webcache > jhdmw02.63155: Flags [P.], cksum 0x14b4 (incorrect -> 0x9a01), seq 322576385:322584577, ack 174, win 232, options [nop,nop,TS val 2477304477 ecr 2477304476], length 8192: HTTP
14:52:36.530930 IP (tos 0x0, ttl 64, id 49459, offset 0, flags [DF], proto TCP (6), length 8244)
    11.233.201.36.webcache > jhdmw02.63155: Flags [P.], cksum 0x14b4 (incorrect -> 0x4fc8), seq 322584577:322592769, ack 174, win 232, options [nop,nop,TS val 2477304477 ecr 2477304476], length 8192: HTTP
14:52:36.530970 IP (tos 0x0, ttl 64, id 49465, offset 0, flags [DF], proto TCP (6), length 8244)
    11.233.201.36.webcache > jhdmw02.63155: Flags [P.], cksum 0x14b4 (incorrect -> 0xa491), seq 322592769:322600961, ack 174, win 232, options [nop,nop,TS val 2477304477 ecr 2477304476], length 8192: HTTP
14:52:36.530995 IP (tos 0x0, ttl 64, id 49471, offset 0, flags [DF], proto TCP (6), length 8244)
    11.233.201.36.webcache > jhdmw02.63155: Flags [P.], cksum 0x14b4 (incorrect -> 0x0fa8), seq 322600961:322609153, ack 174, win 232, options [nop,nop,TS val 2477304477 ecr 2477304476], length 8192: HTTP
14:52:36.531018 IP (tos 0x0, ttl 64, id 49477, offset 0, flags [DF], proto TCP (6), length 8244)
    11.233.201.36.webcache > jhdmw02.63155: Flags [P.], cksum 0x14b4 (incorrect -> 0x0f42), seq 322609153:322617345, ack 174, win 232, options [nop,nop,TS val 2477304477 ecr 2477304476], length 8192: HTTP
14:52:36.531058 IP (tos 0x0, ttl 64, id 49483, offset 0, flags [DF], proto TCP (6), length 8244)
    11.233.201.36.webcache > jhdmw02.63155: Flags [P.], cksum 0x14b4 (incorrect -> 0x701b), seq 322617345:322625537, ack 174, win 232, options [nop,nop,TS val 2477304477 ecr 2477304476], length 8192: HTTP
14:52:36.531081 IP (tos 0x0, ttl 64, id 49489, offset 0, flags [DF], proto TCP (6), length 8244)
    11.233.201.36.webcache > jhdmw02.63155: Flags [P.], cksum 0x14b4 (incorrect -> 0x73ea), seq 322625537:322633729, ack 174, win 232, options [nop,nop,TS val 2477304477 ecr 2477304476], length 8192: HTTP
14:52:36.531455 IP (tos 0x0, ttl 64, id 49495, offset 0, flags [DF], proto TCP (6), length 8244)
    11.233.201.36.webcache > jhdmw02.63155: Flags [P.], cksum 0x14b4 (incorrect -> 0x5b3f), seq 322633729:322641921, ack 174, win 232, options [nop,nop,TS val 2477304477 ecr 2477304476], length 8192: HTTP
14:52:36.531572 IP (tos 0x0, ttl 64, id 49501, offset 0, flags [DF], proto TCP (6), length 8244)
    11.233.201.36.webcache > jhdmw02.63155: Flags [P.], cksum 0x14b4 (incorrect -> 0x4ff1), seq 322641921:322650113, ack 174, win 232, options [nop,nop,TS val 2477304477 ecr 2477304476], length 8192: HTTP
14:52:36.531616 IP (tos 0x0, ttl 64, id 49507, offset 0, flags [DF], proto TCP (6), length 8244)
    11.233.201.36.webcache > jhdmw02.63155: Flags [P.], cksum 0x14b4 (incorrect -> 0xf39f), seq 322650113:322658305, ack 174, win 232, options [nop,nop,TS val 2477304477 ecr 2477304476], length 8192: HTTP
14:52:36.531640 IP (tos 0x0, ttl 64, id 49513, offset 0, flags [DF], proto TCP (6), length 8244)
    11.233.201.36.webcache > jhdmw02.63155: Flags [P.], cksum 0x14b4 (incorrect -> 0x7bbf), seq 322658305:322666497, ack 174, win 232, options [nop,nop,TS val 2477304477 ecr 2477304476], length 8192: HTTP
14:52:36.531664 IP (tos 0x0, ttl 64, id 49519, offset 0, flags [DF], proto TCP (6), length 8244)
    11.233.201.36.webcache > jhdmw02.63155: Flags [P.], cksum 0x14b4 (incorrect -> 0x9028), seq 322666497:322674689, ack 174, win 232, options [nop,nop,TS val 2477304477 ecr 2477304476], length 8192: HTTP
14:52:36.531687 IP (tos 0x0, ttl 64, id 49525, offset 0, flags [DF], proto TCP (6), length 8244)
    11.233.201.36.webcache > jhdmw02.63155: Flags [P.], cksum 0x14b4 (incorrect -> 0x3960), seq 322674689:322682881, ack 174, win 232, options [nop,nop,TS val 2477304477 ecr 2477304476], length 8192: HTTP
14:52:36.531755 IP (tos 0x0, ttl 64, id 49531, offset 0, flags [DF], proto TCP (6), length 8244)
    11.233.201.36.webcache > jhdmw02.63155: Flags [P.], cksum 0x14b4 (incorrect -> 0x53d2), seq 322682881:322691073, ack 174, win 232, options [nop,nop,TS val 2477304477 ecr 2477304476], length 8192: HTTP
14:52:36.531819 IP (tos 0x0, ttl 64, id 49537, offset 0, flags [DF], proto TCP (6), length 8244)
    11.233.201.36.webcache > jhdmw02.63155: Flags [P.], cksum 0x14b4 (incorrect -> 0xbde9), seq 322691073:322699265, ack 174, win 232, options [nop,nop,TS val 2477304478 ecr 2477304476], length 8192: HTTP
14:52:36.531853 IP (tos 0x0, ttl 64, id 44370, offset 0, flags [DF], proto TCP (6), length 40)
    jhdmw02.63155 > 11.233.201.36.webcache: Flags [R], cksum 0x0eab (correct), seq 676883980, win 0, length 0

76952 packets captured
76958 packets received by filter
0 packets dropped by kernel
```

### Kubernetes version

<details>

```console
$ kubectl version
 ~]# kubectl version
Client Version: version.Info{Major:"1", Minor:"22", GitVersion:"v1.22.7", GitCommit:"b56e432f2191419647a6a13b9f5867801850f969", GitTreeState:"clean", BuildDate:"2022-02-16T11:50:27Z", GoVersion:"go1.16.14", Compiler:"gc", Platform:"linux/amd64"}
Server Version: version.Info{Major:"1", Minor:"22", GitVersion:"v1.22.7", GitCommit:"b56e432f2191419647a6a13b9f5867801850f969", GitTreeState:"clean", BuildDate:"2022-02-16T11:43:55Z", GoVersion:"go1.16.14", Compiler:"gc", Platform:"linux/amd64"}
```

</details>

### Cloud provider

<details>
On-Premise
</details>

### OS version

<details>

```console
# On Linux:
$ cat /etc/os-release
NAME="Red Hat Enterprise Linux Server"
VERSION="7.9 (Maipo)"
ID="rhel"
ID_LIKE="fedora"
VARIANT="Server"
VARIANT_ID="server"
VERSION_ID="7.9"
PRETTY_NAME="Red Hat Enterprise Linux Server 7.9 (Maipo)"
ANSI_COLOR="0;31"
CPE_NAME="cpe:/o:redhat:enterprise_linux:7.9:GA:server"
HOME_URL="https://www.redhat.com/"
BUG_REPORT_URL="https://bugzilla.redhat.com/"

REDHAT_BUGZILLA_PRODUCT="Red Hat Enterprise Linux 7"
REDHAT_BUGZILLA_PRODUCT_VERSION=7.9
REDHAT_SUPPORT_PRODUCT="Red Hat Enterprise Linux"
REDHAT_SUPPORT_PRODUCT_VERSION="7.9"
$ uname -a
 ~]# uname -a
Linux jhdmm03 3.10.0-1160.el7.x86_64 #1 SMP Tue Aug 18 14:50:17 EDT 2020 x86_64 x86_64 x86_64 GNU/Linux
```

</details>

### Install tools

<details>
kubeadm
</details>

### Container runtime (CRI) and version (if applicable)

<details>
```console
 ~]# containerd --version
containerd containerd.io 1.6.4 212e8b6fa2f44b9c21b2798135fc6fb7c53efc16
```
</details>

### Related plugins (CNI, CSI, ...) and versions (if applicable)

```shell
 ~]# cat /etc/cni/net.d/10-calico.conflist
{
  "name": "k8s-pod-network",
  "cniVersion": "0.3.1",
  "plugins": [
    {
      "type": "calico",
      "log_level": "info",
      "log_file_path": "/var/log/calico/cni/cni.log",
      "datastore_type": "kubernetes",
      "nodename": "jhdmm03",
      "mtu": 0,
      "ipam": {
          "type": "calico-ipam"
      },
      "policy": {
          "type": "k8s"
      },
      "kubernetes": {
          "kubeconfig": "/etc/cni/net.d/calico-kubeconfig"
      }
    },
    {
      "type": "portmap",
      "snat": true,
      "capabilities": {"portMappings": true}
    },
    {
      "type": "bandwidth",
      "capabilities": {"bandwidth": true}
    }
  ]
}

 ~]# kubectl get pods -n kube-system calico-kube-controllers-685b65ddf9-j6k92 -o yaml | grep 'image:'
    image: docker.io/calico/kube-controllers:v3.23.1

 ~]# kubectl get pods -n kube-system calico-node-fvmzx -o yaml | grep 'image:'
    image: docker.io/calico/node:v3.23.1
    image: docker.io/calico/cni:v3.23.1
```

**Comment by aojea** [comment]
> kubectl get cm -n kube-system kube-proxy -o yaml | grep mode
    mode: ipvs

/area ipvs

**Comment by chenlein** [comment]
I found the crux: the service is created by an operator, and the operator's reconcile loop is constantly patching the service, even if the service has not changed. This causes the resourceVersion field of this service to keep changing. When I close the operator, everything is ok.
I'm not sure if any changes to the service will break the connection via ipvs, but, in my opinion, it should only affect ipvs when the service's spec changes.

**Comment by aojea** [comment]
> I'm not sure if any changes to the service will break the connection via ipvs, but, in my opinion, it should only affect ipvs when the service's spec changes

that should be the expected behavior 

https://github.com/kubernetes/kubernetes/blob/657776e52ba527d8ff04187be4e8743e62909c07/pkg/proxy/service.go#L314-L328

are you sure that is the only change? maybe adding endpoints too? what is the patch doing?

**Comment by chenlein** [comment]
@aojea Yes, I'm sure, the patch only does SSA and the crd doesn't change,the code of reconcile like this
```go
r.Patch(ctx, resource, client.Apply, &client.PatchOptions{FieldManager: FieldManager, Force: func(force bool) *bool { return &force }(true)})
```
 I have checked the yaml of service more than once. There are still many cases where only resourceVersion changes like this, maybe because there is no `WithEventFilter` in my Operator

**Comment by aojea** [comment]
what a mystery :thinking:
