### ISSUE TITLE
DNS Resolution not working from pods running on specific nodes

### ISSUE THREAD

**Issue by khatrig** [kubernetes/kubernetes#95365]
**What happened**:  I'm seeing an odd dns resolution issue. Node is not able to resolve any kubernetes services. The cluster has 100+ nodes, all of the nodes were setup using the same kubespray automation. OS setup is also completely the same on all the nodes. I checked kube-proxy, nodelocaldns, coredns, calico configuration but didn't find anything significant there. External DNS also does not work by default but If I specifically query 8.8.8.8 for google.com then it works.
What stands out is that all of the impacted nodes are **HP Proliant dl325 gen10 plus** model nodes. If I add any other vendor hardware, It works fine.  The Ethernet adapter used here is Marvell FastLinQ 41000 Series (Not sure if this could cause a problem)

**_Symptoms_:** nslookup to kubernetes internal service does not work from within the cluster pod containers running on the impacted nodes.
```
k exec -it dnsutils -- sh/ # nslookup kubernetes
;; connection timed out; no servers could be reached 
```

_Containers can ping the Kubernetes service IP directly._
```
ping 10.233.0.1
PING 10.233.0.1 (10.233.0.1): 56 data bytes 64 bytes from 10.233.0.1: seq=0 ttl=64 time=0.103 ms
```
The request packet does get to the destination internal dns server but no response is sent back.

Behavior from Impacted node: node-jm-04 (no response from the DNS server)
_########## Request_
```
/ # nslookup kubernetes 10.233.67.130 
;; connection timed out; no servers could be reached

``` 
_#########TCPDUMP on the destination coredns server host from pod IP_
```
root@node-k8ctl-02:~# tcpdump | grep 10.233.71.2 
tcpdump: verbose output suppressed, use -v or -vv for full protocol decode 
listening on enp5s0f0, link-type EN10MB (Ethernet), capture size 262144 bytes 
10:50:54.053673 IP node-jm-04 > node-k8ctl-02: IP 10.233.71.2 > 10.233.67.130: udp (ipip-proto-4) 10:50:59.053597 IP node-jm-04 > node-k8ctl-02: IP 10.233.71.2 > 10.233.67.130: udp (ipip-proto-4) 
10:51:04.053601 IP node-jm-04 > node-k8ctl-02: IP 10.233.71.2 > 10.233.67.130: udp (ipip-proto-4) 
9229 packets captured 
9321 packets received by filter 
0 packets dropped by kernel
```

**What you expected to happen**: 

_Normal behavior on the working node: node-jm-02_

_########## Request_
```
/ # nslookup kubernetes 10.233.67.130
Server: 10.233.67.130
Address: 10.233.67.130#53
Name: kubernetes.default.svc.cluster.local
Address: 10.233.0.1
```
 
_########## TCPDUMP on the destination coredns server host from pod IP_
```
root@node-k8ctl-02:~# tcpdump | grep 10.233.91.2
tcpdump: verbose output suppressed, use -v or -vv for full protocol decode 
listening on enp5s0f0, link-type EN10MB (Ethernet), capture size 262144 bytes
10:50:30.443534 IP node-jm-02.cluster.local > node-k8ctl-02: IP 10.233.91.2.36300 > 10.233.67.130.domain: 46737+ A? kubernetes.default.svc.cluster.local. (54) (ipip-proto-4) 
10:50:30.443959 IP node-k8ctl-02 > node-jm-02.cluster.local: IP 10.233.67.130.domain > 10.233.91.2.36300: 46737*- 1/0/0 A 10.233.0.1 (106) (ipip-proto-4) 
10:50:30.444505 IP node-jm-02.cluster.local > node-k8ctl-02: IP 10.233.91.2.51511 > 10.233.67.130.domain: 58899+ AAAA? kubernetes.default.svc.cluster.local. (54) (ipip-proto-4) 
10:50:30.444866 IP node-k8ctl-02 > node-jm-02.cluster.local: IP 10.233.67.130.domain > 10.233.91.2.51511: 58899*- 0/1/0 (147) (ipip-proto-4) 
5466 packets captured 
5583 packets received by filter 
0 packets dropped by kernel
```

**How to reproduce it (as minimally and precisely as possible)**: Issue is visible only on HP Proliant dl325 gen10 plus model nodes. Adding the such nodes and doing a simple DNS lookup to kubernetes.default from the pod running on impacted node does not work.
```
/ # nslookup kubernetes 10.233.67.130 
;; connection timed out; no servers could be reached

``` 

**Anything else we need to know?**:

**Environment**: 
- Kubernetes version (use `kubectl version`): 1.16.3
- Cloud provider or hardware configuration:
- OS (e.g: `cat /etc/os-release`):  Ubuntu 18.04.3 LTS / Ubuntu 18.04.4 LTS / CentOS Linux release 7.7.1908 (Core)
- Kernel (e.g. `uname -a`): Tried multiple kernel versions on ubuntu - 4.15.0-72-generic, 4.15.0-112-generic, 5.3.0-45-generic, 3.10.0-1062.el7.x86_64(CentOS)
- Install tools:
- Network plugin and version (if this is a network-related bug): Calico - v3.11.1
- Others:

**Comment by thockin** [comment]
A few things:

- What network infra (CNI in particular) is this using?
- Is this using kube-proxy or some other Services impl?
- Can you explain the IPs in here?  Which is the DNS clusterIP and which is the DNS pod IP?
- Ping to a clusterIP SHOULD NOT work - that it works suggest something else is up

Can you walk through https://kubernetes.io/docs/tasks/debug-application-cluster/debug-service/ ?

**Comment by khatrig** [comment]
Found the issue. Marvell Qlogic Fastlinq ethernet controller is used in the impacted nodes which is causing the issue. Any other controller works just fine. Guessing some type of ethernet firmware issue. Had to reach out to the vendor.

**Comment by thockin** [comment]
Well, this wins weirdest bug of the year :)

**Comment by csschwe** [comment]
Is there a fix or any additional information about this Marvell Qlogic Fastlinq ethernet controller issue?  Seeing the same or similar issue on some servers with this ethernet controller.

**Comment by csschwe** [comment]
A fix for this issue has been submitted by the vendor.

https://bugs.launchpad.net/ubuntu/+source/linux/+bug/1909062

**Comment by thockin** [comment]
Thanks for the update!  Super interesting bug :)

**Comment by saggiyogesh** [comment]
We got a similar issue with vm with Debian 12. One of the pods has a DNS resolution issue. 
`curl google.com` is showing cloudfront and AWS ISP details. :)

Switching OS to ubuntu 22 fixed it. Weird issue.
