### ISSUE TITLE
Send request to kube-apiserver but not response 

### ISSUE THREAD

**Issue by gogeof** [kubernetes/kubernetes#56135]
**Is this a BUG REPORT or FEATURE REQUEST?**:
/kind bug

**What happened**:
send request to apiserver, but not response, seems apiserver also not get the request

**What you expected to happen**:
apiserver response for request

**How to reproduce it (as minimally and precisely as possible)**:
I don't know, I just use kubeadm to create cluster and add nodes.

**Anything else we need to know?**:
anything you want to know, just ping me.

**Environment**:
- Kubernetes version (use `kubectl version`):
```
~# kubectl version
Client Version: version.Info{Major:"1", Minor:"8", GitVersion:"v1.8.3", GitCommit:"f0efb3cb883751c5ffdbe6d515f3cb4fbe7b7acd", GitTreeState:"clean", BuildDate:"2017-11-08T18:39:33Z", GoVersion:"go1.8.3", Compiler:"gc", Platform:"linux/amd64"}
Server Version: version.Info{Major:"1", Minor:"8", GitVersion:"v1.8.3", GitCommit:"f0efb3cb883751c5ffdbe6d515f3cb4fbe7b7acd", GitTreeState:"clean", BuildDate:"2017-11-08T18:27:48Z", GoVersion:"go1.8.3", Compiler:"gc", Platform:"linux/amd64"}
```
- Cloud provider or hardware configuration:none
- OS (e.g. from /etc/os-release):
```
~# cat /etc/os-release
NAME="Ubuntu"
VERSION="16.04.2 LTS (Xenial Xerus)"
ID=ubuntu
ID_LIKE=debian
PRETTY_NAME="Ubuntu 16.04.2 LTS"
VERSION_ID="16.04"
HOME_URL="http://www.ubuntu.com/"
SUPPORT_URL="http://help.ubuntu.com/"
BUG_REPORT_URL="http://bugs.launchpad.net/ubuntu/"
VERSION_CODENAME=xenial
UBUNTU_CODENAME=xenial
```
- Kernel (e.g. `uname -a`):
```
~# uname -a
Linux m-cluster-192-168-8-151 4.4.0-98-generic #121-Ubuntu SMP Tue Oct 10 14:24:03 UTC 2017 x86_64 x86_64 x86_64 GNU/Linux
```
- Install tools:kubeadm
- Others:calico

/sig api-machinery
/sig network

**Comment by gogeof** [comment]
here is what it like:
```
~# tcpdump -i ens160 | grep ufleet
tcpdump: verbose output suppressed, use -v or -vv for full protocol decode
listening on ens160, link-type EN10MB (Ethernet), capture size 262144 bytes
14:42:08.889236 IP ufleet.49578 > m-cluster-192-168-8-151.6443: Flags [P.], seq 2399853084:2399853121, ack 1891011076, win 8048, options [nop,nop,TS val 231081984 ecr 230949241], length 37
14:42:16.047697 IP ufleet.33966 > m-cluster-192-168-8-151.6443: Flags [S], seq 1009130100, win 29200, options [mss 1460,sackOK,TS val 231083773 ecr 0,nop,wscale 7], length 0
14:42:17.043578 IP ufleet.33966 > m-cluster-192-168-8-151.6443: Flags [S], seq 1009130100, win 29200, options [mss 1460,sackOK,TS val 231084023 ecr 0,nop,wscale 7], length 0
14:42:19.046905 IP ufleet.33966 > m-cluster-192-168-8-151.6443: Flags [S], seq 1009130100, win 29200, options [mss 1460,sackOK,TS val 231084524 ecr 0,nop,wscale 7], length 0
14:42:21.058201 IP ufleet.33986 > m-cluster-192-168-8-151.6443: Flags [S], seq 219956981, win 29200, options [mss 1460,sackOK,TS val 231085027 ecr 0,nop,wscale 7], length 0
14:42:22.057746 IP ufleet.33986 > m-cluster-192-168-8-151.6443: Flags [S], seq 219956981, win 29200, options [mss 1460,sackOK,TS val 231085277 ecr 0,nop,wscale 7], length 0
14:42:24.060892 IP ufleet.33986 > m-cluster-192-168-8-151.6443: Flags [S], seq 219956981, win 29200, options [mss 1460,sackOK,TS val 231085778 ecr 0,nop,wscale 7], length 0
14:42:26.577615 IP ufleet.34002 > m-cluster-192-168-8-151.6443: Flags [S], seq 1452228409, win 29200, options [mss 1460,sackOK,TS val 231086407 ecr 0,nop,wscale 7], length 0
14:42:27.575105 IP ufleet.34002 > m-cluster-192-168-8-151.6443: Flags [S], seq 1452228409, win 29200, options [mss 1460,sackOK,TS val 231086657 ecr 0,nop,wscale 7], length 0
14:42:29.578206 IP ufleet.34002 > m-cluster-192-168-8-151.6443: Flags [S], seq 1452228409, win 29200, options [mss 1460,sackOK,TS val 231087158 ecr 0,nop,wscale 7], length 0
14:42:32.101845 IP ufleet.34022 > m-cluster-192-168-8-151.6443: Flags [S], seq 2560435142, win 29200, options [mss 1460,sackOK,TS val 231087789 ecr 0,nop,wscale 7], length 0
14:42:33.100297 IP ufleet.34022 > m-cluster-192-168-8-151.6443: Flags [S], seq 2560435142, win 29200, options [mss 1460,sackOK,TS val 231088039 ecr 0,nop,wscale 7], length 0
14:42:35.103049 IP ufleet.34022 > m-cluster-192-168-8-151.6443: Flags [S], seq 2560435142, win 29200, options [mss 1460,sackOK,TS val 231088540 ecr 0,nop,wscale 7], length 0
14:42:39.640605 IP ufleet.34058 > m-cluster-192-168-8-151.6443: Flags [S], seq 3536380279, win 29200, options [mss 1460,sackOK,TS val 231089675 ecr 0,nop,wscale 7], length 0
14:42:40.639774 IP ufleet.34058 > m-cluster-192-168-8-151.6443: Flags [S], seq 3536380279, win 29200, options [mss 1460,sackOK,TS val 231089925 ecr 0,nop,wscale 7], length 0
14:42:42.160572 IP ufleet.39094 > m-cluster-192-168-8-151.9100: Flags [S], seq 2907232053, win 29200, options [mss 1460,sackOK,TS val 231090305 ecr 0,nop,wscale 7], length 0
14:42:42.642558 IP ufleet.34058 > m-cluster-192-168-8-151.6443: Flags [S], seq 3536380279, win 29200, options [mss 1460,sackOK,TS val 231090426 ecr 0,nop,wscale 7], length 0
14:42:43.158227 IP ufleet.39094 > m-cluster-192-168-8-151.9100: Flags [S], seq 2907232053, win 29200, options [mss 1460,sackOK,TS val 231090555 ecr 0,nop,wscale 7], length 0
14:43:07.625082 IP ufleet.34172 > m-cluster-192-168-8-151.6443: Flags [S], seq 3003824280, win 29200, options [mss 1460,sackOK,TS val 231096674 ecr 0,nop,wscale 7], length 0
14:43:08.622402 IP ufleet.34172 > m-cluster-192-168-8-151.6443: Flags [S], seq 3003824280, win 29200, options [mss 1460,sackOK,TS val 231096924 ecr 0,nop,wscale 7], length 0
14:43:10.625574 IP ufleet.34172 > m-cluster-192-168-8-151.6443: Flags [S], seq 3003824280, win 29200, options [mss 1460,sackOK,TS val 231097425 ecr 0,nop,wscale 7], length 0
14:43:12.635502 IP ufleet.34194 > m-cluster-192-168-8-151.6443: Flags [S], seq 1234145078, win 29200, options [mss 1460,sackOK,TS val 231097927 ecr 0,nop,wscale 7], length 0
14:43:13.632385 IP ufleet.34194 > m-cluster-192-168-8-151.6443: Flags [S], seq 1234145078, win 29200, options [mss 1460,sackOK,TS val 231098177 ecr 0,nop,wscale 7], length 0
14:43:15.635510 IP ufleet.34194 > m-cluster-192-168-8-151.6443: Flags [S], seq 1234145078, win 29200, options [mss 1460,sackOK,TS val 231098678 ecr 0,nop,wscale 7], length 0
14:43:18.144903 IP ufleet.34214 > m-cluster-192-168-8-151.6443: Flags [S], seq 3599608993, win 29200, options [mss 1460,sackOK,TS val 231099305 ecr 0,nop,wscale 7], length 0
14:43:19.142028 IP ufleet.34214 > m-cluster-192-168-8-151.6443: Flags [S], seq 3599608993, win 29200, options [mss 1460,sackOK,TS val 231099555 ecr 0,nop,wscale 7], length 0
14:43:21.145131 IP ufleet.34214 > m-cluster-192-168-8-151.6443: Flags [S], seq 3599608993, win 29200, options [mss 1460,sackOK,TS val 231100056 ecr 0,nop,wscale 7], length 0
14:43:23.654981 IP ufleet.34232 > m-cluster-192-168-8-151.6443: Flags [S], seq 776992131, win 29200, options [mss 1460,sackOK,TS val 231100683 ecr 0,nop,wscale 7], length 0
14:43:24.651462 IP ufleet.34232 > m-cluster-192-168-8-151.6443: Flags [S], seq 776992131, win 29200, options [mss 1460,sackOK,TS val 231100933 ecr 0,nop,wscale 7], length 0
14:43:26.654517 IP ufleet.34232 > m-cluster-192-168-8-151.6443: Flags [S], seq 776992131, win 29200, options [mss 1460,sackOK,TS val 231101434 ecr 0,nop,wscale 7], length 0
14:43:42.782963 IP ufleet.39312 > m-cluster-192-168-8-151.9100: Flags [S], seq 1363729463, win 29200, options [mss 1460,sackOK,TS val 231105468 ecr 0,nop,wscale 7], length 0
14:43:43.781415 IP ufleet.39312 > m-cluster-192-168-8-151.9100: Flags [S], seq 1363729463, win 29200, options [mss 1460,sackOK,TS val 231105718 ecr 0,nop,wscale 7], length 0
14:43:44.658707 IP ufleet.34300 > m-cluster-192-168-8-151.6443: Flags [S], seq 195057641, win 29200, options [mss 1460,sackOK,TS val 231105937 ecr 0,nop,wscale 7], length 0
14:43:45.656460 IP ufleet.34300 > m-cluster-192-168-8-151.6443: Flags [S], seq 195057641, win 29200, options [mss 1460,sackOK,TS val 231106187 ecr 0,nop,wscale 7], length 0
14:43:47.659306 IP ufleet.34300 > m-cluster-192-168-8-151.6443: Flags [S], seq 195057641, win 29200, options [mss 1460,sackOK,TS val 231106688 ecr 0,nop,wscale 7], length 0
14:43:57.637512 IP ufleet.49578 > m-cluster-192-168-8-151.6443: Flags [P.], seq 0:37, ack 1, win 8048, options [nop,nop,TS val 231109184 ecr 230949241], length 37
14:43:59.181135 IP ufleet.34344 > m-cluster-192-168-8-151.6443: Flags [S], seq 647988005, win 29200, options [mss 1460,sackOK,TS val 231109570 ecr 0,nop,wscale 7], length 0
14:44:00.180034 IP ufleet.34344 > m-cluster-192-168-8-151.6443: Flags [S], seq 647988005, win 29200, options [mss 1460,sackOK,TS val 231109820 ecr 0,nop,wscale 7], length 0
14:44:02.182786 IP ufleet.34344 > m-cluster-192-168-8-151.6443: Flags [S], seq 647988005, win 29200, options [mss 1460,sackOK,TS val 231110321 ecr 0,nop,wscale 7], length 0
14:44:04.186995 IP ufleet.34356 > m-cluster-192-168-8-151.6443: Flags [S], seq 80090208, win 29200, options [mss 1460,sackOK,TS val 231110822 ecr 0,nop,wscale 7], length 0
14:44:05.185021 IP ufleet.34356 > m-cluster-192-168-8-151.6443: Flags [S], seq 80090208, win 29200, options [mss 1460,sackOK,TS val 231111072 ecr 0,nop,wscale 7], length 0
14:44:07.187872 IP ufleet.34356 > m-cluster-192-168-8-151.6443: Flags [S], seq 80090208, win 29200, options [mss 1460,sackOK,TS val 231111573 ecr 0,nop,wscale 7], length 0
14:44:08.179946 IP m-cluster-192-168-8-151.6443 > ufleet.49578: Flags [P.], seq 1:1449, ack 0, win 1452, options [nop,nop,TS val 231006946 ecr 231054154], length 1448
14:44:08.179964 IP m-cluster-192-168-8-151.6443 > ufleet.49578: Flags [.], seq 1449:4345, ack 0, win 1452, options [nop,nop,TS val 231006946 ecr 231054154], length 2896
14:44:08.180112 IP m-cluster-192-168-8-151.6443 > ufleet.49578: Flags [.], seq 4345:7241, ack 0, win 1452, options [nop,nop,TS val 231006946 ecr 231054154], length 2896
14:44:08.180121 IP m-cluster-192-168-8-151.6443 > ufleet.49578: Flags [.], seq 7241:10137, ack 0, win 1452, options [nop,nop,TS val 231006946 ecr 231054154], length 2896
14:44:08.180519 IP m-cluster-192-168-8-151.6443 > ufleet.49578: Flags [.], seq 10137:13033, ack 0, win 1452, options [nop,nop,TS val 231006946 ecr 231054154], length 2896
14:44:08.180552 IP m-cluster-192-168-8-151.6443 > ufleet.49578: Flags [P.], seq 13033:14022, ack 0, win 1452, options [nop,nop,TS val 231006946 ecr 231054154], length 989
14:44:08.180554 IP ufleet.49578 > m-cluster-192-168-8-151.6443: Flags [.], ack 1449, win 8048, options [nop,nop,TS val 231111821 ecr 231006946], length 0
14:44:08.180572 IP m-cluster-192-168-8-151.6443 > ufleet.49578: Flags [.], seq 14022:16918, ack 0, win 1452, options [nop,nop,TS val 231006946 ecr 231054154], length 2896
14:44:08.180581 IP ufleet.49578 > m-cluster-192-168-8-151.6443: Flags [.], ack 4345, win 8048, options [nop,nop,TS val 231111821 ecr 231006946], length 0
14:44:08.180589 IP m-cluster-192-168-8-151.6443 > ufleet.49578: Flags [.], seq 16918:22710, ack 0, win 1452, options [nop,nop,TS val 231006946 ecr 231054154], length 5792
14:44:08.180667 IP ufleet.49578 > m-cluster-192-168-8-151.6443: Flags [.], ack 10137, win 8048, options [nop,nop,TS val 231111821 ecr 231006946], length 0
14:44:08.180683 IP m-cluster-192-168-8-151.6443 > ufleet.49578: Flags [.], seq 22710:32846, ack 0, win 1452, options [nop,nop,TS val 231006946 ecr 231054154], length 10136
14:44:08.180953 IP ufleet.49578 > m-cluster-192-168-8-151.6443: Flags [.], ack 14022, win 8048, options [nop,nop,TS val 231111821 ecr 231006946], length 0
14:44:08.180972 IP m-cluster-192-168-8-151.6443 > ufleet.49578: Flags [.], seq 32846:34294, ack 0, win 1452, options [nop,nop,TS val 231006946 ecr 231054154], length 1448
14:44:08.180984 IP m-cluster-192-168-8-151.6443 > ufleet.49578: Flags [.], seq 34294:42982, ack 0, win 1452, options [nop,nop,TS val 231006946 ecr 231054154], length 8688
14:44:08.181081 IP ufleet.49578 > m-cluster-192-168-8-151.6443: Flags [.], ack 16918, win 8048, options [nop,nop,TS val 231111821 ecr 231006946], length 0
14:44:08.181188 IP m-cluster-192-168-8-151.6443 > ufleet.49578: Flags [P.], seq 42982:43186, ack 0, win 1452, options [nop,nop,TS val 231006946 ecr 231054154], length 204
14:44:08.181214 IP m-cluster-192-168-8-151.6443 > ufleet.49578: Flags [.], seq 43186:47530, ack 0, win 1452, options [nop,nop,TS val 231006946 ecr 231054154], length 4344
14:44:08.181729 IP ufleet.49578 > m-cluster-192-168-8-151.6443: Flags [.], ack 32846, win 8048, options [nop,nop,TS val 231111821 ecr 231006946], length 0
14:44:08.181751 IP ufleet.49578 > m-cluster-192-168-8-151.6443: Flags [.], ack 34294, win 8048, options [nop,nop,TS val 231111821 ecr 231006946], length 0
14:44:08.181756 IP ufleet.49578 > m-cluster-192-168-8-151.6443: Flags [.], ack 43186, win 8048, options [nop,nop,TS val 231111821 ecr 231006946], length 0
14:44:08.181763 IP ufleet.49578 > m-cluster-192-168-8-151.6443: Flags [.], ack 47530, win 8048, options [nop,nop,TS val 231111821 ecr 231006946], length 0
14:44:08.181774 IP m-cluster-192-168-8-151.6443 > ufleet.49578: Flags [P.], seq 47530:55386, ack 0, win 1452, options [nop,nop,TS val 231006946 ecr 231054154], length 7856
14:44:08.181947 IP m-cluster-192-168-8-151.6443 > ufleet.49578: Flags [P.], seq 55386:67646, ack 0, win 1452, options [nop,nop,TS val 231006946 ecr 231054154], length 12260
14:44:08.181972 IP m-cluster-192-168-8-151.6443 > ufleet.49578: Flags [.], seq 67646:77782, ack 0, win 1452, options [nop,nop,TS val 231006946 ecr 231054154], length 10136
14:44:08.182024 IP m-cluster-192-168-8-151.6443 > ufleet.49578: Flags [P.], seq 77782:79245, ack 0, win 1452, options [nop,nop,TS val 231006946 ecr 231054154], length 1463
14:44:08.182040 IP m-cluster-192-168-8-151.6443 > ufleet.49578: Flags [P.], seq 79245:91445, ack 0, win 1452, options [nop,nop,TS val 231006946 ecr 231054154], length 12200
14:44:08.182106 IP ufleet.49578 > m-cluster-192-168-8-151.6443: Flags [.], ack 50426, win 8048, options [nop,nop,TS val 231111821 ecr 231006946], length 0
14:44:08.182106 IP m-cluster-192-168-8-151.6443 > ufleet.49578: Flags [P.], seq 91445:102455, ack 0, win 1452, options [nop,nop,TS val 231006946 ecr 231054154], length 11010
14:44:08.182138 IP ufleet.49578 > m-cluster-192-168-8-151.6443: Flags [.], ack 55386, win 8048, options [nop,nop,TS val 231111821 ecr 231006946], length 0
14:44:08.182150 IP m-cluster-192-168-8-151.6443 > ufleet.49578: Flags [.], seq 102455:106799, ack 0, win 1452, options [nop,nop,TS val 231006946 ecr 231054154], length 4344
14:44:08.182303 IP m-cluster-192-168-8-151.6443 > ufleet.49578: Flags [P.], seq 106799:115286, ack 0, win 1452, options [nop,nop,TS val 231006946 ecr 231054154], length 8487
14:44:08.182330 IP ufleet.49578 > m-cluster-192-168-8-151.6443: Flags [.], ack 56834, win 8048, options [nop,nop,TS val 231111821 ecr 231006946], length 0
14:44:08.182337 IP m-cluster-192-168-8-151.6443 > ufleet.49578: Flags [.], seq 115286:121078, ack 0, win 1452, options [nop,nop,TS val 231006946 ecr 231054154], length 5792
14:44:08.182363 IP m-cluster-192-168-8-151.6443 > ufleet.49578: Flags [.], seq 121078:122526, ack 0, win 1452, options [nop,nop,TS val 231006946 ecr 231054154], length 1448
14:44:08.182373 IP ufleet.49578 > m-cluster-192-168-8-151.6443: Flags [.], ack 62626, win 8048, options [nop,nop,TS val 231111821 ecr 231006946], length 0
14:44:08.182382 IP m-cluster-192-168-8-151.6443 > ufleet.49578: Flags [P.], seq 122526:126885, ack 0, win 1452, options [nop,nop,TS val 231006946 ecr 231054154], length 4359
14:44:08.182394 IP m-cluster-192-168-8-151.6443 > ufleet.49578: Flags [.], seq 126885:128333, ack 0, win 1452, options [nop,nop,TS val 231006946 ecr 231054154], length 1448
14:44:08.182397 IP ufleet.49578 > m-cluster-192-168-8-151.6443: Flags [.], ack 67646, win 8048, options [nop,nop,TS val 231111821 ecr 231006946], length 0
14:44:08.182405 IP m-cluster-192-168-8-151.6443 > ufleet.49578: Flags [.], seq 128333:134125, ack 0, win 1452, options [nop,nop,TS val 231006946 ecr 231054154], length 5792
14:44:08.182496 IP ufleet.49578 > m-cluster-192-168-8-151.6443: Flags [.], ack 71990, win 8032, options [nop,nop,TS val 231111821 ecr 231006946], length 0
14:44:08.182514 IP m-cluster-192-168-8-151.6443 > ufleet.49578: Flags [P.], seq 134125:138466, ack 0, win 1452, options [nop,nop,TS val 231006946 ecr 231054154], length 4341
14:44:08.182525 IP ufleet.49578 > m-cluster-192-168-8-151.6443: Flags [.], ack 79245, win 7987, options [nop,nop,TS val 231111821 ecr 231006946], length 0
14:44:08.182537 IP m-cluster-192-168-8-151.6443 > ufleet.49578: Flags [.], seq 138466:148602, ack 0, win 1452, options [nop,nop,TS val 231006946 ecr 231054154], length 10136
14:44:08.182654 IP ufleet.49578 > m-cluster-192-168-8-151.6443: Flags [.], ack 92893, win 8039, options [nop,nop,TS val 231111821 ecr 231006946], length 0
14:44:08.182725 IP m-cluster-192-168-8-151.6443 > ufleet.49578: Flags [P.], seq 148602:151315, ack 0, win 1452, options [nop,nop,TS val 231006946 ecr 231054154], length 2713
14:44:08.182743 IP m-cluster-192-168-8-151.6443 > ufleet.49578: Flags [P.], seq 151315:161135, ack 0, win 1452, options [nop,nop,TS val 231006946 ecr 231054154], length 9820
14:44:08.183484 IP ufleet.49578 > m-cluster-192-168-8-151.6443: Flags [.], ack 161135, win 7797, options [nop,nop,TS val 231111822 ecr 231006946], length 0
14:44:09.714872 IP ufleet.34376 > m-cluster-192-168-8-151.6443: Flags [S], seq 918380027, win 29200, options [mss 1460,sackOK,TS val 231112205 ecr 0,nop,wscale 7], length 0
14:44:09.714960 IP m-cluster-192-168-8-151.6443 > ufleet.34376: Flags [S.], seq 1367691985, ack 918380028, win 28960, options [mss 1460,sackOK,TS val 231007329 ecr 231112205,nop,wscale 7], length 0
14:44:09.715174 IP ufleet.34376 > m-cluster-192-168-8-151.6443: Flags [.], ack 1, win 229, options [nop,nop,TS val 231112205 ecr 231007329], length 0
14:44:09.715982 IP ufleet.34376 > m-cluster-192-168-8-151.6443: Flags [P.], seq 1:518, ack 1, win 229, options [nop,nop,TS val 231112205 ecr 231007329], length 517
14:44:09.716018 IP m-cluster-192-168-8-151.6443 > ufleet.34376: Flags [.], ack 518, win 235, options [nop,nop,TS val 231007330 ecr 231112205], length 0
14:44:09.721188 IP m-cluster-192-168-8-151.6443 > ufleet.34376: Flags [P.], seq 1:1368, ack 518, win 235, options [nop,nop,TS val 231007331 ecr 231112205], length 1367
14:44:09.721408 IP ufleet.34376 > m-cluster-192-168-8-151.6443: Flags [.], ack 1368, win 251, options [nop,nop,TS val 231112206 ecr 231007331], length 0
14:44:09.724238 IP ufleet.34376 > m-cluster-192-168-8-151.6443: Flags [P.], seq 518:2418, ack 1368, win 251, options [nop,nop,TS val 231112207 ecr 231007331], length 1900
14:44:09.724266 IP m-cluster-192-168-8-151.6443 > ufleet.34376: Flags [.], ack 2418, win 265, options [nop,nop,TS val 231007332 ecr 231112207], length 0
14:44:09.725291 IP m-cluster-192-168-8-151.6443 > ufleet.34376: Flags [P.], seq 1368:3049, ack 2418, win 265, options [nop,nop,TS val 231007332 ecr 231112207], length 1681
14:44:09.725523 IP ufleet.34376 > m-cluster-192-168-8-151.6443: Flags [.], ack 3049, win 278, options [nop,nop,TS val 231112207 ecr 231007332], length 0
14:44:09.725862 IP ufleet.34376 > m-cluster-192-168-8-151.6443: Flags [P.], seq 2418:2603, ack 3049, win 278, options [nop,nop,TS val 231112207 ecr 231007332], length 185
14:44:09.728091 IP m-cluster-192-168-8-151.6443 > ufleet.34376: Flags [P.], seq 3049:4257, ack 2603, win 287, options [nop,nop,TS val 231007333 ecr 231112207], length 1208
14:44:09.728170 IP m-cluster-192-168-8-151.6443 > ufleet.34376: Flags [P.], seq 4257:6644, ack 2603, win 287, options [nop,nop,TS val 231007333 ecr 231112207], length 2387
14:44:09.728221 IP m-cluster-192-168-8-151.6443 > ufleet.34376: Flags [P.], seq 6644:7232, ack 2603, win 287, options [nop,nop,TS val 231007333 ecr 231112207], length 588
14:44:09.728287 IP m-cluster-192-168-8-151.6443 > ufleet.34376: Flags [P.], seq 7232:8452, ack 2603, win 287, options [nop,nop,TS val 231007333 ecr 231112207], length 1220
```

**Comment by gogeof** [comment]
## system information:
**top**
```
top - 14:50:25 up 10 days, 16:51,  5 users,  load average: 0.65, 0.45, 0.38
Tasks: 240 total,   1 running, 239 sleeping,   0 stopped,   0 zombie
%Cpu(s):  2.9 us,  1.8 sy,  0.0 ni, 94.9 id,  0.2 wa,  0.0 hi,  0.3 si,  0.0 st
KiB Mem :  4046220 total,   231460 free,   840124 used,  2974636 buff/cache
KiB Swap:  2093052 total,  2092808 free,      244 used.  2794148 avail Mem 

  PID USER      PR  NI    VIRT    RES    SHR S  %CPU %MEM     TIME+ COMMAND                                                                                                                                        
 6033 root      20   0  123536  84360  43560 S   4.0  2.1   9:55.99 kube-controller                                                                                                                                
 6101 root      20   0  357000 269524  54088 S   3.7  6.7  10:03.59 kube-apiserver                                                                                                                                 
 1136 root      20   0 2796120  89392  27236 S   3.0  2.2 240:40.56 dockerd                                                                                                                                        
 5699 root      20   0  753336 105004  48900 S   3.0  2.6  10:43.67 kubelet                                                                                                                                        
 7220 root      20   0   44944  31800  20104 S   3.0  0.8   5:18.07 calico-felix                                                                                                                                   
 5554 root      20   0   45592  34216  23292 S   2.0  0.8   3:11.71 kube-scheduler                                                                                                                                 
 2630 root      20   0 10.072g  66908  17584 S   1.7  1.7   3:48.82 etcd                                                                                                                                           
 6501 root      20   0 10.030g  22972  13668 S   1.0  0.6   2:00.00 etcd                                                                                                                                           
    7 root      20   0       0      0      0 S   0.3  0.0  30:33.39 rcu_sched                                                                                                                                      
  916 root      20   0   14860   3356   2076 S   0.3  0.1   0:01.17 watch                                                                                                                                          
  955 root      20   0  188344  12296   8560 S   0.3  0.3  13:26.19 vmtoolsd                                                                                                                                       
 1315 root      20   0 1976920  27508   8240 S   0.3  0.7  21:51.94 containerd                                                                                                                                     
 6721 root      20   0   42364  33048  22616 S   0.3  0.8   0:47.70 kube-proxy                                                                                                                                     
 7222 root      20   0     732      4      0 S   0.3  0.0   0:02.29 bird6                                                                                                                                          
 7319 root      20   0  388224  28356  13280 S   0.3  0.7   0:28.96 cosrv                                                                                                                                          
 7655 root      20   0   37708  23768  16760 S   0.3  0.6   0:11.13 kube-dns                                                                                                                                       
 7789 nobody    20   0   37336  25400  14496 S   0.3  0.6   0:24.68 sidecar                                                                                                                                        
    1 root      20   0  120724   7000   4072 S   0.0  0.2   0:18.83 systemd                                                                                                                                        
    2 root      20   0       0      0      0 S   0.0  0.0   0:00.14 kthreadd                                                                                                                                       
    3 root      20   0       0      0      0 S   0.0  0.0   0:46.24 ksoftirqd/0                                                                                                                                    
    5 root       0 -20       0      0      0 S   0.0  0.0   0:00.00 kworker/0:0H                                                                                                                                   
    8 root      20   0       0      0      0 S   0.0  0.0   0:00.00 rcu_bh                                                                                                                                         
    9 root      rt   0       0      0      0 S   0.0  0.0   0:48.60 migration/0                                                                                                                                    
   10 root      rt   0       0      0      0 S   0.0  0.0   0:03.47 watchdog/0                                                                                                                                     
   11 root      rt   0       0      0      0 S   0.0  0.0   0:03.33 watchdog/1                                                                                                                                     
   12 root      rt   0       0      0      0 S   0.0  0.0   0:49.06 migration/1                                                                                                                                    
   13 root      20   0       0      0      0 S   0.0  0.0   2:05.32 ksoftirqd/1                                                                                                                                    
   15 root       0 -20       0      0      0 S   0.0  0.0   0:00.00 kworker/1:0H                                                                                                                                   
   16 root      rt   0       0      0      0 S   0.0  0.0   0:03.43 watchdog/2                                                                                                                                     
   17 root      rt   0       0      0      0 S   0.0  0.0   0:44.11 migration/2                                                                                                                                    
   18 root      20   0       0      0      0 S   0.0  0.0   2:01.12 ksoftirqd/2                                                                                                                                    
   20 root       0 -20       0      0      0 S   0.0  0.0   0:00.00 kworker/2:0H                                                                                                                                   
   21 root      rt   0       0      0      0 S   0.0  0.0   0:03.41 watchdog/3                                                                                                                                     
   22 root      rt   0       0      0      0 S   0.0  0.0   0:44.50 migration/3                                                                                                                                    
   23 root      20   0       0      0      0 S   0.0  0.0   2:28.46 ksoftirqd/3
```

**free -mg**
```
~# free -mg
              total        used        free      shared  buff/cache   available
Mem:              3           0           0           0           2           2
Swap:             1           0           1
```

**kube-apiserver**
```
~# docker ps -a | grep apiserver
a8a9bcfdb831        cb809b44649a                                          "kube-apiserver --req"   4 hours ago         Up 4 hours                              k8s_kube-apiserver_kube-apiserver-m-cluster-192-168-8-151_kube-system_c9bc26f90d5c52411b4ccf64c5c54343_0
4aa0a0db0959        gcr.io/google_containers/pause-amd64:3.0              "/pause"                 4 hours ago         Up 4 hours                              k8s_POD_kube-apiserver-m-cluster-192-168-8-151_kube-system_c9bc26f90d5c52411b4ccf64c5c54343_0
~# docker stats a8a9bcfdb831
CONTAINER           CPU %               MEM USAGE / LIMIT       MEM %               NET I/O             BLOCK I/O           PIDS
a8a9bcfdb831        3.66%               211.9 MiB / 3.859 GiB   5.36%               0 B / 0 B           0 B / 0 B           12
```

**kubectl get pods --all-namespaces**
```
~# kubectl get pods --all-namespaces
NAMESPACE     NAME                                              READY     STATUS    RESTARTS   AGE
kube-system   calico-node-7j2qg                                 2/2       Running   0          4h
kube-system   calico-node-mnft2                                 2/2       Running   0          4h
kube-system   calico-node-rtrbp                                 2/2       Running   0          3h
kube-system   calico-policy-controller-5464665d54-7nmtl         1/1       Running   0          4h
kube-system   kube-apiserver-m-cluster-192-168-8-151            1/1       Running   0          4h
kube-system   kube-controller-manager-m-cluster-192-168-8-151   1/1       Running   1          4h
kube-system   kube-dns-545bc4bfd4-6vnr6                         3/3       Running   0          4h
kube-system   kube-proxy-8cjmt                                  1/1       Running   0          4h
kube-system   kube-proxy-bc656                                  1/1       Running   0          3h
kube-system   kube-proxy-n96k8                                  1/1       Running   0          4h
kube-system   kube-scheduler-m-cluster-192-168-8-151            1/1       Running   0          4h
kube-system   prometheus-node-exporter-llhmn                    1/1       Running   0          3h
kube-system   prometheus-node-exporter-pf6zq                    1/1       Running   0          4h
kube-system   prometheus-node-exporter-xkfdf                    1/1       Running   0          4h
kube-system   traefik-ingress-lb-b2rcv                          1/1       Running   0          4h
ws            wordpress-5596dcd5f-7k2l9                         2/2       Running   0          3h
~#
```

**kubectl get nodes**
```
~# kubectl get nodes
NAME                      STATUS     ROLES     AGE       VERSION
m-cluster-192-168-8-151   Ready      master    4h        v1.8.3
n-cluster-192-168-3-62    NotReady   <none>    4h        v1.8.3
n-cluster-192-168-8-152   Ready      <none>    3h        v1.8.3
```

**Comment by gogeof** [comment]
**node: n-cluster-192-168-3-62**
```
~# kubectl describe node n-cluster-192-168-3-62
Name:               n-cluster-192-168-3-62
Roles:              <none>
Labels:             beta.kubernetes.io/arch=amd64
                    beta.kubernetes.io/os=linux
                    kubernetes.io/hostname=n-cluster-192-168-3-62
Annotations:        alpha.kubernetes.io/provided-node-ip=192.168.3.62
                    node.alpha.kubernetes.io/ttl=0
                    volumes.kubernetes.io/controller-managed-attach-detach=true
Taints:             <none>
CreationTimestamp:  Tue, 21 Nov 2017 10:35:40 +0800
Conditions:
  Type             Status    LastHeartbeatTime                 LastTransitionTime                Reason                     Message
  ----             ------    -----------------                 ------------------                ------                     -------
  OutOfDisk        False     Tue, 21 Nov 2017 14:50:13 +0800   Tue, 21 Nov 2017 10:35:40 +0800   KubeletHasSufficientDisk   kubelet has sufficient disk space available
  MemoryPressure   Unknown   Tue, 21 Nov 2017 14:50:13 +0800   Tue, 21 Nov 2017 14:50:57 +0800   NodeStatusUnknown          Kubelet stopped posting node status.
  DiskPressure     Unknown   Tue, 21 Nov 2017 14:50:13 +0800   Tue, 21 Nov 2017 14:50:57 +0800   NodeStatusUnknown          Kubelet stopped posting node status.
  Ready            Unknown   Tue, 21 Nov 2017 14:50:13 +0800   Tue, 21 Nov 2017 14:50:57 +0800   NodeStatusUnknown          Kubelet stopped posting node status.
Addresses:
  InternalIP:  192.168.3.62
  Hostname:    n-cluster-192-168-3-62
Capacity:
 cpu:     4
 memory:  4046232Ki
 pods:    110
Allocatable:
 cpu:     4
 memory:  3943832Ki
 pods:    110
System Info:
 Machine ID:                 ea1446efc2525ceef81c6b5059b2789e
 System UUID:                42335730-6EEB-3EC2-F8A4-098A40795DD6
 Boot ID:                    7e97276d-d716-43c2-ada0-dec222769c38
 Kernel Version:             4.4.0-93-generic
 OS Image:                   Ubuntu 16.04.3 LTS
 Operating System:           linux
 Architecture:               amd64
 Container Runtime Version:  docker://1.12.6
 Kubelet Version:            v1.8.3
 Kube-Proxy Version:         v1.8.3
PodCIDR:                     10.244.1.0/24
ExternalID:                  n-cluster-192-168-3-62
Non-terminated Pods:         (3 in total)
  Namespace                  Name                              CPU Requests  CPU Limits  Memory Requests  Memory Limits
  ---------                  ----                              ------------  ----------  ---------------  -------------
  kube-system                calico-node-mnft2                 250m (6%)     0 (0%)      0 (0%)           0 (0%)
  kube-system                kube-proxy-8cjmt                  0 (0%)        0 (0%)      0 (0%)           0 (0%)
  kube-system                prometheus-node-exporter-xkfdf    0 (0%)        0 (0%)      0 (0%)           0 (0%)
Allocated resources:
  (Total limits may be over 100 percent, i.e., overcommitted.)
  CPU Requests  CPU Limits  Memory Requests  Memory Limits
  ------------  ----------  ---------------  -------------
  250m (6%)     0 (0%)      0 (0%)           0 (0%)
Events:
  Type    Reason                   Age               From                             Message
  ----    ------                   ----              ----                             -------
  Normal  NodeHasSufficientMemory  9m (x37 over 4h)  kubelet, n-cluster-192-168-3-62  Node n-cluster-192-168-3-62 status is now: NodeHasSufficientMemory
  Normal  NodeHasNoDiskPressure    9m (x37 over 4h)  kubelet, n-cluster-192-168-3-62  Node n-cluster-192-168-3-62 status is now: NodeHasNoDiskPressure
```

**Comment by gogeof** [comment]
seems it's the linux system setting problem, not just apiserver, connect etcd also not response.
```
14:59:51.866062 IP n-cluster-192-168-3-62.51644 > m-cluster-192-168-8-151.bgp: Flags [.], ack 1, win 229, options [nop,nop,TS val 90121526 ecr 231242867], length 0
14:59:51.866108 IP n-cluster-192-168-3-62.51644 > m-cluster-192-168-8-151.bgp: Flags [P.], seq 1:62, ack 1, win 229, options [nop,nop,TS val 90121526 ecr 231242867], length 61: BGP
14:59:51.866123 IP m-cluster-192-168-8-151.bgp > n-cluster-192-168-3-62.51644: Flags [.], ack 62, win 227, options [nop,nop,TS val 231242867 ecr 90121526], length 0
14:59:51.866194 IP m-cluster-192-168-8-151.bgp > n-cluster-192-168-3-62.51644: Flags [R.], seq 1, ack 62, win 227, options [nop,nop,TS val 231242867 ecr 90121526], length 0
14:59:52.169088 IP m-cluster-192-168-8-151.6443 > n-cluster-192-168-3-62.60208: Flags [P.], seq 113054:113512, ack 851, win 276, options [nop,nop,TS val 231242943 ecr 90121434], length 458
14:59:52.169430 IP n-cluster-192-168-3-62.60208 > m-cluster-192-168-8-151.6443: Flags [.], ack 113512, win 7846, options [nop,nop,TS val 90121601 ecr 231242943], length 0
14:59:53.508671 IP m-cluster-192-168-8-151.6443 > n-cluster-192-168-3-62.60208: Flags [P.], seq 113512:113952, ack 851, win 276, options [nop,nop,TS val 231243278 ecr 90121601], length 440
14:59:53.508936 IP n-cluster-192-168-3-62.60208 > m-cluster-192-168-8-151.6443: Flags [.], ack 113952, win 7846, options [nop,nop,TS val 90121936 ecr 231243278], length 0
14:59:53.509069 IP n-cluster-192-168-3-62.60208 > m-cluster-192-168-8-151.6443: Flags [P.], seq 851:885, ack 113952, win 7846, options [nop,nop,TS val 90121936 ecr 231243278], length 34
14:59:53.509101 IP m-cluster-192-168-8-151.6443 > n-cluster-192-168-3-62.60208: Flags [.], ack 885, win 276, options [nop,nop,TS val 231243278 ecr 90121936], length 0
14:59:54.176272 IP m-cluster-192-168-8-151.6443 > n-cluster-192-168-3-62.60208: Flags [P.], seq 113952:114410, ack 885, win 276, options [nop,nop,TS val 231243445 ecr 90121936], length 458
14:59:54.213891 IP n-cluster-192-168-3-62.60208 > m-cluster-192-168-8-151.6443: Flags [.], ack 114410, win 7846, options [nop,nop,TS val 90122113 ecr 231243445], length 0
14:59:55.539758 IP m-cluster-192-168-8-151.6443 > n-cluster-192-168-3-62.60208: Flags [P.], seq 114410:114850, ack 885, win 276, options [nop,nop,TS val 231243786 ecr 90122113], length 440
14:59:55.540014 IP n-cluster-192-168-3-62.60208 > m-cluster-192-168-8-151.6443: Flags [.], ack 114850, win 7846, options [nop,nop,TS val 90122444 ecr 231243786], length 0
14:59:55.870452 IP n-cluster-192-168-3-62.45005 > m-cluster-192-168-8-151.bgp: Flags [S], seq 980033535, win 29200, options [mss 1460,sackOK,TS val 90122527 ecr 0,nop,wscale 7], length 0
14:59:55.870545 IP m-cluster-192-168-8-151.bgp > n-cluster-192-168-3-62.45005: Flags [S.], seq 3847466187, ack 980033536, win 28960, options [mss 1460,sackOK,TS val 231243868 ecr 90122527,nop,wscale 7], length 0
14:59:55.870865 IP n-cluster-192-168-3-62.45005 > m-cluster-192-168-8-151.bgp: Flags [.], ack 1, win 229, options [nop,nop,TS val 90122527 ecr 231243868], length 0
14:59:55.870912 IP n-cluster-192-168-3-62.45005 > m-cluster-192-168-8-151.bgp: Flags [P.], seq 1:62, ack 1, win 229, options [nop,nop,TS val 90122527 ecr 231243868], length 61: BGP
14:59:55.870929 IP m-cluster-192-168-8-151.bgp > n-cluster-192-168-3-62.45005: Flags [.], ack 62, win 227, options [nop,nop,TS val 231243868 ecr 90122527], length 0
14:59:55.871003 IP m-cluster-192-168-8-151.bgp > n-cluster-192-168-3-62.45005: Flags [P.], seq 1:62, ack 62, win 227, options [nop,nop,TS val 231243868 ecr 90122527], length 61: BGP
14:59:55.871136 IP n-cluster-192-168-3-62.45005 > m-cluster-192-168-8-151.bgp: Flags [.], ack 62, win 229, options [nop,nop,TS val 90122527 ecr 231243868], length 0
14:59:55.871158 IP m-cluster-192-168-8-151.bgp > n-cluster-192-168-3-62.45005: Flags [P.], seq 62:81, ack 62, win 227, options [nop,nop,TS val 231243868 ecr 90122527], length 19: BGP
14:59:55.871168 IP n-cluster-192-168-3-62.45005 > m-cluster-192-168-8-151.bgp: Flags [P.], seq 62:81, ack 62, win 229, options [nop,nop,TS val 90122527 ecr 231243868], length 19: BGP
14:59:55.907691 IP m-cluster-192-168-8-151.bgp > n-cluster-192-168-3-62.45005: Flags [.], ack 81, win 227, options [nop,nop,TS val 231243878 ecr 90122527], length 0
14:59:55.907947 IP n-cluster-192-168-3-62.45005 > m-cluster-192-168-8-151.bgp: Flags [P.], seq 81:173, ack 81, win 229, options [nop,nop,TS val 90122536 ecr 231243868], length 92: BGP
14:59:55.907982 IP m-cluster-192-168-8-151.bgp > n-cluster-192-168-3-62.45005: Flags [P.], seq 81:165, ack 173, win 227, options [nop,nop,TS val 231243878 ecr 90122536], length 84: BGP
14:59:55.945986 IP n-cluster-192-168-3-62.45005 > m-cluster-192-168-8-151.bgp: Flags [.], ack 165, win 229, options [nop,nop,TS val 90122546 ecr 231243878], length 0
14:59:57.282054 IP n-cluster-192-168-3-62.58762 > m-cluster-192-168-8-151.6443: Flags [P.], seq 0:37, ack 1, win 1947, options [nop,nop,TS val 90122880 ecr 231161481], length 37
15:00:00.804255 IP n-cluster-192-168-3-62.51920 > m-cluster-192-168-8-151.12379: Flags [P.], seq 786:943, ack 2526, win 270, options [nop,nop,TS val 90123760 ecr 231242555], length 157
15:00:01.006161 IP n-cluster-192-168-3-62.51920 > m-cluster-192-168-8-151.12379: Flags [P.], seq 786:943, ack 2526, win 270, options [nop,nop,TS val 90123811 ecr 231242555], length 157
15:00:01.210305 IP n-cluster-192-168-3-62.51920 > m-cluster-192-168-8-151.12379: Flags [P.], seq 786:943, ack 2526, win 270, options [nop,nop,TS val 90123862 ecr 231242555], length 157
15:00:01.618209 IP n-cluster-192-168-3-62.51920 > m-cluster-192-168-8-151.12379: Flags [P.], seq 786:943, ack 2526, win 270, options [nop,nop,TS val 90123964 ecr 231242555], length 157
15:00:01.676264 IP n-cluster-192-168-3-62.44850 > m-cluster-192-168-8-151.9876: Flags [S], seq 327208484, win 29200, options [mss 1460,sackOK,TS val 90123978 ecr 0,nop,wscale 7], length 0
15:00:01.988118 IP n-cluster-192-168-3-62.47199 > m-cluster-192-168-8-151.ntp: NTPv4, Client, length 48
15:00:02.434309 IP n-cluster-192-168-3-62.51920 > m-cluster-192-168-8-151.12379: Flags [P.], seq 786:943, ack 2526, win 270, options [nop,nop,TS val 90124168 ecr 231242555], length 157
15:00:02.658307 IP n-cluster-192-168-3-62.43462 > m-cluster-192-168-8-151.12379: Flags [.], ack 1, win 525, options [nop,nop,TS val 90124224 ecr 231238045], length 0
15:00:02.658345 IP n-cluster-192-168-3-62.43458 > m-cluster-192-168-8-151.12379: Flags [.], ack 1, win 540, options [nop,nop,TS val 90124224 ecr 231238045], length 0
15:00:02.674219 IP n-cluster-192-168-3-62.44850 > m-cluster-192-168-8-151.9876: Flags [S], seq 327208484, win 29200, options [mss 1460,sackOK,TS val 90124228 ecr 0,nop,wscale 7], length 0
15:00:04.070348 IP n-cluster-192-168-3-62.51920 > m-cluster-192-168-8-151.12379: Flags [P.], seq 786:943, ack 2526, win 270, options [nop,nop,TS val 90124577 ecr 231242555], length 157
15:00:04.322287 IP n-cluster-192-168-3-62.43450 > m-cluster-192-168-8-151.12379: Flags [.], ack 1, win 265, options [nop,nop,TS val 90124640 ecr 231238461], length 0
15:00:04.322287 IP n-cluster-192-168-3-62.43470 > m-cluster-192-168-8-151.12379: Flags [.], ack 1, win 299, options [nop,nop,TS val 90124640 ecr 231238461], length 0
15:00:04.322326 IP n-cluster-192-168-3-62.43474 > m-cluster-192-168-8-151.12379: Flags [.], ack 1, win 237, options [nop,nop,TS val 90124640 ecr 231238461], length 0
15:00:04.322379 IP n-cluster-192-168-3-62.43460 > m-cluster-192-168-8-151.12379: Flags [.], ack 1, win 254, options [nop,nop,TS val 90124640 ecr 231238461], length 0
15:00:04.678292 IP n-cluster-192-168-3-62.44850 > m-cluster-192-168-8-151.9876: Flags [S], seq 327208484, win 29200, options [mss 1460,sackOK,TS val 90124729 ecr 0,nop,wscale 7], length 0
15:00:04.962314 IP n-cluster-192-168-3-62.43466 > m-cluster-192-168-8-151.12379: Flags [.], ack 1, win 254, options [nop,nop,TS val 90124800 ecr 231238621], length 0
15:00:04.962322 IP n-cluster-192-168-3-62.43456 > m-cluster-192-168-8-151.12379: Flags [.], ack 1, win 254, options [nop,nop,TS val 90124800 ecr 231238621], length 0
15:00:04.962342 IP n-cluster-192-168-3-62.43468 > m-cluster-192-168-8-151.12379: Flags [.], ack 1, win 262, options [nop,nop,TS val 90124800 ecr 231238621], length 0
15:00:04.962384 IP n-cluster-192-168-3-62.43464 > m-cluster-192-168-8-151.12379: Flags [.], ack 1, win 254, options [nop,nop,TS val 90124800 ecr 231238621], length 0
15:00:07.346374 IP n-cluster-192-168-3-62.51920 > m-cluster-192-168-8-151.12379: Flags [P.], seq 786:943, ack 2526, win 270, options [nop,nop,TS val 90125396 ecr 231242555], length 157
15:00:08.690422 IP n-cluster-192-168-3-62.44850 > m-cluster-192-168-8-151.9876: Flags [S], seq 327208484, win 29200, options [mss 1460,sackOK,TS val 90125732 ecr 0,nop,wscale 7], length 0
15:00:13.891203 IP n-cluster-192-168-3-62.51920 > m-cluster-192-168-8-151.12379: Flags [P.], seq 786:943, ack 2526, win 270, options [nop,nop,TS val 90127032 ecr 231242555], length 157
15:00:17.250702 IP n-cluster-192-168-3-62.43476 > m-cluster-192-168-8-151.12379: Flags [.], ack 2037, win 1444, options [nop,nop,TS val 90127872 ecr 231241694], length 0
15:00:17.379039 IP n-cluster-192-168-3-62.43482 > m-cluster-192-168-8-151.12379: Flags [.], ack 4489, win 1274, options [nop,nop,TS val 90127904 ecr 231241725], length 0
15:00:17.891496 IP n-cluster-192-168-3-62.44878 > m-cluster-192-168-8-151.12379: Flags [.], ack 1, win 237, options [nop,nop,TS val 90128032 ecr 231241853], length 0
15:00:25.570893 IP n-cluster-192-168-3-62.60208 > m-cluster-192-168-8-151.6443: Flags [.], ack 114850, win 7846, options [nop,nop,TS val 90129952 ecr 231243786], length 0
15:00:26.978995 IP n-cluster-192-168-3-62.51920 > m-cluster-192-168-8-151.12379: Flags [P.], seq 786:943, ack 2526, win 270, options [nop,nop,TS val 90130304 ecr 231242555], length 157
15:00:30.805231 IP n-cluster-192-168-3-62.51920 > m-cluster-192-168-8-151.12379: Flags [F.], seq 943, ack 2526, win 270, options [nop,nop,TS val 90131260 ecr 231242555], length 0
15:00:32.739160 IP n-cluster-192-168-3-62.43462 > m-cluster-192-168-8-151.12379: Flags [.], ack 1, win 525, options [nop,nop,TS val 90131744 ecr 231238045], length 0
15:00:32.739206 IP n-cluster-192-168-3-62.43458 > m-cluster-192-168-8-151.12379: Flags [.], ack 1, win 540, options [nop,nop,TS val 90131744 ecr 231238045], length 0
15:00:34.403161 IP n-cluster-192-168-3-62.43470 > m-cluster-192-168-8-151.12379: Flags [.], ack 1, win 299, options [nop,nop,TS val 90132160 ecr 231238461], length 0
15:00:34.403168 IP n-cluster-192-168-3-62.43474 > m-cluster-192-168-8-151.12379: Flags [.], ack 1, win 237, options [nop,nop,TS val 90132160 ecr 231238461], length 0
15:00:34.403196 IP n-cluster-192-168-3-62.43460 > m-cluster-192-168-8-151.12379: Flags [.], ack 1, win 254, options [nop,nop,TS val 90132160 ecr 231238461], length 0
15:00:34.403207 IP n-cluster-192-168-3-62.43450 > m-cluster-192-168-8-151.12379: Flags [.], ack 1, win 265, options [nop,nop,TS val 90132160 ecr 231238461], length 0
15:00:35.043312 IP n-cluster-192-168-3-62.43466 > m-cluster-192-168-8-151.12379: Flags [.], ack 1, win 254, options [nop,nop,TS val 90132320 ecr 231238621], length 0
15:00:35.043312 IP n-cluster-192-168-3-62.43456 > m-cluster-192-168-8-151.12379: Flags [.], ack 1, win 254, options [nop,nop,TS val 90132320 ecr 231238621], length 0
15:00:35.043341 IP n-cluster-192-168-3-62.43468 > m-cluster-192-168-8-151.12379: Flags [.], ack 1, win 262, options [nop,nop,TS val 90132320 ecr 231238621], length 0
15:00:35.043357 IP n-cluster-192-168-3-62.43464 > m-cluster-192-168-8-151.12379: Flags [.], ack 1, win 254, options [nop,nop,TS val 90132320 ecr 231238621], length 0
15:00:40.811126 IP n-cluster-192-168-3-62.51964 > m-cluster-192-168-8-151.12379: Flags [S], seq 1779468267, win 29200, options [mss 1460,sackOK,TS val 90133761 ecr 0,nop,wscale 7], length 0
15:00:41.807331 IP n-cluster-192-168-3-62.51964 > m-cluster-192-168-8-151.12379: Flags [S], seq 1779468267, win 29200, options [mss 1460,sackOK,TS val 90134011 ecr 0,nop,wscale 7], length 0
15:00:43.811359 IP n-cluster-192-168-3-62.51964 > m-cluster-192-168-8-151.12379: Flags [S], seq 1779468267, win 29200, options [mss 1460,sackOK,TS val 90134512 ecr 0,nop,wscale 7], length 0
15:00:47.331370 IP n-cluster-192-168-3-62.43476 > m-cluster-192-168-8-151.12379: Flags [.], ack 2037, win 1444, options [nop,nop,TS val 90135392 ecr 231241694], length 0
15:00:47.459413 IP n-cluster-192-168-3-62.43482 > m-cluster-192-168-8-151.12379: Flags [.], ack 4489, win 1274, options [nop,nop,TS val 90135424 ecr 231241725], length 0
15:00:47.819459 IP n-cluster-192-168-3-62.51964 > m-cluster-192-168-8-151.12379: Flags [S], seq 1779468267, win 29200, options [mss 1460,sackOK,TS val 90135514 ecr 0,nop,wscale 7], length 0
15:00:47.971429 IP n-cluster-192-168-3-62.44878 > m-cluster-192-168-8-151.12379: Flags [.], ack 1, win 237, options [nop,nop,TS val 90135552 ecr 231241853], length 0
15:00:53.155546 IP n-cluster-192-168-3-62.51920 > m-cluster-192-168-8-151.12379: Flags [FP.], seq 786:943, ack 2526, win 270, options [nop,nop,TS val 90136848 ecr 231242555], length 157
15:00:55.652282 IP n-cluster-192-168-3-62.60208 > m-cluster-192-168-8-151.6443: Flags [.], ack 114850, win 7846, options [nop,nop,TS val 90137472 ecr 231243786], length 0
15:00:55.843669 IP n-cluster-192-168-3-62.51964 > m-cluster-192-168-8-151.12379: Flags [S], seq 1779468267, win 29200, options [mss 1460,sackOK,TS val 90137520 ecr 0,nop,wscale 7], length 0
15:01:01.382135 IP n-cluster-192-168-3-62.44882 > m-cluster-192-168-8-151.9876: Flags [S], seq 101517893, win 29200, options [mss 1460,sackOK,TS val 90138904 ecr 0,nop,wscale 7], length 0
15:01:02.379647 IP n-cluster-192-168-3-62.44882 > m-cluster-192-168-8-151.9876: Flags [S], seq 101517893, win 29200, options [mss 1460,sackOK,TS val 90139154 ecr 0,nop,wscale 7], length 0
15:01:02.819776 IP n-cluster-192-168-3-62.43462 > m-cluster-192-168-8-151.12379: Flags [.], ack 1, win 525, options [nop,nop,TS val 90139264 ecr 231238045], length 0
15:01:02.819814 IP n-cluster-192-168-3-62.43458 > m-cluster-192-168-8-151.12379: Flags [.], ack 1, win 540, options [nop,nop,TS val 90139264 ecr 231238045], length 0
15:01:03.978322 IP n-cluster-192-168-3-62.45005 > m-cluster-192-168-8-151.bgp: Flags [P.], seq 173:192, ack 165, win 229, options [nop,nop,TS val 90139553 ecr 231243878], length 19: BGP
15:01:04.183911 IP n-cluster-192-168-3-62.45005 > m-cluster-192-168-8-151.bgp: Flags [P.], seq 173:192, ack 165, win 229, options [nop,nop,TS val 90139605 ecr 231243878], length 19: BGP
15:01:04.383787 IP n-cluster-192-168-3-62.44882 > m-cluster-192-168-8-151.9876: Flags [S], seq 101517893, win 29200, options [mss 1460,sackOK,TS val 90139655 ecr 0,nop,wscale 7], length 0
15:01:04.391746 IP n-cluster-192-168-3-62.45005 > m-cluster-192-168-8-151.bgp: Flags [P.], seq 173:192, ack 165, win 229, options [nop,nop,TS val 90139657 ecr 231243878], length 19: BGP
15:01:04.483738 IP n-cluster-192-168-3-62.43470 > m-cluster-192-168-8-151.12379: Flags [.], ack 1, win 299, options [nop,nop,TS val 90139680 ecr 231238461], length 0
15:01:04.483740 IP n-cluster-192-168-3-62.43474 > m-cluster-192-168-8-151.12379: Flags [.], ack 1, win 237, options [nop,nop,TS val 90139680 ecr 231238461], length 0
15:01:04.483748 IP n-cluster-192-168-3-62.43460 > m-cluster-192-168-8-151.12379: Flags [.], ack 1, win 254, options [nop,nop,TS val 90139680 ecr 231238461], length 0
15:01:04.483764 IP n-cluster-192-168-3-62.43450 > m-cluster-192-168-8-151.12379: Flags [.], ack 1, win 265, options [nop,nop,TS val 90139680 ecr 231238461], length 0
15:01:04.807876 IP n-cluster-192-168-3-62.45005 > m-cluster-192-168-8-151.bgp: Flags [P.], seq 173:192, ack 165, win 229, options [nop,nop,TS val 90139761 ecr 231243878], length 19: BGP
15:01:05.123728 IP n-cluster-192-168-3-62.43466 > m-cluster-192-168-8-151.12379: Flags [.], ack 1, win 254, options [nop,nop,TS val 90139840 ecr 231238621], length 0
15:01:05.123746 IP n-cluster-192-168-3-62.43456 > m-cluster-192-168-8-151.12379: Flags [.], ack 1, win 254, options [nop,nop,TS val 90139840 ecr 231238621], length 0
15:01:05.123785 IP n-cluster-192-168-3-62.43468 > m-cluster-192-168-8-151.12379: Flags [.], ack 1, win 262, options [nop,nop,TS val 90139840 ecr 231238621], length 0
15:01:05.123809 IP n-cluster-192-168-3-62.43464 > m-cluster-192-168-8-151.12379: Flags [.], ack 1, win 254, options [nop,nop,TS val 90139840 ecr 231238621], length 0
15:01:05.639887 IP n-cluster-192-168-3-62.45005 > m-cluster-192-168-8-151.bgp: Flags [P.], seq 173:192, ack 165, win 229, options [nop,nop,TS val 90139969 ecr 231243878], length 19: BGP
15:01:07.307746 IP n-cluster-192-168-3-62.45005 > m-cluster-192-168-8-151.bgp: Flags [P.], seq 173:192, ack 165, win 229, options [nop,nop,TS val 90140386 ecr 231243878], length 19: BGP
15:01:08.387770 IP n-cluster-192-168-3-62.44882 > m-cluster-192-168-8-151.9876: Flags [S], seq 101517893, win 29200, options [mss 1460,sackOK,TS val 90140656 ecr 0,nop,wscale 7], length 0
15:01:10.643965 IP n-cluster-192-168-3-62.45005 > m-cluster-192-168-8-151.bgp: Flags [P.], seq 173:192, ack 165, win 229, options [nop,nop,TS val 90141220 ecr 231243878], length 19: BGP
15:01:17.315917 IP n-cluster-192-168-3-62.45005 > m-cluster-192-168-8-151.bgp: Flags [P.], seq 173:192, ack 165, win 229, options [nop,nop,TS val 90142888 ecr 231243878], length 19: BGP
15:01:17.411854 IP n-cluster-192-168-3-62.43476 > m-cluster-192-168-8-151.12379: Flags [.], ack 2037, win 1444, options [nop,nop,TS val 90142912 ecr 231241694], length 0
15:01:17.539900 IP n-cluster-192-168-3-62.43482 > m-cluster-192-168-8-151.12379: Flags [.], ack 4489, win 1274, options [nop,nop,TS val 90142944 ecr 231241725], length 0
15:01:18.051927 IP n-cluster-192-168-3-62.44878 > m-cluster-192-168-8-151.12379: Flags [.], ack 1, win 237, options [nop,nop,TS val 90143072 ecr 231241853], length 0
15:01:21.617192 IP n-cluster-192-168-3-62.51988 > m-cluster-192-168-8-151.12379: Flags [S], seq 3218862381, win 29200, options [mss 1460,sackOK,TS val 90143963 ecr 0,nop,wscale 7], length 0
15:01:22.615926 IP n-cluster-192-168-3-62.51988 > m-cluster-192-168-8-151.12379: Flags [S], seq 3218862381, win 29200, options [mss 1460,sackOK,TS val 90144213 ecr 0,nop,wscale 7], length 0
15:01:24.619933 IP n-cluster-192-168-3-62.51988 > m-cluster-192-168-8-151.12379: Flags [S], seq 3218862381, win 29200, options [mss 1460,sackOK,TS val 90144714 ecr 0,nop,wscale 7], length 0
15:01:25.732110 IP n-cluster-192-168-3-62.60208 > m-cluster-192-168-8-151.6443: Flags [.], ack 114850, win 7846, options [nop,nop,TS val 90144992 ecr 231243786], length 0
15:01:28.627986 IP n-cluster-192-168-3-62.51988 > m-cluster-192-168-8-151.12379: Flags [S], seq 3218862381, win 29200, options [mss 1460,sackOK,TS val 90145716 ecr 0,nop,wscale 7], length 0
15:01:30.665471 IP n-cluster-192-168-3-62.45005 > m-cluster-192-168-8-151.bgp: Flags [P.], seq 173:192, ack 165, win 229, options [nop,nop,TS val 90146224 ecr 231243878], length 19: BGP
15:01:32.899987 IP n-cluster-192-168-3-62.43462 > m-cluster-192-168-8-151.12379: Flags [.], ack 1, win 525, options [nop,nop,TS val 90146784 ecr 231238045], length 0
15:01:32.900023 IP n-cluster-192-168-3-62.43458 > m-cluster-192-168-8-151.12379: Flags [.], ack 1, win 540, options [nop,nop,TS val 90146784 ecr 231238045], length 0
15:01:34.564008 IP n-cluster-192-168-3-62.43470 > m-cluster-192-168-8-151.12379: Flags [.], ack 1, win 299, options [nop,nop,TS val 90147200 ecr 231238461], length 0
15:01:34.564057 IP n-cluster-192-168-3-62.43460 > m-cluster-192-168-8-151.12379: Flags [.], ack 1, win 254, options [nop,nop,TS val 90147200 ecr 231238461], length 0
15:01:34.564162 IP n-cluster-192-168-3-62.43474 > m-cluster-192-168-8-151.12379: Flags [.], ack 1, win 237, options [nop,nop,TS val 90147200 ecr 231238461], length 0
15:01:34.564190 IP n-cluster-192-168-3-62.43450 > m-cluster-192-168-8-151.12379: Flags [.], ack 1, win 265, options [nop,nop,TS val 90147200 ecr 231238461], length 0
15:01:35.204004 IP n-cluster-192-168-3-62.43456 > m-cluster-192-168-8-151.12379: Flags [.], ack 1, win 254, options [nop,nop,TS val 90147360 ecr 231238621], length 0
15:01:35.204068 IP n-cluster-192-168-3-62.43466 > m-cluster-192-168-8-151.12379: Flags [.], ack 1, win 254, options [nop,nop,TS val 90147360 ecr 231238621], length 0
15:01:35.204535 IP n-cluster-192-168-3-62.43468 > m-cluster-192-168-8-151.12379: Flags [.], ack 1, win 262, options [nop,nop,TS val 90147360 ecr 231238621], length 0
15:01:35.204551 IP n-cluster-192-168-3-62.43464 > m-cluster-192-168-8-151.12379: Flags [.], ack 1, win 254, options [nop,nop,TS val 90147360 ecr 231238621], length 0
15:01:36.645099 IP n-cluster-192-168-3-62.51988 > m-cluster-192-168-8-151.12379: Flags [S], seq 3218862381, win 29200, options [mss 1460,sackOK,TS val 90147720 ecr 0,nop,wscale 7], length 0
15:01:47.492048 IP n-cluster-192-168-3-62.43476 > m-cluster-192-168-8-151.12379: Flags [.], ack 2037, win 1444, options [nop,nop,TS val 90150432 ecr 231241694], length 0
15:01:47.620140 IP n-cluster-192-168-3-62.43482 > m-cluster-192-168-8-151.12379: Flags [.], ack 4489, win 1274, options [nop,nop,TS val 90150464 ecr 231241725], length 0
15:01:48.132106 IP n-cluster-192-168-3-62.44878 > m-cluster-192-168-8-151.12379: Flags [.], ack 1, win 237, options [nop,nop,TS val 90150592 ecr 231241853], length 0
15:01:55.812082 IP n-cluster-192-168-3-62.60208 > m-cluster-192-168-8-151.6443: Flags [.], ack 114850, win 7846, options [nop,nop,TS val 90152512 ecr 231243786], length 0
15:01:57.348038 IP n-cluster-192-168-3-62.45005 > m-cluster-192-168-8-151.bgp: Flags [P.], seq 173:192, ack 165, win 229, options [nop,nop,TS val 90152896 ecr 231243878], length 19: BGP
15:01:57.604111 IP n-cluster-192-168-3-62.58762 > m-cluster-192-168-8-151.6443: Flags [P.], seq 0:37, ack 1, win 1947, options [nop,nop,TS val 90152960 ecr 231161481], length 37
15:02:01.601868 IP n-cluster-192-168-3-62.44914 > m-cluster-192-168-8-151.9876: Flags [S], seq 111161164, win 29200, options [mss 1460,sackOK,TS val 90153959 ecr 0,nop,wscale 7], length 0
15:02:02.332909 IP n-cluster-192-168-3-62.52012 > m-cluster-192-168-8-151.12379: Flags [S], seq 2879390864, win 29200, options [mss 1460,sackOK,TS val 90154142 ecr 0,nop,wscale 7], length 0
15:02:02.600037 IP n-cluster-192-168-3-62.44914 > m-cluster-192-168-8-151.9876: Flags [S], seq 111161164, win 29200, options [mss 1460,sackOK,TS val 90154209 ecr 0,nop,wscale 7], length 0
15:02:02.980085 IP n-cluster-192-168-3-62.43462 > m-cluster-192-168-8-151.12379: Flags [.], ack 1, win 525, options [nop,nop,TS val 90154304 ecr 231238045], length 0
15:02:02.980126 IP n-cluster-192-168-3-62.43458 > m-cluster-192-168-8-151.12379: Flags [.], ack 1, win 540, options [nop,nop,TS val 90154304 ecr 231238045], length 0
15:02:03.332078 IP n-cluster-192-168-3-62.52012 > m-cluster-192-168-8-151.12379: Flags [S], seq 2879390864, win 29200, options [mss 1460,sackOK,TS val 90154392 ecr 0,nop,wscale 7], length 0
15:02:04.604079 IP n-cluster-192-168-3-62.44914 > m-cluster-192-168-8-151.9876: Flags [S], seq 111161164, win 29200, options [mss 1460,sackOK,TS val 90154710 ecr 0,nop,wscale 7], length 0
15:02:04.644051 IP n-cluster-192-168-3-62.43470 > m-cluster-192-168-8-151.12379: Flags [.], ack 1, win 299, options [nop,nop,TS val 90154720 ecr 231238461], length 0
15:02:04.644095 IP n-cluster-192-168-3-62.43450 > m-cluster-192-168-8-151.12379: Flags [.], ack 1, win 265, options [nop,nop,TS val 90154720 ecr 231238461], length 0
15:02:04.644105 IP n-cluster-192-168-3-62.43474 > m-cluster-192-168-8-151.12379: Flags [.], ack 1, win 237, options [nop,nop,TS val 90154720 ecr 231238461], length 0
15:02:04.644104 IP n-cluster-192-168-3-62.43460 > m-cluster-192-168-8-151.12379: Flags [.], ack 1, win 254, options [nop,nop,TS val 90154720 ecr 231238461], length 0
15:02:05.284085 IP n-cluster-192-168-3-62.43456 > m-cluster-192-168-8-151.12379: Flags [.], ack 1, win 254, options [nop,nop,TS val 90154880 ecr 231238621], length 0
15:02:05.284085 IP n-cluster-192-168-3-62.43466 > m-cluster-192-168-8-151.12379: Flags [.], ack 1, win 254, options [nop,nop,TS val 90154880 ecr 231238621], length 0
15:02:05.284123 IP n-cluster-192-168-3-62.43468 > m-cluster-192-168-8-151.12379: Flags [.], ack 1, win 262, options [nop,nop,TS val 90154880 ecr 231238621], length 0
15:02:05.284130 IP n-cluster-192-168-3-62.43464 > m-cluster-192-168-8-151.12379: Flags [.], ack 1, win 254, options [nop,nop,TS val 90154880 ecr 231238621], length 0
15:02:05.336053 IP n-cluster-192-168-3-62.52012 > m-cluster-192-168-8-151.12379: Flags [S], seq 2879390864, win 29200, options [mss 1460,sackOK,TS val 90154893 ecr 0,nop,wscale 7], length 0
15:02:08.612099 IP n-cluster-192-168-3-62.44914 > m-cluster-192-168-8-151.9876: Flags [S], seq 111161164, win 29200, options [mss 1460,sackOK,TS val 90155712 ecr 0,nop,wscale 7], length 0
15:02:09.348072 IP n-cluster-192-168-3-62.52012 > m-cluster-192-168-8-151.12379: Flags [S], seq 2879390864, win 29200, options [mss 1460,sackOK,TS val 90155896 ecr 0,nop,wscale 7], length 0
15:02:17.364029 IP n-cluster-192-168-3-62.52012 > m-cluster-192-168-8-151.12379: Flags [S], seq 2879390864, win 29200, options [mss 1460,sackOK,TS val 90157900 ecr 0,nop,wscale 7], length 0
15:02:17.572034 IP n-cluster-192-168-3-62.43476 > m-cluster-192-168-8-151.12379: Flags [.], ack 2037, win 1444, options [nop,nop,TS val 90157952 ecr 231241694], length 0
15:02:17.700029 IP n-cluster-192-168-3-62.43482 > m-cluster-192-168-8-151.12379: Flags [.], ack 4489, win 1274, options [nop,nop,TS val 90157984 ecr 231241725], length 0
15:02:18.212031 IP n-cluster-192-168-3-62.44878 > m-cluster-192-168-8-151.12379: Flags [.], ack 1, win 237, options [nop,nop,TS val 90158112 ecr 231241853], length 0
15:02:25.891977 IP n-cluster-192-168-3-62.60208 > m-cluster-192-168-8-151.6443: Flags [.], ack 114850, win 7846, options [nop,nop,TS val 90160032 ecr 231243786], length 0
15:02:33.059958 IP n-cluster-192-168-3-62.43462 > m-cluster-192-168-8-151.12379: Flags [.], ack 1, win 525, options [nop,nop,TS val 90161824 ecr 231238045], length 0
15:02:33.059992 IP n-cluster-192-168-3-62.43458 > m-cluster-192-168-8-151.12379: Flags [.], ack 1, win 540, options [nop,nop,TS val 90161824 ecr 231238045], length 0
15:02:34.723997 IP n-cluster-192-168-3-62.43474 > m-cluster-192-168-8-151.12379: Flags [.], ack 1, win 237, options [nop,nop,TS val 90162240 ecr 231238461], length 0
15:02:34.724043 IP n-cluster-192-168-3-62.43470 > m-cluster-192-168-8-151.12379: Flags [.], ack 1, win 299, options [nop,nop,TS val 90162240 ecr 231238461], length 0
15:02:34.724052 IP n-cluster-192-168-3-62.43450 > m-cluster-192-168-8-151.12379: Flags [.], ack 1, win 265, options [nop,nop,TS val 90162240 ecr 231238461], length 0
15:02:34.724082 IP n-cluster-192-168-3-62.43460 > m-cluster-192-168-8-151.12379: Flags [.], ack 1, win 254, options [nop,nop,TS val 90162240 ecr 231238461], length 0
15:02:35.363874 IP n-cluster-192-168-3-62.43466 > m-cluster-192-168-8-151.12379: Flags [.], ack 1, win 254, options [nop,nop,TS val 90162400 ecr 231238621], length 0
15:02:35.363878 IP n-cluster-192-168-3-62.43456 > m-cluster-192-168-8-151.12379: Flags [.], ack 1, win 254, options [nop,nop,TS val 90162400 ecr 231238621], length 0
15:02:35.363918 IP n-cluster-192-168-3-62.43468 > m-cluster-192-168-8-151.12379: Flags [.], ack 1, win 262, options [nop,nop,TS val 90162400 ecr 231238621], length 0
15:02:35.363924 IP n-cluster-192-168-3-62.43464 > m-cluster-192-168-8-151.12379: Flags [.], ack 1, win 254, options [nop,nop,TS val 90162400 ecr 231238621], length 0
15:02:40.099854 IP n-cluster-192-168-3-62.10250 > m-cluster-192-168-8-151.36528: Flags [.], ack 248, win 1366, options [nop,nop,TS val 90163584 ecr 231239890], length 0
15:02:43.051563 IP n-cluster-192-168-3-62.52032 > m-cluster-192-168-8-151.12379: Flags [S], seq 2051174372, win 29200, options [mss 1460,sackOK,TS val 90164321 ecr 0,nop,wscale 7], length 0
15:02:44.047885 IP n-cluster-192-168-3-62.52032 > m-cluster-192-168-8-151.12379: Flags [S], seq 2051174372, win 29200, options [mss 1460,sackOK,TS val 90164571 ecr 0,nop,wscale 7], length 0
15:02:46.051801 IP n-cluster-192-168-3-62.52032 > m-cluster-192-168-8-151.12379: Flags [S], seq 2051174372, win 29200, options [mss 1460,sackOK,TS val 90165072 ecr 0,nop,wscale 7], length 0
15:02:47.651796 IP n-cluster-192-168-3-62.43476 > m-cluster-192-168-8-151.12379: Flags [.], ack 2037, win 1444, options [nop,nop,TS val 90165472 ecr 231241694], length 0
15:02:47.779777 IP n-cluster-192-168-3-62.43482 > m-cluster-192-168-8-151.12379: Flags [.], ack 4489, win 1274, options [nop,nop,TS val 90165504 ecr 231241725], length 0
15:02:48.291784 IP n-cluster-192-168-3-62.44878 > m-cluster-192-168-8-151.12379: Flags [.], ack 1, win 237, options [nop,nop,TS val 90165632 ecr 231241853], length 0
15:02:50.059826 IP n-cluster-192-168-3-62.52032 > m-cluster-192-168-8-151.12379: Flags [S], seq 2051174372, win 29200, options [mss 1460,sackOK,TS val 90166074 ecr 0,nop,wscale 7], length 0
15:02:50.723773 IP n-cluster-192-168-3-62.45005 > m-cluster-192-168-8-151.bgp: Flags [P.], seq 173:192, ack 165, win 229, options [nop,nop,TS val 90166240 ecr 231243878], length 19: BGP
15:02:55.971713 IP n-cluster-192-168-3-62.60208 > m-cluster-192-168-8-151.6443: Flags [.], ack 114850, win 7846, options [nop,nop,TS val 90167552 ecr 231243786], length 0
15:02:58.083804 IP n-cluster-192-168-3-62.52032 > m-cluster-192-168-8-151.12379: Flags [S], seq 2051174372, win 29200, options [mss 1460,sackOK,TS val 90168080 ecr 0,nop,wscale 7], length 0
15:03:01.378591 IP n-cluster-192-168-3-62.44948 > m-cluster-192-168-8-151.9876: Flags [S], seq 2758156063, win 29200, options [mss 1460,sackOK,TS val 90168903 ecr 0,nop,wscale 7], length 0
15:03:02.375653 IP n-cluster-192-168-3-62.44948 > m-cluster-192-168-8-151.9876: Flags [S], seq 2758156063, win 29200, options [mss 1460,sackOK,TS val 90169153 ecr 0,nop,wscale 7], length 0
15:03:03.139760 IP n-cluster-192-168-3-62.43462 > m-cluster-192-168-8-151.12379: Flags [.], ack 1, win 525, options [nop,nop,TS val 90169344 ecr 231238045], length 0
15:03:03.139799 IP n-cluster-192-168-3-62.43458 > m-cluster-192-168-8-151.12379: Flags [.], ack 1, win 540, options [nop,nop,TS val 90169344 ecr 231238045], length 0
15:03:04.379599 IP n-cluster-192-168-3-62.44948 > m-cluster-192-168-8-151.9876: Flags [S], seq 2758156063, win 29200, options [mss 1460,sackOK,TS val 90169654 ecr 0,nop,wscale 7], length 0
15:03:04.803772 IP n-cluster-192-168-3-62.43474 > m-cluster-192-168-8-151.12379: Flags [.], ack 1, win 237, options [nop,nop,TS val 90169760 ecr 231238461], length 0
15:03:04.803830 IP n-cluster-192-168-3-62.43470 > m-cluster-192-168-8-151.12379: Flags [.], ack 1, win 299, options [nop,nop,TS val 90169760 ecr 231238461], length 0
15:03:04.803839 IP n-cluster-192-168-3-62.43450 > m-cluster-192-168-8-151.12379: Flags [.], ack 1, win 265, options [nop,nop,TS val 90169760 ecr 231238461], length 0
15:03:04.803875 IP n-cluster-192-168-3-62.43460 > m-cluster-192-168-8-151.12379: Flags [.], ack 1, win 254, options [nop,nop,TS val 90169760 ecr 231238461], length 0
15:03:05.443608 IP n-cluster-192-168-3-62.43456 > m-cluster-192-168-8-151.12379: Flags [.], ack 1, win 254, options [nop,nop,TS val 90169920 ecr 231238621], length 0
15:03:05.444866 IP n-cluster-192-168-3-62.43468 > m-cluster-192-168-8-151.12379: Flags [.], ack 1, win 262, options [nop,nop,TS val 90169920 ecr 231238621], length 0
15:03:05.444897 IP n-cluster-192-168-3-62.43464 > m-cluster-192-168-8-151.12379: Flags [.], ack 1, win 254, options [nop,nop,TS val 90169920 ecr 231238621], length 0
15:03:05.444909 IP n-cluster-192-168-3-62.43466 > m-cluster-192-168-8-151.12379: Flags [.], ack 1, win 254, options [nop,nop,TS val 90169920 ecr 231238621], length 0
15:03:08.387582 IP n-cluster-192-168-3-62.44948 > m-cluster-192-168-8-151.9876: Flags [S], seq 2758156063, win 29200, options [mss 1460,sackOK,TS val 90170656 ecr 0,nop,wscale 7], length 0
15:03:17.731362 IP n-cluster-192-168-3-62.43476 > m-cluster-192-168-8-151.12379: Flags [.], ack 2037, win 1444, options [nop,nop,TS val 90172992 ecr 231241694], length 0
15:03:17.859368 IP n-cluster-192-168-3-62.43482 > m-cluster-192-168-8-151.12379: Flags [.], ack 4489, win 1274, options [nop,nop,TS val 90173024 ecr 231241725], length 0
15:03:18.371463 IP n-cluster-192-168-3-62.44878 > m-cluster-192-168-8-151.12379: Flags [.], ack 1, win 237, options [nop,nop,TS val 90173152 ecr 231241853], length 0
15:03:22.142421 IP m-cluster-192-168-8-151.bgp > n-cluster-192-168-3-62.45005: Flags [FP.], seq 165:224, ack 173, win 227, options [nop,nop,TS val 231295436 ecr 90122536], length 59: BGP
15:03:22.142827 IP n-cluster-192-168-3-62.45005 > m-cluster-192-168-8-151.bgp: Flags [FP.], seq 192:230, ack 225, win 229, options [nop,nop,TS val 90174094 ecr 231295436], length 38: BGP
15:03:22.142889 IP m-cluster-192-168-8-151.bgp > n-cluster-192-168-3-62.45005: Flags [R], seq 3847466412, win 0, length 0
15:03:23.092078 IP n-cluster-192-168-3-62.52056 > m-cluster-192-168-8-151.12379: Flags [S], seq 1409323441, win 29200, options [mss 1460,sackOK,TS val 90174332 ecr 0,nop,wscale 7], length 0
15:03:23.092163 IP m-cluster-192-168-8-151.12379 > n-cluster-192-168-3-62.52056: Flags [S.], seq 447010540, ack 1409323442, win 28960, options [mss 1460,sackOK,TS val 231295674 ecr 90174332,nop,wscale 7], length 0
15:03:23.092388 IP n-cluster-192-168-3-62.52056 > m-cluster-192-168-8-151.12379: Flags [.], ack 1, win 229, options [nop,nop,TS val 90174332 ecr 231295674], length 0
15:03:23.094424 IP n-cluster-192-168-3-62.52056 > m-cluster-192-168-8-151.12379: Flags [P.], seq 1:158, ack 1, win 229, options [nop,nop,TS val 90174332 ecr 231295674], length 157
15:03:23.094460 IP m-cluster-192-168-8-151.12379 > n-cluster-192-168-3-62.52056: Flags [.], ack 158, win 235, options [nop,nop,TS val 231295674 ecr 90174332], length 0
15:03:23.094883 IP m-cluster-192-168-8-151.12379 > n-cluster-192-168-3-62.52056: Flags [P.], seq 1:506, ack 158, win 235, options [nop,nop,TS val 231295674 ecr 90174332], length 505
15:03:23.095091 IP n-cluster-192-168-3-62.52056 > m-cluster-192-168-8-151.12379: Flags [.], ack 506, win 237, options [nop,nop,TS val 90174332 ecr 231295674], length 0
15:03:23.192741 IP m-cluster-192-168-8-151.6443 > n-cluster-192-168-3-62.60208: Flags [P.], seq 114850:116298, ack 885, win 276, options [nop,nop,TS val 231295699 ecr 90122444], length 1448
15:03:23.192776 IP m-cluster-192-168-8-151.6443 > n-cluster-192-168-3-62.60208: Flags [.], seq 116298:120642, ack 885, win 276, options [nop,nop,TS val 231295699 ecr 90122444], length 4344
15:03:23.192784 IP m-cluster-192-168-8-151.6443 > n-cluster-192-168-3-62.60208: Flags [P.], seq 120642:123830, ack 885, win 276, options [nop,nop,TS val 231295699 ecr 90122444], length 3188
15:03:23.192877 IP m-cluster-192-168-8-151.6443 > n-cluster-192-168-3-62.60208: Flags [.], seq 123830:128174, ack 885, win 276, options [nop,nop,TS val 231295699 ecr 90122444], length 4344
15:03:23.193126 IP n-cluster-192-168-3-62.60208 > m-cluster-192-168-8-151.6443: Flags [.], ack 116298, win 7846, options [nop,nop,TS val 90174357 ecr 231295699], length 0
15:03:23.193168 IP m-cluster-192-168-8-151.6443 > n-cluster-192-168-3-62.60208: Flags [.], seq 128174:131070, ack 885, win 276, options [nop,nop,TS val 231295699 ecr 90174357], length 2896
15:03:23.193194 IP n-cluster-192-168-3-62.60208 > m-cluster-192-168-8-151.6443: Flags [.], ack 122090, win 7846, options [nop,nop,TS val 90174357 ecr 231295699], length 0
15:03:23.193301 IP n-cluster-192-168-3-62.60208 > m-cluster-192-168-8-151.6443: Flags [.], ack 123830, win 7846, options [nop,nop,TS val 90174357 ecr 231295699], length 0
15:03:23.193311 IP m-cluster-192-168-8-151.6443 > n-cluster-192-168-3-62.60208: Flags [P.], seq 131070:132370, ack 885, win 276, options [nop,nop,TS val 231295699 ecr 90174357], length 1300
15:03:23.193327 IP m-cluster-192-168-8-151.6443 > n-cluster-192-168-3-62.60208: Flags [P.], seq 132370:142688, ack 885, win 276, options [nop,nop,TS val 231295699 ecr 90174357], length 10318
15:03:23.193352 IP n-cluster-192-168-3-62.60208 > m-cluster-192-168-8-151.6443: Flags [.], ack 128174, win 7846, options [nop,nop,TS val 90174357 ecr 231295699], length 0
15:03:23.193487 IP n-cluster-192-168-3-62.60208 > m-cluster-192-168-8-151.6443: Flags [.], ack 131070, win 7846, options [nop,nop,TS val 90174357 ecr 231295699], length 0
```

**Comment by gogeof** [comment]
when node(n-cluster-192-168-3-62) can't connect to apiserver, I use kubectl get information is ok

**Comment by lavalamp** [comment]
cc @yliaog

**Comment by yliaog** [comment]
please try  "kubectl --v 10", also it seems it cannot connect to api server at all at the network level.

**Comment by gogeof** [comment]
@lavalamp @yliaog thanks for response
This cluster has been delete, I'm trying to make the problem reappear. After I success, I will add more detail log by run "kubectl --v 10".
