### ISSUE TITLE
I want to use service in pod to connect   Externel Mysql but  not use

### ISSUE THREAD

**Issue by Rogary** [kubernetes/kubernetes#70945]
Hello ,I want to use service in pod to connect   Externel Mysql but  not use

in kubernetes i use calico  i want to use service and endpoint  to connect a externel mysql like this 
```yml
kind: Endpoints
apiVersion: v1
metadata:
  name: mysql-endpoint
  namespace: default
subsets:
  - addresses:
      - ip: 10.111.121.2 # this is externel mysql ip address
    ports:
      - port: 3306
---------
apiVersion: v1
kind: Service
metadata:
  name: mysql-endpoint
  namespace: default
spec:
  ports:
    - port: 3306
```

now i have a Service like this 
```
Name:              mysql-endpoint
Namespace:         default
Labels:            <none>
Annotations:       kubectl.kubernetes.io/last-applied-configuration:
                     {"apiVersion":"v1","kind":"Service","metadata":{"annotations":{},"name":"mysql-endpoint","namespace":"default","selfLink":"/api/v1/namespa...
Selector:          <none>
Type:              ClusterIP
IP:                10.99.53.23
Port:              <unset>  3306/TCP
TargetPort:        3306/TCP
Endpoints:         10.111.121.2:3306
Session Affinity:  None
```

## Expected Behavior 
In hope that i can use clusterIp + port to connect Externel mysql  in pod 

## Current Behavior 
in  cluster  node  i can telnet  clusterIp port  this Service ,
```
# telnet 10.99.53.23 3306
Trying 10.99.53.23...
Connected to 10.99.53.23.
Escape character is '^]'.
```
but in pod i can't  ,
```
# nc -vzw 10 10.99.53.23 3306
nc: 10.99.53.23 (10.99.53.23:3306): Operation timed out
```
## Possible Solution
i try to modify NetworkPolicy  allow-all 
```
kubectl apply -f - <<EOF
apiVersion: networking.k8s.io/v1
kind: NetworkPolicy
metadata:
  name: allow-all
spec:
  podSelector: {}
  egress:
  - {}
  policyTypes:
  - Egress
EOF
------------------
kubectl create -f - <<EOF
apiVersion: networking.k8s.io/v1
kind: NetworkPolicy
metadata:
  name: allow-all-1
spec:
  podSelector: {}
  ingress:
  - {}
EOF
```
but not use 
then 
i use tcpdump  in mysql node  i got this 
```
15:59:33.043557 IP 192.1.1.24.36009 > nsxjapptst01.cs1cloud.internal.mysql: Flags [S], seq 2624077831, win 28000, options [mss 1400,sackOK,TS val 1060556222 ecr 0,nop,wscale 7], length 0
15:59:33.043614 IP nsxjapptst01.cs1cloud.internal.mysql > 192.1.1.24.36009: Flags [S.], seq 195091831, ack 2624077832, win 28960, options [mss 1460,sackOK,TS val 1061852098 ecr 1060556222,nop,wscale 7], length 0
```
and tcpdump in pod node 
```
16:35:13.452727 IP 192.1.1.24.42053 > nsxjapptst01.cs1cloud.internal.mysql: Flags [S], seq 2971838493, win 28000, options [mss 1400,sackOK,TS val 1062696641 ecr 0,nop,wscale 7], length 0
16:35:14.455413 IP 192.1.1.24.42053 > nsxjapptst01.cs1cloud.internal.mysql: Flags [S], seq 2971838493, win 28000, options [mss 1400,sackOK,TS val 1062697644 ecr 0,nop,wscale 7], length 0
```
**Package has Already arrived to mysql node ,but   NO Package Return** 

192.1.1.24  this is my pod IP but mysql node has no route to 192.1.0.0/16  so package can't return 

so i configed calico ip pool 
like this 
https://docs.projectcalico.org/master/usage/external-connectivity
```
cat << EOF | calicoctl apply -f -
- apiVersion: projectcalico.org/v3
  kind: IPPool
  metadata:
    name: default-ipv4-ippool
  spec:
    cidr: 192.168.0.0/16
    ipipMode: Always
    natOutgoing: true
EOF
```
but it still not work  
in mysql node tcpdump not change

How can i Connect mysql in pod?

@kubernetes/sig-network-feature-requests
/sig network

**Comment by yanghaichao12** [comment]
have you configured BGP peer？ how about this problem now？

**Comment by Rogary** [comment]
@yanghaichao12  I change network plugin from calico  to flannel so  externel service  worked just config  endport and service 

i guess  if   calico  want use externel service A  in Host H ,  Host H's netrork  must support BGP

**Comment by yanghaichao12** [comment]
is the mysql node in the same subnet or not ?later i'll setup a cluster and test it as yours

**Comment by Rogary** [comment]
cluster node  is the same subnet   and have network access to the Kubernetes nodes
i use tcpdump in mysql node i got this
```
15:59:33.043557 IP 192.1.1.24.36009 > nsxjapptst01.cs1cloud.internal.mysql: Flags [S], seq 2624077831, win 28000, options [mss 1400,sackOK,TS val 1060556222 ecr 0,nop,wscale 7], length 0
15:59:33.043614 IP nsxjapptst01.cs1cloud.internal.mysql > 192.1.1.24.36009: Flags [S.], seq 195091831, ack 2624077832, win 28960, options [mss 1460,sackOK,TS val 1061852098 ecr 1060556222,nop,wscale 7], length 0
```
but 
```192.1.1.24``` this is my pod IP but mysql node has no route to 192.1.0.0/16 so package can't return

**Comment by yanghaichao12** [comment]
hi，i make testing，below is my service and endpoints：
`{
    "apiVersion": "v1",
    "kind": "Service",
    "metadata": {
        "creationTimestamp": "2019-01-24T10:06:55Z",
        "name": "mysql-endpoint",
        "namespace": "default",
        "resourceVersion": "57065",
        "selfLink": "/api/v1/namespaces/default/services/mysql-endpoint",
        "uid": "c76ed2ee-1fbf-11e9-a7e5-fa163e87720d"
    },
    "spec": {
        "clusterIP": "10.254.179.105",
        "ports": [
            {
                "port": 2222,
                "protocol": "TCP",
                "targetPort": 2222
            }
        ],
        "sessionAffinity": "None",
        "type": "ClusterIP"
    },
    "status": {
        "loadBalancer": {}
    }
}`

`{
    "apiVersion": "v1",
    "kind": "Endpoints",
    "metadata": {
        "creationTimestamp": "2019-01-24T10:05:31Z",
        "name": "mysql-endpoint",
        "namespace": "default",
        "resourceVersion": "57020",
        "selfLink": "/api/v1/namespaces/default/endpoints/mysql-endpoint",
        "uid": "953c4edb-1fbf-11e9-a7e5-fa163e87720d"
    },
    "subsets": [
        {
            "addresses": [
                {
                    "ip": "10.46.177.64"
                }
            ],
            "ports": [
                {
                    "port": 22,
                    "protocol": "TCP"
                }
            ]
        }
    ]
}`

i enter one pod and exec telnet：
![image](https://user-images.githubusercontent.com/20693362/51673861-13797700-200a-11e9-8a46-3b83a065fcec.png)
everything is okay
that‘s my tcpdump：
![image](https://user-images.githubusercontent.com/20693362/51673947-44f24280-200a-11e9-8ac0-59c48dfedee1.png)
10.46.177.110  is NodeIp,so i think maybe something is wrong with your iptables, and this is mine:
![image](https://user-images.githubusercontent.com/20693362/51674025-82ef6680-200a-11e9-95a7-a4d96de0ed75.png)

i think perhaps you should check it.

**Comment by Rogary** [comment]
@yanghaichao12  thank you test 
i will check it again in a new env

**Comment by freehan** [comment]
@lzang

**Comment by freehan** [comment]
Ping

**Comment by freehan** [comment]
reopen if needed
