### ISSUE TITLE
skydns stops working randomly

### ISSUE THREAD

**Issue by eknkc** [kubernetes/kubernetes#22161]
Hi,

Recenly, one of our clusters on GCE (1.1.7) started having intermittent connection issues. It turned out to be dns resolver issues. Here are my findings during a recent occurance:
- Pods can not resolve anything.
- If I remove skydns ip from /etc/resolv.conf, they work fine. (secondary ip is 169.254.169.254)
- skydns logs `2016/02/29 04:54:22 skydns: failure to forward request "read udp 169.254.169.254:53: i/o timeout"` lines during these outages.
- Our apps perform a lot of requests on several google apis and facebook apis. These would create a lot of dns requests.
- Using default config provided by google cloud.
- Tried replacing all nodes, which effectively restarted every single pod and this did not resolve anything.
- Created another cluster while this was happening, it came up with the same issues. This would make me believe that the dns server was down but only skydns was failing at this point.

I thought maybe the dns server was throttling our requests. This would make sense that multiple clusters failed at the same time. But being able to directly query `169.254.169.254` from pods seems to eliminate this.

So, for some reason, skydns starts failing and recovers by itself. On the host machines everything works perfectly fine as they query the GCE dns server directly.

What could be the reason / solution in this?

Thanks!

**Comment by thockin** [comment]
This is not something we have seen before - even running DNS benchmarks.
Is it something you can trigger?

If it happens again, can you `tcpdump -i cbr0  port 53` and capture some
failures?  I would also like to see you `kubectl exec` into the skydns
container `kubectl --namespace=kube-system exec -ti kube-dns-v10-di5zy -c
skydns sh` (sub in your own DNS pod name) and `nslookup google.com`.

**Comment by maclof** [comment]
I experience the same issue quite a lot, although I use bare metal servers and not GCE.

I used to default all of the pods on my cluster to use ClusterFirst for DNS, but due to this issue I had to change it to use a local dnsmasq server instead.

This is the log from yesterday:
```
2016/02/28 17:42:56 skydns: failure to forward request "read udp 8.8.8.8:53: i/o timeout"
2016/02/28 18:40:59 skydns: failure to forward request "read udp 8.8.8.8:53: i/o timeout"
2016/02/28 18:40:59 skydns: failure to forward request "read udp 8.8.8.8:53: i/o timeout"
2016/02/28 18:57:41 skydns: failure to forward request "read udp 8.8.8.8:53: i/o timeout"
2016/02/28 18:58:09 skydns: failure to forward request "read udp 8.8.8.8:53: i/o timeout"
2016/02/28 19:40:13 skydns: failure to forward request "read udp 8.8.8.8:53: i/o timeout"
2016/02/28 19:49:16 skydns: failure to forward request "read udp 8.8.8.8:53: i/o timeout"
2016/02/28 20:00:50 skydns: failure to forward request "read udp 8.8.8.8:53: i/o timeout"
2016/02/28 20:06:26 skydns: failure to forward request "read udp 8.8.8.8:53: i/o timeout"
2016/02/28 20:20:38 skydns: failure to forward request "read udp 8.8.8.8:53: i/o timeout"
```

I'll also try to get some tcpdump data for this.

**Comment by thockin** [comment]
Interesting.  Thanks.  Data will help.

**Comment by ArtfulCoder** [comment]
Are you using user space kubeproxy ?

**Comment by maclof** [comment]
I'm using iptables proxy with v1.2.0-alpha.3

**Comment by ArtfulCoder** [comment]
You are probably using an older version of skydns too. It would help a bit to try upgrading it to the version that we now use on HEAD. Also, we have moved to a configuration where skydns is the only DNS in /etc:resolv.conf
It seems you are on a version where you have 3 name servers in /etc/resolv.conf ?

**Comment by maclof** [comment]
Sorry actually my master is v1.2.0-alpha.3 but my kubelets run v1.2.0-alpha.7.

Inside /etc/resolv.conf there is for example:
```
search default.svc.cluster.local svc.cluster.local cluster.local
nameserver 172.16.0.2
options ndots:5
```

Afaik I'm running the latest version of the skydns rc which uses the image gcr.io/google_containers/skydns:2015-10-13-8c72f8c

**Comment by ArtfulCoder** [comment]
Why is skydns trying 8.8.8.8. Is that a name server on the node's etc/resolv ?

**Comment by maclof** [comment]
Yes that's one of the nameservers in the node's /etc/resolv.conf. I've actually recently had to switch all of the nodes to use a local dnsmasq server because of some requests to Google DNS taking 5~ seconds to complete.

**Comment by ArtfulCoder** [comment]
One possibility is that skydns is experiencing slowdown because google DNS is slow (or the path to it from your cluster is slow), holding up skydns threads.. 

1. What is the etc/resolv file on the node ?
2. what are the command line params for your skydns container ? I am looking for timeout flag, if any.
3. Could you try having 8.8.8.8 as the last name server on your node's etc/resolv?

**Comment by maclof** [comment]
I'm using this rc: https://github.com/kubernetes/kubernetes/blob/master/cluster/addons/dns/skydns-rc.yaml.in

I'm using a local dnsmasq server now to fix the issue with Google DNS so I'll only have a single 192.168.0.x resolver in /etc/resolv.conf for now and I'll see how it goes.

**Comment by ArtfulCoder** [comment]
Is the dnsmasq server on the same node as skydns ?

**Comment by aliteff** [comment]
I believe we are experiencing a similar problem to this ... see here #22823

**Comment by girishkalele** [comment]
@maclof 

I looked at the tcpdump captured from cbr0 - don't understand the duplicate requests from different IPs, probably UDP packet duplication. 192.168.2.1:44204 requests a lookup for db.ahead4.com and there is a duplicate request from 192.168.0.2. You see later even 172.16.0.2 replies back to the originating pod, which is not expected.

`172.16.0.2.domain > 192.168.2.1.44204` ???

```
20:09:07.489968 IP 192.168.2.1.44204 > 192.168.2.0.domain: 42592+ A? db.ahead4.com. (31)
20:09:07.490000 IP 192.168.0.2.44204 > 192.168.2.0.domain: 42592+ A? db.ahead4.com. (31)
20:09:07.490036 IP 192.168.2.1.44204 > 192.168.2.0.domain: 13160+ AAAA? db.ahead4.com. (31)
20:09:07.490047 IP 192.168.0.2.44204 > 192.168.2.0.domain: 13160+ AAAA? db.ahead4.com. (31)
20:09:07.490435 IP 192.168.2.0.48681 > google-public-dns-a.google.com.domain: 42592+ A? db.ahead4.com. (31)
20:09:07.490603 IP 192.168.2.0.60182 > google-public-dns-a.google.com.domain: 13160+ AAAA? db.ahead4.com. (31)
20:09:07.495025 IP google-public-dns-a.google.com.domain > 192.168.2.0.48681: 42592 1/0/0 A 51.254.238.141 (47)
20:09:07.495132 IP 192.168.2.0.domain > 192.168.2.1.44204: 42592 1/0/0 A 51.254.238.141 (47)
20:09:07.495143 IP 172.16.0.2.domain > 192.168.2.1.44204: 42592 1/0/0 A 51.254.238.141 (47)
20:09:07.495178 IP 192.168.2.0.domain > 192.168.2.1.44204: 42592 1/0/0 A 51.254.238.141 (47)
20:09:07.495184 IP 172.16.0.2.domain > 192.168.2.1.44204: 42592 1/0/0 A 51.254.238.141 (47)
20:09:07.495740 IP google-public-dns-a.google.com.domain > 192.168.2.0.60182: 13160 0/1/0 (85)
20:09:07.495841 IP 192.168.2.0.domain > 192.168.2.1.44204: 13160 0/1/0 (85)
20:09:07.495852 IP 172.16.0.2.domain > 192.168.2.1.44204: 13160 0/1/0 (85)
20:09:07.495887 IP 192.168.2.0.domain > 192.168.2.1.44204: 13160 0/1/0 (85)
20:09:07.495892 IP 172.16.0.2.domain > 192.168.2.1.44204: 13160 0/1/0 (85)
```

**Comment by girishkalele** [comment]
@eknkc @maclof @aliteff 

For the 1.3 release, there has been a major change in the kube DNS implemention.
Check the saltbase/salt/kube-dns/skydns-rc.yaml file in master for the new pod definition and containers used. For older releases, it should be possible with a little surgery and know-how to edit the skydns pod spec with the new one from 1.3.
