### ISSUE TITLE
agnhost netexec http dialer resolves hostnames and sets host: field to IP address

### ISSUE THREAD

**Issue by andreaskaris** [kubernetes/kubernetes#109234]
### What happened?

agnhost netexec http dialer resolves hostnames and sets host: field to IP address

netexec resolves here:
https://github.com/kubernetes/kubernetes/blob/master/test/images/agnhost/netexec/netexec.go#L380
with: https://pkg.go.dev/net#ResolveTCPAddr

But then when calling the actual URL, the host field is set to the IP address, and not to the URL that was used:
https://github.com/kubernetes/kubernetes/blob/master/test/images/agnhost/netexec/netexec.go#L425

~~~
[akaris@linux egressip (main)]$ tshark -r req.pcap -O http frame.number == 13
(...)
Transmission Control Protocol, Src Port: 40884, Dst Port: 80, Seq: 1, Ack: 1, Len: 106
Hypertext Transfer Protocol
    GET //clientip HTTP/1.1\r\n
        [Expert Info (Chat/Sequence): GET //clientip HTTP/1.1\r\n]
            [GET //clientip HTTP/1.1\r\n]
            [Severity level: Chat]
            [Group: Sequence]
        Request Method: GET
        Request URI: //clientip
        Request Version: HTTP/1.1
    Host: <x.x.x.x>:80\r\n                  # <----- should be the actual "host" value
    User-Agent: Go-http-client/1.1\r\n
    Accept-Encoding: gzip\r\n
    \r\n
    [Full request URI: http://<x.x.x.x>:80//clientip]
    [HTTP request 1/1]
~~~

That's problematic when calling actual web servers with virtual hosts:
~~~
curl localhost/dial?host=myvirtualserver.example.com&port=80&request=/clientip&protocol=http
~~~

### What did you expect to happen?

The host: field shall be set to the actual url, not to the ip

### How can we reproduce it (as minimally and precisely as possible)?

see above

### Kubernetes version

latest

### Cloud provider

all

### OS version

<details>

```console
# On Linux:
$ cat /etc/os-release
# paste output here
$ uname -a
# paste output here

# On Windows:
C:\> wmic os get Caption, Version, BuildNumber, OSArchitecture
# paste output here
```

</details>

### Install tools

<details>

</details>

### Container runtime (CRI) and version (if applicable)

<details>

</details>

### Related plugins (CNI, CSI, ...) and versions (if applicable)

<details>

</details>

**Comment by andreaskaris** [comment]
Yeah I was actually trying to run a /dial against one of our own OpenShift routes for a downstream test and for obvious reasons, that failed. I worked around this with something else and I do not need this right now, but I think it would be nice to be able to query our own routes (which are obviously virtual hosts). So even if I do not need it now, I think it makes sense to at least have a switch to disable premature DNS resolution and instead have the http.Get() request handle the resolution and correctly populate the Host: field.

**Comment by aojea** [comment]
/sig testing
/sig network


but why do you do 
```
curl localhost/dial?host=myvirtualserver.example.com&port=80&request=/clientip&protocol=http
```

instead of 
```
curl myvirtualserver.example.com
```
directly?

**Comment by andreaskaris** [comment]
It was meant as a test for the OpenShift EgressIP feature.

Sorry for the bad example above, I was of course not just calling localhost in the tests where I had thought I needed it.

I rather had something like this in mind (and actually would still like it to work for my tests):
* Caller -> `curl <url of service endpoint>/dial?host=myvirtualserver.example.com&port=80&request=/clientip&protocol=http`
* Pod behind service endpoint will run: `http.Get myvirtualserver.example.com:80/clientip` (or whatever other request for that matter)

**Comment by thockin** [comment]
Who owns agnhost?  I legit don't know :)

**Comment by dims** [comment]
@claudiubelu has been taking care of agnhost

**Comment by thockin** [comment]
ping @aojea We use this in a lot of sig-net too

**Comment by aojea** [comment]
> ping @aojea We use this in a lot of sig-net too

yes, we do use it a lot in sig-net, and I'm reviewing all the network changes in agnhost, but I personally don't like add a feature if we don't exercise it ... moreover, I'd not like to export the e2e framework or the agnost image so external components depend on them ... we can't offer guarantees and is easy to break thins here

**Comment by andreaskaris** [comment]
We can close this, I really don't insist. I don't need this change after all.

**Comment by aojea** [comment]
Thanks for understanding, we can always add it if we test that functionality in the future in kubernetes

/close
