### ISSUE TITLE
MIssing iptables rules on the nodes for Service type=LoadBalancer in AWS

### ISSUE THREAD

**Issue by icicimov** [kubernetes/kubernetes#44078]
**Is this a request for help?** (If yes, you should use our troubleshooting guide and community support channels, see http://kubernetes.io/docs/troubleshooting/.): No

**What keywords did you search in Kubernetes issues before filing this one?** (If you have found any duplicates, you should instead reply there.): elb aws iptables loadbalancer

---

**Is this a BUG REPORT or FEATURE REQUEST?** (choose one): BUG REPORT

**Kubernetes version** (use `kubectl version`): 1.5.6

**Environment**:
- **Cloud provider or hardware configuration**: AWS
- **OS** (e.g. from /etc/os-release): Debian GNU/Linux 8.6 (jessie)
- **Kernel** (e.g. `uname -a`): 4.4.41-k8s
- **Install tools**: kops
- **Others**:

**What happened**:
The AWS ELB created as external LoadBalancer for the service could not access the service port (in this case TCP port 80) on the k8s worker nodes due to missing iptables rules thus rendering the ELB backends as "OutOfService". 

**What you expected to happen**:
The service to be accessible from other nodes in the VPC external to the k8s cluster via the ELB.

**How to reproduce it** (as minimally and precisely as possible):
Create Deployment and Service as shown below (the app simply returns the pod hostname):

```
---
apiVersion: extensions/v1beta1
kind: Deployment
metadata:
  name: nodejs-app-deployment
  namespace: default
  labels:
    app: nodejs-app
spec:
  strategy:
    type: Recreate
  template:
    metadata:
      labels:
        app: nodejs-app
        tier: frontend
    spec:
      containers:
      - name: nodejs-app
        image: igoratencompass/nodejs-app:latest
        ports:
        - containerPort: 8080
          name: nodejs-app
        resources:
          limits:
            cpu: "1"
            memory: 256Mi
          requests:
            cpu: "1"
            memory: 64Mi

---
apiVersion: v1
kind: Service
metadata:
  name: nodejs-app-svc
  namespace: default
  labels:
    name: nodejs-app
  annotations:
    service.beta.kubernetes.io/aws-load-balancer-internal: 0.0.0.0/0
spec:
  type: LoadBalancer
  ports:
    - port: 80
      targetPort: 8080
      protocol: TCP
  selector:
    # This needs to match the selector in the RC/Deployment
    app: nodejs-app

---
apiVersion: autoscaling/v1
kind: HorizontalPodAutoscaler
metadata:
  name: nodejs-app-autoscaler
  namespace: default
spec:
  scaleTargetRef:
    apiVersion: extensions/v1beta1
    kind: Deployment
    name: nodejs-app-deployment
  minReplicas: 1
  maxReplicas: 6
  targetCPUUtilizationPercentage: 80
```

This should create an internal ELB in the VPC k8s is running in with backend `HTTP:80/health` health check point. The ELB will show all the backends, the k8s worker nodes, as `OutOfService`.

**Anything else we need to know**:
On the node where the nodejs-app container was running (`10.99.7.148`) I could see the ELB health checks are failing:

```
03:29:28.753228 IP 10.99.7.204.17280 > 10.99.7.148.80: Flags [S], seq 3977567752, win 26883, options [mss 8961,sackOK,TS val 22755710 ecr 0,nop,wscale 8], length 0
03:29:28.753282 IP 10.99.7.148.80 > 10.99.7.204.17280: Flags [R.], seq 0, ack 3977567753, win 0, length 0
03:29:29.068063 IP 10.99.6.168.58367 > 10.99.7.148.80: Flags [S], seq 4082957956, win 26883, options [mss 8961,sackOK,TS val 22756713 ecr 0,nop,wscale 8], length 0
03:29:29.068122 IP 10.99.7.148.80 > 10.99.6.168.58367: Flags [R.], seq 0, ack 4082957957, win 0, length 0
03:29:29.384023 IP 10.99.8.76.28018 > 10.99.7.148.80: Flags [S], seq 2785866742, win 26883, options [mss 8961,sackOK,TS val 22754944 ecr 0,nop,wscale 8], length 0
03:29:29.384104 IP 10.99.7.148.80 > 10.99.8.76.28018: Flags [R.], seq 0, ack 2785866743, win 0, length 0
```

and the tcpdump shows that the k8s node was resetting the connections. Looking at the `iptables` rules on this node I could see the relevant rules in the `nat` table:

```
-A KUBE-SERVICES -d 100.65.223.12/32 -p tcp -m comment --comment "default/nodejs-app-svc: cluster IP" -m tcp --dport 80 -j KUBE-SVC-J7GMV6S4AQU7TVTG

-A KUBE-SVC-J7GMV6S4AQU7TVTG -m comment --comment "default/nodejs-app-svc:" -j KUBE-SEP-TGXQJ6YFKHFU373D

-A KUBE-NODEPORTS -p tcp -m comment --comment "default/nodejs-app-svc:" -m tcp --dport 31154 -j KUBE-MARK-MASQ
-A KUBE-NODEPORTS -p tcp -m comment --comment "default/nodejs-app-svc:" -m tcp --dport 31154 -j KUBE-SVC-J7GMV6S4AQU7TVTG

-A KUBE-SEP-TGXQJ6YFKHFU373D -s 100.104.0.9/32 -m comment --comment "default/nodejs-app-svc:" -j KUBE-MARK-MASQ
-A KUBE-SEP-TGXQJ6YFKHFU373D -p tcp -m comment --comment "default/nodejs-app-svc:" -m tcp -j DNAT --to-destination 100.104.0.9:8080

-N KUBE-MARK-MASQ
-A KUBE-MARK-MASQ -j MARK --set-xmark 0x4000/0x4000
```

So, there was a rule to accept traffic for the internal service VIP address `100.65.223.12` on TCP port `80`:

```
-A KUBE-SERVICES -d 100.65.223.12/32 -p tcp -m comment --comment "default/nodejs-app-svc: cluster IP" -m tcp --dport 80 -j KUBE-SVC-J7GMV6S4AQU7TVTG
```

and process it further down the chain so it ends up on the kube-proxy internal service port `31154` from where it would be sent to the local container's port `8080` and ip of `100.104.0.9` which is the node-js container/pod it self.

So, after adding the following iptables rules on each of the three k8s nodes:

```
iptables -t nat -A KUBE-SERVICES -d 10.99.7.148/32 -p tcp -m comment --comment "default/nodejs-app-svc: cluster IP" -m tcp --dport 80 -j KUBE-SVC-J7GMV6S4AQU7TVTG
iptables -t nat -A KUBE-SERVICES -d 10.99.6.134/32 -p tcp -m comment --comment "default/nodejs-app-svc: cluster IP" -m tcp --dport 80 -j KUBE-SVC-J7GMV6S4AQU7TVTG
iptables -t nat -A KUBE-SERVICES -d 10.99.8.189/32 -p tcp -m comment --comment "default/nodejs-app-svc: cluster IP" -m tcp --dport 80 -j KUBE-SVC-J7GMV6S4AQU7TVTG
```

I was able to confirm the health check probes from the ELB were now successful for this node:

```
03:45:28.753455 IP 10.99.7.204.17792 > 10.99.7.148.80: Flags [P.], seq 3331596860:3331596975, ack 1068689986, win 126, options [nop,nop,TS val 22995710 ecr 65504549], length 115: HTTP: GET /health HTTP/1.1
03:45:28.754824 IP 10.99.7.148.80 > 10.99.7.204.17792: Flags [P.], seq 1:169, ack 115, win 57, options [nop,nop,TS val 65512050 ecr 22995710], length 168: HTTP: HTTP/1.1 200 OK
03:45:28.755194 IP 10.99.7.204.17792 > 10.99.7.148.80: Flags [.], ack 169, win 131, options [nop,nop,TS val 22995710 ecr 65512050], length 0
03:45:29.067369 IP 10.99.6.168.58895 > 10.99.7.148.80: Flags [P.], seq 2737267215:2737267330, ack 1722668984, win 126, options [nop,nop,TS val 22996713 ecr 65504628], length 115: HTTP: GET /health HTTP/1.1
03:45:29.067718 IP 10.99.7.148.80 > 10.99.6.168.58895: Flags [P.], seq 1:169, ack 115, win 57, options [nop,nop,TS val 65512128 ecr 22996713], length 168: HTTP: HTTP/1.1 200 OK
03:45:29.068442 IP 10.99.6.168.58895 > 10.99.7.148.80: Flags [.], ack 169, win 131, options [nop,nop,TS val 22996714 ecr 65512128], length 0
03:45:29.384588 IP 10.99.8.76.28542 > 10.99.7.148.80: Flags [P.], seq 2567996948:2567997063, ack 3710232123, win 126, options [nop,nop,TS val 22994944 ecr 65504707], length 115: HTTP: GET /health HTTP/1.1
03:45:29.384927 IP 10.99.7.148.80 > 10.99.8.76.28542: Flags [P.], seq 1:169, ack 115, win 57, options [nop,nop,TS val 65512207 ecr 22994944], length 168: HTTP: HTTP/1.1 200 OK
03:45:29.385657 IP 10.99.8.76.28542 > 10.99.7.148.80: Flags [.], ack 169, win 131, options [nop,nop,TS val 22994945 ecr 65512207], length 0
```

and it was put `InService` on the ELB.

**Comment by cmluciano** [comment]
@kubernetes/sig-aws-misc
