### ISSUE TITLE
apiserver 1.5+ not responding to SSLv3 client hello

### ISSUE THREAD

**Issue by dragorosson** [kubernetes/kubernetes#40850]
**Is this a request for help?** (If yes, you should use our troubleshooting guide and community support channels, see http://kubernetes.io/docs/troubleshooting/.): Kind of.

**What keywords did you search in Kubernetes issues before filing this one?** (If you have found any duplicates, you should instead reply there.): haproxy, TLS, SSL, client hello, server hello, TLS handshake timeout

---

**Is this a BUG REPORT or FEATURE REQUEST?** (choose one): BUG REPORT

**Kubernetes version** (use `kubectl version`): 1.5.0, 1.5.1, 1.5.2, 1.5.3-beta.0, 1.6.0-alpha.1

**Environment**:
- **Cloud provider or hardware configuration**: OpenStack
- **OS** (e.g. from /etc/os-release): Fedora 24 (Cloud Edition)
- **Kernel** (e.g. `uname -a`): Linux 4.8.15-200.fc24.x86_64 #1 SMP Thu Dec 15 23:09:22 UTC 2016 x86_64 x86_64 x86_64 GNU/Linux
- **Install tools**: OpenStack Heat, cloud-init
- **Others**: Non-k8s-managed HAProxy load balancer (no HTTPS termination) in front of the kubernetes API with attached floating IP

**What happened**:

Any kubectl commands that go through the HAProxy LB result in "Unable to connect to the server: net/http: TLS handshake timeout". Using curl directly shows curl getting to the "SSLv3, TLS handshake, Client hello (1):" step, and then waiting for "SSLv3, TLS handshake, Server hello (2):", which never comes.

The interesting thing is, this only happens when making a request through the LB (via the floating IP) from outside one of the nodes in the kubernetes cluster, when kube-apiserver is v1.5+. That is,

- When making a request to kube-apiserver v1.4 (tested with 1.4.4, 1.4.8), it works.
- Or, when the floating IP is associated directly with the master node (not going through the LB), it works.
- Or, when making a request from within (logged into) a master/minion to the LB, it works.

**What you expected to happen**: I expected kubectl to be able to communicate with the apiserver.

**How to reproduce it** (as minimally and precisely as possible):

- Create a vm and set up devstack (http://docs.openstack.org/developer/devstack/) with LBaaS v2 enabled (http://docs.openstack.org/developer/devstack/guides/devstack-with-lbaas-v2.html)
- Create a neutron network and subnet.
- Create neutron port on that network.
- Create a nova server, specifying the port created previously.
- Set up kubernetes on the server with TLS enabled.
- Create a neutron lbaas v2 load balancer on the subnet created previously.
- Create a pool for the load balancer.
- Add a lbaas v2 member to the pool, using the IP of the port created previously and the port number the kubernetes API will be listening on.
- Create a lbaas v2 listener for the load balancer, specifying HTTPS (not HTTPS_terminated) and the port the kubernetes API will be listening on.
- Create a floating IP on the "public" neutron network automatically created by devstack and associate it with the VIP port of the load balancer.
- Send a request to the API using curl (`curl -vv -k https://{floating IP}:{k8s secure port}`)

**Anything else do we need to know**:

I have used openssl's s_server to listen on the master and I can communicate both ways, so I'm pretty sure this isn't a networking problem, but some odd way that HAProxy and kube-apiserver are interacting with each other, since it works with older versions of kube-apiserver and also with requests through HAProxy that originate from within the master node.

I've captured some packets.

Client side, going through the LB's floating IP:

```
04:42:09.923895 IP 172.24.4.1.44132 > 172.24.4.5.6443: Flags [S], seq 1237812882, win 29200, options [mss 1460,nop,wscale 10], length 0
04:42:09.924381 IP 172.24.4.5.6443 > 172.24.4.1.44132: Flags [S.], seq 175254992, ack 1237812883, win 29200, options [mss 1460,nop,wscale 4], length 0
04:42:09.924423 IP 172.24.4.1.44132 > 172.24.4.5.6443: Flags [.], ack 1, win 29, length 0
04:42:09.924915 IP 172.24.4.1.44132 > 172.24.4.5.6443: Flags [P.], seq 1:274, ack 1, win 29, length 273
04:42:09.924993 IP 172.24.4.5.6443 > 172.24.4.1.44132: Flags [.], ack 274, win 1892, length 0
04:42:09.947559 IP 172.24.4.5.6443 > 172.24.4.1.44132: Flags [P.], seq 1461:1749, ack 274, win 1892, length 288
04:42:09.947580 IP 172.24.4.1.44132 > 172.24.4.5.6443: Flags [.], ack 1, win 30, length 0
# Hangs at this point
```

Server side, going through the LB's floating IP:

```
node = be6ea502-7610-4d32-9aab-84c44a269292-master-0.sun-sr-https
LB = 10.0.0.3
10:10:50.019717 IP LB.54340 > node: Flags [S], seq 2609801294, win 29200, options [mss 1460,nop,wscale 4], length 0
10:10:50.019809 IP node > LB.54340: Flags [S.], seq 2355417994, ack 2609801295, win 28200, options [mss 1410,nop,wscale 7], length 0
10:10:50.020042 IP LB.54340 > node: Flags [.], ack 1, win 1825, length 0
10:10:50.020462 IP LB.54340 > node: Flags [P.], seq 1:274, ack 1, win 1825, length 273
10:10:50.020492 IP node > LB.54340: Flags [.], ack 274, win 229, length 0
10:10:50.042316 IP node > LB.54340: Flags [P.], seq 1:1749, ack 274, win 229, length 1748
10:10:50.042518 IP LB.54340 > node: Flags [.], ack 1749, win 2044, length 0
# Hangs at this point
```

Client side, directly to master node (no LB):

```
04:24:00.683745 IP 172.24.4.1.51321 > 172.24.4.3.6443: Flags [S], seq 2551946840, win 29200, options [mss 1460,nop,wscale 10], length 0
04:24:00.684351 IP 172.24.4.3.6443 > 172.24.4.1.51321: Flags [S.], seq 1350250882, ack 2551946841, win 28200, options [mss 1410,nop,wscale 7], length 0
04:24:00.684400 IP 172.24.4.1.51321 > 172.24.4.3.6443: Flags [.], ack 1, win 29, length 0
04:24:00.684997 IP 172.24.4.1.51321 > 172.24.4.3.6443: Flags [P.], seq 1:274, ack 1, win 29, length 273
04:24:00.685129 IP 172.24.4.3.6443 > 172.24.4.1.51321: Flags [.], ack 274, win 229, length 0
04:24:00.707837 IP 172.24.4.3.6443 > 172.24.4.1.51321: Flags [P.], seq 1:1749, ack 274, win 229, length 1748
04:24:00.707870 IP 172.24.4.1.51321 > 172.24.4.3.6443: Flags [.], ack 1749, win 32, length 0
# Does not hang here, unlike going through the LB
04:24:00.709099 IP 172.24.4.1.51321 > 172.24.4.3.6443: Flags [P.], seq 274:412, ack 1749, win 32, length 138
04:24:00.709565 IP 172.24.4.3.6443 > 172.24.4.1.51321: Flags [P.], seq 1749:1800, ack 412, win 238, length 51
04:24:00.709868 IP 172.24.4.1.51321 > 172.24.4.3.6443: Flags [P.], seq 412:520, ack 1800, win 32, length 108
04:24:00.710373 IP 172.24.4.3.6443 > 172.24.4.1.51321: Flags [P.], seq 1800:2002, ack 520, win 238, length 202
04:24:00.710599 IP 172.24.4.1.51321 > 172.24.4.3.6443: Flags [P.], seq 520:551, ack 2002, win 35, length 31
04:24:00.710693 IP 172.24.4.1.51321 > 172.24.4.3.6443: Flags [F.], seq 551, ack 2002, win 35, length 0
04:24:00.711006 IP 172.24.4.3.6443 > 172.24.4.1.51321: Flags [P.], seq 2002:2033, ack 552, win 238, length 31
04:24:00.711060 IP 172.24.4.1.51321 > 172.24.4.3.6443: Flags [R], seq 2551947392, win 0, length 0
04:24:00.711108 IP 172.24.4.3.6443 > 172.24.4.1.51321: Flags [F.], seq 2033, ack 552, win 238, length 0
04:24:00.711135 IP 172.24.4.1.51321 > 172.24.4.3.6443: Flags [R], seq 2551947392, win 0, length 0
```

Server side, directly to master node (no LB):

```
node = be6ea502-7610-4d32-9aab-84c44a269292-master-0.sun-sr-https
10:11:44.740258 IP 172.24.4.1.23736 > node: Flags [S], seq 2749273659, win 29200, options [mss 1460,nop,wscale 10], length 0
10:11:44.740341 IP node > 172.24.4.1.23736: Flags [S.], seq 3758752705, ack 2749273660, win 28200, options [mss 1410,nop,wscale 7], length 0
10:11:44.740560 IP 172.24.4.1.23736 > node: Flags [.], ack 1, win 29, length 0
10:11:44.741093 IP 172.24.4.1.23736 > node: Flags [P.], seq 1:274, ack 1, win 29, length 273
10:11:44.741132 IP node > 172.24.4.1.23736: Flags [.], ack 274, win 229, length 0
10:11:44.763039 IP node > 172.24.4.1.23736: Flags [P.], seq 1:1749, ack 274, win 229, length 1748
10:11:44.763125 IP 172.24.4.1.23736 > node: Flags [.], ack 1749, win 32, length 0
# Does not hang here, unlike going through the LB
10:11:44.764512 IP 172.24.4.1.23736 > node: Flags [P.], seq 274:412, ack 1749, win 32, length 138 # first packet that's different
10:11:44.764802 IP node > 172.24.4.1.23736: Flags [P.], seq 1749:1800, ack 412, win 238, length 51
10:11:44.765059 IP 172.24.4.1.23736 > node: Flags [P.], seq 412:520, ack 1800, win 32, length 108
10:11:44.765498 IP node > 172.24.4.1.23736: Flags [P.], seq 1800:2002, ack 520, win 238, length 202
10:11:44.765666 IP 172.24.4.1.23736 > node: Flags [P.], seq 520:551, ack 2002, win 35, length 31
10:11:44.765714 IP 172.24.4.1.23736 > node: Flags [F.], seq 551, ack 2002, win 35, length 0                                                    # client is finished
10:11:44.765872 IP node > 172.24.4.1.23736: Flags [P.], seq 2002:2033, ack 552, win 238, length 31
10:11:44.765906 IP node > 172.24.4.1.23736: Flags [F.], seq 2033, ack 552, win 238, length 0                                                   # node is finished
10:11:44.766007 IP 172.24.4.1.23736 > node: Flags [R], seq 2749274211, win 0, length 0
10:11:44.766023 IP 172.24.4.1.23736 > node: Flags [R], seq 2749274211, win 0, length 0
```

**Comment by xsgordon** [comment]
/cc @k8s-sig-openstack-bugs 

@idvoretskyi can you please add the sig/openstack label?

**Comment by calebamiles** [comment]
labels added @xsgordon

**Comment by dragorosson** [comment]
I've been doing kubernetes builds and have traced the problem down to this commit: https://github.com/kubernetes/kubernetes/commit/3803fee9724ae02e4019c64275c959d308b3a74d

Still investigating.

**Comment by liggitt** [comment]
general TLS issues are more api-machinery-related, not seeing an auth connection here

**Comment by liggitt** [comment]
wondering if default ciphers changed in go 1.7... do you know what ciphers the LB supports?

**Comment by liggitt** [comment]
or http2 defaulted on

**Comment by dragorosson** [comment]
@liggitt I agree. This seems to be before auth would come into play. Here's the HAProxy config (just to reiterate, with no changes to the LB, apiserver v1.4.x works fine):

(`HA-Proxy version 1.5.14 2015/07/02`)

```
global
    daemon
    user nobody
    group nogroup
    log /dev/log local0
    log /dev/log local1 notice
    stats socket /var/lib/octavia/7619d633-7114-4077-80fe-df8a7c9ec343.sock mode 0666 level user

defaults
    log global
    retries 3
    option redispatch
    timeout connect 5000
    timeout client 50000
    timeout server 50000



frontend 7619d633-7114-4077-80fe-df8a7c9ec343
    option tcplog
    bind 10.0.0.8:10443
    mode tcp
    default_backend cbfdf089-ca1c-4274-936a-592d4409b30a

backend cbfdf089-ca1c-4274-936a-592d4409b30a
    mode tcp
    balance roundrobin
    timeout check 5
    server 2d0e02a2-f638-4585-8868-36eb491fbcfb 10.0.0.15:10443 weight 1 check inter 5s fall 3 rise 5
```

**Comment by dragorosson** [comment]
After running `git bisect` on golang 1.6 through 1.7.1 (compiling go, then building apiserver at https://github.com/kubernetes/kubernetes/commit/3803fee9724ae02e4019c64275c959d308b3a74d on top of it), the commit that breaks everything is:

https://github.com/golang/go/commit/2a8c81ffaadc69add6ff85b241691adb7f9f24ff "crypto/tls: buffer handshake messages."

**Comment by liggitt** [comment]
Maybe the title isn't accurate any more, but since the minimum version supported by the API server is tls1.2, would we ever expect a sslv3 handshake to succeed?

**Comment by liggitt** [comment]
(Not to shortsell the dedication to bisect the golang release… nice job)

**Comment by dragorosson** [comment]
@liggitt I'm no security/networking expert, and so I used the symptom (what curl reported) as the title. Still, it doesn't seem to be a TLS1.2 vs SSLv3 issue, because the breaking commit doesn't change the underlying handshake algorithm itself. (Plus, nothing different happens when I use `curl`'s `--tls1.2` flag, and kubectl can't get through either, which I'd expect would use TLS1.2 anyway.)

I'm going to see if there's anything that can be done on the HAProxy side about this.

**Comment by johnsom** [comment]
If I read the bug report correctly it sounds like this works correctly if you are not going through the floating IP.  Can you confirm this?
Can you check if you have Distributed Virtual Router (DVR) enabled on the router you are connecting your load balancer VIP to?  There are a number of known issues with DVR.  The symptoms you are reporting sound like issues I have experienced with DVR enabled.

**Comment by dragorosson** [comment]
@johnsom Both of the routers in my cloud report distributed=False. I don't think there are any other routers.

```
drago-devstack1-do-not-delete|stack ~$ neutron router-list
+--------------------------------------+------------------------------------------+--------------------------------------------------------------------------------------------------------------------------------+-------------+-------+
| id                                   | name                                     | external_gateway_info                                                                                                          | distributed | ha    |
+--------------------------------------+------------------------------------------+--------------------------------------------------------------------------------------------------------------------------------+-------------+-------+
| 181caf80-faca-40ac-86fc-cc5c9f5b32d7 | router1                                  | {"network_id": "54c1014e-ddf2-4538-9cfe-74cddd965d06", "enable_snat": true, "external_fixed_ips": [{"subnet_id":               | False       | False |
|                                      |                                          | "3ff5c3ec-6105-49b9-824f-8c37251a9145", "ip_address": "172.24.4.7"}, {"subnet_id": "f95b63c6-e950-4539-a617-53df596c68e4",     |             |       |
|                                      |                                          | "ip_address": "2001:db8::8"}]}                                                                                                 |             |       |
| 1b0e480b-db98-42fd-b4b7-d14ebdb1311a | k8s1-ieedufdxx3gj-extrouter-habgyobqpai3 | {"network_id": "54c1014e-ddf2-4538-9cfe-74cddd965d06", "enable_snat": true, "external_fixed_ips": [{"subnet_id":               | False       | False |
|                                      |                                          | "3ff5c3ec-6105-49b9-824f-8c37251a9145", "ip_address": "172.24.4.6"}, {"subnet_id": "f95b63c6-e950-4539-a617-53df596c68e4",     |             |       |
|                                      |                                          | "ip_address": "2001:db8::b"}]}                                                                                                 |             |       |
+--------------------------------------+------------------------------------------+--------------------------------------------------------------------------------------------------------------------------------+-------------+-------+

drago-devstack1-do-not-delete|stack ~$ neutron router-show 1b0e480b-db98-42fd-b4b7-d14ebdb1311a
+-------------------------+--------------------------------------------------------------------------------------------------------------------------------------------------------------------------------------------------------------+
| Field                   | Value                                                                                                                                                                                                        |
+-------------------------+--------------------------------------------------------------------------------------------------------------------------------------------------------------------------------------------------------------+
| admin_state_up          | True                                                                                                                                                                                                         |
| availability_zone_hints |                                                                                                                                                                                                              |
| availability_zones      | nova                                                                                                                                                                                                         |
| created_at              | 2017-03-03T21:20:24Z                                                                                                                                                                                         |
| description             |                                                                                                                                                                                                              |
| distributed             | False                                                                                                                                                                                                        |
| external_gateway_info   | {"network_id": "54c1014e-ddf2-4538-9cfe-74cddd965d06", "enable_snat": true, "external_fixed_ips": [{"subnet_id": "3ff5c3ec-6105-49b9-824f-8c37251a9145", "ip_address": "172.24.4.6"}, {"subnet_id":          |
|                         | "f95b63c6-e950-4539-a617-53df596c68e4", "ip_address": "2001:db8::b"}]}                                                                                                                                       |
| flavor_id               |                                                                                                                                                                                                              |
| ha                      | False                                                                                                                                                                                                        |
| id                      | 1b0e480b-db98-42fd-b4b7-d14ebdb1311a                                                                                                                                                                         |
| name                    | k8s1-ieedufdxx3gj-extrouter-habgyobqpai3                                                                                                                                                                     |
| project_id              | f10b7d618f504f2da255b9b8f44278cf                                                                                                                                                                             |
| revision_number         | 7                                                                                                                                                                                                            |
| routes                  |                                                                                                                                                                                                              |
| status                  | ACTIVE                                                                                                                                                                                                       |
| tenant_id               | f10b7d618f504f2da255b9b8f44278cf                                                                                                                                                                             |
| updated_at              | 2017-03-03T21:20:26Z                                                                                                                                                                                         |
+-------------------------+--------------------------------------------------------------------------------------------------------------------------------------------------------------------------------------------------------------+
drago-devstack1-do-not-delete|stack ~$ neutron router-show 181caf80-faca-40ac-86fc-cc5c9f5b32d7
+-------------------------+--------------------------------------------------------------------------------------------------------------------------------------------------------------------------------------------------------------+
| Field                   | Value                                                                                                                                                                                                        |
+-------------------------+--------------------------------------------------------------------------------------------------------------------------------------------------------------------------------------------------------------+
| admin_state_up          | True                                                                                                                                                                                                         |
| availability_zone_hints |                                                                                                                                                                                                              |
| availability_zones      | nova                                                                                                                                                                                                         |
| created_at              | 2017-03-01T23:15:59Z                                                                                                                                                                                         |
| description             |                                                                                                                                                                                                              |
| distributed             | False                                                                                                                                                                                                        |
| external_gateway_info   | {"network_id": "54c1014e-ddf2-4538-9cfe-74cddd965d06", "enable_snat": true, "external_fixed_ips": [{"subnet_id": "3ff5c3ec-6105-49b9-824f-8c37251a9145", "ip_address": "172.24.4.7"}, {"subnet_id":          |
|                         | "f95b63c6-e950-4539-a617-53df596c68e4", "ip_address": "2001:db8::8"}]}                                                                                                                                       |
| flavor_id               |                                                                                                                                                                                                              |
| ha                      | False                                                                                                                                                                                                        |
| id                      | 181caf80-faca-40ac-86fc-cc5c9f5b32d7                                                                                                                                                                         |
| name                    | router1                                                                                                                                                                                                      |
| project_id              | 186636583e9b4fabbb1bb11034ff9bfb                                                                                                                                                                             |
| revision_number         | 9                                                                                                                                                                                                            |
| routes                  |                                                                                                                                                                                                              |
| status                  | ACTIVE                                                                                                                                                                                                       |
| tenant_id               | 186636583e9b4fabbb1bb11034ff9bfb                                                                                                                                                                             |
| updated_at              | 2017-03-01T23:16:18Z                                                                                                                                                                                         |
+-------------------------+--------------------------------------------------------------------------------------------------------------------------------------------------------------------------------------------------------------+
```

**Comment by johnsom** [comment]
Ok, so it's not one of the DVR issues.  I looked at the bug you opened and saw the HAProxy log.

The sD code in those entries mean the flow ended abnormally.

s : the server-side timeout expired while waiting for the server to send or receive data.
D : the session was in the DATA phase.

So, the timeout waiting for the server to send data expired.  50000 milliseconds seems like it should be long enough.

However the connection disconnection state implies that it is an issue with the member host (backend).

**Comment by dims** [comment]
Heat support is now deprecated - https://github.com/kubernetes/website/pull/5670

/close

**Comment by tomkukral** [comment]
@dims This isn't related only to Heat support since everybody accessing apiserver through haproxy with checks is hitting this issue.
