### ISSUE TITLE
DNS e2e test cases fail with IPv6 traffic

### ISSUE THREAD

**Issue by wenyingd** [kubernetes/kubernetes#94794]
**What happened**:
If I run DNS relevant test cases on an IPv6 cluster (not a Dual-Stack cluster), some cases should fail, while all the cases could pass on an IPv4 cluster. The failed cases include, 
```
[sig-network] DNS [It] should provide DNS for the cluster [Conformance]
[sig-network] DNS [It] should provide DNS for services [Conformance]
[sig-network] DNS [It] should provide DNS for pods for Subdomain [Conformance]
```
All above cases fail when trying to resolve an IPv6 Record (AAAA) if the case has provided a name appended with ` ClusterDNSDomain` (cluster.local). I have tried to capture the DNS packets using tcpdump, and find that the client container always append the suffix which is read from the DNS configuration. But I didn't capture any packet without the suffix. I think this should be the root cause of the issue, as coreDNS is actually expecting the name just as the test case has set.

**What you expected to happen**:
The test cases should pass.

**How to reproduce it (as minimally and precisely as possible)**:
Run the failed cases on a cluster which is configured with IPv6 pod-network-cidr and IPv6 Service CIDR, and disable the Feature Gate of "IPv6DualStack"

**Anything else we need to know?**:

**Environment**:
- Kubernetes version (use `kubectl version`): 1.18
- DNS test Pod images:
   gcr.io/kubernetes-e2e-test-images/dnsutils:1.1
   gcr.io/kubernetes-e2e-test-images/jessie-dnsutils:1.0

**Comment by athenabot** [comment]
/triage unresolved

Comment `/remove-triage unresolved` when the issue is assessed and confirmed.

🤖 I am a bot run by vllry. 👩‍🔬

**Comment by pacoxu** [comment]
Have you configure `--cluster-dns` in kubelet config file ? 

https://github.com/kubernetes/kubernetes/blob/62b8faed4042e9f1a9c1e895ad1c36bb473eb6ee/test/e2e/network/dns.go#L47
It tries to nslookup 'kubernetes.default.svc.cluster.local' inside a pod(ClusterFirst, which will use --cluster-dns config in resolv.conf)

**Comment by wenyingd** [comment]
> --cluster-dns

I didn't add any additional configuration in kubelet. From the packets I captured, the client Pod could add the suffix read from the resolve.conf. But the issue is it always appends a suffix, and never uses the configured name directly. While the failed cases are already using a name including the suffix which the client Pod is trying to append. This causes the coreDNS receives requests including a duplicated cluster domain suffix. 

The issue only happens in IPv6 traffic. The same tests and configuration could pass on an IPv4 cluster.

**Comment by pacoxu** [comment]
Any logs for the failed case ?

ERRO[0000] no dns pods found with the labels [k8s-app=kube-dns, k8s-app=coredns] in namespace kube-system

I got the error message in my cluster at first, for the label is not the same. Check the pod and service, and change it to coredns or kube-dns

**Comment by wenyingd** [comment]
The error logs should be something like this

**Comment by aojea** [comment]
if coreDNS is not able to reach the upstream server it fails,so you have to configure as an offline environment in order to make it work https://github.com/coredns/coredns/issues/2494#issuecomment-457215452

 check this issue for reference
https://github.com/kubernetes-sigs/kind/issues/1736#issuecomment-660602160

per example, to run the ipv6 jobs in current Kubernetes CI we have to reconfigure CoreDNS like this

**Comment by wenyingd** [comment]
> if coreDNS is not able to reach the upstream server it fails,so you have to configure as an offline environment in order to make it work [coredns/coredns#2494 (comment)](https://github.com/coredns/coredns/issues/2494#issuecomment-457215452)
> 
> check this issue for reference
> [kubernetes-sigs/kind#1736 (comment)](https://github.com/kubernetes-sigs/kind/issues/1736#issuecomment-660602160)
> 
> per example, to run the ipv6 jobs in current Kubernetes CI we have to reconfigure CoreDNS like this

I don't think it is coreDNS issue, as the failed cases are about IPv6  traffic inside the cluster, it should not be the same the issue that coreDNS can't reach the upstream server. In my opinion, the issue should be from the testing client container image or the test cases. As it never tries to query IPv6 DNS Record using the name set in the cases, which is already a complete name including the domain suffix according to the test. I am not sure if the behavior in the client image is reasonable (because it looks the client is able to try the given name directly for IPv4 Record, but not for IPv6 Record). Besides, if the test client image is not able to change, I think we have to adjust the test cases, to not append the suffix when testing IPv6 traffic.

**Comment by aojea** [comment]
Those tests are running in the CI, https://testgrid.k8s.io/conformance-kind#kind%20(IPv6),%20master%20(dev)&include-filter-by-regex=DNS and I'm telling this based on my experience because I had to set them up :smile: 

It has to append the suffix, it is how it works, https://man7.org/linux/man-pages/man5/resolv.conf.5.html

it tries using all the suffixes in the `search` field of `/etc/resol.conf` , but the problem is IIRC that it stop querying if it receives an NXDOMAIN,

can you check the Coredns logs to confirm?
https://kubernetes.io/docs/tasks/administer-cluster/dns-debugging-resolution/#are-dns-queries-being-received-processed

**Comment by wenyingd** [comment]
@aojea I agree that appending the suffix is reasonable, but I think the client should try both two cases: adding suffix from /etc/resolv.conf and not adding any suffix.

In the test case, we call this command in the client 
`check="$$(dig +notcp +noall +answer +search dns-test-service-2.dns-556.svc.cluster.local AAAA)"`

but when I capture packets from coreDNS, I get these queries
```
08:01:26.109160 IP 172.16.2.25.43288 > 172.16.2.219.53: 56321+ [1au] AAAA? dns-test-service-2.dns-1995.svc.cluster.local.cluster.local. (10
08:01:26.109300 IP 172.16.2.219.53 > 172.16.2.25.43288: 56321 NXDomain*- 0/1/1 (193)
08:01:38.182385 IP 172.16.2.25.57796 > 172.16.2.219.53: 41336+ [1au] AAAA? dns-test-service-2.dns-1995.svc.cluster.local.svc.cluster.local.
08:01:38.182573 IP 172.16.2.219.53 > 172.16.2.25.57796: 41336 NXDomain*- 0/1/1 (185)
08:01:38.183824 IP 172.16.2.25.60023 > 172.16.2.219.53: 29812+ [1au] AAAA? dns-test-service-2.dns-1995.svc.cluster.local.eng.vmware.com. (8
08:01:40.184237 IP 172.16.2.219.53 > 172.16.2.25.60023: 29812 ServFail- 0/0/1 (89)
08:01:43.169993 IP 172.16.2.25.58878 > 172.16.2.219.53: 24385+ [1au] AAAA? dns-test-service-2.dns-1995.svc.cluster.local.dns-1995.svc.clust (113)
08:01:43.170130 IP 172.16.2.219.53 > 172.16.2.25.58878: 24385 NXDomain*- 0/1/1 (206)
08:01:43.170456 IP 172.16.2.25.42321 > 172.16.2.219.53: 28464+ [1au] AAAA? dns-test-service-2.dns-1995.svc.cluster.local.svc.cluster.local.
08:01:43.170620 IP 172.16.2.219.53 > 172.16.2.25.42321: 28464 NXDomain*- 0/1/1 (197)
```

We expect coreDNS should receive a packet including this content
`AAAA? dns-test-service-2.dns-1995.svc.cluster.local`, and only this query could be resolved correctly. But in fact, the client doesn't send out such a query at all.

**Comment by aojea** [comment]
can you paste the /etc/resolv.conf from your pods in the test?

**Comment by wenyingd** [comment]
Following is the content of configuration file of `/etc/resolve.conf` from the Pod

```
 # cat /etc/resolv.conf 
nameserver 172.17.0.10
search dns-2778.svc.cluster.local svc.cluster.local cluster.local eng.vmware.com
options ndots:5
```

**Comment by aojea** [comment]
In an IPv6 cluster, the pods only have IPv6 addresses :thinking: 
```
kubectl attach -it sh
Defaulting container name to sh.
Use 'kubectl describe pod/sh -n default' to see all of the containers in this pod.
If you don't see a command prompt, try pressing enter.
/ # cat /etc/resolv.conf 
search default.svc.cluster.local svc.cluster.local cluster.local lan
nameserver fd00:10:96::a
options ndots:5
```

**Comment by wenyingd** [comment]
Sorry, I paste the file content from a dual-stack cluster setup. So the address of nameserver might introduce a confusion.

But I think I got the root cause, it is because the configuration `options ndots:5`. I don't know why it requires 5 dots in the name, but the test case actually only has 4 dots.

@aojea Do you know how to change this option for the cluster but not for every single Pod?

**Comment by aojea** [comment]
I think that the problem is this

> 08:01:38.183824 IP 172.16.2.25.60023 > 172.16.2.219.53: 29812+ [1au] AAAA? dns-test-service-2.dns-1995.svc.cluster.local.eng.vmware.com. (8
> 08:01:40.184237 IP 172.16.2.219.53 > 172.16.2.25.60023: 29812 ServFail- 0/0/1 (89)

IIRC that stops the resolver to keep trying to resolve, you can workaround it adding vmware.com to your coredns, so it handles that zone and does not ask the upstream resolver
can you try with?

```
apiVersion: v1
data:
  Corefile: |
    .:53 {
        errors
        health {
           lameduck 5s
        }
        ready
        log
        kubernetes cluster.local vmware.com in-addr.arpa ip6.arpa {
           pods insecure
           ttl 30
        }
        prometheus :9153
        forward . /etc/resolv.conf {
           max_concurrent 1000
        }
        cache 30
        reload
        loadbalance
    }
```

**Comment by chrisohaver** [comment]
@aojea , adding the domain to the kubernetes plugin would add kubernetes service names to the vmware.com domain (i.e. treating vmware.com as if it is an alternate cluster domain name). If the intent is to trap all vmware.com requests and return NXDOMAIN (so clients continue searching), then the following is cleaner ...


```
apiVersion: v1
data:
  Corefile: |
    .:53 {
        errors
        health {
           lameduck 5s
        }
        ready
        log
        kubernetes cluster.local in-addr.arpa ip6.arpa {
           pods insecure
           ttl 30
        }
        prometheus :9153
        forward . /etc/resolv.conf {
           max_concurrent 1000
        }
        cache 30
        reload
        loadbalance
    }
    vmware.com:53 {
      template ANY ANY {
        rcode NXDOMAIN
      }
    }
```

**Comment by aojea** [comment]
> If the intent is to trap all vmware.com requests and return NXDOMAIN (so clients continue searching), then the following is cleaner ...

lovely :+1: , next time I will ask you first before coming up with my  hacky solutions :sweat_smile:

**Comment by aojea** [comment]
@chrisohaver how can I express ALL but kubernetes return NXDOMAIN?
/cc @BenTheElder

**Comment by chrisohaver** [comment]
Stepping back a bit, it's probably cleaner over all, to remove `eng.vmware.com` from the search domains by pointing kubelet at a copy of the host's resolv.conf with search the domains removed. That way, pods would just get the standard cluster search domains with no local domains injected.

nevertheless...

> how can I express "ALL but kubernetes return NXDOMAIN?"

There isn't a clean way to do that ... that I can think of ATM.  Instead of forwarding to /etc/resolv.conf, you could forward to another coredns server that uses the following corefile:

```
    .:53 {
      template ANY ANY {
        rcode NXDOMAIN
      }
    }
```

That server _could_ run in the cluster coredns, on a different port... e.g. 

```
    .:53 {
        errors
        health {
           lameduck 5s
        }
        ready
        log
        kubernetes cluster.local in-addr.arpa ip6.arpa {
           pods insecure
           ttl 30
        }
        prometheus :9153
        forward . 10.96.0.10:5353 {
           max_concurrent 1000
        }
        cache 30
        reload
        loadbalance
    }
    .:5353 {
      template ANY ANY {
        rcode NXDOMAIN
      }
    }
```

... which would require opening up the ports in the coredns service spec.  But this is extremely awkward.

**Comment by wenyingd** [comment]
>     vmware.com:53 {
>       template ANY ANY {
>         rcode NXDOMAIN
>       }
>     }

@chrisohaver I tried your suggested configmap in coreDNS, but I got erros like 
`/etc/coredns/Corefile:22 - Error during parsing: Unknown directive 'vmware.com:53'`

And the Pods "coredns" fail to run.

**Comment by wenyingd** [comment]
@chrisohaver @aojea Thanks for the suggestions. I tried to add this configuration in configmap "coredns", and it works.
```
    vmware.com:53 {
      template ANY ANY {
        rcode NXDOMAIN
      }
    }
```
I have another question,"eng.vmware.com" is actually an internal upstreaming DNS nameserver for my testbed, and it only works for IPv4 traffic. For an IPv6 only setup, we could enforce the query to this nameserver to return NXDOMAIN (not server fault ). But for a dual-stack setup, we might still depends on it to help access external IPv4 address. Hence, do you have any suggestions on the configuration to ensure only IPv6 traffic not use this nameserver, but IPv4 traffic still uses it?

**Comment by aojea** [comment]
My understanding is (Chris please correct me if I said something wrong or I'm missing something) that the problem here is because your CoreDNS inside the cluster can not reach the upstream DNS server, so it sends an ServFail and stops the client resolver iteration. If you had had IPv6 connectivity upstream, your CoreDNS server would be able to contact the upstream servers and not send a ServFaill, so the client will eventually resolve.

In a dual stack environment, your pods will be dual stack. It should not be a problem if you only have ipv4 connectivity for your upstreams DNS servers, the pods will be able to reach them with their IP address.

Another thing is what address will use the client, because the DNS may answer with A and AAAA records, but that's why is important for clients to support ["happy eyeballs"](https://en.wikipedia.org/wiki/Happy_Eyeballs) so they will "know" which family to use.

**Comment by chrisohaver** [comment]
> Hence, do you have any suggestions on the configuration to ensure only IPv6 traffic not use this nameserver, but IPv4 traffic still uses it?

@wenyingd - If the upstream DNS IP address defined in the forward declaration is v4, then CoreDNS will always be attempt to connect to it via ipv4.  CoreDNS forwards by proxy - it doesn't forward packets, it establishes a new connection to the upstream dns server ip address, gets an answer, and then sends the same answer to the client ip address. IOW, if a client sends a dual-stack CoreDNS a request for an `AAAA` record over ipv6, CoreDNS would receive the request, and then make the `AAAA` request to the upstream ip address (per `/etc/resolv.conf`).  If CoreDNS gets an answer, it sends the answer to the client using ipv6.

As @aojea says, a single stack ipv6 CoreDNS will be unable to connect to an ipv4 address.   So if your upstream dns is ipv4 only,  a single stack ipv6 CoreDNS would timeout and return SERVFAIL to the client.  IIRC, the SERVFAIL response typically causes the client to stop searching (but is based on client side search domain implementation which i don't think is universally consistent).

The address the client uses doesn't matter, what matters is what record type it requests.  If it requests an `A` record, it will get an ipv4 address.  If it requests an `AAAA`  record, it will get an ipv6 address.  The underlying internet layer of the request packet doesn't play a part in DNS application protocol.  Dual stack clients typically make two separate requests, an `A` and an `AAAA` when looking up an address.  Clients can become confused when those answers conflict or violate DNS rules.  E.g. when the `AAAA` response is NXDOMAIN, and the `A` response is NOERROR. So it's not advisable to try to "block" `AAAA` lookups by forcing them to NXDOMAIN, while allowing `A` through.

**Comment by wenyingd** [comment]
Thanks for the detail explanation, and that helps me a lot.

**Comment by aojea** [comment]
I think we can close this at this point.
It turned out in an excellent lesson on DNS and ip families, thanks Chris
/Close
