### ISSUE TITLE
Azure: incoming connections seen with cluster's outbound ip address

### ISSUE THREAD

**Issue by sylr** [kubernetes/kubernetes#86667]
**What happened**:

Here my setup:

- kubernetes 1.13.12 cluster
- Deployed manually with custom aks-engine version
- Nodes deployed on several availability zones in West Europe
- Using Standard Load Balancer
- Using Accelerated Networking interfaces
- Load Balancer rules have disable Outgoing SNAT **enabled**
- 1 Load Balancer rule **without** disable Outgoing SNAT enabled to control which IP address is used to exit the cluster (let's call it 55.55.55.55)
- kube-proxy in iptables mode
- Using calico

Looking at the access log of our reverse proxy (served by a kubernetes service using `externalTrafficPolicy: Local`) we discovered some requests that are seen to be incoming with the public IP address of the cluster (55.55.55.55).

This could totaly happen in the case we have backend to backend calls within the cluster using public IP.

In our case we are sure that some of those requests are coming from external clients, therefore,  should not be seen with the 55.55.55.55 Public IP.

I've been able to induce this behavior by killing reverse proxy pods.

| IP | Description |
| --- | --- |
| 1.1.1.1 | My Office Public IP |
| 9.9.9.9 | The Public IP of the reverse proxy carried by the Azure Load Balancer |
| 10.100.70.106 | Private IP of the node on which I killed the reverse proxy pod |
| 55.55.55.55 | Public IP carried by the Azure Load Balancer used for cluster's outbound connections |

Here a normal tcpdump trace:
```
12:15:24.665801 IP 1.1.1.1.43043 > 9.9.9.9.http: Flags [S], seq 2211007586, win 65535, options [mss 1460,nop,wscale 6,nop,nop,TS val 64938450 ecr 0,sackOK,eol], length 0
12:15:24.665934 IP 9.9.9.9.http > 1.1.1.1.43043: Flags [S.], seq 570311328, ack 2211007587, win 28960, options [mss 1460,sackOK,TS val 511098534 ecr 64938450,nop,wscale 7], length 0
12:15:24.688930 IP 1.1.1.1.43043 > 9.9.9.9.http: Flags [.], ack 1, win 2052, options [nop,nop,TS val 64938473 ecr 511098534], length 0
12:15:24.689261 IP 1.1.1.1.43043 > 9.9.9.9.http: Flags [P.], seq 1:105, ack 1, win 2052, options [nop,nop,TS val 64938473 ecr 511098534], length 104: HTTP: GET /2 HTTP/1.1
12:15:24.689311 IP 9.9.9.9.http > 1.1.1.1.43043: Flags [.], ack 105, win 227, options [nop,nop,TS val 511098557 ecr 64938473], length 0
12:15:24.690081 IP 9.9.9.9.http > 1.1.1.1.43043: Flags [P.], seq 1:211, ack 105, win 227, options [nop,nop,TS val 511098558 ecr 64938473], length 210: HTTP: HTTP/1.1 301 Moved Permanently
12:15:24.712578 IP 1.1.1.1.43043 > 9.9.9.9.http: Flags [.], ack 211, win 2049, options [nop,nop,TS val 64938495 ecr 511098558], length 0
12:15:24.712638 IP 1.1.1.1.43043 > 9.9.9.9.http: Flags [F.], seq 105, ack 211, win 2049, options [nop,nop,TS val 64938495 ecr 511098558], length 0
12:15:24.712858 IP 9.9.9.9.http > 1.1.1.1.43043: Flags [F.], seq 211, ack 106, win 227, options [nop,nop,TS val 511098581 ecr 64938495], length 0
12:15:24.735486 IP 1.1.1.1.43043 > 9.9.9.9.http: Flags [.], ack 212, win 2049, options [nop,nop,TS val 64938518 ecr 511098581], length 0
```

Here another trace just after I've killed the reverse proxy pod on that node
```
12:15:28.807861 IP 1.1.1.1.31076 > 9.9.9.9.http: Flags [S], seq 4172014515, win 65535, options [mss 1460,nop,wscale 6,nop,nop,TS val 64942549 ecr 0,sackOK,eol], length 0
12:15:28.807997 IP 10.100.70.106.31076 > 9.9.9.9.http: Flags [S], seq 4172014515, win 65535, options [mss 1460,nop,wscale 6,nop,nop,TS val 64942549 ecr 0,sackOK,eol], length 0
12:15:28.808427 IP 55.55.55.55.3968 > 9.9.9.9.http: Flags [S], seq 4172014515, win 65535, options [mss 1440,nop,wscale 6,nop,nop,TS val 64942549 ecr 0,sackOK,eol], length 0
12:15:28.808478 IP 10.100.70.106.3968 > 9.9.9.9.http: Flags [S], seq 4172014515, win 65535, options [mss 1440,nop,wscale 6,nop,nop,TS val 64942549 ecr 0,sackOK,eol], length 0
12:15:28.809755 IP 9.9.9.9.http > 10.100.70.106.3968: Flags [S.], seq 1840499964, ack 4172014516, win 28960, options [mss 1440,sackOK,TS val 3380050731 ecr 64942549,nop,wscale 7], length 0
12:15:28.809769 IP 9.9.9.9.http > 55.55.55.55.3968: Flags [S.], seq 1840499964, ack 4172014516, win 28960, options [mss 1440,sackOK,TS val 3380050731 ecr 64942549,nop,wscale 7], length 0
12:15:28.810259 IP 9.9.9.9.http > 10.100.70.106.31076: Flags [S.], seq 1840499964, ack 4172014516, win 28960, options [mss 1420,sackOK,TS val 3380050731 ecr 64942549,nop,wscale 7], length 0
12:15:28.810273 IP 9.9.9.9.http > 1.1.1.1.31076: Flags [S.], seq 1840499964, ack 4172014516, win 28960, options [mss 1420,sackOK,TS val 3380050731 ecr 64942549,nop,wscale 7], length 0
12:15:28.832805 IP 1.1.1.1.31076 > 9.9.9.9.http: Flags [.], ack 1, win 2060, options [nop,nop,TS val 64942574 ecr 3380050731], length 0
12:15:28.832843 IP 10.100.70.106.31076 > 9.9.9.9.http: Flags [.], ack 1, win 2060, options [nop,nop,TS val 64942574 ecr 3380050731], length 0
12:15:28.832935 IP 55.55.55.55.3968 > 9.9.9.9.http: Flags [.], ack 1, win 2060, options [nop,nop,TS val 64942574 ecr 3380050731], length 0
12:15:28.832956 IP 10.100.70.106.3968 > 9.9.9.9.http: Flags [.], ack 1, win 2060, options [nop,nop,TS val 64942574 ecr 3380050731], length 0
12:15:28.833101 IP 1.1.1.1.31076 > 9.9.9.9.http: Flags [P.], seq 1:105, ack 1, win 2060, options [nop,nop,TS val 64942574 ecr 3380050731], length 104: HTTP: GET /4 HTTP/1.1
12:15:28.833129 IP 10.100.70.106.31076 > 9.9.9.9.http: Flags [P.], seq 1:105, ack 1, win 2060, options [nop,nop,TS val 64942574 ecr 3380050731], length 104: HTTP: GET /4 HTTP/1.1
12:15:28.833213 IP 55.55.55.55.3968 > 9.9.9.9.http: Flags [P.], seq 1:105, ack 1, win 2060, options [nop,nop,TS val 64942574 ecr 3380050731], length 104: HTTP: GET /4 HTTP/1.1
12:15:28.833247 IP 10.100.70.106.3968 > 9.9.9.9.http: Flags [P.], seq 1:105, ack 1, win 2060, options [nop,nop,TS val 64942574 ecr 3380050731], length 104: HTTP: GET /4 HTTP/1.1
12:15:28.833459 IP 9.9.9.9.http > 10.100.70.106.3968: Flags [.], ack 105, win 227, options [nop,nop,TS val 3380050755 ecr 64942574], length 0
12:15:28.833475 IP 9.9.9.9.http > 55.55.55.55.3968: Flags [.], ack 105, win 227, options [nop,nop,TS val 3380050755 ecr 64942574], length 0
12:15:28.833563 IP 9.9.9.9.http > 10.100.70.106.31076: Flags [.], ack 105, win 227, options [nop,nop,TS val 3380050755 ecr 64942574], length 0
12:15:28.833594 IP 9.9.9.9.http > 1.1.1.1.31076: Flags [.], ack 105, win 227, options [nop,nop,TS val 3380050755 ecr 64942574], length 0
12:15:28.835524 IP 9.9.9.9.http > 10.100.70.106.3968: Flags [P.], seq 1:211, ack 105, win 227, options [nop,nop,TS val 3380050757 ecr 64942574], length 210: HTTP: HTTP/1.1 301 Moved Permanently
12:15:28.835542 IP 9.9.9.9.http > 55.55.55.55.3968: Flags [P.], seq 1:211, ack 105, win 227, options [nop,nop,TS val 3380050757 ecr 64942574], length 210: HTTP: HTTP/1.1 301 Moved Permanently
12:15:28.835724 IP 9.9.9.9.http > 10.100.70.106.31076: Flags [P.], seq 1:211, ack 105, win 227, options [nop,nop,TS val 3380050757 ecr 64942574], length 210: HTTP: HTTP/1.1 301 Moved Permanently
12:15:28.835742 IP 9.9.9.9.http > 1.1.1.1.31076: Flags [P.], seq 1:211, ack 105, win 227, options [nop,nop,TS val 3380050757 ecr 64942574], length 210: HTTP: HTTP/1.1 301 Moved Permanently
12:15:28.858645 IP 1.1.1.1.31076 > 9.9.9.9.http: Flags [.], ack 211, win 2057, options [nop,nop,TS val 64942598 ecr 3380050757], length 0
12:15:28.858693 IP 10.100.70.106.31076 > 9.9.9.9.http: Flags [.], ack 211, win 2057, options [nop,nop,TS val 64942598 ecr 3380050757], length 0
12:15:28.858813 IP 1.1.1.1.31076 > 9.9.9.9.http: Flags [F.], seq 105, ack 211, win 2057, options [nop,nop,TS val 64942598 ecr 3380050757], length 0
12:15:28.858831 IP 10.100.70.106.31076 > 9.9.9.9.http: Flags [F.], seq 105, ack 211, win 2057, options [nop,nop,TS val 64942598 ecr 3380050757], length 0
12:15:28.858887 IP 55.55.55.55.3968 > 9.9.9.9.http: Flags [.], ack 211, win 2057, options [nop,nop,TS val 64942598 ecr 3380050757], length 0
12:15:28.858909 IP 10.100.70.106.3968 > 9.9.9.9.http: Flags [.], ack 211, win 2057, options [nop,nop,TS val 64942598 ecr 3380050757], length 0
12:15:28.858917 IP 55.55.55.55.3968 > 9.9.9.9.http: Flags [F.], seq 105, ack 211, win 2057, options [nop,nop,TS val 64942598 ecr 3380050757], length 0
12:15:28.858929 IP 10.100.70.106.3968 > 9.9.9.9.http: Flags [F.], seq 105, ack 211, win 2057, options [nop,nop,TS val 64942598 ecr 3380050757], length 0
12:15:28.859367 IP 9.9.9.9.http > 10.100.70.106.3968: Flags [F.], seq 211, ack 106, win 227, options [nop,nop,TS val 3380050781 ecr 64942598], length 0
12:15:28.859417 IP 9.9.9.9.http > 55.55.55.55.3968: Flags [F.], seq 211, ack 106, win 227, options [nop,nop,TS val 3380050781 ecr 64942598], length 0
12:15:28.859448 IP 9.9.9.9.http > 10.100.70.106.31076: Flags [F.], seq 211, ack 106, win 227, options [nop,nop,TS val 3380050781 ecr 64942598], length 0
12:15:28.859458 IP 9.9.9.9.http > 1.1.1.1.31076: Flags [F.], seq 211, ack 106, win 227, options [nop,nop,TS val 3380050781 ecr 64942598], length 0
12:15:28.881843 IP 1.1.1.1.31076 > 9.9.9.9.http: Flags [.], ack 212, win 2057, options [nop,nop,TS val 64942621 ecr 3380050781], length 0
12:15:28.881878 IP 10.100.70.106.31076 > 9.9.9.9.http: Flags [.], ack 212, win 2057, options [nop,nop,TS val 64942621 ecr 3380050781], length 0
12:15:28.881912 IP 55.55.55.55.3968 > 9.9.9.9.http: Flags [.], ack 212, win 2057, options [nop,nop,TS val 64942621 ecr 3380050781], length 0
12:15:28.881931 IP 10.100.70.106.3968 > 9.9.9.9.http: Flags [.], ack 212, win 2057, options [nop,nop,TS val 64942621 ecr 3380050781], length 0
```

On the access logs of the remaining pods hosted on another nodes I get this:

```json
{
  "ClientAddr": "55.55.55.55:3969",
  "ClientHost": "55.55.55.55",
  "ClientPort": "3969",
  "ClientUsername": "-",
  "DownstreamContentSize": 17,
  "DownstreamStatus": 301,
  "Duration": 747903,
  "OriginContentSize": 17,
  "OriginDuration": 398502,
  "OriginStatus": 301,
  "Overhead": 349401,
  "RequestAddr": "debug.company.com",
  "RequestContentSize": 0,
  "RequestCount": 15,
  "RequestHost": "debug.company.com",
  "RequestMethod": "GET",
  "RequestPath": "/4",
  "RequestPort": "-",
  "RequestProtocol": "HTTP/1.1",
  "RetryAttempts": 0,
  "RouterName": "ingress-traefik-v2-http-sinkhole-20ffaeb293594706edb6@kubernetescrd",
  "StartLocal": "2019-12-27T12:15:28.833278795Z",
  "StartUTC": "2019-12-27T12:15:28.833278795Z",
  "entryPointName": "http",
  "level": "info",
  "msg": "",
  "time": "2019-12-27T12:15:28Z"
}
```

**What you expected to happen**:

I expect that requests bounced to another node to be seen with the real IP address of the client.

**How to reproduce it (as minimally and precisely as possible)**:

**Anything else we need to know?**:

**Environment**:
- Kubernetes version (use `kubectl version`): 1.13.12
- Cloud provider or hardware configuration: Azure
- OS (e.g: `cat /etc/os-release`):
- Kernel (e.g. `uname -a`):
- Install tools:
- Network plugin and version (if this is a network-related bug):
- Others:

**Comment by athenabot** [comment]
/triage unresolved

Comment `/remove-triage unresolved` when the issue is assessed and confirmed.

🤖 I am a bot run by vllry. 👩‍🔬

**Comment by feiskyer** [comment]
have you enabled [outbound rules](https://docs.microsoft.com/en-us/azure/load-balancer/load-balancer-outbound-rules-overview) for outbound connections? Outbound rules are recommended to configure outbound connections for standard load balancer.

**Comment by sylr** [comment]
Yes, the outbound rule is the rule using 55.55.55.55.

**Comment by feiskyer** [comment]
OK, it's a different IP compared to 9.9.9.9. I think it happened because of the following workflow:

* When killed the reverse proxy pod on the node, the conntrack of that connection would lose
* Then the response from Pod is SNAT to node IP 10.100.70.106 by masquerade
* Finally, the package is SNAT to outbound IP 55.55.55.55

@sylr do you think this is reasonable?

**Comment by sylr** [comment]
I'm not well versed in the linux networking stack so I wouldn't assume.

What I've observed is that after killing the reverse proxy pod on the node, when requests are still coming in before the load balancer realizes that there is no more pod to answer the requests on the node, the network traffic seems "multiplied" using several source ips, ie.:

```
12:15:28.807861 IP 1.1.1.1.31076 > 9.9.9.9.http: Flags [S], seq 4172014515, win 65535, options [mss 1460,nop,wscale 6,nop,nop,TS val 64942549 ecr 0,sackOK,eol], length 0
12:15:28.807997 IP 10.100.70.106.31076 > 9.9.9.9.http: Flags [S], seq 4172014515, win 65535, options [mss 1460,nop,wscale 6,nop,nop,TS val 64942549 ecr 0,sackOK,eol], length 0
12:15:28.808427 IP 55.55.55.55.3968 > 9.9.9.9.http: Flags [S], seq 4172014515, win 65535, options [mss 1440,nop,wscale 6,nop,nop,TS val 64942549 ecr 0,sackOK,eol], length 0
12:15:28.808478 IP 10.100.70.106.3968 > 9.9.9.9.http: Flags [S], seq 4172014515, win 65535, options [mss 1440,nop,wscale 6,nop,nop,TS val 64942549 ecr 0,sackOK,eol], length 0
12:15:28.809755 IP 9.9.9.9.http > 10.100.70.106.3968: Flags [S.], seq 1840499964, ack 4172014516, win 28960, options [mss 1440,sackOK,TS val 3380050731 ecr 64942549,nop,wscale 7], length 0
12:15:28.809769 IP 9.9.9.9.http > 55.55.55.55.3968: Flags [S.], seq 1840499964, ack 4172014516, win 28960, options [mss 1440,sackOK,TS val 3380050731 ecr 64942549,nop,wscale 7], length 0
12:15:28.810259 IP 9.9.9.9.http > 10.100.70.106.31076: Flags [S.], seq 1840499964, ack 4172014516, win 28960, options [mss 1420,sackOK,TS val 3380050731 ecr 64942549,nop,wscale 7], length 0
12:15:28.810273 IP 9.9.9.9.http > 1.1.1.1.31076: Flags [S.], seq 1840499964, ack 4172014516, win 28960, options [mss 1420,sackOK,TS val 3380050731 ecr 64942549,nop,wscale 7], length 0
```

**Comment by sylr** [comment]
1. client <1.1.1.1> -> <9.9.9.9> LB  -> <10.100.70.106> node without pod 
2. node without pod <10.100.70.106> -> <9.9.9.9> LB <55.55.55.55> -> <10.100.70.106> node without pod
3. node without pod <10.100.70.106> -> <9.9.9.9> LB (again ?????)

**Comment by feiskyer** [comment]
Interesting. There're some delays between Pod shutdown and kube-proxy iptables updates, hence I think it only happens in a short period after Pod shutdown, it this true? And would the connections back to normal after the Pod runs again?

**Comment by sylr** [comment]
Yes it comes back to normal after a short while in most case but it does not when clients are instantiating long running connections like websockets.

**Comment by feiskyer** [comment]
@sylr Any more information why the long running connections are not coming back? Didn't the client receive a connection reset?

**Comment by sylr** [comment]
Here a graph showing the amount of request originating with the outbound ip of the load balancer instead of the real IP after I killed all the reverse proxy pods.

<img width="1645" alt="Search___Splunk_7_2_9" src="https://user-images.githubusercontent.com/153052/71763728-742e5680-2edf-11ea-961f-9f11c91fbee5.png">

It took 15 hours before all clients be seen with their real IP.

**Comment by feiskyer** [comment]
oops, didn't expect it would need so long. I still didn't get why it would need so long time. Have you noticed what's the request responses on such cases? I think it should be timeout or connection reset, hence the clients should reinitialize the connection again.

**Comment by sylr** [comment]
> oops, didn't expect it would need so long. I still didn't get why it would need so long time. Have you noticed what's the request responses on such cases? I think it should be timeout or connection reset, hence the clients should reinitialize the connection again.

I haven't done any tests but I think that in case of long connections the load balancer continues to forward requests to the host it started with even if the load balancer probes removed the host from the backend pool.

If it is really what's happening then I agree with you that the load balancer should reset connections that are tied to a host that has been scraped from the backend pool.

**Comment by feiskyer** [comment]
@sylr Thanks for the update. By the way, could you upgrade to >=v1.16.0 and check whether it would happen? TCPReset is enabled by default since v1.16, I think it may help with the issue.

**Comment by sylr** [comment]
That's no something I can do. I have clusters deployed with an heavily customized aks-engine and they are running `1.13.12`. I'm not able to upgrade those clusters.

**Comment by feiskyer** [comment]
@sylr If so, could you modify the LoadBalancer rules and enable tcpreset? the setting may be lost on next cloud provider sync , but it could help to identify whether it is caused by tcpreset issues.

**Comment by athenabot** [comment]
@aramase
If this issue has been triaged, please comment `/remove-triage unresolved`.

If you aren't able to handle this issue, consider unassigning yourself and/or adding the `help-wanted` label.

🤖 I am a bot run by vllry. 👩‍🔬

**Comment by sylr** [comment]
@feiskyer I'll try that next week.

**Comment by athenabot** [comment]
@aramase
If this issue has been triaged, please comment `/remove-triage unresolved`.

If you aren't able to handle this issue, consider unassigning yourself and/or adding the `help-wanted` label.

🤖 I am a bot run by vllry. 👩‍🔬

**Comment by athenabot** [comment]
@aramase
If this issue has been triaged, please comment `/remove-triage unresolved`.

If you aren't able to handle this issue, consider unassigning yourself and/or adding the `help-wanted` label.

🤖 I am a bot run by vllry. 👩‍🔬

**Comment by craiglpeters** [comment]
@sylr is this still an issue you face?
