### ISSUE TITLE
Iptables forwarding routes for ClusterIP services

### ISSUE THREAD

**Issue by paralin** [kubernetes/kubernetes#27161]
I have the following use case:

I need to route from non-kubernetes servers to Kubernetes ClusterIPs. I already have the routes set up properly to FORWARD to pod IP addresses, and this works perfectly (I can access pod IP addresses from outside the cluster). But nothing I've tried seems to get the service routing to work properly.

How can I set this up properly? Is this something that potentially should be included in Kubernetes?

**Comment by AdoHe** [comment]
Typically, services and pods have IPs only routable by the cluster network. IIUC you want to access services outside of cluster, this is what [Ingress](http://kubernetes.io/docs/user-guide/ingress/) do, ptal.

**Comment by paralin** [comment]
@adohe I'm well familiar with ingress but it *should* be possible for other servers on the same private subnet as the cluster to route traffic to services. 

As I mentioned before I already have pod routing working properly.

**Comment by chrislovecnm** [comment]
I forgot that @paralin opened this.

 Requirements:

- 2 or more non-federated K8s deployments or possibly K8s Federated
- K8s deployment alpha - petset alpha is deployed
- K8s deployment beta - petset beta is deployed
- petset alpha and beta are applications that must communicate with every Pet ip address in K8s alpha and K8s beta.
- Petsets distributed HA systems that are designed to provide multiple datacenter HA.
- Petsets are distributed systems that provide capability for work load specific uses cases inside of a Datacenter - Data is the same across distributed systems, but Petset alpha 1 is configured differently than Petset alpha 2.  Analytics workloads vs Data ingestion workloads.

Software applications Impacted:
- Cassandra  - P1
- Apache Spark - P1 (master has to talk to all nodes, needs further vetting)
- Elastic (need to vet)
- Redis (may not be a valid use case)

Cassandra Use Case:

Specifically Cassandra instances CANNOT be load balanced.  A client external to cluster must see every Cassandra IP address, and when doing multiple Datacenters between K8s deployments all nodes must talk to each other.  Federated will assist, but since Cassandra provides amazing HA, I almost would recommend to have Cassandra to handle itself.  A SeedProvider and SnitchProvider for Cassandra could utilize muitple K8s endpoints for discovery. 

Cassandra routinely uses IP addresses instead of DNS, and with Petsets ... voila!

Ubernetes Multiple Cassandra Datacenters - every node must be able to talk to every other node. DC1 eight nodes, DC2 eight nodes. All 16 nodes must be able to lookup and talk to each other.
External Clients - For instance the cassandra java driver needs to be able to communicate to every server in a C* ring. Going through a loadbalancer just does not fit multiple features that C* clients rely on.

Items Impacted:
- DNS
- IP networking
- Cassandra SeedProvider
- Cassandra Snitch
- Cassandra Racks and Datacenters.

@bgrant0607 who is the networking super guru that can assist.
@mward29 pulling you in because of your aws / Cassandra awesomeness
@bprashanth / @smarterclayton I think PetSet is fully ready for this 😄 

cc @kubernetes/examples - do we have other use cases in apps?

Once this is vetted, I can put in a formal proposal after 1.3 launch ... till then I am SUPER busy

**Comment by paralin** [comment]
And if anyone here who is an amazing network guru wants to help me with my trivial little routing problem (unrelated to the Services routing)...

http://superuser.com/questions/1087888/ip-forwarding-from-one-server-through-default-route

**Comment by chrislovecnm** [comment]
Some notes from now closed: https://github.com/kubernetes/kubernetes/issues/27239

Per @paralin 

OpenVPN. I use Babel for route redistribution, and since Babel can't talk over the GCE networks, I use Google Cloud Networking routes to define the IP CIDRs I have behind the VPN. However, in my "remote datacenter" babel gossip works so I have it running on all the nodes. It results in a very robust setup.

Babel:

https://www.irif.univ-paris-diderot.fr/~jch/software/babel/

It's a really well known routing algorithm.

**Comment by chrislovecnm** [comment]
@thockin I have been meaning to pester you about this 😀   Might you give us your two cents.  I also know you are SUPER busy because of the 1.3 release...

**Comment by thockin** [comment]
Sorry, I'm, actually on vacation.

As of a few weeks ago (I forget the release but it was a 1.2.x where x != 0) (https://github.com/kubernetes/kubernetes/pull/24429) we fixed the routing such that any traffic that arrives at a node destined for a service IP will be handled as if it came to a node port.  This means you should be able to set yo static routes for your service cluster IP range to one or more nodes and the nodes will act as bridges.  This is the same trick most people do with flannel to bridge the overlay.

It's imperfect but it works.  In the future will will need to get more precise with the routing if you want optimal behavior (i.e. not losing the client IP), or we will see more non-kube-proxy implementations of services.

**Comment by paralin** [comment]
@thockin What if the source is from a node itself? Is it possible to create a static route to localhost?

**Comment by thockin** [comment]
When a node in the cluster accesses a cluster IP it is already captured.

On Sat, Jun 11, 2016 at 3:12 PM, Christian Stewart <notifications@github.com

**Comment by paralin** [comment]
@thockin The case I'm running into is, that I'm tunneling some remote traffic through a VPN, and I want cluster IPs to route through there properly. It seems that pod IPs route fine, but cluster IPs do not. 

I'll do some more experimenting and get back to you if I can't figure it out still. Have a good vacation!

**Comment by thockin** [comment]
What we set up fro GCE customers is a static route for the whole service IP
range to each of the nodes (ECMP).  Traffic through the VPN is subject to
those routing rules, arrives at a random node, is recognized as coming from
"outside this cluster" and is proxied to the Service IP.

On Sat, Jun 11, 2016 at 3:18 PM, Christian Stewart <notifications@github.com

**Comment by chrislovecnm** [comment]
@thockin have a great vacation, don't let us interrupt yah!!

**Comment by thockin** [comment]
I'm on a crazy half-way timezone still, so we're up but the world around us
is not :)

**Comment by chrislovecnm** [comment]
@thockin lol - so what cloud independent solution would you recommend? Soup to nuts ;P

**Comment by paralin** [comment]
@chrislovecnm Routing rules are not specific to GCE, he's just saying, route the traffic to the service IPs to any of the kubernetes nodes, and they will forward them properly. The problem I'm running into is that babel doesn't want to redistribute the route properly it seems.

**Comment by chrislovecnm** [comment]
all I know is that I am staying outta this and letting you network gurus work it out :P

**Comment by chrislovecnm** [comment]
Just ELIF when you all work it out ;)

**Comment by thockin** [comment]
The problem is that networking is VERY customized to every site, so it's hard to have a soup-to-nuts *anything*.  Whatever your routing infrastructure is, you can set up static routes that way.  It might be a conf file that configures `ip route` in your cluster nodes, or it might be a BGP config, or it might be some other vendor-centric control plane.

**Comment by thockin** [comment]
For GCE *specifically*:

* ensure each k8s cluster has a unique service IP range
* create 3+ static routes for each cluster where range = service range, next-hop = some node in that cluster
* bob's your uncle

**Comment by chrislovecnm** [comment]
Encrypted?

**Comment by chrislovecnm** [comment]
I am guessing traffic will go Internet?

**Comment by paralin** [comment]
@chrislovecnm This is simple IP routing, and on GCE, you can route between network locations seamlessly, it's just about telling the nodes in one region how to get to the pods in the other. I can walk you through it.

**Comment by thockin** [comment]
Not encrypted, no internet.  It only affects traffic already inside the perimiter

**Comment by paralin** [comment]
The solution (thanks @thockin !!)

Check the route on one of your nodes:

```
$ ip route get 10.0.0.1
10.0.0.1 via 10.128.0.1 dev eth0  src 10.128.0.3
```

Add this route on your remote device, where tap0 is your device that can "see" the node, and the IP is the ip address of the node:

`ip route add 10.0.0.0/16 dev tap0 via 10.5.0.1 proto static`

Works great.

@chrislovecnm Sorry to do this to you but can you open your old issue again?

**Comment by thockin** [comment]
This was not exactly what I meant.  I meant to use GCE's static routing API
(when in GCE, obv).

On Sat, Jun 11, 2016 at 5:57 PM, Christian Stewart <notifications@github.com

**Comment by chrislovecnm** [comment]
@paralin lets reopen this amigo 😄

**Comment by chrislovecnm** [comment]
@thockin does get us backend traffic over google wire not internet?

**Comment by thockin-cc** [comment]
Yes, stays within GCE as long as same virtual Network.  No public anything,
unless I deeply misunderstand

**Comment by paralin** [comment]
@chrislovecnm why reopen?
@thockin-cc I understand exactly what you're saying and will walk @chrislovecnm through it / document it down the line.

**Comment by chrislovecnm** [comment]
No worries I guess yah liked the other issue better

**Comment by thockin-cc** [comment]
Roger.  Thanks!

**Comment by ashmere** [comment]
@thockin is there any public docs on your gce soution as this is what I'm struggling with making the cluster service range available over a gce vpn.

**Comment by chrislovecnm** [comment]
@thockin should we reopen this?

**Comment by thockin** [comment]
@roberthbailey @cjcullen Do we have published docs on the services routing config "trick" ?

@ashmere It was broken for a couple of 1.2.x releases and was fixed in https://github.com/kubernetes/kubernetes/pull/24429

**Comment by ashmere** [comment]
@thockin I'm using v1.3.0 are we should it is fixed I get odd results some connections work others don't

simple example of connecting to kubernetes service ip from another gce project connected via gcp vpn
```
while true; do curl -k --max-time 5 https://<service range>.1/; sleep 2; done;
Unauthorized
Unauthorized
curl: (28) Connection timed out after 5000 milliseconds
Unauthorized
curl: (28) Connection timed out after 5000 milliseconds
Unauthorized
Unauthorized
```

**Comment by chrislovecnm** [comment]
Can someone reopen this please :)

**Comment by thockin** [comment]
@ashmere Can you share the static routes you set up?

**Comment by ashmere** [comment]
We are using coreos (stable) and v1.3.0 in gce with a custom cluster setup (i.e. not saltstack) with flannel networking (using gce backend).
I've configured a static route using gce api for the service ip range with a next hop of the one of the kube-masters (which is running the kube-proxy) priority 100.

**Comment by thockin** [comment]
@ashmere that's a complex setup.  why are you using flannel on GCE?  The node controller already knows how to handle GCE routing.  It smells like duplicate routes, to me.

**Comment by ashmere** [comment]
I don't appear to hve duplicate gce routes. but going to try running without flannel.

Think I must be doing something wrong when I try to stripe flannel out
```
kubelet.go:2479] skipping pod synchronization - [ConfigureCBR0 requested, but PodCIDR not set. Will not configure CBR0 right now]
```
all the containers appear to be running using the default docker networking 172.17.x.x

Passing on the kubelet options  --reconcile-cidr=true,  --configure-cbr0=true and on the controller-manager  --allocate-node-cidrs=true, --configure-cloud-routes=true

**Comment by thockin** [comment]
So for status, you can now get proper pod IPs and they can all reach each other?  And service IPs work from within nodes?  And you set up statis routes for your service IP range to one or more nodes?

Can you share your `gcloud compute routes list` ?

**Comment by ashmere** [comment]
Below is the routing info
```
NAME                                        NETWORK      DEST_RANGE       NEXT_HOP                                                 PRIORITY
default-route-8cb0d446ca80bae8              kube-lans   10.20.0.0/16                                                              1000
default-route-9bd7ab4d411d8997              kube-lans   0.0.0.0/0        default-internet-gateway                                 1000
kube-11e54845-5d7f-11e6-891a-42010a140003  kube-lans   10.120.1.0/24    europe-west1-d/instances/kube-core-0                    1000
kube-1250f76c-5d7f-11e6-9540-42010a140004  kube-lans   10.120.2.0/24    europe-west1-d/instances/kube-core-2                    1000
kube-13809ede-5d7f-11e6-b99a-42010a140002  kube-lans   10.120.3.0/24    europe-west1-d/instances/kube-core-1                    1000
kube-16d7e6f7-5d7f-11e6-9540-42010a140004  kube-lans   10.120.4.0/24    europe-west1-d/instances/kube-wk2-1                     1000
kube-1722998d-5d7f-11e6-9540-42010a140004  kube-lans   10.120.5.0/24    europe-west1-d/instances/kube-wk2-0                     1000
kube-56681c90-5d7f-11e6-9540-42010a140004  kube-lans   10.120.6.0/24    europe-west1-d/instances/kube-wk1-mb7r                  1000
kube-lans-service-ip-range-route1          kube-lans   10.220.254.0/24  europe-west1-d/instances/kube-core-0                    200
kube-lans-to-nonkube-1-route1              kube-lans   10.10.8.0/22   europe-west1/vpnTunnels/kube-to-nonkube-tunnel            100
```

**Comment by thockin** [comment]
I assume kube-lans-service-ip-range-route1 is the one you set up manually?
  10.220.254.0/24  is your service range?  did you create the VMs with
"can-ip-forward" ?  Did you check firewalls for the Service range?

**Comment by ashmere** [comment]
Yes all VM created with can-ip-forward and yes that is the manual service range route

**Comment by thockin** [comment]
firewalls?

**Comment by ashmere** [comment]
only firewalls are gce which are configured to allow traffic and as you can see on the example some of the requests work. (if there was a firewall issue none of them would work)

**Comment by kdima** [comment]
Quick update we still get a lot of packet loss when accessing service ip. We are only using GCE networking. This issue still persists after we moved to 1.4.0-alpha.3. 
Here is the output or a `curl` when running 1.4.0-alpha.3
```
while true; do curl -k --max-time 5 https://<service_ip>/; sleep 2; done;                                                    
Unauthorized
curl: (28) Connection timed out after 5001 milliseconds
Unauthorized
Unauthorized
curl: (28) Connection timed out after 5001 milliseconds
Unauthorized
```
As you can see there is not issue with firewalling as some requests succeed. 

We ran tcpdump on the box that is the gce route endpoint which is one of kubernetes api-servers. We can see all the traffic coming in:
```
source_ip.38926 > 10.220.254.1.https: Flags [S], seq 1700406661, win 28400, options [mss 1420,sackOK,TS val 2083749020 ecr 0,nop,wscale 7], length 0
source_ip.38926 > 10.20.0.4.sun-sr-https: Flags [S], seq 1700406661, win 28400, options [mss 1420,sackOK,TS val 2083749020 ecr 0,nop,wscale 7], length 0
source_ip.38926 > 10.220.254.1.https: Flags [S], seq 1700406661, win 28400, options [mss 1420,sackOK,TS val 2083750022 ecr 0,nop,wscale 7], length 0
source_ip.38926 > 10.20.0.4.sun-sr-https: Flags [S], seq 1700406661, win 28400, options [mss 1420,sackOK,TS val 2083750022 ecr 0,nop,wscale 7], length 0
source_ip.38926 > 10.220.254.1.https: Flags [S], seq 1700406661, win 28400, options [mss 1420,sackOK,TS val 2083752024 ecr 0,nop,wscale 7], length 0
source_ip.38926 > 10.20.0.4.sun-sr-https: Flags [S], seq 1700406661, win 28400, options [mss 1420,sackOK,TS val 2083752024 ecr 0,nop,wscale 7], length 0
```

`10.20.0.4` is address of an other box that is hosting the kubernetes-API service.

We assume that the traffic get correctly routed to the "active" kubernetes api-server via kube-proxy but the reply is getting lost.

**Comment by thockin** [comment]
What filter is being applied on that tcpdump?  There's obviously no replies in there, which would help a lot.  Also, please run with `-i any -n` to get most useful output.

even better run tcpdump at both the originating node and the destination node.

**Comment by kdima** [comment]
Sorry about the delay. 
Here is the tcp dump of the the timeout:

I am running the following command on my local box:
```
$ curl -k --max-time 5 https://10.220.254.1/           
curl: (28) Connection timed out after 5000 milliseconds
```

tcpdump on my local box:
```
sudo tcpdump -i any -n host 10.220.254.1
tcpdump: verbose output suppressed, use -v or -vv for full protocol decode
listening on any, link-type LINUX_SLL (Linux cooked), capture size 65535 bytes
IP 10.11.0.5.37273 > 10.220.254.1.443: Flags [S], seq 4026671374, win 23200, options [mss 1160,sackOK,TS val 174251689 ecr 0,nop,wscale 7], length 0
IP 10.11.0.5.37273 > 10.220.254.1.443: Flags [S], seq 4026671374, win 23200, options [mss 1160,sackOK,TS val 174251939 ecr 0,nop,wscale 7], length 0
IP 10.11.0.5.37273 > 10.220.254.1.443: Flags [S], seq 4026671374, win 23200, options [mss 1160,sackOK,TS val 174252440 ecr 0,nop,wscale 7], length 0
```

Tcp dump on the remote box inside k8s cluster that is the gateway:
```
tcpdump -i any -n port 443
IP 172.29.12.5.37273 > 10.220.254.1.https: Flags [S], seq 4026671374, win 23200, options [mss 1160,sackOK,TS val 174251689 ecr 0,nop,wscale 7], length 0
IP 172.29.12.5.37273 > 10.220.254.1.https: Flags [S], seq 4026671374, win 23200, options [mss 1160,sackOK,TS val 174251939 ecr 0,nop,wscale 7], length 0
IP 172.29.12.5.37273 > 10.220.254.1.https: Flags [S], seq 4026671374, win 23200, options [mss 1160,sackOK,TS val 174252440 ecr 0,nop,wscale 7], length 0
```

As you can see sequence numbers match on my local box and what was captured on the remote box. So the traffic is getting to the gateway box.

Here is a tcpdump of the case where traffic actually goes through:
Command I ran on my local box:
```
curl -k --max-time 5 https://10.220.254.1/ 
Unauthorized
```

Local box tcpdump
```
sudo tcpdump -i any -n host 10.220.254.1
IP 10.11.0.5.37567 > 10.220.254.1.443: Flags [S], seq 3864019960, win 23200, options [mss 1160,sackOK,TS val 174372844 ecr 0,nop,wscale 7], length 0
IP 10.220.254.1.443 > 10.11.0.5.37567: Flags [S.], seq 3620472236, ack 3864019961, win 28160, options [mss 1160,sackOK,TS val 89257878 ecr 174372844,nop,wscale 7], length 0
IP 10.11.0.5.37567 > 10.220.254.1.443: Flags [.], ack 1, win 182, options [nop,nop,TS val 174372847 ecr 89257878], length 0
IP 10.11.0.5.37567 > 10.220.254.1.443: Flags [P.], seq 1:274, ack 1, win 182, options [nop,nop,TS val 174372847 ecr 89257878], length 273
IP 10.220.254.1.443 > 10.11.0.5.37567: Flags [.], ack 274, win 229, options [nop,nop,TS val 89257888 ecr 174372847], length 0
IP 10.220.254.1.443 > 10.11.0.5.37567: Flags [P.], seq 1:55, ack 274, win 229, options [nop,nop,TS val 89257889 ecr 174372847], length 54
IP 10.11.0.5.37567 > 10.220.254.1.443: Flags [.], ack 55, win 182, options [nop,nop,TS val 174372849 ecr 89257889], length 0
IP 10.220.254.1.443 > 10.11.0.5.37567: Flags [.], seq 55:1203, ack 274, win 229, options [nop,nop,TS val 89257889 ecr 174372847], length 1148
IP 10.11.0.5.37567 > 10.220.254.1.443: Flags [.], ack 1203, win 200, options [nop,nop,TS val 174372849 ecr 89257889], length 0
IP 10.220.254.1.443 > 10.11.0.5.37567: Flags [.], seq 1203:2351, ack 274, win 229, options [nop,nop,TS val 89257889 ecr 174372847], length 1148
IP 10.11.0.5.37567 > 10.220.254.1.443: Flags [.], ack 2351, win 218, options [nop,nop,TS val 174372849 ecr 89257889], length 0
IP 10.220.254.1.443 > 10.11.0.5.37567: Flags [.], seq 2351:3499, ack 274, win 229, options [nop,nop,TS val 89257889 ecr 174372847], length 1148
IP 10.11.0.5.37567 > 10.220.254.1.443: Flags [.], ack 3499, win 236, options [nop,nop,TS val 174372849 ecr 89257889], length 0
IP 10.220.254.1.443 > 10.11.0.5.37567: Flags [P.], seq 3499:4312, ack 274, win 229, options [nop,nop,TS val 89257889 ecr 174372847], length 813
IP 10.11.0.5.37567 > 10.220.254.1.443: Flags [.], ack 4312, win 253, options [nop,nop,TS val 174372849 ecr 89257889], length 0
IP 10.220.254.1.443 > 10.11.0.5.37567: Flags [P.], seq 4312:4650, ack 274, win 229, options [nop,nop,TS val 89257895 ecr 174372847], length 338
IP 10.11.0.5.37567 > 10.220.254.1.443: Flags [.], ack 4650, win 271, options [nop,nop,TS val 174372851 ecr 89257895], length 0
IP 10.220.254.1.443 > 10.11.0.5.37567: Flags [P.], seq 4650:5008, ack 274, win 229, options [nop,nop,TS val 89257896 ecr 174372847], length 358
IP 10.11.0.5.37567 > 10.220.254.1.443: Flags [.], ack 5008, win 289, options [nop,nop,TS val 174372851 ecr 89257896], length 0
IP 10.220.254.1.443 > 10.11.0.5.37567: Flags [P.], seq 5008:5017, ack 274, win 229, options [nop,nop,TS val 89257896 ecr 174372847], length 9
IP 10.11.0.5.37567 > 10.220.254.1.443: Flags [.], ack 5017, win 289, options [nop,nop,TS val 174372851 ecr 89257896], length 0
IP 10.11.0.5.37567 > 10.220.254.1.443: Flags [P.], seq 274:412, ack 5017, win 289, options [nop,nop,TS val 174372851 ecr 89257896], length 138
IP 10.220.254.1.443 > 10.11.0.5.37567: Flags [P.], seq 5017:5023, ack 412, win 237, options [nop,nop,TS val 89257906 ecr 174372851], length 6
IP 10.220.254.1.443 > 10.11.0.5.37567: Flags [P.], seq 5023:5068, ack 412, win 237, options [nop,nop,TS val 89257906 ecr 174372851], length 45
IP 10.11.0.5.37567 > 10.220.254.1.443: Flags [.], ack 5068, win 289, options [nop,nop,TS val 174372854 ecr 89257906], length 0
IP 10.11.0.5.37567 > 10.220.254.1.443: Flags [P.], seq 412:517, ack 5068, win 289, options [nop,nop,TS val 174372854 ecr 89257906], length 105
IP 10.220.254.1.443 > 10.11.0.5.37567: Flags [P.], seq 5068:5270, ack 517, win 237, options [nop,nop,TS val 89257916 ecr 174372854], length 202
IP 10.11.0.5.37567 > 10.220.254.1.443: Flags [P.], seq 517:548, ack 5270, win 307, options [nop,nop,TS val 174372856 ecr 89257916], length 31
IP 10.11.0.5.37567 > 10.220.254.1.443: Flags [F.], seq 548, ack 5270, win 307, options [nop,nop,TS val 174372856 ecr 89257916], length 0
IP 10.220.254.1.443 > 10.11.0.5.37567: Flags [P.], seq 5270:5301, ack 549, win 237, options [nop,nop,TS val 89257926 ecr 174372856], length 31
IP 10.11.0.5.37567 > 10.220.254.1.443: Flags [R], seq 3864020509, win 0, length 0
IP 10.220.254.1.443 > 10.11.0.5.37567: Flags [F.], seq 5301, ack 549, win 237, options [nop,nop,TS val 89257926 ecr 174372856], length 0
IP 10.11.0.5.37567 > 10.220.254.1.443: Flags [R], seq 3864020509, win 0, length 0
```

Remote tcp dump
```
tcpdump -i any -n port 443
IP 172.29.12.5.37567 > 10.220.254.1.https: Flags [S], seq 3864019960, win 23200, options [mss 1160,sackOK,TS val 174372844 ecr 0,nop,wscale 7], length 0
IP 10.220.254.1.https > 172.29.12.5.37567: Flags [S.], seq 3620472236, ack 3864019961, win 28160, options [mss 1420,sackOK,TS val 89257878 ecr 174372844,nop,wscale 7], length 0
IP 172.29.12.5.37567 > 10.220.254.1.https: Flags [.], ack 1, win 182, options [nop,nop,TS val 174372847 ecr 89257878], length 0
IP 172.29.12.5.37567 > 10.220.254.1.https: Flags [P.], seq 1:274, ack 1, win 182, options [nop,nop,TS val 174372847 ecr 89257878], length 273
IP 10.220.254.1.https > 172.29.12.5.37567: Flags [.], ack 274, win 229, options [nop,nop,TS val 89257888 ecr 174372847], length 0
IP 10.220.254.1.https > 172.29.12.5.37567: Flags [P.], seq 1:55, ack 274, win 229, options [nop,nop,TS val 89257889 ecr 174372847], length 54
IP 10.220.254.1.https > 172.29.12.5.37567: Flags [.], seq 55:2351, ack 274, win 229, options [nop,nop,TS val 89257889 ecr 174372847], length 2296
IP 10.220.254.1.https > 172.29.12.5.37567: Flags [P.], seq 2351:4312, ack 274, win 229, options [nop,nop,TS val 89257889 ecr 174372847], length 1961
IP 10.220.254.1.https > 172.29.12.5.37567: Flags [P.], seq 4312:4650, ack 274, win 229, options [nop,nop,TS val 89257895 ecr 174372847], length 338
IP 10.220.254.1.https > 172.29.12.5.37567: Flags [P.], seq 4650:5008, ack 274, win 229, options [nop,nop,TS val 89257896 ecr 174372847], length 358
IP 10.220.254.1.https > 172.29.12.5.37567: Flags [P.], seq 5008:5017, ack 274, win 229, options [nop,nop,TS val 89257896 ecr 174372847], length 9
IP 172.29.12.5.37567 > 10.220.254.1.https: Flags [.], ack 55, win 182, options [nop,nop,TS val 174372849 ecr 89257889], length 0
IP 172.29.12.5.37567 > 10.220.254.1.https: Flags [.], ack 1203, win 200, options [nop,nop,TS val 174372849 ecr 89257889], length 0
IP 172.29.12.5.37567 > 10.220.254.1.https: Flags [.], ack 2351, win 218, options [nop,nop,TS val 174372849 ecr 89257889], length 0
IP 172.29.12.5.37567 > 10.220.254.1.https: Flags [.], ack 3499, win 236, options [nop,nop,TS val 174372849 ecr 89257889], length 0
IP 172.29.12.5.37567 > 10.220.254.1.https: Flags [.], ack 4312, win 253, options [nop,nop,TS val 174372849 ecr 89257889], length 0
IP 172.29.12.5.37567 > 10.220.254.1.https: Flags [.], ack 4650, win 271, options [nop,nop,TS val 174372851 ecr 89257895], length 0
IP 172.29.12.5.37567 > 10.220.254.1.https: Flags [.], ack 5008, win 289, options [nop,nop,TS val 174372851 ecr 89257896], length 0
IP 172.29.12.5.37567 > 10.220.254.1.https: Flags [.], ack 5017, win 289, options [nop,nop,TS val 174372851 ecr 89257896], length 0
IP 172.29.12.5.37567 > 10.220.254.1.https: Flags [P.], seq 274:412, ack 5017, win 289, options [nop,nop,TS val 174372851 ecr 89257896], length 138
IP 10.220.254.1.https > 172.29.12.5.37567: Flags [P.], seq 5017:5023, ack 412, win 237, options [nop,nop,TS val 89257906 ecr 174372851], length 6
IP 10.220.254.1.https > 172.29.12.5.37567: Flags [P.], seq 5023:5068, ack 412, win 237, options [nop,nop,TS val 89257906 ecr 174372851], length 45
IP 172.29.12.5.37567 > 10.220.254.1.https: Flags [P.], seq 412:517, ack 5068, win 289, options [nop,nop,TS val 174372854 ecr 89257906], length 105
IP 10.220.254.1.https > 172.29.12.5.37567: Flags [P.], seq 5068:5270, ack 517, win 237, options [nop,nop,TS val 89257916 ecr 174372854], length 202
IP 172.29.12.5.37567 > 10.220.254.1.https: Flags [P.], seq 517:548, ack 5270, win 307, options [nop,nop,TS val 174372856 ecr 89257916], length 31
IP 172.29.12.5.37567 > 10.220.254.1.https: Flags [F.], seq 548, ack 5270, win 307, options [nop,nop,TS val 174372856 ecr 89257916], length 0
IP 10.220.254.1.https > 172.29.12.5.37567: Flags [P.], seq 5270:5301, ack 549, win 237, options [nop,nop,TS val 89257926 ecr 174372856], length 31
IP 10.220.254.1.https > 172.29.12.5.37567: Flags [F.], seq 5301, ack 549, win 237, options [nop,nop,TS val 89257926 ecr 174372856], length 0
IP 172.29.12.5.37567 > 10.220.254.1.https: Flags [R], seq 3864020509, win 0, length 0
IP 172.29.12.5.37567 > 10.220.254.1.https: Flags [R], seq 3864020509, win 0, length 0
IP 1.2.3.4.https > 10.20.0.3.34318: Flags [P.], seq 479531611:479531674, ack 276920723, win 237, options [nop,nop,TS val 1085792045 ecr 89019131], length 63
IP 1.2.3.4.https > 10.20.0.3.34318: Flags [F.], seq 63, ack 1, win 237, options [nop,nop,TS val 1085792045 ecr 89019131], length 0
IP 10.20.0.3.34318 > 1.2.3.4.https: Flags [P.], seq 1:32, ack 64, win 1228, options [nop,nop,TS val 89259139 ecr 1085792045], length 31
IP 10.20.0.3.34318 > 1.2.3.4.https: Flags [F.], seq 32, ack 64, win 1228, options [nop,nop,TS val 89259139 ecr 1085792045], length 0
IP 1.2.3.4.https > 10.20.0.3.34318: Flags [R], seq 479531675, win 0, length 0
IP 1.2.3.4.https > 10.20.0.3.34318: Flags [R], seq 479531675, win 0, length 0
```

**Comment by thockin** [comment]
Can you clarify who the actors are? I see

```
P 10.11.0.5.37567 > 10.220.254.1.443: Flags [S], seq 3864019960, win 23200,
options [mss 1160,sackOK,TS val 174372844 ecr 0,nop,wscale 7], length 0
```

I assume 10.11.0.5 is the pod, and 10.220.254.1 is the Service?  If so, why
does the receiving end see:

```
IP 172.29.12.5.37567 > 10.220.254.1.https: Flags [S], seq 3864019960, win
23200, options [mss 1160,sackOK,TS val 174372844 ecr 0,nop,wscale 7],
length 0
```

First, who is 172.29.12.5 and why does he appear to be a NAT of 10.11.0.5
(same port)?

Second, why is 10.220.254.1 seen on the wire - if it is a Service IP, it
should be NAT'ed client side (unless you are doing something very different
than default).

Third, who is 1.2.3.4 in this dump?

**Comment by kdima** [comment]
I have realised that this tcp dump is a bit over complicated as I was running it from my local machine and thus going through multiple tunnels. Here is a different version where there is only one tunnel involved.
K8S api server service ip 10.220.254.1
VPN gateway is 10.20.0.3 this is where I am going to be running server side tcp dump.
K8S api server endpoint 10.20.0.2:6443

K8S api server:
```
$kubectl describe svc kubernetes

Name:                   kubernetes
Namespace:              default
Labels:                 component=apiserver
                        provider=kubernetes
Selector:               <none>
Type:                   ClusterIP
IP:                     10.220.254.1
Port:                   https   443/TCP
Endpoints:              10.20.0.2:6443
Session Affinity:       ClientIP
No events.%     
```

Running curl from 172.29.12.6. It has a vpn tunnel to k8s cluster using 10.20.0.3 as the gateway.
```
curl -k --max-time 5 https://10.220.254.1
curl: (28) Connection timed out after 5000 milliseconds
```

I run tcp dump on 172.29.12.6
```
[root@172.29.12.6]# tcpdump -i any -n port 443
tcpdump: verbose output suppressed, use -v or -vv for full protocol decode                                           
listening on any, link-type LINUX_SLL (Linux cooked), capture size 262144 bytes                                      
15:01:58.543754 IP 172.29.12.6.46476 > 10.220.254.1.https: Flags [S], seq 2230218670, win 28400, options [mss 1420,sackOK,TS val 1226976533 ecr 0,nop,wscale 7], length 0                                                                 
15:01:59.546643 IP 172.29.12.6.46476 > 10.220.254.1.https: Flags [S], seq 2230218670, win 28400, options [mss 1420,sackOK,TS val 1226977536 ecr 0,nop,wscale 7], length 0                                                                 
15:02:01.550667 IP 172.29.12.6.46476 > 10.220.254.1.https: Flags [S], seq 2230218670, win 28400, options [mss 1420,sackOK,TS val 1226979540 ecr 0,nop,wscale 7], length 0        
```

Tcpdump on the gateway box 10.20.0.3
```
[root@10.20.0.3]#  tcpdump -i any -n host 172.29.12.6
tcpdump: verbose output suppressed, use -v or -vv for full protocol decode
listening on any, link-type LINUX_SLL (Linux cooked), capture size 262144 bytes
15:01:58.545530 IP 172.29.12.6.46476 > 10.220.254.1.https: Flags [S], seq 2230218670, win 28400, options [mss 1420,sackOK,TS val 1226976533 ecr 0,nop,wscale 7], length 0
15:01:58.545583 IP 172.29.12.6.46476 > 10.20.0.2.sun-sr-https: Flags [S], seq 2230218670, win 28400, options [mss 1420,sackOK,TS val 1226976533 ecr 0,nop,wscale 7], length 0
15:01:59.547851 IP 172.29.12.6.46476 > 10.220.254.1.https: Flags [S], seq 2230218670, win 28400, options [mss 1420,sackOK,TS val 1226977536 ecr 0,nop,wscale 7], length 0
15:01:59.547881 IP 172.29.12.6.46476 > 10.20.0.2.sun-sr-https: Flags [S], seq 2230218670, win 28400, options [mss 1420,sackOK,TS val 1226977536 ecr 0,nop,wscale 7], length 0
15:02:01.551497 IP 172.29.12.6.46476 > 10.220.254.1.https: Flags [S], seq 2230218670, win 28400, options [mss 1420,sackOK,TS val 1226979540 ecr 0,nop,wscale 7], length 0
15:02:01.551528 IP 172.29.12.6.46476 > 10.20.0.2.sun-sr-https: Flags [S], seq 2230218670, win 28400, options [mss 1420,sackOK,TS val 1226979540 ecr 0,nop,wscale 7], length 0
```
Here a new ip appears the 10.20.0.2. This is the ip address of the pod where kubernetes api server currently is.

```
[root@10.20.0.2~]# tcpdump -i any -n host 172.29.12.6
tcpdump: verbose output suppressed, use -v or -vv for full protocol decode
listening on any, link-type LINUX_SLL (Linux cooked), capture size 262144 bytes
15:01:58.545963 IP 172.29.12.6.46476 > 10.20.0.2.sun-sr-https: Flags [S], seq 2230218670, win 28400, options [mss 1420,sackOK,TS val 1226976533 ecr 0,nop,wscale 7], length 0
15:01:58.546007 IP 10.20.0.2.sun-sr-https > 172.29.12.6.46476: Flags [S.], seq 2058743368, ack 2230218671, win 28160, options [mss 1420,sackOK,TS val 190681009 ecr 1226976533,nop,wscale 7], length 0
15:01:58.548666 IP 172.29.12.6.46476 > 10.20.0.2.sun-sr-https: Flags [R], seq 2230218671, win 0, length 0
15:01:59.547921 IP 172.29.12.6.46476 > 10.20.0.2.sun-sr-https: Flags [S], seq 2230218670, win 28400, options [mss 1420,sackOK,TS val 1226977536 ecr 0,nop,wscale 7], length 0
15:01:59.547984 IP 10.20.0.2.sun-sr-https > 172.29.12.6.46476: Flags [S.], seq 2074399197, ack 2230218671, win 28160, options [mss 1420,sackOK,TS val 190682011 ecr 1226977536,nop,wscale 7], length 0
15:01:59.550169 IP 172.29.12.6.46476 > 10.20.0.2.sun-sr-https: Flags [R], seq 2230218671, win 0, length 0
15:02:01.551531 IP 172.29.12.6.46476 > 10.20.0.2.sun-sr-https: Flags [S], seq 2230218670, win 28400, options [mss 1420,sackOK,TS val 1226979540 ecr 0,nop,wscale 7], length 0
15:02:01.551617 IP 10.20.0.2.sun-sr-https > 172.29.12.6.46476: Flags [S.], seq 2105705832, ack 2230218671, win 28160, options [mss 1420,sackOK,TS val 190684015 ecr 1226979540,nop,wscale 7], length 0
15:02:01.553719 IP 172.29.12.6.46476 > 10.20.0.2.sun-sr-https: Flags [R], seq 2230218671, win 0, length 0
```

It looks like what happens is traffic arrives from my ip `172.29.12.6` to the gateway on `10.20.0.3`. From there it is redirected to the actual k8s api server
endpoint that is on `10.20.0.2`. When the packet gets to `10.20.0.2` it replies with `Syn-Ack` but the source ip is `10.20.0.2` at which point the connection is reset.

**Comment by thockin** [comment]
The kube-proxy has performed a DNAT, the return path needs to go back
through the gateway.  The iptables rules are supposed to SNAT in this case.

@freehan @cjcullen I swear this was working before - are we collectively
hallucinating or did we regress somewhere?

**Comment by mwitkow** [comment]
@thockin just to clarify @kdima's above post:
The setup we have is from a management cluster we have running in a different GCE project (let's call it `global-1`) calling into a K8S cluster running in a different GCE project (let's call it `h-stg`). They are connected using the GCE VPN:

The relevant GCE networking routes for the `global-1` look as follows:
```
global-1-to-kube-staging-network-route1
  range: 10.20.0.0/16	next hop: global-1-to-kube-staging-tunnel	
global-1-to-kube-staging-pod-route1
  range: 10.120.0.0/16	 next hop: global-1-to-kube-staging-tunnel	
global-1-to-kube-staging-service-route1	
  range:  10.220.254.0/24 next hop: global-1-to-kube-staging-tunnel	
```
The GCE routes for `kube-staging` look as:
```
h-stg-staging-to-global-1-route1	
  range: 172.29.12.0/22 next hop: h-stg-to-global-1-tunnel
h-stg-service-ip-range-route1	
 range: 10.220.254.0/24 next hop: h-stg-core-0 (*here the "gateway"*, 10.20.0.3)
```
Please note that that we're seeing this on the `v1.4.0-beta.8` version (and before on `1.3`) since we are also testing the new external LB functionality as reported in https://github.com/kubernetes/kubernetes/issues/33081

Unfortunately, the way it looks, this problem is currently a blocker for us to move to K8S in our current multi-cluster, multi-network setup.

**Comment by freehan** [comment]
@kdima 
Would you mind sharing the output of `ifconfig` and `iptable-save` on `kube-core-0`?

**Comment by freehan** [comment]
I tried something simpler just now. 

I created a route from a vm to a cluster node thru service cluster ip cidr. Then the vm was able to reach services cluster ip. 

SNAT should be applied if request source ip is NOT from pod cidr range of current node.

**Comment by kdima** [comment]
I had to recreate the cluster so some ips have changed. Now this is the gateway node ip `10.20.0.4`

```
core@10.20.0.4~ $ ifconfig
docker0: flags=4099<UP,BROADCAST,MULTICAST>  mtu 1500
        inet 172.17.0.1  netmask 255.255.0.0  broadcast 0.0.0.0
        inet6 fe80::42:75ff:fe34:17d0  prefixlen 64  scopeid 0x20<link>
        ether 02:42:75:34:17:d0  txqueuelen 0  (Ethernet)
        RX packets 7  bytes 520 (520.0 B)
        RX errors 0  dropped 0  overruns 0  frame 0
        TX packets 4  bytes 348 (348.0 B)
        TX errors 0  dropped 0 overruns 0  carrier 0  collisions 0

ens4v1: flags=4163<UP,BROADCAST,RUNNING,MULTICAST>  mtu 1460
        inet 10.20.0.4  netmask 255.255.255.255  broadcast 10.20.0.4
        inet6 fe80::4001:aff:fe14:4  prefixlen 64  scopeid 0x20<link>
        ether 42:01:0a:14:00:04  txqueuelen 1000  (Ethernet)
        RX packets 35480  bytes 240873813 (229.7 MiB)
        RX errors 0  dropped 0  overruns 0  frame 0
        TX packets 32637  bytes 4777828 (4.5 MiB)
        TX errors 0  dropped 0 overruns 0  carrier 0  collisions 0

lo: flags=73<UP,LOOPBACK,RUNNING>  mtu 65536
        inet 127.0.0.1  netmask 255.0.0.0
        inet6 ::1  prefixlen 128  scopeid 0x10<host>
        loop  txqueuelen 1  (Local Loopback)
        RX packets 5240  bytes 2083582 (1.9 MiB)
        RX errors 0  dropped 0  overruns 0  frame 0
        TX packets 5240  bytes 2083582 (1.9 MiB)
        TX errors 0  dropped 0 overruns 0  carrier 0  collisions 0
```        

```
core@10.20.0.4~ $ sudo iptables-save
# Generated by iptables-save v1.4.21 on Fri Sep 23 12:55:48 2016
*nat
:PREROUTING ACCEPT [0:0]
:INPUT ACCEPT [0:0]
:OUTPUT ACCEPT [2:136]
:POSTROUTING ACCEPT [2:136]
:KUBE-MARK-DROP - [0:0]
:KUBE-MARK-MASQ - [0:0]
:KUBE-NODEPORTS - [0:0]
:KUBE-POSTROUTING - [0:0]
:KUBE-SEP-IBD4BOICCJNOIDCC - [0:0]
:KUBE-SERVICES - [0:0]
:KUBE-SVC-NPX46M4PTMTKRN6Y - [0:0]
-A PREROUTING -m comment --comment "kubernetes service portals" -j KUBE-SERVICES
-A OUTPUT -m comment --comment "kubernetes service portals" -j KUBE-SERVICES
-A POSTROUTING -m comment --comment "kubernetes postrouting rules" -j KUBE-POSTROUTING
-A POSTROUTING ! -d 10.0.0.0/8 -m comment --comment "kubenet: SNAT for outbound traffic from cluster" -m addrtype ! --dst-type LOCAL -j MASQUERADE
-A KUBE-MARK-DROP -j MARK --set-xmark 0x8000/0x8000
-A KUBE-MARK-MASQ -j MARK --set-xmark 0x4000/0x4000
-A KUBE-POSTROUTING -m comment --comment "kubernetes service traffic requiring SNAT" -m mark --mark 0x4000/0x4000 -j MASQUERADE
-A KUBE-SEP-IBD4BOICCJNOIDCC -s 10.20.0.4/32 -m comment --comment "default/kubernetes:https" -j KUBE-MARK-MASQ
-A KUBE-SEP-IBD4BOICCJNOIDCC -p tcp -m comment --comment "default/kubernetes:https" -m recent --set --name KUBE-SEP-IBD4BOICCJNOIDCC --mask 255.255.255.255 --rsource -m tcp -j DNAT --to-destination 10.20.0.4:6443
-A KUBE-SERVICES -d 10.220.254.1/32 -p tcp -m comment --comment "default/kubernetes:https cluster IP" -m tcp --dport 443 -j KUBE-SVC-NPX46M4PTMTKRN6Y
-A KUBE-SERVICES -m comment --comment "kubernetes service nodeports; NOTE: this must be the last rule in this chain" -m addrtype --dst-type LOCAL -j KUBE-NODEPORTS
-A KUBE-SVC-NPX46M4PTMTKRN6Y -m comment --comment "default/kubernetes:https" -m recent --rcheck --seconds 180 --reap --name KUBE-SEP-IBD4BOICCJNOIDCC --mask 255.255.255.255 --rsource -j KUBE-SEP-IBD4BOICCJNOIDCC
-A KUBE-SVC-NPX46M4PTMTKRN6Y -m comment --comment "default/kubernetes:https" -j KUBE-SEP-IBD4BOICCJNOIDCC
COMMIT
# Completed on Fri Sep 23 12:55:48 2016
# Generated by iptables-save v1.4.21 on Fri Sep 23 12:55:48 2016
*filter
:INPUT ACCEPT [35:5598]
:FORWARD ACCEPT [0:0]
:OUTPUT ACCEPT [39:7480]
:ACCOUNT - [0:0]
:KUBE-FIREWALL - [0:0]
:KUBE-SERVICES - [0:0]
-A INPUT -j KUBE-FIREWALL
-A FORWARD -i docker0 -j ACCOUNT
-A OUTPUT -m comment --comment "kubernetes service portals" -j KUBE-SERVICES
-A OUTPUT -j KUBE-FIREWALL
-A OUTPUT -j ACCOUNT
-A ACCOUNT ! -d 10.20.0.0/22 -o ens4v1 -j RETURN
-A KUBE-FIREWALL -m comment --comment "kubernetes firewall for dropping marked packets" -m mark --mark 0x8000/0x8000 -j DROP
COMMIT
# Completed on Fri Sep 23 12:55:48 2016
```

**Comment by thockin** [comment]
If this (missing SNAT) is really a bug, can someone re-title this bug and
tag for v1.5

**Comment by freehan** [comment]
@kdima Can you provide the parameter config on kube-proxy? I am wondering if `cluster-cidr` is set.

**Comment by gg7** [comment]
To those coming here from Google Search: I have experienced a similar issue (using k8s nodes as gateways to access service IPs did not work) before. The solution in my case was to:

1. Properly restart the networking and kube-proxy services, making sure all iptables rules get cleared before kube-proxy gets restarted.
1. Enable promiscuous mode on the bridge device (`ip link set cbr0 promisc on`).

**Comment by ashmere** [comment]
@freehan that was the bit of information we were missing we had set the cluster-cidr only on the kube-controller-manager not on the kube-proxy, once this is set we aren't seeing this issue anymore.

Is there any reason kube-proxy doesn't get this information from the kube-controller-manager like it gets the service ip range from it?

**Comment by thockin** [comment]
We are in the beginning of a process to move a lot of config to ConfigMap
structures, but it will take a while.

**Comment by thockin** [comment]
Promiscuous should already be set - are you setting kubelet's
`--hairpin-mode=promiscuous-bridge` flag?

**Comment by gg7** [comment]
> Promiscuous should already be set - are you setting kubelet's
> `--hairpin-mode=promiscuous-bridge` flag?

Yes (that's the default and I haven't overridden it). However, since I use `--configure-cbr0=false`, this seems to have no effect:

```
kubelet[14200]: W0927 17:23:17.086216   14200 kubelet.go:572] Hairpin mode set to "promiscuous-bridge" but configureCBR0 is false, falling back to "hairpin-veth"
```

**Comment by thockin** [comment]
Ahh, interesting intersection.  Why are you setting --configure-cbr0=false ?

**Comment by gg7** [comment]
> Ahh, interesting intersection.  Why are you setting --configure-cbr0=false ?

Decided to have networking configuration handled by the OS. I have to insert custom routes, add another IP address, and disable STP. I simply didn't want to risk Kubernetes doing something wrong / eating my configuration. It'd be nice if this was better documented though -- it's hard to spot the kubelet warning.

**Comment by thockin** [comment]
configure-cbr0 should only set the CIDR and promisc mode of the broidge

**Comment by gg7** [comment]
> configure-cbr0 should only set the CIDR and promisc mode of the broidge

If "set the CIDR" == `ip addr add x.x.x.x/c dev $IFACE` ([seems like it](https://github.com/kubernetes/kubernetes/blob/cf7301f16c036363c4fdcb5d4d0c867720214598/pkg/kubelet/container_bridge.go#L42)), then that won't work in my case because of a [Docker bug](https://github.com/docker/docker/issues/26341).

**Comment by thockin** [comment]
Docker should not be touching cbr0 any more.
