### ISSUE TITLE
Packets from service sometimes arrive with the IP of pod, not service

### ISSUE THREAD

**Issue by sagor999** [kubernetes/kubernetes#93337]
**What happened**:
When a pod communicates with the service, traffic comes and goes to the IP of the service, but sometimes traffic arrives with the IP of underlying pod, which causes connection to be reset.

**What you expected to happen**:
All traffic with the service should be coming from the service's IP.

**How to reproduce it (as minimally and precisely as possible)**:
Take a look at this wireshark capture:
![Screenshot from 2020-07-22 08-01-36](https://user-images.githubusercontent.com/18602811/88197521-7516a380-cbf7-11ea-8bee-5ed046131c5b.png)
`192.168.46.136` is the IP of the pod that is experiencing connection reset.
`10.111.254.78` is the service IP of redis service.
Look at packet `14637`. `192.168.236.76` is the IP of redis pod itself.
Notice that that packet for some reason has arrived directly from redis pod, instead of properly being replaced with service IP.
That caused connection to get reset.
Target pod and redis pod are located on different nodes.

**Anything else we need to know?**:
This is hard to reproduce bug, as even in our environment it doesn't happen all the time, but it does happen at least several times a day.
But it seems to happen most often right when pod and other pods are starting up. 

**Environment**:
- Kubernetes version (use `kubectl version`):
Server Version: version.Info{Major:"1", Minor:"17", GitVersion:"v1.17.3", GitCommit:"06ad960bfd03b39c8310aaf92d1e7c12ce618213", GitTreeState:"clean", BuildDate:"2020-02-11T18:07:13Z", GoVersion:"go1.13.6", Compiler:"gc", Platform:"linux/amd64"}

- Cloud provider or hardware configuration: barebone
- OS (e.g: `cat /etc/os-release`):
Ubuntu 18.04.4 LTS
- Kernel (e.g. `uname -a`):
5.3.0-62-generic 56~18.04.1-Ubuntu SMP Wed Jun 24 16:17:03 UTC 2020 x86_64 x86_64 x86_64 GNU/Linux
- Install tools:
- Network plugin and version (if this is a network-related bug): Calico 3.15.1
- Others:

I opened similar issue with calico, as I am not sure if this is caused by calico or by kube-proxy.
https://github.com/projectcalico/calico/issues/3821

**Comment by athenabot** [comment]
/triage unresolved

Comment `/remove-triage unresolved` when the issue is assessed and confirmed.

🤖 I am a bot run by vllry. 👩‍🔬

**Comment by uablrek** [comment]
Which proxy-mode? Ipvs or iptables? Or Calico in eBPF mode?

If you use Calico in eBPF mode I would say this is a Calico problem.

**Comment by sagor999** [comment]
@uablrek yes. proxy mode = iptables. Calico is NOT in eBPF mode.

**Comment by uablrek** [comment]
If the entry for the connection in the connection tracker (conntrack) on the node where the client POD executes is lost this will happen. Why the connection would be lost I can't say. The packet is a keep-alive which may indicate that the connection has been idle for a long time and the conntrack entry has timed out. However this should not normally happen unless the conntrack timers or the keep-aliive timeout has been modified. I would anyway recommend some trouble-shooting with conntrack tools on the client node and to check the keep-alive and conntrack timeout settings.

**Comment by uablrek** [comment]
Find conntrack settings for kube-proxy here; https://kubernetes.io/docs/reference/command-line-tools-reference/kube-proxy/

**Comment by sagor999** [comment]
Connection has only been idle for about 20 seconds. So I don't think it would timeout that fast.
I did check our conntrack settings for kube-proxy, and they are all default.
Just to confirm, this is what I see in logs for kube-proxy:
```
│ I0717 13:40:52.102414       1 conntrack.go:100] Set sysctl 'net/netfilter/nf_conntrack_max' to 2359296
│ I0717 13:40:52.102452       1 conntrack.go:52] Setting nf_conntrack_max to 2359296
│ I0717 13:40:52.102867       1 conntrack.go:83] Setting conntrack hashsize to 589824
│ I0717 13:40:52.272053       1 conntrack.go:100] Set sysctl 'net/netfilter/nf_conntrack_tcp_timeout_established' to 86400
│ I0717 13:40:52.272170       1 conntrack.go:100] Set sysctl 'net/netfilter/nf_conntrack_tcp_timeout_close_wait' to 3600
```
We are also not even close to conntrack max entries. Highest number for conntrack entries is about 150k, while max is 2.3M.

**Comment by sagor999** [comment]
@uablrek what would be the best way to diagnose why an entry would be missing from conntrack? Especially that it happens when the pod is already running, and seems to happen for only a small amount of time, as 99% of traffic is being properly conntracked.

**Comment by sagor999** [comment]
@uablrek any ideas how to better debug this issue?

**Comment by sagor999** [comment]
@bridgetkromhout would it be possible to have someone else from sig network to take a look at this issue as well and maybe provide some insight?

**Comment by uablrek** [comment]
Sorry for the late reply. I commented and got assigned during my vacation. Anyway...

I made a local test;
* Connect through a service
* Trace in the client pod with `tcpdump`
* Remove the conntrack entry on the client node with `conntrack -D --dst <clusterIP>`

I can confirm that the symptoms are consistent with what you are seeing, NAT does not work and packets appear in the client POD with the server pod-address as source;
```
...
10:12:05.177360 IP 12.0.2.53.5001 > 11.0.0.2.37100: Flags [.], ack 1, win 510, options [nop,nop,TS val 3712725341 ecr 4035131607], length 0
10:12:05.177457 IP 11.0.0.2.37100 > 12.0.2.53.5001: Flags [.], ack 1, win 502, options [nop,nop,TS val 4035146711 ecr 3712513956], length 0
10:12:20.281762 IP 11.0.2.2.5001 > 11.0.0.2.37100: Flags [.], ack 1729403400, win 510, options [nop,nop,TS val 3712740446 ecr 4035146711], length 0
10:12:20.281791 IP 11.0.0.2.37100 > 11.0.2.2.5001: Flags [R], seq 1729403400, win 0, length 0
```
That said it *may* be other things that can cause this behavior but I can not think of any so I will assume that disappearing contrack entry is the cause.

Unless this can be recreated in a consistent way I would say it is extremly hard to troubleshoot. It may be something that appears on your system only but since it is so infrequent it also may be something that happens all the time but is discarded as some temporary hicup.

I can't even think of a way to catch this on-the-fly in your system when it happens.

Basically you may have to be lucky and find some one who recognizes the problem. This issue has been triaged on the sig/network meeting (I was not attending) and since I got assigned I assume nobody at the meeting recognized the problem.

> But it seems to happen most often right when pod and other pods are starting up.

I will try to scale-up a deployment while having the connection established to see if that can provoke the problem. But then I am basically out of ideas.

### Some good news

I do not see this problem with proxy-mode=ipvs. When I delete the conntrack entry it is re-created when the next packet arrives. Apparently `ipvs` does it's own NAT that may be more stable.

So if you don't care what the problem is but just want to get rid of it switching to proxy-mode=ipvs might be a work-around.

**Comment by uablrek** [comment]
I think I can reproduce the fault but I *really* want someone else to confirm this since my test cluster is a bit "odd".

Setup

```
Workers: 4
K8s Version: v1.18.5
Linux kernel; 5.7.6
CNI-plugin; calico/cni:v3.14.0
CRI-plugin; cri-o/1.18.1
Proxy-mode: "iptables"
```

* A DaemonSet running continuous traffic trough a service and monitor connection failures.
* A Deployment only used for scaling. This have a service to make sure `kube-proxy` does something when the Deployment is scaled.
* Scale up/down the Deployment and check for connection failures in the DaemonSet

Quite often there are a few failed connections, but not always.

The [ctraffic](https://github.com/Nordix/ctraffic) program is used to generate continuous traffic. The DaemonSet is created using [mserver-daemonset.yaml.txt](https://github.com/kubernetes/kubernetes/files/5001486/mserver-daemonset.yaml.txt).

Once deployed on your system run ctraffic from inside a POD;

```
pod=$(kubectl get pods -l app=mserver -o name | head -1)
kubectl exec -it $pod -- sh
# In the pod;
ctraffic -address mserver-deployment:5003 -timeout 2m -nconn 12 -rate 12 -monitor
```

While this is running scale out/in the Deployment. I guess any Deployment (with a service) will do. I use [mserver-deployment.yaml.txt](https://github.com/kubernetes/kubernetes/files/5001488/mserver-deployment.yaml.txt).

Scale out/in;
```
kubectl scale --replicas=16 deployment/mserver-deployment
kubectl scale --replicas=2 deployment/mserver-deployment
```

Check the monitor printouts from `ctraffic`;
```
...
Conn act/fail/connecting: 12/9/0, Packets send/rec/dropped: 14077/14068/0
Conn act/fail/connecting: 12/9/0, Packets send/rec/dropped: 14197/14188/0
...
```

I will do some tests with `tcpdump` before I remove the triage/unresolved labe.

**Comment by athenabot** [comment]
@uablrek
If this issue has been triaged, please comment `/remove-triage unresolved`.

If you aren't able to handle this issue, consider unassigning yourself and/or adding the `help-wanted` label.

🤖 I am a bot run by vllry. 👩‍🔬

**Comment by uablrek** [comment]
I can't reproduce this problem by aggressively start/stop PODs (see the test above). It does however happen infrequently in the issuers system so "not-reproducible" is incorrect. I triage this as a bug.

/remove-triage unresolved

If this can't be reproduced in a controllable way I fear it requires that somebody recognizes the problem from previous experience.

I have assumed that the non-working NAT is caused by that the conntrack entry is removed, but somebody may have some other idea.

**Comment by uablrek** [comment]
@sagor999 Have you tried to switch to proxy-mode=ipvs?

**Comment by sagor999** [comment]
@uablrek I am in the process of testing out ipvs mode. 
Thank you for trying to repro the issue. Even on our end it doesn't happen often.

**Comment by spacetc62** [comment]
As an additional data point, I have at least one cluster (possibly additional ones, have not proven it yet) that are exhibiting this same issue on GKE. We recently upgraded from 1.16.13-gke.401 to 1.17.13-gke.1400, and started seeing intermittent connection reset errors, and after digging in discovered that we are seeing exactly what this issue describes.

Example tcp dump log from some of my testing (an nginx pod proxying traffic to a mqtt broker service):

```
16:07:55.253788 IP broker.default.svc.cluster.local.1883 > nginx-proxy2-z6jdh.58700: Flags [P.], seq 1:5, ack 184, win 340, options [nop,nop,TS val 804201543 ecr 2126407394], length 4
16:07:55.253806 IP nginx-proxy2-z6jdh.58700 > broker.default.svc.cluster.local.1883: Flags [.], ack 5, win 333, options [nop,nop,TS val 2126407458 ecr 804201543], length 0
16:08:25.377273 IP nginx-proxy2-z6jdh.58700 > broker.default.svc.cluster.local.1883: Flags [P.], seq 184:186, ack 5, win 333, options [nop,nop,TS val 2126437582 ecr 804201543], length 2
16:08:25.377403 IP broker.default.svc.cluster.local.1883 > nginx-proxy2-z6jdh.58700: Flags [R], seq 1141508656, win 0, length 0
16:08:40.254477 IP 10.128.1.13.1883 > nginx-proxy2-z6jdh.58700: Flags [F.], seq 1141508656, ack 3772205011, win 340, options [nop,nop,TS val 804246544 ecr 2126407458], length 0
16:08:40.254508 IP nginx-proxy2-z6jdh.58700 > 10.128.1.13.1883: Flags [R], seq 3772205011, win 0, length 0
16:09:25.510112 IP nginx-proxy2-z6jdh.59570 > broker.default.svc.cluster.local.1883: Flags [S], seq 3287187340, win 42600, options [mss 1420,sackOK,TS val 2126497715 ecr 0,nop,wscale 7], length 0
16:09:25.511158 IP broker.default.svc.cluster.local.1883 > nginx-proxy2-z6jdh.59570: Flags [S.], seq 2554505676, ack 3287187341, win 43648, options [mss 1420,sackOK,TS val 804291800 ecr 2126497715,nop,wscale 7], length 0
```

That line there with an IP address instead of a name, thats the IP of a broker pod behind the broker service - and that causes nginx to error the connection.

Interesting additional note, at least for us the issue only seems to occur when the pods are on the *same* node, and does not occur (or at the very least, occurs much less frequently) when the pods are on *different* nodes. Also, because I'm on GKE, I'm unable to try out ipvs mode, as GKE does not support that. I have also filed a google support ticket, because perhaps the issue that I'm seeing is specifically with GKE.

**Comment by spacetc62** [comment]
An update to the above - after additional testing it seems to be an interaction with the GKE's [Intranode Visibility](https://cloud.google.com/kubernetes-engine/docs/how-to/intranode-visibility) setting. When that is enabled, a pod talking through a service to a pod on the *same node* will on occasion cause the above behavior. This suggests to me that at least for my issue, it probably a GKE-specific issue - and I'm working with Google support to try and isolated and consistently reproduce.

**Comment by sagor999** [comment]
Wanted to update this. We have switched our cluster from kube-proxy to Calico CNI using eBPF mode and completely disabled kube-proxy and no longer seeing this issue.
Not sure if the problem was with kube-proxy or with iptables mode in kube-proxy. We were not able to try out ipvs mode due to some ipvs limitations.
