### ISSUE TITLE
Using ipvs and hostNetwork=True causes pods not able to communicate with service addresses

### ISSUE THREAD

**Issue by baelish** [kubernetes/kubernetes#63985]
/kind bug
/sig Network
@kubernetes/sig-Network-bugs

**What happened**:
kube2iam pods on our 1.10.1 cluster failed to communicate with kube-api-server on service ip 100.64.0.1
```>kubectl logs -n kube-system kube2iam-xxlcv
time="2018-05-17T13:34:26Z" level=info msg="base ARN autodetected, arn:aws:iam::****************:role/"
E0517 13:34:56.853102       1 reflector.go:199] github.com/jtblin/kube2iam/vendor/k8s.io/client-go/tools/cache/reflector.go:94: Failed to list *v1.Namespace: Get https://100.64.0.1:443/api/v1/namespaces?resourceVersion=0: dial tcp 100.64.0.1:443: i/o timeout
```
**What you expected to happen**:
kube2iam pods being able to communicate with kube-api-server

**How to reproduce it (as minimally and precisely as possible)**:
On an IPVS enabled cluster run a pod with hostNetwork=true and attempt to communicate with the api-server on IPVS address e.g. `curl -ks 100.64.0.1:443`. If it just sits there and/or finally times out the problem I experienced is correctly reproduced.

Note: I suspect that you could reach services which are served by a pod on the same node as your test pod so pick a service that is not served by a pod on the same node.

**Anything else we need to know?**:
Cause:
This issue is caused by a failure to masquerade the packets behind the leaving interface's address. IPVS translates the source to the service address (100.64.0.1 in our case) and sends it out of the external interface.
```
>tcpdump -i ens3 -f port 6443
tcpdump: verbose output suppressed, use -v or -vv for full protocol decode
listening on ens3, link-type EN10MB (Ethernet), capture size 262144 bytes
16:08:00.827566 IP 100.64.0.1.45844 > 10.1.11.75.6443: Flags [S], seq 2072723696, win 43690, options [mss 65495,sackOK,TS val 435163552 ecr 0,nop,wscale 7], length 0
16:08:00.827600 IP 100.64.0.1.45846 > 10.1.11.75.6443: Flags [S], seq 2605133727, win 43690, options [mss 65495,sackOK,TS val 435163552 ecr 0,nop,wscale 7], length 0
16:08:04.827580 IP 100.64.0.1.45826 > 10.1.11.75.6443: Flags [S], seq 2456920056, win 43690, options [mss 65495,sackOK,TS val 435164552 ecr 0,nop,wscale 7], length 0
16:08:08.843563 IP 100.64.0.1.45844 > 10.1.11.75.6443: Flags [S], seq 2072723696, win 43690, options [mss 65495,sackOK,TS val 435165556 ecr 0,nop,wscale 7], length 0
16:08:08.843609 IP 100.64.0.1.45846 > 10.1.11.75.6443: Flags [S], seq 2605133727, win 43690, options [mss 65495,sackOK,TS val 435165556 ecr 0,nop,wscale 7], length 0
^C
5 packets captured
5 packets received by filter
0 packets dropped by kernel
>
```
 Then either the external network (external to kubernetes) drops the packet or it arrives at a master node which has the service IP locally, in either scenario the return packets will not return to the originating worker node.

Workaround: 
I worked around the issue by adding a NAT rule to IPTABLES for packets leaving on the external interface with a source address in the service network:
```
>iptables -t nat -A POSTROUTING -s 100.64.0.0/16 -o ens3 -j MASQUERADE
>
```
**Environment**:
- Kubernetes version (use `kubectl version`): 1.10.1
```
Client Version: version.Info{Major:"1", Minor:"6", GitVersion:"v1.6.4", GitCommit:"d6f433224538d4f9ca2f7ae19b252e6fcb66a3ae", GitTreeState:"clean", BuildDate:"2017-05-19T18:44:27Z", GoVersion:"go1.7.5", Compiler:"gc", Platform:"linux/amd64"}
Server Version: version.Info{Major:"1", Minor:"10", GitVersion:"v1.10.1", GitCommit:"d4ab47518836c750f9949b9e0d387f20fb92260b", GitTreeState:"clean", BuildDate:"2018-04-12T14:14:26Z", GoVersion:"go1.9.3", Compiler:"gc", Platform:"linux/amd64"}
```
- Cloud provider or hardware configuration: AWS
- OS (e.g. from /etc/os-release): Ubuntu 16.04.4 LTS
```
NAME="Ubuntu"
VERSION="16.04.4 LTS (Xenial Xerus)"
ID=ubuntu
ID_LIKE=debian
PRETTY_NAME="Ubuntu 16.04.4 LTS"
VERSION_ID="16.04"
HOME_URL="http://www.ubuntu.com/"
SUPPORT_URL="http://help.ubuntu.com/"
BUG_REPORT_URL="http://bugs.launchpad.net/ubuntu/"
VERSION_CODENAME=xenial
UBUNTU_CODENAME=xenial
```
- Kernel (e.g. `uname -a`): 4.4.121-k8s 
```
Linux k8s-worker-10-1-8-176 4.4.121-k8s #1 SMP Sun Mar 11 19:39:47 UTC 2018 x86_64 x86_64 x86_64 GNU/Linux
```
- Install tools: None
- Others: None

**Comment by rramkumar1** [comment]
@m1093782566 Can you take a look please?

**Comment by m1093782566** [comment]
cc @Lion-Wei

**Comment by m1093782566** [comment]
@baelish

Can you post the detailed service and endpoints information?

**Comment by baelish** [comment]
@m1093782566 sure:
endpoints: https://gist.github.com/baelish/95c29965cf15fb741421802cc46f406f
services: https://gist.github.com/baelish/945d68624a5d9cbe6923311d13e3a281
Please note this is now working with the workaround specified above.

**Comment by m1093782566** [comment]
I assume you are trying to visit the service cluster IP on the **node**?

I agree with @Lion-Wei, this issue duplicated with #63241. 

@baelish 

Would you please try it again when #63319 goes in?

**Comment by m1093782566** [comment]
I am going to close this issue since #63319 went in.

@baelish please check out the HEAD. Also, feel free to re-open if you still have some troubles :)

/close

**Comment by baelish** [comment]
@m1093782566 I was using a pod with hostNetwork=True so I suppose you could argue both that I was trying to visit the service cluster from the host or not :)

I will test it once more when I've upgraded to the next version with #63319 in. Thanks.
