### ISSUE TITLE
Pods on the same Node cannot access each other

### ISSUE THREAD

**Issue by whc9527** [kubernetes/kubernetes#130234]
### What happened?

Both mysql and busybox Pods are deployed on node 172.21.8.183. The svc address of mysql pod is apollo-db. mysql pod can access mysql services through apollo-db. However, the busybox pod cannot access apollo-db. The domain name apollo-db can be resolved normally in busybox pod.

Is there a friend who can help me look at it? It is urgent to solve this problem at work. Thank you very much！！

![Image](https://github.com/user-attachments/assets/0b928839-f045-4a5a-abd7-3d46d53f31ea)

svc information：

![Image](https://github.com/user-attachments/assets/fba06e70-401d-4ce3-94c6-16a2dc9bf87e)

Log in to 172.21.8.183 and see some information:

![Image](https://github.com/user-attachments/assets/6dfab93c-54a6-4f14-ac54-ca233f4392b6)

![Image](https://github.com/user-attachments/assets/b0698822-71b5-4932-8bf1-d2c24164d2ad)

![Image](https://github.com/user-attachments/assets/a12648f8-ed3b-40ab-8049-8e1de2eb5caf)

![Image](https://github.com/user-attachments/assets/f3e0f112-4f10-4b8c-8153-28882b40bb55)

![Image](https://github.com/user-attachments/assets/b99096b8-abb4-4c4c-a510-584a2146c40c)

At first I thought it was the Hairpin Mode, but I found that hairpin_mode is set to 1 in all my VNets

![Image](https://github.com/user-attachments/assets/198da1f3-15fb-4991-8070-b0da1d9acb3e)

### What did you expect to happen?

Pods on the same Node can access each other

### How can we reproduce it (as minimally and precisely as possible)?

A Node starts a Mysql Pod, a busybox Pod, and telnet the svc address of mysql on the busybox Pod

### Kubernetes version

1.31.1

### Cloud provider
<details>
The node node is on Alibaba Cloud, and the master node is on aws. They are connected by a special line
</details>

### OS version
<details>

```
# On Linux:
$ cat /etc/os-release 
NAME="Alibaba Cloud Linux (Aliyun Linux)"
VERSION="2.1903 LTS (Hunting Beagle)"
ID="alinux"
ID_LIKE="rhel fedora centos"
VERSION_ID="2.1903"
PRETTY_NAME="Alibaba Cloud Linux (Aliyun Linux) 2.1903 LTS (Hunting Beagle)"
ANSI_COLOR="0;31"
HOME_URL="https://www.aliyun.com/"
# paste output here
$ uname -a
# paste output here
Linux iZ0xi930e22iqpyhwaa27xZ 4.19.91-24.1.al7.x86_64 #1 SMP Wed Jul 21 17:40:23 CST 2021 x86_64 x86_64 x86_64 GNU/Linux
```

</details>

### Install tools

<details>

</details>

### Container runtime (CRI) and version (if applicable)
<details>

```
root@iZ0xi930e22iqpyhwaa27xZ:~ #containerd --version
containerd github.com/containerd/containerd v1.7.23 57f17b0a6295a39009d861b89e3b3b87b005ca27
```

</details>

### Related plugins (CNI, CSI, ...) and versions (if applicable)

<details>
kube-flannel.yml

```
---
kind: Namespace
apiVersion: v1
metadata:
  name: kube-flannel
  labels:
    k8s-app: flannel
    pod-security.kubernetes.io/enforce: privileged
---
kind: ClusterRole
apiVersion: rbac.authorization.k8s.io/v1
metadata:
  labels:
    k8s-app: flannel
  name: flannel
rules:
- apiGroups:
  - ""
  resources:
  - pods
  verbs:
  - get
- apiGroups:
  - ""
  resources:
  - nodes
  verbs:
  - get
  - list
  - watch
- apiGroups:
  - ""
  resources:
  - nodes/status
  verbs:
  - patch
---
kind: ClusterRoleBinding
apiVersion: rbac.authorization.k8s.io/v1
metadata:
  labels:
    k8s-app: flannel
  name: flannel
roleRef:
  apiGroup: rbac.authorization.k8s.io
  kind: ClusterRole
  name: flannel
subjects:
- kind: ServiceAccount
  name: flannel
  namespace: kube-flannel
---
apiVersion: v1
kind: ServiceAccount
metadata:
  labels:
    k8s-app: flannel
  name: flannel
  namespace: kube-flannel
---
kind: ConfigMap
apiVersion: v1
metadata:
  name: kube-flannel-cfg
  namespace: kube-flannel
  labels:
    tier: node
    k8s-app: flannel
    app: flannel
data:
  cni-conf.json: |
    {
      "name": "cbr0",
      "cniVersion": "0.3.1",
      "plugins": [
        {
          "type": "flannel",
          "delegate": {
            "hairpinMode": true,
            "isDefaultGateway": true
          }
        },
        {
          "type": "portmap",
          "capabilities": {
            "portMappings": true
          }
        }
      ]
    }
  net-conf.json: |
    {
      "Network": "192.168.0.0/17",
      "EnableNFTables": false,
      "Backend": {
        "Type": "vxlan"
      }
    }
---
apiVersion: apps/v1
kind: DaemonSet
metadata:
  name: kube-flannel-ds
  namespace: kube-flannel
  labels:
    tier: node
    app: flannel
    k8s-app: flannel
spec:
  selector:
    matchLabels:
      app: flannel
  template:
    metadata:
      labels:
        tier: node
        app: flannel
    spec:
      affinity:
        nodeAffinity:
          requiredDuringSchedulingIgnoredDuringExecution:
            nodeSelectorTerms:
            - matchExpressions:
              - key: kubernetes.io/os
                operator: In
                values:
                - linux
      hostNetwork: true
      priorityClassName: system-node-critical
      tolerations:
      - operator: Exists
        effect: NoSchedule
      serviceAccountName: flannel
      initContainers:
      - name: install-cni-plugin
        image: docker.io/flannel/flannel-cni-plugin:v1.5.1-flannel2
        command:
        - cp
        args:
        - -f
        - /flannel
        - /opt/cni/bin/flannel
        volumeMounts:
        - name: cni-plugin
          mountPath: /opt/cni/bin
      - name: install-cni
        image: docker.io/flannel/flannel:v0.25.7
        command:
        - cp
        args:
        - -f
        - /etc/kube-flannel/cni-conf.json
        - /etc/cni/net.d/10-flannel.conflist
        volumeMounts:
        - name: cni
          mountPath: /etc/cni/net.d
        - name: flannel-cfg
          mountPath: /etc/kube-flannel/
      containers:
      - name: kube-flannel
        image: docker.io/flannel/flannel:v0.25.7
        command:
        - /opt/bin/flanneld
        args:
        - --ip-masq
        - --kube-subnet-mgr
        resources:
          requests:
            cpu: "100m"
            memory: "50Mi"
        securityContext:
          privileged: false
          capabilities:
            add: ["NET_ADMIN", "NET_RAW"]
        env:
        - name: POD_NAME
          valueFrom:
            fieldRef:
              fieldPath: metadata.name
        - name: POD_NAMESPACE
          valueFrom:
            fieldRef:
              fieldPath: metadata.namespace
        - name: EVENT_QUEUE_DEPTH
          value: "5000"
        volumeMounts:
        - name: run
          mountPath: /run/flannel
        - name: flannel-cfg
          mountPath: /etc/kube-flannel/
        - name: xtables-lock
          mountPath: /run/xtables.lock
      volumes:
      - name: run
        hostPath:
          path: /run/flannel
      - name: cni-plugin
        hostPath:
          path: /opt/cni/bin
      - name: cni
        hostPath:
          path: /etc/cni/net.d
      - name: flannel-cfg
        configMap:
          name: kube-flannel-cfg
      - name: xtables-lock
        hostPath:
          path: /run/xtables.lock
          type: FileOrCreate
```
</details>

**Comment by whc9527** [comment]
> This has nothing to do with whether they are on the same node; even if they are on different nodes, they can still access each other.
> 
> check the ouput `cat /etc/resolv.conf`
> 
> have you checked what the result is of `telnet apollo-db.${ns-1234...-k8s}.svc.cluster.local 3306`?

@chengjoey  Thank you for your reply. The screenshot below is the test I did

![Image](https://github.com/user-attachments/assets/7f998172-3a18-4b79-9c6e-2e5dd3c9ba3f)


The following data is a packet that I captured on the node using tcpdump.
node ip: 172.21.8.183
busybox pod ip:192.168.0.238
mysql pod ip: 192.168.0.233
mysql svc ip: 192.168.134.205

<details>
root@iZ0xi930e22iqpyhwaa27xZ:~ #tcpdump -i cni0
tcpdump: verbose output suppressed, use -v or -vv for full protocol decode
listening on cni0, link-type EN10MB (Ethernet), capture size 262144 bytes
20:45:05.090816 IP 192.168.0.238.46218 > iZ0xi930e22iqpyhwaa27xZ.domain: 3283+ A? apollo-db.ns-1234-151--data-k8s-testbed-space-workspace-xuexia-li2-k8s.svc.cluster.local.ns-1234-151--data-k8s-testbed-space-workspace-xuexia-li2-k8s.svc.cluster.local. (185)
20:45:05.090856 IP 192.168.0.238.46218 > iZ0xi930e22iqpyhwaa27xZ.domain: 51407+ AAAA? apollo-db.ns-1234-151--data-k8s-testbed-space-workspace-xuexia-li2-k8s.svc.cluster.local.ns-1234-151--data-k8s-testbed-space-workspace-xuexia-li2-k8s.svc.cluster.local. (185)
20:45:05.091366 IP iZ0xi930e22iqpyhwaa27xZ.domain > 192.168.0.238.46218: 51407 NXDomain*- 0/1/0 (278)
20:45:05.091372 IP iZ0xi930e22iqpyhwaa27xZ.domain > 192.168.0.238.46218: 3283 NXDomain*- 0/1/0 (278)
20:45:05.091403 IP 192.168.0.238.45524 > iZ0xi930e22iqpyhwaa27xZ.domain: 62841+ A? apollo-db.ns-1234-151--data-k8s-testbed-space-workspace-xuexia-li2-k8s.svc.cluster.local.svc.cluster.local. (124)
20:45:05.091409 IP 192.168.0.238.45524 > iZ0xi930e22iqpyhwaa27xZ.domain: 38759+ AAAA? apollo-db.ns-1234-151--data-k8s-testbed-space-workspace-xuexia-li2-k8s.svc.cluster.local.svc.cluster.local. (124)
20:45:05.091743 IP iZ0xi930e22iqpyhwaa27xZ.domain > 192.168.0.238.45524: 62841 NXDomain*- 0/1/0 (217)
20:45:05.091748 IP iZ0xi930e22iqpyhwaa27xZ.domain > 192.168.0.238.45524: 38759 NXDomain*- 0/1/0 (217)
20:45:05.091764 IP 192.168.0.238.57307 > iZ0xi930e22iqpyhwaa27xZ.domain: 38392+ A? apollo-db.ns-1234-151--data-k8s-testbed-space-workspace-xuexia-li2-k8s.svc.cluster.local.cluster.local. (120)
20:45:05.091769 IP 192.168.0.238.57307 > iZ0xi930e22iqpyhwaa27xZ.domain: 56569+ AAAA? apollo-db.ns-1234-151--data-k8s-testbed-space-workspace-xuexia-li2-k8s.svc.cluster.local.cluster.local. (120)
20:45:05.092077 IP iZ0xi930e22iqpyhwaa27xZ.domain > 192.168.0.238.57307: 56569 NXDomain*- 0/1/0 (213)
20:45:05.092079 IP iZ0xi930e22iqpyhwaa27xZ.domain > 192.168.0.238.57307: 38392 NXDomain*- 0/1/0 (213)
20:45:05.092092 IP 192.168.0.238.52071 > iZ0xi930e22iqpyhwaa27xZ.domain: 49660+ A? apollo-db.ns-1234-151--data-k8s-testbed-space-workspace-xuexia-li2-k8s.svc.cluster.local. (106)
20:45:05.092097 IP 192.168.0.238.52071 > iZ0xi930e22iqpyhwaa27xZ.domain: 55039+ AAAA? apollo-db.ns-1234-151--data-k8s-testbed-space-workspace-xuexia-li2-k8s.svc.cluster.local. (106)
20:45:05.092419 IP iZ0xi930e22iqpyhwaa27xZ.domain > 192.168.0.238.52071: 55039*- 0/1/0 (199)
20:45:05.092422 IP iZ0xi930e22iqpyhwaa27xZ.domain > 192.168.0.238.52071: 49660*- 1/0/0 A 192.168.134.205 (210)
20:45:05.092449 IP 192.168.0.238.40198 > iZ0xi930e22iqpyhwaa27xZ.mysql: Flags [S], seq 1306564344, win 42050, options [mss 8410,sackOK,TS val 1926766616 ecr 0,nop,wscale 9], length 0
20:45:05.092460 IP 192.168.0.238.40198 > 192.168.0.233.mysql: Flags [S], seq 1306564344, win 42050, options [mss 8410,sackOK,TS val 1926766616 ecr 0,nop,wscale 9], length 0
20:45:05.092473 IP 192.168.0.233.mysql > 192.168.0.238.40198: Flags [S.], seq 3122571770, ack 1306564345, win 41990, options [mss 8410,sackOK,TS val 1985677996 ecr 1926766616,nop,wscale 9], length 0
20:45:05.092477 IP 192.168.0.238.40198 > 192.168.0.233.mysql: Flags [R], seq 1306564345, win 0, length 0
20:45:06.148307 IP 192.168.0.238.40198 > iZ0xi930e22iqpyhwaa27xZ.mysql: Flags [S], seq 1306564344, win 42050, options [mss 8410,sackOK,TS val 1926767672 ecr 0,nop,wscale 9], length 0
20:45:06.148332 IP 192.168.0.238.40198 > 192.168.0.233.mysql: Flags [S], seq 1306564344, win 42050, options [mss 8410,sackOK,TS val 1926767672 ecr 0,nop,wscale 9], length 0
20:45:06.148349 IP 192.168.0.233.mysql > 192.168.0.238.40198: Flags [S.], seq 3139069836, ack 1306564345, win 41990, options [mss 8410,sackOK,TS val 1985679052 ecr 1926767672,nop,wscale 9], length 0
20:45:06.148358 IP 192.168.0.238.40198 > 192.168.0.233.mysql: Flags [R], seq 1306564345, win 0, length 0
20:45:08.196315 IP 192.168.0.238.40198 > iZ0xi930e22iqpyhwaa27xZ.mysql: Flags [S], seq 1306564344, win 42050, options [mss 8410,sackOK,TS val 1926769720 ecr 0,nop,wscale 9], length 0
20:45:08.196349 IP 192.168.0.238.40198 > 192.168.0.233.mysql: Flags [S], seq 1306564344, win 42050, options [mss 8410,sackOK,TS val 1926769720 ecr 0,nop,wscale 9], length 0
20:45:08.196367 IP 192.168.0.233.mysql > 192.168.0.238.40198: Flags [S.], seq 3171070117, ack 1306564345, win 41990, options [mss 8410,sackOK,TS val 1985681100 ecr 1926769720,nop,wscale 9], length 0
20:45:08.196376 IP 192.168.0.238.40198 > 192.168.0.233.mysql: Flags [R], seq 1306564345, win 0, length 0
20:45:10.308296 ARP, Request who-has 192.168.0.238 tell iZ0xi930e22iqpyhwaa27xZ, length 28
20:45:10.308305 ARP, Request who-has 192.168.0.233 tell iZ0xi930e22iqpyhwaa27xZ, length 28
20:45:10.308320 ARP, Reply 192.168.0.238 is-at 92:e3:94:bc:ef:0e (oui Unknown), length 28
20:45:10.308324 ARP, Request who-has 192.168.0.233 tell 192.168.0.238, length 28
20:45:10.308326 ARP, Request who-has 192.168.0.238 tell 192.168.0.233, length 28
20:45:10.308330 ARP, Request who-has iZ0xi930e22iqpyhwaa27xZ tell 192.168.0.238, length 28
20:45:10.308333 ARP, Reply iZ0xi930e22iqpyhwaa27xZ is-at 7a:86:ac:fa:ae:72 (oui Unknown), length 28
20:45:10.308337 ARP, Reply 192.168.0.233 is-at be:98:69:87:3b:db (oui Unknown), length 28
20:45:10.308339 ARP, Reply 192.168.0.233 is-at be:98:69:87:3b:db (oui Unknown), length 28
20:45:10.308340 ARP, Reply 192.168.0.238 is-at 92:e3:94:bc:ef:0e (oui Unknown), length 28
20:45:12.228306 IP 192.168.0.238.40198 > iZ0xi930e22iqpyhwaa27xZ.mysql: Flags [S], seq 1306564344, win 42050, options [mss 8410,sackOK,TS val 1926773752 ecr 0,nop,wscale 9], length 0
20:45:12.228328 IP 192.168.0.238.40198 > 192.168.0.233.mysql: Flags [S], seq 1306564344, win 42050, options [mss 8410,sackOK,TS val 1926773752 ecr 0,nop,wscale 9], length 0
20:45:12.228344 IP 192.168.0.233.mysql > 192.168.0.238.40198: Flags [S.], seq 3234069750, ack 1306564345, win 41990, options [mss 8410,sackOK,TS val 1985685132 ecr 1926773752,nop,wscale 9], length 0
20:45:12.228351 IP 192.168.0.238.40198 > 192.168.0.233.mysql: Flags [R], seq 1306564345, win 0, length 0
20:45:20.548342 IP 192.168.0.238.40198 > iZ0xi930e22iqpyhwaa27xZ.mysql: Flags [S], seq 1306564344, win 42050, options [mss 8410,sackOK,TS val 1926782071 ecr 0,nop,wscale 9], length 0
20:45:20.548372 IP 192.168.0.238.40198 > 192.168.0.233.mysql: Flags [S], seq 1306564344, win 42050, options [mss 8410,sackOK,TS val 1926782071 ecr 0,nop,wscale 9], length 0
20:45:20.548391 IP 192.168.0.233.mysql > 192.168.0.238.40198: Flags [S.], seq 3364070479, ack 1306564345, win 41990, options [mss 8410,sackOK,TS val 1985693452 ecr 1926782071,nop,wscale 9], length 0
20:45:20.548399 IP 192.168.0.238.40198 > 192.168.0.233.mysql: Flags [R], seq 1306564345, win 0, length 0
20:46:48.485341 IP 192.168.0.233.51519 > iZ0xi930e22iqpyhwaa27xZ.domain: 3723+ A? ns-1234-151--data-k8s-testbed-space-workspace-xuexia-li2-k8s.ns-1234-151--data-k8s-testbed-space-workspace-xuexia-li2-k8s.svc.cluster.local. (157)
20:46:48.485385 IP 192.168.0.233.51519 > iZ0xi930e22iqpyhwaa27xZ.domain: 3255+ AAAA? ns-1234-151--data-k8s-testbed-space-workspace-xuexia-li2-k8s.ns-1234-151--data-k8s-testbed-space-workspace-xuexia-li2-k8s.svc.cluster.local. (157)
20:46:48.485998 IP iZ0xi930e22iqpyhwaa27xZ.domain > 192.168.0.233.51519: 3255 NXDomain*- 0/1/0 (250)
20:46:48.486005 IP iZ0xi930e22iqpyhwaa27xZ.domain > 192.168.0.233.51519: 3723 NXDomain*- 0/1/0 (250)
20:46:48.486041 IP 192.168.0.233.34913 > iZ0xi930e22iqpyhwaa27xZ.domain: 25279+ A? ns-1234-151--data-k8s-testbed-space-workspace-xuexia-li2-k8s.svc.cluster.local. (96)
20:46:48.486050 IP 192.168.0.233.34913 > iZ0xi930e22iqpyhwaa27xZ.domain: 26033+ AAAA? ns-1234-151--data-k8s-testbed-space-workspace-xuexia-li2-k8s.svc.cluster.local. (96)
20:46:48.486345 IP iZ0xi930e22iqpyhwaa27xZ.domain > 192.168.0.233.34913: 26033*- 0/1/0 (189)
20:46:48.486383 IP iZ0xi930e22iqpyhwaa27xZ.domain > 192.168.0.233.34913: 25279*- 0/1/0 (189)
20:46:48.486396 IP 192.168.0.233.42816 > iZ0xi930e22iqpyhwaa27xZ.domain: 40997+ A? ns-1234-151--data-k8s-testbed-space-workspace-xuexia-li2-k8s.cluster.local. (92)
20:46:48.486402 IP 192.168.0.233.42816 > iZ0xi930e22iqpyhwaa27xZ.domain: 37668+ AAAA? ns-1234-151--data-k8s-testbed-space-workspace-xuexia-li2-k8s.cluster.local. (92)
20:46:48.486831 IP iZ0xi930e22iqpyhwaa27xZ.domain > 192.168.0.233.42816: 37668 NXDomain*- 0/1/0 (185)
20:46:48.486834 IP iZ0xi930e22iqpyhwaa27xZ.domain > 192.168.0.233.42816: 40997 NXDomain*- 0/1/0 (185)
20:46:48.486848 IP 192.168.0.233.46246 > iZ0xi930e22iqpyhwaa27xZ.domain: 39219+ A? ns-1234-151--data-k8s-testbed-space-workspace-xuexia-li2-k8s. (78)
20:46:48.486855 IP 192.168.0.233.46246 > iZ0xi930e22iqpyhwaa27xZ.domain: 61744+ AAAA? ns-1234-151--data-k8s-testbed-space-workspace-xuexia-li2-k8s. (78)
20:46:48.488179 IP iZ0xi930e22iqpyhwaa27xZ.domain > 192.168.0.233.46246: 39219 NXDomain 0/1/0 (153)
20:46:48.488687 IP iZ0xi930e22iqpyhwaa27xZ.domain > 192.168.0.233.46246: 61744 NXDomain 0/1/0 (153)
20:46:53.732293 ARP, Request who-has 192.168.0.233 tell iZ0xi930e22iqpyhwaa27xZ, length 28
20:46:53.732309 ARP, Reply 192.168.0.233 is-at be:98:69:87:3b:db (oui Unknown), length 28
20:46:53.732318 ARP, Request who-has iZ0xi930e22iqpyhwaa27xZ tell 192.168.0.233, length 28
20:46:53.732323 ARP, Reply iZ0xi930e22iqpyhwaa27xZ is-at 7a:86:ac:fa:ae:72 (oui Unknown), length 28
20:47:09.539220 IP 192.168.0.233.34484 > iZ0xi930e22iqpyhwaa27xZ.domain: 7828+ A? apollo-db.ns-1234-151--data-k8s-testbed-space-workspace-xuexia-li2-k8s.ns-1234-151--data-k8s-testbed-space-workspace-xuexia-li2-k8s.svc.cluster.local. (167)
20:47:09.539266 IP 192.168.0.233.34484 > iZ0xi930e22iqpyhwaa27xZ.domain: 62864+ AAAA? apollo-db.ns-1234-151--data-k8s-testbed-space-workspace-xuexia-li2-k8s.ns-1234-151--data-k8s-testbed-space-workspace-xuexia-li2-k8s.svc.cluster.local. (167)
20:47:09.539786 IP iZ0xi930e22iqpyhwaa27xZ.domain > 192.168.0.233.34484: 62864 NXDomain*- 0/1/0 (260)
20:47:09.539793 IP iZ0xi930e22iqpyhwaa27xZ.domain > 192.168.0.233.34484: 7828 NXDomain*- 0/1/0 (260)
20:47:09.539829 IP 192.168.0.233.33241 > iZ0xi930e22iqpyhwaa27xZ.domain: 22823+ A? apollo-db.ns-1234-151--data-k8s-testbed-space-workspace-xuexia-li2-k8s.svc.cluster.local. (106)
20:47:09.539838 IP 192.168.0.233.33241 > iZ0xi930e22iqpyhwaa27xZ.domain: 6437+ AAAA? apollo-db.ns-1234-151--data-k8s-testbed-space-workspace-xuexia-li2-k8s.svc.cluster.local. (106)
20:47:09.540231 IP iZ0xi930e22iqpyhwaa27xZ.domain > 192.168.0.233.33241: 6437*- 0/1/0 (199)
20:47:09.540251 IP iZ0xi930e22iqpyhwaa27xZ.domain > 192.168.0.233.33241: 22823*- 1/0/0 A 192.168.134.205 (210)
20:47:09.540282 IP 192.168.0.233.53086 > iZ0xi930e22iqpyhwaa27xZ.mysql: Flags [S], seq 2946393816, win 42050, options [mss 8410,sackOK,TS val 2110662024 ecr 0,nop,wscale 9], length 0
20:47:09.540298 IP iZ0xi930e22iqpyhwaa27xZ.53086 > 192.168.0.233.mysql: Flags [S], seq 2946393816, win 42050, options [mss 8410,sackOK,TS val 2110662024 ecr 0,nop,wscale 9], length 0
20:47:09.540307 IP 192.168.0.233.mysql > iZ0xi930e22iqpyhwaa27xZ.53086: Flags [S.], seq 1440298101, ack 2946393817, win 41990, options [mss 8410,sackOK,TS val 2941695541 ecr 2110662024,nop,wscale 9], length 0
20:47:09.540315 IP iZ0xi930e22iqpyhwaa27xZ.mysql > 192.168.0.233.53086: Flags [S.], seq 1440298101, ack 2946393817, win 41990, options [mss 8410,sackOK,TS val 2941695541 ecr 2110662024,nop,wscale 9], length 0
20:47:09.540323 IP 192.168.0.233.53086 > iZ0xi930e22iqpyhwaa27xZ.mysql: Flags [.], ack 1, win 83, options [nop,nop,TS val 2110662024 ecr 2941695541], length 0
20:47:09.540326 IP iZ0xi930e22iqpyhwaa27xZ.53086 > 192.168.0.233.mysql: Flags [.], ack 1, win 83, options [nop,nop,TS val 2110662024 ecr 2941695541], length 0
20:47:09.540479 IP 192.168.0.233.mysql > iZ0xi930e22iqpyhwaa27xZ.53086: Flags [P.], seq 1:79, ack 1, win 83, options [nop,nop,TS val 2941695541 ecr 2110662024], length 78
20:47:09.540490 IP iZ0xi930e22iqpyhwaa27xZ.mysql > 192.168.0.233.53086: Flags [P.], seq 1:79, ack 1, win 83, options [nop,nop,TS val 2941695541 ecr 2110662024], length 78
20:47:09.540498 IP 192.168.0.233.53086 > iZ0xi930e22iqpyhwaa27xZ.mysql: Flags [.], ack 79, win 83, options [nop,nop,TS val 2110662024 ecr 2941695541], length 0
20:47:09.540502 IP iZ0xi930e22iqpyhwaa27xZ.53086 > 192.168.0.233.mysql: Flags [.], ack 79, win 83, options [nop,nop,TS val 2110662024 ecr 2941695541], length 0
20:47:09.540510 IP 192.168.0.233.53086 > iZ0xi930e22iqpyhwaa27xZ.mysql: Flags [P.], seq 1:37, ack 79, win 83, options [nop,nop,TS val 2110662025 ecr 2941695541], length 36
20:47:09.540514 IP iZ0xi930e22iqpyhwaa27xZ.53086 > 192.168.0.233.mysql: Flags [P.], seq 1:37, ack 79, win 83, options [nop,nop,TS val 2110662025 ecr 2941695541], length 36
20:47:09.540517 IP 192.168.0.233.mysql > iZ0xi930e22iqpyhwaa27xZ.53086: Flags [.], ack 37, win 83, options [nop,nop,TS val 2941695542 ecr 2110662025], length 0
20:47:09.540521 IP iZ0xi930e22iqpyhwaa27xZ.mysql > 192.168.0.233.53086: Flags [.], ack 37, win 83, options [nop,nop,TS val 2941695542 ecr 2110662025], length 0
20:47:09.545001 IP 192.168.0.233.53086 > iZ0xi930e22iqpyhwaa27xZ.mysql: Flags [P.], seq 37:316, ack 79, win 83, options [nop,nop,TS val 2110662029 ecr 2941695542], length 279
20:47:09.545017 IP iZ0xi930e22iqpyhwaa27xZ.53086 > 192.168.0.233.mysql: Flags [P.], seq 37:316, ack 79, win 83, options [nop,nop,TS val 2110662029 ecr 2941695542], length 279
20:47:09.545025 IP 192.168.0.233.mysql > iZ0xi930e22iqpyhwaa27xZ.53086: Flags [.], ack 316, win 83, options [nop,nop,TS val 2941695546 ecr 2110662029], length 0
20:47:09.545034 IP iZ0xi930e22iqpyhwaa27xZ.mysql > 192.168.0.233.53086: Flags [.], ack 316, win 83, options [nop,nop,TS val 2941695546 ecr 2110662029], length 0
20:47:09.545943 IP 192.168.0.233.mysql > iZ0xi930e22iqpyhwaa27xZ.53086: Flags [P.], seq 79:2268, ack 316, win 83, options [nop,nop,TS val 2941695547 ecr 2110662029], length 2189
20:47:09.545955 IP iZ0xi930e22iqpyhwaa27xZ.mysql > 192.168.0.233.53086: Flags [P.], seq 79:2268, ack 316, win 83, options [nop,nop,TS val 2941695547 ecr 2110662029], length 2189
20:47:09.546220 IP 192.168.0.233.53086 > iZ0xi930e22iqpyhwaa27xZ.mysql: Flags [P.], seq 316:426, ack 2268, win 79, options [nop,nop,TS val 2110662030 ecr 2941695547], length 110
20:47:09.546229 IP iZ0xi930e22iqpyhwaa27xZ.53086 > 192.168.0.233.mysql: Flags [P.], seq 316:426, ack 2268, win 79, options [nop,nop,TS val 2110662030 ecr 2941695547], length 110
20:47:09.546282 IP 192.168.0.233.53086 > iZ0xi930e22iqpyhwaa27xZ.mysql: Flags [P.], seq 426:647, ack 2268, win 79, options [nop,nop,TS val 2110662030 ecr 2941695547], length 221
20:47:09.546294 IP iZ0xi930e22iqpyhwaa27xZ.53086 > 192.168.0.233.mysql: Flags [P.], seq 426:647, ack 2268, win 79, options [nop,nop,TS val 2110662030 ecr 2941695547], length 221
20:47:09.546330 IP 192.168.0.233.mysql > iZ0xi930e22iqpyhwaa27xZ.53086: Flags [P.], seq 2268:2523, ack 647, win 83, options [nop,nop,TS val 2941695547 ecr 2110662030], length 255
20:47:09.546338 IP iZ0xi930e22iqpyhwaa27xZ.mysql > 192.168.0.233.53086: Flags [P.], seq 2268:2523, ack 647, win 83, options [nop,nop,TS val 2941695547 ecr 2110662030], length 255
20:47:09.546372 IP 192.168.0.233.mysql > iZ0xi930e22iqpyhwaa27xZ.53086: Flags [P.], seq 2523:2778, ack 647, win 83, options [nop,nop,TS val 2941695547 ecr 2110662030], length 255
20:47:09.546378 IP iZ0xi930e22iqpyhwaa27xZ.mysql > 192.168.0.233.53086: Flags [P.], seq 2523:2778, ack 647, win 83, options [nop,nop,TS val 2941695547 ecr 2110662030], length 255
20:47:09.546384 IP 192.168.0.233.53086 > iZ0xi930e22iqpyhwaa27xZ.mysql: Flags [.], ack 2778, win 79, options [nop,nop,TS val 2110662030 ecr 2941695547], length 0
20:47:09.546389 IP iZ0xi930e22iqpyhwaa27xZ.53086 > 192.168.0.233.mysql: Flags [.], ack 2778, win 79, options [nop,nop,TS val 2110662030 ecr 2941695547], length 0
20:47:09.546448 IP 192.168.0.233.mysql > iZ0xi930e22iqpyhwaa27xZ.53086: Flags [P.], seq 2778:2811, ack 647, win 83, options [nop,nop,TS val 2941695547 ecr 2110662030], length 33
20:47:09.546453 IP iZ0xi930e22iqpyhwaa27xZ.mysql > 192.168.0.233.53086: Flags [P.], seq 2778:2811, ack 647, win 83, options [nop,nop,TS val 2941695547 ecr 2110662030], length 33
20:47:09.546500 IP 192.168.0.233.53086 > iZ0xi930e22iqpyhwaa27xZ.mysql: Flags [P.], seq 647:708, ack 2811, win 79, options [nop,nop,TS val 2110662030 ecr 2941695547], length 61
20:47:09.546505 IP iZ0xi930e22iqpyhwaa27xZ.53086 > 192.168.0.233.mysql: Flags [P.], seq 647:708, ack 2811, win 79, options [nop,nop,TS val 2110662030 ecr 2941695547], length 61
20:47:09.546649 IP 192.168.0.233.mysql > iZ0xi930e22iqpyhwaa27xZ.53086: Flags [P.], seq 2811:2925, ack 708, win 83, options [nop,nop,TS val 2941695548 ecr 2110662030], length 114
20:47:09.546664 IP iZ0xi930e22iqpyhwaa27xZ.mysql > 192.168.0.233.53086: Flags [P.], seq 2811:2925, ack 708, win 83, options [nop,nop,TS val 2941695548 ecr 2110662030], length 114
20:47:09.587296 IP 192.168.0.233.53086 > iZ0xi930e22iqpyhwaa27xZ.mysql: Flags [.], ack 2925, win 79, options [nop,nop,TS val 2110662071 ecr 2941695548], length 0
20:47:09.587304 IP iZ0xi930e22iqpyhwaa27xZ.53086 > 192.168.0.233.mysql: Flags [.], ack 2925, win 79, options [nop,nop,TS val 2110662071 ecr 2941695548], length 0
20:47:11.007265 IP 192.168.0.233.53086 > iZ0xi930e22iqpyhwaa27xZ.mysql: Flags [P.], seq 708:735, ack 2925, win 79, options [nop,nop,TS val 2110663491 ecr 2941695548], length 27
20:47:11.007290 IP iZ0xi930e22iqpyhwaa27xZ.53086 > 192.168.0.233.mysql: Flags [P.], seq 708:735, ack 2925, win 79, options [nop,nop,TS val 2110663491 ecr 2941695548], length 27
20:47:11.007313 IP 192.168.0.233.53086 > iZ0xi930e22iqpyhwaa27xZ.mysql: Flags [F.], seq 735, ack 2925, win 79, options [nop,nop,TS val 2110663491 ecr 2941695548], length 0
20:47:11.007318 IP iZ0xi930e22iqpyhwaa27xZ.53086 > 192.168.0.233.mysql: Flags [F.], seq 735, ack 2925, win 79, options [nop,nop,TS val 2110663491 ecr 2941695548], length 0
20:47:11.007365 IP 192.168.0.233.mysql > iZ0xi930e22iqpyhwaa27xZ.53086: Flags [F.], seq 2925, ack 736, win 83, options [nop,nop,TS val 2941697008 ecr 2110663491], length 0
20:47:11.007385 IP iZ0xi930e22iqpyhwaa27xZ.mysql > 192.168.0.233.53086: Flags [F.], seq 2925, ack 736, win 83, options [nop,nop,TS val 2941697008 ecr 2110663491], length 0
20:47:11.007398 IP 192.168.0.233.53086 > iZ0xi930e22iqpyhwaa27xZ.mysql: Flags [.], ack 2926, win 79, options [nop,nop,TS val 2110663491 ecr 2941697008], length 0
20:47:11.007410 IP iZ0xi930e22iqpyhwaa27xZ.53086 > 192.168.0.233.mysql: Flags [.], ack 2926, win 79, options [nop,nop,TS val 2110663491 ecr 2941697008], length 0
20:49:24.063242 IP 192.168.0.232.56605 > iZ0xi930e22iqpyhwaa27xZ.domain: 45684+ A? apollo-db.ns-1234-151--data-k8s-testbed-space-workspace-xuexia-li2-k8s.svc.cluster.local. (106)
20:49:24.063303 IP 192.168.0.232.56605 > iZ0xi930e22iqpyhwaa27xZ.domain: 1657+ AAAA? apollo-db.ns-1234-151--data-k8s-testbed-space-workspace-xuexia-li2-k8s.svc.cluster.local. (106)
20:49:24.063872 IP iZ0xi930e22iqpyhwaa27xZ.domain > 192.168.0.232.56605: 1657*- 0/1/0 (199)
20:49:24.063878 IP iZ0xi930e22iqpyhwaa27xZ.domain > 192.168.0.232.56605: 45684*- 1/0/0 A 192.168.134.205 (210)
20:49:24.066037 IP 192.168.0.232.39096 > iZ0xi930e22iqpyhwaa27xZ.mysql: Flags [S], seq 3849812800, win 42050, options [mss 8410,sackOK,TS val 3337860653 ecr 0,nop,wscale 9], length 0
20:49:24.066060 IP 192.168.0.232.39096 > 192.168.0.233.mysql: Flags [S], seq 3849812800, win 42050, options [mss 8410,sackOK,TS val 3337860653 ecr 0,nop,wscale 9], length 0
20:49:24.066078 IP 192.168.0.233.mysql > 192.168.0.232.39096: Flags [S.], seq 1471354168, ack 3849812801, win 41990, options [mss 8410,sackOK,TS val 3061457214 ecr 3337860653,nop,wscale 9], length 0
20:49:24.066084 IP 192.168.0.232.39096 > 192.168.0.233.mysql: Flags [R], seq 3849812801, win 0, length 0
20:49:25.092316 IP 192.168.0.232.39096 > iZ0xi930e22iqpyhwaa27xZ.mysql: Flags [S], seq 3849812800, win 42050, options [mss 8410,sackOK,TS val 3337861679 ecr 0,nop,wscale 9], length 0
20:49:25.092356 IP 192.168.0.232.39096 > 192.168.0.233.mysql: Flags [S], seq 3849812800, win 42050, options [mss 8410,sackOK,TS val 3337861679 ecr 0,nop,wscale 9], length 0
20:49:25.092378 IP 192.168.0.233.mysql > 192.168.0.232.39096: Flags [S.], seq 1487390093, ack 3849812801, win 41990, options [mss 8410,sackOK,TS val 3061458240 ecr 3337861679,nop,wscale 9], length 0
20:49:25.092387 IP 192.168.0.232.39096 > 192.168.0.233.mysql: Flags [R], seq 3849812801, win 0, length 0
20:49:26.269829 IP 192.168.0.232.40431 > iZ0xi930e22iqpyhwaa27xZ.domain: 48422+ A? apollo-db.ns-1234-151--data-k8s-testbed-space-workspace-xuexia-li2-k8s.svc.cluster.local. (106)
20:49:26.269886 IP 192.168.0.232.40431 > iZ0xi930e22iqpyhwaa27xZ.domain: 52514+ AAAA? apollo-db.ns-1234-151--data-k8s-testbed-space-workspace-xuexia-li2-k8s.svc.cluster.local. (106)
20:49:26.270337 IP iZ0xi930e22iqpyhwaa27xZ.domain > 192.168.0.232.40431: 52514*- 0/1/0 (199)
20:49:26.270349 IP iZ0xi930e22iqpyhwaa27xZ.domain > 192.168.0.232.40431: 48422*- 1/0/0 A 192.168.134.205 (210)
20:49:26.272476 IP 192.168.0.232.39098 > iZ0xi930e22iqpyhwaa27xZ.mysql: Flags [S], seq 3187983505, win 42050, options [mss 8410,sackOK,TS val 3337862860 ecr 0,nop,wscale 9], length 0
20:49:26.272502 IP 192.168.0.232.39098 > 192.168.0.233.mysql: Flags [S], seq 3187983505, win 42050, options [mss 8410,sackOK,TS val 3337862860 ecr 0,nop,wscale 9], length 0
20:49:26.272520 IP 192.168.0.233.mysql > 192.168.0.232.39098: Flags [S.], seq 2799189454, ack 3187983506, win 41990, options [mss 8410,sackOK,TS val 3061459421 ecr 3337862860,nop,wscale 9], length 0
20:49:26.272527 IP 192.168.0.232.39098 > 192.168.0.233.mysql: Flags [R], seq 3187983506, win 0, length 0
20:49:27.140314 IP 192.168.0.232.39096 > iZ0xi930e22iqpyhwaa27xZ.mysql: Flags [S], seq 3849812800, win 42050, options [mss 8410,sackOK,TS val 3337863727 ecr 0,nop,wscale 9], length 0
20:49:27.140348 IP 192.168.0.232.39096 > 192.168.0.233.mysql: Flags [S], seq 3849812800, win 42050, options [mss 8410,sackOK,TS val 3337863727 ecr 0,nop,wscale 9], length 0
20:49:27.140367 IP 192.168.0.233.mysql > 192.168.0.232.39096: Flags [S.], seq 1519389951, ack 3849812801, win 41990, options [mss 8410,sackOK,TS val 3061460288 ecr 3337863727,nop,wscale 9], length 0
20:49:27.140375 IP 192.168.0.232.39096 > 192.168.0.233.mysql: Flags [R], seq 3849812801, win 0, length 0
20:49:27.332320 IP 192.168.0.232.39098 > iZ0xi930e22iqpyhwaa27xZ.mysql: Flags [S], seq 3187983505, win 42050, options [mss 8410,sackOK,TS val 3337863919 ecr 0,nop,wscale 9], length 0
20:49:27.332342 IP 192.168.0.232.39098 > 192.168.0.233.mysql: Flags [S], seq 3187983505, win 42050, options [mss 8410,sackOK,TS val 3337863919 ecr 0,nop,wscale 9], length 0
20:49:27.332358 IP 192.168.0.233.mysql > 192.168.0.232.39098: Flags [S.], seq 2815749421, ack 3187983506, win 41990, options [mss 8410,sackOK,TS val 3061460480 ecr 3337863919,nop,wscale 9], length 0
20:49:27.332364 IP 192.168.0.232.39098 > 192.168.0.233.mysql: Flags [R], seq 3187983506, win 0, length 0
20:49:27.876847 IP 192.168.0.232.36022 > iZ0xi930e22iqpyhwaa27xZ.domain: 49413+ A? apollo-db.ns-1234-151--data-k8s-testbed-space-workspace-xuexia-li2-k8s.svc.cluster.local. (106)
20:49:27.876897 IP 192.168.0.232.36022 > iZ0xi930e22iqpyhwaa27xZ.domain: 27910+ AAAA? apollo-db.ns-1234-151--data-k8s-testbed-space-workspace-xuexia-li2-k8s.svc.cluster.local. (106)
20:49:27.877430 IP iZ0xi930e22iqpyhwaa27xZ.domain > 192.168.0.232.36022: 49413*- 1/0/0 A 192.168.134.205 (210)
20:49:27.877440 IP iZ0xi930e22iqpyhwaa27xZ.domain > 192.168.0.232.36022: 27910*- 0/1/0 (199)
20:49:27.879505 IP 192.168.0.232.39102 > iZ0xi930e22iqpyhwaa27xZ.mysql: Flags [S], seq 3324484698, win 42050, options [mss 8410,sackOK,TS val 3337864467 ecr 0,nop,wscale 9], length 0
20:49:27.879532 IP 192.168.0.232.39102 > 192.168.0.233.mysql: Flags [S], seq 3324484698, win 42050, options [mss 8410,sackOK,TS val 3337864467 ecr 0,nop,wscale 9], length 0
20:49:27.879549 IP 192.168.0.233.mysql > 192.168.0.232.39102: Flags [S.], seq 3910270886, ack 3324484699, win 41990, options [mss 8410,sackOK,TS val 3061461028 ecr 3337864467,nop,wscale 9], length 0
20:49:27.879554 IP 192.168.0.232.39102 > 192.168.0.233.mysql: Flags [R], seq 3324484699, win 0, length 0
20:49:28.932307 IP 192.168.0.232.39102 > iZ0xi930e22iqpyhwaa27xZ.mysql: Flags [S], seq 3324484698, win 42050, options [mss 8410,sackOK,TS val 3337865519 ecr 0,nop,wscale 9], length 0
20:49:28.932337 IP 192.168.0.232.39102 > 192.168.0.233.mysql: Flags [S], seq 3324484698, win 42050, options [mss 8410,sackOK,TS val 3337865519 ecr 0,nop,wscale 9], length 0
20:49:28.932353 IP 192.168.0.233.mysql > 192.168.0.232.39102: Flags [S.], seq 3926720938, ack 3324484699, win 41990, options [mss 8410,sackOK,TS val 3061462080 ecr 3337865519,nop,wscale 9], length 0
20:49:28.932362 IP 192.168.0.232.39102 > 192.168.0.233.mysql: Flags [R], seq 3324484699, win 0, length 0
20:49:29.380296 ARP, Request who-has 192.168.0.232 tell iZ0xi930e22iqpyhwaa27xZ, length 28
20:49:29.380303 ARP, Request who-has 192.168.0.233 tell iZ0xi930e22iqpyhwaa27xZ, length 28
20:49:29.380313 ARP, Reply 192.168.0.232 is-at ce:50:4e:4e:19:f3 (oui Unknown), length 28
20:49:29.380322 ARP, Request who-has 192.168.0.233 tell 192.168.0.232, length 28
20:49:29.380325 IP 192.168.0.232.39098 > iZ0xi930e22iqpyhwaa27xZ.mysql: Flags [S], seq 3187983505, win 42050, options [mss 8410,sackOK,TS val 3337865967 ecr 0,nop,wscale 9], length 0
20:49:29.380325 ARP, Request who-has 192.168.0.232 tell 192.168.0.233, length 28
20:49:29.380329 ARP, Request who-has iZ0xi930e22iqpyhwaa27xZ tell 192.168.0.232, length 28
20:49:29.380332 ARP, Reply iZ0xi930e22iqpyhwaa27xZ is-at 7a:86:ac:fa:ae:72 (oui Unknown), length 28
20:49:29.380335 ARP, Reply 192.168.0.233 is-at be:98:69:87:3b:db (oui Unknown), length 28
20:49:29.380337 ARP, Reply 192.168.0.233 is-at be:98:69:87:3b:db (oui Unknown), length 28
20:49:29.380337 ARP, Reply 192.168.0.232 is-at ce:50:4e:4e:19:f3 (oui Unknown), length 28
20:49:29.380356 IP 192.168.0.232.39098 > 192.168.0.233.mysql: Flags [S], seq 3187983505, win 42050, options [mss 8410,sackOK,TS val 3337865967 ecr 0,nop,wscale 9], length 0
20:49:29.380373 IP 192.168.0.233.mysql > 192.168.0.232.39098: Flags [S.], seq 2847749653, ack 3187983506, win 41990, options [mss 8410,sackOK,TS val 3061462528 ecr 3337865967,nop,wscale 9], length 0
20:49:29.380379 IP 192.168.0.232.39098 > 192.168.0.233.mysql: Flags [R], seq 3187983506, win 0, length 0
20:49:30.980304 IP 192.168.0.232.39102 > iZ0xi930e22iqpyhwaa27xZ.mysql: Flags [S], seq 3324484698, win 42050, options [mss 8410,sackOK,TS val 3337867567 ecr 0,nop,wscale 9], length 0
20:49:30.980324 IP 192.168.0.232.39102 > 192.168.0.233.mysql: Flags [S], seq 3324484698, win 42050, options [mss 8410,sackOK,TS val 3337867567 ecr 0,nop,wscale 9], length 0
20:49:30.980341 IP 192.168.0.233.mysql > 192.168.0.232.39102: Flags [S.], seq 3958720758, ack 3324484699, win 41990, options [mss 8410,sackOK,TS val 3061464128 ecr 3337867567,nop,wscale 9], length 0
20:49:30.980348 IP 192.168.0.232.39102 > 192.168.0.233.mysql: Flags [R], seq 3324484699, win 0, length 0
20:49:31.172312 IP 192.168.0.232.39096 > iZ0xi930e22iqpyhwaa27xZ.mysql: Flags [S], seq 3849812800, win 42050, options [mss 8410,sackOK,TS val 3337867759 ecr 0,nop,wscale 9], length 0
20:49:31.172335 IP 192.168.0.232.39096 > 192.168.0.233.mysql: Flags [S], seq 3849812800, win 42050, options [mss 8410,sackOK,TS val 3337867759 ecr 0,nop,wscale 9], length 0
20:49:31.172348 IP 192.168.0.233.mysql > 192.168.0.232.39096: Flags [S.], seq 1582389666, ack 3849812801, win 41990, options [mss 8410,sackOK,TS val 3061464320 ecr 3337867759,nop,wscale 9], length 0
20:49:31.172354 IP 192.168.0.232.39096 > 192.168.0.233.mysql: Flags [R], seq 3849812801, win 0, length 0
20:49:33.412308 IP 192.168.0.232.39098 > iZ0xi930e22iqpyhwaa27xZ.mysql: Flags [S], seq 3187983505, win 42050, options [mss 8410,sackOK,TS val 3337869999 ecr 0,nop,wscale 9], length 0
20:49:33.412336 IP 192.168.0.232.39098 > 192.168.0.233.mysql: Flags [S], seq 3187983505, win 42050, options [mss 8410,sackOK,TS val 3337869999 ecr 0,nop,wscale 9], length 0
20:49:33.412356 IP 192.168.0.233.mysql > 192.168.0.232.39098: Flags [S.], seq 2910749388, ack 3187983506, win 41990, options [mss 8410,sackOK,TS val 3061466560 ecr 3337869999,nop,wscale 9], length 0
20:49:33.412364 IP 192.168.0.232.39098 > 192.168.0.233.mysql: Flags [R], seq 3187983506, win 0, length 0
20:49:35.012307 IP 192.168.0.232.39102 > iZ0xi930e22iqpyhwaa27xZ.mysql: Flags [S], seq 3324484698, win 42050, options [mss 8410,sackOK,TS val 3337871599 ecr 0,nop,wscale 9], length 0
20:49:35.012336 IP 192.168.0.232.39102 > 192.168.0.233.mysql: Flags [S], seq 3324484698, win 42050, options [mss 8410,sackOK,TS val 3337871599 ecr 0,nop,wscale 9], length 0
20:49:35.012353 IP 192.168.0.233.mysql > 192.168.0.232.39102: Flags [S.], seq 4021720941, ack 3324484699, win 41990, options [mss 8410,sackOK,TS val 3061468160 ecr 3337871599,nop,wscale 9], length 0
20:49:35.012360 IP 192.168.0.232.39102 > 192.168.0.233.mysql: Flags [R], seq 3324484699, win 0, length 0
20:49:39.620317 IP 192.168.0.232.39096 > iZ0xi930e22iqpyhwaa27xZ.mysql: Flags [S], seq 3849812800, win 42050, options [mss 8410,sackOK,TS val 3337876207 ecr 0,nop,wscale 9], length 0
20:49:39.620347 IP 192.168.0.232.39096 > 192.168.0.233.mysql: Flags [S], seq 3849812800, win 42050, options [mss 8410,sackOK,TS val 3337876207 ecr 0,nop,wscale 9], length 0
20:49:39.620364 IP 192.168.0.233.mysql > 192.168.0.232.39096: Flags [S.], seq 1714389901, ack 3849812801, win 41990, options [mss 8410,sackOK,TS val 3061472768 ecr 3337876207,nop,wscale 9], length 0
20:49:39.620370 IP 192.168.0.232.39096 > 192.168.0.233.mysql: Flags [R], seq 3849812801, win 0, length 0
^C
194 packets captured
194 packets received by filter
0 packets dropped by kernel
root@iZ0xi930e22iqpyhwaa27xZ:~ #
</details>

**Comment by whc9527** [comment]
I started a busybox02 pod on another node and it was able to telnet normally
![Image](https://github.com/user-attachments/assets/a2d58b67-fd9e-44d0-823f-f932ab55fb81)

**Comment by chengjoey** [comment]
@whc9527 The result shows that the domain name apollo-db can now successfully resolve to the svc IP (192.168.134.205). Is the result the same when you use telnet 192.168.134.205 3306 on the node, or could it be related to the MySQL configuration `PRIVILEGES`?

**Comment by whc9527** [comment]
> [@whc9527](https://github.com/whc9527) The result shows that the domain name apollo-db can now successfully resolve to the svc IP (192.168.134.205). Is the result the same when you use telnet 192.168.134.205 3306 on the node, or could it be related to the MySQL configuration `PRIVILEGES`?

I can telnet mysql pod ip directly in the busybox01 pod. It's really weird!

![Image](https://github.com/user-attachments/assets/c5b3e9db-3c73-41db-9e19-e974c4c72a68)

**Comment by whc9527** [comment]
> [@whc9527](https://github.com/whc9527) The result shows that the domain name apollo-db can now successfully resolve to the svc IP (192.168.134.205). Is the result the same when you use telnet 192.168.134.205 3306 on the node, or could it be related to the MySQL configuration `PRIVILEGES`? `GRANT ALL PRIVILEGES ON ...`

It is possible to access both the svc ip and mysql pod ip on node
![Image](https://github.com/user-attachments/assets/92314ffb-d204-4af4-9e13-c192c6ade7d8)

**Comment by chengjoey** [comment]
@whc9527 I took a quick look at your reply above, and it seems the network is fine, whether it's the svc or pod ip, and busybox2 also indicates that it can communicate normally. Do you have a networkpolicy configuration that might be blocking busybox1?

**Comment by whc9527** [comment]
> [@whc9527](https://github.com/whc9527) I took a quick look at your reply above, and it seems the network is fine, whether it's the svc or pod ip, and busybox2 also indicates that it can communicate normally. Do you have a networkpolicy configuration that might be blocking busybox1?

I don't have artificial restrictions on the network, such as iptables, how do I check these points?

**Comment by whc9527** [comment]
iptables rules, auto add by kube-flannel

```
root@iZ0xi930e22iqpyhwaa27xZ:~ #iptables -L
Chain INPUT (policy ACCEPT)
target     prot opt source               destination
KUBE-IPVS-FILTER  all  --  anywhere             anywhere             /* kubernetes ipvs access filter */
KUBE-PROXY-FIREWALL  all  --  anywhere             anywhere             /* kube-proxy firewall rules */
KUBE-NODE-PORT  all  --  anywhere             anywhere             /* kubernetes health check rules */

Chain FORWARD (policy ACCEPT)
target     prot opt source               destination
KUBE-PROXY-FIREWALL  all  --  anywhere             anywhere             /* kube-proxy firewall rules */
KUBE-FORWARD  all  --  anywhere             anywhere             /* kubernetes forwarding rules */
FLANNEL-FWD  all  --  anywhere             anywhere             /* flanneld forward */

Chain OUTPUT (policy ACCEPT)
target     prot opt source               destination
KUBE-IPVS-OUT-FILTER  all  --  anywhere             anywhere             /* kubernetes ipvs access filter */

Chain FLANNEL-FWD (1 references)
target     prot opt source               destination
ACCEPT     all  --  192.168.0.0/17       anywhere             /* flanneld forward */
ACCEPT     all  --  anywhere             192.168.0.0/17       /* flanneld forward */

Chain KUBE-FIREWALL (0 references)
target     prot opt source               destination

Chain KUBE-FORWARD (1 references)
target     prot opt source               destination
ACCEPT     all  --  anywhere             anywhere             /* kubernetes forwarding rules */ mark match 0x4000/0x4000
ACCEPT     all  --  anywhere             anywhere             /* kubernetes forwarding conntrack rule */ ctstate RELATED,ESTABLISHED

Chain KUBE-IPVS-FILTER (1 references)
target     prot opt source               destination
RETURN     all  --  anywhere             anywhere             match-set KUBE-LOAD-BALANCER dst,dst
RETURN     all  --  anywhere             anywhere             match-set KUBE-CLUSTER-IP dst,dst
RETURN     all  --  anywhere             anywhere             match-set KUBE-EXTERNAL-IP dst,dst
RETURN     all  --  anywhere             anywhere             match-set KUBE-EXTERNAL-IP-LOCAL dst,dst
RETURN     all  --  anywhere             anywhere             match-set KUBE-HEALTH-CHECK-NODE-PORT dst
REJECT     all  --  anywhere             anywhere             ctstate NEW match-set KUBE-IPVS-IPS dst reject-with icmp-port-unreachable

Chain KUBE-IPVS-OUT-FILTER (1 references)
target     prot opt source               destination

Chain KUBE-KUBELET-CANARY (0 references)
target     prot opt source               destination

Chain KUBE-NODE-PORT (1 references)
target     prot opt source               destination
ACCEPT     all  --  anywhere             anywhere             /* Kubernetes health check node port */ match-set KUBE-HEALTH-CHECK-NODE-PORT dst

Chain KUBE-PROXY-FIREWALL (2 references)
target     prot opt source               destination

Chain KUBE-SOURCE-RANGES-FIREWALL (0 references)
target     prot opt source               destination
DROP       all  --  anywhere             anywhere
root@iZ0xi930e22iqpyhwaa27xZ:~ #
```

**Comment by chengjoey** [comment]
> I don't have artificial restrictions on the network, such as iptables, how do I check these points?

kubectl get networkpolicy -n ${ns}

**Comment by whc9527** [comment]
> > I don't have artificial restrictions on the network, such as iptables, how do I check these points?
> 
> kubectl get networkpolicy -n ${ns}

The configured network policy is not displayed.

Will:~ $ kubectl get networkpolicy -n ns-1234-151--data-k8s-testbed-space-workspace-xuexia-li2-k8s
No resources found in ns-1234-151--data-k8s-testbed-space-workspace-xuexia-li2-k8s namespace.
Will:~ $

**Comment by whc9527** [comment]
@chengjoey 
I ran into the same problem, and with the help of an AWS architect I found the reason and failed to load the package.
modprobe br_netfilter

**Comment by snair3** [comment]
Not sure if this would help, but in addition to setting Flannel’s “hairpinMode” to true , you might also want to check if the kubelet and the linux kernel are also set to allow hairpin bridging.
