### ISSUE TITLE
UDP packet does not get distributed due to ipvsadm timeout.

### ISSUE THREAD

**Issue by opg7371** [kubernetes/kubernetes#110814]
### What happened?

We have a couple of real server and a proxy server which are a part of the kubernetes cluster. These real servers are exposed through a **ClusterIP service** <IP:Port>. The mode of the **kube-proxy is IPVS** and the **scheduler is rr** (round robin). 

The proxy server is binded to a particular IP and a port say, 20.10.10.10 and port 5060. The proxy server then sends the UDP packets to the real server's service (say 10.98.248.149, port 5060). 

The issue is that the service does not distribute the UDP packets among the multiple real servers in a round robin fashion. It just sends to one of them. 

The reason for the same is the IPVS udp_timeout whose minimum value is 1 second.

SInce, UDP packets are continuously sent by the proxy to the service, the timeout never really expires.  

```
[root@master-node ~]# ipvsadm -L --timeout
Timeout (tcp tcpfin udp): 900 120 1
```
We can't set the timeout less that 1.

### What did you expect to happen?

The UDP traffic should distribute in a round robin fashion even if the source IP and Source Port of the proxy server is same. 

### How can we reproduce it (as minimally and precisely as possible)?

There should be multiple pods which can receive UDP traffic behind a service. 1. A normal C Program for UDP server should work fine. Multiple pods of that server should be created with a cluster IP. 
2. A client C Program for UDP client inside a pod which is not a part of the above service. It should send the data continuously towards that service.

If required, please let me know, and I will create the docker images for the same.

### Anything else we need to know?

If i am correct, i believe that this is not a issue at the Kubernetes side. This is actually a thing at IPVS which is a part of linux kernel. The UDP is distributed in a random order if the ```net.netfilter.nf_conntrack_udp_timeout=0``` when the kube-proxy mode is Iptables. Only drawback is that it is random and it is unpredictable. It would be awesome if the same functionality could be achieved using IPVS (preferably round robin). So, 
1) i would like to know why the minimum udptimeout possible in IPVS is 1 and not 0.
2) Is there any other hack that we can perform to achieve our aim since changes at the kernel is possible with our knowledge.

### Kubernetes version

<details>

```console
$ kubectl version
Client Version: version.Info{Major:"1", Minor:"23", GitVersion:"v1.23.6", GitCommit:"ad3338546da947756e8a88aa6822e9c11e7eac22", GitTreeState:"clean", BuildDate:"2022-04-14T08:49:13Z", GoVersion:"go1.17.9", Compiler:"gc", Platform:"linux/amd64"}
Server Version: version.Info{Major:"1", Minor:"23", GitVersion:"v1.23.6", GitCommit:"ad3338546da947756e8a88aa6822e9c11e7eac22", GitTreeState:"clean", BuildDate:"2022-04-14T08:43:11Z", GoVersion:"go1.17.9", Compiler:"gc", Platform:"linux/amd64"}

```

</details>

### Cloud provider

<details>
Bare metal. Kubernetes created through kubeadm.
</details>

### OS version

<details>

```console
# On Linux:
$ cat /etc/os-release
# paste output here
$ uname -a
NAME="CentOS Linux"
VERSION="7 (Core)"
ID="centos"
ID_LIKE="rhel fedora"
VERSION_ID="7"
PRETTY_NAME="CentOS Linux 7 (Core)"
ANSI_COLOR="0;31"
CPE_NAME="cpe:/o:centos:centos:7"
HOME_URL="https://www.centos.org/"
BUG_REPORT_URL="https://bugs.centos.org/"

CENTOS_MANTISBT_PROJECT="CentOS-7"
CENTOS_MANTISBT_PROJECT_VERSION="7"
REDHAT_SUPPORT_PRODUCT="centos"
REDHAT_SUPPORT_PRODUCT_VERSION="7"

# On Windows:
C:\> wmic os get Caption, Version, BuildNumber, OSArchitecture
# paste output here
```

</details>

### Install tools

<details>
Packet can be sent through nc or through any other udp generator.
</details>

### Container runtime (CRI) and version (if applicable)

<details>

</details>

### Related plugins (CNI, CSI, ...) and versions (if applicable)

<details>
CNI is flannel.
</details>

**Comment by aojea** [comment]
If this is the IPVS behavior , then you should open a bug in the kernel bugzilla https://bugzilla.kernel.org/

**Comment by opg7371** [comment]
@aojea Thanks for fast reply.
I wanted to know that how are other applications running in kubernetes binded to a particular ip:port deals with UDP packet so that it is distributed in the round robin fashion.
Do you have any idea with respect to this.

I will open a bug in kernel bugzilla, thanks for suggesting.

**Comment by aojea** [comment]
same src_port:src_ip will always be directed to the same backend, they will be considered part of the same session.
Use a different source port, that will work , no?

**Comment by opg7371** [comment]
Apologies for delayed response.

>> Use a different source port, that will work , no?
Yes, that would definitely work because  the tuple for same UDP src and dest will always be different because src port is always different.

My test case is a very general test case - 
I'm setting up a cluster based on IPVS, all UDP data grams sent from firewall with fixed source IP and fixed source port, so  pseudo-random balancing based on client IP and port won't be working. 

The "not working" above means the UDP data grams from one source IP is sticked to one real server, it doesn't distribute to other real servers which --ops designed for.

I find OPS(One-packet-scheduling) mode in IPVSAdm a good compromise for balancing multiple requests coming from the same IP/port over UDP.

Also, in telco cases, this is a very common situation where the UDP packets will always be generated from Fixed IP:port towards another real server through a virtual service.

After digging through some of the kube-proxy IPVS options, i find that ops methods is not supported by kube-proxy. 

May I request a solution to provide the "--ops" options in IPVS through kube-proxy?

**Comment by aojea** [comment]
/remove kind-bug
/kind feature
/area ipvs


> I find OPS(One-packet-scheduling) mode in IPVSAdm a good compromise for balancing multiple requests coming from the same IP/port over UDP.

@uablrek you are the expert here

**Comment by uablrek** [comment]
I'll take a look at it. But I soon be on vacation so please don't expect a quick answer.

**Comment by uablrek** [comment]
Yep, NAT problems it is. The trace below is from inside a POD;
```
/ # tcpdump -ni eth0 udp
tcpdump: verbose output suppressed, use -v or -vv for full protocol decode
listening on eth0, link-type EN10MB (Ethernet), capture size 262144 bytes
14:59:17.029783 IP 11.0.3.2.56633 > 10.0.0.0.5001: UDP, length 1
14:59:17.031613 IP 10.0.0.0.5001 > 11.0.3.2.56633: UDP, length 33
14:59:49.510462 IP 11.0.3.2.54783 > 12.0.17.222.5001: UDP, length 1
14:59:49.512041 IP 11.0.1.3.5001 > 11.0.3.2.54783: UDP, length 33
```
When the no-ops loadBalancerIP is used the reply comes with the loadBalancerIP as source. But when clusterIP is used the reply is from the POD.

**Comment by opg7371** [comment]
Sorry closed by mistake

**Comment by opg7371** [comment]
Thank you for taking your time to test it and provide valuable feedback. 

I have not tested the ops option for the UDP traffic coming from outside to the cluster. 

I have tested the same for when pod belonging to one type of services (say A) sends the UDP packet to multiple pods belonging to another type of services (Say B). I have performed my testing on following type of setup.
```
                                                        |------> POD B1
   POD A  ----------> SERVICE B ----|------> POD B2 
                                                        |------> POD B3
```

To include the ops option in ipvsadm, i have done a little hack, just for testing purposes. 
I have increased the IPVS sync timeout to 3000s in the kube-proxy config map.

To include the ops option , I executed the following command 
`ipvsadm -E -u <SERVICE_IP_B>:PORT -s rr -o`
`-o option for ops (one packet scheduling) option in ipvsadm`

My `ipvsadm -ln`  looks like this 
```
UDP  10.98.148.249:5060 rr ops
  -> 10.244.4.9:5060               Masq    1	 0          0
  -> 10.244.4.10:5060             Masq    1	 0          0
  -> 10.244.4.11:5060             Masq    1	 0          0
```

Then i run the following command on the Pod A intended for Service B- 
```
while true ; 
     do nc -v -u -s 10.244.2.5 -p 5060 10.98.148.249 5060 < MESSAGE  ; 
 done
```

The following is the result [Screenshot attached.]

![Screenshot from 2022-06-29 20-34-45](https://user-images.githubusercontent.com/10517011/176470873-9e7be7a0-b221-4603-b329-28bf944dbdb7.png)

**Comment by opg7371** [comment]
Sir please look at this link -
https://github.com/kubernetes/kubernetes/issues/110814#issuecomment-1169660569

**Comment by opg7371** [comment]
Our primary purpose is to distribute the UDP traffic inside the cluster over multiple pods. The proxy in our case accepts TCP traffic and then convert it into UDP traffic for the real servers.

We can provide the solution for ops option for all the services per port (SEP endpoint). It will be automatically disabled for the TCP oriented connections and will be applicable for UDP based traffics.

I am also interested in providing a patch or helping you out. Please let me know.

**Comment by uablrek** [comment]
What you are requesting is a special implementation for a particular use-case; Round-robin sheduling per-packet for internal UDP traffic where you don't care about return packets. The feature would also be available only for proxy-mode=ipvs.

While this is not hard to implement, e.g. with an annotation in the service, features must also be tested in CI, documented and maintained. K8s maintainers (myself included as co-maintainer of proxy-mode=ipvs) are reluctant to accept features for one specific use-case.

If you like to pursue this, you may write a pull-request (PR). My patch above is a start. Or you may write an own special-purpose proxier, it's [easier than you might think using kpng](https://kubernetes.io/blog/2021/10/18/use-kpng-to-write-specialized-kube-proxiers/).

**Comment by opg7371** [comment]
Thank you for your suggestions. I will look forward to exploring the approaches suggested by you.

**Comment by uablrek** [comment]
Closing with https://github.com/kubernetes/kubernetes/issues/110814#issuecomment-1170240428

/close
