### ISSUE TITLE
kube-proxy: externalTrafficPolicy:Local and proxy-mode=nftables blackholes pods traffic to external IPs

### ISSUE THREAD

**Issue by ffilippopoulos** [kubernetes/kubernetes#131765]
### What happened?

When using kube-proxy on nftables mode and specify a `LoadBalancer` Service with `externalTrafficPolicy:Local` that has an ExternalIP assigned, kube-proxy will create an entry in the kube-proxy ip nftable that will drop traffic to that external IP, like:

```
        map no-endpoint-services {
                type ipv4_addr . inet_proto . inet_service : verdict
                comment "vmap to drop or reject packets to services with no endpoints"
                elements = { 
                             10.88.1.2 . tcp . 80 comment "sys-ingress-priv/internal-ingress-controller-v2:web" : drop,
```

As a result, any pod on the host cannot send traffic to the external IP of the LoadBalancer.

### What did you expect to happen?

On nodes where no workload is present, traffic should not be dropped but load balanced by kube proxy to the target Service endpoints.
This will also bring consistency with how other modes work, as this issue was addressed both for ipvs (https://github.com/kubernetes/kubernetes/issues/93456)
and iptables (https://github.com/kubernetes/kubernetes/pull/77523) modes.

### How can we reproduce it (as minimally and precisely as possible)?

Run kube-proxy on nftables mode and try hitting a `LoadBalancer` Service `ExternalIP` from within a pod running in a node that does not have ready endpoints of the target service

### Anything else we need to know?

@kubernetes/sig-network-bugs
Simmilar to https://github.com/kubernetes/kubernetes/issues/75262 but for `nftables` mode

### Kubernetes version

<details>

```console
Server Version: v1.33.0
```

</details>

kube-proxy: v1.33.0

### Cloud provider

aws, gcp and bare metal

**Comment by aojea** [comment]
ping @danwinship @aroradaman

**Comment by aroradaman** [comment]
I was able to reproduce this for LoadBalancerIPs.
 
We short-circuit traffic originating within the cluster (from pods or workers) that is destined for external addresses (LoadBalancerIP, ExternalIP, or NodePort), DNATing it to cluster endpoints rather than local endpoints.

The filter-output is hooked to output hook with a priority lower then DNAT ( -110), and the packets are dropped.
confirmed with trace
```
trace id f97b367d ip filter trace packet: oif "eth0" ip saddr 172.18.0.3 ip daddr 172.18.0.100 ip dscp cs0 ip ecn not-ect ip ttl 64 ip id 53570 ip length 60 tcp sport 53880 tcp dport 3000 tcp flags == syn tcp window 64240 
trace id f97b367d ip filter trace rule ip daddr 172.18.0.100 meta nftrace set 1 (verdict continue)
trace id f97b367d ip filter trace verdict continue 
trace id f97b367d ip filter trace policy accept 
trace id f97b367d ip kube-proxy filter-output packet: oif "eth0" ip saddr 172.18.0.3 ip daddr 172.18.0.100 ip dscp cs0 ip ecn not-ect ip ttl 64 ip id 53570 ip length 60 tcp sport 53880 tcp dport 3000 tcp flags == syn tcp window 64240 
trace id f97b367d ip kube-proxy filter-output rule ct state new jump service-endpoints-check (verdict jump service-endpoints-check)
trace id f97b367d ip kube-proxy service-endpoints-check rule ip daddr . meta l4proto . th dport vmap @no-endpoint-services (verdict drop)
trace id 587493e0 ip filter trace packet: oif "eth0" ip saddr 172.18.0.3 ip daddr 172.18.0.100 ip dscp cs0 ip ecn not-ect ip ttl 64 ip id 53571 ip length 60 tcp sport 53880 tcp dport 3000 tcp flags == syn tcp window 64240 
trace id 587493e0 ip filter trace rule ip daddr 172.18.0.100 meta nftrace set 1 (verdict continue)
trace id 587493e0 ip filter trace verdict continue 
trace id 587493e0 ip filter trace policy accept 
trace id 587493e0 ip kube-proxy filter-output packet: oif "eth0" ip saddr 172.18.0.3 ip daddr 172.18.0.100 ip dscp cs0 ip ecn not-ect ip ttl 64 ip id 53571 ip length 60 tcp sport 53880 tcp dport 3000 tcp flags == syn tcp window 64240 
trace id 587493e0 ip kube-proxy filter-output rule ct state new jump service-endpoints-check (verdict jump service-endpoints-check)
trace id 587493e0 ip kube-proxy service-endpoints-check rule ip daddr . meta l4proto . th dport vmap @no-endpoint-services (verdict drop)
```

**Comment by aroradaman** [comment]
@danwinship I tried to set priority of all filter chains to 0 (default filter priority) and handle the firewall-check case which happens in filter-prerouting and filter-output using original destination IP and port from conntrack but it turns out we can not match on `inet_service` data type with `ct original proto-dst` expression.
(ref: https://wiki.nftables.org/wiki-nftables/index.php/Data_types#IP_types)

```
E0622 17:16:35.104974       1 proxier.go:1850] "nftables sync failed" err=<
    /dev/stdin:61:75-97: Error: can not use variable sized data types (invalid) in concat expressions
    add rule ip kube-proxy firewall-check ct original ip daddr . meta l4proto . ct original proto-dst vmap @firewall-ips
                                          ~~~~~~~~~~~~~~~~~~~~~~~~~~~~~~~~~~~~^^^^^^^^^^^^^^^^^^^^^^^
```

I was thinking of having `filter-prerouting-pre-dnat` and `filter-output-pre-dnat` chains hooked with -110 priority. These chains  will jump to firewall check. And `filter-input`, `filter-forward`, `filter-output` chains hooked with priority 0. 
We can also merge the `filter-output-post-dnat` into `filter-output` with this change.

**Comment by danwinship** [comment]
> it turns out we can not match on `inet_service` data type with `ct original proto-dst` expression

That error seems wrong... the man page claims that `proto-dst` is a 16-bit integer, so it shouldn't be saying it's "variable sized"... but at any rate, even if it is a bug and they fix it, we can't depend on that fix for a long time.

**Comment by aroradaman** [comment]
@danwinship @aojea Do we have an e2e for this? I couldn't find any.

**Comment by danwinship** [comment]
It looks like we only have a single ExternalIPs test, which only tests the short-circuiting of pod-to-externalIP traffic.

ExternalIPs are only half a feature (we define what happens when externalIP traffic reaches the cluster, but we don't define any way to allocate an externalIP) so they can't really be tested portably. We could probably write some tests that would work at least under kind.

But then, the other problem is that we recommend that people disable externalIPs anyway...

**Comment by ffilippopoulos** [comment]
I do not think this issue is actually resolved. We have re-enabled `externalTrafficPolicy: Local` in one of our Services and I am trying to hit it's external IP (10.87.1.2) from inside a pod:

```
$ kubectl --context exp-1-merit --namespace sys-ingress-priv get svc internal-ingress-controller-v2
NAME                             TYPE           CLUSTER-IP     EXTERNAL-IP   PORT(S)                      AGE
internal-ingress-controller-v2   LoadBalancer   10.7.113.128   10.87.1.2     80:32634/TCP,443:32008/TCP   4y243d
```

In nftables, I can see that the externalIP is in both `no-endpoint-services` and `service-ips` maps and has ready/live endpoints in our cluster. As the fix (https://github.com/kubernetes/kubernetes/pull/132456) suggests, I can see the `filter-prerouting-pre-dnat` chain:
```
        chain filter-prerouting-pre-dnat {
                type filter hook prerouting priority dstnat - 10; policy accept;
                ct state new jump firewall-check
        }
```
that is supposed to bypass the chains that drop packets to external IP. The rest of chains are as follows:
```
        chain nodeport-endpoints-check {
                ip daddr != 127.0.0.0/8 meta l4proto . th dport vmap @no-endpoint-nodeports
        }

        chain service-endpoints-check {
                ip daddr . meta l4proto . th dport vmap @no-endpoint-services
        }

        chain firewall-check {
                ip daddr . meta l4proto . th dport vmap @firewall-ips
        }

        chain services {
                ip daddr . meta l4proto . th dport vmap @service-ips
                fib daddr type local ip daddr != 127.0.0.0/8 meta l4proto . th dport vmap @service-nodeports
        }

        chain masquerading {
                meta mark & 0x00004000 == 0x00000000 return
                meta mark set meta mark ^ 0x00004000
                masquerade fully-random
        }

        chain cluster-ips-check {
                ip daddr @cluster-ips reject comment "Reject traffic to invalid ports of ClusterIPs"
                ip daddr 10.7.0.0/16 drop comment "Drop traffic to unallocated ClusterIPs"
        }

        chain mark-for-masquerade {
                meta mark set meta mark | 0x00004000
        }

        chain reject-chain {
                comment "helper for @no-endpoint-services / @no-endpoint-nodeports"
                reject
        }

        chain service-66AAUTXI-sys-argocd/argocd-server/tcp/http {
...
```
to give you a glimpse of where this is jumping to.


But trying to hit this from inside a Pod gives me a timeout:
```
$ nc -v -w2 -z 10.87.1.2 443
nc: 10.87.1.2 (10.87.1.2:443): Operation timed out
command terminated with exit code 1
```
while using the Service IP (or a Pod IP directly works):
```
$ nc -v -w2 -z 10.7.113.128  443
10.7.113.128 (10.7.113.128:443) open
```

`tcpdump -i any` on the caller pod host shows that when trying the ExternalIP packets never jump off the calico pod interface:
```
11:25:39.411133 calia30537cfb69 In  IP 10.6.12.6.46149 > 10.87.1.2.443: Flags [S], seq 987021165, win 64800, options [mss 1440,sackOK,TS val 3972518332 ecr 0,nop,wscale 7], length 0
11:25:40.446536 calia30537cfb69 In  IP 10.6.12.6.46149 > 10.87.1.2.443: Flags [S], seq 987021165, win 64800, options [mss 1440,sackOK,TS val 3972519368 ecr 0,nop,wscale 7], length 0
```
while using a target Pod IP directly is able to be routed out:
```
11:25:21.467278 calia30537cfb69 In  IP 10.6.12.6.40527 > 10.6.9.24.443: Flags [S], seq 979113911, win 64800, options [mss 1440,sackOK,TS val 3337680190 ecr 0,nop,wscale 7], length 0         
11:25:21.467335 wireguard.cali Out IP 10.6.12.6.40527 > 10.6.9.24.443: Flags [S], seq 979113911, win 64800, options [mss 1440,sackOK,TS val 3337680190 ecr 0,nop,wscale 7], length 0          
11:25:21.468273 calia30537cfb69 In  IP 10.6.12.6.40527 > 10.6.9.24.443: Flags [.], ack 3906855355, win 507, options [nop,nop,TS val 3337680191 ecr 2850828976], length 0                      
11:25:21.468284 wireguard.cali Out IP 10.6.12.6.40527 > 10.6.9.24.443: Flags [.], ack 1, win 507, options [nop,nop,TS val 3337680191 ecr 2850828976], length 0
```

Atm we are using `registry.k8s.io/kube-proxy:v1.34.2` image. I think that this issue should be re-opened as the original problem described does not look solved.

**Comment by aojea** [comment]
are we sure is the same or a permutation of the same?

your tcpdump indicates that you have a more complex setup than common setups, as the wireguard interface seems to indicate, but that is just pure especulation ... if is similar but not the same then we need to open a new issue to avoid mixing contexts

**Comment by ffilippopoulos** [comment]
@aojea @aroradaman 

I am quite confident we are talking about the same issue still. The wireguard interface is standard Calico configuration by now and I only posted it here to present the example of packets forwarded further and not being dropped after pod network interface. Effectively we still observe the same issue as the one stated in the description:

> On nodes where no workload is present, traffic should not be dropped but load balanced by kube proxy to the target Service endpoints.

As far as my limited understanding of nftables goes, based on the fix: https://github.com/kubernetes/kubernetes/pull/132456 the chain that should be implementing the short circuit for local traffic to external addresses is:

```
        chain filter-forward {
                type filter hook forward priority filter; policy accept;
                ct state new jump service-endpoints-check
                ct state new jump cluster-ips-check
        }
```

which still evaluates service endpoints and drops my ExternalIP which is mapped in `no-endpoint-services` 
```
        chain service-endpoints-check {
                ip daddr . meta l4proto . th dport vmap @no-endpoint-services
        }
```
Thus is still cannot hit Service ExternalIPs from within Pods.

**Comment by aroradaman** [comment]
@ffilippopoulos Can you share the complete dump of the nftable rules?
`nft list table ip kube-proxy`

**Comment by ffilippopoulos** [comment]
@aroradaman yes, this is an example nftable dump: https://gist.github.com/ffilippopoulos/98054f1274d79c9b8a10457f82b0c610. The external IP I am trying to hit is `10.87.1.2` and pod subnet is `10.6.0.0/16` and Services ClusterIPs subnet is `10.7.0.0/16`. This is on a host with no pod of the service in question is running.
