### ISSUE TITLE
API server drops watch connections

### ISSUE THREAD

**Issue by aleks-f** [kubernetes/kubernetes#16666]
After 30-45 minutes, chunked HTTP connection to API server is dropped:

```Transmission Control Protocol, Src Port: http-alt (8080), Dst Port: 55782 (55782), Seq: 751, Ack: 88, Len: 0
.... 0000 0001 0001 = Flags: 0x011 (FIN, ACK)```

This happens regardless of the activity level, i.e. it happens for connections that were idle for a long time but also for the ones that had notifications coming for the whole duration of the connection. HTTP 1.0 (with `Connection: Keep-Alive` header) just ends the original request, while HTTP 1.1, which is keepalive by default, sends `400 Bad Request` before dropping the connection.

Is it possible to get a watch connection which remains alive for a long period of time?

**Comment by aleks-f** [comment]
Re-posted on [Stack Overflow](http://stackoverflow.com/questions/33480560/kuberentes-api-server-drops-watch-connections)

**Comment by aleks-f** [comment]
kubernetes version is 1.0.6

**Comment by thockin** [comment]
This is expected behavior.  Watch is just an HTTP operation and it times out.  Is this causing problems or is it just something you noticed?

**Comment by alex-mohr** [comment]
Closing here in favor of StackOverflow thread: http://stackoverflow.com/questions/33480560/kubernetes-api-server-drops-watch-connections
