### ISSUE TITLE
TCP connection timeout after sometime when using externaltrafficpolicy:local and metalb controller.

### ISSUE THREAD

**Issue by akshaysharama** [kubernetes/kubernetes#127937]
### What happened?

I have deployed a microservice(single instance) on a 3 node cluster, each node as a master/worker. 
Application is up and running, have a svc with loadbalancer(External IP). 

when deploying freshly, all traffic on the external loadbalancer IP is running fine, but after sometime I could see traffic is stopped, tcp connection timeout on the loadbalancer ip: port.

After debugging, I could see, when setup is fresh, all nodes have iptables related to health check and the node which has instance running has some iptables to support trafficpolicy I guess.

but later on, if i do rolling update or instance get deleted and move to other node, could see the drop iptables on the nodes where the instance is not scheduled. 

1) How this drop iptables rules came?
2) externaltrafficpolicy: local, then traffic should reach to the node where instance is running, but packet is getting dropped hence it is reaching to the other node when iptable rules are dropped. so why the traffic is reaching to the node with no instance? 

node-1:~ # iptables -L | grep 192.168.64.128
DROP       tcp  --  anywhere             192.168.64.128       /* services/controller-3:x has no local endpoints */ tcp dpt:gsmp-x

node-0:~ # iptables -L | grep 192.168.64.128
DROP       tcp  --  anywhere             192.168.64.128       /* services/controller-3:x has no local endpoints */ tcp dpt:gsmp-x

node-2:~ # iptables -L | grep 192.168.64.128
(no rule)

Error:
{"level":"error","timestamp":1728416020520.091,"caller":"ancp.git@v1.4.0-33309983/client.go:66","short_message":"connection failed: dial tcp 192.168.64.128:6068: connect: connection timed out","logging_lib_version":"2.0.0","time_zone":"UTC(+0s)","a4_pod_name":"4901708dc8f4","log_type":"APPLICATION"}
2024/10/08 19:33:40 failed to create client for 192.168.64.128: dial tcp 192.168.64.128:6068: connect:

svc:
services      controller-3                                 LoadBalancer   192.168.255.74    192.168.64.128   6068:30655/TCP                                                                  10d

### What did you expect to happen?

traffic should flow seamlessely.

### How can we reproduce it (as minimally and precisely as possible)?

 deploy pod on node-3.
restart the pod, it got deployed to node-2.
and you will see the issue.

(sometimes we may need to do multiple rolling update)

### Kubernetes version

<details>

```console
$ kubectl version
Client Version: version.Info{Major:"1", Minor:"26", GitVersion:"v1.26.7", GitCommit:"84e1fc493a47446df2e155e70fca768d2653a398", GitTreeState:"clean", BuildDate:"2023-07-19T12:23:27Z", GoVersion:"go1.20.6", Compiler:"gc", Platform:"linux/amd64"}
Kustomize Version: v4.5.7
Server Version: version.Info{Major:"1", Minor:"26", GitVersion:"v1.26.7", GitCommit:"84e1fc493a47446df2e155e70fca768d2653a398", GitTreeState:"clean", BuildDate:"2023-07-19T12:16:45Z", GoVersion:"go1.20.6", Compiler:"gc", Platform:"linux/amd64"}
```

</details>

### Cloud provider

<details>

</details>

### OS version

<details>

```console
# On Linux:
$ cat /etc/os-release
# paste output here
$ uname -a
# paste output here

# On Windows:
C:\> wmic os get Caption, Version, BuildNumber, OSArchitecture
# paste output here
```

</details>

### Install tools

<details>

</details>

### Container runtime (CRI) and version (if applicable)

<details>
containerd
</details>

### Related plugins (CNI, CSI, ...) and versions (if applicable)

<details>
flannel/calico
</details>

**Comment by uablrek** [comment]
K8s _should_ drop external packets coming to a node without local endpoints if `externalTrafficPolicy:Local` is used. K8s is not involved in external routing, so the problem is likely in `metallb`.

**Comment by akshaysharama** [comment]
@uablrek, thank you for your comment.

quick question:
1) During initial deployment, I couldn't see any drop rules, but if the instance is moved to other node or rolling update or redeploy ..I'm seeing this dropping rules which also not every time. why? Why in the first place we don't have this rule? and when it is getting added or why?

**Comment by uablrek** [comment]
First guess is that you *have* instances on all nodes on initial deployment. But is that is not the case, nodes without instances *should* have the drop rules. If not, *that* may be a K8s bug.

**Comment by akshaysharama** [comment]
We have only one instance, and when we checked intially as soon as we deployed the application, there was no drop rule in any of the node.

**Comment by haosdent** [comment]
Seems not related to `/sig network` instead of `/sig scheduling`

**Comment by uablrek** [comment]
I tested on K8s v1.31.1, and I get drop rules from start. K8s v1.26.7 is not supported, so please upgrade to a supported version.

If you get drop rules from start it would not help you, but perhaps other things have been fixed in supported versions of K8s

**Comment by akshaysharama** [comment]
@uablrek @haosdent, as the traffic has reached to the cluster but forwarded to the other node where instance is not scheduled, then it is not a kube-proxy or cni issue(we are using flannel/k3s)????

**Comment by uablrek** [comment]
No. To which node external traffic is routed is not handled by K8s (kube-proxy). Since "metallb" is mentioned in the slogan for this issue, I assumed you use it for that function. Metallb can route external traffic to a node by announcing the loadBalancerIP via BGP, or via neighbor discovery (L2, ARP). If metallb is used, it has the responsibility to announce the  loadBalancerIP *only* on nodes with local instances.

**Comment by akshaysharama** [comment]
Hi @uablrek , 

**If you see, below logs.. metallb speaker logs, reconsiling is happening. when the pod/instance is scheduled on node-0
but the traffic is reaching to node-3 (not sure why).

checked svc endpoints, pod health.. everything is up and running. ( no restarts of the pod) and traffic was working for a day then suddenly it stopped working and checked traffic is reaching to node-2 now.**


14:50:34.226141 52:54:00:9d:47:8a > e8:c5:7a:d6:0c:19, ethertype 802.1Q (0x8100), length 78: vlan 16, p 0, ethertype IPv4, 192.168.66.33.55408 > 192.168.64.128.6068: Flags [S], seq 3354532105, win 64240, options [mss 1460,sackOK,TS val 2032431007 ecr 0,nop,wscale 7], length 0
14:50:34.227481 e8:c5:7a:d6:0c:19 > 52:54:00:9d:47:8a, ethertype 802.1Q (0x8100), length 106: vlan 16, p 7, ethertype IPv4, 192.168.65.22 > 192.168.66.33: ICMP time exceeded in-transit, length 68

tcpdump of node-3

14:51:51.663781 eth5  In  IP 192.168.66.33.45288 > 192.168.64.128.6068: Flags [S], seq 2466323344, win 64240, options [mss 1460,sackOK,TS val 2032524227 ecr 0,nop,wscale 7], length 0
14:51:51.663781 vlan4074.5 In  IP 192.168.66.33.45288 > 192.168.64.128.6068: Flags [S], seq 2466323344, win 64240, options [mss 1460,sackOK,TS val 2032524227 ecr 0,nop,wscale 7], length 0
14:51:51.663847 vlan4074.5 Out IP 192.168.66.33.45288 > 192.168.64.128.6068: Flags [S], seq 2466323344, win 64240, options [mss 1460,sackOK,TS val 2032524227 ecr 0,nop,wscale 7], length 0
14:51:51.663855 eth5  Out IP 192.168.66.33.45288 > 192.168.64.128.6068: Flags [S], seq 2466323344, win 64240, options [mss 1460,sackOK,TS val 2032524227 ecr 0,nop,wscale 7], length 0
  
   Speaker logs:                              

{"caller":"service_controller.go:134","controller":"ServiceReconciler","enqueueing":"services/controller-3","epslice":"{\"metadata\":{\"name\":\"-controller-3-d2rtt\",\"generateName\":\"-controller-3-\",\"namespace\":\"services\",\"uid\":\"e99d06c4-71ee-488a-8568-9cbdca1e66bb\",\"resourceVersion\":\"45170081\",\"generation\":27,\"creationTimestamp\":\"2024-10-08T12:48:14Z\",\"labels\":{\"app.kubernetes.io/instance\":\"-controller\",\"app.kubernetes.io/managed-by\":\"Helm\",\"app.kubernetes.io/name\":\"-controller\",\"app.kubernetes.io/version\":\"1.6.0-0.ftth79942.34855950\",\"endpointslice.kubernetes.io/managed-by\":\"endpointslice-controller.k8s.io\",\"helm.sh/chart\":\"-controller-1.6.0-0.ftth79942.34855950\",\"kubernetes.io/service-name\":\"-controller-3\"},\"ownerReferences\":[{\"apiVersion\":\"v1\",\"kind\":\"Service\",\"name\":\"-controller-3\",\"uid\":\"aaa46636-e198-4796-9d68-ddb6d2f6dfdd\",\"controller\":true,\"blockOwnerDeletion\":true}],\"managedFields\":[{\"manager\":\"k3s\",\"operation\":\"Update\",\"apiVersion\":\"discovery.k8s.io/v1\",\"time\":\"2024-10-08T13:39:45Z\",\"fieldsType\":\"FieldsV1\",\"fieldsV1\":{\"f:addressType\":{},\"f:endpoints\":{},\"f:metadata\":{\"f:generateName\":{},\"f:labels\":{\".\":{},\"f:app.kubernetes.io/instance\":{},\"f:app.kubernetes.io/managed-by\":{},\"f:app.kubernetes.io/name\":{},\"f:app.kubernetes.io/version\":{},\"f:endpointslice.kubernetes.io/managed-by\":{},\"f:helm.sh/chart\":{},\"f:kubernetes.io/service-name\":{}},\"f:ownerReferences\":{\".\":{},\"k:{\\\"uid\\\":\\\"aaa46636-e198-4796-9d68-ddb6d2f6dfdd\\\"}\":{}}},\"f:ports\":{}}}]},\"addressType\":\"IPv4\",\"endpoints\":[{\"addresses\":[\"192.168.248.135\"],\"conditions\":{\"ready\":true,\"serving\":true,\"terminating\":false},\"targetRef\":{\"kind\":\"Pod\",\"namespace\":\"services\",\"name\":\"-controller-66949c74c5-kdb65\",\"uid\":\"eb3ec071-6ad7-48db-8adc-547f100294ac\"},\"nodeName\":\"node-0\"}],\"ports\":[{\"name\":\"ancp\",\"protocol\":\"TCP\",\"port\":6068}]}","level":"debug","ts":"2024-10-09T14:33:33Z"}
{"caller":"service_controller.go:134","controller":"ServiceReconciler","enqueueing":"services/controller-1","epslice":"{\"meta        data\":{\"name\":\"-controller-1-wjcf6\",\"generateName\":\"-controller-1-\",\"namespace\":\"services\",\"uid\":\"        963f2a40-b595-445e-a928-19033d1f6d32\",\"resourceVersion\":\"45170083\",\"generation\":27,\"creationTimestamp\":\"2024-10-08T12:48:14Z\",\"label        s\":{\"app.kubernetes.io/instance\":\"-controller\",\"app.kubernetes.io/managed-by\":\"Helm\",\"app.kubernetes.io/name\":\"pao-msan        -ancp-controller\",\"app.kubernetes.io/version\":\"1.6.0-0.ftth79942.34855950\",\"endpointslice.kubernetes.io/managed-by\":\"endpointslice-contr        oller.k8s.io\",\"helm.sh/chart\":\"-controller-1.6.0-0.ftth79942.34855950\",\"kubernetes.io/service-name\":\"-controll        er-1\"},\"ownerReferences\":[{\"apiVersion\":\"v1\",\"kind\":\"Service\",\"name\":\"-controller-1\",\"uid\":\"cc6b54ae-c97c-451a-a4        fd-f9ef591297bd\",\"controller\":true,\"blockOwnerDeletion\":true}],\"managedFields\":[{\"manager\":\"k3s\",\"operation\":\"Update\",\"apiVersio        n\":\"discovery.k8s.io/v1\",\"time\":\"2024-10-08T13:39:45Z\",\"fieldsType\":\"FieldsV1\",\"fieldsV1\":{\"f:addressType\":{},\"f:endpoints\":{},        \"f:metadata\":{\"f:generateName\":{},\"f:labels\":{\".\":{},\"f:app.kubernetes.io/instance\":{},\"f:app.kubernetes.io/managed-by\":{},\"f:app.k        ubernetes.io/name\":{},\"f:app.kubernetes.io/version\":{},\"f:endpointslice.kubernetes.io/managed-by\":{},\"f:helm.sh/chart\":{},\"f:kubernetes.        io/service-name\":{}},\"f:ownerReferences\":{\".\":{},\"k:{\\\"uid\\\":\\\"cc6b54ae-c97c-451a-a4fd-f9ef591297bd\\\"}\":{}}},\"f:ports\":{}}}]},\        "addressType\":\"IPv4\",\"endpoints\":[{\"addresses\":[\"192.168.248.135\"],\"conditions\":{\"ready\":true,\"serving\":true,\"terminating\":fals        e},\"targetRef\":{\"kind\":\"Pod\",\"namespace\":\"services\",\"name\":\"-controller-66949c74c5-kdb65\",\"uid\":\"eb3ec071-6ad7        -48db-8adc-547f100294ac\"},\"nodeName\":\"node-0\"}],\"ports\":[{\"name\":\"ancp\",\"protocol\":\"TCP\",\"port\":6068}]}"        ,"level":"debug","ts":"2024-10-09T14:33:34Z"}
{"caller":"service_controller_reload.go:98","controller":"ServiceReconciler - reprocessAll","level":"debug","reprocessing service":"{\"kind\":\"        Service\",\"apiVersion\":\"v1\",\"metadata\":{\"name\":\"-controller-1\",\"namespace\":\"services\",\"uid\":\"cc6b54ae-c97c-451        a-a4fd-f9ef591297bd\",\"resourceVersion\":\"45169969\",\"creationTimestamp\":\"2024-10-08T12:48:14Z\",\"labels\":{\"app.kubernetes.io/instance\"        :\"-controller\",\"app.kubernetes.io/managed-by\":\"Helm\",\"app.kubernetes.io/name\":\"-controller\",\"app.kubernetes        .io/version\":\"1.6.0-0.ftth79942.34855950\",\"helm.sh/chart\":\"-controller-1.6.0-0.ftth79942.34855950\"},\"annotations\":{\"field        .cattle.io/publicEndpoints\":\"[{\\\"addresses\\\":[\\\"192.168.64.129\\\"],\\\"port\\\":6068,\\\"protocol\\\":\\\"TCP\\\",\\\"serviceName\\\":\        \\"services:-controller-1\\\",\\\"allNodes\\\":false}]\",\"meta.helm.sh/release-name\":\"-controller\",\"meta.helm        .sh/release-namespace\":\"services\",\"metallb.universe.tf/address-pool\":\"my-application\",\"metallb.universe.tf/ip-allocated-from-pool\":\        "my-application\"},\"managedFields\":[{\"manager\":\"agent\",\"operation\":\"Update\",\"apiVersion\":\"v1\",\"time\":\"2024-10-08T12:48:14Z\",\"f        ieldsType\":\"FieldsV1\",\"fieldsV1\":{\"f:metadata\":{\"f:annotations\":{\"f:field.cattle.io/publicEndpoints\":{}}}}},{\"manager\":\"controller        \",\"operation\":\"Update\",\"apiVersion\":\"v1\",\"time\":\"2024-10-08T12:48:14Z\",\"fieldsType\":\"FieldsV1\",\"fieldsV1\":{\"f:metadata\":{\"        f:annotations\":{\"f:metallb.universe.tf/ip-allocated-from-pool\":{}}},\"f:status\":{\"f:loadBalancer\":{\"f:ingress\":{}}}},\"subresource\":\"s        tatus\"},{\"manager\":\"helm\",\"operation\":\"Update\",\"apiVersion\":\"v1\",\"time\":\"2024-10-08T12:48:14Z\",\"fieldsType\":\"FieldsV1\",\"fi        eldsV1\":{\"f:metadata\":{\"f:annotations\":{\".\":{},\"f:meta.helm.sh/release-name\":{},\"f:meta.helm.sh/release-namespace\":{},\"f:metallb.uni        verse.tf/address-pool\":{}},\"f:labels\":{\".\":{},\"f:app.kubernetes.io/instance\":{},\"f:app.kubernetes.io/managed-by\":{},\"f:app.kubernetes.        io/name\":{},\"f:app.kubernetes.io/version\":{},\"f:helm.sh/chart\":{}}},\"f:spec\":{\"f:allocateLoadBalancerNodePorts\":{},\"f:externalTrafficP        olicy\":{},\"f:internalTrafficPolicy\":{},\"f:ports\":{\".\":{},\"k:{\\\"port\\\":6068,\\\"protocol\\\":\\\"TCP\\\"}\":{\".\":{},\"f:name\":{},\        "f:port\":{},\"f:protocol\":{},\"f:targetPort\":{}}},\"f:selector\":{},\"f:sessionAffinity\":{},\"f:type\":{}}}}]},\"spec\":{\"ports\":[{\"name\        ":\"ancp\",\"protocol\":\"TCP\",\"port\":6068,\"targetPort\":6068,\"nodePort\":31520}],\"selector\":{\"app.kubernetes.io/instance\":\"pao-msan-a        ncp-controller\",\"app.kubernetes.io/name\":\"-controller\"},\"clusterIP\":\"192.168.254.160\",\"clusterIPs\":[\"192.168.254.160\"]        ,\"type\":\"LoadBalancer\",\"sessionAffinity\":\"None\",\"externalTrafficPolicy\":\"Local\",\"healthCheckNodePort\":32635,\"ipFamilies\":[\"IPv4        \"],\"ipFamilyPolicy\":\"SingleStack\",\"allocateLoadBalancerNodePorts\":true,\"internalTrafficPolicy\":\"Cluster\"},\"status\":{\"loadBalancer\        ":{\"ingress\":[{\"ip\":\"192.168.64.129\"}]}}}","ts":"2024-10-09T14:33:34Z"}
{"caller":"bgp_controller.go:152","event":"skipping should announce bgp","ips":["192.168.64.129"],"level":"debug","pool":"my-application","protoc        ol":"bgp","reason":"pool not matching my node","service":"services/controller-1","ts":"2024-10-09T14:33:35Z"}
{"caller":"layer2_controller.go:110","event":"shouldannounce","ips":["192.168.64.129"],"level":"debug","nodes":["node-0"]        ,"pool":"my-application","protocol":"l2","service":"services/controller-1","ts":"2024-10-09T14:33:35Z"}
"IPAddressPool\",\"apiVersion\":\"metallb.io/v1beta1\",\"metadata\":{\"name\":\"dpu-driver-ancp-dpu-adt\",\"namespace\":\"metal-lb\",\"uid\":\"6        a1f0e35-94ef-4306-b139-6ca3fd5058a6\",\"resourceVersion\":\"36994686\",\"generation\":1,\"creationTimestamp\":\"2024-09-26T11:53:17Z\",\"labels\        ":{\"app.kubernetes.io/instance\":\"metal-lb\",\"app.kubernetes.io/managed-by\":\"Helm\",\"app.kubernetes.io/name\":\"metal-lb\",\"app.kubernete        s.io/version\":\"1.7.0-32464170\",\"helm.sh/chart\":\"metal-lb-1.7.0-32464170\"},\"annotations\":{\"meta.helm.sh/release-name\":\"metal-lb\",\"m        eta.helm.sh/release-namespace\":\"metal-lb\"},\"managedFields\":[{\"manager\":\"helm\",\"operation\":\"Update\",\"apiVersion\":\"metallb.io/v1be        ta1\",\"time\":\"2024-09-26T11:53:17Z\",\"fieldsType\":\"FieldsV1\",\"fieldsV1\":{\"f:metadata\":{\"f:annotations\":{\".\":{},\"f:meta.helm.sh/r        elease-name\":{},\"f:meta.helm.sh/release-namespace\":{}},\"f:labels\":{\".\":{},\"f:app.kubernetes.io/instance\":{},\"f:app.kubernetes.io/manag        ed-by\":{},\"f:app.kubernetes.io/name\":{},\"f:app.kubernetes.io/version\":{},\"f:helm.sh/chart\":{}}},\"f:spec\":{\".\":{},\"f:addresses\":{},\        "f:autoAssign\":{},\"f:avoidBuggyIPs\":{}}}}]},\"spec\":{\"addresses\":[\"100.64.0.129/32\"],\"autoAssign\":false},\"status\":{}},{\"kind\":\"IP        AddressPool\",\"apiVersion\":\"metallb.io/v1beta1\",\"metadata\":{\"name\":\"my-application\",\"namespace\":\"metal-lb\",\"uid\":\"f05d9af3-80a8-        4f9e-9eb1-7dce98940abd\",\"resourceVersion\":\"36994680\",\"generation\":1,\"creationTimestamp\":\"2024-09-26T11:53:17Z\",\"labels\":{\"app.kube        rnetes.io/instance\":\"metal-lb\",\"app.kubernetes.io/managed-by\":\"Helm\",\"app.kubernetes.io/name\":\"metal-lb\",\"app.kubernetes.io/version\        ":\"1.7.0-32464170\",\"helm.sh/chart\":\"metal-lb-1.7.0-32464170\"},\"annotations\":{\"meta.helm.sh/release-name\":\"metal-lb\",\"meta.helm.sh/r        elease-namespace\":\"metal-lb\"},\"managedFields\":[{\"manager\":\"helm\",\"operation\":\"Update\",\"apiVersion\":\"metallb.io/v1beta1\",\"time\        ":\"2024-09-26T11:53:17Z\",\"fieldsType\":\"FieldsV1\",\"fieldsV1\":{\"f:metadata\":{\"f:annotations\":{\".\":{},\"f:meta.helm.sh/release-name\"        :{},\"f:meta.helm.sh/release-namespace\":{}},\"f:labels\":{\".\":{},\"f:app.kubernetes.io/instance\":{},\"f:app.kubernetes.io/managed-by\":{},\"        f:app.kubernetes.io/name\":{},\"f:app.kubernetes.io/version\":{},\"f:helm.sh/chart\":{}}},\"f:spec\":{\".\":{},\"f:addresses\":{},\"f:autoAssign        \":{},\"f:avoidBuggyIPs\":{}}}}]},\"spec\":{\"addresses\":[\"192.168.64.128/30\"],\"autoAssign\":false},\"status\":{}},{\"kind\":\"IPAddressPool        \",\"apiVersion\":\"metallb.io/v1beta1\",\"metadata\":{\"name\":\"gelf-ibm\",\"namespace\":\"metal-lb\",\"uid\":\"86c97c89-e437-431f-abf1-e075eb        bf4ab6\",\"resourceVersion\":\"36994692\",\"generation\":1,\"creationTimestamp\":\"2024-09-26T11:53:17Z\",\"labels\":{\"app.kubernetes.io/instan        ce\":\"metal-lb\",\"app.kubernetes.io/managed-by\":\"Helm\",\"app.kubernetes.io/name\":\"metal-lb\",\"app.kubernetes.io/version\":\"1.7.0-324641        70\",\"helm.sh/chart\":\"metal-lb-1.7.0-32464170\"},\"annotations\":{\"meta.helm.sh/release-name\":\"metal-lb\",\"meta.helm.sh/release-namespace        \":\"metal-lb\"},\"managedFields\":[{\"manager\":\"helm\",\"operation\":\"Update\",\"apiVersion\":\"metallb.io/v1beta1\",\"time\":\"2024-09-26T1        1:53:17Z\",\"fieldsType\":\"FieldsV1\",\"fieldsV1\":{\"f:metadata\":{\"f:annotations\":{\".\":{},\"f:meta.helm.sh/release-name\":{},\"f:meta.hel        m.sh/release-namespace\":{}},\"f:labels\":{\".\":{},\"f:app.kubernetes.io/instance\":{},\"f:app.kubernetes.io/managed-by\":{},\"f:app.kubernetes        .io/name\":{},\"f:app.kubernetes.io/version\":{},\"f:helm.sh/chart\":{}}},\"f:spec\":{\".\":{},\"f:addresses\":{},\"f:autoAssign\":{},\"f:avoidB        uggyIPs\":{}}}}]},\"spec\":{\"addresses\":[\"192.168.16.132/32\"],\"autoAssign\":false},\"status\":{}},{\"kind\":\"IPAddressPool\",\"apiVersion\        ":\"metallb.io/v1beta1\",\"metadata\":{\"name\":\"rsyslog-olt-ibm\",\"namespace\":\"metal-lb\",\"uid\":\"ab1a4c80-5c45-4d6e-8ce1-7b23db646e1b\",        \"resourceVersion\":\"36994698\",\"generation\":1,\"creationTimestamp\":\"2024-09-26T11:53:17Z\",\"labels\":{\"app.kubernetes.io/instance\":\"me        tal-lb\",\"app.kubernetes.io/managed-by\":\"Helm\",\"app.kubernetes.io/name\":\"metal-lb\",\"app.kubernetes.io/version\":\"1.7.0-32464170\",\"he        lm.sh/chart\":\"metal-lb-1.7.0-32464170\"},\"annotations\":{\"meta.helm.sh/release-name\":\"metal-lb\",\"meta.helm.sh/release-namespace\":\"meta
{"caller":"service_controller_reload.go:98","controller":"ServiceReconciler - reprocessAll","level":"debug","reprocessing service":"{\"kind\":\"        Service\",\"apiVersion\":\"v1\",\"metadata\":{\"name\":\"-controller-4\",\"namespace\":\"services\",\"uid\":\"4dc877ee-5ecf-4aa        6-b981-8139b21e9f55\",\"resourceVersion\":\"45169986\",\"creationTimestamp\":\"2024-10-08T12:48:14Z\",\"labels\":{\"app.kubernetes.io/instance\"        :\"-controller\",\"app.kubernetes.io/managed-by\":\"Helm\",\"app.kubernetes.io/name\":\"-controller\",\"app.kubernetes        .io/version\":\"1.6.0-0.ftth79942.34855950\",\"helm.sh/chart\":\"-controller-1.6.0-0.ftth79942.34855950\"},\"annotations\":{\"field        .cattle.io/publicEndpoints\":\"[{\\\"addresses\\\":[\\\"192.168.64.131\\\"],\\\"port\\\":6068,\\\"protocol\\\":\\\"TCP\\\",\\\"serviceName\\\":\        \\"services:-controller-4\\\",\\\"allNodes\\\":false}]\",\"meta.helm.sh/release-name\":\"-controller\",\"meta.helm        .sh/release-namespace\":\"services\",\"metallb.universe.tf/address-pool\":\"my-application\",\"metallb.universe.tf/ip-allocated-from-pool\":\        "my-application\"},\"managedFields\":[{\"manager\":\"agent\",\"operation\":\"Update\",\"apiVersion\":\"v1\",\"time\":\"2024-10-08T12:48:14Z\",\"f        ieldsType\":\"FieldsV1\",\"fieldsV1\":{\"f:metadata\":{\"f:annotations\":{\"f:field.cattle.io/publicEndpoints\":{}}}}},{\"manager\":\"controller        \",\"operation\":\"Update\",\"apiVersion\":\"v1\",\"time\":\"2024-10-08T12:48:14Z\",\"fieldsType\":\"FieldsV1\",\"fieldsV1\":{\"f:metadata\":{\"        f:annotations\":{\"f:metallb.universe.tf/ip-allocated-from-pool\":{}}},\"f:status\":{\"f:loadBalancer\":{\"f:ingress\":{}}}},\"subresource\":\"s        tatus\"},{\"manager\":\"helm\",\"operation\":\"Update\",\"apiVersion\":\"v1\",\"time\":\"2024-10-08T12:48:14Z\",\"fieldsType\":\"FieldsV1\",\"fi        eldsV1\":{\"f:metadata\":{\"f:annotations\":{\".\":{},\"f:meta.helm.sh/release-name\":{},\"f:meta.helm.sh/release-namespace\":{},\"f:metallb.uni        verse.tf/address-pool\":{}},\"f:labels\":{\".\":{},\"f:app.kubernetes.io/instance\":{},\"f:app.kubernetes.io/managed-by\":{},\"f:app.kubernetes.        io/name\":{},\"f:app.kubernetes.io/version\":{},\"f:helm.sh/chart\":{}}},\"f:spec\":{\"f:allocateLoadBalancerNodePorts\":{},\"f:externalTrafficP        olicy\":{},\"f:internalTrafficPolicy\":{},\"f:ports\":{\".\":{},\"k:{\\\"port\\\":6068,\\\"protocol\\\":\\\"TCP\\\"}\":{\".\":{},\"f:name\":{},\        "f:port\":{},\"f:protocol\":{},\"f:targetPort\":{}}},\"f:selector\":{},\"f:sessionAffinity\":{},\"f:type\":{}}}}]},\"spec\":{\"ports\":[{\"name\        ":\"ancp\",\"protocol\":\"TCP\",\"port\":6068,\"targetPort\":6068,\"nodePort\":32655}],\"selector\":{\"app.kubernetes.io/instance\":\"pao-msan-a        ncp-controller\",\"app.kubernetes.io/name\":\"-controller\"},\"clusterIP\":\"192.168.253.128\",\"clusterIPs\":[\"192.168.253.128\"]        ,\"type\":\"LoadBalancer\",\"sessionAffinity\":\"None\",\"externalTrafficPolicy\":\"Local\",\"healthCheckNodePort\":30889,\"ipFamilies\":[\"IPv4        \"],\"ipFamilyPolicy\":\"SingleStack\",\"allocateLoadBalancerNodePorts\":true,\"internalTrafficPolicy\":\"Cluster\"},\"status\":{\"loadBalancer\        ":{\"ingress\":[{\"ip\":\"192.168.64.131\"}]}}}","ts":"2024-10-09T14:33:35Z"}
{"caller":"bgp_controller.go:152","event":"skipping should announce bgp","ips":["192.168.64.131"],"level":"debug","pool":"my-application","protoc        ol":"bgp","reason":"pool not matching my node","service":"services/controller-4","ts":"2024-10-09T14:33:35Z"}
{"caller":"layer2_controller.go:110","event":"shouldannounce","ips":["192.168.64.131"],"level":"debug","nodes":["node-0"]        ,"pool":"my-application","protocol":"l2","service":"services/controller-4","ts":"2024-10-09T14:33:35Z"}                                                                                                                                      13,1           2%
{"caller":"config_controller.go:147","controller":"ConfigReconciler","level":"debug","rendered config":"(config.Config) {\n Peers: (map[string]*        config.Peer) {\n },\n Pools: (*config.Pools)(0xc000fe84b0)({\n  ByName: (map[string]*config.Pool) (len=19) {\n   (string) (len=13) \"podconfig-i        bm\": (*config.Pool)(0xc0002b1b90)({\n    Name: (string) (len=13) \"podconfig-ibm\",\n    CIDR: ([]*net.IPNet) (len=1 cap=1) {\n     (*net.IPNet        )(0xc000cfdec0)(192.168.16.130/32)\n    },\n    AvoidBuggyIPs: (bool) false,\n    AutoAssign: (bool) false,\n    BGPAdvertisements: ([]*config.B        GPAdvertisement) <nil>,\n    L2Advertisements: ([]*config.L2Advertisement) (len=1 cap=1) {\n     (*config.L2Advertisement)(0xc000fe8480)({\n              Nodes: (map[string]bool) (len=3) {\n       (string) (len=29) \"node-1\": (bool) true,\n       (string) (len=29) \"pod-s        erver1-49-6121-1801-7kd0\": (bool) true,\n       (string) (len=29) \"node-3\": (bool) true\n      },\n      Interfaces: (        []string) <nil>,\n      AllInterfaces: (bool) true\n     })\n    },\n    cidrsPerAddresses: (map[string][]*net.IPNet) (len=1) {\n     (string) (        len=17) \"192.168.16.130/32\": ([]*net.IPNet) (len=1 cap=1) {\n      (*net.IPNet)(0xc000cfdec0)(192.168.16.130/32)\n     }\n    },\n    ServiceA        llocations: (*config.ServiceAllocation)(<nil>)\n   }),\n   (string) (len=8) \"gelf-oob\": (*config.Pool)(0xc0002b1c70)({\n    Name: (string) (le        n=8) \"gelf-oob\",\n    CIDR: ([]*net.IPNet) (len=1 cap=1) {\n     (*net.IPNet)(0xc000cfdf80)(192.168.0.201/32)\n    },\n    AvoidBuggyIPs: (boo        l) false,\n    AutoAssign: (bool) false,\n    BGPAdvertisements: ([]*config.BGPAdvertisement) <nil>,\n    L2Advertisements: ([]*config.L2Adverti        sement) (len=1 cap=1) {\n     (*config.L2Advertisement)(0xc000fe8480)({\n      Nodes: (map[string]bool) (len=3) {\n       (string) (len=29) \"po        d-server2-49-6121-1801-7kd1\": (bool) true,\n       (string) (len=29) \"node-0\": (bool) true,\n       (string) (len=29)         \"node-3\": (bool) true\n      },\n      Interfaces: ([]string) <nil>,\n      AllInterfaces: (bool) true\n     })\n    },        \n    cidrsPerAddresses: (map[string][]*net.IPNet) (len=1) {\n     (string) (len=16) \"192.168.0.201/32\": ([]*net.IPNet) (len=1 cap=1) {\n              (*net.IPNet)(0xc000cfdf80)(192.168.0.201/32)\n     }\n    },\n    ServiceAllocations: (*config.ServiceAllocation)(<nil>)\n   }),\n   (string) (        len=16) \"switchupdate-oob\": (*config.Pool)(0xc0002b1ce0)({\n    Name: (string) (len=16) \"switchupdate-oob\",\n    CIDR: ([]*net.IPNet) (len=1         cap=1) {\n     (*net.IPNet)(0xc000fe8000)(192.168.0.205/32)\n    },\n    AvoidBuggyIPs: (bool) false,\n    AutoAssign: (bool) false,\n    BGPAd        vertisements: ([]*config.BGPAdvertisement) <nil>,\n    L2Advertisements: ([]*config.L2Advertisement) (len=1 cap=1) {\n     (*config.L2Advertisem        ent)(0xc000fe8480)({\n      Nodes: (map[string]bool) (len=3) {\n       (string) (len=29) \"node-1\": (bool) true,\n               (string) (len=29) \"node-0\": (bool) true,\n       (string) (len=29) \"node-3\": (bool) true\n              },\n      Interfaces: ([]string) <nil>,\n      AllInterfaces: (bool) true\n     })\n    },\n    cidrsPerAddresses: (map[string][]*net.IPNet)         (len=1) {\n     (string) (len=16) \"192.168.0.205/32\": ([]*net.IPNet) (len=1 cap=1) {\n      (*net.IPNet)(0xc000fe8000)(192.168.0.205/32)\n             }\n    },\n    ServiceAllocations: (*config.ServiceAllocation)(<nil>)\n   }),\n   (string) (len=10) \"tacacs-oob\": (*config.Pool)(0xc0002b1f10        )({\n    Name: (string) (len=10) \"tacacs-oob\",\n    CIDR: ([]*net.IPNet) (len=1 cap=1) {\n     (*net.IPNet)(0xc000fe81e0)(192.168.0.204/32)\n            },\n    AvoidBuggyIPs: (bool) false,\n    AutoAssign: (bool) false,\n    BGPAdvertisements: ([]*config.BGPAdvertisement) <nil>,\n    L2Advert        isements: ([]*config.L2Advertisement) (len=1 cap=1) {\n     (*config.L2Advertisement)(0xc000fe8480)({\n      Nodes: (map[string]bool) (len=3) {\        n       (string) (len=29) \"node-1\": (bool) true,\n       (string) (len=29) \"node-0\": (bool) tr        ue,\n       (string) (len=29) \"node-3\": (bool) true\n      },\n      Interfaces: ([]string) <nil>,\n      AllInterfaces        : (bool) true\n     })\n    },\n    cidrsPerAddresses: (map[string][]*net.IPNet) (len=1) {\n     (string) (len=16) \"192.168.0.204/32\": ([]*net        .IPNet) (len=1 cap=1) {\n      (*net.IPNet)(0xc000fe81e0)(192.168.0.204/32)\n     }\n    },\n    ServiceAllocations: (*config.ServiceAllocation)
{"caller":"config_controller.go:135","controller":"ConfigReconciler","level":"debug","metallb CRs and Secrets":"{\"ipaddresspools\":[{\"kind\":\        "IPAddressPool\",\"apiVersion\":\"metallb.io/v1beta1\",\"metadata\":{\"name\":\"tacacs-olt-ibm\",\"namespace\":\"metal-lb\",\"uid\":\"0abd63fc-9        4b9-444d-9560-bf01481826a5\",\"resourceVersion\":\"36994701\",\"generation\":1,\"creationTimestamp\":\"2024-09-26T11:53:17Z\",\"labels\":{\"app.        kubernetes.io/instance\":\"metal-lb\",\"app.kubernetes.io/managed-by\":\"Helm\",\"app.kubernetes.io/name\":\"metal-lb\",\"app.kubernetes.io/vers        ion\":\"1.7.0-32464170\",\"helm.sh/chart\":\"metal-lb-1.7.0-32464170\"},\"annotations\":{\"meta.helm.sh/release-name\":\"metal-lb\",\"meta.helm.        sh/release-namespace\":\"metal-lb\"},\"managedFields\":[{\"manager\":\"helm\",\"operation\":\"Update\",\"apiVersion\":\"metallb.io/v1beta1\",\"t        ime\":\"2024-09-26T11:53:17Z\",\"fieldsType\":\"FieldsV1\",\"fieldsV1\":{\"f:metadata\":{\"f:annotations\":{\".\":{},\"f:meta.helm.sh/release-na        me\":{},\"f:meta.helm.sh/release-namespace\":{}},\"f:labels\":{\".\":{},\"f:app.kubernetes.io/instance\":{},\"f:app.kubernetes.io/managed-by\":{        },\"f:app.kubernetes.io/name\":{},\"f:app.kubernetes.io/version\":{},\"f:helm.sh/chart\":{}}},\"f:spec\":{\".\":{},\"f:addresses\":{},\"f:autoAs        sign\":{},\"f:avoidBuggyIPs\":{}}}}]},\"spec\":{\"addresses\":[\"192.168.32.129/32\"],\"autoAssign\":false},\"status\":{}},{\"kind\":\"IPAddress        Pool\",\"apiVersion\":\"metallb.io/v1beta1\",\"metadata\":{\"name\":\"-dpu\",\"namespace\":\"metal-lb\",\"uid\":\"d60aeee7-b876-45ad-928        8-59219e5c4b67\",\"resourceVersion\":\"36994700\",\"generation\":1,\"creationTimestamp\":\"2024-09-26T11:53:17Z\",\"labels\":{\"app.kubernetes.i        o/instance\":\"metal-lb\",\"app.kubernetes.io/managed-by\":\"Helm\",\"app.kubernetes.io/name\":\"metal-lb\",\"app.kubernetes.io/version\":\"1.7.        0-32464170\",\"helm.sh/chart\":\"metal-lb-1.7.0-32464170\"},\"annotations\":{\"meta.helm.sh/release-name\":\"metal-lb\",\"meta.helm.sh/release-n        amespace\":\"metal-lb\"},\"managedFields\":[{\"manager\":\"helm\",\"operation\":\"Update\",\"apiVersion\":\"metallb.io/v1beta1\",\"time\":\"2024        -09-26T11:53:17Z\",\"fieldsType\":\"FieldsV1\",\"fieldsV1\":{\"f:metadata\":{\"f:annotations\":{\".\":{},\"f:meta.helm.sh/release-name\":{},\"f:        meta.helm.sh/release-namespace\":{}},\"f:labels\":{\".\":{},\"f:app.kubernetes.io/instance\":{},\"f:app.kubernetes.io/managed-by\":{},\"f:app.ku        bernetes.io/name\":{},\"f:app.kubernetes.io/version\":{},\"f:helm.sh/chart\":{}}},\"f:spec\":{\".\":{},\"f:addresses\":{},\"f:autoAssign\":{},\"        f:avoidBuggyIPs\":{}}}}]},\"spec\":{\"addresses\":[\"100.64.0.128/32\"],\"autoAssign\":false},\"status\":{}},{\"kind\":\"IPAddressPool\",\"apiVe        rsion\":\"metallb.io/v1beta1\",\"metadata\":{\"name\":\"podconfig-oob\",\"namespace\":\"metal-lb\",\"uid\":\"30746614-336f-4464-8572-2088823355f        2\",\"resourceVersion\":\"36994682\",\"generation\":1,\"creationTimestamp\":\"2024-09-26T11:53:17Z\",\"labels\":{\"app.kubernetes.io/instance\":        \"metal-lb\",\"app.kubernetes.io/managed-by\":\"Helm\",\"app.kubernetes.io/name\":\"metal-lb\",\"app.kubernetes.io/version\":\"1.7.0-32464170\",        \"helm.sh/chart\":\"metal-lb-1.7.0-32464170\"},\"annotations\":{\"meta.helm.sh/release-name\":\"metal-lb\",\"meta.helm.sh/release-namespace\":\"        metal-lb\"},\"managedFields\":[{\"manager\":\"helm\",\"operation\":\"Update\",\"apiVersion\":\"metallb.io/v1beta1\",\"time\":\"2024-09-26T11:53:        17Z\",\"fieldsType\":\"FieldsV1\",\"fieldsV1\":{\"f:metadata\":{\"f:annotations\":{\".\":{},\"f:meta.helm.sh/release-name\":{},\"f:meta.helm.sh/        release-namespace\":{}},\"f:labels\":{\".\":{},\"f:app.kubernetes.io/instance\":{},\"f:app.kubernetes.io/managed-by\":{},\"f:app.kubernetes.io/n        ame\":{},\"f:app.kubernetes.io/version\":{},\"f:helm.sh/chart\":{}}},\"f:spec\":{\".\":{},\"f:addresses\":{},\"f:autoAssign\":{},\"f:avoidBuggyI        Ps\":{}}}}]},\"spec\":{\"addresses\":[\"192.168.0.200/32\"],\"autoAssign\":false},\"status\":{}},{\"kind\":\"IPAddressPool\",\"apiVersion\":\"me        tallb.io/v1beta1\",\"metadata\":{\"name\":\"tacacs-oob\",\"namespace\":\"metal-lb\",\"uid\":\"e4a99bad-322a-4eb2-9c02-f3e8f340e7c9\",\"resourceV        ersion\":\"36994702\",\"generation\":1,\"creationTimestamp\":\"2024-09-26T11:53:17Z\",\"labels\":{\"app.kubernetes.io/instance\":\"metal-lb\",\"        app.kubernetes.io/managed-by\":\"Helm\",\"app.kubernetes.io/name\":\"metal-lb\",\"app.kubernetes.io/version\":\"1.7.0-32464170\",\"helm.sh/chart        \":\"metal-lb-1.7.0-32464170\"},\"annotations\":{\"meta.helm.sh/release-name\":\"metal-lb\",\"meta.helm.sh/release-namespace\":\"metal-lb\"},\"m
{"caller":"config_controller.go:147","controller":"ConfigReconciler","level":"debug","rendered config":"(config.Config) {\n Peers: (map[string]*        config.Peer) {\n },\n Pools: (*config.Pools)(0xc001022f60)({\n  ByName: (map[string]*config.Pool) (len=19) {\n   (string) (len=16) \"switchupdat        e-oob\": (*config.Pool)(0xc0002aabd0)({\n    Name: (string) (len=16) \"switchupdate-oob\",\n    CIDR: ([]*net.IPNet) (len=1 cap=1) {\n     (*net        .IPNet)(0xc001022c90)(192.168.0.205/32)\n    },\n    AvoidBuggyIPs: (bool) false,\n    AutoAssign: (bool) false,\n    BGPAdvertisements: ([]*con        fig.BGPAdvertisement) <nil>,\n    L2Advertisements: ([]*config.L2Advertisement) (len=1 cap=1) {\n     (*config.L2Advertisement)(0xc001022f30)({\        n      Nodes: (map[string]bool) (len=3) {\n       (string) (len=29) \"node-0\": (bool) true,\n       (string) (len=29) \"        node-3\": (bool) true,\n       (string) (len=29) \"node-1\": (bool) true\n      },\n      Interfac        es: ([]string) <nil>,\n      AllInterfaces: (bool) true\n     })\n    },\n    cidrsPerAddresses: (map[string][]*net.IPNet) (len=1) {\n     (stri        ng) (len=16) \"192.168.0.205/32\": ([]*net.IPNet) (len=1 cap=1) {\n      (*net.IPNet)(0xc001022c90)(192.168.0.205/32)\n     }\n    },\n    Servi        ceAllocations: (*config.ServiceAllocation)(<nil>)\n   }),\n   (string) (len=14) \"tacacs-olt-ibm\": (*config.Pool)(0xc0002aad20)({\n    Name: (s        tring) (len=14) \"tacacs-olt-ibm\",\n    CIDR: ([]*net.IPNet) (len=1 cap=1) {\n     (*net.IPNet)(0xc001022db0)(192.168.32.129/32)\n    },\n    A        voidBuggyIPs: (bool) false,\n    AutoAssign: (bool) false,\n    BGPAdvertisements: ([]*config.BGPAdvertisement) <nil>,\n    L2Advertisements: ([        ]*config.L2Advertisement) (len=1 cap=1) {\n     (*config.L2Advertisement)(0xc001022f30)({\n      Nodes: (map[string]bool) (len=3) {\n       (str        ing) (len=29) \"node-0\": (bool) true,\n       (string) (len=29) \"node-3\": (bool) true,\n               (string) (len=29) \"node-1\": (bool) true\n      },\n      Interfaces: ([]string) <nil>,\n      AllInterfaces: (bool) tru        e\n     })\n    },\n    cidrsPerAddresses: (map[string][]*net.IPNet) (len=1) {\n     (string) (len=17) \"192.168.32.129/32\": ([]*net.IPNet) (le        n=1 cap=1) {\n      (*net.IPNet)(0xc001022db0)(192.168.32.129/32)\n     }\n    },\n    ServiceAllocations: (*config.ServiceAllocation)(<nil>)\n           }),\n   (string) (len=8) \"gelf-ibm\": (*config.Pool)(0xc0002aad90)({\n    Name: (string) (len=8) \"gelf-ibm\",\n    CIDR: ([]*net.IPNet) (len        =1 cap=1) {\n     (*net.IPNet)(0xc001022e10)(192.168.16.132/32)\n    },\n    AvoidBuggyIPs: (bool) false,\n    AutoAssign: (bool) false,\n    BG        PAdvertisements: ([]*config.BGPAdvertisement) <nil>,\n    L2Advertisements: ([]*config.L2Advertisement) (len=1 cap=1) {\n     (*config.L2Adverti        sement)(0xc001022f30)({\n      Nodes: (map[string]bool) (len=3) {\n       (string) (len=29) \"node-0\": (bool) true,\n               (string) (len=29) \"node-3\": (bool) true,\n       (string) (len=29) \"node-1\": (bool) true\n              },\n      Interfaces: ([]string) <nil>,\n      AllInterfaces: (bool) true\n     })\n    },\n    cidrsPerAddresses: (map[string][]*net.IPNe        t) (len=1) {\n     (string) (len=17) \"192.168.16.132/32\": ([]*net.IPNet) (len=1 cap=1) {\n      (*net.IPNet)(0xc001022e10)(192.168.16.132/32)\        n     }\n    },\n    ServiceAllocations: (*config.ServiceAllocation)(<nil>)\n   }),\n   (string) (len=3) \"ip2\": (*config.Pool)(0xc0002aa700)({        \n    Name: (string) (len=3) \"ip2\",\n    CIDR: ([]*net.IPNet) (len=1 cap=1) {\n     (*net.IPNet)(0xc001022930)(62.181.181.15/32)\n    },\n            AvoidBuggyIPs: (bool) false,\n    AutoAssign: (bool) false,\n    BGPAdvertisements: ([]*config.BGPAdvertisement) <nil>,\n    L2Advertisements: (        []*config.L2Advertisement) (len=1 cap=1) {\n     (*config.L2Advertisement)(0xc001022f30)({\n      Nodes: (map[string]bool) (len=3) {\n       (st        ring) (len=29) \"node-0\": (bool) true,\n       (string) (len=29) \"node-3\": (bool) true,\n               (string) (len=29) \"node-1\": (bool) true\n      },\n      Interfaces: ([]string) <nil>,\n      AllInterfaces: (bool) tr        ue\n     })\n    },\n    cidrsPerAddresses: (map[string][]*net.IPNet) (len=1) {\n     (string) (len=16) \"62.181.181.15/32\": ([]*net.IPNet) (le        n=1 cap=1) {\n      (*net.IPNet)(0xc001022930)(62.181.181.15/32)\n     }\n    },\n    ServiceAllocations: (*config.ServiceAllocation)(<nil>)\n
 {"caller":"bgp_controller.go:152","event":"skipping should announce bgp","ips":["192.168.64.130"],"level":"debug","pool":"my-application","protoc        ol":"bgp","reason":"pool not matching my node","service":"services/controller-3","ts":"2024-10-09T14:33:36Z"}
{"caller":"layer2_controller.go:110","event":"shouldannounce","ips":["192.168.64.130"],"level":"debug","nodes":["node-0"]        ,"pool":"my-application","protocol":"l2","service":"services/controller-3","ts":"2024-10-09T14:33:36Z"}
{"caller":"service_controller.go:115","controller":"ServiceReconciler","end reconcile":"services/controller-3","level":"info",        "ts":"2024-10-09T14:33:36Z"}
  
 
**then we did a hack, as the traffic was flowing on node-3, where pod is not scheduled and traffic was not working, so we edit the application and asked to schduled on node-3, and if you see reconsile is happing and annoucement as well.**

{"caller":"config_controller.go:147","controller":"ConfigReconciler","level":"debug","rendered config":"(config.Config) {\n Peers: (map[string]*        config.Peer) {\n },\n Pools: (*config.Pools)(0xc001022f60)({\n  ByName: (map[string]*config.Pool) (len=19) {\n   (string) (len=16) \"switchupdat        e-oob\": (*config.Pool)(0xc0002aabd0)({\n    Name: (string) (len=16) \"switchupdate-oob\",\n    CIDR: ([]*net.IPNet) (len=1 cap=1) {\n     (*net        .IPNet)(0xc001022c90)(192.168.0.205/32)\n    },\n    AvoidBuggyIPs: (bool) false,\n    AutoAssign: (bool) false,\n    BGPAdvertisements: ([]*con        fig.BGPAdvertisement) <nil>,\n    L2Advertisements: ([]*config.L2Advertisement) (len=1 cap=1) {\n     (*config.L2Advertisement)(0xc001022f30)({\        n      Nodes: (map[string]bool) (len=3) {\n       (string) (len=29) \"node-0\": (bool) true,\n       (string) (len=29) \"        node-3\": (bool) true,\n       (string) (len=29) \"node-1\": (bool) true\n      },\n      Interfac        es: ([]string) <nil>,\n      AllInterfaces: (bool) true\n     })\n    },\n    cidrsPerAddresses: (map[string][]*net.IPNet) (len=1) {\n     (stri        ng) (len=16) \"192.168.0.205/32\": ([]*net.IPNet) (len=1 cap=1) {\n      (*net.IPNet)(0xc001022c90)(192.168.0.205/32)\n     }\n    },\n    Servi        ceAllocations: (*config.ServiceAllocation)(<nil>)\n   }),\n   (string) (len=14) \"tacacs-olt-ibm\": (*config.Pool)(0xc0002aad20)({\n    Name: (s        tring) (len=14) \"tacacs-olt-ibm\",\n    CIDR: ([]*net.IPNet) (len=1 cap=1) {\n     (*net.IPNet)(0xc001022db0)(192.168.32.129/32)\n    },\n    A        voidBuggyIPs: (bool) false,\n    AutoAssign: (bool) false,\n    BGPAdvertisements: ([]*config.BGPAdvertisement) <nil>,\n    L2Advertisements: ([        ]*config.L2Advertisement) (len=1 cap=1) {\n     (*config.L2Advertisement)(0xc001022f30)({\n      Nodes: (map[string]bool) (len=3) {\n       (str        ing) (len=29) \"node-0\": (bool) true,\n       (string) (len=29) \"node-3\": (bool) true,\n               (string) (len=29) \"node-1\": (bool) true\n      },\n      Interfaces: ([]string) <nil>,\n      AllInterfaces: (bool) tru        e\n     })\n    },\n    cidrsPerAddresses: (map[string][]*net.IPNet) (len=1) {\n     (string) (len=17) \"192.168.32.129/32\": ([]*net.IPNet) (le        n=1 cap=1) {\n      (*net.IPNet)(0xc001022db0)(192.168.32.129/32)\n     }\n    },\n    ServiceAllocations: (*config.ServiceAllocation)(<nil>)\n           }),\n   (string) (len=8) \"gelf-ibm\": (*config.Pool)(0xc0002aad90)({\n    Name: (string) (len=8) \"gelf-ibm\",\n    CIDR: ([]*net.IPNet) (len        =1 cap=1) {\n     (*net.IPNet)(0xc001022e10)(192.168.16.132/32)\n    },\n    AvoidBuggyIPs: (bool) false,\n    AutoAssign: (bool) false,\n    BG        PAdvertisements: ([]*config.BGPAdvertisement) <nil>,\n    L2Advertisements: ([]*config.L2Advertisement) (len=1 cap=1) {\n     (*config.L2Adverti        sement)(0xc001022f30)({\n      Nodes: (map[string]bool) (len=3) {\n       (string) (len=29) \"node-0\": (bool) true,\n               (string) (len=29) \"node-3\": (bool) true,\n       (string) (len=29) \"node-1\": (bool) true\n              },\n      Interfaces: ([]string) <nil>,\n      AllInterfaces: (bool) true\n     })\n    },\n    cidrsPerAddresses: (map[string][]*net.IPNe        t) (len=1) {\n     (string) (len=17) \"192.168.16.132/32\": ([]*net.IPNet) (len=1 cap=1) {\n      (*net.IPNet)(0xc001022e10)(192.168.16.132/32)\        n     }\n    },\n    ServiceAllocations: (*config.ServiceAllocation)(<nil>)\n   }),\n   (string) (len=3) \"ip2\": (*config.Pool)(0xc0002aa700)({        \n    Name: (string) (len=3) \"ip2\",\n    CIDR: ([]*net.IPNet) (len=1 cap=1) {\n     (*net.IPNet)(0xc001022930)(62.181.181.15/32)\n    },\n            AvoidBuggyIPs: (bool) false,\n    AutoAssign: (bool) false,\n    BGPAdvertisements: ([]*config.BGPAdvertisement) <nil>,\n    L2Advertisements: (        []*config.L2Advertisement) (len=1 cap=1) {\n     (*config.L2Advertisement)(0xc001022f30)({\n      Nodes: (map[string]bool) (len=3) {\n       (st        ring) (len=29) \"node-0\": (bool) true,\n       (string) (len=29) \"node-3\": (bool) true,\n               (string) (len=29) \"node-1\": (bool) true\n      },\n      Interfaces: ([]string) <nil>,\n      AllInterfaces: (bool) tr        ue\n     })\n    },\n    cidrsPerAddresses: (map[string][]*net.IPNet) (len=1) {\n     (string) (len=16) \"62.181.181.15/32\": ([]*net.IPNet) (le        n=1 cap=1) {\n      (*net.IPNet)(0xc001022930)(62.181.181.15/32)\n     }\n    },\n    ServiceAllocations: (*config.ServiceAllocation)(<nil>)\n
 {"caller":"bgp_controller.go:152","event":"skipping should announce bgp","ips":["192.168.64.130"],"level":"debug","pool":"my-application","protoc        ol":"bgp","reason":"pool not matching my node","service":"services/controller-3","ts":"2024-10-09T15:08:03Z"}
    {"caller":"layer2_controller.go:110","event":"shouldannounce","ips":["192.168.64.130"],"level":"debug","nodes":["node-0",        "node-3"],"pool":"my-application","protocol":"l2","service":"services/controller-3","ts":"2024-10-09T15:        08:03Z"}
    {"caller":"main.go:409","event":"serviceAnnounced","ips":["192.168.64.130"],"level":"info","msg":"service has IP, announcing","pool":"-m        san","protocol":"layer2","ts":"2024-10-09T15:08:03Z"}
     {"level":"debug","ts":"2024-10-09T15:08:03Z","logger":"events","msg":"announcing from node \"node-3\" with protocol \"lay@@@                                                                                                                       

**if you see , traffic is working now.**


15:15:00.763289 e8:c5:7a:d6:0c:19 > ff:ff:ff:ff:ff:ff, ethertype 802.1Q (0x8100), length 64: vlan 16, p 0, ethertype ARP, Request who-has 192.168.66.34 (e8:c5:7a:d6:0c:19) tell 192.168.66.34, length 46
15:15:01.349288 52:54:00:9d:47:8a > e8:c5:7a:d6:0c:19, ethertype 802.1Q (0x8100), length 78: vlan 16, p 0, ethertype IPv4, 192.168.66.33.35406 > 192.168.64.128.6068: Flags [S], seq 2082727465, win 64240, options [mss 1460,sackOK,TS val 2033898130 ecr 0,nop,wscale 7], length 0
15:15:01.349508 e8:c5:7a:d6:0c:19 > 52:54:00:9d:47:8a, ethertype 802.1Q (0x8100), length 78: vlan 16, p 7, ethertype IPv4, 192.168.64.128.6068 > 192.168.66.33.35406: Flags [S.], seq 1101682475, ack 2082727466, win 64308, options [mss 1410,sackOK,TS val 3933222906 ecr 2033898130,nop,wscale 7], length 0
15:15:01.349545 52:54:00:9d:47:8a > e8:c5:7a:d6:0c:19, ethertype 802.1Q (0x8100), length 70: vlan 16, p 0, ethertype IPv4, 192.168.66.33.35406 > 192.168.64.128.6068: Flags [.], ack 1, win 502, options [nop,nop,TS val 2033898131 ecr 3933222906], length 0
15:15:01.350954 52:54:00:9d:47:8a > e8:c5:7a:d6:0c:19, ethertype 802.1Q (0x8100), length 118: vlan 16, p 0, ethertype IPv4, 192.168.66.33.35406 > 192.168.64.128.6068: Flags [P.], seq 1:49, ack 1, win 502, options [nop,nop,TS val 2033898132 ecr 3933222906], length 48
15:15:01.351077 e8:c5:7a:d6:0c:19 > 52:54:00:9d:47:8a, ethertype 802.1Q (0x8100), length 70: vlan 16, p 7, ethertype IPv4, 192.168.64.128.6068 > 192.168.66.33.35406: Flags [.], ack 49, win 503, options [nop,nop,TS val 3933222908 ecr 2033898132], length 0
15:15:01.355612 e8:c5:7a:d6:0c:19 > 52:54:00:9d:47:8a, ethertype 802.1Q (0x8100), length 118: vlan 16, p 7, ethertype IPv4, 192.168.64.128.6068 > 192.168.66.33.35406: Flags [P.], seq 1:49, ack 49, win 503, options [nop,nop,TS val 3933222912 ecr 2033898132], length 48
15:15:01.355628 52:54:00:9d:47:8a > e8:c5:7a:d6:0c:19, ethertype 802.1Q (0x8100), length 70: vlan 16, p 0, ethertype IPv4, 192.168.66.33.35406 > 192.168.64.128.6068: Flags [.], ack 49, win 502, options [nop,nop,TS val 2033898137 ecr 3933222912], length 0
15:15:01.356038 52:54:00:9d:47:8a > e8:c5:7a:d6:0c:19, ethertype 802.1Q (0x8100), length 118: vlan 16, p 0, ethertype IPv4, 192.168.66.33.35406 > 192.168.64.128.6068: Flags [P.], seq 49:97, ack 49, win 502, options [nop,nop,TS val 2033898137 ecr 3933222912], length 48
15:15:01.356166 e8:c5:7a:d6:0c:19 > 52:54:00:9d:47:8a, ethertype 802.1Q (0x8100), length 70: vlan 16, p 7, ethertype IPv4, 192.168.64.128.6068 > 192.168.66.33.35406: Flags [.], ack 97, win 503, options [nop,nop,TS val 3933222913 ecr 2033898137], length 0
15:15:01.358253 e8:c5:7a:d6:0c:19 > 52:54:00:9d:47:8a, ethertype 802.1Q (0x8100), length 118: vlan 16, p 7, ethertype IPv4, 192.168.64.128.6068 > 192.168.66.33.35406: Flags [P.], seq 49:97, ack 97, win 503, options [nop,nop,TS val 3933222915 ecr 2033898137], length 48
15:15:01.358266 52:54:00:9d:47:8a > e8:c5:7a:d6:0c:19, ethertype 802.1Q (0x8100), length 70: vlan 16, p 0, ethertype IPv4, 192.168.66.33.35406 > 192.168.64.128.6068: Flags [.], ack 97, win 502, options [nop,nop,TS val 2033898139 ecr 3933222915], length 0
15:15:01.358668 52:54:00:9d:47:8a > e8:c5:7a:d6:0c:19, ethertype 802.1Q (0x8100), length 118: vlan 16, p 0, ethertype IPv4, 192.168.66.33.35406 > 192.168.64.128.6068: Flags [P.], seq 97:145, ack 97, win 502, options [nop,nop,TS val 2033898140 ecr 3933222915], length 48
15:15:01.358785 e8:c5:7a:d6:0c:19 > 52:54:00:9d:47:8a, ethertype 802.1Q (0x8100), length 70: vlan 16, p 7, ethertype IPv4, 192.168.64.128.6068 > 192.168.66.33.35406: Flags [.], ack 145, win 503, options [nop,nop,TS val 3933222915 ecr 2033898140], length 0
15:15:01.360645 e8:c5:7a:d6:0c:19 > 52:54:00:9d:47:8a, ethertype 802.1Q (0x8100), length 118: vlan 16, p 7, ethertype IPv4, 192.168.64.128.6068 > 192.168.66.33.35406: Flags [P.], seq 97:145, ack 145, win 503, options [nop,nop,TS val 3933222917 ecr 2033898140], length 48
15:15:01.360656 52:54:00:9d:47:8a > e8:c5:7a:d6:0c:19, ethertype 802.1Q (0x8100), length 70: vlan 16, p 0, ethertype IPv4, 192.168.66.33.35406 > 192.168.64.128.6068: Flags [.], ack 145, win 502, options [nop,nop,TS val 2033898142 ecr 3933222917], length 0





TCPDUMP OF ALL INTERFACE on node-3, after the workaround.


15:13:40.910348 eth5  In  IP 192.168.66.33.42844 > 192.168.64.128.6068: Flags [S], seq 254594485, win 64240, options [mss 1460,sackOK,TS val 2033833515 ecr 0,nop,wscale 7], length 0
15:13:40.910348 vlan4074.5 In  IP 192.168.66.33.42844 > 192.168.64.128.6068: Flags [S], seq 254594485, win 64240, options [mss 1460,sackOK,TS val 2033833515 ecr 0,nop,wscale 7], length 0
15:13:40.910421 cni0  Out IP 192.168.66.33.42844 > 192.168.250.192.6068: Flags [S], seq 254594485, win 64240, options [mss 1460,sackOK,TS val 2033833515 ecr 0,nop,wscale 7], length 0
15:13:40.910428 veth2a3e7dbe Out IP 192.168.66.33.42844 > 192.168.250.192.6068: Flags [S], seq 254594485, win 64240, options [mss 1460,sackOK,TS val 2033833515 ecr 0,nop,wscale 7], length 0
15:13:40.910457 veth2a3e7dbe P   IP 192.168.250.192.6068 > 192.168.66.33.42844: Flags [S.], seq 418854327, ack 254594486, win 64308, options [mss 1410,sackOK,TS val 3933158293 ecr 2033833515,nop,wscale 7], length 0
15:13:40.910457 cni0  In  IP 192.168.250.192.6068 > 192.168.66.33.42844: Flags [S.], seq 418854327, ack 254594486, win 64308, options [mss 1410,sackOK,TS val 3933158293 ecr 2033833515,nop,wscale 7], length 0
15:13:40.910481 vlan4074.5 Out IP 192.168.64.128.6068 > 192.168.66.33.42844: Flags [S.], seq 418854327, ack 254594486, win 64308, options [mss 1410,sackOK,TS val 3933158293 ecr 2033833515,nop,wscale 7], length 0
15:13:40.910485 eth5  Out IP 192.168.64.128.6068 > 192.168.66.33.42844: Flags [S.], seq 418854327, ack 254594486, win 64308, options [mss 1410,sackOK,TS val 3933158293 ecr 2033833515,nop,wscale 7], length 0
15:13:40.910569 eth5  In  IP 192.168.66.33.42844 > 192.168.64.128.6068: Flags [.], ack 1, win 502, options [nop,nop,TS val 2033833515 ecr 3933158293], length 0
15:13:40.910569 vlan4074.5 In  IP 192.168.66.33.42844 > 192.168.64.128.6068: Flags [.], ack 1, win 502, options [nop,nop,TS val 2033833515 ecr 3933158293], length 0


why it is happening when the metallb is continously reconsiling and checking? and no pod restarts.

**Comment by uablrek** [comment]
Sorry, the logs are unreadable. Please use 3 back-ticks "```" ([syntax](https://www.markdownguide.org/extended-syntax/#fenced-code-blocks)) before and after the logs to pre-format. Use the "Prewiew" tag to check. But, as said, `kube-proxy` can not fix this problem, so you should probably open an issue on metallb, and refer to this one. I haven't worked with metallb for years, so the maintainers of metallb can provide better help.

**Comment by uablrek** [comment]
Much better, thanks. As I said, I am not experienced with recent metallb versions, but this:
```json
{
  "caller": "bgp_controller.go:152",
  "event": "skipping should announce bgp",
  "ips": [
    "192.168.64.131"
  ],
  "level": "debug",
  "pool": "my-application",
  "protocol": "bgp",
  "reason": "pool not matching my node",
  "service": "services/controller-4",
  "ts": "2024-10-09T14:33:35Z"
}
```
strikes me as odd. Why "pool not matching my node", and not something like "no local instance"? There might be a metallb configuration problem.

**Comment by uablrek** [comment]
/assign

(for triage)

**Comment by thockin** [comment]
Thanks @uablrek - My instinctive answer aligns with yours.  kube-proxy takes over once the traffic reaches a node, but how it gets there is outside of our direct control.

**Comment by uablrek** [comment]
I tested with K8s v1.29.9 (supported), and the drop rules were set on all nodes without local instance from start, so if that was a bug in v1.26.7, it has been fixed in supported versions.

That was the only potential problem that in K8s (kube-proxy), so I close this issue as the problem must be fixed outside K8s, in `metallb`, or metallb configuration.

/close
