### ISSUE TITLE
kubedns can resolve kubernetes and kubernetes.default.svc.cluster.local, but not kubernetes.default

### ISSUE THREAD

**Issue by xialonglee** [kubernetes/kubernetes#45479]
**Kubernetes version**: v1.6.0

**Environment**:
- **OS**: Centos 7
- **Install tools**: ansible
- **kubedns images and args**:
```
kubedns-amd64:1.9
        args:
        - --domain=cluster.local.
        - --dns-port=10053
        - --config-map=kube-dns
        - --v=2
kube-dnsmasq-amd64:1.4
        - --cache-size=1000
        - --no-resolv
        - --server=127.0.0.1#10053
        - --log-facility=-
dnsmasq-metrics-amd64:1.0
        args:
        - --v=2
        - --logtostderr
exechealthz-amd64:1.2
        - --cmd=nslookup kubernetes.default.svc.cluster.local. 127.0.0.1 >/dev/null
        - --url=/healthz-dnsmasq
        - --cmd=nslookup kubernetes.default.svc.cluster.local. 127.0.0.1:10053 >/dev/null
        - --url=/healthz-kubedns
        - --port=8080
        - --quiet
```

**What happened**:

When I clean my node's `/etc/resolve.conf` file (make it empty),
Kubedns could resolve resolve `kubernetes` and `kubernetes.default.svc.cluster.local`, 
but **can not resolve** `kubernetes.default`, `kubernetes.default.svc`, because the library of skydns in kubedns will make a request forward to `8.8.8.8` and results a timeout problem.

The results as below:
1. Both kubernetes and kubernetes fqdn could be resolved
```
kubectl exec busybox-4217148749-tmwg1 nslookup kubernetes
Server:    192.168.3.10
Address 1: 192.168.3.10 kube-dns.kube-system.svc.cluster.local

Name:      kubernetes
Address 1: 192.168.3.1 kubernetes.default.svc.cluster.local

kubectl exec busybox-4217148749-tmwg1 nslookup kubernetes.default.svc.cluster.local
Server:    192.168.3.10
Address 1: 192.168.3.10 kube-dns.kube-system.svc.cluster.local

Name:      kubernetes.default.svc.cluster.local
Address 1: 192.168.3.1 kubernetes.default.svc.cluster.local
```

2. kubernetes.default and others could not be resolved
```
kubectl exec busybox-4217148749-tmwg1 nslookup kubernetes.default
Server:    192.168.3.10
Address 1: 192.168.3.10 kube-dns.kube-system.svc.cluster.local

nslookup: can't resolve 'kubernetes.default'

kubectl exec busybox-4217148749-tmwg1 nslookup kubernetes.default.svc
Server:    192.168.3.10
Address 1: 192.168.3.10 kube-dns.kube-system.svc.cluster.local

nslookup: can't resolve 'kubernetes.default.svc'
```
**kubedns log**
when search `kubernetes.default` , kubedns will request forward to the `8.8.8.8` and cause timeout problem.
```
 logs.go:41] skydns: failure to forward request "read udp 172.16.22.10:53178->8.8.8.8:53: i/o timeout"
 logs.go:41] skydns: failure to forward request "read udp 172.16.22.10:53203->8.8.8.8:53: i/o timeout"
```

**What you expected to happen**:
because my k8s cluster are for internal used, could not access to any outside DNS servers, I left `/etc/resolv.conf` empty on the node which kubedns will run on, so kubedns pod would get 
```
kubectl exec kube-dns-3909973750-tp810 -n kube-system -c kubedns cat /etc/resolv.conf

nameserver 8.8.8.8
nameserver 8.8.4.4
options ndots:5
```
but actually I don't want this.
I tried arg `--resolv-conf=''` for kubelet as https://kubernetes.io/docs/concepts/services-networking/dns-pod-service/#inheriting-dns-from-the-node suggests, it will use `127.0.0.1` as its nameserver and logs are:
```
 logs.go:41] skydns: failure to forward request "read udp 127.0.0.1:44572->127.0.0.1:53: i/o timeout"
 logs.go:41] skydns: failure to forward request "read udp 127.0.0.1:40238->127.0.0.1:53: i/o timeout"

```

**How to reproduce it** (as minimally and precisely as possible):
1. Setup a k8s cluster which can not access 8.8.8.8.
2. Make `/etc/resolv.conf` empty in every nodes and then deploy kubedns.
3. `nslookup kubernetes.default` in a busybox pod.

**Anything else we need to know**:

1. Config node's `/etc/resolv.conf` to quest kubedns service, it works on node after a while:
```
nslookup kubernetes.default 
;; connection timed out; trying next origin
Server:         172.16.22.10
Address:        172.16.22.10#53

Non-authoritative answer:
Name:   kubernetes.default.svc.cluster.local
Address: 192.168.3.10
```
It's strange, different from nslookup in a busybox pod.

2. Add a accessable DNS server on the node, this problem could be solved, but not i want.

**Comment by xialonglee** [comment]
cc @bowei @MrHohn

**Comment by MrHohn** [comment]
/area dns

> Kubedns could resolve resolve kubernetes and kubernetes.default.svc.cluster.local,
but can not resolve kubernetes.default, kubernetes.default.svc

Did you check the content of `/etc/resolve.conf` in your busybox container? I suspect it does not have proper search paths set up.

**Comment by tacy** [comment]
@xialonglee - Could you test dns resolv use busybox:musl?  busybox don't support `search` in `resolv.conf`

Related to : 
1. gliderlabs/docker-alpine#8
2. https://hub.docker.com/_/busybox/

**Comment by xialonglee** [comment]
@MrHohn
I check `/etc/resolve.conf` in busybox, it's no problem, search path was setup properly.
I did some further experiments and found out that the `nslookup` works weirdly in busybox pod:
1. When kubedns pod inherits unaccessable external DNS servers(in my case are 8.8.8.8 and 8.8.4.4), do `nslookup kubernetes` and `nslookup kubernetes.default` in busybox, the latter command didn't add search path properly.

Listening docker0 and capture udp packages. 
```
09:44:31.544254 IP 172.16.22.10.45571 > 172.16.22.5.domain: 2+ PTR? 10.3.168.192.in-addr.arpa. (43)
09:44:31.544275 IP 172.16.22.10.45571 > 172.16.22.5.domain: 2+ PTR? 10.3.168.192.in-addr.arpa. (43)
09:44:31.544918 IP 172.16.22.5.domain > 172.16.22.10.45571: 2 1/0/0 PTR kube-dns.kube-system.svc.cluster.local. (95)
09:44:31.545115 IP 172.16.22.10.41751 > 172.16.22.5.domain: 3+ AAAA? kubernetes.default. (36)
09:44:31.545127 IP 172.16.22.10.41751 > 172.16.22.5.domain: 3+ AAAA? kubernetes.default. (36)
09:44:31.545513 IP 172.16.22.5.37446 > google-public-dns-a.google.com.domain: 60792+ AAAA? kubernetes.default. (36)
09:44:33.545956 IP 172.16.22.5.47199 > google-public-dns-b.google.com.domain: 60792+ AAAA? kubernetes.default. (36)
09:44:35.546409 IP 172.16.22.5.33246 > google-public-dns-a.google.com.domain: 60792+ AAAA? kubernetes.default. (36)
09:44:36.550303 IP 172.16.22.10.47731 > 172.16.22.5.domain: 4+ AAAA? kubernetes.default. (36)
09:44:36.550322 IP 172.16.22.10.47731 > 172.16.22.5.domain: 4+ AAAA? kubernetes.default. (36)
09:44:37.546980 IP 172.16.22.5.54940 > google-public-dns-b.google.com.domain: 16724+ AAAA? kubernetes.default. (36)
09:44:39.547441 IP 172.16.22.5.47956 > google-public-dns-a.google.com.domain: 16724+ AAAA? kubernetes.default. (36)
09:44:41.554133 IP 172.16.22.10.46895 > 172.16.22.5.domain: 5+ AAAA? kubernetes.default. (36)
09:44:41.554149 IP 172.16.22.10.46895 > 172.16.22.5.domain: 5+ AAAA? kubernetes.default. (36)
```  
Seems nslookup in busybox didn't add search path and keep sending `kubernetes.default` to quest kubedns.

But when kubedns pod inherits an accessable external DNS server, it works fine:
```
09:48:24.505128 IP 172.16.22.10.37413 > 172.16.22.11.domain: 2+ PTR? 10.3.168.192.in-addr.arpa. (43)
09:48:24.505145 IP 172.16.22.10.37413 > 172.16.22.11.domain: 2+ PTR? 10.3.168.192.in-addr.arpa. (43)
09:48:24.505702 IP 172.16.22.11.domain > 172.16.22.10.37413: 2 1/0/0 PTR kube-dns.kube-system.svc.cluster.local. (95)
09:48:24.505915 IP 172.16.22.10.59215 > 172.16.22.11.domain: 3+ AAAA? kubernetes.default. (36)
09:48:24.505928 IP 172.16.22.10.59215 > 172.16.22.11.domain: 3+ AAAA? kubernetes.default. (36)
09:48:24.506381 IP 172.16.22.11.43503 > 10.30.1.9.domain: 31263+ AAAA? kubernetes.default. (36)
09:48:24.529770 IP 10.30.1.9.domain > 172.16.22.11.43503: 31263 NXDomain 0/1/0 (111)
09:48:24.529967 IP 172.16.22.11.domain > 172.16.22.10.59215: 3 NXDomain 0/1/0 (111)
09:48:24.530041 IP 172.16.22.10.48059 > 172.16.22.11.domain: 4+ AAAA? kubernetes.default.default.svc.cluster.local. (62)
09:48:24.530045 IP 172.16.22.10.48059 > 172.16.22.11.domain: 4+ AAAA? kubernetes.default.default.svc.cluster.local. (62)
09:48:24.530413 IP 172.16.22.11.domain > 172.16.22.10.48059: 4 NXDomain 0/1/0 (155)
09:48:24.530487 IP 172.16.22.10.59720 > 172.16.22.11.domain: 5+ AAAA? kubernetes.default.svc.cluster.local. (54)
09:48:24.530495 IP 172.16.22.10.59720 > 172.16.22.11.domain: 5+ AAAA? kubernetes.default.svc.cluster.local. (54)
09:48:24.530549 IP 172.16.22.11.domain > 172.16.22.10.59720: 5 0/0/0 (54)
09:48:24.530591 IP 172.16.22.11.domain > 172.16.22.10.59720: 5 0/0/0 (54)
09:48:24.530630 IP 172.16.22.10.43224 > 172.16.22.11.domain: 6+ A? kubernetes.default. (36)
09:48:24.530638 IP 172.16.22.10.43224 > 172.16.22.11.domain: 6+ A? kubernetes.default. (36)
09:48:24.530879 IP 172.16.22.11.50755 > 10.30.1.9.domain: 43837+ A? kubernetes.default. (36)
09:48:24.554328 IP 10.30.1.9.domain > 172.16.22.11.50755: 43837 NXDomain 0/1/0 (111)
09:48:24.554533 IP 172.16.22.11.domain > 172.16.22.10.43224: 6 NXDomain 0/1/0 (111)
09:48:24.554606 IP 172.16.22.10.40286 > 172.16.22.11.domain: 7+ A? kubernetes.default.default.svc.cluster.local. (62)
09:48:24.554615 IP 172.16.22.10.40286 > 172.16.22.11.domain: 7+ A? kubernetes.default.default.svc.cluster.local. (62)
09:48:24.554898 IP 172.16.22.11.domain > 172.16.22.10.40286: 7 NXDomain 0/1/0 (155)
09:48:24.554961 IP 172.16.22.10.48279 > 172.16.22.11.domain: 8+ A? kubernetes.default.svc.cluster.local. (54)
09:48:24.554971 IP 172.16.22.10.48279 > 172.16.22.11.domain: 8+ A? kubernetes.default.svc.cluster.local. (54)
09:48:24.555031 IP 172.16.22.11.domain > 172.16.22.10.48279: 8 1/0/0 A 192.168.3.1 (70)
09:48:24.555071 IP 172.16.22.11.domain > 172.16.22.10.48279: 8 1/0/0 A 192.168.3.1 (70)
09:48:24.555140 IP 172.16.22.10.37608 > 172.16.22.11.domain: 9+ PTR? 1.3.168.192.in-addr.arpa. (42)
09:48:24.555149 IP 172.16.22.10.37608 > 172.16.22.11.domain: 9+ PTR? 1.3.168.192.in-addr.arpa. (42)
09:48:24.555201 IP 172.16.22.11.domain > 172.16.22.10.37608: 9 1/0/0 PTR kubernetes.default.svc.cluster.local. (92)
09:48:24.555238 IP 172.16.22.11.domain > 172.16.22.10.37608: 9 1/0/0 PTR kubernetes.default.svc.cluster.local. (92)
```

Finally i tried another pod based on Ubuntu system image and install nslookup. It works normally in both  cases and did less quest to kubedns.
```
09:43:18.844701 IP 172.16.22.6.34455 > 172.16.22.5.domain: 33375+ A? kubernetes.default.default.svc.cluster.local. (62)
09:43:18.844765 IP 172.16.22.6.34455 > 172.16.22.5.domain: 33375+ A? kubernetes.default.default.svc.cluster.local. (62)
09:43:18.845376 IP 172.16.22.5.domain > 172.16.22.6.34455: 33375 NXDomain 0/1/0 (155)
09:43:18.845784 IP 172.16.22.6.58432 > 172.16.22.5.domain: 3089+ A? kubernetes.default.svc.cluster.local. (54)
09:43:18.845829 IP 172.16.22.6.58432 > 172.16.22.5.domain: 3089+ A? kubernetes.default.svc.cluster.local. (54)
09:43:18.845927 IP 172.16.22.5.domain > 172.16.22.6.58432: 3089 1/0/0 A 192.168.3.1 (70)
09:43:18.846028 IP 172.16.22.5.domain > 172.16.22.6.58432: 3089 1/0/0 A 192.168.3.1 (70)
```
So it has to be the problem of nslookup working in the busybox, which misleading me.

**Comment by xialonglee** [comment]
@tacy
I tested it You are right. So it is the problem of busybox ...
This issue can be cloesd ...

**Comment by MrHohn** [comment]
@tacy Thanks!

@xialonglee I'm going to close this issue :)

/assign
