### ISSUE TITLE
DNS does't work properly from different namespaces

### ISSUE THREAD

**Issue by ntquyen** [kubernetes/kubernetes#14533]
I have only one DNS server running in namespace `default`, and it works correctly from the same namespace
```
$ kubectl get po --namespace=default
NAME             READY     STATUS    RESTARTS   AGE
curlpod          1/1       Running   2          2d
kube-dns-1gvwb   3/3       Running   0          2d

$ kubectl get se --namespace=default
NAME         LABELS                                                              SELECTOR           IP(S)         PORT(S)
kube-dns     k8s-app=kube-dns,kubernetes.io/cluster-service=true,name=kube-dns   k8s-app=kube-dns   10.100.0.10   53/UDP
                                                                                                                  53/TCP
kubernetes   component=apiserver,provider=kubernetes                             <none>             10.100.0.1    443/TCP

$ kubectl exec curlpod --namespace=default -- nslookup svc-rethinkdb-driver.development
Server:    10.100.0.10
Address 1: 10.100.0.10

Name:      svc-rethinkdb-driver.development
Address 1: 10.100.137.137
```

I don't have any DNS server in other namespace. And now, from namespace `development`, resolving service name doesn't work: (I have `curlpod` running in both namespaces)

```
$ kubectl exec curlpod --namespace=development -- nslookup svc-rethinkdb-driver.development
Server:    10.100.0.10
Address 1: 10.100.0.10

nslookup: can't resolve 'svc-rethinkdb-driver.development'
error: Error executing remote command: Error executing command in container: Error executing in Docker Container: 1
```

Even more, it is so weird that I'm sure it worked before, until today. I'm having some application still up and running in `development` and well connected  to `svc-rethinkdb-driver`. But I cannot deploy a new one anymore.

Note that I didn't make any change to the kubernetes cluster since a few days.

What I have to do to troubleshoot this? Are there any logs? Thanks for any help.

**Comment by pmorie** [comment]
@kubernetes/rh-networking

**Comment by thockin** [comment]
What is the resolv.conf in the pod that is not working?

**Comment by ntquyen** [comment]
The file is the same as the one that works

```
[ root@curlpod:/ ]$ cat /etc/resolv.conf
nameserver 10.100.0.10
nameserver 10.0.2.3
search development.svc.cluster.local svc.cluster.local cluster.local
options ndots:5
```
The only difference between those two pods is that the working one has the `KUBE_DNS*` environment variables, the other doesn't

**Comment by bgrant0607-nocc** [comment]
cc @ArtfulCoder

**Comment by ArtfulCoder** [comment]
@ntquyen

Can you run "tcpdump -n port 53"  on development /curlpod, 
while you run "nslookup svc-rethinkdb-driver.development"

Once you give me the output of tcpdump, we can figure out what happened..

**Comment by ArtfulCoder** [comment]
If it is inconvenient to run tcpdump on the pod, run it on the host of the pod, and capture packets on docker interface

**Comment by ntquyen** [comment]
This is the tcpdump when running on host of the pod
```
tcpdump: verbose output suppressed, use -v or -vv for full protocol decode
listening on eth0, link-type EN10MB (Ethernet), capture size 262144 bytes
01:25:03.310207 IP 10.0.2.15.60931 > 8.8.4.4.domain: 3+ PTR? 1.0.100.10.in-addr.arpa. (41)
01:25:03.311428 IP 8.8.4.4.domain > 10.0.2.15.60931: 3 NXDomain 0/1/0 (90)
01:25:04.153189 IP 10.0.2.15.44840 > 10.0.2.3.domain: 3+ PTR? 10.0.100.10.in-addr.arpa. (42)
01:25:04.156049 IP 10.0.2.3.domain > 10.0.2.15.44840: 3 NXDomain*- 0/0/0 (42)
01:25:04.156391 IP 10.0.2.15.39959 > 10.0.2.3.domain: 4+ PTR? 10.0.100.10.in-addr.arpa.development.svc.cluster.local. (72)
01:25:04.159269 IP 10.0.2.3.domain > 10.0.2.15.39959: 4 NXDomain*- 0/0/0 (72)
01:25:04.159586 IP 10.0.2.15.41325 > 10.0.2.3.domain: 5+ PTR? 10.0.100.10.in-addr.arpa.svc.cluster.local. (60)
01:25:04.162359 IP 10.0.2.3.domain > 10.0.2.15.41325: 5 NXDomain*- 0/0/0 (60)
01:25:04.162686 IP 10.0.2.15.42955 > 10.0.2.3.domain: 6+ PTR? 10.0.100.10.in-addr.arpa.cluster.local. (56)
01:25:04.165364 IP 10.0.2.3.domain > 10.0.2.15.42955: 6 NXDomain*- 0/0/0 (56)
01:25:04.166079 IP 10.0.2.15.47329 > 10.0.2.3.domain: 7+ AAAA? svc-rethinkdb-driver.development. (50)
01:25:04.169168 IP 10.0.2.3.domain > 10.0.2.15.47329: 7 NXDomain*- 0/0/0 (50)
01:25:04.169498 IP 10.0.2.15.60240 > 10.0.2.3.domain: 8+ AAAA? svc-rethinkdb-driver.development.development.svc.cluster.local. (80)
01:25:04.172254 IP 10.0.2.3.domain > 10.0.2.15.60240: 8 NXDomain*- 0/0/0 (80)
01:25:04.172570 IP 10.0.2.15.37393 > 10.0.2.3.domain: 9+ AAAA? svc-rethinkdb-driver.development.svc.cluster.local. (68)
01:25:04.175016 IP 10.0.2.3.domain > 10.0.2.15.37393: 9 NXDomain*- 0/0/0 (68)
01:25:04.175332 IP 10.0.2.15.46839 > 10.0.2.3.domain: 10+ AAAA? svc-rethinkdb-driver.development.cluster.local. (64)
01:25:04.178010 IP 10.0.2.3.domain > 10.0.2.15.46839: 10 NXDomain*- 0/0/0 (64)
01:25:04.178413 IP 10.0.2.15.44893 > 10.0.2.3.domain: 11+ A? svc-rethinkdb-driver.development. (50)
01:25:04.180983 IP 10.0.2.3.domain > 10.0.2.15.44893: 11 NXDomain*- 0/0/0 (50)
01:25:04.181315 IP 10.0.2.15.56849 > 10.0.2.3.domain: 12+ A? svc-rethinkdb-driver.development.development.svc.cluster.local. (80)
01:25:04.183993 IP 10.0.2.3.domain > 10.0.2.15.56849: 12 NXDomain*- 0/0/0 (80)
01:25:04.184325 IP 10.0.2.15.47892 > 10.0.2.3.domain: 13+ A? svc-rethinkdb-driver.development.svc.cluster.local. (68)
01:25:04.187109 IP 10.0.2.3.domain > 10.0.2.15.47892: 13 NXDomain*- 0/0/0 (68)
01:25:04.187425 IP 10.0.2.15.42436 > 10.0.2.3.domain: 14+ A? svc-rethinkdb-driver.development.cluster.local. (64)
01:25:04.190184 IP 10.0.2.3.domain > 10.0.2.15.42436: 14 NXDomain*- 0/0/0 (64)
01:25:13.174425 IP 10.0.2.15.45770 > 8.8.4.4.domain: 3+ PTR? 1.0.100.10.in-addr.arpa. (41)
```

**Comment by ArtfulCoder** [comment]
We can confirm the tcpdump, that the dns client never hits skydns.
Some how, the dns client tries  10.0.2.3 first.
We need to somehow enforce the client to use the first nameserver first...
Will check if there is any such option to set in resolv.conf

**Comment by ArtfulCoder** [comment]
@ntquyen
Can you confirm that the lookup works from the development pod if the 10.0.2.3 nameserver is removed from /etc/resolv.conf on that pod.
you can do the following:
1.  kubectl exec -ti curlpod --namespace=development   /bin/bash
2. run nslookup svc-rethinkdb-driver.development. confirm that it fails
2. edit /etc/resolv.conf and remove the nameserver 10.0.2.3
3.nslookup svc-rethinkdb-driver.development. Check if it succeeds.

I think your curlpod is probably based on busybox. is that right ?

**Comment by ArtfulCoder** [comment]
Also, it is interesting that the dnsclient tries the query as FQDN first, which is what the resolv.conf documentation says, but I have not seen that happen on ubuntu container.

**Comment by ArtfulCoder** [comment]
Actually, can you run tcpdump -i any -n port 53

I suspect that your dns pod is running on the same host as your development pod, and as a result, your tcpdump query did not capture those packets on eth0

Also, it would be useful to compare the tcpdumps that happens for the happy and the un-happy case..

(Further, I think if your pods are FROM ubuntu or something other than busybox, this problem should go away, but it still important to get to do the bottom of this)

**Comment by ArtfulCoder** [comment]
I think I know the root cause:
are you using iptables mode for kube-proxy ?
Somehow, the udp packets dont hit the dns pod, since the packets are considered martian..

Your development pod and the dns pod are on the same host, most likely.

If you use iptables in userspace mode, this should work.

**Comment by ntquyen** [comment]
My curlpod is the one from kubernetes example, it based on `radial/busyboxplus:curl`. But curlpod is just the one I use for my test after having the same problem with my project's container which is base on ubuntu trusty.

I removed 10.0.2.3 nameserver, it still failed :(. This is the log running `tcpdump -i any -n port 53`
```
02:53:22.380130 IP 10.244.69.50.48998 > 10.100.0.10.domain: 2+ PTR? 10.0.100.10.in-addr.arpa. (42)
02:53:24.153211 IP 10.244.69.2.43212 > 8.8.4.4.domain: 3+ PTR? 1.0.100.10.in-addr.arpa. (41)
02:53:24.153211 IP 10.244.69.2.43212 > 8.8.4.4.domain: 3+ PTR? 1.0.100.10.in-addr.arpa. (41)
02:53:24.153246 IP 10.0.2.15.43212 > 8.8.4.4.domain: 3+ PTR? 1.0.100.10.in-addr.arpa. (41)
02:53:24.154578 IP 8.8.4.4.domain > 10.0.2.15.43212: 3 NXDomain 0/1/0 (90)
02:53:24.154598 IP 8.8.4.4.domain > 10.244.69.2.43212: 3 NXDomain 0/1/0 (90)
02:53:24.154602 IP 8.8.4.4.domain > 10.244.69.2.43212: 3 NXDomain 0/1/0 (90)
02:53:27.385561 IP 10.244.69.50.44218 > 10.100.0.10.domain: 3+ PTR? 10.0.100.10.in-addr.arpa. (42)
02:53:32.391116 IP 10.244.69.50.43133 > 10.100.0.10.domain: 4+ PTR? 10.0.100.10.in-addr.arpa. (42)
02:53:34.233337 IP 10.244.69.2.54583 > 8.8.4.4.domain: 3+ PTR? 1.0.100.10.in-addr.arpa. (41)
02:53:34.233337 IP 10.244.69.2.54583 > 8.8.4.4.domain: 3+ PTR? 1.0.100.10.in-addr.arpa. (41)
02:53:34.233373 IP 10.0.2.15.54583 > 8.8.4.4.domain: 3+ PTR? 1.0.100.10.in-addr.arpa. (41)
02:53:34.234636 IP 8.8.4.4.domain > 10.0.2.15.54583: 3 NXDomain 0/1/0 (90)
02:53:34.234658 IP 8.8.4.4.domain > 10.244.69.2.54583: 3 NXDomain 0/1/0 (90)
02:53:34.234661 IP 8.8.4.4.domain > 10.244.69.2.54583: 3 NXDomain 0/1/0 (90)
02:53:37.396372 IP 10.244.69.50.59339 > 10.100.0.10.domain: 5+ PTR? 10.0.100.10.in-addr.arpa. (42)
02:53:42.402414 IP 10.244.69.50.51012 > 10.100.0.10.domain: 6+ AAAA? svc-rethinkdb-driver.development. (50)
02:53:44.246847 IP 10.244.69.2.46263 > 8.8.4.4.domain: 3+ PTR? 1.0.100.10.in-addr.arpa. (41)
02:53:44.246847 IP 10.244.69.2.46263 > 8.8.4.4.domain: 3+ PTR? 1.0.100.10.in-addr.arpa. (41)
02:53:44.246882 IP 10.0.2.15.46263 > 8.8.4.4.domain: 3+ PTR? 1.0.100.10.in-addr.arpa. (41)
02:53:44.248006 IP 8.8.4.4.domain > 10.0.2.15.46263: 3 NXDomain 0/1/0 (90)
02:53:44.248030 IP 8.8.4.4.domain > 10.244.69.2.46263: 3 NXDomain 0/1/0 (90)
02:53:44.248034 IP 8.8.4.4.domain > 10.244.69.2.46263: 3 NXDomain 0/1/0 (90)
02:53:47.408814 IP 10.244.69.50.46202 > 10.100.0.10.domain: 7+ AAAA? svc-rethinkdb-driver.development. (50)
02:53:52.414385 IP 10.244.69.50.53683 > 10.100.0.10.domain: 8+ AAAA? svc-rethinkdb-driver.development. (50)
02:53:54.228326 IP 10.244.69.2.52797 > 8.8.4.4.domain: 3+ PTR? 1.0.100.10.in-addr.arpa. (41)
02:53:54.228326 IP 10.244.69.2.52797 > 8.8.4.4.domain: 3+ PTR? 1.0.100.10.in-addr.arpa. (41)
02:53:54.228360 IP 10.0.2.15.52797 > 8.8.4.4.domain: 3+ PTR? 1.0.100.10.in-addr.arpa. (41)
02:53:54.230398 IP 8.8.4.4.domain > 10.0.2.15.52797: 3 NXDomain 0/1/0 (90)
02:53:54.230418 IP 8.8.4.4.domain > 10.244.69.2.52797: 3 NXDomain 0/1/0 (90)
02:53:54.230422 IP 8.8.4.4.domain > 10.244.69.2.52797: 3 NXDomain 0/1/0 (90)
02:53:57.419708 IP 10.244.69.50.49885 > 10.100.0.10.domain: 9+ AAAA? svc-rethinkdb-driver.development. (50)
02:54:02.425335 IP 10.244.69.50.37395 > 10.100.0.10.domain: 10+ A? svc-rethinkdb-driver.development. (50)
02:54:04.270861 IP 10.244.69.2.35847 > 8.8.4.4.domain: 3+ PTR? 1.0.100.10.in-addr.arpa. (41)
02:54:04.270861 IP 10.244.69.2.35847 > 8.8.4.4.domain: 3+ PTR? 1.0.100.10.in-addr.arpa. (41)
02:54:04.270899 IP 10.0.2.15.35847 > 8.8.4.4.domain: 3+ PTR? 1.0.100.10.in-addr.arpa. (41)
02:54:04.272296 IP 8.8.4.4.domain > 10.0.2.15.35847: 3 NXDomain 0/1/0 (90)
02:54:04.272313 IP 8.8.4.4.domain > 10.244.69.2.35847: 3 NXDomain 0/1/0 (90)
02:54:04.272316 IP 8.8.4.4.domain > 10.244.69.2.35847: 3 NXDomain 0/1/0 (90)
02:54:07.430691 IP 10.244.69.50.52509 > 10.100.0.10.domain: 11+ A? svc-rethinkdb-driver.development. (50)
02:54:12.433066 IP 10.244.69.50.54443 > 10.100.0.10.domain: 12+ A? svc-rethinkdb-driver.development. (50)
02:54:14.288198 IP 10.244.69.2.49871 > 8.8.4.4.domain: 3+ PTR? 1.0.100.10.in-addr.arpa. (41)
02:54:14.288198 IP 10.244.69.2.49871 > 8.8.4.4.domain: 3+ PTR? 1.0.100.10.in-addr.arpa. (41)
02:54:14.288249 IP 10.0.2.15.49871 > 8.8.4.4.domain: 3+ PTR? 1.0.100.10.in-addr.arpa. (41)
02:54:14.290178 IP 8.8.4.4.domain > 10.0.2.15.49871: 3 NXDomain 0/1/0 (90)
02:54:14.290195 IP 8.8.4.4.domain > 10.244.69.2.49871: 3 NXDomain 0/1/0 (90)
02:54:14.290198 IP 8.8.4.4.domain > 10.244.69.2.49871: 3 NXDomain 0/1/0 (90)
02:54:17.438595 IP 10.244.69.50.52348 > 10.100.0.10.domain: 13+ A? svc-rethinkdb-driver.development. (50)
```
The kube-dns and the development curlpod is running the different host. I have tried both, same host or different host it still failed.

I don't get your instruction: "If you use iptables in userspace mode, this should work." Can you be more specific? Thanks!!

**Comment by ntquyen** [comment]
Ah you're right, it the kube-dns and and the curlpod are running in different host, it will work!

**Comment by ArtfulCoder** [comment]
can you check what command-lines args is kube-proxy running with ?

**Comment by ArtfulCoder** [comment]
"ps -ef |grep kube-proxy" on host, or check the /etc/default/kube-proxy file

**Comment by ntquyen** [comment]
```
core@node-01 ~ $ ps -ef | grep kube-proxy
root      1405     1  1 Sep22 ?        01:19:36 /opt/bin/kube-proxy --master=172.17.8.101:8080 --logtostderr=true
core     24567 30958  0 03:42 pts/0    00:00:00 grep --colour=auto kube-proxy
```

**Comment by ArtfulCoder** [comment]
Args got clipped.
Can you get the full args list ?

**Comment by ntquyen** [comment]
Here the full `kube-proxy.service`:
```
[Unit]
Description=Kubernetes Proxy
Documentation=https://github.com/GoogleCloudPlatform/kubernetes
Requires=kube-install.service
After=kube-install.service
[Service]
ExecStartPre=/opt/bin/wupiao 172.17.8.101:8080
ExecStart=/opt/bin/kube-proxy \
  --master=172.17.8.101:8080 \
  --logtostderr=true
Restart=always
RestartSec=10
```
and `kube-install.service`:

```
[Unit]
Description=Download/Install Kubernetes
Requires=network-online.target
After=network-online.target
[Service]
Type=oneshot
EnvironmentFile=/etc/environment
ExecStart=-/usr/bin/mkdir -p /opt/bin
ExecStart=/usr/bin/wget -P /opt/bin https://storage.googleapis.com/kubernetes-release/release/v1.0.3/bin/linux/amd64/kube-proxy
ExecStart=/usr/bin/wget -P /opt/bin https://storage.googleapis.com/kubernetes-release/release/v1.0.3/bin/linux/amd64/kubelet
ExecStart=/usr/bin/chmod +x /opt/bin/kube-proxy
ExecStart=/usr/bin/chmod +x /opt/bin/kubelet
```

**Comment by ArtfulCoder** [comment]
one more thing: can you run "sudo iptables-save" on the host of the failing pod.
Also, can you double-check that this happens only if the dns pod and your dev pod are on the same host ?

**Comment by ntquyen** [comment]
Yes, I retried and confirm that it failed only if the dns pod and curlpod are on the same host.

```
core@node-01 ~ $ sudo iptables-save
# Generated by iptables-save v1.4.21 on Mon Sep 28 06:46:39 2015
*nat
:PREROUTING ACCEPT [1:69]
:INPUT ACCEPT [0:0]
:OUTPUT ACCEPT [1:60]
:POSTROUTING ACCEPT [1:60]
:DOCKER - [0:0]
:FLANNEL - [0:0]
:KUBE-NODEPORT-CONTAINER - [0:0]
:KUBE-NODEPORT-HOST - [0:0]
:KUBE-PORTALS-CONTAINER - [0:0]
:KUBE-PORTALS-HOST - [0:0]
-A PREROUTING -m comment --comment "handle ClusterIPs; NOTE: this must be before the NodePort rules" -j KUBE-PORTALS-CONTAINER
-A PREROUTING -m addrtype --dst-type LOCAL -j DOCKER
-A PREROUTING -m addrtype --dst-type LOCAL -m comment --comment "handle service NodePorts; NOTE: this must be the last rule in the chain" -j KUBE-NODEPORT-CONTAINER
-A OUTPUT -m comment --comment "handle ClusterIPs; NOTE: this must be before the NodePort rules" -j KUBE-PORTALS-HOST
-A OUTPUT ! -d 127.0.0.0/8 -m addrtype --dst-type LOCAL -j DOCKER
-A OUTPUT -m addrtype --dst-type LOCAL -m comment --comment "handle service NodePorts; NOTE: this must be the last rule in the chain" -j KUBE-NODEPORT-HOST
-A POSTROUTING -s 10.244.0.0/16 -j FLANNEL
-A FLANNEL -d 10.244.0.0/16 -j ACCEPT
-A FLANNEL ! -d 224.0.0.0/4 -j MASQUERADE
-A KUBE-NODEPORT-CONTAINER -p tcp -m comment --comment "development/svc-rethinkdb-admin:" -m tcp --dport 31094 -j REDIRECT --to-ports 45574
-A KUBE-NODEPORT-CONTAINER -p tcp -m comment --comment "development/svc-rethinkdb-cluster:" -m tcp --dport 32543 -j REDIRECT --to-ports 54267
-A KUBE-NODEPORT-CONTAINER -p tcp -m comment --comment "development/svc-ms-subscriber:" -m tcp --dport 30550 -j REDIRECT --to-ports 50962
-A KUBE-NODEPORT-CONTAINER -p tcp -m comment --comment "development/svc-ms-account:" -m tcp --dport 30617 -j REDIRECT --to-ports 52712
-A KUBE-NODEPORT-CONTAINER -p tcp -m comment --comment "development/svc-ms-realm:" -m tcp --dport 32280 -j REDIRECT --to-ports 41345
-A KUBE-NODEPORT-CONTAINER -p tcp -m comment --comment "development/svc-ms-list:" -m tcp --dport 32385 -j REDIRECT --to-ports 33786
-A KUBE-NODEPORT-CONTAINER -p tcp -m comment --comment "development/svc-redis-driver:" -m tcp --dport 31514 -j REDIRECT --to-ports 43465
-A KUBE-NODEPORT-CONTAINER -p tcp -m comment --comment "development/svc-influxdb-admin:" -m tcp --dport 31668 -j REDIRECT --to-ports 44570
-A KUBE-NODEPORT-CONTAINER -p tcp -m comment --comment "development/svc-couchbase:admin-port" -m tcp --dport 32045 -j REDIRECT --to-ports 50213
-A KUBE-NODEPORT-CONTAINER -p tcp -m comment --comment "development/svc-ms-email-template:" -m tcp --dport 32205 -j REDIRECT --to-ports 41160
-A KUBE-NODEPORT-HOST -p tcp -m comment --comment "development/svc-rethinkdb-admin:" -m tcp --dport 31094 -j DNAT --to-destination 10.0.2.15:45574
-A KUBE-NODEPORT-HOST -p tcp -m comment --comment "development/svc-rethinkdb-cluster:" -m tcp --dport 32543 -j DNAT --to-destination 10.0.2.15:54267
-A KUBE-NODEPORT-HOST -p tcp -m comment --comment "development/svc-ms-subscriber:" -m tcp --dport 30550 -j DNAT --to-destination 10.0.2.15:50962
-A KUBE-NODEPORT-HOST -p tcp -m comment --comment "development/svc-ms-account:" -m tcp --dport 30617 -j DNAT --to-destination 10.0.2.15:52712
-A KUBE-NODEPORT-HOST -p tcp -m comment --comment "development/svc-ms-realm:" -m tcp --dport 32280 -j DNAT --to-destination 10.0.2.15:41345
-A KUBE-NODEPORT-HOST -p tcp -m comment --comment "development/svc-ms-list:" -m tcp --dport 32385 -j DNAT --to-destination 10.0.2.15:33786
-A KUBE-NODEPORT-HOST -p tcp -m comment --comment "development/svc-redis-driver:" -m tcp --dport 31514 -j DNAT --to-destination 10.0.2.15:43465
-A KUBE-NODEPORT-HOST -p tcp -m comment --comment "development/svc-influxdb-admin:" -m tcp --dport 31668 -j DNAT --to-destination 10.0.2.15:44570
-A KUBE-NODEPORT-HOST -p tcp -m comment --comment "development/svc-couchbase:admin-port" -m tcp --dport 32045 -j DNAT --to-destination 10.0.2.15:50213
-A KUBE-NODEPORT-HOST -p tcp -m comment --comment "development/svc-ms-email-template:" -m tcp --dport 32205 -j DNAT --to-destination 10.0.2.15:41160
-A KUBE-PORTALS-CONTAINER -d 10.100.0.10/32 -p udp -m comment --comment "default/kube-dns:dns" -m udp --dport 53 -j REDIRECT --to-ports 34555
-A KUBE-PORTALS-CONTAINER -d 10.100.0.10/32 -p tcp -m comment --comment "default/kube-dns:dns-tcp" -m tcp --dport 53 -j REDIRECT --to-ports 39352
-A KUBE-PORTALS-CONTAINER -d 10.100.0.1/32 -p tcp -m comment --comment "default/kubernetes:" -m tcp --dport 443 -j REDIRECT --to-ports 52837
-A KUBE-PORTALS-CONTAINER -d 10.100.239.33/32 -p tcp -m comment --comment "development/svc-rethinkdb-admin:" -m tcp --dport 8080 -j REDIRECT --to-ports 45574
-A KUBE-PORTALS-CONTAINER -d 10.100.137.137/32 -p tcp -m comment --comment "development/svc-rethinkdb-driver:" -m tcp --dport 28015 -j REDIRECT --to-ports 59356
-A KUBE-PORTALS-CONTAINER -d 10.100.173.170/32 -p tcp -m comment --comment "development/svc-rethinkdb-cluster:" -m tcp --dport 29015 -j REDIRECT --to-ports 54267
-A KUBE-PORTALS-CONTAINER -d 10.100.58.155/32 -p tcp -m comment --comment "development/svc-ms-subscriber:" -m tcp --dport 80 -j REDIRECT --to-ports 50962
-A KUBE-PORTALS-CONTAINER -d 10.100.92.125/32 -p tcp -m comment --comment "development/svc-ms-account:" -m tcp --dport 80 -j REDIRECT --to-ports 52712
-A KUBE-PORTALS-CONTAINER -d 10.100.85.129/32 -p tcp -m comment --comment "development/svc-ms-realm:" -m tcp --dport 80 -j REDIRECT --to-ports 41345
-A KUBE-PORTALS-CONTAINER -d 10.100.248.208/32 -p tcp -m comment --comment "development/svc-ms-list:" -m tcp --dport 80 -j REDIRECT --to-ports 33786
-A KUBE-PORTALS-CONTAINER -d 10.100.155.206/32 -p tcp -m comment --comment "development/svc-redis-driver:" -m tcp --dport 6379 -j REDIRECT --to-ports 43465
-A KUBE-PORTALS-CONTAINER -d 10.100.6.230/32 -p tcp -m comment --comment "development/svc-influxdb-admin:" -m tcp --dport 8083 -j REDIRECT --to-ports 44570
-A KUBE-PORTALS-CONTAINER -d 10.100.94.72/32 -p tcp -m comment --comment "development/svc-influxdb-driver:" -m tcp --dport 8086 -j REDIRECT --to-ports 44456
-A KUBE-PORTALS-CONTAINER -d 10.100.10.109/32 -p tcp -m comment --comment "development/svc-couchbase:admin-port" -m tcp --dport 8091 -j REDIRECT --to-ports 50213
-A KUBE-PORTALS-CONTAINER -d 10.100.125.21/32 -p tcp -m comment --comment "development/svc-ms-email-template:" -m tcp --dport 80 -j REDIRECT --to-ports 41160
-A KUBE-PORTALS-HOST -d 10.100.0.10/32 -p udp -m comment --comment "default/kube-dns:dns" -m udp --dport 53 -j DNAT --to-destination 10.0.2.15:34555
-A KUBE-PORTALS-HOST -d 10.100.0.10/32 -p tcp -m comment --comment "default/kube-dns:dns-tcp" -m tcp --dport 53 -j DNAT --to-destination 10.0.2.15:39352
-A KUBE-PORTALS-HOST -d 10.100.0.1/32 -p tcp -m comment --comment "default/kubernetes:" -m tcp --dport 443 -j DNAT --to-destination 10.0.2.15:52837
-A KUBE-PORTALS-HOST -d 10.100.239.33/32 -p tcp -m comment --comment "development/svc-rethinkdb-admin:" -m tcp --dport 8080 -j DNAT --to-destination 10.0.2.15:45574
-A KUBE-PORTALS-HOST -d 10.100.137.137/32 -p tcp -m comment --comment "development/svc-rethinkdb-driver:" -m tcp --dport 28015 -j DNAT --to-destination 10.0.2.15:59356
-A KUBE-PORTALS-HOST -d 10.100.173.170/32 -p tcp -m comment --comment "development/svc-rethinkdb-cluster:" -m tcp --dport 29015 -j DNAT --to-destination 10.0.2.15:54267
-A KUBE-PORTALS-HOST -d 10.100.58.155/32 -p tcp -m comment --comment "development/svc-ms-subscriber:" -m tcp --dport 80 -j DNAT --to-destination 10.0.2.15:50962
-A KUBE-PORTALS-HOST -d 10.100.92.125/32 -p tcp -m comment --comment "development/svc-ms-account:" -m tcp --dport 80 -j DNAT --to-destination 10.0.2.15:52712
-A KUBE-PORTALS-HOST -d 10.100.85.129/32 -p tcp -m comment --comment "development/svc-ms-realm:" -m tcp --dport 80 -j DNAT --to-destination 10.0.2.15:41345
-A KUBE-PORTALS-HOST -d 10.100.248.208/32 -p tcp -m comment --comment "development/svc-ms-list:" -m tcp --dport 80 -j DNAT --to-destination 10.0.2.15:33786
-A KUBE-PORTALS-HOST -d 10.100.155.206/32 -p tcp -m comment --comment "development/svc-redis-driver:" -m tcp --dport 6379 -j DNAT --to-destination 10.0.2.15:43465
-A KUBE-PORTALS-HOST -d 10.100.6.230/32 -p tcp -m comment --comment "development/svc-influxdb-admin:" -m tcp --dport 8083 -j DNAT --to-destination 10.0.2.15:44570
-A KUBE-PORTALS-HOST -d 10.100.94.72/32 -p tcp -m comment --comment "development/svc-influxdb-driver:" -m tcp --dport 8086 -j DNAT --to-destination 10.0.2.15:44456
-A KUBE-PORTALS-HOST -d 10.100.10.109/32 -p tcp -m comment --comment "development/svc-couchbase:admin-port" -m tcp --dport 8091 -j DNAT --to-destination 10.0.2.15:50213
-A KUBE-PORTALS-HOST -d 10.100.125.21/32 -p tcp -m comment --comment "development/svc-ms-email-template:" -m tcp --dport 80 -j DNAT --to-destination 10.0.2.15:41160
COMMIT
# Completed on Mon Sep 28 06:46:39 2015
# Generated by iptables-save v1.4.21 on Mon Sep 28 06:46:39 2015
*filter
:INPUT ACCEPT [6576960:2415816481]
:FORWARD ACCEPT [10959:962690]
:OUTPUT ACCEPT [6930297:973898765]
:DOCKER - [0:0]
-A FORWARD -o docker0 -j DOCKER
-A FORWARD -o docker0 -m conntrack --ctstate RELATED,ESTABLISHED -j ACCEPT
-A FORWARD -i docker0 ! -o docker0 -j ACCEPT
-A FORWARD -i docker0 -o docker0 -j ACCEPT
COMMIT
# Completed on Mon Sep 28 06:46:39 2015
```

**Comment by ArtfulCoder** [comment]
@ntquyen 
Ok, this seems to makes sense.
can you confirm that on the host, "sysctl net.ipv4.ip_forward" gives you 0.

If it gives 0, on the host, run  "sudo sysctl net.ipv4.ip_forward=1".

This should solve the problem.
I believe this is a flannel-kube-proxy interaction issue, where hair-pin traffic needs to be enabled.

**Comment by ArtfulCoder** [comment]
@ntquyen any updates ?

**Comment by ntquyen** [comment]
Sorry @ArtfulCoder I was not with my computer last night, I'm trying now

**Comment by ntquyen** [comment]
@ArtfulCoder It's already set to 1 before, both nodes: `net.ipv4.ip_forward = 1` :(

**Comment by ArtfulCoder** [comment]
Ok,  I am still betting that flannel is somehow not handling the dns request packet after kube-proxy is dnat-ing. 
This bug is probably not dns-specific, but is about two pods on the same host communicating over flannel and using a k8s service. I will set up my own cluster with flannel and try to investigate this.

Can you confirm that this works  : 
 kubectl exec curlpod --namespace=development -- nslookup svc-rethinkdb-driver.development  < DNS POD IP>
(specify DNS POD IP, not DNS service IP)

**Comment by ntquyen** [comment]
I don't understand the command. Where in the command do I specify the DNS pod IP? Can you pls give me an example of exact command and put it in a `block quote`?

**Comment by ArtfulCoder** [comment]
kubectl exec curlpod --namespace=development -- nslookup svc-rethinkdb-driver.development `DNS-POD-IP`

**Comment by ntquyen** [comment]
Yes, it works!
```
~$ kubectl exec curlpod --namespace=development -- nslookup svc-rethinkdb-driver.development 10.244.69.2
Server:    10.244.69.2
Address 1: 10.244.69.2

Name:      svc-rethinkdb-driver.development
Address 1: 10.100.137.137
```

**Comment by ArtfulCoder** [comment]
The problem you are facing is not about dns, but about flannel not handling hairpin traffic.

Basically, a pod P on the host A, using service B, will run into issues if the endpoint of service B is on host A.
Lets say, the pod (10.244.69.1) behind flannel, sends out a packet to service B IP (10.0.0.10).
KubeProxy captures this packet and DNATs it to say service-endpoint IP 10.244.69.2 (which is behind the same flannel bridge on the same host)

At this point, for some reason, the packet gets dropped because flannel feels that the source(10.244.69.1) and dest IP (10.244.69.2) belong to the same subnet and should not be travelling across the flannel bridge. so, the packet is considered martian and gets dropped.

We need to find the right kernel/flannel bridge setting to allow martian packets.
I will try the setup (use flannel) and see how this can be fixed.

**Comment by ntquyen** [comment]
One quick, possible solution is that I can install DNS pod in a separated node. The drawback of this is that I have to schedule all my pods to avoid this node.

**Comment by ArtfulCoder** [comment]
Lets figure out how to configure flannel to right way.
I will take a look and get back to you

**Comment by ArtfulCoder** [comment]
you need the following iptables rule on every node of your cluster:
-A POSTROUTING ! -s 10.244.0.0/16 -d 10.244.0.0/16 -j MASQUERADE

you can say
`sudo iptables -t nat -A POSTROUTING ! -s 10.244.0.0/16 -d 10.244.0.0/16 -j MASQUERADE`

This should fix your issue.

The next flannel release should fix this for you automatically.
https://github.com/coreos/flannel/pull/327

**Comment by ntquyen** [comment]
@ArtfulCoder I added the iptables rule in all my nodes (except master) but it doesn't fix the problem:
```
$ sudo iptables-save
...
-A POSTROUTING -s 10.244.0.0/16 -j FLANNEL
-A POSTROUTING ! -s 10.244.0.0/16 -d 10.244.0.0/16 -j MASQUERADE
-A FLANNEL -d 10.244.0.0/16 -j ACCEPT
-A FLANNEL ! -d 224.0.0.0/4 -j MASQUERADE
...
```

**Comment by ArtfulCoder** [comment]
I had an error in my command.
Can you replace POSTROUTING with FLANNEL.

**Comment by ArtfulCoder** [comment]
@ntquyen did it work ?

**Comment by sanjana-bhat** [comment]
@ArtfulCoder, I landed on this issue while looking into coreos/flannel#327 
The side effect of pulling the above flannel fix is, I lose the source IP of any external request (i.e. any request that lands on the container from outside of the cluster). The source IP gets masqueraded to the docker bridge interface. Can you please help me understand on why this masquerade rule is needed?

**Comment by thockin** [comment]
The masquerade rule is needed particularly when there are DNATs involved
(as there are for Services in Kubernetes).  It is unfortunate that this
obscures the client IP.  As load-balancers learn to talk to containers
directly, this might get better and we might revisit the need for this.
