### ISSUE TITLE
Return packets arrive at Node but not delivered to Pod

### ISSUE THREAD

**Issue by arya** [kubernetes/kubernetes#37632]
**Kubernetes version** (use `kubectl version`):
```Client Version: version.Info{Major:"1", Minor:"4", GitVersion:"v1.4.4", GitCommit:"3b417cc4ccd1b8f38ff9ec96bb50a81ca0ea9d56", GitTreeState:"clean", BuildDate:"2016-10-21T02:48:38Z", GoVersion:"go1.6.3", Compiler:"gc", Platform:"linux/amd64"}
Server Version: version.Info{Major:"1", Minor:"4", GitVersion:"v1.4.5", GitCommit:"5a0a696437ad35c133c0c8493f7e9d22b0f9b81b", GitTreeState:"clean", BuildDate:"2016-10-29T01:32:42Z", GoVersion:"go1.6.3", Compiler:"gc", Platform:"linux/amd64"}
```

**Environment**:
- **Cloud provider or hardware configuration**:
GKE, n1-standard-4 nodes

- **OS** (e.g. from /etc/os-release):
```BUILD_ID=8872.26.0
NAME="Container-VM Image"
GOOGLE_CRASH_ID=Lakitu
VERSION_ID=55
BUG_REPORT_URL=https://crbug.com/new
PRETTY_NAME="Google Container-VM Image"
VERSION=55
GOOGLE_METRICS_PRODUCT_ID=26
HOME_URL="https://cloud.google.com/compute/docs/containers/vm-image/"
ID=gci
```

- **Kernel** (e.g. `uname -a`):
Linux gke-arb3-dev-default-pool-2abbee48-12yv 4.4.21+ #1 SMP Wed Oct 26 13:00:52 PDT 2016 x86_64 Intel(R) Xeon(R) CPU @ 2.30GHz GenuineIntel GNU/Linux

- **Install tools**:
N/A (since it's GKE)

- **Others**:
None

**What happened**:
A few of our nodes got into a state where any pods scheduled on them have no network access. This manifests as being unable to ping anything (whether it be another pod IP, a VM private IP, or google.com's IP). Using TCP dump, I'm able to see the packets arrive at the destination, which sends a return packet. On the node that the problem is occurring, the return packet does arrive but is not seen by the pod.

This is a TCP dump from the VM:
```
06:22:58.197298 IP 192.168.0.32 > 216.58.195.238: ICMP echo request, id 117, seq 6, length 64
06:22:58.232518 IP 216.58.195.238 > 192.168.0.32: ICMP echo reply, id 117, seq 6, length 64
06:22:59.197318 IP 192.168.0.32 > 216.58.195.238: ICMP echo request, id 117, seq 7, length 64
06:22:59.232595 IP 216.58.195.238 > 192.168.0.32: ICMP echo reply, id 117, seq 7, length 64
06:23:00.197272 IP 192.168.0.32 > 216.58.195.238: ICMP echo request, id 117, seq 8, length 64

```
This is the ping that generated those tcp dump packets, from a Pod:
```
root@wavefront-push-agent-2800521060-b5rxj:/# ping 216.58.195.238
PING 216.58.195.238 (216.58.195.238) 56(84) bytes of data.
^C
--- 216.58.195.238 ping statistics ---
19 packets transmitted, 0 received, 100% packet loss, time 17999ms

```

Rebooting the VM does fix it, at least temporarily. I've tried rebooting the kube-proxy with no luck.

As far as I can tell, the iptables NAT rules are correct but I don't fully understand them so hard to say if there is a subtle issue. At the very least, the NAT table is not empty.

The output of "docker network inspect" for all 3 networks seems to be identical to a healthy node, and the pods are in the same networks (kube-proxy is in bridge, everything else is in "none")

**What you expected to happen**:
I expect the pod to have network access as it normally does.

**How to reproduce it** (as minimally and precisely as possible):
I don't know how it gets into this state, but it has happened on multiple occasions to us.

**Anything else do we need to know**:
I've contacted Google Cloud support and he was stumped and suggested asking here. I've also asked in the kubernetes slack but got no responses.

**Comment by i0exception** [comment]
We found that the value for net.ipv4.conf.eth0.forwarding was set to 0 on the machine. We're not sure what process unsets the value given that it is '1' on the other machines and given that the pods on this bad machine had network access at one point in time, should have been '1' there too.

**Comment by arya** [comment]
The issue seems to be that systemd-networkd and systemd-sysctl both change sysctl values for IP forwarding. The former sets the per-interface bit while the latter sets the system-wide bit (both to zero). The docker daemon sets them both to 1 if and only if both are zero:

```
gke-arb3-dev-default-pool-2abbee48-9ie8 arya # sysctl net.ipv4.conf.eth0.forwarding; sysctl net.ipv4.ip_forward
net.ipv4.conf.eth0.forwarding = 1
net.ipv4.ip_forward = 1
gke-arb3-dev-default-pool-2abbee48-9ie8 arya # systemctl restart systemd-networkd
gke-arb3-dev-default-pool-2abbee48-9ie8 arya # sysctl net.ipv4.conf.eth0.forwarding; sysctl net.ipv4.ip_forward
net.ipv4.conf.eth0.forwarding = 0
net.ipv4.ip_forward = 1
gke-arb3-dev-default-pool-2abbee48-9ie8 arya # systemctl restart docker
gke-arb3-dev-default-pool-2abbee48-9ie8 arya # sysctl net.ipv4.conf.eth0.forwarding; sysctl net.ipv4.ip_forward
net.ipv4.conf.eth0.forwarding = 0
net.ipv4.ip_forward = 1
gke-arb3-dev-default-pool-2abbee48-9ie8 arya # systemctl restart systemd-sysctl
gke-arb3-dev-default-pool-2abbee48-9ie8 arya # sysctl net.ipv4.conf.eth0.forwarding; sysctl net.ipv4.ip_forward
net.ipv4.conf.eth0.forwarding = 0
net.ipv4.ip_forward = 0
gke-arb3-dev-default-pool-2abbee48-9ie8 arya # systemctl restart docker
gke-arb3-dev-default-pool-2abbee48-9ie8 arya # sysctl net.ipv4.conf.eth0.forwarding; sysctl net.ipv4.ip_forward
net.ipv4.conf.eth0.forwarding = 1
net.ipv4.ip_forward = 1
```

The GCI image should have systemd-networkd configured with `IPForward=true` and /etc/sysctl.conf should have `net.ipv4.ip_forward` set to 1, rather than relying on docker to set them.

**Comment by grodrigues3** [comment]
@kubernetes/sig-network-bugs

**Comment by thockin** [comment]
This is fixed in GCI as of a couple months ago.
