### ISSUE TITLE
App pods in k8s cluster can not resolve external address like: google.com 

### ISSUE THREAD

**Issue by colachg** [kubernetes/kubernetes#37798]
**Is this a BUG REPORT or FEATURE REQUEST?** (choose one):BUG REPORT

**Kubernetes version** (use `kubectl version`):v1.4.0

**Environment**:
- **Cloud provider or hardware configuration**: kvm
- **OS** (e.g. from /etc/os-release): ubuntu 16.04.1 LTS
- **Kernel** (e.g. `uname -a`): 4.4.0-49-generic
- **Install tools**: [kubeadm](http://kubernetes.io/docs/getting-started-guides/kubeadm/)
- **Others**:

**What happened**:

**dns can't resolve google.com in a pod with resolv.conf like this:**
```
$ kubectl exec my-pod cat /etc/resolv.conf 
search sc.svc.cluster.local svc.cluster.local cluster.local my.domain1 my.domain2
nameserver 100.64.0.10
options ndots:5

$ kubectl exec my-pod nslookup google.com 
nslookup: can't resolve '(null)': Name does not resolve

nslookup: can't resolve 'google.com': Name does not resolve
```

**What you expected to happen**:

DNS works.

**How to reproduce it** (as minimally and precisely as possible):

In /etc/resolv.conf, the search list has at least 5 domain names, options ndots > 1

**Anything else do we need to know**:

When google.com considered a incomplete domain name(less than 2 dots), the DNS try all 5 combinations,  but won't try it (google.com) as a absolute domain name.

**Comment by MrHohn** [comment]
Could your provide more detail about the pod you ran nslookup on? What base image it used?

Were the internal DNS addresses resolvable?

**Comment by colachg** [comment]
@MrHohn 
base image is node:latest
Yes,internal DNS addresses are resolvable.

**Comment by MrHohn** [comment]
@colachg I tried to reproduce using `node:latest` but failed. Below is what I got:
```
$ kubectl run dnstest --image=node:latest --command sleep 36000
deployment "dnstest" created
$ kubectl get pods
NAME                       READY     STATUS    RESTARTS   AGE
dnstest-2456393214-rzblj   1/1       Running   0          20s
$ kubectl exec -it dnstest-2456393214-rzblj -- sh -c "apt-get update && apt-get install dnsutils -y"
... # omit outputs
$ kubectl exec dnstest-2456393214-rzblj -- cat /etc/resolv.conf
search default.svc.cluster.local svc.cluster.local cluster.local my.domain1 my.domain2
nameserver 10.0.0.10
options ndots:5
$ kubectl exec dnstest-2456393214-rzblj -- nslookup google.com
Server:         10.0.0.10
Address:        10.0.0.10#53

Non-authoritative answer:
Name:   google.com
Address: 173.194.74.113
Name:   google.com
Address: 173.194.74.101
Name:   google.com
Address: 173.194.74.139
Name:   google.com
Address: 173.194.74.138
Name:   google.com
Address: 173.194.74.102
Name:   google.com
Address: 173.194.74.100
```

Are you using bare metal, or which cloud provider are you on?
And could you show the YAML file created that pod?

**Comment by colachg** [comment]
@MrHohn  Thank you for comment. I am using bare metal.I run all the commands above with minikube, it reproduces again.
`minikube start`
This time, I use **alpine:latest** to reproduce.
```
$ kubectl run  dnstest --image=alpine:latest --command sleep 36000
deployment "dnstest" created
$ kubectl get po
NAME                       READY     STATUS    RESTARTS   AGE
dnstest-3357646667-1ksfm   1/1       Running   0          51s
$ kubectl exec -it dnstest-3357646667-1ksfm -- cat /etc/resolv.conf
search default.svc.cluster.local svc.cluster.local cluster.local my.domain.com my.domain2.com
nameserver 10.0.0.10
options ndots:5
$ kubectl exec -it dnstest-3357646667-1ksfm -- nslookup google.com
nslookup: can't resolve '(null)': Name does not resolve

nslookup: can't resolve 'google.com': Name does not resolve

```
**make sure there are 5 domains in /etc/resolve.conf, that's the key point for me to reproduce.**

**Comment by MrHohn** [comment]
A quick question, is google.com resolvable outside of the pod(on the same node)?

And by indicating 5 domains in the search path, do you mean it works if there are less than 5? May be could use [this trick](https://github.com/kubernetes/kubernetes/pull/35525#issuecomment-257919311) to verify.

**Comment by MrHohn** [comment]
And could probably check the logs from pod kube-dns by using `kubectl logs` command (mostly from the container `kubedns` and `dnsmasq`).

**Comment by colachg** [comment]
@MrHohn 
```
docker@minikube:~$ nslookup google.com
Server:    10.0.2.3
Address 1: 10.0.2.3

Name:      google.com
Address 1: 216.58.197.174 nrt12s02-in-f174.1e100.net
Address 2: 2404:6800:4004:801::200e nrt12s02-in-x0e.1e100.net
```
`kubectl logs ` is my first debug method,I can't find anything abnormal.

If there are less than 5 search domains, it works fine.so I use tshark to trace the network traffic and find that it only resolves 5 times.

I use `kubelet --resolve-conf="/my custom resolve.conf"` to reduce search domains to less than 5.
I solve the problem.

**Comment by MrHohn** [comment]
Thanks for the details. I literally span up a cluster with ubuntu 16.04.1 LTS using kubeadm. But still failed to reproduce the issue (with 5 domains in search path).

Add @bowei in loop.

**Comment by bowei** [comment]
Can you post your full `resolve.conf` or an equivalent?

**Comment by MrHohn** [comment]
And could you please also try something like `nslookup -debug google.com` or `dig +showsearch google.com` to confirm what the exact requests are sent out?

**Comment by cmluciano** [comment]
/close

closing due to inactivity

**Comment by Marcofeli** [comment]
Hi I have a similar problem too. Using a `busybox` image I'm unable to connect via `telnet` to the `smtp.gmail.com` host. Also with an `ubuntu` image I cannot `apt-get update` inside the pod. Besides, same behavior is presented with `alpine` and the `nslookup google.com` command exposed by @colachg 

### Busybox Image:

```
$ kubectl run busybox --image=busybox:latest --command sleep 36000
deployment.apps/busybox created
$ kubectl get pods
NAME                       READY   STATUS    RESTARTS   AGE
busybox-7675ff88dc-j5lns   1/1     Running   0          47s
ubuntu@infonovus-k8s-master:~$ kubectl exec -it busybox-7675ff88dc-j5lns sh
$ kubectl exec -it busybox-7675ff88dc-j5lns sh
/ # telnet smtp.gmail.com 25
telnet: bad address 'smtp.gmail.com'
```

### Ubuntu Image:

```
$ kubectl run ubuntu --image=ubuntu:16.04 --command sleep 36000
deployment.apps/ubuntu created
$ kubectl get pods
NAME                       READY   STATUS    RESTARTS   AGE
ubuntu-c55b8cbcb-bsz4s     1/1     Running   0          40s
$ kubectl exec -it ubuntu-c55b8cbcb-bsz4s bash
/# apt-get update
Err:1 http://archive.ubuntu.com/ubuntu xenial InRelease
  Temporary failure resolving 'archive.ubuntu.com'
Err:2 http://security.ubuntu.com/ubuntu xenial-security InRelease
  Temporary failure resolving 'security.ubuntu.com'
Err:3 http://archive.ubuntu.com/ubuntu xenial-updates InRelease
  Temporary failure resolving 'archive.ubuntu.com'
Err:4 http://archive.ubuntu.com/ubuntu xenial-backports InRelease
  Temporary failure resolving 'archive.ubuntu.com'
Reading package lists... Done
W: Failed to fetch http://archive.ubuntu.com/ubuntu/dists/xenial/InRelease  Temporary failure resolving 'archive.ubuntu.com'
W: Failed to fetch http://archive.ubuntu.com/ubuntu/dists/xenial-updates/InRelease  Temporary failure resolving 'archive.ubuntu.com'
W: Failed to fetch http://archive.ubuntu.com/ubuntu/dists/xenial-backports/InRelease  Temporary failure resolving 'archive.ubuntu.com'
W: Failed to fetch http://security.ubuntu.com/ubuntu/dists/xenial-security/InRelease  Temporary failure resolving 'security.ubuntu.com'
W: Some index files failed to download. They have been ignored, or old ones used instead.
```

### Alpine Image:

```
$ kubectl run  alpine --image=alpine:latest --command sleep 36000
deployment "alpine" created
$ kubectl get pods
NAME                       READY     STATUS    RESTARTS   AGE
alpine-7857f89598-mwg5d   1/1       Running   0          16s
$ kubectl exec -it alpine-7857f89598-mwg5d sh
/# nslookup google.com
nslookup: can't resolve '(null)': Name does not resolve

nslookup: can't resolve 'google.com': Name does not resolve
```

By the way, all these test were made on bare metal with kubernetes `1.17`, but same problem appears on kubernetes `1.14`. Also I've tested it on a AWS environment and same problems appear.

I've used `Calico` as network plugin as pointed on this [https://github.com/kubernetes/kubernetes/issues/64448](issue) but problems are the same.

**Comment by colachg** [comment]
Time flies fast, it's 3 years ago but I remember this :). 
@Marcofeli 
Firstly I think you can use tcpdump to catch dns packages to find the real domains it queried.  
Then try to modify the `/etc/resolve.conf` to figure this out.  
Finally I remember I fixed it by specifying custom `resolve.conf` at kubelet start conf.
Good lucks to you :）

**Comment by Marcofeli** [comment]
Hi @colachg thanks for the reply 😃

I'm really new with `tcpdump` but I tried with the following command

```
sudo tcpdump -i enp0s3 port 25 
```

Inside the kubernetes `node` I made a 

```
telnet smtp.gmail.com 25
```


And got he following response:

```
tcpdump: verbose output suppressed, use -v or -vv for full protocol decode
listening on enp0s3, link-type EN10MB (Ethernet), capture size 262144 bytes
09:50:34.835220 IP 192.168.189.67.12706 > vh-in-f108.1e100.net.smtp: Flags [S], seq 3849093620, win 29200, options [mss 1460,sackOK,TS val 1268738 ecr 0,nop,wscale 7], length 0
09:50:34.902585 IP vh-in-f108.1e100.net.smtp > 192.168.189.67.12706: Flags [S.], seq 3846399543, ack 3849093621, win 62392, options [mss 1430,sackOK,TS val 166518268 ecr 1268738,nop,wscale 8], length 0
09:50:34.902630 IP 192.168.189.67.12706 > vh-in-f108.1e100.net.smtp: Flags [.], ack 1, win 229, options [nop,nop,TS val 1268755 ecr 166518268], length 0
09:50:34.902794 IP 192.168.189.67.12706 > vh-in-f108.1e100.net.smtp: Flags [P.], seq 1:3, ack 1, win 229, options [nop,nop,TS val 1268755 ecr 166518268], length 2: SMTP:
09:50:34.970348 IP vh-in-f108.1e100.net.smtp > 192.168.189.67.12706: Flags [.], ack 3, win 244, options [nop,nop,TS val 166518336 ecr 1268755], length 0
09:50:35.032857 IP vh-in-f108.1e100.net.smtp > 192.168.189.67.12706: Flags [P.], seq 1:53, ack 3, win 244, options [nop,nop,TS val 166518393 ecr 1268755], length 52: SMTP: 220 smtp.gmail.com ESMTP f17sm857583uaq.19 - gsmtp
09:50:35.032922 IP 192.168.189.67.12706 > vh-in-f108.1e100.net.smtp: Flags [.], ack 53, win 229, options [nop,nop,TS val 1268787 ecr 166518393], length 0
```

Then, inside my `pod` I tried the same `telnet` command but now I got no response from `tcpdump`

Could you detail more which changes you made to the `resolve.conf` file?


Thanks again for the help!

**Comment by colachg** [comment]
Hi @Marcofeli please check below links:
- https://kubernetes.io/docs/tasks/administer-cluster/dns-debugging-resolution/#known-issues
- https://kubernetes.io/docs/tasks/administer-cluster/kubelet-config-file/#start-a-kubelet-process-configured-via-the-config-file
- https://kubernetes.io/docs/tasks/administer-cluster/dns-custom-nameservers/#introduction

I deploy kubernetes on Ubuntu, the kubelet start conf is under `/etc/systemd/system/kubelet.service.d` and I think you can aopend your custom path of `resolve.conf` to `Environment="KUBELET_DNS_ARGS=--cluster-dns=10.96.0.10 --cluster-domain=cluster.local" --resolve.conf=/path/to/custom/resolve.conf`

Good lucks!

**Comment by Marcofeli** [comment]
Thanks @colachg you really saved my live! 😁

**Comment by Prashanth-M** [comment]
@colachg @Marcofeli I'm also facing same issue.
How do we find the proper resolv.conf??
In my case some pods are working, some pods are throwing the same error as above. both pods /etc/resolv.conf is looks same.

resolv.conf
`nameserver 10.96.0.10                     

 search abc-services.svc.cluster.local svc.cluster.local cluster.local ap-south-1.compute.internal
 options ndots:5
`

**Comment by Prashanth-M** [comment]
> Hi @Marcofeli please check below links:
> 
> * https://kubernetes.io/docs/tasks/administer-cluster/dns-debugging-resolution/#known-issues
> * https://kubernetes.io/docs/tasks/administer-cluster/kubelet-config-file/#start-a-kubelet-process-configured-via-the-config-file
> * https://kubernetes.io/docs/tasks/administer-cluster/dns-custom-nameservers/#introduction
> 
> I deploy kubernetes on Ubuntu, the kubelet start conf is under `/etc/systemd/system/kubelet.service.d` and I think you can append your custom path of `resolve.conf` to `Environment="KUBELET_DNS_ARGS=--cluster-dns=10.96.0.10 --cluster-domain=cluster.local" --resolv-conf=/path/to/custom/resolve.conf`
> 
> Good lucks!

have you done this changes on all node?? 
I have tried with one worker, but still failing connectivity.

**Comment by colachg** [comment]
https://github.com/kubernetes/kubernetes/issues/64924
