### ISSUE TITLE
pods can not reach endpoints in the same node, for UDP services, if they are using hostNetwork

### ISSUE THREAD

**Issue by aojea** [kubernetes/kubernetes#95565]
**What happened**:

Pods can not reach endpoints using hostNetwork: true that run in the same node.

**What you expected to happen**:

It works for TCP, so it should work for UDP too

**How to reproduce it (as minimally and precisely as possible)**:

Deploy a service with endpoints using hostNetwork: true
```
kubectl apply -f https://gist.githubusercontent.com/aojea/ee37cc43f2513afbf5918c7ffddd807d/raw/b01b800b333539044d9c81eab232edab9fd5718a/svc-hostnet.yml
```

Create an UDP service too, using that deployment

Run a container to probe the service:
```
kubectl run testpod -it --image alpine -- ash
```

And from there test the service, it will return the endpoint hostname:
```
echo hostname | nc svcip svcport
```
and
```
curl http://svcip:svcport/hostname
```

The pod can not reach the endpoint in the same node for the UDP service, it works for the TCP service
The pod can always reach the endpoint in the other node

**Anything else we need to know?**:

It was detected in this PR trying to add coverage to network scenarios where the service backend pods are using hostNetwork: true

https://github.com/kubernetes/kubernetes/pull/94812

More detailed explanations:
- https://github.com/kubernetes/kubernetes/pull/94812#issuecomment-708264308
- https://gist.github.com/aojea/72de8754bc20e7f8f930d0d6cf31b82b

**Comment by uablrek** [comment]
I can't reproduce this problem on;
```
  08:50:47 Server Version: v1.19.4
  08:50:47 CNI-plugin; calico/cni:v3.16.0
  08:50:47 Proxy-mode: "iptables"
  08:50:47 Dual-stack cluster. BaseFamily=IPv4, old dual-stack API
```
Nor with Proxy-mode:ipvs.

Can this problem be CNI-plugin related?

**Comment by aojea** [comment]
> I can't reproduce this problem on;
> 
> ```
>   08:50:47 Server Version: v1.19.4
>   08:50:47 CNI-plugin; calico/cni:v3.16.0
>   08:50:47 Proxy-mode: "iptables"
>   08:50:47 Dual-stack cluster. BaseFamily=IPv4, old dual-stack API
> ```
> 
> Nor with Proxy-mode:ipvs.
> 
> Can this problem be CNI-plugin related?

or kube-proxy iptables?

**Comment by uablrek** [comment]
No. I have tried with a daemonset and get replies from all server, including the local one. Both in a hostNetwor:true POD and from main netns on the node (which should be the same thing). And with ipvs and iptables.

It would be good if someone else can try it on calico so I havnt done some mistake.

**Comment by aojea** [comment]
> It would be good if someone else can try it on calico so I havnt done some mistake.

There is an e2e test for that, I' ve added an skip, but is just removing the skip and run it ... but it failed on KIND jobs and GCE jobs, don' t know which CNI use the GCE jobs though
https://github.com/kubernetes/kubernetes/blob/e1c617a88ec286f5f6cb2589d6ac562d095e1068/test/e2e/network/networking.go#L469-L485

**Comment by uablrek** [comment]
I have investigated some more and I can't reproduce the problem but I _can_ provoke a similar one. I have now switched to a simple bridge CNI-plugin setup for more control and K8s "master", proxy-mode=ipvs. For udp traffic to a local POD packets are routed to the local `crb0` device. Example;
```
$ kubectl get svc mserver-udp
NAME          TYPE           CLUSTER-IP   EXTERNAL-IP   PORT(S)          AGE
mserver-udp   LoadBalancer   12.0.73.49   <pending>     5001:31402/UDP   21m
$ tcpdump -ni cbr0
07:44:37.009658 IP 11.0.2.1.45605 > 11.0.2.4.5001: UDP, length 5
07:44:37.010233 IP 11.0.2.4.5001 > 12.0.73.49.51955: UDP, length 13
```
The request is NAT'ed by ipvs to the ip of the local POD, the reply is NAT'ed back to the VIP (12.0.73.49). Everything works.

#### But...

```
$ sysctl -w net.bridge.bridge-nf-call-iptables=1
# Same test-case;
$ tcpdump -ni cbr0
07:44:06.124440 IP 11.0.2.1.59134 > 11.0.2.4.5001: UDP, length 5
07:44:06.125130 IP 11.0.2.4.5001 > 11.0.2.1.59134: UDP, length 13
```
_The VIP is not NAT'ed back!_

Return traffic reaches the application but with incorrect addresses. Most programs will dismiss that traffic as spoofing or stray packets.

Could traffic actually reach the endpoint but the reply have incorrect addresses and be dismissed by `curl`?

If so, check sysctl `net.bridge.bridge-nf-call-iptables`.

I have had this problem myself. The symptom was that DNS lookup failed if CoreDNS happened to be on the same node. Note that installation with `kubeadm` fixes this in some way.

**Comment by uablrek** [comment]
**Ooops**, I think I have missed the problem entirely here. The UDP servers are in `hostNetwork:True`, not the client as I assumed.

Sorry about that, please ignore my comments.

**Comment by uablrek** [comment]
Now I got it. Trace from within a "normal" POD to a service with endpoints in hostNetwork;
```
08:35:06.725996 IP 11.0.2.3.50509 > 12.0.211.164.5001: UDP, length 5
08:35:06.726321 IP 11.0.2.1.5001 > 11.0.2.3.50509: UDP, length 6
08:35:06.726387 IP 11.0.2.3 > 11.0.2.1: ICMP 11.0.2.3 udp port 50509 unreachable, length 42
```
The POD responds with "port unreachable", but the port exists. The src is not the VIP which is wrong, maybe that trigs the icmp.

**Comment by aojea** [comment]
The CNIs I´ve been using use ptp interface not bridge.

My observation was that the packet from the testpod to the hostnetwork endpoint pod worked, is the answer that never get reverse natted, so I think that is something related to conntrack (the nat kernel code uses the conntrack table to know if it has to reverse the nat)

https://gist.github.com/aojea/72de8754bc20e7f8f930d0d6cf31b82b

**Comment by aojea** [comment]
@uablrek sorry for not being able to see this before, you are right on this

> The src is not the VIP which is wrong, maybe that trigs the icmp.

Kudos to @fedepaol for resolving this enigma, it turns out that, if we consider UDP and the app stateless, it is working as expected.

Lars trace is ok for this:
1. pods sends UDP packet to the service 
11.0.2.3:5059 -> 12.0.211.164:5001
2. service is DNATed to the endpoint, that is a process in the same host. This endpoint is the HostIP, Hostnetwork pods use the HostIP
11.0.3.3:5059 -> HostIP:EndpointPort
3. Here is the magic, the agnhost process receives the udp packet and replies
11.0.2.1:5001 -> 11.0.2.3:5059
There is no DNAT, because the source IP is different.

Since UDP is stateless and we didn´t implemented the concept of UDP session in agnhost, this is working as expected, it is using the default route to choose the source IP.
http://linux-ip.net/html/routing-saddr-selection.html

So, in order to make this scenario work or the UDP app binds to an specific IP or it uses raw sockets to reply with the same IP that the initial packet.

I´m going to close it as working as expected, thank you very much Federico @fedepaol for your 
/close

**Comment by fedepaol** [comment]
@aojea if there's agreement in how to change udp listeners (at least for host network pods), I'd be happy to fix the test.
