### ISSUE TITLE
DNS almost entirely failing on single Kubernetes node only

### ISSUE THREAD

**Issue by willthames** [kubernetes/kubernetes#66432]
**Is this a BUG REPORT or FEATURE REQUEST?**:

/kind bug

**What happened**:

On a single node only, DNS is almost entirely failing to work

**What you expected to happen**:

DNS to always work

**How to reproduce it (as minimally and precisely as possible)**:

```
# while true; do ping -W 2 dl-cdn.alpinelinux.org -c 1; sleep 3; done
ping: bad address 'dl-cdn.alpinelinux.org'
ping: bad address 'dl-cdn.alpinelinux.org'
ping: bad address 'dl-cdn.alpinelinux.org'
PING dl-cdn.alpinelinux.org (151.101.52.249): 56 data bytes

--- dl-cdn.alpinelinux.org ping statistics ---
1 packets transmitted, 0 packets received, 100% packet loss
ping: bad address 'dl-cdn.alpinelinux.org'
ping: bad address 'dl-cdn.alpinelinux.org'
ping: bad address 'dl-cdn.alpinelinux.org'
ping: bad address 'dl-cdn.alpinelinux.org'
ping: bad address 'dl-cdn.alpinelinux.org'
```

So in that test DNS resolution succeeded one time out of 9. (This seems to be worse since I tried earlier where it was more like 50/50). On all other nodes, DNS resolution seems to be working fine. 

This problem is the same whether we are looking up cluster addresses or external addresses. 

DNS is gcr.io/google_containers/k8s-dns-kube-dns-amd64:1.14.10 

Testing the network seems to be fine. 

If I do curl http://www.google.com/ repeatedly, then I get some results and some DNS failures
If I do curl http://216.58.199.68/ repeatedly, then I get the expected 301 moved response

**Anything else we need to know?**:
```
$ kubectl get nodes -o wide
NAME                                          STATUS                     ROLES     AGE       VERSION   EXTERNAL-IP   OS-IMAGE                       KERNEL-VERSION   CONTAINER-RUNTIME
ip-172-18-12-137.us-west-2.compute.internal   Ready                      master    2d        v1.9.7    <none>        Debian GNU/Linux 8 (jessie)    4.4.121-k8s      docker://17.3.2
ip-172-18-12-222.us-west-2.compute.internal   Ready                      node      2d        v1.9.7    <none>        Debian GNU/Linux 9 (stretch)   4.9.0-6-amd64    docker://17.3.2
ip-172-18-13-173.us-west-2.compute.internal   Ready                      master    4d        v1.9.7    <none>        Debian GNU/Linux 8 (jessie)    4.4.121-k8s      docker://17.3.2
ip-172-18-13-186.us-west-2.compute.internal   Ready,SchedulingDisabled   node      2d        v1.9.7    <none>        Debian GNU/Linux 9 (stretch)   4.9.0-6-amd64    docker://17.3.2
ip-172-18-13-187.us-west-2.compute.internal   Ready                      node      5h        v1.9.7    <none>        Debian GNU/Linux 9 (stretch)   4.9.0-6-amd64    docker://17.3.2
ip-172-18-13-242.us-west-2.compute.internal   Ready                      node      1h        v1.9.7    <none>        Debian GNU/Linux 9 (stretch)   4.9.0-6-amd64    docker://17.3.2
ip-172-18-13-44.us-west-2.compute.internal    Ready,SchedulingDisabled   node      5h        v1.9.7    <none>        Debian GNU/Linux 9 (stretch)   4.9.0-6-amd64    docker://17.3.2
ip-172-18-14-15.us-west-2.compute.internal    Ready                      master    4d        v1.9.7    <none>        Debian GNU/Linux 8 (jessie)    4.4.121-k8s      docker://17.3.2
ip-172-18-14-7.us-west-2.compute.internal     Ready                      node      9d        v1.9.7    <none>        Debian GNU/Linux 9 (stretch)   4.9.0-6-amd64    docker://17.3.2
```

The node is ip-172-18-13-186.us-west-2.compute.internal, it's cordoned so that we can keep troubleshooting but avoid unexpected issues. Pods left remaining on the node still exhibit the issue.

**Environment**:
- Kubernetes version (use `kubectl version`):
  Client Version: version.Info{Major:"1", Minor:"10", GitVersion:"v1.10.4", GitCommit:"5ca598b4ba5abb89bb773071ce452e33fb66339d", GitTreeState:"clean", BuildDate:"2018-06-06T15:22:13Z", GoVersion:"go1.9.6", Compiler:"gc", Platform:"darwin/amd64"}
Server Version: version.Info{Major:"1", Minor:"9", GitVersion:"v1.9.7", GitCommit:"dd5e1a2978fd0b97d9b78e1564398aeea7e7fe92", GitTreeState:"clean", BuildDate:"2018-04-18T23:58:35Z", GoVersion:"go1.9.3", Compiler:"gc", Platform:"linux/amd64"}

- Cloud provider or hardware configuration:
   AWS m5.large
- OS (e.g. from /etc/os-release):
  ```
PRETTY_NAME="Debian GNU/Linux 9 (stretch)"
NAME="Debian GNU/Linux"
VERSION_ID="9"
VERSION="9 (stretch)"
ID=debian
HOME_URL="https://www.debian.org/"
SUPPORT_URL="https://www.debian.org/support"
BUG_REPORT_URL="https://bugs.debian.org/"
```
- Kernel (e.g. `uname -a`):
   Linux ip-172-18-13-186 4.9.0-6-amd64 #1 SMP Debian 4.9.88-1+deb9u1 (2018-05-07) x86_64 GNU/Linux

- Install tools: kops
- Others:

**Comment by fturib** [comment]
@chrisohaver , @MrHohn  - FYI.

**Comment by chrisohaver** [comment]
Do you have better results with tcp?  e.g. `dig www.google.com +tcp`

**Comment by willthames** [comment]
I left the node running over the weekend so that I could further diagnose this now it's Monday but the DNS is now working perfectly again which is frustrating - would have liked to have got further to the bottom of this.

**Comment by willthames** [comment]
@chrisohaver having managed to reproduce this again during another attempt at a 1.9.7 to 1.9.9 upgrade, I can finally answer 'no':

```
# dig www.google.com +tcp
;; Connection to 100.64.0.10#53(100.64.0.10) for www.google.com failed: timed out.
```

**Comment by willthames** [comment]
With tcpdump

```
# host www.google.com 
03:34:39.195821 IP alpine-network-tools.43468 > 100.64.0.10.53: 3064+ A? www.google.com.monitoring.svc.cluster.local. (61)
03:34:39.197286 IP 100.64.0.10.53 > alpine-network-tools.43468: 3064 NXDomain 0/1/0 (154)
03:34:39.197628 IP alpine-network-tools.51957 > 100.64.0.10.53: 50905+ A? www.google.com.svc.cluster.local. (50)
03:34:39.198892 IP 100.64.0.10.53 > alpine-network-tools.51957: 50905 NXDomain 0/1/0 (143)
03:34:39.199625 IP alpine-network-tools.60696 > 100.64.0.10.53: 5042+ A? www.google.com.cluster.local. (46)
03:34:44.199659 IP alpine-network-tools.60696 > 100.64.0.10.53: 5042+ A? www.google.com.cluster.local. (46)
;; connection timed out; no servers could be reached
```

From the kubedns side with verbosity ramped up:

```
$ stern -n kube-system -c kubedns kube-dns  --tail 100 | grep google
+ kube-dns-7d677cfbc5-k2pzh › kubedns
+ kube-dns-7d677cfbc5-gv68k › kubedns
kube-dns-7d677cfbc5-gv68k kubedns I0730 03:34:39.195126       1 dns.go:637] Query for "www.google.com.monitoring.svc.cluster.local.", exact: false
kube-dns-7d677cfbc5-gv68k kubedns I0730 03:34:39.195159       1 dns.go:866] Not a federation query: len(["www" "google" "com" "monitoring" "svc" "cluster" "local"]) != 4+len(["local" "cluster"])
kube-dns-7d677cfbc5-gv68k kubedns I0730 03:34:39.195179       1 dns.go:757] Found 0 records for [local cluster svc monitoring com google www] in the cache
kube-dns-7d677cfbc5-gv68k kubedns I0730 03:34:39.195188       1 dns.go:764] getRecordsForPath retval=[], path=[local cluster svc monitoring com google www]
kube-dns-7d677cfbc5-gv68k kubedns I0730 03:34:39.195194       1 dns.go:670] No record found for www.google.com.monitoring.svc.cluster.local.
kube-dns-7d677cfbc5-gv68k kubedns I0730 03:34:39.196804       1 dns.go:637] Query for "www.google.com.svc.cluster.local.", exact: false
kube-dns-7d677cfbc5-gv68k kubedns I0730 03:34:39.196838       1 dns.go:757] Found 0 records for [local cluster svc com google www] in the cache
kube-dns-7d677cfbc5-gv68k kubedns I0730 03:34:39.196851       1 dns.go:764] getRecordsForPath retval=[], path=[local cluster svc com google www]
kube-dns-7d677cfbc5-gv68k kubedns I0730 03:34:39.196861       1 dns.go:670] No record found for www.google.com.svc.cluster.local.
```

So the query is being sent out but not received by kube-dns.

**Comment by willthames** [comment]
Looks like one of our kube-dns pods (of two) is responding but the other isn't:

```
# conntrack -L | grep 'port=53 '
conntrack v1.4.4 (conntrack-tools): 252 flow entries have been shown.
udp      17 20 src=100.113.59.141 dst=100.64.0.10 sport=43666 dport=53 [UNREPLIED] src=100.124.179.99 dst=100.113.59.141 sport=53 dport=43666 mark=0 use=1
udp      17 25 src=100.113.59.141 dst=100.64.0.10 sport=54184 dport=53 src=100.102.3.253 dst=100.113.59.141 sport=53 dport=54184 mark=0 use=1
udp      17 5 src=100.113.59.141 dst=100.64.0.10 sport=51338 dport=53 src=100.102.3.253 dst=100.113.59.141 sport=53 dport=51338 mark=0 use=1
udp      17 15 src=100.113.59.141 dst=100.64.0.10 sport=46727 dport=53 src=100.102.3.253 dst=100.113.59.141 sport=53 dport=46727 mark=0 use=1
udp      17 25 src=100.113.59.141 dst=100.64.0.10 sport=39206 dport=53 [UNREPLIED] src=100.124.179.99 dst=100.113.59.141 sport=53 dport=39206 mark=0 use=1
udp      17 10 src=100.113.59.141 dst=100.64.0.10 sport=55265 dport=53 [UNREPLIED] src=100.124.179.99 dst=100.113.59.141 sport=53 dport=55265 mark=0 use=1
udp      17 0 src=100.113.59.141 dst=100.64.0.10 sport=49065 dport=53 [UNREPLIED] src=100.124.179.99 dst=100.113.59.141 sport=53 dport=49065 mark=0 use=2
udp      17 5 src=100.113.59.141 dst=100.64.0.10 sport=58615 dport=53 src=100.102.3.253 dst=100.113.59.141 sport=53 dport=58615 mark=0 use=1
udp      17 15 src=100.113.59.141 dst=100.64.0.10 sport=47337 dport=53 src=100.102.3.253 dst=100.113.59.141 sport=53 dport=47337 mark=0 use=1
```

**Comment by willthames** [comment]
iptables rules on the source node look reasonable and pointing at the right places

```
# iptables -t nat -nL -v | grep dns
    0     0 KUBE-MARK-MASQ  all  --  *      *       100.124.179.99       0.0.0.0/0            /* kube-system/kube-dns:dns */
    2   148 DNAT       udp  --  *      *       0.0.0.0/0            0.0.0.0/0            /* kube-system/kube-dns:dns */ udp to:100.124.179.99:53
    0     0 KUBE-MARK-MASQ  all  --  *      *       100.102.3.253        0.0.0.0/0            /* kube-system/kube-dns:dns-tcp */
    0     0 DNAT       tcp  --  *      *       0.0.0.0/0            0.0.0.0/0            /* kube-system/kube-dns:dns-tcp */ tcp to:100.102.3.253:53
    0     0 KUBE-MARK-MASQ  all  --  *      *       100.102.3.253        0.0.0.0/0            /* kube-system/kube-dns:dns */
    4   334 DNAT       udp  --  *      *       0.0.0.0/0            0.0.0.0/0            /* kube-system/kube-dns:dns */ udp to:100.102.3.253:53
    0     0 KUBE-MARK-MASQ  all  --  *      *       100.124.179.99       0.0.0.0/0            /* kube-system/kube-dns:dns-tcp */
    0     0 DNAT       tcp  --  *      *       0.0.0.0/0            0.0.0.0/0            /* kube-system/kube-dns:dns-tcp */ tcp to:100.124.179.99:53
    0     0 KUBE-MARK-MASQ  udp  --  *      *      !100.96.0.0/11        100.64.0.10          /* kube-system/kube-dns:dns cluster IP */ udp dpt:53
    6   482 KUBE-SVC-TCOU7JCQXEZGVUNU  udp  --  *      *       0.0.0.0/0            100.64.0.10          /* kube-system/kube-dns:dns cluster IP */ udp dpt:53
    0     0 KUBE-MARK-MASQ  tcp  --  *      *      !100.96.0.0/11        100.64.0.10          /* kube-system/kube-dns:dns-tcp cluster IP */ tcp dpt:53
    0     0 KUBE-SVC-ERIFXISQEP7F7OF4  tcp  --  *      *       0.0.0.0/0            100.64.0.10          /* kube-system/kube-dns:dns-tcp cluster IP */ tcp dpt:53
    0     0 KUBE-SEP-JKFKB5EIK7OPSLS3  all  --  *      *       0.0.0.0/0            0.0.0.0/0            /* kube-system/kube-dns:dns-tcp */ statistic mode random probability 0.50000000000
    0     0 KUBE-SEP-TYHUMF3YLNJJJ6NB  all  --  *      *       0.0.0.0/0            0.0.0.0/0            /* kube-system/kube-dns:dns-tcp */
    4   334 KUBE-SEP-QZGKA7GH7GE5X4KW  all  --  *      *       0.0.0.0/0            0.0.0.0/0            /* kube-system/kube-dns:dns */ statistic mode random probability 0.50000000000
    2   148 KUBE-SEP-4WBEUYPDNAJO63ZX  all  --  *      *       0.0.0.0/0            0.0.0.0/0            /* kube-system/kube-dns:dns */
```

**Comment by willthames** [comment]
Note also that this seems to be a different issue to https://github.com/weaveworks/weave/issues/3287 - our `insert_failed` count is not increasing at all (it could be that we're hitting a similar issue due to parallel udp calls that isn't manifesting in the same way)

```
# conntrack -S
cpu=0   	found=0 invalid=6 ignore=74053 insert=0 insert_failed=0 drop=0 early_drop=0 error=0 search_restart=10 
cpu=1   	found=0 invalid=4 ignore=18105 insert=0 insert_failed=0 drop=0 early_drop=0 error=0 search_restart=0 
cpu=2   	found=3 invalid=0 ignore=4285 insert=0 insert_failed=1 drop=1 early_drop=0 error=0 search_restart=3 
cpu=3   	found=0 invalid=2 ignore=3721 insert=0 insert_failed=0 drop=0 early_drop=0 error=0 search_restart=2 
```

**Comment by willthames** [comment]
@chrisohaver the [logs from kube-dns](https://github.com/kubernetes/kubernetes/issues/66432#issuecomment-408738256) suggest that it's not receiving the request

**Comment by willthames** [comment]
This bug is actually due to SourceDestinationCheck being true on the EC2 nodes. That is caused because k8s-ec2-srcdst container sometimes crashes due to a bug gathering node information following node deletion - any new nodes created after that crash will see this issue, manifesting in not being able to talk to endpoints only in the *same* subnet. 

k8s-ec2-srcdst crash is fixed in https://github.com/ottoyiu/k8s-ec2-srcdst/issues/9, and I've raised https://github.com/kubernetes/kops/pull/5746 to update kops to use the fixed k8s-ec2-srcdst

**Comment by chrisohaver** [comment]
@willthames, Thanks for following up!
