### ISSUE TITLE
Pod dnsConfig.searches should be allowed setting "search" to a dot.

### ISSUE THREAD

**Issue by zengyuxing007** [kubernetes/kubernetes#125883]
### What happened?

```yaml
apiVersion: v1
kind: Pod
metadata:
  name: test
  namespace: default
spec:
  containers:
  - image: alpine
    command:
      - sleep
      - "10000"
    imagePullPolicy: Always
    name: alpine
  dnsPolicy: None
  dnsConfig:
    nameservers:
    - "192.168.0.10"
    searches:
    - .
    - default.svc.cluster.local
    - svc.cluster.local
    - cluster.local
    options:
    - name: ndots
      value: "3"
```

Applying this pod YAML to Kubernetes will result in an error like this:

```shell
The Pod "test" is invalid: spec.dnsConfig.searches[0]: Invalid value: "": a lowercase RFC 1123 subdomain must consist of lower case alphanumeric characters, '-' or '.', and must start and end with an alphanumeric character (e.g. 'example.com', regex used for validation is '[a-z0-9]([-a-z0-9]*[a-z0-9])?(\.[a-z0-9]([-a-z0-9]*[a-z0-9])?)*')
```

It seems unreasonable because the /etc/resolv.conf file allows a configuration with a dot, and it can be very meaningful in specific scenarios.

### What did you expect to happen?

no error

### How can we reproduce it (as minimally and precisely as possible)?

```yaml
apiVersion: v1
kind: Pod
metadata:
  name: test
  namespace: default
spec:
  containers:
  - image: alpine
    command:
      - sleep
      - "10000"
    imagePullPolicy: Always
    name: alpine
  dnsPolicy: None
  dnsConfig:
    nameservers:
    - "192.168.0.10"
    searches:
    - .
    - default.svc.cluster.local
    - svc.cluster.local
    - cluster.local
    options:
    - name: ndots
      value: "3"
```
apply this yaml to kubernetes

### Kubernetes version

<details>

```console
$ kubectl version
# paste output here
```

</details>

### Cloud provider

<details>
any
</details>

### OS version

<details>

```console
# On Linux:
$ cat /etc/os-release
# paste output here
$ uname -a
# paste output here

# On Windows:
C:\> wmic os get Caption, Version, BuildNumber, OSArchitecture
# paste output here
```

</details>

### Install tools

<details>

</details>

### Container runtime (CRI) and version (if applicable)

<details>

</details>

### Related plugins (CNI, CSI, ...) and versions (if applicable)

<details>

</details>

**Comment by pranav-pandey0804** [comment]
hi @zengyuxing007  
I encountered the error when setting dnsConfig.searches to a dot (".") in a Pod spec. Here’s the error:

```The Pod "test" is invalid: spec.dnsConfig.searches[0]: Invalid value: "": a lowercase RFC 1123 subdomain must consist of lower case alphanumeric characters, '-' or '.', and must start and end with an alphanumeric character (e.g. 'example.com', regex used for validation is '[a-z0-9]([-a-z0-9]*[a-z0-9])?(\.[a-z0-9]([-a-z0-9]*[a-z0-9])?)*')```

This seems inconsistent with Unix /etc/resolv.conf standards.

**Comment by pranav-pandey0804** [comment]
Could we look into aligning Kubernetes' DNS config validations with these Unix standards?

**Comment by pranav-pandey0804** [comment]
Given the potential for enhancing DNS configuration flexibility in Kubernetes, I believe revising this validation could be valuable. 

Would it be possible to discuss this in an upcoming SIG-Network meeting, or should we consider starting a thread to gather more community feedback?

Thanks for the attention to this !! @zengyuxing007

**Comment by aojea** [comment]
Would it be possible to discuss this in an upcoming SIG-Network meeting, or should we consider starting a thread to gather more community feedback?

absolutely, this issue is the perfect place, it will be nice if you can enhance this issue with more detail so we can have the full context documented.
Since this will require to lose validation on the API it will require a bit more of information to justify this change

> Could we look into aligning Kubernetes' DNS config validations with these Unix standards?

can you provide some references to these standards ?

> it can be very meaningful in specific scenarios.

can you provide some examples of these scenarios? use cases are very valuable

**Comment by zengyuxing007** [comment]
> > Would it be possible to discuss this in an upcoming SIG-Network meeting, or should we consider starting a thread to gather more community feedback?
> 
> absolutely, this issue is the perfect place, it will be nice if you can enhance this issue with more detail so we can have the full context documented. Since this will require to lose validation on the API it will require a bit more of information to justify this change
> 
> > Could we look into aligning Kubernetes' DNS config validations with these Unix standards?
> 
> can you provide some references to these standards ?
> 
> > it can be very meaningful in specific scenarios.
> 
> can you provide some examples of these scenarios? use cases are very valuable

In a cluster, some pods may need to access both external domain names and internal cluster domain names. For external domain names, we do not want glibc to initiate unnecessary internal domain name resolution requests. By configuring the first search domain to be . (a dot), we can avoid this issue.

**Comment by zengyuxing007** [comment]
```yaml
apiVersion: v1
kind: Pod
metadata:
  name: alpine
  namespace: default
spec:
  containers:
  - image: alpine
    command:
      - sleep
      - "10000"
    imagePullPolicy: Always
    name: alpine
  dnsPolicy: ClusterFirst
```
Additionally, if I use the default ClusterFirst DNS policy, with a pod YAML like above. 

Even when I issue a Fully Qualified Domain Name (FQDN) request within this pod (strictly speaking, it's not an FQDN because it doesn't end with a dot), it is still interpreted as a relative name, leading to many unnecessary DNS query attempts. This is not what I expect.


Example:

in the alpine pod, i excuted the command : " ping metrics-server.kube-system.svc.cluster.local "

```shell
[root@alpine /]# ping metrics-server.kube-system.svc.cluster.local
PING metrics-server.kube-system.svc.cluster.local (192.168.124.136) 56(84) bytes of data.
From metrics-server.kube-system.svc.cluster.local (192.168.124.136) icmp_seq=1 Destination Port Unreachable
From metrics-server.kube-system.svc.cluster.local (192.168.124.136) icmp_seq=2 Destination Port Unreachable
```

in another shell, i excuted the tcpdump comand , will see the all dns request like below:
```shell
[root@alipne /]# tcpdump -i eth0 udp port 53 -nn
dropped privs to tcpdump
tcpdump: verbose output suppressed, use -v or -vv for full protocol decode
listening on eth0, link-type EN10MB (Ethernet), capture size 262144 bytes
12:25:14.793158 IP 10.0.176.48.43321 > 192.168.0.10.53: 43601+ A? metrics-server.kube-system.svc.cluster.local.default.svc.cluster.local. (88)
12:25:14.793224 IP 10.0.176.48.43321 > 192.168.0.10.53: 29022+ AAAA? metrics-server.kube-system.svc.cluster.local.default.svc.cluster.local. (88)
12:25:14.793807 IP 192.168.0.10.53 > 10.0.176.48.43321: 29022*- 0/0/0 (88)
12:25:14.793838 IP 192.168.0.10.53 > 10.0.176.48.43321: 43601 NXDomain*- 0/1/0 (181)
12:25:14.793903 IP 10.0.176.48.51072 > 192.168.0.10.53: 17636+ A? metrics-server.kube-system.svc.cluster.local.svc.cluster.local. (80)
12:25:14.793943 IP 10.0.176.48.51072 > 192.168.0.10.53: 18457+ AAAA? metrics-server.kube-system.svc.cluster.local.svc.cluster.local. (80)
12:25:14.794453 IP 192.168.0.10.53 > 10.0.176.48.51072: 18457*- 0/0/0 (80)
12:25:14.794507 IP 192.168.0.10.53 > 10.0.176.48.51072: 17636 NXDomain*- 0/1/0 (173)
12:25:14.794561 IP 10.0.176.48.45373 > 192.168.0.10.53: 49005+ A? metrics-server.kube-system.svc.cluster.local.cluster.local. (76)
12:25:14.794588 IP 10.0.176.48.45373 > 192.168.0.10.53: 11370+ AAAA? metrics-server.kube-system.svc.cluster.local.cluster.local. (76)
12:25:14.794923 IP 192.168.0.10.53 > 10.0.176.48.45373: 11370*- 0/0/0 (76)
12:25:14.794944 IP 192.168.0.10.53 > 10.0.176.48.45373: 49005 NXDomain*- 0/1/0 (169)
12:25:14.794982 IP 10.0.176.48.48760 > 192.168.0.10.53: 24806+ A? metrics-server.kube-system.svc.cluster.local. (62)
12:25:14.795004 IP 10.0.176.48.48760 > 192.168.0.10.53: 10468+ AAAA? metrics-server.kube-system.svc.cluster.local. (62)
12:25:14.795295 IP 192.168.0.10.53 > 10.0.176.48.48760: 24806*- 1/0/0 A 192.168.124.136 (122)
12:25:14.795316 IP 192.168.0.10.53 > 10.0.176.48.48760: 10468*- 0/0/0 (62)
12:25:14.795594 IP 10.0.176.48.58077 > 192.168.0.10.53: 48805+ PTR? 136.124.168.192.in-addr.arpa. (46)
12:25:14.795893 IP 192.168.0.10.53 > 10.0.176.48.58077: 48805*- 1/0/0 PTR metrics-server.kube-system.svc.cluster.local. (132)
```

**metrics-server.kube-system.svc.cluster.local.default.svc.cluster.local
metrics-server.kube-system.svc.cluster.local.svc.cluster.local
metrics-server.kube-system.svc.cluster.local.cluster.local**  these invalid dns request is not we wanted 


From this perspective, if we do not modify the glibc search matching rule logic, configuring the first search domain as a single dot is an effective way to reduce many unnecessary DNS queries."

**Comment by chengjoey** [comment]
> > > Would it be possible to discuss this in an upcoming SIG-Network meeting, or should we consider starting a thread to gather more community feedback?
> > 
> > 
> > absolutely, this issue is the perfect place, it will be nice if you can enhance this issue with more detail so we can have the full context documented. Since this will require to lose validation on the API it will require a bit more of information to justify this change
> > > Could we look into aligning Kubernetes' DNS config validations with these Unix standards?
> > 
> > 
> > can you provide some references to these standards ?
> > > it can be very meaningful in specific scenarios.
> > 
> > 
> > can you provide some examples of these scenarios? use cases are very valuable
> 
> @aojea
> 
> In a cluster, some pods may need to access both external domain names and internal cluster domain names. For external domain names, we do not want glibc to initiate unnecessary internal domain name resolution requests. By configuring the first search domain to be . (a dot), we can avoid this issue.

In the sample you provided, ndots: 3 is also configured. If the external domain you are accessing is something like a.b.c.com, then you don't need to configure search to dot. If it is a.b.com, just set ndots to 2. For internal domains, you can directly access ${servicename} or ${servicename.namespace}, It will search for ${servicename}.default.svc.cluster.local and then ${servicename}.svc.cluster.local

**Comment by aojea** [comment]
I knew this one dot thing in search was familiar , I found the related issues, systemd started rolling this ball that broke kubernetes and got fixed by https://github.com/kubernetes/kubernetes/pull/109441, but later broke muslc containers and got fixed by https://github.com/kubernetes/kubernetes/pull/112157.

The request here seems to be, "let me configure a single dot on search via the Pod API", that is forbidden by validation, it seems that something like this will solve the problem

```
diff --git a/pkg/apis/core/validation/validation.go b/pkg/apis/core/validation/validation.go
index e0841d0c21b..d47df3f4eef 100644
--- a/pkg/apis/core/validation/validation.go
+++ b/pkg/apis/core/validation/validation.go
@@ -3759,8 +3759,10 @@ func validatePodDNSConfig(dnsConfig *core.PodDNSConfig, dnsPolicy *core.DNSPolic
                }
                for i, search := range dnsConfig.Searches {
                        // it is fine to have a trailing dot
-                       search = strings.TrimSuffix(search, ".")
-                       allErrs = append(allErrs, ValidateDNS1123Subdomain(search, fldPath.Child("searches").Index(i))...)
+                       if search != "." {
+                               search = strings.TrimSuffix(search, ".")
+                               allErrs = append(allErrs, ValidateDNS1123Subdomain(search, fldPath.Child("searches").Index(i))...)
+                       }
                }
                // Validate options.
                for i, option := range dnsConfig.Options {
diff --git a/pkg/apis/core/validation/validation_test.go b/pkg/apis/core/validation/validation_test.go
index 65d5a2236e3..49596f45a15 100644
--- a/pkg/apis/core/validation/validation_test.go
+++ b/pkg/apis/core/validation/validation_test.go
@@ -9591,6 +9591,12 @@ func TestValidatePodDNSConfig(t *testing.T) {
                },
                dnsPolicy:     &testDNSNone,
                expectedError: false,
+       }, {
+               desc: "valid: search path with single dot",
+               dnsConfig: &core.PodDNSConfig{
+                       Searches: []string{"."},
+               },
+               expectedError: false,
        }, {
                desc: "valid: 1 search path",
                dnsConfig: &core.PodDNSConfig{
@@ -9610,6 +9616,13 @@ func TestValidatePodDNSConfig(t *testing.T) {
                        Searches:    []string{"custom", "mydomain.com", "local", "cluster.local", "svc.cluster.local", "default.svc.cluster.local."},
                },
                expectedError: false,
+       }, {
+               desc: "valid: 3 nameservers and 5 searches path with a single dot",
+               dnsConfig: &core.PodDNSConfig{
+                       Nameservers: []string{"127.0.0.1", "10.0.0.10", "8.8.8.8"},
+                       Searches:    []string{"custom", "mydomain.com", ".", "svc.cluster.local", "default.svc.cluster.local."},
+               },
+               expectedError: false,
        }, {
                desc: "valid: 3 nameservers and 32 search paths",
                dnsConfig: &core.PodDNSConfig{
```

However, this change need to be feature gated as we are going to relax validation and we need to be careful with skewed apiservers.

Coincidentally, there is a KEP that targets to relax the validation of this field too https://github.com/kubernetes/enhancements/pull/4428, but it seems the author @sethev has not been active since it merged 🤔 

I don't know if the best thing here is for someone to update the existing KEP to amend the need to solve the one dot problem too, and take over the work needed

cc: @danwinship @thockin

**Comment by thockin** [comment]
This sounds legitimate, and I think it would be great to include this in the same KEP and gate if we are doing both.  Good call @aojea.

@sethev - is this a KEP you plan to come back to?  Do you want to try to get someone to take it over?  It missed the boat on 1.30 and now on 1.31.

@zengyuxing007 - are you open to helping make this happen?  The right thing to do would be to open a PR against https://github.com/kubernetes/enhancements/tree/master/keps/sig-network/4427-relaxed-dns-search-validation to include this problem, rationale, and solution.  If @sethev doesn't respond or doesn't have time to follow-through, the next step would be to implement the KEP and gate -- this one should not be too hard to do!

If neither of you is able/willing to implement the KEP, then this falls into the categbory of "conceptually approved but unstaffed" work, which (sadly) is not a place many KEPs come back from.  :(

**Comment by adrianmoisey** [comment]
I'm happy to give this one a try, since I have no KEP experience (KEPerience perhaps?).
The problem being solved also seems to be well understood and contained.

**Comment by thockin** [comment]
Thanks for the response!

**Comment by adrianmoisey** [comment]
Given that the KEP exists, can this be closed off?
