### ISSUE TITLE
"externalTrafficPolicy": "Local" not work fine

### ISSUE THREAD

**Issue by manuperera** [kubernetes/kubernetes#52096]
**Is this a BUG REPORT or FEATURE REQUEST?**:

/kind bug

**What happened**:
I have defined a service thar use externalTrafficPolicy field to preserve source IP of clients requests. The configuration file to this service is as follow:

```
apiVersion: v1
kind: Service
metadata:
  labels:
    name: connector-tcp
  name: connector-tcp
spec:
  ports:
    # The port that this service should serve on.
    - port: 9955
      name: apisouth
      targetPort: 9955
      #nodePort: 30955
      protocol: TCP
    - port: 9443
      name: ssl-port-south
      targetPort: 9443
      protocol: TCP
    - port: 11112
      name: rmi-rabbitauth
      targetPort: 11112
      protocol: TCP
    - port: 54321
      name: sigfox
      targetPort: 54321
      protocol: TCP
  # Label keys and values that must match in order to receive traffic for this service.
  externalIPs:
    - "172.19.18.72"
  selector:
     app: connector
  type: LoadBalancer
  externalTrafficPolicy: Local
```

In the dashboard of Kubernetes the service appears as follow:

![image](https://user-images.githubusercontent.com/28434493/30173400-ce1e1aac-93f7-11e7-8836-1ce961ce79c3.png)

When I send a request to 9955/tcp port from a remote client, I see that the source IP is another that expected.

![image](https://user-images.githubusercontent.com/28434493/30173326-8909c20e-93f7-11e7-8998-9dc63f5cc1cc.png)

Otherwise, on the CoreOS host I see the source IP correctly.

![image](https://user-images.githubusercontent.com/28434493/30173296-7783ae3c-93f7-11e7-9e7f-bd8a97e6790f.png)

**What you expected to happen**:

I expected that source IP inside the container must be the client address.

**How to reproduce it (as minimally and precisely as possible)**:

**Anything else we need to know?**:

Other component versions:
Calico Node: 2.5.1
Calico CNI: 1.5.2
Calico Kube Policy Controller: 0.7.0
Calico Leader Elector: 0.1.0
Flanneld: 0.7.1

**Environment**:
- Kubernetes version (use `kubectl version`):
Client Version: version.Info{Major:"1", Minor:"7", GitVersion:"v1.7.5", GitCommit:"17d7182a7ccbb167074be7a87f0a68bd00d58d97", GitTreeState:"clean", BuildDate:"2017-08-31T09:14:02Z", GoVersion:"go1.8.3", Compiler:"gc", Platform:"linux/amd64"}
Server Version: version.Info{Major:"1", Minor:"7", GitVersion:"v1.7.5+coreos.0", GitCommit:"070d238cd2ec359928548e486a9171b498573181", GitTreeState:"clean", BuildDate:"2017-08-31T21:28:39Z", GoVersion:"go1.8.3", Compiler:"gc", Platform:"linux/amd64"}

- Cloud provider or hardware configuration**:
private

- OS (e.g. from /etc/os-release):
DISTRIB_ID="Container Linux by CoreOS"
DISTRIB_RELEASE=1465.6.0
DISTRIB_CODENAME="Ladybug"
DISTRIB_DESCRIPTION="Container Linux by CoreOS 1465.6.0 (Ladybug)"

- Kernel (e.g. `uname -a`):
Linux coreos002.amplia.int 4.12.7-coreos #1 SMP Tue Aug 15 23:54:56 UTC 2017 x86_64 QEMU Virtual CPU version 2.0.0 GenuineIntel GNU/Linux

- Install tools:
- Others:

**Comment by cmluciano** [comment]
/sig network

Are you using Canal or flannel+calico? 

cc @caseydavenport @tomdee

**Comment by caseydavenport** [comment]
@manuperera where are those two packet captures being taken?  Is the first one inside the destination pod, and the second one on the source host?  If so, which interface on the source host?

Also, whose IP is `10.1.75.0`?  Sounds like someone is doing an SNAT somewhere, but not sure yet who it is :)

**Comment by manuperera** [comment]
I'm using Flannel + Calico.

The first packer has been captured in the POD (Docker container). The second packet has been captured in the CoreOS host where run Kubernetes master node:  coreos002.

IP 10.1.75.0 corresponds to coreos002 flannel interface:

```
coreos002 ~ # ifconfig 
docker0: flags=4099<UP,BROADCAST,MULTICAST>  mtu 1500
        inet 172.17.0.1  netmask 255.255.0.0  broadcast 0.0.0.0
        ether 02:42:39:53:81:1a  txqueuelen 0  (Ethernet)
        RX packets 0  bytes 0 (0.0 B)
        RX errors 0  dropped 0  overruns 0  frame 0
        TX packets 0  bytes 0 (0.0 B)
        TX errors 0  dropped 0 overruns 0  carrier 0  collisions 0

eth0: flags=4163<UP,BROADCAST,RUNNING,MULTICAST>  mtu 1500
        inet 172.19.18.72  netmask 255.255.240.0  broadcast 172.19.31.255
        inet6 fe80::5054:ff:fefe:b3c2  prefixlen 64  scopeid 0x20<link>
        ether 52:54:00:fe:b3:c2  txqueuelen 1000  (Ethernet)
        RX packets 2826591  bytes 1175693921 (1.0 GiB)
        RX errors 0  dropped 53  overruns 0  frame 0
        TX packets 1945057  bytes 1178740965 (1.0 GiB)
        TX errors 0  dropped 0 overruns 0  carrier 0  collisions 0

flannel0: flags=4305<UP,POINTOPOINT,RUNNING,NOARP,MULTICAST>  mtu 1472
        inet 10.1.75.0  netmask 255.255.0.0  destination 10.1.75.0
        inet6 fe80::8f38:be88:9774:d2c9  prefixlen 64  scopeid 0x20<link>
        unspec 00-00-00-00-00-00-00-00-00-00-00-00-00-00-00-00  txqueuelen 500  (UNSPEC)
        RX packets 42118  bytes 51147731 (48.7 MiB)
        RX errors 0  dropped 0  overruns 0  frame 0
        TX packets 23922  bytes 2426735 (2.3 MiB)
        TX errors 0  dropped 0 overruns 0  carrier 0  collisions 0

lo: flags=73<UP,LOOPBACK,RUNNING>  mtu 65536
        inet 127.0.0.1  netmask 255.0.0.0
        inet6 ::1  prefixlen 128  scopeid 0x10<host>
        loop  txqueuelen 1000  (Local Loopback)
        RX packets 1826135  bytes 673564041 (642.3 MiB)
        RX errors 0  dropped 0  overruns 0  frame 0
        TX packets 1826135  bytes 673564041 (642.3 MiB)
        TX errors 0  dropped 0 overruns 0  carrier 0  collisions 0
```

**Comment by manuperera** [comment]
@caseydavenport  ,  I think that SNAT has been made by Flannel. What do yo think?.

**Comment by MrHohn** [comment]
Ref https://github.com/coreos/flannel/issues/734.

**Comment by manuperera** [comment]
@MrHohn, I have tried with the possible solution that you indicate in issue #734 (https://github.com/coreos/flannel/blob/master/network/ipmasq.go#L36), but it doesn't work in my environment.

Can someone help me to solve this situation.

**Comment by MrHohn** [comment]
@manuperera Is it possible to upgrade the flannel plugin to >=[v0.8.0](https://github.com/coreos/flannel/releases/tag/v0.8.0), which contains the fix (https://github.com/coreos/flannel/pull/745)?

**Comment by manuperera** [comment]
Hello @MrHohn , thank you for your interest in solve the problem.

I've installed the latest stable release of CoreOS (1548.0.0). This release contains Flanneld 0.9.0.

```
coreos002 ~ # more /etc/lsb-release 
DISTRIB_ID="Container Linux by CoreOS"
DISTRIB_RELEASE=1548.0.0
DISTRIB_CODENAME="Ladybug"
DISTRIB_DESCRIPTION="Container Linux by CoreOS 1548.0.0 (Ladybug)"
coreos002 ~ # /var/lib/rkt/cas/tree/deps-sha512-d422e9e7efc0d089bfcf581cac189d39513a6fd421269aa31f863c44ef96d9ff/rootfs/opt/bin/flanneld --version
v0.9.0
```

I've repeated tests over connector container and results are the same. Packets captured in Kubernetes's master nodo have correct IP address.

``` logs
13:34:00.340753 IP 172.19.18.53.35686 > coreos002.amplia.int.radius-acct: RADIUS, Accounting-Request (4), id: 0x48 length: 166
13:34:00.340880 IP 172.19.18.53.35686 > coreos002.amplia.int.radius-acct: RADIUS, Accounting-Request (4), id: 0x49 length: 151
13:34:01.241995 IP 172.19.18.53.35686 > coreos002.amplia.int.radius-acct: RADIUS, Accounting-Request (4), id: 0x4a length: 166
13:34:01.242135 IP 172.19.18.53.35686 > coreos002.amplia.int.radius-acct: RADIUS, Accounting-Request (4), id: 0x4b length: 151
13:34:02.142696 IP 172.19.18.53.35686 > coreos002.amplia.int.radius-acct: RADIUS, Accounting-Request (4), id: 0x4c length: 166
13:34:02.142817 IP 172.19.18.53.35686 > coreos002.amplia.int.radius-acct: RADIUS, Accounting-Request (4), id: 0x4d length: 151
13:34:02.538837 IP 172.19.18.53.35686 > coreos002.amplia.int.radius-acct: RADIUS, Accounting-Request (4), id: 0x4e length: 151
13:34:03.440217 IP 172.19.18.53.35686 > coreos002.amplia.int.radius-acct: RADIUS, Accounting-Request (4), id: 0x4f length: 151
13:34:04.341705 IP 172.19.18.53.35686 > coreos002.amplia.int.radius-acct: RADIUS, Accounting-Request (4), id: 0x50 length: 151
13:34:05.243232 IP 172.19.18.53.35686 > coreos002.amplia.int.radius-acct: RADIUS, Accounting-Request (4), id: 0x51 length: 151
```

But, packets captured in Docker container (Connector) don,t have client IP address.

```
13:34:00.343773 IP 10.1.7.0.35686 > perfconnector-ttqx8.radius-acct: RADIUS, Accounting-Request (4), id: 0x48 length: 166
13:34:00.343857 IP 10.1.7.0.35686 > perfconnector-ttqx8.radius-acct: RADIUS, Accounting-Request (4), id: 0x49 length: 151
13:34:01.245124 IP 10.1.7.0.35686 > perfconnector-ttqx8.radius-acct: RADIUS, Accounting-Request (4), id: 0x4a length: 166
13:34:01.245862 IP 10.1.7.0.35686 > perfconnector-ttqx8.radius-acct: RADIUS, Accounting-Request (4), id: 0x4b length: 151
13:34:02.145736 IP 10.1.7.0.35686 > perfconnector-ttqx8.radius-acct: RADIUS, Accounting-Request (4), id: 0x4c length: 166
13:34:02.146381 IP 10.1.7.0.35686 > perfconnector-ttqx8.radius-acct: RADIUS, Accounting-Request (4), id: 0x4d length: 151
13:34:02.541613 IP 10.1.7.0.35686 > perfconnector-ttqx8.radius-acct: RADIUS, Accounting-Request (4), id: 0x4e length: 151
13:34:03.443608 IP 10.1.7.0.35686 > perfconnector-ttqx8.radius-acct: RADIUS, Accounting-Request (4), id: 0x4f length: 151
13:34:04.344522 IP 10.1.7.0.35686 > perfconnector-ttqx8.radius-acct: RADIUS, Accounting-Request (4), id: 0x50 length: 151
13:34:05.246380 IP 10.1.7.0.35686 > perfconnector-ttqx8.radius-acct: RADIUS, Accounting-Request (4), id: 0x51 length: 151
```

**Comment by MrHohn** [comment]
@manuperera Thanks for the update. It might be better to report your issue on https://github.com/coreos/flannel/issues/734 or open up a new one. Flannel folks should have more insight.

**Comment by caseydavenport** [comment]
@manuperera sorry for the delay on response.

Could you try to identify where the masquerade is occurring by running the following command?

```
iptables-save -c | grep MASQURADE
```

This will show us the packet counts on rules which perform masquerade and might give some insight. If you could try watching that while you send traffic to the pod, it might identify which rule is causing the problem.

**Comment by manuperera** [comment]
I've executed command in Kubernetes node where is running connector's pod. 

This is the output:
```
core@coreos003 ~ $ sudo iptables-save -c | grep MASQUERADE
[0:0] -A POSTROUTING -s 172.17.0.0/16 ! -o docker0 -j MASQUERADE
[497589:32298643] -A POSTROUTING -s 10.1.0.0/16 ! -d 224.0.0.0/4 -j MASQUERADE
[0:0] -A POSTROUTING ! -s 10.1.0.0/16 -d 10.1.0.0/16 -j MASQUERADE
[0:0] -A KUBE-POSTROUTING -m comment --comment "kubernetes service traffic requiring SNAT" -m mark --mark 0x4000/0x4000 -j MASQUERADE
```

**Comment by caseydavenport** [comment]
@manuperera actually, could you run that on the node that's the source of the traffic?

**Comment by manuperera** [comment]
The node that's the source of the traffic doesn't a Kubernetes's node. It's a machine that is out of Kubernetes's cluster.

No output for command ```sudo iptables-save -c | grep MASQUERADE```

The output for command ```sudo iptables-save -c``` is:

```
[root@druida3 ~]# sudo iptables-save -c 
# Generated by iptables-save v1.4.7 on Mon Oct  9 16:57:44 2017
*filter
:INPUT ACCEPT [29933775:19876993512]
:FORWARD ACCEPT [0:0]
:OUTPUT ACCEPT [26794814:13212491472]
[8116775:389605200] -A INPUT -p udp -m udp --sport 1813 -j DROP 
COMMIT
# Completed on Mon Oct  9 16:57:44 2017
```

**Comment by manuperera** [comment]
There are any news about the solution of this problem?

**Comment by manuperera** [comment]
There are any news about the solution of this problem?

**Comment by manuperera** [comment]
Closed??? There are any solution for this problem?

**Comment by fpytloun** [comment]
I have just the same issue - using NodePort with externalTrafficPolicy=Local does not work and I cannot see correct source IP from pods.
Does anyone came up with solution or workaround to this issue? Or is there any up-to-date open issue? Everything I found is closed without solution for this problem.

**Comment by micw** [comment]
@manuperera could you reopen this? It's still not solved :-(

**Comment by JeremyJeanson** [comment]
Please reopen.

It is not solved. I use a local kubernetes cluster and my pods are not able to see source IP as expected.
