### ISSUE TITLE
Cluster does not getting any connection requests

### ISSUE THREAD

**Issue by mfinkelstine** [kubernetes/kubernetes#75035]
/sig network

Hi all,

I hope this is the right place for such issue.

**What happened**:
Explanation : 
I have k8s with 11 nodes environment with 3 master nodes (2 replicas).
With several services and pods in my environment my main master node stopped exposing ports while other master (replica1, replica2) are exposing the ports for my pods 

here is example of my k8s dashboard which is working on my 2 replicas but not in the master node with port exposed
#### on my k8s-master-main this is the output from the tcpdump
we can see that the host is listen to the port but does not redirect the networking
```
root@k8s-master-main:~# lsof -i:30465
COMMAND     PID USER   FD   TYPE  DEVICE SIZE/OFF NODE NAME
kube-prox 32627 root   25u  IPv6 7465821      0t0  TCP *:30465 (LISTEN)
```
here the iptable rules that I have for the dashboard it's exact on all master nodes
```
root@k8s-master-main:~# iptables -t nat -nL | grep dashboard
KUBE-MARK-MASQ  tcp  --  0.0.0.0/0            0.0.0.0/0            /* kube-system/kubernetes-dashboard: */ tcp dpt:30465
KUBE-SVC-XGLOHA7QRQ3V22RZ  tcp  --  0.0.0.0/0            0.0.0.0/0            /* kube-system/kubernetes-dashboard: */ tcp dpt:30465
KUBE-MARK-MASQ  all  --  10.32.0.3            0.0.0.0/0            /* kube-system/kubernetes-dashboard: */
DNAT       tcp  --  0.0.0.0/0            0.0.0.0/0            /* kube-system/kubernetes-dashboard: */ tcp to:10.32.0.3:8443
KUBE-MARK-MASQ  tcp  -- !10.32.0.0/12         10.110.60.225        /* kube-system/kubernetes-dashboard: cluster IP */ tcp dpt:443
KUBE-SVC-XGLOHA7QRQ3V22RZ  tcp  --  0.0.0.0/0            10.110.60.225        /* kube-system/kubernetes-dashboard: cluster IP */ tcp dpt:443
KUBE-SEP-LPUGT7E25KUQ5PUI  all  --  0.0.0.0/0            0.0.0.0/0            /* kube-system/kubernetes-dashboard: */

```
the dashboard is listen on port 30465 here is the output of my tcpdump
```
root@k8s-master-main:~# tcpdump -ni any port 30465
tcpdump: verbose output suppressed, use -v or -vv for full protocol decode
listening on any, link-type LINUX_SLL (Linux cooked), capture size 262144 bytes
13:01:13.002312 IP 192.168.10.139.65533 > 192.168.132.133.30465: Flags [S], seq 3169086234, win 64260, options [mss 1428,nop,wscale 8,nop,nop,sackOK], length 0
13:01:13.252722 IP 192.168.10.139.65535 > 192.168.132.133.30465: Flags [S], seq 1338864689, win 64260, options [mss 1428,nop,wscale 8,nop,nop,sackOK], length 0
13:01:16.000630 IP 192.168.10.139.65533 > 192.168.132.133.30465: Flags [S], seq 3169086234, win 64260, options [mss 1428,nop,wscale 8,nop,nop,sackOK], length 0
13:01:16.253443 IP 192.168.10.139.65535 > 192.168.132.133.30465: Flags [S], seq 1338864689, win 64260, options [mss 1428,nop,wscale 8,nop,nop,sackOK], length 0
```

#### on my k8s-master-replica1 this is the output from the tcpdump
```
root@k8s-master-replica1:~# tcpdump -ni any port 30465
tcpdump: verbose output suppressed, use -v or -vv for full protocol decode
listening on any, link-type LINUX_SLL (Linux cooked), capture size 262144 bytes
13:06:15.891608 IP 192.168.10.139.49475 > 192.168.132.135.30465: Flags [S], seq 3874981346, win 64260, options [mss 1428,nop,wscale 8,nop,nop,sackOK], length 0
13:06:15.892994 IP 192.168.132.135.30465 > 192.168.10.139.49475: Flags [S.], seq 4062915301, ack 3874981347, win 26720, options [mss 1336,nop,nop,sackOK,nop,wscale 7], length 0
13:06:15.893576 IP 192.168.10.139.49475 > 192.168.132.135.30465: Flags [.], ack 1, win 260, length 0
13:06:15.895480 IP 192.168.10.139.49475 > 192.168.132.135.30465: Flags [P.], seq 1:518, ack 1, win 260, length 517
13:06:15.895658 IP 192.168.132.135.30465 > 192.168.10.139.49475: Flags [.], ack 518, win 218, length 0
13:06:15.895788 IP 192.168.132.135.30465 > 192.168.10.139.49475: Flags [P.], seq 1:147, ack 518, win 218, length 146
13:06:15.896432 IP 192.168.10.139.49475 > 192.168.132.135.30465: Flags [P.], seq 518:569, ack 147, win 260, length 51
13:06:15.896865 IP 192.168.132.135.30465 > 192.168.10.139.49475: Flags [P.], seq 147:203, ack 569, win 218, length 56
13:06:15.933856 IP 192.168.10.139.49475 > 192.168.132.135.30465: Flags [P.], seq 569:746, ack 203, win 260, length 177
13:06:15.933885 IP 192.168.10.139.49475 > 192.168.132.135.30465: Flags [P.], seq 746:1022, ack 203, win 260, length 276
```

I have created a docker image for nginx and I saw that the system is redirected the http port
```
root@k8s-master-main:~# tcpdump  -ni any port 8080
tcpdump: verbose output suppressed, use -v or -vv for full protocol decode
listening on any, link-type LINUX_SLL (Linux cooked), capture size 262144 bytes
13:35:19.394587 IP 192.168.10..139.52032 > 192.168.132.133.8080: Flags [F.], seq 3885521030, ack 1729975292, win 252, length 0
13:35:19.394755 IP 192.168.132.133.8080 > 192.168.10..139.52032: Flags [F.], seq 1, ack 1, win 245, length 0
13:35:19.395317 IP 192.168.10..139.52032 > 192.168.132.133.8080: Flags [.], ack 2, win 252, length 0
13:35:19.428629 IP 192.168.10..139.52071 > 192.168.132.133.8080: Flags [S], seq 3014852904, win 64260, options [mss 1428,nop,wscale 8,nop,nop,sackOK], length 0
13:35:19.428724 IP 192.168.132.133.8080 > 192.168.10..139.52071: Flags [S.], seq 1168464434, ack 3014852905, win 29200, options [mss 1460,nop,nop,sackOK,nop,wscale 7], length 0
13:35:19.430191 IP 192.168.10..139.52071 > 192.168.132.133.8080: Flags [.], ack 1, win 256, length 0
13:35:19.431712 IP 192.168.10..139.52071 > 192.168.132.133.8080: Flags [P.], seq 1:380, ack 1, win 256, length 379: HTTP: GET / HTTP/1.1
13:35:19.431751 IP 192.168.132.133.8080 > 192.168.10..139.52071: Flags [.], ack 380, win 237, length 0
13:35:19.431905 IP 192.168.132.133.8080 > 192.168.10..139.52071: Flags [P.], seq 1:239, ack 380, win 237, length 238: HTTP: HTTP/1.1 200 OK
13:35:19.431983 IP 192.168.132.133.8080 > 192.168.10..139.52071: Flags [P.], seq 239:851, ack 380, win 237, length 612: HTTP
13:35:19.433158 IP 192.168.10..139.52071 > 192.168.132.133.8080: Flags [.], ack 851, win 253, length 0
13:35:19.453609 IP 192.168.10..139.52071 > 192.168.132.133.8080: Flags [P.], seq 380:740, ack 851, win 253, length 360: HTTP: GET /favicon.ico HTTP/1.1
13:35:19.453927 IP 192.168.132.133.8080 > 192.168.10..139.52071: Flags [P.], seq 851:1159, ack 740, win 245, length 308: HTTP: HTTP/1.1 404 Not Found
13:35:19.498549 IP 192.168.10..139.52071 > 192.168.132.133.8080: Flags [.], ack 1159, win 252, length 0
```

**What you expected to happen**:
To have access to my exposed ports
**How to reproduce it (as minimally and precisely as possible)**:

**Anything else we need to know?**:

**Environment**:
- Kubernetes version (use `kubectl version`):
```
Client Version: version.Info{Major:"1", Minor:"11", GitVersion:"v1.11.0", GitCommit:"91e7b4fd31fcd3d5f436da26c980becec37ceefe", GitTreeState:"clean", BuildDate:"2018-06-27T20:17:28Z", GoVersion:"go1.10.2", Compiler:"gc", Platform:"linux/amd64"}
Server Version: version.Info{Major:"1", Minor:"11", GitVersion:"v1.11.2", GitCommit:"bb9ffb1654d4a729bb4cec18ff088eacc153c239", GitTreeState:"clean", BuildDate:"2018-08-07T23:08:19Z", GoVersion:"go1.10.3", Compiler:"gc", Platform:"linux/amd64"}
```
- Cloud provider or hardware configuration:
   On-Premise VM's
- OS (e.g: `cat /etc/os-release`):
  ```
  NAME="Ubuntu"
  VERSION="16.04.4 LTS (Xenial Xerus)"
  ```
- Kernel (e.g. `uname -a`):
```4.4.0-116-generic```
- Install tools:

- Others:

**Comment by figo** [comment]
/close 

@mfinkelstine i am closing the issue now because sig-network suggesting that stack overflow is a better place to get particular issue triaged.
please feel free to open a new issue if you can pin down the issue to sig-network area.
