### ISSUE TITLE
kube-dns can't failed smoothly after kube-dns replacing to new pod

### ISSUE THREAD

**Issue by chesterlai** [kubernetes/kubernetes#44890]
Hi, all
**Kubernetes version:**
Client Version: version.Info{Major:"1", Minor:"2", GitVersion:"v1.2.0", GitCommit:"5cb86ee022267586db386f62781338b0483733b3", GitTreeState:"clean"}
Server Version: version.Info{Major:"1", Minor:"2", GitVersion:"v1.2.0", GitCommit:"5cb86ee022267586db386f62781338b0483733b3", GitTreeState:"clean"}

**Environment:**

- **Kernel**(e.g. uname -a):
   Linux ip-10-74-33-147 4.2.0-23-generic #28-Ubuntu SMP Sun Dec 27 17:47:31 UTC 2015 x86_64  x86_64 x86_64 GNU/Linux

- **Cloud provider or hardware configuration**:
   AWS ec2

- **OS**(e.g. from /etc/os-release):
   NAME="Ubuntu"
   VERSION="15.10 (Wily Werewolf)"
- **skydns version**
        image: gcr.io/google_containers/etcd-amd64:2.2.1
        image: gcr.io/google_containers/kube2sky:1.14
        image: gcr.io/google_containers/skydns:2015-10-13-8c72f8c
        image: gcr.io/google_containers/exechealthz:1.0

**What happened:**
We used 2 replicas on our kube-dns.
When we delete one kube-dns pod, it will create new kube-dns pod.
Client will ask the entry to kube-dns "service", then it will get kube-dns "pod" IP.
However, we have impact during the pod change period.
After we use tcpdump, we get below information.

10:38:51.882927 IP 172.17.47.22.55780 > 172.17.47.20.53: 3+ A? php-apache.default.svc.cluster.local. (54)
10:38:51.882930 IP 172.17.47.22.55780 > 172.17.47.20.53: 3+ A? php-apache.default.svc.cluster.local. (54)
10:38:51.882932 IP 172.17.47.22.55780 > 172.17.47.20.53: 3+ A? php-apache.default.svc.cluster.local. (54)
10:38:51.882934 IP 172.17.47.22.55780 > 172.17.47.20.53: 3+ A? php-apache.default.svc.cluster.local. (54)
10:38:51.882944 IP 172.17.47.22.55780 > 172.17.47.20.53: 3+ A? php-apache.default.svc.cluster.local. (54)

Because it doesn't return failed msg back to source, it will take a while to fail.
After it failed, the request can ask "service" again then get new IP.

Is that a bug? How could we solve it?

Thanks

**Comment by MrHohn** [comment]
/area dns
/assign

I believe this is already addressed since k8s v1.4. Please update your cluster :)

See #31807, #33050, #31894, kubernetes/contrib#1756.
