### ISSUE TITLE
Pod cannot access any services on a 10 Gigabit network

### ISSUE THREAD

**Issue by meng-yu-github** [kubernetes/kubernetes#117162]
### What happened?

The Kubernetes cluster was originally running normally on a gigabit network, but now I have switched the network to a 10 Gigabit network and found that the pod cannot access the service.

Before switching to a 10 Gigabit network, the existing services on Kubernetes are normal, and each node can access all.
After switching to a 10 Gigabit network, all services on Kubernetes are running, but when nodes access the service, only the nodes corresponding to the service's pod can access it, and other nodes fail to access it. Afterwards, I deployed the nginx service and the dnsutils service in the default space. I used curl to access the nginx service in the pod of the dnsutils service, but the access failed. Later, I used curl to access the IP corresponding to the nginx service, and the result was also a failure.

### What did you expect to happen?

1. I hope that after switching to 10 Gigabit fiber optic, the pod can access all services and all nodes can access services.
2. I would like to know what configurations are required for Kubernetes to support 10 Gigabit networks?

### How can we reproduce it (as minimally and precisely as possible)?

Now deploy Kubernetes clusters of 3 or more on a gigabit network, and deploy nginx services and dnsutils services. It is necessary to ensure that nginx and dnsutils are not on the same node, and then switch the network to a gigabit network. Enter the pod of the dnsutils service and use curl to access nginx services to check if the request passes.

### Anything else we need to know?

The CNI plugin I am using is calico 3.8.5.
Kube-proxy uses ipvs mode.

### Kubernetes version

kubernets: 1.21.1
calico: 3.8.5
docker: 1.18.15

### Cloud provider

no

### OS version

OS system: Centos 7.9
kernel: 3.10.0-1160.62.1.el7.x86_64

### Install tools

kubeadm

### Container runtime (CRI) and version (if applicable)

docker: 1.18.15

### Related plugins (CNI, CSI, ...) and versions (if applicable)

calico: 3.8.5

**Comment by aojea** [comment]
kubernetes doesn't depend on any physical aspect of the network, it is not clear from the description what do you. mean by "switching to a 10 Gigabit network", is this a new network? is the existing network with just different physical interfaces? is there any IP address or subnet changes?

**Comment by meng-yu-github** [comment]
> kubernetes doesn't depend on any physical aspect of the network, it is not clear from the description what do you. mean by "switching to a 10 Gigabit network", is this a new network? is the existing network with just different physical interfaces? is there any IP address or subnet changes?

@aojea Thank you for your reply. Here are some additional questions to address.

A physical server has two 10 gigabit network interfaces (optical fiber) and two gigabit network interfaces (network cable), which are different physical network interfaces. This is a new network, but the IP address and subnet mask are copied from the gigabit network interface configuration file to the 10 gigabit network interface configuration file. The IP address and subnet mask remain unchanged.

**Comment by meng-yu-github** [comment]
A pod named `dnsutils`  was deployed on the master node, and a pod named `nginx`  was deployed on the upper node of node1. At the same time, a service named `nginx-service`  was also deployed. Afterwards, tcpdump was used to listen to the calixxx network cards of the two pods, and `curl nginx-service`  was accessed on the dnsutils pod. The monitoring of the dnsutils network card was shown below, and the monitoring of the nginx network card did not respond.

```shell
[root@master ~]# tcpdump -i  calid6cf645a89e
tcpdump: verbose output suppressed, use -v or -vv for full protocol decode
listening on calid6cf645a89e, link-type EN10MB (Ethernet), capture size 262144 bytes
20:03:59.985405 ARP, Request who-has 169.254.1.1 tell 10.244.219.68, length 28
20:03:59.985450 ARP, Reply 169.254.1.1 is-at ee:ee:ee:ee:ee:ee (oui Unknown), length 28
20:03:59.985457 IP 10.244.219.68.47683 > master.domain: 13619+ A? nginx-service.default.svc.cluster.local. (57)
20:03:59.985618 IP 10.244.219.68.47683 > master.domain: 14560+ AAAA? nginx-service.default.svc.cluster.local. (57)
20:03:59.986213 IP master.domain > 10.244.219.68.47683: 14560*- 0/1/0 (150)
20:03:59.986303 IP master.domain > 10.244.219.68.47683: 13619*- 1/0/0 A 10.96.31.38 (112)
20:03:59.986912 IP 10.244.219.68.56802 > master.http: Flags [S], seq 2028343146, win 28000, options [mss 1400,sackOK,TS val 16311258 ecr 0,nop,wscale 7], length 0
20:04:00.988924 IP 10.244.219.68.56802 > master.http: Flags [S], seq 2028343146, win 28000, options [mss 1400,sackOK,TS val 16312260 ecr 0,nop,wscale 7], length 0
20:04:02.993859 IP 10.244.219.68.56802 > master.http: Flags [S], seq 2028343146, win 28000, options [mss 1400,sackOK,TS val 16314265 ecr 0,nop,wscale 7], length 0
20:04:05.000952 ARP, Request who-has 10.244.219.68 tell master, length 28
20:04:05.001022 ARP, Reply 10.244.219.68 is-at d2:2e:c9:fa:cf:9d (oui Unknown), length 28
20:04:07.001161 IP 10.244.219.68.56802 > master.http: Flags [S], seq 2028343146, win 28000, options [mss 1400,sackOK,TS val 16318272 ecr 0,nop,wscale 7], length 0
20:04:15.016875 IP 10.244.219.68.56802 > master.http: Flags [S], seq 2028343146, win 28000, options [mss 1400,sackOK,TS val 16326288 ecr 0,nop,wscale 7], length 0
20:04:31.064907 IP 10.244.219.68.56802 > master.http: Flags [S], seq 2028343146, win 28000, options [mss 1400,sackOK,TS val 16342336 ecr 0,nop,wscale 7], length 0
20:04:36.072869 ARP, Request who-has 169.254.1.1 tell 10.244.219.68, length 28
20:04:36.072898 ARP, Reply 169.254.1.1 is-at ee:ee:ee:ee:ee:ee (oui Unknown), length 28
```

**Comment by sftim** [comment]
@meng-yu-github, GitHub is not the right place for support requests.

If you're looking for help, you could ask on [Server Fault](https://serverfault.com/questions/tagged/kubernetes).

You can also post your question on the [Kubernetes Slack](http://slack.k8s.io/) or the [Discuss Kubernetes](https://discuss.kubernetes.io/) forum.

**Comment by pacoxu** [comment]
link https://github.com/projectcalico/calico/issues/7543 
/close
