### ISSUE TITLE
kube-proxy ipvs conn_reuse_mode setting causes errors with high load from single client

### ISSUE THREAD

**Issue by juliantaylor** [kubernetes/kubernetes#81775]
**What happened**:
The kube-proxy sets `/proc/sys/net/ipv4/vs/conn_reuse_mode` to zero
https://github.com/kubernetes/kubernetes/blob/master/pkg/proxy/ipvs/proxier.go#L340

This has the effect that when:
- kube-proxy uses ipvs mode and an ipvs virtualserver is configured with only a few realservers (pod replicas)
- a client sends a lot of requests so that the source ports are reused before the MLS expires
- a pod gets removed(e.g. via upgrade) removed while it receives traffic from this client

What happens in this situation is that the kube-proxy correctly sets  the wait of the realserver to 0 and creates a new realserver with for the new pod that replaces the removed pod.

The problem is that the kube-proxy will not remove the weight zero realserver until its connections drop to zero.
This will never happen as the `conn_reuse_mode` is set to 0 and the client reuses its source ports. This causes the kernel to constantly reuse connections and send the traffic to the weight 0 realserver.

**What you expected to happen**:
When the old pod is removed its realserver receives no traffic anymore and is removed by kube-proxy

**How to reproduce it (as minimally and precisely as possible)**:
Deploy a service with with only a few replica pods as endpoints.

start sending lots of traffic to that service from a single client so the client will reuse its source ports sooner than the maximum segment lifetime of tcp connections.
For example with fortio:

```
fortio load -t 0 -qps 1000 -c 16 -keepalive=0 http://10.86.6.96
```

delete a pod on the node.

Fortio will now produce following errors occassionally:

```
08:50:10 E http_client.go:558> Unable to connect to 10.86.6.96:80 : dial tcp 10.86.6.96:80: connect: no route to host
08:50:11 E http_client.go:558> Unable to connect to 10.86.6.96:80 : dial tcp 10.86.6.96:80: connect: no route to host
08:50:12 E http_client.go:558> Unable to connect to 10.86.6.96:80 : dial tcp 10.86.6.96:80: connect: no route to host
08:50:13 E http_client.go:558> Unable to connect to 10.86.6.96:80 : dial tcp 10.86.6.96:80: connect: no route to host
```

ipvs will look like this:

```
ipvsadm -l -t 10.86.6.96:80 -n
  -> RemoteAddress:Port           Forward Weight ActiveConn InActConn
TCP  10.86.6.96:80 rr
  -> 100.66.61.116:8000           Masq    1	 0          5134
  -> 100.69.146.151:8000          Masq    0	 76         3956
  -> 100.69.146.185:8000          Masq    1	 0          967
```

kube-proxy will never remove the backends due to existing connections:

```
I0822 09:17:35.283821       1 graceful_termination.go:172] Not deleting, RS 10.86.6.96:80/TCP/100.69.146.151:8000: 33 ActiveConn, 38296 InactiveConn
I0822 09:18:35.283996       1 graceful_termination.go:161] Trying to delete rs: 10.86.6.96:80/TCP/100.69.146.151:8000
I0822 09:18:35.284111       1 graceful_termination.go:172] Not deleting, RS 10.86.6.96:80/TCP/100.69.146.151:8000: 76 ActiveConn, 11271 InactiveConn
I0822 09:19:35.284242       1 graceful_termination.go:161] Trying to delete rs: 10.86.6.96:80/TCP/100.69.146.151:8000
I0822 09:19:35.284324       1 graceful_termination.go:172] Not deleting, RS 10.86.6.96:80/TCP/100.69.146.151:8000: 58 ActiveConn, 0 InactiveConn
```

**Anything else we need to know?**:

setting the conn_reuse_mode to 1 fixes the problem, though that has performance impact (see #70747 and https://marc.info/?l=linux-virtual-server&m=151706660530133&w=2)
maybe #81308 helps too
using keepalive on the client also avoids this problem, though one may not be able to control all clients.

**Environment**:
- Kubernetes version (use `kubectl version`):
Client Version: version.Info{Major:"1", Minor:"15", GitVersion:"v1.15.0", GitCommit:"e8462b5b5dc2584fdcd18e6bcfe9f1e4d970a529", GitTreeState:"clean", BuildDate:"2019-06-19T16:40:16Z", GoVersion:"go1.12.5", Compiler:"gc", Platform:"linux/amd64"}
Server Version: version.Info{Major:"1", Minor:"14", GitVersion:"v1.14.5", GitCommit:"0e9fcb426b100a2aea5ed5c25b3d8cfbb01a8acf", GitTreeState:"clean", BuildDate:"2019-08-05T09:13:08Z", GoVersion:"go1.12.5", Compiler:"gc", Platform:"linux/amd64"}

- hardware
- "Container Linux by CoreOS 2135.6.0 (Rhyolite)
- kernel 4.19.56-coreos-r1
- Install tools:
- calico 3.8.2

**Comment by andrewsykim** [comment]
/sig network
/area ipvs
/assign 

As per https://github.com/kubernetes/kubernetes/issues/81308#issuecomment-520579495, we need to add a hard timeout on graceful termination. I had originally thought we had one for 15m but turns out we never did (unused constant https://github.com/kubernetes/kubernetes/pull/81312). 

I'm thinking 5m is reasonable hard limit for graceful termination, thoughts @lbernail ?

**Comment by athenabot** [comment]
/triage unresolved

Comment `/remove-triage unresolved` when the issue is assessed and confirmed.

🤖 I am a bot run by vllry. 👩‍🔬

**Comment by lbernail** [comment]
@andrewsykim yes, we definitely need a hard timeout. 5mn sounds good but some users may have pods remaining in terminating status for a long time?

@juliantaylor what should happen is the following:
- pod is deleted
- pod enters graceful termination and weight is set to zero
- no new connections to real server.
- pod exits and TCP connection is ended by the server (FIN)
- FIN triggers a status change for the IPVS connection tracking entry (FIN_WAIT) and I think the entry should disappear as soon as final FIN/ACK are exchanged

I think (not completely sure) that port_reuse only matters when the source pod is reusing the same source port as a previous one which should be prevented by TIME_WAIT in the pod. I wonder if we could end up in situations where the timer in the pod and the timer in the IPVS connection tracking do not match. Do you have any special configuration for lower TIME_WAIT in the pod?

A known issue is this one: if the connection is not closed by the remote pod (FIN/RST), usually because of a hard server crash, the entry in the IPVS conntrack will remain until the local pod TCP stack detects that the remote host is dead (which depends on tcp_retries2)

**Comment by athenabot** [comment]
@andrewsykim
If this issue has been triaged, please comment `/remove-triage unresolved`.

If you aren't able to handle this issue, consider unassigning yourself and/or adding the `help-wanted` label.

🤖 I am a bot run by vllry. 👩‍🔬

**Comment by njuicsgz** [comment]
I met this problem in my product env -- my envoy send http short-lived request to k8s service add with speed 2000qps.

Have tried net.ipv4.vs.conn_reuse_mode=1, could resolve the problem but get 1s delay for all requests since envoy have reuse ports. As metioned by @juliantaylor 

#81962 hard remove rs only works after 5min(or 15min), but within this period requests also route to the rs whose ipvs weight = 0.

so, I think if we could just clear the conntracks who bound to the rs address? This makes new request from envoy (reusing port) to get a normal rs. As while it has no 1s delay performance issue.

**Comment by njuicsgz** [comment]
I have resolved this problem just by deleting rs immediately when pod enters Terminating state.

Code diff like this:
```
@@ -168,10 +168,12 @@ func (m *GracefulTerminationManager) deleteRsFunc(rsToDelete *listItem) (bool, e
                        // For UDP traffic, no graceful termination, we immediately delete the RS
                        //     (existing connections will be deleted on the next packet because sysctlExpireNoDestConn=1)
                        // For other protocols, don't delete until all connections have expired)
-                       if strings.ToUpper(rsToDelete.VirtualServer.Protocol) != "UDP" && rs.ActiveConn+rs.InactiveConn != 0 {
+                       /*
+                       if strings.ToUpper(rsToDelete.VirtualServer.Protocol) != "UDP" && rs.ActiveConn+rs.InactiveConn != 0 {
                                klog.Infof("Not deleting, RS %v: %v ActiveConn, %v InactiveConn", rsToDelete.String(), rs.ActiveConn, rs.InactiveConn)
                                return false, nil
                        }
+                       */
                        klog.V(2).Infof("Deleting rs: %s", rsToDelete.String())
                        err := m.ipvs.DeleteRealServer(rsToDelete.VirtualServer, rs)
                        if err != nil {
```

I test long request which needs 60s to response, the response can be correctly back if the endpoint is deleted from ipvs service. It seems everything works well, thought I want to known what's the disadvantage? If there is any please let me known, thanks. @juliantaylor @andrewsykim @lbernail 

My test
```
t:
# ipvsadm -ln | grep 192.168.0.113:40080 -A2
TCP  192.168.0.113:40080 rr
  -> 172.16.94.5:80               Masq        1      0          0

t+10s:
# curl http://100.94.28.59:40080/sleep?second=60  -- will response after 60s
# ipvsadm -ln | grep 192.168.0.113:40080 -A2
TCP  192.168.0.113:40080 rr
  -> 172.16.94.5:80               Masq        1      1          0

t+30s:
# ipvsadm -ln | grep 192.168.0.113:40080 -A2
TCP  192.168.0.113:40080 rr
  -> 172.16.28.7:80               Masq        1      0          0

t+60s:
# curl http://100.94.28.59:40080/sleep?second=60
{"kind": "Status", "code": 200, "message": ""}
```

**Comment by lbernail** [comment]
Doing this will disable graceful termination (unless I'm missing something):
- pod enters the Terminating state
- RS is immediately removed
- the established connections are deleted (RST sent at the next packet because of expire_nodest_conn)

**Comment by njuicsgz** [comment]
@lbernail thanks for resp.

the tcpdump show me that the established connections will not be deleted as below

this is normal case
```
# curl 100.94.28.59:40080/sleep?second=6

tcpdump output of 100.94.28.59:
09:06:54.709978 IP node-0001.58138 > 172.16.94.6.http: Flags [S], seq 1865287158, win 29200, options [mss 1460,sackOK,TS val 3841922160 ecr 0,nop,wscale 7], length 0
09:06:54.711285 IP 172.16.94.6.http > node-0001.58138: Flags [S.], seq 4107045663, ack 1865287159, win 27960, options [mss 1410,sackOK,TS val 3913562818 ecr 3841922160,nop,wscale 7], length 0
09:06:54.711932 IP node-0001.58138 > 172.16.94.6.http: Flags [.], ack 1, win 229, options [nop,nop,TS val 3841922162 ecr 3913562818], length 0
09:06:54.711972 IP node-0001.58138 > 172.16.94.6.http: Flags [P.], seq 1:97, ack 1, win 229, options [nop,nop,TS val 3841922162 ecr 3913562818], length 96: HTTP: GET /sleep?second=6 HTTP/1.1
09:06:54.712319 IP 172.16.94.6.http > node-0001.58138: Flags [.], ack 97, win 219, options [nop,nop,TS val 3913562819 ecr 3841922162], length 0
09:07:00.718271 IP 172.16.94.6.http > node-0001.58138: Flags [P.], seq 1:18, ack 97, win 219, options [nop,nop,TS val 3913568825 ecr 3841922162], length 17: HTTP: HTTP/1.0 200 OK
09:07:00.718365 IP 172.16.94.6.http > node-0001.58138: Flags [FP.], seq 18:241, ack 97, win 219, options [nop,nop,TS val 3913568825 ecr 3841922162], length 223: HTTP
09:07:00.719107 IP node-0001.58138 > 172.16.94.6.http: Flags [.], ack 18, win 229, options [nop,nop,TS val 3841928170 ecr 3913568825], length 0
09:07:00.719169 IP node-0001.58138 > 172.16.94.6.http: Flags [F.], seq 97, ack 242, win 237, options [nop,nop,TS val 3841928170 ecr 3913568825], length 0
09:07:00.719715 IP 172.16.94.6.http > node-0001.58138: Flags [.], ack 98, win 219, options [nop,nop,TS val 3913568827 ecr 3841928170], length 0
```

this is compare case
```
# curl 100.94.28.59:40080/sleep?second=6

09:03:35.850427 IP node-0001.58146 > 172.16.94.6.http: Flags [S], seq 46936640, win 29200, options [mss 1460,sackOK,TS val 3841723301 ecr 0,nop,wscale 7], length 0
09:03:35.851750 IP 172.16.94.6.http > node-0001.58146: Flags [S.], seq 3138617601, ack 46936641, win 27960, options [mss 1410,sackOK,TS val 3913363959 ecr 3841723301,nop,wscale 7], length 0
09:03:35.852349 IP node-0001.58146 > 172.16.94.6.http: Flags [.], ack 1, win 229, options [nop,nop,TS val 3841723304 ecr 3913363959], length 0
09:03:35.852386 IP node-0001.58146 > 172.16.94.6.http: Flags [P.], seq 1:98, ack 1, win 229, options [nop,nop,TS val 3841723304 ecr 3913363959], length 97: HTTP: GET /sleep?second=60 HTTP/1.1
09:03:35.852746 IP 172.16.94.6.http > node-0001.58146: Flags [.], ack 98, win 219, options [nop,nop,TS val 3913363961 ecr 3841723304], length 0


here, I deleted rs by `# ipvsadm -d -t 192.168.0.113:40080 -r 172.16.94.6:80`


09:04:35.914487 IP 172.16.94.6.http > node-0001.58146: Flags [P.], seq 1:18, ack 98, win 219, options [nop,nop,TS val 3913424022 ecr 3841723304], length 17: HTTP: HTTP/1.0 200 OK
09:04:35.914552 IP 172.16.94.6.http > node-0001.58146: Flags [FP.], seq 18:241, ack 98, win 219, options [nop,nop,TS val 3913424022 ecr 3841723304], length 223: HTTP
09:04:35.915255 IP node-0001.58146 > 172.16.94.6.http: Flags [.], ack 18, win 229, options [nop,nop,TS val 3841783366 ecr 3913424022], length 0
09:04:35.915312 IP node-0001.58146 > 172.16.94.6.http: Flags [F.], seq 98, ack 242, win 237, options [nop,nop,TS val 3841783366 ecr 3913424022], length 0
09:04:35.916048 IP 172.16.94.6.http > node-0001.58146: Flags [.], ack 99, win 219, options [nop,nop,TS val 3913424024 ecr 3841783366], length 0
```

**Comment by weizhouBlue** [comment]
hi @njuicsgz  
I have a doubt with you test that you resolved this problem just by deleting rs immediately when pod enters Terminating state. Can you tell your ipvs sysctl setting ?

according to my understanding , kube-proxy need to set net.ipv4.vs.conntrack=1 to use masquarade and set net.ipv4.vs.conn_reuse_mode=0 .
BTW, if set net.ipv4.vs.conn_reuse_mode=1 , this failover issue will not produce but the 1s delayed response will produce

I have do the following test:

1 setup a ipvs node , and set net.ipv4.vs.conntrack=1 and net.ipv4.vs.conn_reuse_mode=0 

2 configure two real server r1 and r2 to ipvs with NAT mode , and test them working ok

3  from a client node , try to " curl http://vip:vip_port --local-port 999" . this  request get response correctly . And I can see this tcp session stay on WAIT_TIMEOUT on the ipvs node. And Using ipvsadm -ln , find the request was handled by r1

4 within the WAIT_TIMEOUT seconds , I try to set the rs1 to weight 0 ( also try to remove rs1 )

5 wthin the WAIT_TIMEOUT seconds , I use the same client node to " curl http://vip:vip_port --local-port 999 " again , this  request get response, but from the ipvs node , I found the ActiveConn and InActConn of rs2 did not increase , and the time_out counter of original  tcp session between client and rs1 was updated to a big one . This improves that the new request from the same client was still handled by the remove real server r1

So , in a word , my test did not verify your solution

According to my understanding, when net.ipv4.vs.conntrack=1 and  net.ipv4.vs.conn_reuse_mode=0 (This will effectively  disable expire_nodest_conn) , if the client reuse the port and hit the WAIT_TIMEOUT socket, ipvs will not schedule a new real server ,  even when the real server was removed or set to weight 0 

if my words wrong, please tell me , thanks

**Comment by njuicsgz** [comment]
@weizhouBlue  Thanks for your attention.

first, the sysctl conf is same as you wish
```
# sysctl -a | egrep "net.ipv4.vs.conntrack|net.ipv4.vs.conn_reuse_mode"
net.ipv4.vs.conn_reuse_mode = 0
net.ipv4.vs.conntrack = 1
```

I reproduced your steps, but get different result. I will attach the detailed steps and my env as below. We should work out the root cause of those different results.
```
1~2 same as you. the status shows:
# ipvsadm -ln | grep 192.168.0.113:40080 -A2                                                                                
TCP  192.168.0.113:40080 rr
  -> 172.16.28.7:80               Masq        1      0          0
  -> 172.16.94.6:80               Masq        1      0          0
# ipvsadm -lnc 
IPVS connection entries
pro expire state       source             virtual            destination

--- no record here

3. make a request, all is normal
# curl 100.94.28.59:40080/ping --local-port 999
# ipvsadm -ln | grep 192.168.0.113:40080 -A2           
TCP  192.168.0.113:40080 rr
  -> 172.16.28.7:80               Masq        1      0          1
  -> 172.16.94.6:80               Masq        1      0          0

# ipvsadm -lnc  
IPVS connection entries
pro expire state       source             virtual            destination
TCP 01:40  TIME_WAIT   100.95.140.109:999 192.168.0.113:40080 172.16.28.7:80

4. delete the rs as what I changed in k8s
# ipvsadm -d -t 192.168.0.113:40080 -r 172.16.28.7:80
# ipvsadm -ln | grep 192.168.0.113:40080 -A2  
TCP  192.168.0.113:40080 rr
  -> 172.16.94.6:80               Masq        1      0          0

 # ipvsadm -lnc      
IPVS connection entries
pro expire state       source             virtual            destination
TCP 00:47  TIME_WAIT   100.95.140.109:999 192.168.0.113:40080 172.16.28.7:80

--- 172.16.28.7:80 still exist

5. make a request again
# curl 100.94.28.59:40080/ping --local-port 999
# ipvsadm -ln | grep 192.168.0.113:40080 -A2
TCP  192.168.0.113:40080 rr
  -> 172.16.94.6:80               Masq        1      0          1

# ipvsadm -lnc  
IPVS connection entries
pro expire state       source             virtual            destination
TCP 01:41  TIME_WAIT   100.95.140.109:999 192.168.0.113:40080 172.16.94.6:80

--- **same new request is processed by another rs: 172.16.94.6:80 AND the old connection of 172.16.28.7:80 is disappeared immediately thought is TIMEOUT is still not expired**
```

my env
```
# kube-proxy --version
Kubernetes v1.15.4-beta.0.24+b1c62c21df4169-dirty
# ipvsadm --version
ipvsadm v1.29 2016/12/23 (compiled with popt and IPVS v1.2.1)
# uname -a
Linux cluster-0001 4.19.36-vhulk1905.1.0.h276.eulerosv2r8.aarch64 #1 SMP Mon Apr 1 00:00:00 UTC 2019 aarch64 aarch64 aarch64 GNU/Linux
```

I guess

**Comment by weizhouBlue** [comment]
hi @njuicsgz 
it does differ , thanks for retrying my test
I just test it simply with IPVS on VM , but not on K8S. Maybe , I will try to update  versions of something , and I will post any update if possible

my env
# ipvsadm --version
ipvsadm v1.27 2008/5/15 (compiled with popt and IPVS v1.2.1)
# uname -a
Linux localhost.localdomain 3.10.0-693.el7.x86_64 #1 SMP Tue Aug 22 21:09:27 UTC 2017 x86_64 x86_64 x86_64 GNU/Linux
# cat /etc/centos-release
CentOS Linux release 7.4.1708 (Core)

**Comment by panpan0000** [comment]
@njuicsgz  @weizhouBlue , awesome, gurus !
those two parameters does help a lot on IPVS/NAT mode!

**Comment by weizhouBlue** [comment]
hi @njuicsgz  
I have found the key
Although the IPVS doc writes that net.ipv4.vs.conn_reuse_mode=0 will effectively  disable expire_nodest_conn , it performs differently with below two case:

1 when setting the RS to weight=0, regardless of the value of net.ipv4.vs.expire_nodest_conn , the problem exists
2 when deleting the RS from the ipvs, set net.ipv4.vs.expire_nodest_conn =1 can solve the issue , and settting net.ipv4.vs.expire_nodest_conn =1  could not help . BTW, by deleting the RS , the port reused request has 1s delay issue because of scheduling new RS

so ,the best configuration is 
net.ipv4.vs.conntrack=1
net.ipv4.vs.conn_reuse_mode=0 
net.ipv4.vs.expire_nodest_conn=1
and just possibly remove the RS from the ipvs, not setting the weight=0

**Comment by njuicsgz** [comment]
@weizhouBlue

**Comment by andrewsykim** [comment]
Still reading through the comments, but if I recall correctly, we added graceful termination _before_ we made the sysctl optimizations so the results found here may be possible. Will do some of my  own research/testing and report back, thanks folks!

**Comment by andrewsykim** [comment]
Confirmed that graceful deletion was added before we made the sysctl updates for `conn_reuse_mode` and `expire_nodest_conn`. 

PR for graceful termination (July 2018): https://github.com/kubernetes/kubernetes/pull/66012
PR for sysctl updates (Dec 2018): https://github.com/kubernetes/kubernetes/pull/71834

It seems likely we didn't re-evaluate the need for graceful termination after the sysctl updates @lbernail made. Sounds promising so far :)

**Comment by lbernail** [comment]
I just did the following test with kube-proxy `v1.14.5`:

- create a deployment with a single pod using http/1.1 (to do multiple requests on the same connection) and with a graceful termination period of 60s
- create a service backed by this deployment
- connect to the service using telnet and perform multiple `GET / HTTP/1.1` on the same connection
- delete the pod providing the service

Here is what happens:
- weight of the RS is set to 0
- connection remains in the "Active" state
- all GETs continue to work until the graceful termination ends which triggers a connection termination

However, if I delete the real server during the graceful termination period (using `sudo ipvsadm -d -t <VS> -r <RS>`) the connection is immediately terminated (RST triggered by `expire_nodest_conn`), effectively disabling graceful termination

**Comment by kvaps** [comment]
Hi, I have the same problem when I try using nfs-server-provisioner. After restarting the pod, the client connections are stuck due they try to reuse old connections.
For more details see https://github.com/kubernetes/kubernetes/issues/84322#issuecomment-546293485

I can confirm that disabling graceful termination or setting `sys.net.ipv4.vs.conn_reuse_mode` to `1` solves my problem.

**Comment by andrewsykim** [comment]
It sounds like the desired behavior for graceful termination is largely dependant on how applications handle graceful termination. Wondering if we should just make the graceful period configurable and call it a day

**Comment by lbernail** [comment]
I think the current graceful termination behavior is what most of us expect with some remaining problems:
- conn_reuse_mode =0 is great for performance but triggers a lot of small issues. More context on why it's set up this way here: https://github.com/kubernetes/kubernetes/issues/70747 and here: https://github.com/kubernetes/kubernetes/issues/71358)
- the default value for tcp_retries2 is too high for most use cases (15 => 15min to detect a failed connection when a remote host dies without cleanly shutting down the connection). We could lower it or at least provide a tunable
- ipvs default timeouts (900s for TCP, 120s for TCPFIN and 300s for UDP) are very high, especially in conjonction with `conn_reuse_mode=0` (increased chances of bad port reuse). We can definitely decrease them but it's not perfect. The better option would be to set weight to 0 on backend removal from endpoint and delete the realserver when the pod is completely deleted, but this would require modifying the endpoint controller and the associated API.

**Comment by andrewsykim** [comment]
> The better option would be to set weight to 0 on backend removal from endpoint and delete the realserver when the pod is completely deleted, but this would require modifying the endpoint controller and the associated API.

Or kube-proxy watching Pods but I don't think it's worth the performance trade-off

**Comment by andrewsykim** [comment]
Sounds like there are quite a few things we can tune, I am in favor of the following tunables as a start:
```
--ipvs-graceful-termination-period
--ipvs-tcp-timeout
--ipvs-tcpfin-timeout
--ipvs-udp-timeout
```

(see https://github.com/kubernetes/kubernetes/issues/84041 for tcp/tcpfin/udp timeouts)

I think it might be worthwhile to write up a KEP for this so all the possible options are considered. Anyone want to own this work?

**Comment by kvaps** [comment]
>     * The better option would be to set weight to 0 on backend removal from endpoint and delete the realserver when the pod is completely deleted, but this would require modifying the endpoint controller and the associated API.

I'm agree with that solution, I think this is most expected behavior in this case.

**Comment by njuicsgz** [comment]
> The better option would be to set weight to 0 on backend removal from endpoint and delete the realserver when the pod is completely deleted, but this would require modifying the endpoint controller and the associated API.

I am not agree with this, Only 

The purpose of graceful termination, as I understand, contains 2 part:
1) make best effort, the processing requests on terminating rs could response to client correctly
2) all new requests from client (no matter same conn_track or not) could route to new rs

from my experiment:
a)  setting weight to 0 will route new requests to the terminating pod(rs) in the case of conn_reuse_mode =0 while client local port reuse. this breaks 2)
b) delete rs could route new tcp requests to new rs, at same time, not break 1) for http request
c) for tcp long connection, as @andrewsykim shows above, I think it is not a cogent case, because the tcp connection will break sooner or later when the pod is deleted.

**Comment by lbernail** [comment]
@njuicsgz this does not match my tests or the one from @andrewsykim. Both of us tried to send traffic after removing the RS but while the entry still existed in the conntrack. The connection was closed after the next packet which broke graceful termination (we are using long tcp connections for the tests but this would also break any in-flight http request).

There is a misleading comment in the ipvs documentation saying that conn_reuse_mode=0 disables expire_nodest_conn (it's not true in my tests).

I wonder if this may be related to difference in Kernel versions (I tested this on 4.15)

**Comment by lbernail** [comment]
> Or kube-proxy watching Pods but I don't think it's worth the performance trade-off

Yes, we really can't do that, on large clusters the memory usage of kube-proxy would be far too high (and this would mostly defeat the purpose of endpoints)

**Comment by njuicsgz** [comment]
@lbernail 
Your tests make sense. Deleting rs makes connection error when client sending more packets, this is reasonable for graceful termination. But, for case in my test, which client reuse local port, large number of http short requests comming with same connection, the new request will continue routing to same terminating rs untill the pod recieve SIGKILL. That betrays the purpose of graceful termination.

I cannot forbidden my users not reuse client local port, while cannot set conn_reuse_mode=1 because of performance reason (delay 1s). That's my problem.

What I think is that, if we could just consider tcp short connection (most http) only and ignore tcp long connection. Because for tcp long connection, current graceful termination just extend the connecting time about xx senconds (most 15min?), it is still not enought for normal app (mysql/redis). 

As a trade off, could we just change the object of graceful termination from current new `connection` to new `request` ?

And yes, expire_nodest_conn takes effort when conn_reuse_mode=0.
my env
```
root@wlcb-meta-master:/opt/titan/cluster/conf# uname -a
Linux node102 4.4.0-104-generic #127-Ubuntu SMP Mon Dec 11 12:16:42 UTC 2017 x86_64 x86_64 x86_64 GNU/Linux
```

**Comment by andrewsykim** [comment]
> the default value for tcp_retries2 is too high for most use cases (15 => 15min to detect a failed connection when a remote host dies without cleanly shutting down the connection). We could lower it or at least provide a tunable

@lbernail I'm not able to reproduce the case where a real server isn't deleted for up to 15m because of the remote host dying. I tested this by opening a telnet connection to a pod in a remote host and then shutting down that remote host. Maybe I'm missing a step here to reproduce it.

**Comment by andrewsykim** [comment]
Nvm, I was able to reproduce by taking down the network interface instead of nuking the VM.

**Comment by lbernail** [comment]
> Nvm, I was able to reproduce by taking down the network interface instead of nuking the VM.

I typically test this by triggering a kernel panic

**Comment by DavadDi** [comment]
In my scenario the `/proc/sys/net/ipv4/vs/drop_entry` kernel option can help to reduce the numberr of InActConn.  

From: https://docs.huihoo.com/hpc-cluster/linux-virtual-server/HOWTO/LVS-HOWTO.operation.html
## 27.26.5. InActConn with drop_entry defense strategy
repeating the control experiment above, but using the drop_entry strategy (see the DoS strategies for more information).
director:/etc/lvs# echo "3" >/proc/sys/net/ipv4/vs/drop_entry

```
packets		InActConn, drop_entry=3
 1000		369,368,371
 2000		371,380,409
 4000		467,578,458
 8000		988,725,790
16000		999,994,990
```
The drop_entry strategy drops 1/32 of the entries every second, so the number of InActConn decreases linearly during the timeout period, rather than dropping suddenly at the end of the timeout period.

**Comment by imroc** [comment]
We also met this problem when deployment rolling update, after a deep dive, I found the root cause.

## What We Met
Client in cluster sends a lot of requests to the service(ipvs mode), when the dpeloyment corresponding to the service is rolling update, "No route to host" happens sometime, even with preStop (leave time for kube-proxy to sync ipvs rules).

## Deep Dive
"No route to host" means that the IP was not exists any more, could the request be sent to the pod that has already been destroyed?  
I try to do some experiment on this, I found that when the new pod is ready, its' pod ip:port  was added to the ipvs rules, and weight to 1, the old pod ip:port(terminating pod) weight to 0:
```
root@VM-0-3-ubuntu:~# ipvsadm -Ln -t 172.16.255.241:80
Prot LocalAddress:Port Scheduler Flags
  -> RemoteAddress:Port           Forward Weight ActiveConn InActConn
TCP  172.16.255.241:80 rr
  -> 172.16.8.106:80              Masq    0      10         14048
  -> 172.16.8.107:80              Masq    1      0          243
```
And most of the `InActConn` is in `TIME_WAIT` state which expires in 2 minutes, because client requests service with short lived connections, close connection after the request completed, and then the connection will turn to `TIME_WAIT` state, wait for  2 minutes(2*MSL) before deleting the connection. The old rs will not be completely kicked off until all its connections are cleaned up(InActConn+ActiveConn=0). 

All of above is expected, but then I found one thing is not expected, there were some new connection still been forwarded to old rs `172.16.8.106:80` which corresponding pod already been destroyed and its' weight is 0:
```
root@VM-0-3-ubuntu:~# tcpdump -i eth0 host 172.16.8.106 -n -tttt
tcpdump: verbose output suppressed, use -v or -vv for full protocol decode
listening on eth0, link-type EN10MB (Ethernet), capture size 262144 bytes
2019-12-13 11:49:47.319093 IP 10.0.0.3.36708 > 172.16.8.106.80: Flags [S], seq 3988339656, win 29200, options [mss 1460,sackOK,TS val 3751111666 ecr 0,nop,wscale 9], length 0
2019-12-13 11:49:47.319133 IP 10.0.0.3.36706 > 172.16.8.106.80: Flags [S], seq 109196945, win 29200, options [mss 1460,sackOK,TS val 3751111666 ecr 0,nop,wscale 9], length 0
2019-12-13 11:49:47.319144 IP 10.0.0.3.36704 > 172.16.8.106.80: Flags [S], seq 1838682063, win 29200, options [mss 1460,sackOK,TS val 3751111666 ecr 0,nop,wscale 9], length 0
2019-12-13 11:49:47.319153 IP 10.0.0.3.36702 > 172.16.8.106.80: Flags [S], seq 1591982963, win 29200, options [mss 1460,sackOK,TS val 3751111666 ecr 0,nop,wscale 9], length 0
2019-12-13 11:50:10.158452 IP 10.0.0.3.37878 > 172.16.8.106.80: Flags [S], seq 4124445126, win 29200, options [mss 1460,sackOK,TS val 3751134506 ecr 0,nop,wscale 9], length 0
```
I captured the SYN packets which will never receive ACK, because the old pod was already gone, pod ip was not exsists anymore, and I can also capture the icmp packets which tells that the ip was unreacheable ("No route to host").

So the question is that why try to establish a connection with rs with weight 0? Is there a bug in the scheduling algorithm of the ipvs kernel module? After read the scheduling logic of the linux ipvs source code, I did not find that it would be scheduled to rs with weight 0.

Maybe it's not a problem about scheduling? Then I try to read more code,  mainly `ip_vs_in` function in `net/netfilter/ipvs/ip_vs_core.c`, I found that it will check if the packet belongs to an existing connection entry, if it is, just forward packet to the rs corresponding to the existing connection, otherwise try to schedule.

Maybe the new connetion matched the existing connection for some reason? I try to modify the source code: If the weight of rs corresponding to the matched connection is 0, then try to reschedule. Compile and reload the kernel module, and then retest. I found that the problem was solved ! "No route to host" never happen again. But if we do this, graceful termination will not be supported anymore, because there were no more packets been forwarded to the rs if its' weight is 0. So, this is not a good solution.

But why the new connection matched the old connection? Does the client uses the same source port both in new connection and old connection? After some thought, I think it is possible: client send a lot of requests, using a large number of source ports, when the source port is not enough, client reuses source port which belongs to the connection in `TIME_WAIT` state, and then the five-tuple of the new SYN packet matched the old connection, ipvs treat it as an old connection, and then forward it to the old rs which already been destroyed.

## How to Avoid
This problem often happens in this situation: serviceA receives request out of cluster, and it will call serviceB as a client over rpc or http. When the amount of requests becomes large, the call of  serviceA to serviceB also becomes large, and "No route to host" will happens in serviceA call serviceB. We can increase the number of replicas for serviceA (client), and also add podAntiAffnity, disperse pods to different nodes, avoid source port exhaustion which lead to port reuse.

## How to Solve it Completely
[support configuration of kube-proxy IPVS tcp,tcpfin,udp timeout](https://github.com/kubernetes/kubernetes/pull/85517) will not solve it completely, and it also has no effect on connection which is in `TIME_WAIT` state.

[Should IPVS graceful termination ignore "inactive" connections?](https://github.com/kubernetes/kubernetes/issues/81308) I think it has both advantages and disadvantages, but the advantages can outweigh the disadvantages. The advantage is that we can remove unavailable rs faster, aviod the "No route to host", the disadvantage is that we can't be that "graceful", but I think it's enough.

**Comment by liubog2008** [comment]
I found same problem when rolling update coredns. The connection which has no destination will be expired when "first" packet is received and this packet will be dropped.

```
	/* Check the server status */
	if (cp->dest && !(cp->dest->flags & IP_VS_DEST_F_AVAILABLE)) {
		/* the destination server is not available */

		__u32 flags = cp->flags;

		/* when timer already started, silently drop the packet.*/
		if (timer_pending(&cp->timer))
			__ip_vs_conn_put(cp);
		else
			ip_vs_conn_put(cp);

		if (sysctl_expire_nodest_conn(ipvs) &&
		    !(flags & IP_VS_CONN_F_ONE_PACKET)) {
			/* try to expire the connection immediately */
			ip_vs_conn_expire_now(cp);
		}

		return NF_DROP;
	}
```

I think the "first" packet should be resend to another real server but not just be dropped.

**Comment by njuicsgz** [comment]
> [Should IPVS graceful termination ignore "inactive" connections?](https://github.com/kubernetes/kubernetes/issues/81308) I think it has both advantages and disadvantages, but the advantages can outweigh the disadvantages. The advantage is that we can remove unavailable rs faster, aviod the "No route to host", the disadvantage is that we can't be that "graceful", but I think it's enough.

exactly same scenario I meet. 
And I tried ignore "inactive" connections, but rs still can not be removed due to the active conn number increase, which because there are large number of requests continue coming.

Actually, ServiceA in my case is a ELB, so I can not increase its replicas.

**Comment by liubog2008** [comment]
I find a commit about why SYN packet is dropped.
```
commit f719e3754ee2f7275437e61a6afd520181fdd43b
Author: Julian Anastasov <ja@ssi.bg>
Date:   Sat Mar 5 15:03:22 2016 +0200

    ipvs: drop first packet to redirect conntrack

    Jiri Bohac is reporting for a problem where the attempt
    to reschedule existing connection to another real server
    needs proper redirect for the conntrack used by the IPVS
    connection. For example, when IPVS connection is created
    to NAT-ed real server we alter the reply direction of
    conntrack. If we later decide to select different real
    server we can not alter again the conntrack. And if we
    expire the old connection, the new connection is left
    without conntrack.

    So, the only way to redirect both the IPVS connection and
    the Netfilter's conntrack is to drop the SYN packet that
    hits existing connection, to wait for the next jiffie
    to expire the old connection and its conntrack and to rely
    on client's retransmission to create new connection as
    usually.

    Jiri Bohac provided a fix that drops all SYNs on rescheduling,
    I extended his patch to do such drops only for connections
    that use conntrack. Here is the original report from Jiri Bohac:

    Since commit dc7b3eb900aa ("ipvs: Fix reuse connection if real server
    is dead"), new connections to dead servers are redistributed
    immediately to new servers.  The old connection is expired using
    ip_vs_conn_expire_now() which sets the connection timer to expire
    immediately.

    However, before the timer callback, ip_vs_conn_expire(), is run
    to clean the connection's conntrack entry, the new redistributed
    connection may already be established and its conntrack removed
    instead.

    Fix this by dropping the first packet of the new connection
    instead, like we do when the destination server is not available.
    The timer will have deleted the old conntrack entry long before
    the first packet of the new connection is retransmitted.

    Fixes: dc7b3eb900aa ("ipvs: Fix reuse connection if real server is dead")
    Signed-off-by: Jiri Bohac <jbohac@suse.cz>
    Signed-off-by: Julian Anastasov <ja@ssi.bg>
    Signed-off-by: Simon Horman <horms@verge.net.au>
```

**Comment by lbernail** [comment]
@imroc Thanks for the great analysis
You are right, the reason traffic is sent to an inactive backend is because there is still an entry in the ipvs conntrack that hasn't expired and the client as reused the port matching this entry.

I think the main reason we have issues is because conn_reuse=0 disables checks (we set it to 0 a while back for performance reason).
We can test only for ActiveConn, in this case, we will remove the backend earlier (but it can still take a minute because garbage collection happens every minute), which will trigger a RST the next time a packet is sent (probably on a new connection). My only concern is we break the normal behavior of the TCP stack

On the UDP side there is no graceful termination, the issue comes from port reuse under high load while the entry expires in the IPVS conntrack. We have a PR to make this timeouts configurable (unless you do specific things with UDP I highly recommend setting the UDP timeout very low, for instance 10s)

**Comment by lbernail** [comment]
@imroc Thanks for the great analysis
You are right, the reason traffic is sent to an inactive backend is because there is still an entry in the ipvs conntrack that hasn't expired and the client as reused the port matching this entry.

I think the main reason we have issues is because conn_reuse=0 disables checks (we set it to 0 a while back for performance reason).
We can test only for ActiveConn, in this case, we will remove the backend earlier (but it can still take a minute because garbage collection happens every minute), which will trigger a RST the next time a packet is sent (probably on a new connection). My only concern is we break the normal behavior of the TCP stack

On the UDP side there is no graceful termination, the issue comes from port reuse under high load while the entry expires in the IPVS conntrack. We have a PR to make this timeouts configurable (unless you do specific things with UDP I highly recommend setting the UDP timeout very low, for instance 10s)

**Comment by juliantaylor** [comment]
in the short term maybe making the setting of `conn_reuse_mode` configurable in kube-proxy would be good.

if you have workloads that use keepalive connections the performance hit may not be as relevant as it only occurs if you have too many connections from the same source ip within the time wait window.

**Comment by juliantaylor** [comment]
again also see this post https://marc.info/?l=linux-virtual-server&m=151706660530133&w=2
dropping of the syn packages is intentional

**Comment by lbernail** [comment]
Interesting
Sadly, we can't disable conntrack in IPVS mode, we need it for nodeport and hairpin traffic (it would be great if we could for performance)

**Comment by andrewsykim** [comment]
Once https://github.com/kubernetes/enhancements/pull/1607 is approved, we should be able to start tracking terminating state of endpoints which means we can delete a real server as soon as the pod is terminated. This _should_ mean the # of "inactive" conntrack entries (mostly connections in TIME_WAIT) will be significantly less. I'm hoping this should alleviate most of the issues we're seeing with source port conflicts but will have to run some tests to confirm.

**Comment by lbernail** [comment]
KEP-1672 will definitely be a huge improvement for IPVS graceful termination (it will require EndpointSlices which are not GA yet but still).
Thanks a lot for your work on this @andrewsykim

**Comment by yyx** [comment]
Hello everyone：
      We are very fortunate to tell you that this bug has been fixed by us and has been verified to work very well.  The patch（[ipvs: avoid drop first packet to reuse conntrack](https://lkml.org/lkml/2020/6/11/272)） is being submitted to the Linux kernel community. You can also apply this patch to your own kernel, and then only need to set net.ipv4.vs.conn_reuse_mode=1. 
That Can solve the following problems:
1. Rolling update, IPVS keeps scheduling traffic to the destroyed Pod
2. Unbalanced IPVS traffic scheduling after scaled up or rolling update
3.fix IPVS low throughput issue #71114
https://github.com/kubernetes/kubernetes/pull/71114
4.One second connection delay in masque
https://marc.info/?t=151683118100004&r=1&w=2
5.IPVS low throughputÂ #70747
https://github.com/kubernetes/kubernetes/issues/70747  
6. Apache Bench can fill up ipvs service proxy in seconds #544
https://github.com/cloudnativelabs/kube-router/issues/544
7. Additional 1s latency in `host -> service IP -> pod` when upgrading from `1.15.3 -> 1.18.1` on RHEL 8.1 #90854
https://github.com/kubernetes/kubernetes/issues/90854

  Thank you.
  By Yang Yuxi （TencentCloudContainerTeam）

**Comment by andrewsykim** [comment]
Following-up on @yyx's comment above for posterity. 

The above patch mentioned in https://github.com/kubernetes/kubernetes/issues/81775#issuecomment-642704084 didn't make it to the kernel but there are two recently merged patches worth highlighting. One of them fixes the 1 second delay issue when a conntrack entry is reused and the other fixes an issue where packets are dropped when stale connection entries in the IPVS table are used:
1) http://patchwork.ozlabs.org/project/netfilter-devel/patch/20200701151719.4751-1-ja@ssi.bg/ 
2) http://patchwork.ozlabs.org/project/netfilter-devel/patch/20200708161638.13584-1-kim.andrewsy@gmail.com/ 

The 2nd patch in particular should help in cases where there is high load from a single client as described in the original issue description.

**Comment by andrewsykim** [comment]
This is probably a lot to ask. but it would be great if folks here are willing to try the 5.8 kernel when it is realized or back port the above patches on their own kernels to validate that this issue is fixed. My initial tests have shown good results but I did not validate it in an environment with lots of traffic.

**Comment by juliantaylor** [comment]
still relevant and fixable without downside on linux >= 5.9 as the 1sec SYN delay (kernel commit f0a5e4d7a594e0fe237d3dfafb069bb82f80f42f)

/remove-lifecycle stale

**Comment by dengruilong** [comment]
> I have resolved this problem just by deleting rs immediately when pod enters Terminating state.
> 
> Code diff like this:
> 
> ```
> @@ -168,10 +168,12 @@ func (m *GracefulTerminationManager) deleteRsFunc(rsToDelete *listItem) (bool, e
>                         // For UDP traffic, no graceful termination, we immediately delete the RS
>                         //     (existing connections will be deleted on the next packet because sysctlExpireNoDestConn=1)
>                         // For other protocols, don't delete until all connections have expired)
> -                       if strings.ToUpper(rsToDelete.VirtualServer.Protocol) != "UDP" && rs.ActiveConn+rs.InactiveConn != 0 {
> +                       /*
> +                       if strings.ToUpper(rsToDelete.VirtualServer.Protocol) != "UDP" && rs.ActiveConn+rs.InactiveConn != 0 {
>                                 klog.Infof("Not deleting, RS %v: %v ActiveConn, %v InactiveConn", rsToDelete.String(), rs.ActiveConn, rs.InactiveConn)
>                                 return false, nil
>                         }
> +                       */
>                         klog.V(2).Infof("Deleting rs: %s", rsToDelete.String())
>                         err := m.ipvs.DeleteRealServer(rsToDelete.VirtualServer, rs)
>                         if err != nil {
> ```
> 
> I test long request which needs 60s to response, the response can be correctly back if the endpoint is deleted from ipvs service. It seems everything works well, thought I want to known what's the disadvantage? If there is any please let me known, thanks. @juliantaylor @andrewsykim @lbernail
> 
> My test
> 
> ```
> t:
> # ipvsadm -ln | grep 192.168.0.113:40080 -A2
> TCP  192.168.0.113:40080 rr
>   -> 172.16.94.5:80               Masq        1      0          0
> # curl http://100.94.28.59:40080/sleep?second=60  -- will response after 60s
> 
> t+10s:
> # ipvsadm -ln | grep 192.168.0.113:40080 -A2
> TCP  192.168.0.113:40080 rr
>   -> 172.16.94.5:80               Masq        1      1          0
> # kubectl apply -f rc.yaml  -- create new pods, and delete olds
> 
> t+30s:
> # ipvsadm -ln | grep 192.168.0.113:40080 -A2
> TCP  192.168.0.113:40080 rr
>   -> 172.16.28.7:80               Masq        1      0          0
> 
> t+60s:
> # curl http://100.94.28.59:40080/sleep?second=60
> {"kind": "Status", "code": 200, "message": ""}
> 
> // of cource pods graceful_delete_period should be more than 60s which makes sure it is still alive
> ```

What's the conclusion for this issue? Does it really work after removing the ActConn&InActConn checking? The master branch still not accept your suggestion?

**Comment by uablrek** [comment]
Please test with PR https://github.com/kubernetes/kubernetes/pull/102122 applied and kernel >= 5.9 if possible.

**Comment by uablrek** [comment]
https://github.com/kubernetes/kubernetes/pull/102122 is now merged and should be included in v1.22.

This should be fixed with kernel >= 5.9.
References to the relevant kernel patches are in the https://github.com/kubernetes/kubernetes/issues/93297.

Please reopen this issue if the problem persists with https://github.com/kubernetes/kubernetes/pull/102122 and kernel >= 5.9.

/close

**Comment by woosley** [comment]
although this is a closed issue, I would like to know if the case can happen for long lasting tcp connections? for example, grpc. in this case, the client keeps the connection open and always re-use the source port, then IPVS would not cleanup the connection neither? @lbernail
