### ISSUE TITLE
kube-proxy "--cluster-cidr" does not result in SNAT when pod A on node A accessing node port service on node B

### ISSUE THREAD

**Issue by murali-reddy** [kubernetes/kubernetes#44916]
**Is this a request for help?** (If yes, you should use our troubleshooting guide and community support channels, see http://kubernetes.io/docs/troubleshooting/.):
No

**What keywords did you search in Kubernetes issues before filing this one?** (If you have found any duplicates, you should instead reply there.):
kube-proxy, masquerade, SNAT --cluster-cidr

**Is this a BUG REPORT or FEATURE REQUEST?** (choose one):
Bug

**Kubernetes version** (use `kubectl version`):
1.6.2

**Environment**:
- **Cloud provider or hardware configuration**:
- **OS** (e.g. from /etc/os-release):
- **Kernel** (e.g. `uname -a`):
- **Install tools**:
- **Others**:

**What happened**:

If you access a node port service on node B from pod A on node A, traffic does not get SNAT'ed as pod IP is in cluster CIDR range. So return traffic directly goes from destiantion pod to pod A directly. Pod A drops the packets as it was not expecting respnse from destination pod. Setting pod CIDR on each node for the '--cluster-cidr' flag ensure correct behaviour. If this was intended (passing pod cidr value to cluster-cidr) way to use this falg?

**What you expected to happen**:

On each node traffic other that particular pod CIDR should be source NAt'ed. 
**How to reproduce it** (as minimally and precisely as possible):

Just access a node port service from a pod running on different node.

**Anything else we need to know**:

**Comment by MrHohn** [comment]
> return traffic directly goes from destiantion pod to pod A directly. Pod A drops the packets as it was not expecting respnse from destination pod.

This isn't correct. Response should come from node B.

And I couldn't reproduce the behavior you described, logs as below (replaced IPs with names).
```
$ kubectl get pods -o wide
NAME                        READY     STATUS    RESTARTS   AGE       IP            NODE
busybox                     1/1       Running   0          51m       10.180.3.9    e2e-test-zihongz-minion-group-q7fs
my-nginx-2141241011-kzft8   1/1       Running   0          1h        10.180.2.10   e2e-test-zihongz-minion-group-rv1v

# Have a nodePort nginx service running.
$ kubectl get svc
NAME                CLUSTER-IP     EXTERNAL-IP   PORT(S)        AGE
kubernetes          10.0.0.1       <none>        443/TCP        4d
my-nginx-nodeport   10.0.183.208   <nodes>       80:30970/TCP   1h

# wget from busybox
$ wget -qO- node_rv1v_external_ip:30970
...something normal

# tcpdump on node rv1v (nginx pod is on it).
$ tcpdump -n -i any port 30970
tcpdump: verbose output suppressed, use -v or -vv for full protocol decode
listening on any, link-type LINUX_SLL (Linux cooked), capture size 262144 bytes
21:41:18.301020 IP 10.180.3.9.57676 > node_rv1v_external_ip.30970: Flags [S], seq 4229795513, win 28400, options [mss 1420,sackOK,TS val 105170224 ecr 0,nop,wscale 7], length 0
21:41:18.301020 IP 10.180.3.9.57676 > node_rv1v_external_ip.30970: Flags [S], seq 4229795513, win 28400, options [mss 1420,sackOK,TS val 105170224 ecr 0,nop,wscale 7], length 0
21:41:18.301062 IP node_q7fs_internal_ip.57676 > node_rv1v_external_ip.30970: Flags [S], seq 4229795513, win 28400, options [mss 1420,sackOK,TS val 105170224 ecr 0,nop,wscale 7], length 0
21:41:18.302528 IP node_rv1v_external_ip.30970 > node_q7fs_internal_ip.57676: Flags [S.], seq 3919445231, ack 4229795514, win 28160, options [mss 1420,sackOK,TS val 105171110 ecr 105170224,nop,wscale 7], length 0
21:41:18.302545 IP node_rv1v_external_ip.30970 > 10.180.3.9.57676: Flags [S.], seq 3919445231, ack 4229795514, win 28160, options [mss 1420,sackOK,TS val 105171110 ecr 105170224,nop,wscale 7], length 0
21:41:18.302551 IP node_rv1v_external_ip.30970 > 10.180.3.9.57676: Flags [S.], seq 3919445231, ack 4229795514, win 28160, options [mss 1420,sackOK,TS val 105171110 ecr 105170224,nop,wscale 7], length 0
21:41:18.302571 IP 10.180.3.9.57676 > node_rv1v_external_ip.30970: Flags [.], ack 1, win 222, options [nop,nop,TS val 105170224 ecr 105171110], length 0
21:41:18.302571 IP 10.180.3.9.57676 > node_rv1v_external_ip.30970: Flags [.], ack 1, win 222, options [nop,nop,TS val 105170224 ecr 105171110], length 0
21:41:18.302579 IP node_q7fs_internal_ip.57676 > node_rv1v_external_ip.30970: Flags [.], ack 1, win 222, options [nop,nop,TS val 105170224 ecr 105171110], length 0
21:41:18.302594 IP 10.180.3.9.57676 > node_rv1v_external_ip.30970: Flags [P.], seq 1:84, ack 1, win 222, options [nop,nop,TS val 105170224 ecr 105171110], length 83
21:41:18.303062 IP node_rv1v_external_ip.30970 > node_q7fs_internal_ip.57676: Flags [.], ack 84, win 220, options [nop,nop,TS val 105171110 ecr 105170224], length 0
21:41:18.303070 IP node_rv1v_external_ip.30970 > 10.180.3.9.57676: Flags [.], ack 84, win 220, options [nop,nop,TS val 105171110 ecr 105170224], length 0
21:41:18.303072 IP node_rv1v_external_ip.30970 > 10.180.3.9.57676: Flags [.], ack 84, win 220, options [nop,nop,TS val 105171110 ecr 105170224], length 0
21:41:18.303180 IP node_rv1v_external_ip.30970 > node_q7fs_internal_ip.57676: Flags [P.], seq 1:234, ack 84, win 220, options [nop,nop,TS val 105171110 ecr 105170224], length 233
21:41:18.303188 IP node_rv1v_external_ip.30970 > 10.180.3.9.57676: Flags [P.], seq 1:234, ack 84, win 220, options [nop,nop,TS val 105171110 ecr 105170224], length 233
21:41:18.303190 IP node_rv1v_external_ip.30970 > 10.180.3.9.57676: Flags [P.], seq 1:234, ack 84, win 220, options [nop,nop,TS val 105171110 ecr 105170224], length 233
21:41:18.303234 IP 10.180.3.9.57676 > node_rv1v_external_ip.30970: Flags [.], ack 234, win 231, options [nop,nop,TS val 105170224 ecr 105171110], length 0
21:41:18.303234 IP 10.180.3.9.57676 > node_rv1v_external_ip.30970: Flags [.], ack 234, win 231, options [nop,nop,TS val 105170224 ecr 105171110], length 0
21:41:18.303246 IP node_q7fs_internal_ip.57676 > node_rv1v_external_ip.30970: Flags [.], ack 234, win 231, options [nop,nop,TS val 105170224 ecr 105171110], length 0
21:41:18.303297 IP node_rv1v_external_ip.30970 > node_q7fs_internal_ip.57676: Flags [FP.], seq 234:846, ack 84, win 220, options [nop,nop,TS val 105171110 ecr 105170224], length 612
21:41:18.303303 IP node_rv1v_external_ip.30970 > 10.180.3.9.57676: Flags [FP.], seq 234:846, ack 84, win 220, options [nop,nop,TS val 105171110 ecr 105170224], length 612
21:41:18.303305 IP node_rv1v_external_ip.30970 > 10.180.3.9.57676: Flags [FP.], seq 234:846, ack 84, win 220, options [nop,nop,TS val 105171110 ecr 105170224], length 612
21:41:18.303318 IP 10.180.3.9.57676 > node_rv1v_external_ip.30970: Flags [.], ack 847, win 240, options [nop,nop,TS val 105170224 ecr 105171110], length 0
21:41:18.303318 IP 10.180.3.9.57676 > node_rv1v_external_ip.30970: Flags [.], ack 847, win 240, options [nop,nop,TS val 105170224 ecr 105171110], length 0
21:41:18.303324 IP node_q7fs_internal_ip.57676 > node_rv1v_external_ip.30970: Flags [.], ack 847, win 240, options [nop,nop,TS val 105170224 ecr 105171110], length 0
21:41:18.303618 IP 10.180.3.9.57676 > node_rv1v_external_ip.30970: Flags [F.], seq 84, ack 847, win 240, options [nop,nop,TS val 105170224 ecr 105171110], length 0
21:41:18.303618 IP 10.180.3.9.57676 > node_rv1v_external_ip.30970: Flags [F.], seq 84, ack 847, win 240, options [nop,nop,TS val 105170224 ecr 105171110], length 0
21:41:18.303627 IP node_q7fs_internal_ip.57676 > node_rv1v_external_ip.30970: Flags [F.], seq 84, ack 847, win 240, options [nop,nop,TS val 105170224 ecr 105171110], length 0
21:41:18.304004 IP node_rv1v_external_ip.30970 > node_q7fs_internal_ip.57676: Flags [.], ack 85, win 220, options [nop,nop,TS val 105171110 ecr 105170224], length 0
21:41:18.304015 IP node_rv1v_external_ip.30970 > 10.180.3.9.57676: Flags [.], ack 85, win 220, options [nop,nop,TS val 105171110 ecr 105170224], length 0
21:41:18.304018 IP node_rv1v_external_ip.30970 > 10.180.3.9.57676: Flags [.], ack 85, win 220, options [nop,nop,TS val 105171110 ecr 105170224], length 0
```

Could you do similar tcpdump and see what happen on your end?

**Comment by MrHohn** [comment]
And I don't think `--cluster-cidr` would affect this behavior.

**Comment by murali-reddy** [comment]
You are right. --cluster-cidr would not affect this behavior For pod B, default gateway would be the node B anyway. Sorry about confusion. Closing the bug. thanks for yourtime @MrHohn

**Comment by murali-reddy** [comment]
Ok, i though about it more. Here is my scenario.

Pod A on node A accessing the node port service on node B. service on node B, picks pod C on node C. Now here node B wont SNAT the traffic as pod A is in cluster CIDR. Pod C will see traffic from Pod A and traffic get routed back from node C in the reverse path.

I will re-verify the scenario and get back with tcpdump and re-open.
