### ISSUE TITLE
How to mitigate a misconfigured kubernetes DNS system?

### ISSUE THREAD

**Issue by TLINDEN** [kubernetes/kubernetes#89144]
**What happened**: A misconfigured kubernetes cluster saturates an external nameserver with queries for internal names. Here's a short trace:

` ` `
06:38:30.382721 IP kubernetes.59003 > nameserver.53: 38187+ AAAA? notifications. (31)
06:38:30.383329 IP nameserver.53 > kubernetes.59003: 38187 NXDomain 0/1/0 (106)
06:38:30.862978 IP kubernetes.47153 > nameserver.53: 26240+ AAAA? alerts-gremien.f-i-ts.de. (42)
06:38:30.863733 IP kubernetes.59003 > nameserver.53: 28374+ A? alerts-gremien.f-i-ts.de. (42)
06:38:30.864213 IP nameserver.53 > kubernetes.47153: 26240 NXDomain 0/1/0 (116)
06:38:30.865932 IP nameserver.53 > kubernetes.59003: 28374 NXDomain 0/1/0 (116)
06:38:31.287429 IP kubernetes.59003 > nameserver.53: 18603+ AAAA? observation. (29)
06:38:31.287700 IP nameserver.53 > kubernetes.59003: 18603 NXDomain 0/1/0 (104)
06:38:31.906514 IP kubernetes.59003 > nameserver.53: 22750+ AAAA? vault-managed. (31)
06:38:31.907122 IP nameserver.53 > kubernetes.59003: 22750 NXDomain 0/1/0 (106)
06:38:32.266844 IP kubernetes.47153 > nameserver.53: 5378+ [1au] A? objectstoragereplication-service. (61)
06:38:32.267350 IP nameserver.53 > kubernetes.47153: 5378 NXDomain 0/1/1 (136)
06:38:32.733678 IP kubernetes.59003 > nameserver.53: 21974+ AAAA? notification. (30)
06:38:32.734079 IP nameserver.53 > kubernetes.59003: 21974 NXDomain 0/1/0 (105)
06:38:33.155287 IP kubernetes.47153 > nameserver.53: 8384+ AAAA? history. (25)
06:38:33.155817 IP nameserver.53 > kubernetes.47153: 8384 NXDomain 0/1/0 (100)
06:38:33.216732 IP kubernetes.59003 > nameserver.53: 63187+ AAAA? antivirusix. (29)
06:38:33.218090 IP nameserver.53 > kubernetes.59003: 63187 NXDomain 0/1/0 (104)
06:38:33.577010 IP kubernetes.47153 > nameserver.53: 9113+ AAAA? inspect. (25)
06:38:33.577597 IP nameserver.53 > kubernetes.47153: 9113 NXDomain 0/1/0 (100)
06:38:34.149196 IP kubernetes.47153 > nameserver.53: 57106+ AAAA? localhost. (27)
06:38:34.149684 IP nameserver.53 > kubernetes.47153: 57106* 1/0/0 AAAA ::1 (55)
06:38:34.773004 IP kubernetes.47153 > nameserver.53: 10310+ AAAA? pinning. (25)
06:38:34.773978 IP nameserver.53 > kubernetes.47153: 10310 NXDomain 0/1/0 (100)
` ` `

The problem with this is, that this is an official internet nameserver, which tries to resolve each of those crab tlds against the root nameservers. This happens all the time 24x7 with hundreds of thousands queries of this kind.

**What you expected to happen**: 

Zero such queries.

**How to reproduce it (as minimally and precisely as possible)**:

n/a

**Anything else we need to know?**: 

I am the operator of the internet nameserver. The kubernetes cluster is being operated by a customer of a customer, they are very unresponsive and basically say "no problems here, we have 'clusterfirst' and everything works as expected".

**Environment**:
n/a

I need to mitigate this misbehavior somehow on the internet nameserver. A variety of setups come to mind:

* Create master zone files for each queried TLD and respond with nonsense
* Create master zone files for each queried TLD and respond with forwarding NS records directing kubernetes to nirvana
* Create a view and an ACL deniying DNS access to the internet nameserver by the kubernetes clients for those TLDs
* same as above but deny access for all kinds of queries

I need to know what I could do in a way to minimize impact on the kubernetes cluster, i.e. mitigate the behavior in a way that doesn't stop the system from functioning.

However, I cannot troubleshoot anything on the cluster and as I said above, I do not have any help by the customer's customer.

Thanks in advance,
Tom

**Comment by TLINDEN** [comment]
Thanks a lot for nothing. Fully automated procedures to make sure no person has to work on posted bugs. Unbelievable.
