### ISSUE TITLE
Kubernetes SkyDNS Load Test

### ISSUE THREAD

**Issue by ArtfulCoder** [kubernetes/kubernetes#14394]
Opened issue to track SkyDNS performance under load.

I have a docker image artfulcoder/dnsperf:1.0 which has dnsperf installed along with dnsutils.
The dnsperf container also has a generic load file that can be used (/queryfile-example-current)
Created a 4-node cluster and created 4 pods with this image (one per node).

### Ran DNSPerf
`/dnsperf -s 10.0.0.10 -d /kube-svcs -l 3600 -c 1000 -Q 60000 -v`

### DNS Query File

root@abhi3:/# cat /kube-svcs 
kubernetes.default.cluster.local.       A
heapster.kube-system.cluster.local.     A
kube-registry.kube-system.cluster.local.        A
kube-ui.kube-system.cluster.local.      A
monitoring-grafana.kube-system.cluster.local.   A
monitoring-influxdb.kube-system.cluster.local.  A

### Statistics:

  Queries sent:         2454640
  Queries completed:    2454608 (100.00%)
  Queries lost:         32 (0.00%)

  Response codes:       NOERROR 2454542 (100.00%), NXDOMAIN 66 (0.00%)
  Average packet size:  request 55, response 71
  Run time (s):         3600.154376
  Queries per second:   681.806318

  Average Latency (s):  0.090622 (min 0.089607, max 45.006053)
  Latency StdDev (s):   0.057879

### Conclusion so far
Barely any queries were dropped. This test was run from each pod simultaneously for 1 hour.
Each pod simulated 1000 clients..

**Comment by ArtfulCoder** [comment]
@thockin

**Comment by ArtfulCoder** [comment]
[Timeout] Query timed out: msg id 14054
[Timeout] Query timed out: msg id 13828
[Timeout] Query timed out: msg id 14136
[Timeout] Query timed out: msg id 14316
[Status] Testing complete (time limit)

Statistics:

  Queries sent:         21315743
  Queries completed:    21304437 (99.95%)
  Queries lost:         11306 (0.05%)

  Response codes:       NOERROR 21303038 (99.99%), SERVFAIL 1209 (0.01%), NXDOMAIN 190 (0.00%)
  Average packet size:  request 44, response 94
  Run time (s):         3600.463618
  Queries per second:   5917.137141

  Average Latency (s):  0.011859 (min 0.062276, max 29.009141)
  Latency StdDev (s):   0.007198

root@abhi3:/# cat kube-svcs                                               
kubernetes.default.cluster.local.       A
heapster.kube-system.cluster.local.     A
kube-registry.kube-system.cluster.local.        A
kube-ui.kube-system.cluster.local.      A
monitoring-grafana.kube-system.cluster.local.   A
monitoring-influxdb.kube-system.cluster.local.  A
creative.ak.fbcdn.net.	A
photos-d.ak.fbcdn.net.	A
www.stumbleupon.com.	A
external.ak.fbcdn.net.	A
120.55.22.178.in-addr.arpa.	PTR
external.ak.fbcdn.net.	A
twister.com.	A
www.riddleshut.com.	AAAA
a.root-servers.net.	A

root@abhi3:/# dnsperf -s 10.0.0.10 -d /kube-svcs -l 3600 -c 1000 -Q 60000

**Comment by thockin** [comment]
It's good that we start to get repro.  It's different than what some
reports have been (DNS taking 5-8 seconds and then succeeding), but we
should keep digging.

**Comment by ArtfulCoder** [comment]
#14315
#14051

**Comment by ArtfulCoder** [comment]
resolv.conf behavior: 

* The nameservers are tried in the order they are listed.
The caveat being that, the next nameserver will be tried only if the query to the previous nameserver times out. ie. if the previous nameserver returns a response (even if empty), the next nameserver will not be tried.

* The search paths (if specified), will only be tried with the first nameserver. If the first nameserver times out, the second nameserver will only be tried with the exact name specified by the client, without search paths appended.

* If search paths are used and the dots in the search query is less than ndots (default ndots value =1), the exact name specified by the client will be considered as a relative path, and the lookup with be done by appending the search path (in order), to the client-specified query. If lookups return no answer with the search path, then the client's query will be tried as FQDN (minus any search paths)

**Comment by ArtfulCoder** [comment]
strace running nslookup kubernetes on dns server 10.244.1.4 (dns pod ip), running from a pod on the same host as the dns pod.

brk(0x7fce1d9bf000Process 5239 attached
 <unfinished ...>
[pid  5239] set_robust_list(0x7fce17b7a9e0, 24) = 0 <0.000004>
[pid  5239] epoll_wait(5, Process 5238 attached
 <unfinished ...>
[pid  5238] set_robust_list(0x7fce1837b9e0, 24) = 0 <0.000003>
[pid  5238] gettimeofday({1443114525, 118196}, NULL) = 0 <0.000003>
[pid  5238] futex(0x7fce1c3ef07c, FUTEX_WAIT_PRIVATE, 1, NULLProcess 5237 attached
 <unfinished ...>
[pid  5237] set_robust_list(0x7fce18b7c9e0, 24) = 0 <0.000002>
[pid  5237] futex(0x7fce1c3ed0a4, FUTEX_WAIT_PRIVATE, 1, NULL <unfinished ...>
[pid  5236] <... brk resumed> )         = 0x7fce1d9bf000 <0.000121>
[pid  5236] open("/usr/lib/ssl/openssl.cnf", O_RDONLY) = 6 <0.000016>
[pid  5236] fstat(6, {st_mode=S_IFREG|0644, st_size=10835, ...}) = 0 <0.000004>
[pid  5236] mmap(NULL, 4096, PROT_READ|PROT_WRITE, MAP_PRIVATE|MAP_ANONYMOUS, -1, 0) = 0x7fce1c439000 <0.000005>
[pid  5236] read(6, "#\n# OpenSSL example configuratio"..., 4096) = 4096 <0.000007>
[pid  5236] read(6, "Netscape crash on BMPStrings or "..., 4096) = 4096 <0.000004>
[pid  5236] read(6, " this to avoid interpreting an e"..., 4096) = 2643 <0.000005>
[pid  5236] read(6, "", 4096)           = 0 <0.000004>
[pid  5236] close(6)                    = 0 <0.000005>
[pid  5236] munmap(0x7fce1c439000, 4096) = 0 <0.000009>
[pid  5236] futex(0x7fce1a88e0d0, FUTEX_WAKE_PRIVATE, 2147483647) = 0 <0.000016>
[pid  5236] open("/usr/lib/x86_64-linux-gnu/openssl-1.0.0/engines/libgost.so", O_RDONLY|O_CLOEXEC) = 6 <0.000013>
[pid  5236] read(6, "\177ELF\2\1\1\0\0\0\0\0\0\0\0\0\3\0>\0\1\0\0\0\320T\0\0\0\0\0\0"..., 832) = 832 <0.000012>
[pid  5236] fstat(6, {st_mode=S_IFREG|0644, st_size=89112, ...}) = 0 <0.000004>
[pid  5236] mmap(NULL, 2184224, PROT_READ|PROT_EXEC, MAP_PRIVATE|MAP_DENYWRITE, 6, 0) = 0x7fce17164000 <0.000006>
[pid  5236] mprotect(0x7fce17178000, 2093056, PROT_NONE) = 0 <0.000012>
[pid  5236] mmap(0x7fce17377000, 12288, PROT_READ|PROT_WRITE, MAP_PRIVATE|MAP_FIXED|MAP_DENYWRITE, 6, 0x13000) = 0x7fce17377000 <0.000006>
[pid  5236] close(6)                    = 0 <0.000003>
[pid  5236] mprotect(0x7fce17377000, 4096, PROT_READ) = 0 <0.000006>
[pid  5236] open("/usr/share/locale/C/libdns.cat", O_RDONLY) = -1 ENOENT (No such file or directory) <0.000028>
[pid  5236] open("/usr/share/locale/C/LC_MESSAGES/libdns.cat", O_RDONLY) = -1 ENOENT (No such file or directory) <0.000006>
[pid  5236] open("/usr/share/locale/C/libdns.cat", O_RDONLY) = -1 ENOENT (No such file or directory) <0.000019>
[pid  5236] open("/usr/share/locale/C/LC_MESSAGES/libdns.cat", O_RDONLY) = -1 ENOENT (No such file or directory) <0.000006>
[pid  5236] futex(0x7fce1bde8a7c, FUTEX_WAKE_PRIVATE, 2147483647) = 0 <0.000003>
[pid  5236] futex(0x7fce1bde8b50, FUTEX_WAKE_PRIVATE, 2147483647) = 0 <0.000003>
[pid  5236] open("/etc/resolv.conf", O_RDONLY) = 6 <0.000020>
[pid  5236] fstat(6, {st_mode=S_IFREG|0644, st_size=232, ...}) = 0 <0.000004>
[pid  5236] mmap(NULL, 4096, PROT_READ|PROT_WRITE, MAP_PRIVATE|MAP_ANONYMOUS, -1, 0) = 0x7fce1c439000 <0.000005>
[pid  5236] read(6, "nameserver 10.0.0.10\nnameserver "..., 4096) = 232 <0.000006>
[pid  5236] read(6, "", 4096)           = 0 <0.000004>
[pid  5236] close(6)                    = 0 <0.000004>
[pid  5236] munmap(0x7fce1c439000, 4096) = 0 <0.000021>
[pid  5236] futex(0x7fce1c3ed0a4, FUTEX_WAKE_OP_PRIVATE, 1, 1, 0x7fce1c3ed0a0, {FUTEX_OP_SET, 0, FUTEX_OP_CMP_GT, 1} <unfinished ...>
[pid  5237] <... futex resumed> )       = 0 <0.003635>
[pid  5237] futex(0x7fce1c3ed028, FUTEX_WAIT_PRIVATE, 2, NULL <unfinished ...>
[pid  5236] <... futex resumed> )       = 1 <0.000039>
[pid  5236] futex(0x7fce1c3ed028, FUTEX_WAKE_PRIVATE, 1 <unfinished ...>
[pid  5237] <... futex resumed> )       = 0 <0.000020>
[pid  5237] futex(0x7fce1c3ed028, FUTEX_WAKE_PRIVATE, 1) = 0 <0.000003>
[pid  5237] gettimeofday({1443114525, 121935}, NULL) = 0 <0.000003>
[pid  5237] mmap(NULL, 134217728, PROT_NONE, MAP_PRIVATE|MAP_ANONYMOUS|MAP_NORESERVE, -1, 0) = 0x7fce0f164000 <0.000005>
[pid  5237] munmap(0x7fce0f164000, 15319040) = 0 <0.000005>
[pid  5237] munmap(0x7fce14000000, 51789824) = 0 <0.000006>
[pid  5237] mprotect(0x7fce10000000, 139264, PROT_READ|PROT_WRITE) = 0 <0.000016>
[pid  5237] futex(0x7fce1bde8aa0, FUTEX_WAKE_PRIVATE, 2147483647) = 0 <0.000006>
[pid  5237] futex(0x7fce1b5e47d0, FUTEX_WAKE_PRIVATE, 2147483647) = 0 <0.000005>
[pid  5237] mprotect(0x7fce10022000, 32768, PROT_READ|PROT_WRITE) = 0 <0.000005>
[pid  5237] gettimeofday({1443114525, 122302}, NULL) = 0 <0.000004>
[pid  5237] mprotect(0x7fce1002a000, 8192, PROT_READ|PROT_WRITE) = 0 <0.000005>
[pid  5237] futex(0x7fce1c3ef07c, FUTEX_WAKE_OP_PRIVATE, 1, 1, 0x7fce1c3ef078, {FUTEX_OP_SET, 0, FUTEX_OP_CMP_GT, 1}) = 1 <0.000005>
[pid  5238] <... futex resumed> )       = 0 <0.004154>
[pid  5238] futex(0x7fce1c3ef028, FUTEX_WAIT_PRIVATE, 2, NULL <unfinished ...>
[pid  5237] futex(0x7fce1c3ef028, FUTEX_WAKE_PRIVATE, 1) = 1 <0.000003>
[pid  5238] <... futex resumed> )       = 0 <0.000017>
[pid  5238] gettimeofday({1443114525, 122407}, NULL) = 0 <0.000003>
[pid  5238] futex(0x7fce1c3ef028, FUTEX_WAKE_PRIVATE, 1) = 0 <0.000003>
[pid  5238] futex(0x7fce1c3ef07c, FUTEX_WAIT_BITSET_PRIVATE|FUTEX_CLOCK_REALTIME, 3, {1443114530, 122302000}, ffffffff <unfinished ...>
[pid  5237] rt_sigprocmask(SIG_UNBLOCK, [INT TERM], NULL, 8) = 0 <0.000004>
[pid  5237] rt_sigprocmask(SIG_BLOCK, [INT TERM], NULL, 8) = 0 <0.000003>
[pid  5237] socket(PF_INET, SOCK_DGRAM, IPPROTO_UDP) = 6 <0.000006>
[pid  5237] fcntl(6, F_DUPFD, 20)       = 20 <0.000003>
[pid  5237] close(6)                    = 0 <0.000004>
[pid  5237] fcntl(20, F_GETFL)          = 0x2 (flags O_RDWR) <0.000004>
[pid  5237] fcntl(20, F_SETFL, O_RDWR|O_NONBLOCK) = 0 <0.000003>
[pid  5237] uname({sys="Linux", node="abhi", ...}) = 0 <0.000006>
[pid  5237] futex(0x7fce1b5e48f8, FUTEX_WAKE_PRIVATE, 2147483647) = 0 <0.000004>
[pid  5237] setsockopt(20, SOL_SOCKET, SO_TIMESTAMP, [1], 4) = 0 <0.000005>
[pid  5237] setsockopt(20, SOL_IP, IP_MTU_DISCOVER, [0], 4) = 0 <0.000004>
[pid  5237] getsockopt(20, SOL_SOCKET, SO_RCVBUF, [212992], [4]) = 0 <0.000003>
[pid  5237] bind(20, {sa_family=AF_INET, sin_port=htons(0), sin_addr=inet_addr("0.0.0.0")}, 16) = 0 <0.000005>
[pid  5237] recvmsg(20, 0x7fce18b7bb80, 0) = -1 EAGAIN (Resource temporarily unavailable) <0.000003>
[pid  5237] write(4, "\24\0\0\0\375\377\377\377", 8) = 8 <0.000006>
[pid  5239] <... epoll_wait resumed> {{EPOLLIN, {u32=3, u64=3}}}, 64, -1) = 1 <0.004612>
[pid  5239] read(3, "\24\0\0\0\375\377\377\377", 8) = 8 <0.000005>
[pid  5239] epoll_ctl(5, EPOLL_CTL_ADD, 20, {EPOLLIN, {u32=20, u64=20}}) = 0 <0.000004>
[pid  5239] read(3, 0x7fce17b79e00, 8)  = -1 EAGAIN (Resource temporarily unavailable) <0.000004>
[pid  5239] epoll_wait(5,  <unfinished ...>
[pid  5237] gettimeofday({1443114525, 122845}, NULL) = 0 <0.000003>
[pid  5237] sendmsg(20, {msg_name(16)={sa_family=AF_INET, sin_port=htons(53), sin_addr=inet_addr("10.244.1.4")}, msg_iov(1)=[{"\314\201\1\0\0\1\0\0\0\0\0\0\nkubernetes\7default\3"..., 54}], msg_controllen=0, msg_flags=0}, 0) = 54 <0.000029>
[pid  5237] futex(0x7fce1c3ed0a4, FUTEX_WAIT_PRIVATE, 3, NULL <unfinished ...>
[pid  5236] <... futex resumed> )       = 1 <0.001013>
[pid  5236] rt_sigaction(SIGHUP, {0x7fce1b3ba840, ~[RTMIN RT_1], SA_RESTORER, 0x7fce1b175340}, NULL, 8) = 0 <0.000003>
[pid  5236] rt_sigsuspend([] <unfinished ...>
[pid  5238] <... futex resumed> )       = -1 ETIMEDOUT (Connection timed out) <4.999999>
[pid  5238] gettimeofday({1443114530, 122500}, NULL) = 0 <0.000004>
[pid  5238] futex(0x7fce1c3ed0a4, FUTEX_WAKE_OP_PRIVATE, 1, 1, 0x7fce1c3ed0a0, {FUTEX_OP_SET, 0, FUTEX_OP_CMP_GT, 1}) = 1 <0.000015>
[pid  5238] futex(0x7fce1c3ef028, FUTEX_WAKE_PRIVATE, 1) = 0 <0.000003>
[pid  5238] futex(0x7fce1c3ef07c, FUTEX_WAIT_PRIVATE, 5, NULL <unfinished ...>
[pid  5237] <... futex resumed> )       = 0 <4.999661>
[pid  5237] futex(0x7fce1c3ed028, FUTEX_WAKE_PRIVATE, 1) = 0 <0.000003>
[pid  5237] gettimeofday({1443114530, 122592}, NULL) = 0 <0.000003>
[pid  5237] gettimeofday({1443114530, 122619}, NULL) = 0 <0.000003>
[pid  5237] futex(0x7fce1c3ef07c, FUTEX_WAKE_OP_PRIVATE, 1, 1, 0x7fce1c3ef078, {FUTEX_OP_SET, 0, FUTEX_OP_CMP_GT, 1}) = 1 <0.000004>
[pid  5238] <... futex resumed> )       = 0 <0.000086>
[pid  5238] futex(0x7fce1c3ef028, FUTEX_WAIT_PRIVATE, 2, NULL <unfinished ...>
[pid  5237] futex(0x7fce1c3ef028, FUTEX_WAKE_PRIVATE, 1) = 1 <0.000003>
[pid  5238] <... futex resumed> )       = 0 <0.000018>
[pid  5238] gettimeofday({1443114530, 122693}, NULL) = 0 <0.000003>
[pid  5238] futex(0x7fce1c3ef028, FUTEX_WAKE_PRIVATE, 1) = 0 <0.000003>
[pid  5238] futex(0x7fce1c3ef07c, FUTEX_WAIT_BITSET_PRIVATE|FUTEX_CLOCK_REALTIME, 7, {1443114535, 122619000}, ffffffff <unfinished ...>
[pid  5237] gettimeofday({1443114530, 122745}, NULL) = 0 <0.000003>
[pid  5237] sendmsg(20, {msg_name(16)={sa_family=AF_INET, sin_port=htons(53), sin_addr=inet_addr("10.244.1.4")}, msg_iov(1)=[{"\314\201\1\0\0\1\0\0\0\0\0\0\nkubernetes\7default\3"..., 54}], msg_controllen=0, msg_flags=0}, 0) = 54 <0.000030>
[pid  5237] futex(0x7fce1c3ed0a4, FUTEX_WAIT_PRIVATE, 5, NULL <unfinished ...>
[pid  5239] <... epoll_wait resumed> {{EPOLLIN, {u32=20, u64=20}}}, 64, -1) = 1 <5.016382>
[pid  5239] futex(0x7fce1c3ed0a4, FUTEX_WAKE_OP_PRIVATE, 1, 1, 0x7fce1c3ed0a0, {FUTEX_OP_SET, 0, FUTEX_OP_CMP_GT, 1}) = 1 <0.000007>
[pid  5239] epoll_ctl(5, EPOLL_CTL_DEL, 20, {EPOLLIN, {u32=20, u64=20}}) = 0 <0.000004>
[pid  5239] epoll_wait(5,  <unfinished ...>
[pid  5237] <... futex resumed> )       = 0 <0.016525>
[pid  5237] futex(0x7fce1c3ed028, FUTEX_WAKE_PRIVATE, 1) = 0 <0.000004>
[pid  5237] gettimeofday({1443114530, 139380}, NULL) = 0 <0.000003>
[pid  5237] recvmsg(20, {msg_name(16)={sa_family=AF_INET, sin_port=htons(53), sin_addr=inet_addr("10.244.1.4")}, msg_iov(1)=[{"\314\201\205\200\0\1\0\1\0\0\0\0\nkubernetes\7default\3"..., 65535}], msg_controllen=32, {cmsg_len=32, cmsg_level=SOL_SOCKET, cmsg_type=0x1d /* SCM_??? */, ...}, msg_flags=0}, 0) = 70 <0.000005>
[pid  5237] fstat(1, {st_mode=S_IFCHR|0600, st_rdev=makedev(136, 3), ...}) = 0 <0.000004>
[pid  5237] mmap(NULL, 4096, PROT_READ|PROT_WRITE, MAP_PRIVATE|MAP_ANONYMOUS, -1, 0) = 0x7fce1c439000 <0.000008>
[pid  5237] write(1, "Server:\t\t10.244.1.4\n", 20) = 20 <0.000420>
[pid  5237] write(1, "Address:\t10.244.1.4#53\n", 23) = 23 <0.000285>
[pid  5237] write(1, "\n", 1)           = 1 <0.000047>
[pid  5237] write(1, "Name:\tkubernetes.default.svc.clu"..., 43) = 43 <0.000169>
[pid  5237] write(1, "Address: 10.0.0.1\n", 18) = 18 <0.000085>
[pid  5237] futex(0x7fce1c3ef07c, FUTEX_WAKE_OP_PRIVATE, 1, 1, 0x7fce1c3ef078, {FUTEX_OP_SET, 0, FUTEX_OP_CMP_GT, 1} <unfinished ...>
[pid  5238] <... futex resumed> )       = 0 <0.018024>
[pid  5237] <... futex resumed> )       = 1 <0.000013>
[pid  5238] futex(0x7fce1c3ef028, FUTEX_WAIT_PRIVATE, 2, NULL <unfinished ...>
[pid  5237] futex(0x7fce1c3ef028, FUTEX_WAKE_PRIVATE, 1 <unfinished ...>
[pid  5238] <... futex resumed> )       = 0 <0.000059>
[pid  5237] <... futex resumed> )       = 1 <0.000061>
[pid  5238] gettimeofday({1443114530, 140853}, NULL) = 0 <0.000003>
[pid  5238] futex(0x7fce1c3ef028, FUTEX_WAKE_PRIVATE, 1) = 0 <0.000004>
[pid  5238] futex(0x7fce1c3ef07c, FUTEX_WAIT_PRIVATE, 9, NULL <unfinished ...>
[pid  5237] write(4, "\24\0\0\0\373\377\377\377", 8 <unfinished ...>
[pid  5239] <... epoll_wait resumed> {{EPOLLIN, {u32=3, u64=3}}}, 64, -1) = 1 <0.001559>
[pid  5237] <... write resumed> )       = 8 <0.000017>
[pid  5239] read(3, "\24\0\0\0\373\377\377\377", 8) = 8 <0.000004>
[pid  5239] epoll_ctl(5, EPOLL_CTL_DEL, 20, {EPOLLIN, {u32=20, u64=20}}) = -1 ENOENT (No such file or directory) <0.000003>
[pid  5239] epoll_ctl(5, EPOLL_CTL_DEL, 20, {EPOLLOUT, {u32=20, u64=20}}) = -1 ENOENT (No such file or directory) <0.000004>
[pid  5239] close(20)                   = 0 <0.000007>
[pid  5239] read(3, 0x7fce17b79e00, 8)  = -1 EAGAIN (Resource temporarily unavailable) <0.000004>
[pid  5239] epoll_wait(5,  <unfinished ...>
[pid  5237] tgkill(5236, 5236, SIGTERM) = 0 <0.000006>
[pid  5237] futex(0x7fce1c3ed0a4, FUTEX_WAIT_PRIVATE, 7, NULL <unfinished ...>
[pid  5236] <... rt_sigsuspend resumed> ) = ? ERESTARTNOHAND (To be restarted if no handler) <5.018106>
[pid  5236] --- SIGTERM {si_signo=SIGTERM, si_code=SI_TKILL, si_pid=5236, si_uid=0} ---
[pid  5236] rt_sigreturn()              = -1 EINTR (Interrupted system call) <0.000004>
[pid  5236] write(1, "\n", 1)           = 1 <0.000027>
[pid  5236] futex(0x7fce1c3ed0a4, FUTEX_WAKE_OP_PRIVATE, 1, 1, 0x7fce1c3ed0a0, {FUTEX_OP_SET, 0, FUTEX_OP_CMP_GT, 1}) = 1 <0.000005>
[pid  5237] <... futex resumed> )       = 0 <0.000097>
[pid  5237] futex(0x7fce1c3ed028, FUTEX_WAIT_PRIVATE, 2, NULL <unfinished ...>
[pid  5236] futex(0x7fce1c3ed028, FUTEX_WAKE_PRIVATE, 1) = 1 <0.000004>
[pid  5237] <... futex resumed> )       = 0 <0.000018>
[pid  5237] futex(0x7fce1c3ed028, FUTEX_WAKE_PRIVATE, 1) = 0 <0.000009>
[pid  5237] gettimeofday({1443114530, 141194}, NULL) = 0 <0.000003>
[pid  5237] futex(0x7fce1c3ed0a4, FUTEX_WAIT_PRIVATE, 9, NULL <unfinished ...>
[pid  5236] futex(0x7fce1c3ed0a4, FUTEX_CMP_REQUEUE_PRIVATE, 1, 2147483647, 0x7fce1c3ed028, 10) = 1 <0.000004>
[pid  5237] <... futex resumed> )       = 0 <0.000019>
[pid  5237] futex(0x7fce1c3ed028, FUTEX_WAIT_PRIVATE, 2, NULL <unfinished ...>
[pid  5236] futex(0x7fce1c3ed028, FUTEX_WAKE_PRIVATE, 1) = 1 <0.000003>
[pid  5237] <... futex resumed> )       = 0 <0.000019>
[pid  5237] futex(0x7fce1c3ed028, FUTEX_WAKE_PRIVATE, 1) = 0 <0.000012>
[pid  5237] madvise(0x7fce1837c000, 8368128, MADV_DONTNEED) = 0 <0.000009>
[pid  5237] _exit(0)                    = ?
[pid  5237] +++ exited with 0 +++
[pid  5236] write(4, "\0\0\0\0\377\377\377\377", 8 <unfinished ...>
[pid  5239] <... epoll_wait resumed> {{EPOLLIN, {u32=3, u64=3}}}, 64, -1) = 1 <0.001297>
[pid  5239] read(3, "\0\0\0\0\377\377\377\377", 8) = 8 <0.000004>
[pid  5239] madvise(0x7fce1737a000, 8368128, MADV_DONTNEED) = 0 <0.000006>
[pid  5239] _exit(0)                    = ?
[pid  5239] +++ exited with 0 +++
[pid  5236] <... write resumed> )       = 8 <0.000084>
[pid  5236] epoll_ctl(5, EPOLL_CTL_DEL, 3, {EPOLLIN, {u32=3, u64=3}}) = 0 <0.000004>
[pid  5236] close(5)                    = 0 <0.000006>
[pid  5236] close(3)                    = 0 <0.000003>
[pid  5236] close(4)                    = 0 <0.000006>
[pid  5236] futex(0x7fce1c3ef07c, FUTEX_WAKE_OP_PRIVATE, 1, 1, 0x7fce1c3ef078, {FUTEX_OP_SET, 0, FUTEX_OP_CMP_GT, 1} <unfinished ...>
[pid  5238] <... futex resumed> )       = 0 <0.001599>
[pid  5238] futex(0x7fce1c3ef028, FUTEX_WAIT_PRIVATE, 2, NULL <unfinished ...>
[pid  5236] <... futex resumed> )       = 1 <0.000034>
[pid  5236] futex(0x7fce1c3ef028, FUTEX_WAKE_PRIVATE, 1 <unfinished ...>
[pid  5238] <... futex resumed> )       = 0 <0.000020>
[pid  5238] futex(0x7fce1c3ef028, FUTEX_WAKE_PRIVATE, 1) = 0 <0.000004>
[pid  5238] madvise(0x7fce17b7b000, 8368128, MADV_DONTNEED) = 0 <0.000005>
[pid  5238] _exit(0)                    = ?
[pid  5238] +++ exited with 0 +++
<... futex resumed> )                   = 1 <0.000056>
open("/proc/sys/vm/overcommit_memory", O_RDONLY|O_CLOEXEC) = 3 <0.000019>
read(3, "0", 1)                         = 1 <0.000005>
close(3)                                = 0 <0.000003>
madvise(0x7fce10021000, 45056, MADV_DONTNEED) = 0 <0.000014>
munmap(0x7fce17164000, 2184224)         = 0 <0.000020>
munmap(0x7fce1c3e8000, 266240)          = 0 <0.000035>
exit_group(0)                           = ?
+++ exited with 0 +++

**Comment by ArtfulCoder** [comment]
With ndots = 5, almost every single dns lookup that is a non-cluster DNS name (e.g. google.com), will result in 6 queries.

**Comment by ArtfulCoder** [comment]
http://lxr.free-electrons.com/source/net/dns_resolver/

dns resolver source code..

**Comment by ArtfulCoder** [comment]
skydns seems to return SERVFAIL if the query has 0 dots, but returns NXDOMAIN if the query has non-zero dots, and has not answer to provider.

root@abhi2:/# nslookup kubernetes
;; Got SERVFAIL reply from 10.0.0.10, trying next server

root@abhi2:/# nslookup kubernetes.default
Server:		10.0.0.10
Address:	10.0.0.10#53

** server can't find kubernetes.default: NXDOMAIN

**Comment by thockin** [comment]
I can not substantiate the "search paths don't apply to second nameserver"
part.  I ran tcpdump for port 53, added 127.0.0.1 as the first nameserver,
and then did `nslookup foo.bas`


```
21:23:58.247402 IP 127.0.0.1.43218 > 127.0.0.1.53: 29672+ A? foo.bas. (25)
21:23:59.247970 IP 10.240.211.155.36375 > 169.254.169.254.53: 29672+ A?
foo.bas. (25)
21:23:59.248646 IP 169.254.169.254.53 > 10.240.211.155.36375: 29672
NXDomain 0/1/0 (100)
21:23:59.248816 IP 127.0.0.1.46841 > 127.0.0.1.53: 61507+ A?
foo.bas.c.thockin-dev.internal. (48)
21:24:00.248924 IP 10.240.211.155.41731 > 169.254.169.254.53: 61507+ A?
foo.bas.c.thockin-dev.internal. (48)
21:24:00.250310 IP 169.254.169.254.53 > 10.240.211.155.41731: 61507
NXDomain 0/1/0 (123)
21:24:00.250456 IP 127.0.0.1.38159 > 127.0.0.1.53: 39773+ A?
foo.bas.844790599918.google.internal. (54)
21:24:01.250542 IP 10.240.211.155.44475 > 169.254.169.254.53: 39773+ A?
foo.bas.844790599918.google.internal. (54)
21:24:01.251291 IP 169.254.169.254.53 > 10.240.211.155.44475: 39773
NXDomain 0/1/0 (129)
21:24:01.251429 IP 127.0.0.1.40892 > 127.0.0.1.53: 33764+ A?
foo.bas.google.internal. (41)
21:24:02.251770 IP 10.240.211.155.47127 > 169.254.169.254.53: 33764+ A?
foo.bas.google.internal. (41)
21:24:02.252559 IP 169.254.169.254.53 > 10.240.211.155.47127: 33764
NXDomain 0/1/0 (116)
```

**Comment by ArtfulCoder** [comment]
root@abhi2:/# cat /etc/resolv.conf 
nameserver 127.0.0.1
nameserver 10.0.0.10
nameserver 169.254.169.254
nameserver 10.240.0.1
search default.svc.cluster.local svc.cluster.local cluster.local c.abshah-kubernetes-001.internal. 808746819879.google.internal. google.internal.
options ndots:5

------------------------

root@abhi2:/# nslookup kubernetes.default
Server:		10.0.0.10
Address:	10.0.0.10#53

** server can't find kubernetes.default: NXDOMAIN

-------------------------


21:50:29.329890 IP localhost.41099 > localhost.domain: 27577+ A? kubernetes.default. (36)
21:50:30.330044 IP abhi2.39919 > 10.0.0.10.domain: 27577+ A? kubernetes.default. (36)
21:50:30.334831 IP 10.0.0.10.domain > abhi2.39919: 27577 NXDomain 0/1/0 (111)

**Comment by ArtfulCoder** [comment]
resolve libc source code: https://sourceware.org/git/?p=glibc.git;a=blob;f=resolv/res_query.c;h=4a9b3b3f27288f1c6926082ba5aadcd0427b142e;hb=HEAD

**Comment by ArtfulCoder** [comment]
https://github.com/skynetservices/skydns1/issues/20

**Comment by thockin** [comment]
Note that this is skydns1 - old old.

Most important prio - find a culprit for periodic 5 second hangs

**Comment by ArtfulCoder** [comment]
Unable to reproduce errors with the newer skydns. will try to revert to older skydns one last time and see if the errors occur..

**Comment by ArtfulCoder** [comment]
With the old skydns


root@abhi2:/# time nslookup kube-registry.default.svc.cluster.local 10.244.0.5
Server:         10.244.0.5
Address:        10.244.0.5#53

** server can't find kube-registry.default.svc.cluster.local: NXDOMAIN


real    0m4.243s
user    0m0.000s
sys     0m0.004s

------------------------

14:06:43.039320 IP 10.244.1.4.36951 > 10.244.0.5.53: 60763+ A? kube-registry.default.svc.cluster.local.808746819879.google.internal. (86)
14:06:47.069953 IP 10.244.0.5.53 > 10.244.1.4.36951: 60763 NXDomain 0/1/0 (161)

**Comment by ArtfulCoder** [comment]
root@abhi2:/# time nslookup kube-registry.kube-system.svc.cluster.local 10.244>
Server:         10.244.0.5
Address:        10.244.0.5#53

Name:   kube-registry.kube-system.svc.cluster.local
Address: 10.0.94.9


real    0m8.162s
user    0m0.004s
sys     0m0.000s

---------------



14:12:00.355051 IP 10.244.1.4.42997 > 10.244.0.5.53: 24143+ A? kube-registry.kube-system.svc.cluster.local.default.svc.cluster.local. (87)
14:12:00.373170 IP 10.244.0.5.53 > 10.244.1.4.42997: 24143 NXDomain* 0/1/0 (148)
14:12:00.373340 IP 10.244.1.4.40953 > 10.244.0.5.53: 56330+ A? kube-registry.kube-system.svc.cluster.local.svc.cluster.local. (79)
14:12:00.403796 IP 10.244.0.5.53 > 10.244.1.4.40953: 56330 NXDomain* 0/1/0 (140)
14:12:00.403943 IP 10.244.1.4.36073 > 10.244.0.5.53: 21010+ A? kube-registry.kube-system.svc.cluster.local.cluster.local. (75)
14:12:00.420147 IP 10.244.0.5.53 > 10.244.1.4.36073: 21010 NXDomain* 0/1/0 (136)
14:12:00.420254 IP 10.244.1.4.45868 > 10.244.0.5.53: 13821+ A? kube-registry.kube-system.svc.cluster.local.c.abshah-kubernetes-001.internal. (94)
14:12:04.434717 IP 10.244.0.5.53 > 10.244.1.4.45868: 13821 NXDomain 0/1/0 (169)
14:12:04.434915 IP 10.244.1.4.49136 > 10.244.0.5.53: 4859+ A? kube-registry.kube-system.svc.cluster.local.808746819879.google.internal. (90)
14:12:08.462723 IP 10.244.0.5.53 > 10.244.1.4.49136: 4859 NXDomain 0/1/0 (165)
14:12:08.462924 IP 10.244.1.4.39828 > 10.244.0.5.53: 21478+ A? kube-registry.kube-system.svc.cluster.local.google.internal. (77)
14:12:08.478605 IP 10.244.0.5.53 > 10.244.1.4.39828: 21478 NXDomain 0/1/0 (152)
14:12:08.478719 IP 10.244.1.4.56108 > 10.244.0.5.53: 32138+ A? kube-registry.kube-system.svc.cluster.local. (61)
14:12:08.509616 IP 10.244.0.5.53 > 10.244.1.4.56108: 32138* 1/0/0 A 10.0.94.9 (77)

**Comment by ArtfulCoder** [comment]
With the old skydns, I am quite convinced that the problem is ndots.

The query is tried as FQDN only after trying it with all 6 search domains.
search domains which are non cluster-specific, get forwarded.
Each  forwarded request takes upto 4 seconds to fail.
We have 3 search domains, which are external to cluster. 
(c.abshah-kubernetes-001.internal. 808746819879.google.internal. google.internal.)

The query kube-registry.kube-system.svc.cluster.local.c.abshah-kubernetes-001.internal. takes 4 seconds

The query kube-registry.kube-system.svc.cluster.local.808746819879.google.internal. takes 4 seconds


(This time it will be faster)
The query kube-registry.kube-system.svc.cluster.local.google.internal. takes 0 seconds

**Comment by ArtfulCoder** [comment]
Will try one last time with the newer skydns

**Comment by ArtfulCoder** [comment]
Client-side timeouts happen too, but if they happen they dont result in 5 second responses. the timeout is immediate. With the iptables-kubeproxy, client side timeouts dont happen.
This is not the reason of the 5-second slowness that users experience.

**Comment by ArtfulCoder** [comment]
@thockin 
The culprit : Log in SkyDNS



;; QUESTION SECTION:
;kube-registry.kube-system.svc.cluster.local.808746819879.google.internal.      IN       A

Abhi: ServeDNSForward Request at: 1443366957374328618
Abhi: exchange request at:1443366957374410659
Abhi: ReadMsg err:read udp 10.240.0.1:53: i/o timeout
Abhi: exchange response in:4001276207
Abhi: exchange request at:1443366961375767744
Abhi: exchange response in:5228393
Abhi: ServeDNSForward processed in :4006733305
2015/09/27 15:16:01 Abhi: ServeDNS: Returned Response in: 4006944956
2015/09/27 15:16:01 Abhi: ServeDNS: Received Request at:1443366961385978927, req:;; opcode: QUERY, status: NOERROR, id: 53655
;; flags: rd; QUERY: 1, ANSWER: 0, AUTHORITY: 0, ADDITIONAL: 0

**Comment by ArtfulCoder** [comment]
https://github.com/miekg/dns/blob/master/client.go#L152

**Comment by ArtfulCoder** [comment]
I believe that if we adjust the readtimeout, our dns issues will be fixed easily.
should be an easy change.

I have not verified this, but the timeout is probably set around 5 seconds.
As a result, users see the 5 second delay.

**Comment by bgrant0607-nocc** [comment]
@ArtfulCoder Please add priority and team labels when filing issues.

**Comment by ArtfulCoder** [comment]
#14625

**Comment by ArtfulCoder** [comment]
The PR does seems to mitigate the problem significantly.

I believe we have to source of the problem:

### Consider how google.com gets resolved by kubernetes:

#### Client-side:
Each non-cluster dns query (e.g. google.com) results in the following sub-queries from the client to skydns nameserver (the first nameserver in /etc/resolv.conf):

google.com.default.svc.cluster.local.
google.com.svc.cluster.local. 
google.com.cluster.local. 
google.com.c.abshah-kubernetes-001.internal. 
google.com.808746819879.google.internal. 
google.com.google.internal.

#### Server-side on skydns (or probably any nameserver for that matter):
Each query that the skydns receives is looked up in etcd.
If that fails, it gets forwarded to each of the other nameservers (169.254.169.254, 10.240.0.1) 

### Conclusion
Each client non-cluster dns lookup literally ends up being 6 (search domains) * (3 nameservers) = 18 failed sub-queries.
It is no wonder that those kinds of queries take 120 to 200 milli seconds.
Queries should take around 10-20 milliseconds, but now take 10x the time.

Try doing a nslookup on "google.com" v/s "google.com." and see the difference in time taken..
> time nslookup google.com   (uses search domain suffixes) 
> time nslookup google.com.   (considered a FQDN lookup because of the trailing dot)

Further, we had 2 second timeouts on the forwarded requests (in skydns), this really added to the problem. Reducing that timeout to 300ms has helped a lot. 

### Next Steps
Finally, I believe we need to reduce the search domains that we have or configure skydns to not forward queries that end in "cluster.local". That will help mitigate the problem significantly.

**Comment by thockin** [comment]
Great sleuthing.  I don't think reducing search domains is viable, but it sounds very reasonable to tell skydns not to forward queries for the assigned domain (optionally).

@bketelsen @miekg - is it possible to tell skydns not to forward requests for the skydns-served domain?

**Comment by ArtfulCoder** [comment]
@thockin @bketelsen @miekg
Tim was right in that skydns works as documented. It doesn't  forward queries for the assigned domain.

The slowness is the combination of having 6 search domains, 3 nameservers.


Sometimes, the  skydns forwarding request times out in 4 seconds. This causes the delay.
If we could find a way to mitigate the forwarding request timeouts, we would be in a better state.

**Comment by miekg** [comment]
Reading through the last messages, what do you mean with:

> If we could find a way to mitigate the forwarding request timeouts, we would be in a better state.

forwarding requests to external nameserver (i.e. outside the current served skydns domain)?

**Comment by ArtfulCoder** [comment]
@miekg 

Checkout the log below. ( I added a few custom log statements in skydns binary):
1. SkyDNS gets a request "kube-registry.kube-system.svc.cluster.local.808746819879.google.internal."
2. SkyDNS forwards this request to "10.240.0.1", which is one of the nameservers that skydns can forward to.
3. ServeDNSForward method is called.
4. ServeDNSForwards calls the dns.Exchange method for a synchronous query to 10.240.0.1
5. The exchange call takes 4 seconds, and fails on ReadMsg, because of a timeout error.
https://github.com/miekg/dns/blob/master/client.go#L181

We are seeing such timeouts quite frequently.

--------

;; QUESTION SECTION:
;kube-registry.kube-system.svc.cluster.local.808746819879.google.internal. IN A


Abhi: ServeDNSForward Request at: 1443366957374328618
Abhi: exchange request at:1443366957374410659
Abhi: ReadMsg err:read udp 10.240.0.1:53: i/o timeout
Abhi: exchange response in:4001276207
Abhi: exchange request at:1443366961375767744
Abhi: exchange response in:5228393
Abhi: ServeDNSForward processed in :4006733305
2015/09/27 15:16:01 Abhi: ServeDNS: Returned Response in: 4006944956
2015/09/27 15:16:01 Abhi: ServeDNS: Received Request at:1443366961385978927, req:;; opcode: QUERY, status: NOERROR, id: 53655
;; flags: rd; QUERY: 1, ANSWER: 0, AUTHORITY: 0, ADDITIONAL: 0

-----------

**Comment by miekg** [comment]
[ Quoting <notifications@github.com> in "Re: [kubernetes] Kubernetes SkyDNS ..." ]
>@miekg
>
>Checkout the log below. ( I added a few custom log statements in skydns binary):
>1. SkyDNS gets a request "kube-registry.kube-system.svc.cluster.local.808746819879.google.internal."
>2. SkyDNS forwards this request to "10.240.0.1", which is one of the nameservers that skydns can forward to.
>3. ServeDNSForward method is called.
>4. ServeDNSForwards calls the dns.Exchange method for a synchronous query to 10.240.0.1
>5. The exchange call takes 4 seconds, and fails on ReadMsg, because of a timeout error.
>https://github.com/miekg/dns/blob/master/client.go#L181
>
>We are seeing such timeouts quite frequently.

Is there any way to instrument the remote nameserver for this query? Is it an
actual timeout? Is go dns doing something whacky? If SkyDNS doing something
whacky?

**Comment by ArtfulCoder** [comment]
@miekg I am not sure I can instrument the remote nameserver. I will see if I can instrument skydns further and see if skydns can do anything better.

We could potentially mitigate this by configuring skydns to return SERVFAIL for queries that dont match its assigned domain. That way, skydns does not forward at all and SERVFAIL would ensure that the dns client retries the next nameserver.. 
I would have to verify that the dns client does the right thing..

**Comment by miekg** [comment]
[ Quoting <notifications@github.com> in "Re: [kubernetes] Kubernetes SkyDNS ..." ]
>@miekg I am not sure I can instrument the remote nameserver. I will see if I can instrument skydns further and see if skydns can do anything better.
>
>We could potentially mitigate this by configuring skydns to return SERVFAIL for queries that dont match its assigned domain. That way, skydns does not forward at all and SERVFAIL would ensure that the dns client retries the next nameserver..

Not sure if I completely follow: you don't want skydns to forward queries to 
a recursive nameserver? I.e. the `-no-rec` option? 

>I would have to verify that the dns client does the right thing..
>
>---
>Reply to this email directly or view it on GitHub:
>https://github.com/kubernetes/kubernetes/issues/14394#issuecomment-143792612
/Miek

--
Miek Gieben

**Comment by ArtfulCoder** [comment]
yes, that is correct. I will see if the -no-rec option works for us (as a last resort)

**Comment by ArtfulCoder** [comment]
@miekg 
@thockin 

I think there is a small bug in skydns, where timeout set by the flag is actually doubled incorrectly.
https://github.com/skynetservices/skydns/blob/master/server/server.go#L84
https://github.com/skynetservices/skydns/blob/master/server/server.go#L85

That is why we have these  4 second timeouts here (even though the default is 2 seconds): https://github.com/miekg/dns/blob/master/client.go#L305

I am fairly certain that if we adjust the timeout flag on our end  a lot of these 4-5 second queries times will shrink by half. Till we pick up the latest skydns, I think I will set the timeout flag to be 1 second, make it 2 second timeout effectively.

----------

Following log is for my own record..

root@abhi4:/# time nslookup kube-registry.kube-system.svc.cluster 10.244.1.6   
Server:		10.244.1.6
Address:	10.244.1.6#53

** server can't find kube-registry.kube-system.svc.cluster: NXDOMAIN


real	0m4.458s
user	0m0.004s
sys	0m0.000s

---- 

;; QUESTION SECTION:
;kube-registry.kube-system.svc.cluster.c.abshah-kubernetes-001.internal.	IN	 A

Abhi: ServeDNSForward Request at: 1443471738637410419

Abhi: exchange request at :1443471738637501385
Abhi: Calling DialTimeout at :1443471738637788081
Abhi: Called DialTimeout at :1443471738637844876
Abhi: Writing Msg at :1443471738637860334
Abhi: Wrote Msg. Reading Msg at :1443471738637894288
Abhi: co.Read-ing at :1443471738637919777
Abhi: co.Read complete, err:read udp 10.240.0.1:53: i/o timeout, at :1443471742640269681
Abhi: ReadMsg: ReadMsgHeader Failed., err:read udp 10.240.0.1:53: i/o timeout, at :1443471742640315963
Abhi: ReadMsgErr, err:read udp 10.240.0.1:53: i/o timeout, at :1443471742640330329
Abhi: Read Msg complete at :1443471742640350780
Abhi: exchange response in:4002865474

Abhi: exchange request at :1443471742640378616Abhi: Calling DialTimeout at :1443471742640478325Abhi: Called DialTimeout at :1443471742644325098Abhi: Writing Msg at :1443471742644359737Abhi: Wrote Msg. Reading Msg at :1443471742644402086Abhi: co.Read-ing at :1443471742644420555Abhi: co.Read complete at :1443471742674064800Abhi: ReadMsg: ReadMsgHeader done. Unpacking. at :1443471742674116774Abhi: ReadMsg: Unpacked at :1443471742674157977Abhi: Read Msg complete at :1443471742674167901Abhi: exchange response in:33814448


Abhi: ServeDNSForward processed in :4036832762
2015/09/28 20:22:22 Abhi: ServeDNS: Returned Response in: 4037359767
2015/09/28 20:22:22 Abhi: ServeDNS: Received Request at:1443471742680855957, req:;; opcode: QUERY, status: NOERROR, id: 50517
;; flags: rd; QUERY: 1, ANSWER: 0, AUTHORITY: 0, ADDITIONAL: 0

----------------

**Comment by miekg** [comment]
Ack, yep, that's an easy fix.

Note: from a DNS perspective udp timeouts are the worst thing that can happen. I would still be really interested in why this is time outing. I *may* make some time to create some setup to replicate this locally.

**Comment by ArtfulCoder** [comment]
@miekg I have an container that has dnsperf installed that you can use to generate load
https://github.com/kubernetes/kubernetes/issues/14394#issue-107830623

But since you wrote skydns, I am pretty sure you have many ways to simulate dns load :))

**Comment by ArtfulCoder** [comment]
I think beyond 2 seconds, the probability of success of the dns request is probably close to 0.
i.e. Wating longer than 2 seconds will not help. skydns seems to retry on timeout and I have seen it succeed generally on retries.

I think setting the timeout value, will help a lot of k8s users, who are seeing 4-5 second response times..

**Comment by ArtfulCoder** [comment]
@miekg I don't think you will gain much by trying your own local setup. the timeouts are caused by delays in response from other nameservers that skydns forwards to. skydns can't control that.

I think I can satisfactorily say that clients seeing 4-5 second times is because the other nameservers are timing out and skydns had the accidental 4 second read timeout.

**Comment by miekg** [comment]
[ Quoting <notifications@github.com> in "Re: [kubernetes] Kubernetes SkyDNS ..." ]
>@miekg I have an container that has dnsperf installed that you can use to generate load
>https://github.com/kubernetes/kubernetes/issues/14394#issue-107830623
>
>But since you wrote skydns, I am pretty sure you have many ways to simulate dns load :))

Yes :-)

Thanks for your updates. I don't think it is load related, although most (Google
written) DNS servers block high qps clients - which is something I've seen in
production with SkyDNS).

Lowering the timeouts is fine, I'll make the change to SkyDNS to remove the 2*
in the timeout settings.

/Miek

--
Miek Gieben

**Comment by miekg** [comment]
Note btw, that there *is* caching implemented in SkyDNS - but I am not happy with the impl. I'm going to make a few changes to it:
a) don't cache answers from etcd
b) cache upstream queries only

This is a reversal of the current impl.

**Comment by ArtfulCoder** [comment]
Thanks for the heads-up on caching strategy.

**Comment by thockin** [comment]
All sounds good. Thanks guys.  And FWIW I totally believe that it might be
throttling at Google DNS servers (which might be more reason NOT to use
SkyDNS as a forwarder)

**Comment by ArtfulCoder** [comment]
@thockin yes, i will be trying out the no-recurse option and validate that clients are not impacted in any way. 
Will verify clients on ubuntu and busybox. apparently the libc flavors on them are different, causing different resolver behavior on both.

On busybox, I believe the FQDN is tried before treating query as relative path (as per resolv.conf doc), even if dots in query < ndots.
On ubuntu, queery is treated as relative path (as long as dots are < ndots)

**Comment by karlkfi** [comment]
I've found what may or may not be a related issue with SkyDNS when chaining DNS in K8s-Mesos. 

In this setup, kube-dns is configured to delegate to /etc/resolv.conf when it can't find a result, and we have mesos-dns at the top of /etc/resolv.conf. Kube-DNS resolves k8s domains as expected, but sporatically fails (NXDOMAIN) when delegating resolution to Mesos-dns. Mesos-dns seems to work fine when queried directly. And this issue can be reproduced without any load. 

I'll comment later with the exact /etc/resolv.conf contents.

**Comment by smarterclayton** [comment]
I'll note that we've run with recursion disabled in OpenShift's SkyDNS for the last few months and we occasionally still see multi-second pauses as well (it's an open issues we've been looking at as well, very likely same root cause).  It did reduce the impact of some pauses, but very rarely we'll get SERVFAIL for other reasons.

**Comment by ArtfulCoder** [comment]
IIUC, the readtimeout should only impact udp requests made from SkyDNS.
With no-recurse, SkyDNS would not make udp requests to other nameservers..

**Comment by ArtfulCoder** [comment]
@karlkfi 
do you have mesos-dns at the top of /etc/resolv.conf for pods as well ?

**Comment by karlkfi** [comment]
@ArtfulCoder 
The following output is from our DCOS setup where `10.0.4.194` is mesos-dns, `10.10.10.10` is kube-dns.

```
$ kubectl get service kube-dns --namespace=kube-system
NAME       LABELS                                                                           SELECTOR           IP(S)         PORT(S)
kube-dns   k8s-app=kube-dns,kubernetes.io/cluster-service=true,kubernetes.io/name=KubeDNS   k8s-app=kube-dns   10.10.10.10   53/UDP
                                                                                                                             53/TCP
```

```
$ kubectl exec kube-dns-v8-4nbgq -c skydns --namespace=kube-system -- cat /etc/resolv.conf
options timeout:1
options attempts:3
nameserver 10.0.4.194
nameserver 10.0.0.2
options ndots:5
```

```
$ kubectl get pod oinker-rc-7qmk6 -o template --template='{{.spec.dnsPolicy}}'
ClusterFirst
```

```
$ kubectl exec oinker-rc-7qmk6 -c server -- cat /etc/resolv.conf
nameserver 10.10.10.10
nameserver 10.0.4.194
nameserver 10.0.0.2
search default.svc.cluster.local svc.cluster.local cluster.local
options ndots:5
```

Digs to kube-dns for k8s targets from k8s pods works fine.
Digs to kube-dns for mesos targets from k8s pods is flakey.
Digs to mesos-dns for mesos targets from k8s pods works fine.

For example, here's two consecutive digs where the second one failed:

```
$ exec oinker-rc-7qmk6 -c server -- dig @10.10.10.10 leader.mesos

; <<>> DiG 9.9.5-9+deb8u3-Debian <<>> @10.10.10.10 leader.mesos
; (1 server found)
;; global options: +cmd
;; Got answer:
;; ->>HEADER<<- opcode: QUERY, status: NOERROR, id: 57058
;; flags: qr aa rd ra; QUERY: 1, ANSWER: 1, AUTHORITY: 0, ADDITIONAL: 0

;; QUESTION SECTION:
;leader.mesos.			IN	A

;; ANSWER SECTION:
leader.mesos.		60	IN	A	10.0.4.194

;; Query time: 2 msec
;; SERVER: 10.10.10.10#53(10.10.10.10)
;; WHEN: Mon Oct 05 19:22:09 UTC 2015
;; MSG SIZE  rcvd: 46

$ kubectl exec oinker-rc-7qmk6 -c server -- dig @10.10.10.10 leader.mesos

; <<>> DiG 9.9.5-9+deb8u3-Debian <<>> @10.10.10.10 leader.mesos
; (1 server found)
;; global options: +cmd
;; Got answer:
;; ->>HEADER<<- opcode: QUERY, status: NXDOMAIN, id: 31347
;; flags: qr rd ra; QUERY: 1, ANSWER: 0, AUTHORITY: 1, ADDITIONAL: 1

;; OPT PSEUDOSECTION:
; EDNS: version: 0, flags:; udp: 4096
;; QUESTION SECTION:
;leader.mesos.			IN	A

;; AUTHORITY SECTION:
.			3395	IN	SOA	a.root-servers.net. nstld.verisign-grs.com. 2015100500 1800 900 604800 86400

;; Query time: 1 msec
;; SERVER: 10.10.10.10#53(10.10.10.10)
;; WHEN: Mon Oct 05 19:22:10 UTC 2015
;; MSG SIZE  rcvd: 116
```

However, hitting mesos-dns directly works every time:

```
$ kubectl exec oinker-rc-7qmk6 -c server -- dig @10.0.4.194 leader.mesos

; <<>> DiG 9.9.5-9+deb8u3-Debian <<>> @10.0.4.194 leader.mesos
; (1 server found)
;; global options: +cmd
;; Got answer:
;; ->>HEADER<<- opcode: QUERY, status: NOERROR, id: 38908
;; flags: qr aa rd ra; QUERY: 1, ANSWER: 1, AUTHORITY: 0, ADDITIONAL: 0

;; QUESTION SECTION:
;leader.mesos.			IN	A

;; ANSWER SECTION:
leader.mesos.		60	IN	A	10.0.4.194

;; Query time: 0 msec
;; SERVER: 10.0.4.194#53(10.0.4.194)
;; WHEN: Mon Oct 05 19:27:28 UTC 2015
;; MSG SIZE  rcvd: 46
```

**Comment by karlkfi** [comment]
I was able to make the above work as expected (without flakiness) by explicitly configuring `-nameservers` on skydns. But that isn't a great solution, because it makes the kube-dns config specific to our deployment, instead of just dynamically inheriting the mesos-slave dns settings.

**Comment by miekg** [comment]
So what are we left with here? "occasionally still see multi-second pauses" ? Can I utter the word "GC" here, or is it something deeper with SkyDNS/go DNS?

**Comment by ArtfulCoder** [comment]
Mesos-dns issue seems to be about flakiness, rather than a timeout.
Per Karl, Skydns sometimes seems to sometimes ignore nameservers, unless explicitly specified.

**Comment by ArtfulCoder** [comment]
@miekg is it possible that there is a concurrency issue (specifically, data visibility, where the nameservers are not visible on some request thread since its not being read across a memory barrier like a lock ?

**Comment by ArtfulCoder** [comment]
Created a PR to verify that skydns reads defaults from /etc/resolv.conf successfully.
Today, if there is a failure, skydns ignores it.

**Comment by ArtfulCoder** [comment]
This can't be the cause of flakiness, unless we are running more than 1 instance of skydns on Mesos where one successfully reads /etc/resolv.conf and the other doesnt...

**Comment by karlkfi** [comment]
@ArtfulCoder The k8s dcos package currently only deploys one instance of kube-dns.

FYI, we're using the cluster/addons/dns templates as a base and then using sed to replace the salt pillar pieces: https://github.com/mesosphere/kubernetes-mesos/blob/master/images/dcos/bootstrap.sh#L209-L214

**Comment by ArtfulCoder** [comment]
@karlkfi the only way we can debug the mesos-k8s dns issue is to use tcpdump and see the traffic on client and on skydns pod to see what is actually going on.
If you are up for it, it would be great to run "tcpdump -n port 53" on both the client pod and the skydns pod and capture traffic during the failed dig request.

This will clearly tell us what is going on.

**Comment by ArtfulCoder** [comment]
@karlkfi is there a way we can do a remote debugging session where I can get on to one of the clusters and investigate what is going on ?

**Comment by karlkfi** [comment]
@ArtfulCoder we can do a screenhero session later today, if you want. hit me up on slack.

**Comment by ArtfulCoder** [comment]
thanks @karlkfi for doing the screen share!
@miekg apparently skydns does round-robin causing this issue since the two nameservers are not equivalent. Do you have skydns container with roundrobin flag and the norec flag ?

**Comment by karlkfi** [comment]
@ArtfulCoder and I tried skydns (both `gcr.io/google_containers/skydns:2015-03-11-001` and a new image built from master) and even with `-round-robin=false` and `-no-rec=false` the results appear to always be both round-robin and recursive...

**Comment by karlkfi** [comment]
strace of skydns while running shows that when delegating to mesos-dns works correctly connections are made to both mesos-dns (`10.0.4.140`) AND the local network resolver (`10.0.0.2`):

```
$ cat strace.successfulcall |grep connect
3211  connect(8, {sa_family=AF_INET, sin_port=htons(53), sin_addr=inet_addr("10.0.4.140")}, 16 <unfinished ...>
3211  <... connect resumed> )           = 0 <0.000032>
3212  connect(8, {sa_family=AF_INET, sin_port=htons(53), sin_addr=inet_addr("10.0.0.2")}, 16) = 0 <0.000031>
3212  connect(8, {sa_family=AF_INET, sin_port=htons(53), sin_addr=inet_addr("10.0.0.2")}, 16 <unfinished ...>
3212  <... connect resumed> )           = 0 <0.000027>
```

And when delegation fails, the only connection is to the local network resolver (`10.0.0.2`):

```
$ cat strace.failedcall |grep connect
3211  connect(8, {sa_family=AF_INET, sin_port=htons(53), sin_addr=inet_taddr("10.0.0.2")}, 16) = 0 <0.000027>
```

**Comment by karlkfi** [comment]
tcpdump results show the same as the above. 

When the dig to kube-dns succeeds (`dig @10.0.1.181 -p 1025 leader.mesos`), tcp dump of udp traffic to mesos-dns (`10.0.4.140`) occurs:

```
$ tcpdump -n udp and host 10.0.4.140 -vvv
...
21:47:12.670613 IP (tos 0x0, ttl 63, id 36058, offset 0, flags [DF], proto UDP (17), length 69)
    10.0.1.181.40352 > 10.0.4.140.53: [bad udp cksum 0x1a83 -> 0x839e!] 918+ [1au] A? leader.mesos. ar: . OPT UDPsize=4096 (41)
21:47:12.672318 IP (tos 0x0, ttl 64, id 53515, offset 0, flags [DF], proto UDP (17), length 74)
    10.0.4.140.53 > 10.0.1.181.40352: [udp sum ok] 918* q: A? leader.mesos. 1/0/0 leader.mesos. [1m] A 10.0.4.140 (46)
```

When the exact same dig to kube-dns fails (NXDOMAIN), the tcpdump shows no traffic to mesos-dns (`10.0.4.140`).

**Comment by ArtfulCoder** [comment]
@miekg 
Submitted a fix to skydns.
https://github.com/skynetservices/skydns/pull/231

**Comment by ArtfulCoder** [comment]
Closing this issue.
we started off with tracking load related issues on this issue.
it transformed into other skynds flakiness issues too :)

Have a second thread for the flakiness issue..kubernetes/kubernetes#15303
