### ISSUE TITLE
kube-proxy ipvs mode does not configure rs server as expect during rolling upgrade

### ISSUE THREAD

**Issue by regardfs** [kubernetes/kubernetes#90188]
**What happened**:
1. Below is test yaml file which would create a nginx svc and a deployment with two pods:
```
apiVersion: apps/v1
kind: Deployment
metadata:
  name: nginx-deployment
spec:
  selector:
    matchLabels:
      app: nginx
  replicas: 2
  strategy:
    type: RollingUpdate
    rollingUpdate:
      maxSurge: 1
      maxUnavailable: 1
  template:
    metadata:
      labels:
        app: nginx
    spec:
      affinity:
        podAntiAffinity:
          requiredDuringSchedulingIgnoredDuringExecution:
          - topologyKey: kubernetes.io/hostname
            labelSelector:
              matchLabels:
                app: nginx
      containers:
      - name: nginx
        image: nginx:1.16
        ports:
        - containerPort: 80
        readinessProbe:
          failureThreshold: 3
          initialDelaySeconds: 30
          periodSeconds: 5
          successThreshold: 1
          tcpSocket:
            port: 80
          timeoutSeconds: 1
        livenessProbe:
          failureThreshold: 3
          initialDelaySeconds: 30
          periodSeconds: 5
          successThreshold: 1
          tcpSocket:
            port: 80
          timeoutSeconds: 1
---
apiVersion: v1
kind: Service
metadata:
  name: nginx
spec:
  ports:
    - port: 18080
      targetPort: 80
      protocol: TCP
  selector:
    app: nginx
```
2. Get the cluster ip of the nginx svc,  login one host in k8s cluster and run cmd as below:
in my env, 10.233.30.38 is the svc cluster ip
```
while true;do curl http://10.233.30.38:18080;sleep 0.2;done
```
3. Watch ipvsadm status for this vs:
```
watch -d -n 1 'ipvsadm -Ln -t 10.233.30.38:18080'
Every 1.0s: ipvsadm -Ln -t 10.233.30.38:18080  Thu Apr 16 00:00:08 2020
Prot LocalAddress:Port Scheduler Flags
  -> RemoteAddress:Port           Forward Weight ActiveConn InActConn
TCP  10.233.30.38:18080 rr
  -> 10.233.78.70:80              Masq    1	        0          150
  -> 10.233.87.42:80              Masq    1	        0          150
```
4. Then `kubectl edit deployment nginx-deployment` and change image to nginx:1.17 and do rolling upgrade
5. curl cmd response as `curl: (7) Failed connect to 10.233.30.38:18080;  timeout` and Watch ipvsadm status displaying as below:
```
Prot LocalAddress:Port Scheduler Flags
  -> RemoteAddress:Port           Forward Weight ActiveConn InActConn
TCP  10.233.30.38:18080 rr
  -> 10.233.78.70:80              Masq    0	        0          19 // old one
  -> 10.233.82.73:80              Masq    1	        0          0  // new pod
  -> 10.233.87.42:80              Masq    0	        1          11 // old one
  -> 10.233.87.43:80              Masq    1	        0          0  // new pod
```
6.  Finally it will delete one rs(pod) which weight is zero, it would never delete but only keep the other rs(pod) which ActiveConn is 1:
```
Every 1.0s: ipvsadm -Ln -t 10.233.30.38:18080  Thu Apr 16 00:07:58 2020

Prot LocalAddress:Port Scheduler Flags
  -> RemoteAddress:Port           Forward Weight ActiveConn InActConn
TCP  10.233.30.38:18080 rr
  -> 10.233.82.73:80              Masq    1	        0          0
  -> 10.233.87.42:80              Masq    0	        1          0
  -> 10.233.87.43:80              Masq    1	        0          0
```
by tcpdump: 10.233.78.39 is the tunl0 ip
inet 10.233.78.39/32 brd 10.233.78.39 scope global tunl0
```
00:00:00.000007 IP 10.233.78.39.39390 > 10.233.87.42.http: Flags [S], seq 1475019274, win 43690, options [mss 65495,sackOK,TS val 271635135 ecr 0,nop,wscale 7], length 0
00:00:00.000009 IP 192.168.32.47 > 192.168.32.199: IP 10.233.78.39.39390 > 10.233.87.42.http: Flags [S], seq 1475019274, win 43690, options [mss 65495,sackOK,TS val 271635135 ecr 0,nop,wscale 7], length 0 (ipip-proto-4)
00:00:00.000203 IP 10.233.78.39.38114 > 10.233.87.42.http: Flags [S], seq 2200903672, win 43690, options [mss 65495,sackOK,TS val 271651727 ecr 0,nop,wscale 7], length 0
00:00:00.000010 IP 192.168.32.47 > 192.168.32.199: IP 10.233.78.39.38114 > 10.233.87.42.http: Flags [S], seq 2200903672, win 43690, options [mss 65495,sackOK,TS val 271651727 ecr 0,nop,wscale 7], length 0 (ipip-proto-4)
00:00:00.015188 IP 10.233.78.39.38114 > 10.233.87.42.http: Flags [S], seq 2200903672, win 43690, options [mss 65495,sackOK,TS val 271652736 ecr 0,nop,wscale 7], length 0
00:00:00.000015 IP 192.168.32.47 > 192.168.32.199: IP 10.233.78.39.38114 > 10.233.87.42.http: Flags [S], seq 2200903672, win 43690, options [mss 65495,sackOK,TS val 271652736 ecr 0,nop,wscale 7], length 0 (ipip-proto-4)
00:00:00.043770 IP 10.233.78.39.38114 > 10.233.87.42.http: Flags [S], seq 2200903672, win 43690, options [mss 65495,sackOK,TS val 271654784 ecr 0,nop,wscale 7], length 0
00:00:00.000025 IP 192.168.32.47 > 192.168.32.199: IP 10.233.78.39.38114 > 10.233.87.42.http: Flags [S], seq 2200903672, win 43690, options [mss 65495,sackOK,TS val 271654784 ecr 0,nop,wscale 7], length 0 (ipip-proto-4)
00:00:00.019019 IP 10.233.78.39.38114 > 10.233.87.42.http: Flags [S], seq 2200903672, win 43690, options [mss 65495,sackOK,TS val 271658816 ecr 0,nop,wscale 7], length 0
00:00:00.000021 IP 192.168.32.47 > 192.168.32.199: IP 10.233.78.39.38114 > 10.233.87.42.http: Flags [S], seq 2200903672, win 43690, options [mss 65495,sackOK,TS val 271658816 ecr 0,nop,wscale 7], length 0 (ipip-proto-4)
00:00:00.000003 IP 10.233.78.39.38114 > 10.233.87.42.http: Flags [S], seq 2200903672, win 43690, options [mss 65495,sackOK,TS val 271666880 ecr 0,nop,wscale 7], length 0
00:00:00.000007 IP 192.168.32.47 > 192.168.32.199: IP 10.233.78.39.38114 > 10.233.87.42.http: Flags [S], seq 2200903672, win 43690, options [mss 65495,sackOK,TS val 271666880 ecr 0,nop,wscale 7], length 0 (ipip-proto-4)
```
7.  It would only delete the rs which is actually the nonexistent pod more or less one minute after halting the curl cmd :
```
Every 1.0s: ipvsadm -Ln -t 10.233.30.38:18080  Thu Apr 16 00:18:10 2020

Prot LocalAddress:Port Scheduler Flags
  -> RemoteAddress:Port           Forward Weight ActiveConn InActConn
TCP  10.233.30.38:18080 rr
  -> 10.233.82.73:80              Masq    1	        0          0
  -> 10.233.87.43:80              Masq    1	        0          0
```
**What you expected to happen**:
The rs server `10.233.87.42:80` and `10.233.78.70:80` would be removed from the ipvs real server list at the same time, after graceful shutdown time exhaust.

**How to reproduce it (as minimally and precisely as possible)**:
Flow the process in section one: `What happened:`
**Anything else we need to know?**:

**Environment**:
- Kubernetes version (use `kubectl version`):
```
Client Version: version.Info{Major:"1", Minor:"16", GitVersion:"v1.16.6", GitCommit:"72c30166b2105cd7d3350f2c28a219e6abcd79eb", GitTreeState:"clean", BuildDate:"2020-01-18T23:31:31Z", GoVersion:"go1.13.5", Compiler:"gc", Platform:"linux/amd64"}
Server Version: version.Info{Major:"1", Minor:"16", GitVersion:"v1.16.6", GitCommit:"72c30166b2105cd7d3350f2c28a219e6abcd79eb", GitTreeState:"clean", BuildDate:"2020-01-18T23:23:21Z", GoVersion:"go1.13.5", Compiler:"gc", Platform:"linux/amd64"}
```
- Cloud provider or hardware configuration:
- OS (e.g: `cat /etc/os-release`):
```
NAME="CentOS Linux"
VERSION="7 (Core)"
ID="centos"
ID_LIKE="rhel fedora"
VERSION_ID="7"
PRETTY_NAME="CentOS Linux 7 (Core)"
ANSI_COLOR="0;31"
CPE_NAME="cpe:/o:centos:centos:7"
HOME_URL="https://www.centos.org/"
BUG_REPORT_URL="https://bugs.centos.org/"

CENTOS_MANTISBT_PROJECT="CentOS-7"
CENTOS_MANTISBT_PROJECT_VERSION="7"
REDHAT_SUPPORT_PRODUCT="centos"
REDHAT_SUPPORT_PRODUCT_VERSION="7"
```
- Kernel (e.g. `uname -a`):
```
Linux k8s-01 4.19.84-300.el7.x86_64 #1 SMP Thu Nov 21 16:14:47 UTC 2019 x86_64 x86_64 x86_64 GNU/Linux
```
- Install tools:
- Network plugin and version (if this is a network-related bug): `calico: v3.11.1`
- Others:

**Comment by athenabot** [comment]
/triage unresolved

Comment `/remove-triage unresolved` when the issue is assessed and confirmed.

🤖 I am a bot run by vllry. 👩‍🔬

**Comment by regardfs** [comment]
I use `label` and `prestop lifecycle` as a workaround for this scenario, the modified yaml file as follows:
```
apiVersion: apps/v1
kind: Deployment
metadata:
  name: nginx-deployment
spec:
  selector:
    matchLabels:
      app: nginx
  replicas: 2
  strategy:
    type: RollingUpdate
    rollingUpdate:
      maxSurge: 1
      maxUnavailable: 1
  template:
    metadata:
      labels:
        app: nginx
        enable: "true"
    spec:
      affinity:
        podAntiAffinity:
          requiredDuringSchedulingIgnoredDuringExecution:
          - topologyKey: kubernetes.io/hostname
            labelSelector:
              matchLabels:
                app: nginx
      containers:
      - name: nginx
        image: nginx:1.16
        ports:
        - containerPort: 80
        lifecycle:
          preStop:
            exec:
              command:
              - /disable-pod.sh
        readinessProbe:
          failureThreshold: 3
          initialDelaySeconds: 30
          periodSeconds: 5
          successThreshold: 1
          tcpSocket:
            port: 80
          timeoutSeconds: 1
        livenessProbe:
          failureThreshold: 3
          initialDelaySeconds: 30
          periodSeconds: 5
          successThreshold: 1
          tcpSocket:
            port: 80
          timeoutSeconds: 1
---
apiVersion: v1
kind: Service
metadata:
  name: nginx
spec:
  ports:
    - port: 18080
      targetPort: 80
      protocol: TCP
  selector:
    app: nginx
    enable: "true"
```
Both ab and curl run smoothly during upgrade or rollout restart, But I still do not know why there is  an everlasting `activeconn` in my previous test even the pod or real server had been deleted for a long term.
```
Every 1.0s: ipvsadm -Ln -t 10.233.30.38:18080  Thu Apr 16 00:07:58 2020

Prot LocalAddress:Port Scheduler Flags
  -> RemoteAddress:Port           Forward Weight ActiveConn InActConn
TCP  10.233.30.38:18080 rr
  -> 10.233.82.73:80              Masq    1	        0          0
  -> 10.233.87.42:80              Masq    0	        1          0
  -> 10.233.87.43:80              Masq    1	        0          0
```

**Comment by regardfs** [comment]
Finally, I thought I have figured out why there is an everlasting `1 activeconn`  if  `while true;do curl xxx;sleep 0.2;end` cmd never quit;
I use `conntrack -E |grep -E "10.233.78.70|10.233.87.42"` to get conntrack event for such rs hosts(upgraded pods):  and found a new tcp conntrack entry of sync_send among lots of destroy logs:
```
[DESTROY] tcp      6 src=10.233.30.38 dst=10.233.30.38 sport=60082 dport=18080 src=10.233.78.70 dst=10.233.78.39 sport=80 dport=41338 [ASSURED]
[DESTROY] tcp      6 src=10.233.30.38 dst=10.233.30.38 sport=60100 dport=18080 src=10.233.87.42 dst=10.233.78.39 sport=80 dport=41775 [ASSURED]
[DESTROY] tcp      6 src=10.233.30.38 dst=10.233.30.38 sport=60078 dport=18080 src=10.233.78.70 dst=10.233.78.39 sport=80 dport=47723 [ASSURED]
[DESTROY] tcp      6 src=10.233.30.38 dst=10.233.30.38 sport=60074 dport=18080 src=10.233.78.70 dst=10.233.78.39 sport=80 dport=31684 [ASSURED]
[DESTROY] tcp      6 src=10.233.30.38 dst=10.233.30.38 sport=60080 dport=18080 src=10.233.87.42 dst=10.233.78.39 sport=80 dport=7317 [ASSURED]
[DESTROY] tcp      6 src=10.233.30.38 dst=10.233.30.38 sport=60076 dport=18080 src=10.233.87.42 dst=10.233.78.39 sport=80 dport=55457 [ASSURED]
[DESTROY] tcp      6 src=10.233.30.38 dst=10.233.30.38 sport=60090 dport=18080 src=10.233.87.42 dst=10.233.78.39 sport=80 dport=48339 [ASSURED]
[DESTROY] tcp      6 src=10.233.30.38 dst=10.233.30.38 sport=60066 dport=18080 src=10.233.78.70 dst=10.233.78.39 sport=80 dport=17013 [ASSURED]
[DESTROY] tcp      6 src=10.233.30.38 dst=10.233.30.38 sport=60128 dport=18080 src=10.233.87.42 dst=10.233.78.39 sport=80 dport=22935 [ASSURED]
[DESTROY] tcp      6 src=10.233.30.38 dst=10.233.30.38 sport=60112 dport=18080 src=10.233.87.42 dst=10.233.78.39 sport=80 dport=31284 [ASSURED]
[DESTROY] tcp      6 src=10.233.30.38 dst=10.233.30.38 sport=60130 dport=18080 src=10.233.78.70 dst=10.233.78.39 sport=80 dport=17584 [ASSURED]
[DESTROY] tcp      6 src=10.233.30.38 dst=10.233.30.38 sport=60002 dport=18080 src=10.233.87.42 dst=10.233.78.39 sport=80 dport=61384 [ASSURED]
    [NEW] tcp      6 120 SYN_SENT src=10.233.30.38 dst=10.233.30.38 sport=60002 dport=18080 [UNREPLIED] src=10.233.87.42 dst=10.233.78.39 sport=80 dport=12264
[DESTROY] tcp      6 src=10.233.30.38 dst=10.233.30.38 sport=60142 dport=18080 src=10.233.87.42 dst=10.233.78.39 sport=80 dport=63866 [ASSURED]
[DESTROY] tcp      6 src=10.233.30.38 dst=10.233.30.38 sport=60156 dport=18080 src=10.233.87.42 dst=10.233.78.39 sport=80 dport=12884 [ASSURED]
[DESTROY] tcp      6 src=10.233.30.38 dst=10.233.30.38 sport=60144 dport=18080 src=10.233.87.42 dst=10.233.78.39 sport=80 dport=64537 [ASSURED]
[DESTROY] tcp      6 src=10.233.30.38 dst=10.233.30.38 sport=60124 dport=18080 src=10.233.87.42 dst=10.233.78.39 sport=80 dport=34392 [ASSURED]
[DESTROY] tcp      6 src=10.233.30.38 dst=10.233.30.38 sport=60150 dport=18080 src=10.233.78.70 dst=10.233.78.39 sport=80 dport=19281 [ASSURED]
[DESTROY] tcp      6 src=10.233.30.38 dst=10.233.30.38 sport=60138 dport=18080 src=10.233.87.42 dst=10.233.78.39 sport=80 dport=61580 [ASSURED]
[DESTROY] tcp      6 src=10.233.30.38 dst=10.233.30.38 sport=60136 dport=18080 src=10.233.78.70 dst=10.233.78.39 sport=80 dport=59655 [ASSURED]
[DESTROY] tcp      6 src=10.233.30.38 dst=10.233.30.38 sport=60122 dport=18080 src=10.233.78.70 dst=10.233.78.39 sport=80 dport=63596 [ASSURED]
[DESTROY] tcp      6 src=10.233.30.38 dst=10.233.30.38 sport=60140 dport=18080 src=10.233.78.70 dst=10.233.78.39 sport=80 dport=4366 [ASSURED]
[DESTROY] tcp      6 src=10.233.30.38 dst=10.233.30.38 sport=60134 dport=18080 src=10.233.78.70 dst=10.233.78.39 sport=80 dport=7947 [ASSURED]
[DESTROY] tcp      6 src=10.233.30.38 dst=10.233.30.38 sport=60132 dport=18080 src=10.233.87.42 dst=10.233.78.39 sport=80 dport=57819 [ASSURED]
[DESTROY] tcp      6 src=10.233.30.38 dst=10.233.30.38 sport=60126 dport=18080 src=10.233.78.70 dst=10.233.78.39 sport=80 dport=63995 [ASSURED]
```
then use `tcpdump  -i any  -n -ttt|grep 10.233.87.42`, and found lots of sync packet to this deleted pod. It seems that continuously sync keep this 
`  -> 10.233.87.42:80              Masq    0	        1          0` 
alive , and never delete, is that true?

**Comment by athenabot** [comment]
@andrewsykim
If this issue has been triaged, please comment `/remove-triage unresolved`.

If you aren't able to handle this issue, consider unassigning yourself and/or adding the `help-wanted` label.

🤖 I am a bot run by vllry. 👩‍🔬

**Comment by andrewsykim** [comment]
Unfortunately this is a side effect of:
1) setting conn_reuse to 0 
2) not deleting an RS when the pod is deleted

Not sure there's much we can do about 1) because the performance trade-offs are probably not worth it, but I think 2) will be fixed if KEP-1672 (https://github.com/kubernetes/enhancements/pull/1607) is approved. With KEP-1672 we would start tracking the terminating state of endpoints so we can update the IPVS proxy to safely delete an RS when the pod has been terminated. Today we keep the RS around even after the pod is terminated since we can only assume conntrack entries for the real server means the real server is still around. This causes a bunch of issues because the conntrack entries outlive the lifecycle of the pod.
