### ISSUE TITLE
Webhook authz no longer includes URL parameters

### ISSUE THREAD

**Issue by unixwitch** [kubernetes/kubernetes#48928]
**Is this a BUG REPORT or FEATURE REQUEST?**:

/kind bug

**What happened**:
I configured a webhook authz service like this:

```
    - --authorization-webhook-config-file=/etc/kubernetes/kubeconfig/webhook-authz
    - --authorization-webhook-cache-unauthorized-ttl=5m
    - --authorization-webhook-cache-authorized-ttl=5m
```

`/etc/kubernetes/kubeconfig/webhook-authz` looks like this:

```
clusters:
  - name: tbxaccounts
    cluster:
      server: https://some.authz.service/authz?cluster=staging

users:
  - name: apiserver

current-context: webhook
contexts:
- context:
    cluster: tbxaccounts
    user: apiserver
  name: webhook
```

When Kubernetes tried to authorize a user, it made a request to `https://some.authz.service/authz`, without the URL query string (`cluster=staging`).

**What you expected to happen**:

I expected the URL query string to be included in the URL.

**How to reproduce it (as minimally and precisely as possible)**:

Configure an authz service with a URL query string and perform a cluster operation that would require authorization.

tcpdump confirms the query string is missing:

```
09:03:22.981848 IP 172.31.208.7.46248 > 172.28.1.136.80: Flags [P.], seq 1:386, ack 1, win 222, options [nop,nop,TS val 2678521369 ecr 3814024643], length 385: HTTP: POST /authz HTTP/1.0
E.....@.?..............P.,S....#...........
.....Ue.POST /authz HTTP/1.0
Content-Type: application/json
Accept: application/json, */*
Content-Length: 298
User-Agent: Go-http-client/2.0
Host: some.authz.service
Connection: close
Via: https/2 staging-master-1z76.c.torchkube.internal[985182a9-82fa-4516-ad79-8d0f98755770] (ApacheTrafficServer/7.1.0)


09:03:22.981870 IP 172.28.1.136.80 > 172.31.208.7.46248: Flags [.], ack 386, win 235, options [nop,nop,TS val 3814024643 ecr 2678521369], length 0
E..43.@.@..+.........P.....#.,T.....)......
.Ue.....
09:03:22.981891 IP 172.31.208.7.46248 > 172.28.1.136.80: Flags [P.], seq 386:684, ack 1, win 222, options [nop,nop,TS val 2678521369 ecr 3814024643], length 298: HTTP
E..^..@.?..............P.,T....#...........
.....Ue.{"kind":"SubjectAccessReview","apiVersion":"authorization.k8s.io/v1beta1","metadata":{"creationTimestamp":null},"spec":{"resourceAttributes":{"namespace":"default","verb":"list","version":"v1","resource":"pods"},"user":"ffoobar","group":["tech","system:authenticated"]},"status":{"allowed":false}}
```

**Anything else we need to know?**:

This worked in 1.6.6, as far as I'm aware; it seems to have broken since we upgraded to 1.7.0.

**Environment**:
- Kubernetes version (use `kubectl version`): Server Version: version.Info{Major:"1", Minor:"7", GitVersion:"v1.7.0+coreos.0", GitCommit:"8c1bf133b4129042ef8f7d1ffac1be14ee83ed10", GitTreeState:"clean", BuildDate:"2017-06-30T17:46:00Z", GoVersion:"go1.8.3", Compiler:"gc", Platform:"linux/amd64"}
- Cloud provider or hardware configuration**: GCE
- OS (e.g. from /etc/os-release): CoreOS 1409.6.0
- Kernel (e.g. `uname -a`): Linux staging-master-1xkk.c.torchkube.internal 4.11.9-coreos #1 SMP Thu Jul 6 00:54:42 UTC 2017 x86_64 Intel(R) Xeon(R) CPU @ 2.20GHz GenuineIntel GNU/Linux
- Install tools: Custom scripts
- Others:

**Comment by liggitt** [comment]
I agree the query is stripped, though I'm seeing the same behavior in every release back to 1.2.x where the webhook authorizer was introduced.

I'm not sure we want to add support for query parameters in the url... can you make it a path segment instead?

**Comment by unixwitch** [comment]
Hm... I thought I'd tested this, but obviously not enough since I just tried it on 1.6 and indeed it doesn't work.

We can work around this by moving the parameter into the URL path, although it would be helpful if it was noted in the [webhook documentation](https://kubernetes.io/docs/admin/authorization/webhook/).  (We can't make authz decision on user alone as the decision is based on the list of clusters/services a particular user has access to; I would imagine this is a fairly common requirement.)

**Comment by liggitt** [comment]
Agree the docs should be updated.

> We can't make authz decision on user alone as the decision is based on the list of clusters/services a particular user has access to

If you're looking for other ways to plumb that info (and your webhook doesn't already make use of authentication info from the apiserver), you can put basic auth or bearer token credentials in the authz webhook config, and that will be sent to the webhook as an authorization header. Your bearer token could be "cluster=staging", for example.

**Comment by liggitt** [comment]
opened https://github.com/kubernetes/website/pull/6426
