### ISSUE TITLE
kube-proxy(iptables) uses interface addresses instead of node's InternalIP on SNAT

### ISSUE THREAD

**Issue by naoki9911** [kubernetes/kubernetes#133024]
### What happened?

Traffics to pods on other node via a service are SNATed with the interface's address. 
It causes an issue to control traffic based on the source address.
cilium NetworkPolicy's  `host` and `remote-node` entities use InternalIP addresse to determine node's traffic and the traffic SNATed with interface addresses are not recognized as node's traffic.

A cluster(with kind) configured with `10.16.0.0/24` node internal IPs and the address assigned to loopback device `lo`.
The cluster runs with cilium native routing mode with BGP. 
```
NAME                 STATUS   ROLES           AGE     VERSION   INTERNAL-IP   EXTERNAL-IP   OS-IMAGE                         KERNEL-VERSION      CONTAINER-RUNTIME
kind-control-plane   Ready    control-plane   9m31s   v1.33.1   10.16.0.0     <none>        Debian GNU/Linux 12 (bookworm)   6.11.0-29-generic   containerd://2.1.1
kind-worker          Ready    <none>          9m22s   v1.33.1   10.16.0.1     <none>        Debian GNU/Linux 12 (bookworm)   6.11.0-29-generic   containerd://2.1.1
kind-worker2         Ready    <none>          9m21s   v1.33.1   10.16.0.2     <none>        Debian GNU/Linux 12 (bookworm)   6.11.0-29-generic   containerd://2.1.1
```

Each node has 2 interfaces and routes to Pods are advertised via cilium and FRRouting on nodes.
```
kind-control-plane:/# ip a s lo
1: lo: <LOOPBACK,UP,LOWER_UP> mtu 65536 qdisc noqueue state UNKNOWN group default qlen 1000
    link/loopback 00:00:00:00:00:00 brd 00:00:00:00:00:00
    inet 127.0.0.1/8 scope host lo
       valid_lft forever preferred_lft forever
    inet 10.16.0.0/32 scope global lo
       valid_lft forever preferred_lft forever
    inet6 ::1/128 scope host 
       valid_lft forever preferred_lft forever

kind-control-plane:/# ip a s | grep -e 'eth[1|2]'
700: eth2@if701: <BROADCAST,MULTICAST,UP,LOWER_UP> mtu 9500 qdisc noqueue state UP group default 
    inet 10.100.70.14/30 scope global eth2
704: eth1@if705: <BROADCAST,MULTICAST,UP,LOWER_UP> mtu 9500 qdisc noqueue state UP group default 
    inet 10.100.70.2/30 scope global eth1

kind-control-plane:/# ip route
default via 172.18.0.1 dev eth0 
10.16.0.1 nhid 22 proto bgp src 10.16.0.0 metric 20 
        nexthop via 10.100.70.1 dev eth1 weight 1 
        nexthop via 10.100.70.13 dev eth2 weight 1 
10.16.0.2 nhid 22 proto bgp src 10.16.0.0 metric 20 
        nexthop via 10.100.70.1 dev eth1 weight 1 
        nexthop via 10.100.70.13 dev eth2 weight 1 
10.100.70.0/30 dev eth1 proto kernel scope link src 10.100.70.2 
10.100.70.4/30 nhid 23 via 10.100.70.1 dev eth1 proto bgp src 10.16.0.0 metric 20 
10.100.70.8/30 nhid 23 via 10.100.70.1 dev eth1 proto bgp src 10.16.0.0 metric 20 
10.100.70.12/30 dev eth2 proto kernel scope link src 10.100.70.14 
10.100.70.16/30 nhid 24 via 10.100.70.13 dev eth2 proto bgp src 10.16.0.0 metric 20 
10.100.70.20/30 nhid 24 via 10.100.70.13 dev eth2 proto bgp src 10.16.0.0 metric 20 
10.244.0.0/24 via 10.244.0.20 dev cilium_host proto kernel src 10.244.0.20 
10.244.0.0/24 nhid 41 via 10.16.0.0 dev lo proto bgp src 10.16.0.0 metric 20 
10.244.0.20 dev cilium_host proto kernel scope link 
10.244.1.0/24 nhid 22 proto bgp src 10.16.0.0 metric 20 
        nexthop via 10.100.70.1 dev eth1 weight 1 
        nexthop via 10.100.70.13 dev eth2 weight 1 
10.244.2.0/24 nhid 22 proto bgp src 10.16.0.0 metric 20 
        nexthop via 10.100.70.1 dev eth1 weight 1 
        nexthop via 10.100.70.13 dev eth2 weight 1 
172.18.0.0/16 dev eth0 proto kernel scope link src 172.18.0.3 
```

I deployed a service with following manifest.
```yaml
apiVersion: apps/v1
kind: Deployment
metadata:
  name: nginx-deployment
  labels:
    app: nginx
spec:
  replicas: 1
  selector:
    matchLabels:
      app: nginx
  template:
    metadata:
      labels:
        app: nginx
    spec:
      containers:
      - name: nginx
        image: nginx:latest
        ports:
        - containerPort: 80
---
apiVersion: v1
kind: Service
metadata:
  name: nginx-service
spec:
  type: ClusterIP
  selector:
    app: nginx
  ports:
  - name: http
    port: 80
    targetPort: 80
```

The service runs with ClusterIP `10.96.137.51`.
```
$ kubectl get svc nginx-service -o wide
NAME            TYPE        CLUSTER-IP     EXTERNAL-IP   PORT(S)   AGE     SELECTOR
nginx-service   ClusterIP   10.96.137.51   <none>        80/TCP    8m34s   app=nginx
```

The traffic from other node to the pod via a service is SNATed with an interface address(`10.100.70.14` on `eth2`) instead of node's InternalIP (`10.16.0.0` on `lo`).

```
kind-control-plane:/# wget 10.96.137.51 -O -
Connecting to 10.96.137.51 (10.96.137.51:80)
writing to stdout
<!DOCTYPE html>
<html>
<head>
<title>Welcome to nginx!</title>
<style>
...

kind-control-plane:/# tcpdump -i any -n port 80
tcpdump: data link type LINUX_SLL2
tcpdump: verbose output suppressed, use -v[v]... for full protocol decode
listening on any, link-type LINUX_SLL2 (Linux cooked v2), snapshot length 262144 bytes
08:42:25.467232 eth2  Out IP 10.100.70.14.49709 > 10.244.1.245.80: Flags [S], seq 4271355700, win 64240, options [mss 1460,sackOK,TS val 3021122873 ecr 0,nop,wscale 7], length 0
08:42:25.467331 eth2  In  IP 10.244.1.245.80 > 10.100.70.14.49709: Flags [S.], seq 1638961940, ack 4271355701, win 65160, options [mss 1460,sackOK,TS val 1658386329 ecr 3021122873,nop,wscale 7], length 0
08:42:25.467358 eth2  Out IP 10.100.70.14.49709 > 10.244.1.245.80: Flags [.], ack 1, win 502, options [nop,nop,TS val 3021122873 ecr 1658386329], length 0
08:42:25.467412 eth2  Out IP 10.100.70.14.49709 > 10.244.1.245.80: Flags [P.], seq 1:76, ack 1, win 502, options [nop,nop,TS val 3021122873 ecr 1658386329], length 75: HTTP: GET / HTTP/1.1
...
```

The access directly to the pod has the node's InternalIP address as a source address.
```
kind-control-plane:/# wget 10.244.1.245 -O -
Connecting to 10.244.1.245 (10.244.1.245:80)
writing to stdout
<!DOCTYPE html>
<html>
<head>
<title>Welcome to nginx!</title>
<style>
...

kind-control-plane:/# tcpdump -i any -n port 80
tcpdump: data link type LINUX_SLL2
tcpdump: verbose output suppressed, use -v[v]... for full protocol decode
listening on any, link-type LINUX_SLL2 (Linux cooked v2), snapshot length 262144 bytes
08:48:20.467022 eth1  Out IP 10.16.0.0.52792 > 10.244.1.245.80: Flags [S], seq 738274731, win 56760, options [mss 9460,sackOK,TS val 647518012 ecr 0,nop,wscale 7], length 0
08:48:20.467120 eth1  In  IP 10.244.1.245.80 > 10.16.0.0.52792: Flags [S.], seq 3692829346, ack 738274732, win 65160, options [mss 1460,sackOK,TS val 2682373909 ecr 647518012,nop,wscale 7], length 0
08:48:20.467146 eth1  Out IP 10.16.0.0.52792 > 10.244.1.245.80: Flags [.], ack 1, win 444, options [nop,nop,TS val 647518012 ecr 2682373909], length 0
08:48:20.467193 eth1  Out IP 10.16.0.0.52792 > 10.244.1.245.80: Flags [P.], seq 1:76, ack 1, win 444, options [nop,nop,TS val 647518012 ecr 2682373909], length 75: HTTP: GET / HTTP/1.1
...
```

### What did you expect to happen?

The traffic to the pod via service should has the node's InternalIP address as a source address as same as the direct access to a pod.

### How can we reproduce it (as minimally and precisely as possible)?

The environment to reproduce is available at https://github.com/naoki9911/kube-proxy-with-loopback

### Anything else we need to know?

This should be happened due to a `MASQUERADE` rule instead of a `SNAT` with `--to-source` rule.

```console
root@kind-control-plane:/# iptables -t nat -L
...
Chain KUBE-POSTROUTING (1 references)
target     prot opt source               destination         
RETURN     all  --  anywhere             anywhere             mark match ! 0x4000/0x4000
MARK       all  --  anywhere             anywhere             MARK xor 0x4000
MASQUERADE  all  --  anywhere             anywhere             /* kubernetes service traffic requiring SNAT */ random-fully
...
```

### Kubernetes version

<details>

```console
$ kubectl version
Client Version: v1.33.1
Kustomize Version: v5.6.0
Server Version: v1.33.1
```

</details>

### Cloud provider

<details>

```console
$ kind version
kind v0.29.0 go1.24.3 linux/amd64
```

</details>

### OS version

<details>

```console
$ cat /etc/os-release 
PRETTY_NAME="Ubuntu 24.04.2 LTS"
NAME="Ubuntu"
VERSION_ID="24.04"
VERSION="24.04.2 LTS (Noble Numbat)"
VERSION_CODENAME=noble
ID=ubuntu
ID_LIKE=debian
HOME_URL="https://www.ubuntu.com/"
SUPPORT_URL="https://help.ubuntu.com/"
BUG_REPORT_URL="https://bugs.launchpad.net/ubuntu/"
PRIVACY_POLICY_URL="https://www.ubuntu.com/legal/terms-and-policies/privacy-policy"
UBUNTU_CODENAME=noble
LOGO=ubuntu-logo
```

</details>

### Install tools

<details>

</details>

### Container runtime (CRI) and version (if applicable)

<details>

```console
$ docker version
Client: Docker Engine - Community
 Version:           28.3.2
 API version:       1.51
 Go version:        go1.24.5
 Git commit:        578ccf6
 Built:             Wed Jul  9 16:13:45 2025
 OS/Arch:           linux/amd64
 Context:           default

Server: Docker Engine - Community
 Engine:
  Version:          28.3.2
  API version:      1.51 (minimum version 1.24)
  Go version:       go1.24.5
  Git commit:       e77ff99
  Built:            Wed Jul  9 16:13:45 2025
  OS/Arch:          linux/amd64
  Experimental:     false
 containerd:
  Version:          1.7.27
  GitCommit:        05044ec0a9a75232cad458027ca83437aae3f4da
 runc:
  Version:          1.2.5
  GitCommit:        v1.2.5-0-g59923ef
 docker-init:
  Version:          0.19.0
  GitCommit:        de40ad0
```

</details>

### Related plugins (CNI, CSI, ...) and versions (if applicable)

<details>

```console
root@kind-control-plane:/home/cilium# cilium-dbg status
KVStore:                 Disabled   
Kubernetes:              Ok         1.33 (v1.33.1) [linux/amd64]
Kubernetes APIs:         ["EndpointSliceOrEndpoint", "cilium/v2::CiliumClusterwideNetworkPolicy", "cilium/v2::CiliumEndpoint", "cilium/v2::CiliumLocalRedirectPolicy", "cilium/v2::CiliumNetworkPolicy", "cilium/v2::CiliumNode", "cilium/v2alpha1::CiliumCIDRGroup", "core/v1::Namespace", "core/v1::Pods", "core/v1::Service", "networking.k8s.io/v1::NetworkPolicy"]
KubeProxyReplacement:    False   
Host firewall:           Disabled
SRv6:                    Disabled
CNI Chaining:            none
CNI Config file:         successfully wrote CNI configuration file to /host/etc/cni/net.d/05-cilium.conflist
Cilium:                  Ok   1.17.5 (v1.17.5-69aab28c)
NodeMonitor:             Listening for events on 16 CPUs with 64x4096 of shared memory
Cilium health daemon:    Ok   
IPAM:                    IPv4: 5/254 allocated from 10.244.0.0/24, 
IPv4 BIG TCP:            Disabled
IPv6 BIG TCP:            Disabled
BandwidthManager:        Disabled
Routing:                 Network: Native   Host: Legacy
Attach Mode:             TCX
Device Mode:             veth
Masquerading:            IPTables [IPv4: Enabled, IPv6: Disabled]
Controller Status:       36/36 healthy
Proxy Status:            OK, ip 10.244.0.20, 0 redirects active on ports 10000-20000, Envoy: embedded
Global Identity Range:   min 256, max 65535
Hubble:                  Ok              Current/Max Flows: 4095/4095 (100.00%), Flows/s: 3.91   Metrics: Disabled
Encryption:              Disabled        
Cluster health:          3/3 reachable   (2025-07-17T09:00:07Z)
Name                     IP              Node   Endpoints
Modules Health:          Stopped(0) Degraded(0) OK(62)
```

</details>

**Comment by danwinship** [comment]
Why are you not just using Cilium's service proxy? I'm sure their NetworkPolicy interoperates with that more reliably.

At any rate, yes, kube-proxy masquerades node-to-service-IP traffic, which is not ideal, but if it didn't do that, it would need to know which local IPs on each node are reachable from other nodes and which ones aren't. (For instance, if the source IP was `docker0`'s IP, then the traffic would definitely need to be masqueraded if it was being sent to an endpoint on another node.) Rather than doing that, it just unconditionally masquerades, which ensures that the client IP will be one that is visible from off-node.

> cilium NetworkPolicy's `host` and `remote-node` entities use InternalIP addresse to determine node's traffic and the traffic SNATed with interface addresses are not recognized as node's traffic.

So, kube-proxy predates cilium's `host` and `remote-node` entities, so it seems like this is a bad implementation choice on cilium's part (though as I said above, I bet this works fine if you're using Cilium's service proxy implementation).

**Comment by aojea** [comment]
> Each node has 2 interfaces and routes to Pods are advertised via cilium and FRRouting on nodes.

you have a custom setup and you are making routing decisions so you should handle the routing accordingly to get the source address you want, see http://linux-ip.net/html/routing-saddr-selection.html for refrerence. 
You are explicitly indicating to use the loopback address to route to your pod networks

> 10.244.1.0/24 nhid 22 proto bgp src 10.16.0.0 metric 20 
        nexthop via 10.100.70.1 dev eth1 weight 1 
        nexthop via 10.100.70.13 dev eth2 weight 1 

If you want the OS to use the lo as source address then you need to install the correponding route to the service IP addresses.

Anyway, this does not look correct at first sight

> cilium NetworkPolicy's host and remote-node entities use InternalIP addresse to determine node's traffic and the traffic SNATed with interface addresses are not recognized as node's traffic.

since both eth1 and eth2 are IP addresses of the node, those should be accounted for network policies IMHO, unless you impose a strict control on how the traffic is generated in the node, that as you can see here is not easy to do and is completely unrelated to kubernetes, that does not have any requirement about it

**Comment by naoki9911** [comment]
Thank you for your feedback.
I will consider whether I can resolve the issue through host-side configuration.

**Comment by aojea** [comment]
> Thank you for your feedback. I will consider whether I can resolve the issue through host-side configuration.

please update the issue if you find a solution and close it if is acceptable, so others can benefit from your experience

**Comment by naoki9911** [comment]
I tried to specify source address for service address, but it did not affect the result.

```
$ kubectl get svc
NAME            TYPE        CLUSTER-IP     EXTERNAL-IP   PORT(S)   AGE
kubernetes      ClusterIP   10.96.0.1      <none>        443/TCP   2m47s
nginx-service   ClusterIP   10.96.73.185   <none>        80/TCP    53s

root@kind-worker2:/# ip route get 10.96.73.185
10.96.73.185 dev lo src 10.16.0.2 uid 0 
    cache <local>

root@kind-worker2:/# curl 10.96.73.185
<!DOCTYPE html>
<html>
<head>
...

root@kind-worker2:/# tcpdump -i any port 80 -n
tcpdump: data link type LINUX_SLL2
tcpdump: verbose output suppressed, use -v[v]... for full protocol decode
listening on any, link-type LINUX_SLL2 (Linux cooked v2), snapshot length 262144 bytes
05:01:19.246076 eth2  Out IP 10.100.70.22.18818 > 10.244.1.180.80: Flags [S], seq 2627631773, win 65495, options [mss 65495,sackOK,TS val 563549616 ecr 0,nop,wscale 7], length 0
05:01:19.246187 eth2  In  IP 10.244.1.180.80 > 10.100.70.22.18818: Flags [S.], seq 1130392867, ack 2627631774, win 65160, options [mss 1460,sackOK,TS val 3315371798 ecr 563549616,nop,wscale 7], length 0
...
```

**Comment by naoki9911** [comment]
FYI: I've also tried to force the SNAT with loopback address.
This worked as intended, but it requires more consideration including robust reachability and IPv6.

https://github.com/naoki9911/kubernetes/commit/099c20c81ed12684fce3be8bf142cfd43f13e217

**Comment by aojea** [comment]
> 10.96.73.185

I don't see that IP in the tcpdump, are you sure is kube-proxy that is implementing Services or is it cilium?

**Comment by naoki9911** [comment]
Sorry for late reply.
Let me clarify my understanding as follows.

The cluster has 3 nodes (1 control node, 2 worker nodes).
Each node has 2 interfaces and advertises Pod CIDR's routes via cilium's BGP native mode. 
I used `kube-proxy`, not cilium's one. 

```
$ kubectl get nodes
NAME                 STATUS   ROLES           AGE     VERSION
kind-control-plane   Ready    control-plane   9m48s   v1.33.1
kind-worker          Ready    <none>          9m33s   v1.33.1
kind-worker2         Ready    <none>          9m33s   v1.33.1
```

nginx service is deployed and the pod is running on `kind-worker`.


```
$ kubectl get pods -o wide
NAME                              READY   STATUS    RESTARTS   AGE     IP            NODE          NOMINATED NODE   READINESS GATES
nginx-deployment-96b9d695-vmf75   1/1     Running   0          8m41s   10.244.1.30   kind-worker   <none>           <none>
$ kubectl get svc
NAME            TYPE        CLUSTER-IP    EXTERNAL-IP   PORT(S)   AGE
kubernetes      ClusterIP   10.96.0.1     <none>        443/TCP   10m
nginx-service   ClusterIP   10.96.74.17   <none>        80/TCP    8m46s
```

I also configured `kind-worker2` to use loopback address for the service address `10.96.74.17`

```
root@kind-worker2:/# ip route get 10.96.74.17
10.96.74.17 dev lo src 10.16.0.2 uid 0 
    cache <local>
```

The issue is that the traffic to the service `nginx-service` from the node `kind-worker2` (not pods on kind-worker2, node itself) is SNATed with `kind-worker2`'s interface's address, not loopback address as specified in the routing table.

Of course, @danwinship already pointed out that this is intended behavior.
I would like to clarify that the traffic between nodes and pods via service are depending on iptable's MASQUERADE behavior and there is no option to control the source address.
If it is possible to specify source address, cilium's NetworkPolicy and the BGP fabric-side's configuration like ACLs can be much simple.

<details>
<summary> kind-worker2 's interfaces. </summary>

```
root@kind-worker2:/# ip a s
1: lo: <LOOPBACK,UP,LOWER_UP> mtu 65536 qdisc noqueue state UNKNOWN group default qlen 1000
    link/loopback 00:00:00:00:00:00 brd 00:00:00:00:00:00
    inet 127.0.0.1/8 scope host lo
       valid_lft forever preferred_lft forever
    inet 10.16.0.2/32 scope global lo
       valid_lft forever preferred_lft forever
    inet6 ::1/128 scope host 
       valid_lft forever preferred_lft forever
2: eth0@if11: <BROADCAST,MULTICAST,UP,LOWER_UP> mtu 1500 qdisc noqueue state UP group default 
    link/ether ea:66:f7:48:92:ba brd ff:ff:ff:ff:ff:ff link-netnsid 0
    inet 172.18.0.4/16 brd 172.18.255.255 scope global eth0
       valid_lft forever preferred_lft forever
    inet6 fc00:f853:ccd:e793::4/64 scope global nodad 
       valid_lft forever preferred_lft forever
    inet6 fe80::e866:f7ff:fe48:92ba/64 scope link 
       valid_lft forever preferred_lft forever
3: cilium_net@cilium_host: <BROADCAST,MULTICAST,NOARP,UP,LOWER_UP> mtu 1500 qdisc noqueue state UP group default qlen 1000
    link/ether b6:2b:c0:c5:2c:4a brd ff:ff:ff:ff:ff:ff
    inet6 fe80::b42b:c0ff:fec5:2c4a/64 scope link 
       valid_lft forever preferred_lft forever
4: cilium_host@cilium_net: <BROADCAST,MULTICAST,NOARP,UP,LOWER_UP> mtu 1500 qdisc noqueue state UP group default qlen 1000
    link/ether 26:51:1d:3a:48:be brd ff:ff:ff:ff:ff:ff
    inet 10.244.2.162/32 scope global cilium_host
       valid_lft forever preferred_lft forever
    inet6 fe80::2451:1dff:fe3a:48be/64 scope link 
       valid_lft forever preferred_lft forever
6: lxc_health@if5: <BROADCAST,MULTICAST,UP,LOWER_UP> mtu 1500 qdisc noqueue state UP group default qlen 1000
    link/ether fa:58:71:76:9c:b7 brd ff:ff:ff:ff:ff:ff link-netnsid 3
    inet6 fe80::f858:71ff:fe76:9cb7/64 scope link 
       valid_lft forever preferred_lft forever
21: eth2@if22: <BROADCAST,MULTICAST,UP,LOWER_UP> mtu 9500 qdisc noqueue state UP group default 
    link/ether aa:c1:ab:70:6d:45 brd ff:ff:ff:ff:ff:ff link-netnsid 2
    inet 10.100.70.22/30 scope global eth2
       valid_lft forever preferred_lft forever
    inet6 fe80::a8c1:abff:fe70:6d45/64 scope link 
       valid_lft forever preferred_lft forever
25: eth1@if26: <BROADCAST,MULTICAST,UP,LOWER_UP> mtu 9500 qdisc noqueue state UP group default 
    link/ether aa:c1:ab:4b:6c:d9 brd ff:ff:ff:ff:ff:ff link-netnsid 1
    inet 10.100.70.10/30 scope global eth1
       valid_lft forever preferred_lft forever
    inet6 fe80::a8c1:abff:fe4b:6cd9/64 scope link 
       valid_lft forever preferred_lft forever
```

</details>

<details>
<summary> kind-worker2 's routes </summary>

```
root@kind-worker2:/# ip route
default via 172.18.0.1 dev eth0 
10.16.0.0 nhid 22 proto bgp src 10.16.0.2 metric 20 
	nexthop via 10.100.70.9 dev eth1 weight 1 
	nexthop via 10.100.70.21 dev eth2 weight 1 
10.16.0.1 nhid 22 proto bgp src 10.16.0.2 metric 20 
	nexthop via 10.100.70.9 dev eth1 weight 1 
	nexthop via 10.100.70.21 dev eth2 weight 1 
10.96.74.17 dev lo scope link src 10.16.0.2 
10.100.70.0/30 nhid 23 via 10.100.70.9 dev eth1 proto bgp src 10.16.0.2 metric 20 
10.100.70.4/30 nhid 23 via 10.100.70.9 dev eth1 proto bgp src 10.16.0.2 metric 20 
10.100.70.8/30 dev eth1 proto kernel scope link src 10.100.70.10 
10.100.70.12/30 nhid 24 via 10.100.70.21 dev eth2 proto bgp src 10.16.0.2 metric 20 
10.100.70.16/30 nhid 24 via 10.100.70.21 dev eth2 proto bgp src 10.16.0.2 metric 20 
10.100.70.20/30 dev eth2 proto kernel scope link src 10.100.70.22 
10.244.0.0/24 nhid 22 proto bgp src 10.16.0.2 metric 20 
	nexthop via 10.100.70.9 dev eth1 weight 1 
	nexthop via 10.100.70.21 dev eth2 weight 1 
10.244.1.0/24 nhid 22 proto bgp src 10.16.0.2 metric 20 
	nexthop via 10.100.70.9 dev eth1 weight 1 
	nexthop via 10.100.70.21 dev eth2 weight 1 
10.244.2.0/24 via 10.244.2.162 dev cilium_host proto kernel src 10.244.2.162 
10.244.2.0/24 nhid 36 via 10.16.0.2 dev lo proto bgp src 10.16.0.2 metric 20 
10.244.2.162 dev cilium_host proto kernel scope link 
172.18.0.0/16 dev eth0 proto kernel scope link src 172.18.0.4
```

</details>

The traffic to the service address `10.96.74.17` is DNATed to the deployed pod address `10.244.1.30` on the node.
This is why the service address was not appeared in packet dump.

<details>
<summary> Packet dump with curl 10.96.74.17 on kind-worker2 </summary>

```
root@kind-worker2:/# tcpdump -i any port 80
tcpdump: data link type LINUX_SLL2
tcpdump: verbose output suppressed, use -v[v]... for full protocol decode
listening on any, link-type LINUX_SLL2 (Linux cooked v2), snapshot length 262144 bytes
01:03:53.350047 eth1  Out IP 10.100.70.10.18425 > 10.244.1.30.http: Flags [S], seq 846854958, win 65495, options [mss 65495,sackOK,TS val 4144581806 ecr 0,nop,wscale 7], length 0
01:03:53.350159 eth1  In  IP 10.244.1.30.http > 10.100.70.10.18425: Flags [S.], seq 89918042, ack 846854959, win 65160, options [mss 1460,sackOK,TS val 2067677119 ecr 4144581806,nop,wscale 7], length 0
01:03:53.350232 eth1  Out IP 10.100.70.10.18425 > 10.244.1.30.http: Flags [.], ack 1, win 512, options [nop,nop,TS val 4144581806 ecr 2067677119], length 0
01:03:53.350408 eth1  Out IP 10.100.70.10.18425 > 10.244.1.30.http: Flags [P.], seq 1:76, ack 1, win 512, options [nop,nop,TS val 4144581806 ecr 2067677119], length 75: HTTP: GET / HTTP/1.1
01:03:53.350479 eth1  In  IP 10.244.1.30.http > 10.100.70.10.18425: Flags [.], ack 76, win 509, options [nop,nop,TS val 2067677119 ecr 4144581806], length 0
01:03:53.350624 eth1  In  IP 10.244.1.30.http > 10.100.70.10.18425: Flags [P.], seq 1:239, ack 76, win 509, options [nop,nop,TS val 2067677120 ecr 4144581806], length 238: HTTP: HTTP/1.1 200 OK
01:03:53.350688 eth1  Out IP 10.100.70.10.18425 > 10.244.1.30.http: Flags [.], ack 239, win 511, options [nop,nop,TS val 4144581807 ecr 2067677120], length 0
01:03:53.350742 eth1  In  IP 10.244.1.30.http > 10.100.70.10.18425: Flags [P.], seq 239:854, ack 76, win 509, options [nop,nop,TS val 2067677120 ecr 4144581807], length 615: HTTP
01:03:53.350792 eth1  Out IP 10.100.70.10.18425 > 10.244.1.30.http: Flags [.], ack 854, win 507, options [nop,nop,TS val 4144581807 ecr 2067677120], length 0
```

</details>

<details>
<summary>iptables chain trace on kind-worker2</summary>

```
root@kind-worker2:/# iptables -t raw -I OUTPUT -p tcp --dport 80 --destination 10.96.74.17  -j TRACE
root@kind-worker2:/# xtables-monitor -t
PACKET: 2 08b493ca OUT=lo SRC=10.16.0.2 DST=10.96.74.17 LEN=60 TOS=0x0 TTL=64 ID=45306 DF SPORT=53622 DPORT=80 SYN 
 TRACE: 2 08b493ca raw:OUTPUT:rule:0x15:CONTINUE  -4 -t raw -A OUTPUT -d 10.96.74.17/32 -p tcp -m tcp --dport 80 -j TRACE
 TRACE: 2 08b493ca raw:OUTPUT:rule:0x13:JUMP:CILIUM_OUTPUT_raw  -4 -t raw -A OUTPUT -m comment --comment "cilium-feeder: CILIUM_OUTPUT_raw" -j CILIUM_OUTPUT_raw
 TRACE: 2 08b493ca raw:OUTPUT:policy:ACCEPT 
PACKET: 2 08b493ca OUT=lo SRC=10.16.0.2 DST=10.96.74.17 LEN=60 TOS=0x0 TTL=64 ID=45306 DF SPORT=53622 DPORT=80 SYN 
 TRACE: 2 08b493ca nat:OUTPUT:rule:0x44:JUMP:CILIUM_OUTPUT_nat  -4 -t nat -A OUTPUT -m comment --comment "cilium-feeder: CILIUM_OUTPUT_nat" -j CILIUM_OUTPUT_nat
 TRACE: 2 08b493ca nat:OUTPUT:rule:0x11:JUMP:KUBE-SERVICES  -4 -t nat -A OUTPUT -m comment --comment "kubernetes service portals" -j KUBE-SERVICES
 TRACE: 2 08b493ca nat:KUBE-SERVICES:rule:0xb2:JUMP:KUBE-SVC-6IM33IEVEEV7U3GP  -4 -t nat -A KUBE-SERVICES -d 10.96.74.17/32 -p tcp -m comment --comment "default/nginx-service:http cluster IP" -m tcp --dport 80 -j KUBE-SVC-6IM33IEVEEV7U3GP
 TRACE: 2 08b493ca nat:KUBE-SVC-6IM33IEVEEV7U3GP:rule:0xb3:JUMP:KUBE-MARK-MASQ  -4 -t nat -A KUBE-SVC-6IM33IEVEEV7U3GP ! -s 10.244.0.0/16 -d 10.96.74.17/32 -p tcp -m comment --comment "default/nginx-service:http cluster IP" -m tcp --dport 80 -j KUBE-MARK-MASQ
 TRACE: 2 08b493ca nat:KUBE-MARK-MASQ:rule:0xac:CONTINUE  -4 -t nat -A KUBE-MARK-MASQ -j MARK --set-xmark 0x4000/0x4000
 TRACE: 2 08b493ca nat:KUBE-SVC-6IM33IEVEEV7U3GP:rule:0xb4:JUMP:KUBE-SEP-KZP6MYOQ2KOVUB7U  -4 -t nat -A KUBE-SVC-6IM33IEVEEV7U3GP -m comment --comment "default/nginx-service:http -> 10.244.1.30:80" -j KUBE-SEP-KZP6MYOQ2KOVUB7U
 TRACE: 2 08b493ca nat:KUBE-SEP-KZP6MYOQ2KOVUB7U:rule:0xb6:ACCEPT  -4 -t nat -A KUBE-SEP-KZP6MYOQ2KOVUB7U -p tcp -m comment --comment "default/nginx-service:http" -m tcp -j DNAT --to-destination 10.244.1.30:80
PACKET: 2 08b493ca OUT=lo SRC=10.16.0.2 DST=10.244.1.30 LEN=60 TOS=0x0 TTL=64 ID=45306 DF SPORT=53622 DPORT=80 SYN MARK=0x4000 
 TRACE: 2 08b493ca filter:OUTPUT:rule:0x52:JUMP:CILIUM_OUTPUT  -4 -t filter -A OUTPUT -m comment --comment "cilium-feeder: CILIUM_OUTPUT" -j CILIUM_OUTPUT
 TRACE: 2 08b493ca filter:CILIUM_OUTPUT:rule:0x50:CONTINUE  -4 -t filter -A CILIUM_OUTPUT -m mark ! --mark 0xe00/0xf00 -m mark ! --mark 0xd00/0xf00 -m mark ! --mark 0x400/0xf00 -m mark ! --mark 0xa00/0xe00 -m mark ! --mark 0x800/0xe00 -m mark ! --mark 0xf00/0xf00 -m comment --comment "cilium: host->any mark as from host" -j MARK --set-xmark 0xc00/0xf00
 TRACE: 2 08b493ca filter:OUTPUT:rule:0x16:JUMP:KUBE-PROXY-FIREWALL  -4 -t filter -A OUTPUT -m conntrack --ctstate NEW -m comment --comment "kubernetes load balancer firewall" -j KUBE-PROXY-FIREWALL
 TRACE: 2 08b493ca filter:OUTPUT:rule:0x11:JUMP:KUBE-SERVICES  -4 -t filter -A OUTPUT -m conntrack --ctstate NEW -m comment --comment "kubernetes service portals" -j KUBE-SERVICES
 TRACE: 2 08b493ca filter:OUTPUT:rule:0x3:JUMP:KUBE-FIREWALL  -4 -t filter -A OUTPUT -j KUBE-FIREWALL
 TRACE: 2 08b493ca filter:OUTPUT:policy:ACCEPT 
PACKET: 2 08b493ca OUT=eth1 SRC=10.16.0.2 DST=10.244.1.30 LEN=60 TOS=0x0 TTL=64 ID=45306 DF SPORT=53622 DPORT=80 SYN MARK=0x4c00 
 TRACE: 2 08b493ca mangle:POSTROUTING:rule:0xe:JUMP:CILIUM_POST_mangle  -4 -t mangle -A POSTROUTING -m comment --comment "cilium-feeder: CILIUM_POST_mangle" -j CILIUM_POST_mangle
 TRACE: 2 08b493ca mangle:POSTROUTING:policy:ACCEPT 
PACKET: 2 08b493ca OUT=eth1 SRC=10.16.0.2 DST=10.244.1.30 LEN=60 TOS=0x0 TTL=64 ID=45306 DF SPORT=53622 DPORT=80 SYN MARK=0x4c00 
 TRACE: 2 08b493ca nat:POSTROUTING:rule:0x43:JUMP:CILIUM_POST_nat  -4 -t nat -A POSTROUTING -m comment --comment "cilium-feeder: CILIUM_POST_nat" -j CILIUM_POST_nat
 TRACE: 2 08b493ca nat:POSTROUTING:rule:0x14:JUMP:KUBE-POSTROUTING  -4 -t nat -A POSTROUTING -m comment --comment "kubernetes postrouting rules" -j KUBE-POSTROUTING
 TRACE: 2 08b493ca nat:KUBE-POSTROUTING:rule:0xaa:CONTINUE  -4 -t nat -A KUBE-POSTROUTING -j MARK --set-xmark 0x4000/0x0
 TRACE: 2 08b493ca nat:KUBE-POSTROUTING:rule:0xab:ACCEPT  -4 -t nat -A KUBE-POSTROUTING -m comment --comment "kubernetes service traffic requiring SNAT" -j MASQUERADE --random-fully
```

</details>

**Comment by danwinship** [comment]
I suppose we could add a "no-masquerade-cidrs" option, to let the admin/cluster-deployer indicate to kube-proxy which IP ranges don't need masquerading when sending to an endpoint on another node.

This might make sense as an nftables-only feature though, since adding new special cases to the iptables code is more complicated since it's harder to interact correctly with all the other special cases when you don't have sets/maps to simplify things.

**Comment by aojea** [comment]
I see, as @danwinship says, so this is the thing, that packet is marked as masquerading

> PACKET: 2 08b493ca OUT=eth1 SRC=10.16.0.2 DST=10.244.1.30 LEN=60 TOS=0x0 TTL=64 ID=45306 DF SPORT=53622 DPORT=80 SYN MARK=0x4c00 
 TRACE: 2 08b493ca nat:POSTROUTING:rule:0x43:JUMP:CILIUM_POST_nat  -4 -t nat -A POSTROUTING -m comment --comment "cilium-feeder: CILIUM_POST_nat" -j CILIUM_POST_nat
 TRACE: 2 08b493ca nat:POSTROUTING:rule:0x14:JUMP:KUBE-POSTROUTING  -4 -t nat -A POSTROUTING -m comment --comment "kubernetes postrouting rules" -j KUBE-POSTROUTING
 TRACE: 2 08b493ca nat:KUBE-POSTROUTING:rule:0xaa:CONTINUE  -4 -t nat -A KUBE-POSTROUTING -j MARK --set-xmark 0x4000/0x0
 TRACE: 2 08b493ca nat:KUBE-POSTROUTING:rule:0xab:ACCEPT  -4 -t nat -A KUBE-POSTROUTING -m comment --comment "kubernetes service traffic requiring SNAT" -j MASQUERADE --random-fully

This works with a single interface because we use the podCIDR to discriminate between "local" and "non-local" traffic, see per example
```
-A KUBE-SVC-ERIFXISQEP7F7OF4 ! -s 10.244.0.0/16 -d 10.96.0.10/32 -p tcp -m comment --comment "kube-system/kube-dns:dns-tcp cluster IP" -m tcp --dport 53 -j KUBE-MARK-MASQ
-A KUBE-SVC-ERIFXISQEP7F7OF4 -m comment --comment "kube-system/kube-dns:dns-tcp -> 10.244.0.3:53" -m statistic --mode random --probability 0.50000000000 -j KUBE-SEP-ZXMNUKOKXUTL2MK2
-A KUBE-SVC-ERIFXISQEP7F7OF4 -m comment --comment "kube-system/kube-dns:dns-tcp -> 10.244.0.4:53" -j KUBE-SEP-SF3LG62VAE5ALYDV
```

and the traffic now is coming from `10.16.0.2`, that is not within the podCIDR but it is a local address.

Traffic generated from the host goes directly to the OUTPUT chain 

https://commons.wikimedia.org/wiki/File:Netfilter-packet-flow.svg

@naoki9911  If we add a condition in the KUBE-POSTROUTING rule you can achieve what you want, in your case in each node avoid masquerading the source ip
```
iptables -t nat -I KUBE-POSTROUTING 1 -s 10.16.0.2 -j RETURN
```

The problem is that we can not generalize that ANY IP on a node can be reachable from other node, as in this case propagating the reachability of the loopbacks depend on the BGP protocol, but does not stop applications to bind to any address in the host,

**Comment by naoki9911** [comment]
Thank you for the solution. It works as I intended!

```console
root@kind-worker2:/# ip route add 10.96.0.0/16 dev lo src 10.16.0.2
root@kind-worker2:/# ip route get 10.96.141.244
10.96.141.244 dev lo src 10.16.0.2 uid 0 
    cache <local> 
root@kind-worker2:/# iptables -t nat -I KUBE-POSTROUTING 1 -s 10.16.0.2 -j RETURN
root@kind-worker2:/# curl 10.96.141.244
<!DOCTYPE html>
<html>
<head>
<title>Welcome to nginx!</title>
...
```

```console
root@kind-worker2:/# tcpdump -i any port 80
tcpdump: data link type LINUX_SLL2
tcpdump: verbose output suppressed, use -v[v]... for full protocol decode
listening on any, link-type LINUX_SLL2 (Linux cooked v2), snapshot length 262144 bytes
00:38:40.133399 eth2  Out IP 10.16.0.2.41868 > 10.244.2.118.http: Flags [S], seq 1747818341, win 65495, options [mss 65495,sackOK,TS val 812890569 ecr 0,nop,wscale 7], length 0
00:38:40.133507 eth2  In  IP 10.244.2.118.http > 10.16.0.2.41868: Flags [S.], seq 2989164266, ack 1747818342, win 65160, options [mss 1460,sackOK,TS val 635373154 ecr 812890569,nop,wscale 7], length 0
00:38:40.133543 eth2  Out IP 10.16.0.2.41868 > 10.244.2.118.http: Flags [.], ack 1, win 512, options [nop,nop,TS val 812890569 ecr 635373154], length 0
00:38:40.133619 eth2  Out IP 10.16.0.2.41868 > 10.244.2.118.http: Flags [P.], seq 1:78, ack 1, win 512, options [nop,nop,TS val 812890569 ecr 635373154], length 77: HTTP: GET / HTTP/1.1
...
```

**Comment by aojea** [comment]
I didn't test this but I think you can use https://github.com/kubernetes/enhancements/tree/master/keps/sig-network/2450-Remove-knowledge-of-pod-cluster-CIDR-from-iptables-rules  , and use `--detect-local=cluster-cidr` and then in `--cluster-cidr=` set a range that covers all the ip addresses that you want to consider in cluster traffic, ie. all pods addresses and all loopback ones
