### ISSUE TITLE
kubectl commands lagging

### ISSUE THREAD

**Issue by Antiarchitect** [kubernetes/kubernetes#98283]
**What happened**:
I have a production cluster of K8s 1.9.5 and two developer linux machines with the same Go and kubectl version:
```
Client Version: version.Info{Major:"1", Minor:"19", GitVersion:"v1.19.5", GitCommit:"e338cf2c6d297aa603b50ad3a301f761b4173aa6", GitTreeState:"clean", BuildDate:"2020-12-09T11:18:51Z", GoVersion:"go1.15.2", Compiler:"gc", Platform:"linux/amd64"}
Server Version: version.Info{Major:"1", Minor:"19", GitVersion:"v1.19.5", GitCommit:"e338cf2c6d297aa603b50ad3a301f761b4173aa6", GitTreeState:"clean", BuildDate:"2020-12-09T11:10:32Z", GoVersion:"go1.15.2", Compiler:"gc", Platform:"linux/amd64"}
```

```
go version go1.15.7 linux/amd64
```

On one of the machines (`Linux warmachine 5.10.8-200.fc33.x86_64 #1 SMP Sun Jan 17 19:53:01 UTC 2021 x86_64 x86_64 x86_64 GNU/Linux`) `kubectl get pods -v=99` shows that all requests behind the kubectl command are performed with normal time and it actually is (last one):
```
I0122 03:01:27.449099   11110 round_trippers.go:423] curl -k -v -XGET  -H "Accept: application/json;as=Table;v=v1;g=meta.k8s.io,application/json;as
=Table;v=v1beta1;g=meta.k8s.io,application/json" -H "User-Agent: kubectl/v1.19.5 (linux/amd64) kubernetes/e338cf2" 'https://xxx:6443/
api/v1/namespaces/default/pods?limit=500'
I0122 03:01:27.600157   11110 round_trippers.go:443] GET https://xxx:6443/api/v1/namespaces/default/pods?limit=500 200 OK in 151 milliseconds
I0122 03:01:27.600197   11110 round_trippers.go:449] Response Headers:
I0122 03:01:27.600213   11110 round_trippers.go:452]     Date: Fri, 22 Jan 2021 00:01:27 GMT
I0122 03:01:27.600229   11110 round_trippers.go:452]     Cache-Control: no-cache, private
I0122 03:01:27.600245   11110 round_trippers.go:452]     Content-Type: application/json
I0122 03:01:27.600262   11110 round_trippers.go:452]     Content-Length: 2930
```

On the other one (`Linux dell-warbook 5.10.9-arch1-1 #1 SMP PREEMPT Tue, 19 Jan 2021 22:06:06 +0000 x86_64 GNU/Linux`) I see 5 seconds lag on the last request:
```
I0122 03:02:04.900863    3509 round_trippers.go:423] curl -k -v -XGET  -H "Accept: application/json;as=Table;v=v1;g=meta.k8s.io,application/json;as=Table;v=v1beta1;g=meta.k8s.io,application/json" -H "User-Agent: kubectl/v1.19.5 (linux/amd64) kubernetes/e338cf2" 'https://xxx:6443/api/v1/namespaces/default/pods?limit=500'
I0122 03:02:10.086231    3509 round_trippers.go:443] GET https://xxx:6443/api/v1/namespaces/default/pods?limit=500 200 OK in 5185 milliseconds
I0122 03:02:10.086269    3509 round_trippers.go:449] Response Headers:
I0122 03:02:10.086282    3509 round_trippers.go:452]     Cache-Control: no-cache, private
I0122 03:02:10.086293    3509 round_trippers.go:452]     Content-Type: application/json
I0122 03:02:10.086303    3509 round_trippers.go:452]     Content-Length: 2930
I0122 03:02:10.086318    3509 round_trippers.go:452]     Date: Fri, 22 Jan 2021 00:02:22 GMT
```

I have checked the performance of the actual request on a second machine as described here: https://kubernetes.io/docs/tasks/administer-cluster/access-cluster-api/#without-kubectl-proxy
and it is pretty normal:

```
time curl -k -s -o /dev/null -XGET  -H "Accept: application/json;as=Table;v=v1;g=meta.k8s.io,application/json;as=Table;v=v1beta1;g=meta.k8s.io,application/json" -H "User-Agent: kubectl/v1.19.5 (linux/amd64) kubernetes/e338cf2" -H "Authorization: Bearer $TOKEN" 'https://xxx:6443/api/v1/namespaces/default/pods?limit=500'

real    0m0.260s
user    0m0.028s
sys     0m0.017s
```

Interesting fact. When I remove ~/.kube/cache the first request now have this lag (not the last) on the second machine:

```
I0122 03:24:01.601112    5417 round_trippers.go:423] curl -k -v -XGET  -H "Accept: application/json, */*" -H "User-Agent: kubectl/v1.19.5 (linux/amd64) kubernetes/e338cf2" 'https://xxx:6443/api?timeout=32s'
I0122 03:24:06.890195    5417 round_trippers.go:443] GET https://xxx:6443/api?timeout=32s 200 OK in 5289 milliseconds
I0122 03:24:06.890224    5417 round_trippers.go:449] Response Headers:
I0122 03:24:06.890229    5417 round_trippers.go:452]     Cache-Control: no-cache, private
I0122 03:24:06.890234    5417 round_trippers.go:452]     Content-Type: application/json
I0122 03:24:06.890238    5417 round_trippers.go:452]     Content-Length: 136
I0122 03:24:06.890242    5417 round_trippers.go:452]     Date: Fri, 22 Jan 2021 00:24:18 GMT
```

P.S. My `~/.kube/config` is the same on both machines as synced via the Syncthing tool. Both machines use fast SSDs and the cache directory is located there (no sync for it).

**What you expected to happen**:
Response times are the same

**Comment by pacoxu** [comment]
Not an expert on this. Just think that you should check
1. Is a small request like https://xxx:6443/api/v1/namespaces/default/pods?limit=1 slow as well?
2. Have you use tcpdump/wireshark to see whether there are warnings like `TCP Retransmission`?
Don't think this issue is related to the kubelet cache. (IMO)

**Comment by Antiarchitect** [comment]
The main problem in diagnostics is when I do request by hand via curl - it goes with an expected speed - no lag at all.
I will try to use Wireshark in order to diagnose further.

**Comment by Antiarchitect** [comment]
That's what I see (`tcpdump | grep kube`) on `kubectl get namespaces` as you can see all goes momentarily but these packets are coming with a noticeable delay. It seems to me that the network stack is not involved in this.

```
03:03:19.647194 IP dell-warbook.43466 > kube-5.prod.xxx.sun-sr-https: Flags [S], seq 2778706572, win 64240, options [mss 1460,sackOK,TS val 563104326 ecr 0,nop,wscale 7], length 0
03:03:19.695421 IP kube-5.prod.xxx.sun-sr-https > dell-warbook.43466: Flags [S.], seq 2153498815, ack 2778706573, win 65160, options [mss 1460,sackOK,TS val 3678941421 ecr 563104326,nop,wscale 7], length 0
03:03:19.695495 IP dell-warbook.43466 > kube-5.prod.xxx.sun-sr-https: Flags [.], ack 1, win 502, options [nop,nop,TS val 563104374 ecr 3678941421], length 0
03:03:19.696035 IP dell-warbook.43466 > kube-5.prod.xxx.sun-sr-https: Flags [P.], seq 1:284, ack 1, win 502, options [nop,nop,TS val 563104375 ecr 3678941421], length 283
03:03:19.740800 IP kube-5.prod.xxx.sun-sr-https > dell-warbook.43466: Flags [.], ack 284, win 507, options [nop,nop,TS val 3678941466 ecr 563104375], length 0
03:03:19.751258 IP kube-5.prod.xxx.sun-sr-https > dell-warbook.43466: Flags [P.], seq 1:1616, ack 284, win 507, options [nop,nop,TS val 3678941473 ecr 563104375], length 1615
03:03:19.751318 IP dell-warbook.43466 > kube-5.prod.xxx.sun-sr-https: Flags [.], ack 1616, win 491, options [nop,nop,TS val 563104430 ecr 3678941473], length 0
03:03:19.756522 IP dell-warbook.43466 > kube-5.prod.xxx.sun-sr-https: Flags [P.], seq 284:1460, ack 1616, win 501, options [nop,nop,TS val 563104435 ecr 3678941473], length 1176
03:03:19.832952 IP dell-warbook.43466 > kube-5.prod.xxx.sun-sr-https: Flags [P.], seq 1460:1744, ack 1616, win 501, options [nop,nop,TS val 563104512 ecr 3678941473], length 284
03:03:19.875748 IP kube-5.prod.xxx.sun-sr-https > dell-warbook.43466: Flags [.], ack 1460, win 501, options [nop,nop,TS val 3678941600 ecr 563104435], length 0
03:03:19.875751 IP kube-5.prod.xxx.sun-sr-https > dell-warbook.43466: Flags [P.], seq 1616:1671, ack 1460, win 501, options [nop,nop,TS val 3678941601 ecr 563104435], length 55
03:03:19.875811 IP dell-warbook.43466 > kube-5.prod.xxx.sun-sr-https: Flags [.], ack 1671, win 501, options [nop,nop,TS val 563104554 ecr 3678941601], length 0
03:03:19.875954 IP dell-warbook.43466 > kube-5.prod.xxx.sun-sr-https: Flags [P.], seq 1744:1775, ack 1671, win 501, options [nop,nop,TS val 563104555 ecr 3678941601], length 31
03:03:19.879720 IP kube-5.prod.xxx.sun-sr-https > dell-warbook.43466: Flags [.], ack 1744, win 501, options [nop,nop,TS val 3678941604 ecr 563104512], length 0
03:03:19.879723 IP kube-5.prod.xxx.sun-sr-https > dell-warbook.43466: Flags [P.], seq 1671:1706, ack 1744, win 501, options [nop,nop,TS val 3678941604 ecr 563104512], length 35
03:03:19.879781 IP dell-warbook.43466 > kube-5.prod.xxx.sun-sr-https: Flags [.], ack 1706, win 501, options [nop,nop,TS val 563104558 ecr 3678941604], length 0
03:03:19.882748 IP kube-5.prod.xxx.sun-sr-https > dell-warbook.43466: Flags [P.], seq 1706:1737, ack 1744, win 501, options [nop,nop,TS val 3678941606 ecr 563104512], length 31
03:03:19.882790 IP dell-warbook.43466 > kube-5.prod.xxx.sun-sr-https: Flags [.], ack 1737, win 501, options [nop,nop,TS val 563104561 ecr 3678941606], length 0
03:03:19.896827 IP kube-5.prod.xxx.sun-sr-https > dell-warbook.43466: Flags [P.], seq 1737:1820, ack 1744, win 501, options [nop,nop,TS val 3678941618 ecr 563104512], length 83
03:03:19.896830 IP kube-5.prod.xxx.sun-sr-https > dell-warbook.43466: Flags [.], seq 1820:3268, ack 1744, win 501, options [nop,nop,TS val 3678941619 ecr 563104512], length 1448
03:03:19.896873 IP dell-warbook.43466 > kube-5.prod.xxx.sun-sr-https: Flags [.], ack 1820, win 501, options [nop,nop,TS val 563104575 ecr 3678941618], length 0
03:03:19.896905 IP dell-warbook.43466 > kube-5.prod.xxx.sun-sr-https: Flags [.], ack 3268, win 501, options [nop,nop,TS val 563104575 ecr 3678941619], length 0
03:03:19.902652 IP kube-5.prod.xxx.sun-sr-https > dell-warbook.43466: Flags [P.], seq 3268:4716, ack 1744, win 501, options [nop,nop,TS val 3678941619 ecr 563104512], length 1448
03:03:19.902655 IP kube-5.prod.xxx.sun-sr-https > dell-warbook.43466: Flags [P.], seq 4716:7612, ack 1744, win 501, options [nop,nop,TS val 3678941619 ecr 563104512], length 2896
03:03:19.902655 IP kube-5.prod.xxx.sun-sr-https > dell-warbook.43466: Flags [P.], seq 7612:7772, ack 1744, win 501, options [nop,nop,TS val 3678941619 ecr 563104512], length 160
03:03:19.902656 IP kube-5.prod.xxx.sun-sr-https > dell-warbook.43466: Flags [.], seq 7772:9220, ack 1744, win 501, options [nop,nop,TS val 3678941619 ecr 563104512], length 1448
03:03:19.902685 IP dell-warbook.43466 > kube-5.prod.xxx.sun-sr-https: Flags [.], ack 4716, win 501, options [nop,nop,TS val 563104581 ecr 3678941619], length 0
03:03:19.902709 IP dell-warbook.43466 > kube-5.prod.xxx.sun-sr-https: Flags [.], ack 7612, win 481, options [nop,nop,TS val 563104581 ecr 3678941619], length 0
03:03:19.902718 IP dell-warbook.43466 > kube-5.prod.xxx.sun-sr-https: Flags [.], ack 7772, win 480, options [nop,nop,TS val 563104581 ecr 3678941619], length 0
03:03:19.902731 IP dell-warbook.43466 > kube-5.prod.xxx.sun-sr-https: Flags [.], ack 9220, win 469, options [nop,nop,TS val 563104581 ecr 3678941619], length 0
03:03:19.919837 IP kube-5.prod.xxx.sun-sr-https > dell-warbook.43466: Flags [.], seq 9220:10668, ack 1744, win 501, options [nop,nop,TS val 3678941645 ecr 563104554], length 1448
03:03:19.919863 IP dell-warbook.43466 > kube-5.prod.xxx.sun-sr-https: Flags [.], ack 10668, win 501, options [nop,nop,TS val 563104598 ecr 3678941645], length 0
03:03:19.926567 IP kube-5.prod.xxx.sun-sr-https > dell-warbook.43466: Flags [P.], seq 10668:12116, ack 1744, win 501, options [nop,nop,TS val 3678941645 ecr 563104554], length 1448
03:03:19.926570 IP kube-5.prod.xxx.sun-sr-https > dell-warbook.43466: Flags [P.], seq 12116:15012, ack 1775, win 501, options [nop,nop,TS val 3678941650 ecr 563104555], length 2896
03:03:19.926571 IP kube-5.prod.xxx.sun-sr-https > dell-warbook.43466: Flags [P.], seq 15012:17908, ack 1775, win 501, options [nop,nop,TS val 3678941652 ecr 563104561], length 2896
03:03:19.926601 IP dell-warbook.43466 > kube-5.prod.xxx.sun-sr-https: Flags [.], ack 12116, win 501, options [nop,nop,TS val 563104605 ecr 3678941645], length 0
03:03:19.926630 IP dell-warbook.43466 > kube-5.prod.xxx.sun-sr-https: Flags [.], ack 15012, win 481, options [nop,nop,TS val 563104605 ecr 3678941650], length 0
03:03:19.926748 IP dell-warbook.43466 > kube-5.prod.xxx.sun-sr-https: Flags [.], ack 17908, win 501, options [nop,nop,TS val 563104605 ecr 3678941652], length 0
03:03:19.949727 IP kube-5.prod.xxx.sun-sr-https > dell-warbook.43466: Flags [P.], seq 17908:20804, ack 1775, win 501, options [nop,nop,TS val 3678941668 ecr 563104575], length 2896
03:03:19.949730 IP kube-5.prod.xxx.sun-sr-https > dell-warbook.43466: Flags [.], seq 20804:22252, ack 1775, win 501, options [nop,nop,TS val 3678941668 ecr 563104575], length 1448
03:03:19.949905 IP dell-warbook.43466 > kube-5.prod.xxx.sun-sr-https: Flags [.], ack 22252, win 501, options [nop,nop,TS val 563104628 ecr 3678941668], length 0
03:03:19.950077 IP dell-warbook.43466 > kube-5.prod.xxx.sun-sr-https: Flags [P.], seq 1775:1810, ack 22252, win 501, options [nop,nop,TS val 563104629 ecr 3678941668], length 35
03:03:19.953914 IP dell-warbook.43466 > kube-5.prod.xxx.sun-sr-https: Flags [P.], seq 1810:1845, ack 22252, win 501, options [nop,nop,TS val 563104632 ecr 3678941668], length 35
03:03:19.957485 IP kube-5.prod.xxx.sun-sr-https > dell-warbook.43466: Flags [P.], seq 22252:23700, 
```

**Comment by eddiezane** [comment]
@soltysh to take a look. Possibly an issue with CRD discovery burst.

@Antiarchitect do you have a large number of CRD's?

**Comment by Antiarchitect** [comment]
@eddiezane @soltysh As we're running a bare-metal cluster with all abstractions implemented by operators (rook.io, cert-manager, nginx-ingress) I'm pretty sure we have a lot of CRDs.

**Comment by Antiarchitect** [comment]
@eddiezane @soltysh Can I provide you with any additional info?

**Comment by Antiarchitect** [comment]
Closing. It was DNS resolving issue.
