### ISSUE TITLE
Masquerading is done by kube-proxy in ipvs mode also if LoadBalancer with externalTrafficType: Local

### ISSUE THREAD

**Issue by ssasso** [kubernetes/kubernetes#89869]
**What happened**:
When using kube-proxy in ipvs mode, Masquerading is done also for LoadBalancer service types even if in externalTrafficType: Local. The traffic arrives at the service with the local worker node ip address as source.

**What you expected to happen**:
I am expecting that, when externalTrafficType is set to Local, no source NAT is done. This will allow to preserve the Client Source IP address, i.e. when using MetalLB as Load Balancer.
__In fact, this works fine with kube-proxy in iptables mode.__

**How to reproduce it (as minimally and precisely as possible)**:
* Create a Service of Type: LoadBalancer, and externalTrafficType: Local.
* Access the service from external, using the LoadBalancer allocated IP.
* The packets arrive at the service using the worker node source IP.
In fact, this seems to be done from this ipvs rule:
```
Prot LocalAddress:Port Scheduler Flags
  -> RemoteAddress:Port           Forward Weight ActiveConn InActConn
TCP  172.23.133.1:80 rr
  -> 10.249.51.1:80               Masq    1      0          0
```
(172.23.133.1 is the LB external IP, 10.249.51.1 is the service Pod)
* When switching to iptables mode, everything works fine. The packets arrive at the service preserving the real client IP.

**Anything else we need to know?**:
Local environment, 3 master nodes, 4 worker nodes.
Using MetalLB as Load Balancer, Calico as CNI.

**Environment**:
- Kubernetes version (use `kubectl version`): v1.17.4
- Cloud provider or hardware configuration:
- OS (e.g: `cat /etc/os-release`): Ubuntu 18.04 LTS
- Kernel (e.g. `uname -a`): 4.15.0-91-generic
- Install tools: kubespray
- Network plugin and version (if this is a network-related bug): Calico, MetalLB
- Others:

**Comment by athenabot** [comment]
/triage unresolved

Comment `/remove-triage unresolved` when the issue is assessed and confirmed.

🤖 I am a bot run by vllry. 👩‍🔬

**Comment by uablrek** [comment]
The "Masq" in ipvs has nothing to do with client source preservation, it means that *destination* NAT (DNAT) is used (as opposed to DSR where no dnat is made).

**Comment by ssasso** [comment]
@uablrek you are right.
The fact is that SNAT is happening somehow/somewhere using kube-proxy in ipvs mode, while on iptables mode everything works fine.

**Comment by uablrek** [comment]
I can setup a cluster with v1.17.4 and calico so I will to triage this.

/assign

**Comment by ssasso** [comment]
@uablrek if this can be useful, this is my running conf: https://github.com/ssasso/my-k8s

**Comment by ssasso** [comment]
Also, here you can find a pcap trace of the behaviour https://github.com/ssasso/my-k8s/tree/issue_ipvs_nat/pcap : 
First packet is coming from my computer, 133.0 is the MetalLB announced IP.
Second one is sent from the worker node to the Ingress - as you can see, the IP of the node is present here, instead of my IP.

**Comment by uablrek** [comment]
I can not recreate this with v1.17.4 and calico/cni:v3.12.0, source-ip is preserved. This was sort-of expected since this is fundamental K8s functionality and really well tested.

I did `iptables -t nat -S` and here is a (narroved) result;
```
-A KUBE-LOAD-BALANCER -m comment --comment "Kubernetes service load balancer ip + port with externalTrafficPolicy=local" -m set --match-set KUBE-LOAD-BALANCER-LOCAL dst,dst -j RETURN
-A KUBE-LOAD-BALANCER -j KUBE-MARK-MASQ
```
The important thing here is that the match for the `KUBE-LOAD-BALANCER-LOCAL` with `-j RETURN` is made before the jump to `KUBE-MARK-MASQ` which triggers the SNAT. The `--comment` also indicates clearly externalTrafficPolicy=local.

Also important is that the address+port really is in the set;
```
$ ipset list KUBE-LOAD-BALANCER-LOCAL
Name: KUBE-LOAD-BALANCER-LOCAL
Type: hash:ip,port
Revision: 5
Header: family inet hashsize 1024 maxelem 65536
Size in memory: 320
References: 1
Number of entries: 2
Members:
10.0.0.0,tcp:443
10.0.0.0,tcp:80
```
And yes they are (10.0.0.0 is my loadBalancerIP, and yes it is a valid ipv4 which you probably know since you are using metallb).

Please check these things on your system.

I have not checked the pcap yet since it will only confirm your problem, not give any clues to the cause.

**Comment by uablrek** [comment]
I checked the pcap now, but as expected, it just confirms your problem. My thanks for narrowing it down, I was afraid of megs of unrelated data (I have got that before. Frequently.).

Reading the pcap I conclude that the ingress controller pod does not have `hostNetwork: true`, but can you please check just in case?

**Comment by ssasso** [comment]
@uablrek the ingress controller does not have `hostNetwork: true` (it is a standard nginx-ingress, the one provided by kubernetes, with no customization in the deployment).
I see also your point on iptables above.
However, I am not able to explain why when using `iptables` as kube-proxy mode it works as expected, but in `ipvs` it does not.
I also tried to remove the ingress controller, exposing the Pod/Service directly as LoadBalancer - and I was encountering exactly the same issue.

I will try to re-deploy the cluster in `ipvs` mode and give some additional feedbacks.

**Comment by uablrek** [comment]
> However, I am not able to explain why when using iptables as kube-proxy mode it works as expected, but in ipvs it does not.

I agree, that is the really strange thing.

In addition to `iptables -t nat -S` you may do `iptables -t nat -L -nv` immediately after the request and check the counters for the iptables rules. You should get the counter for the first rule incremented but not the second. Counters are cleared in intervals (by the sync I think) so don't wait to long.

**Comment by uablrek** [comment]
Also try to see if the source is preserved if you access the `nodeport` on address "node-ip:nodeport".
Nodeport is implicit for "type: LoadBalancer" so they are assigned even if you do not normally use them.

**Comment by ssasso** [comment]
I tried to change the kube-proxy config to ipvs in my existing cluster, rebooted the worker node (and verified the ipset/ipvs rules are properly set) but not able to reproduce the problem.
I will try to re-deploy the cluster from scratch.

**Comment by ssasso** [comment]
@uablrek I was able to reproduce the problem installing the cluster from scratch.


```
root@k-worker-1:~# iptables -t nat -S | grep LOAD-BALANCER
-N KUBE-LOAD-BALANCER
-A KUBE-LOAD-BALANCER -m comment --comment "Kubernetes service load balancer ip + port with externalTrafficPolicy=local" -m set --match-set KUBE-LOAD-BALANCER-LOCAL dst,dst -j RETURN
-A KUBE-LOAD-BALANCER -j KUBE-MARK-MASQ

root@k-worker-1:~# ipset list KUBE-LOAD-BALANCER-LOCAL
Name: KUBE-LOAD-BALANCER-LOCAL
Type: hash:ip,port
Revision: 5
Header: family inet hashsize 1024 maxelem 65536
Size in memory: 216
References: 1
Number of entries: 2
Members:
172.23.133.0,tcp:80
172.23.133.0,tcp:443

*** PRE-REQUEST:
root@k-worker-1:~# iptables -t nat -Z KUBE-LOAD-BALANCER
root@k-worker-1:~# iptables -t nat -n -v -L KUBE-LOAD-BALANCER
Chain KUBE-LOAD-BALANCER (1 references)
 pkts bytes target     prot opt in     out     source               destination
    0     0 RETURN     all  --  *      *       0.0.0.0/0            0.0.0.0/0            /* Kubernetes service load balancer ip + port with externalTrafficPolicy=local */ match-set KUBE-LOAD-BALANCER-LOCAL dst,dst
    0     0 KUBE-MARK-MASQ  all  --  *      *       0.0.0.0/0            0.0.0.0/0

*** REQUEST:
$ curl http://simple.172.23.133.0.xip.io
        <ul>
                <li><b>Hostname</b>: simple-57c7f8574-fr6bq</li>
                <li><b>Remote IP</b>: 172.23.132.102</li>
                <li><b>HTTP Host</b>: simple.172.23.133.0.xip.io</li>
        </ul>

*** POST-REQUEST:
root@k-worker-1:~# iptables -t nat -n -v -L KUBE-LOAD-BALANCER
Chain KUBE-LOAD-BALANCER (1 references)
 pkts bytes target     prot opt in     out     source               destination
    1    52 RETURN     all  --  *      *       0.0.0.0/0            0.0.0.0/0            /* Kubernetes service load balancer ip + port with externalTrafficPolicy=local */ match-set KUBE-LOAD-BALANCER-LOCAL dst,dst
    0     0 KUBE-MARK-MASQ  all  --  *      *       0.0.0.0/0            0.0.0.0/0

*** WITH NODE PORT:

$ kubectl get service
NAME         TYPE           CLUSTER-IP       EXTERNAL-IP    PORT(S)          AGE
kubernetes   ClusterIP      10.248.0.1       <none>         443/TCP          28m
simple       LoadBalancer   10.248.207.202   172.23.133.1   8080:31020/TCP   5s


$ curl http://172.23.132.102:31020/
        <ul>
                <li><b>Hostname</b>: simple-57c7f8574-fr6bq</li>
                <li><b>Remote IP</b>: 172.23.132.102</li>
                <li><b>HTTP Host</b>: 172.23.132.102:31020</li>
        </ul>
```

simple tcpdump output for the NodePort connection:
```
root@k-worker-1:~# tcpdump -n -i any port 8080 or port 31020
tcpdump: verbose output suppressed, use -v or -vv for full protocol decode
listening on any, link-type LINUX_SLL (Linux cooked), capture size 262144 bytes

14:36:02.441669 IP 172.17.252.225.64594 > 172.23.132.102.31020: Flags [S], seq 2843796905, win 64860, options [mss 1460,nop,wscale 8,nop,nop,sackOK], length 0
14:36:02.441826 IP 172.23.132.102.64594 > 10.249.51.3.8080: Flags [S], seq 2843796905, win 64860, options [mss 1460,nop,wscale 8,nop,nop,sackOK], length 0
14:36:02.441896 IP 10.249.51.3.8080 > 172.23.132.102.64594: Flags [S.], seq 2323449544, ack 2843796906, win 64240, options [mss 1460,nop,nop,sackOK,nop,wscale 7], length 0
14:36:02.441915 IP 172.23.132.102.31020 > 172.17.252.225.64594: Flags [S.], seq 2323449544, ack 2843796906, win 64240, options [mss 1460,nop,nop,sackOK,nop,wscale 7], length 0
14:36:02.481295 IP 172.17.252.225.64594 > 172.23.132.102.31020: Flags [.], ack 1, win 512, length 0
14:36:02.481347 IP 172.23.132.102.64594 > 10.249.51.3.8080: Flags [.], ack 1, win 512, length 0
14:36:02.488335 IP 172.17.252.225.64594 > 172.23.132.102.31020: Flags [P.], seq 1:85, ack 1, win 512, length 84
14:36:02.488366 IP 172.23.132.102.64594 > 10.249.51.3.8080: Flags [P.], seq 1:85, ack 1, win 512, length 84: HTTP: GET / HTTP/1.1
14:36:02.488394 IP 10.249.51.3.8080 > 172.23.132.102.64594: Flags [.], ack 85, win 502, length 0
14:36:02.488407 IP 172.23.132.102.31020 > 172.17.252.225.64594: Flags [.], ack 85, win 502, length 0
14:36:02.501883 IP 10.249.51.3.8080 > 172.23.132.102.64594: Flags [P.], seq 1:474, ack 85, win 502, length 473: HTTP: HTTP/1.1 200 OK
14:36:02.501931 IP 172.23.132.102.31020 > 172.17.252.225.64594: Flags [P.], seq 1:474, ack 85, win 502, length 473
14:36:02.536321 IP 172.17.252.225.64594 > 172.23.132.102.31020: Flags [F.], seq 85, ack 474, win 510, length 0
14:36:02.536360 IP 172.23.132.102.64594 > 10.249.51.3.8080: Flags [F.], seq 85, ack 474, win 510, length 0
14:36:02.536915 IP 10.249.51.3.8080 > 172.23.132.102.64594: Flags [F.], seq 474, ack 86, win 502, length 0
14:36:02.536960 IP 172.23.132.102.31020 > 172.17.252.225.64594: Flags [F.], seq 474, ack 86, win 502, length 0
14:36:02.576424 IP 172.17.252.225.64594 > 172.23.132.102.31020: Flags [.], ack 475, win 510, length 0
14:36:02.576463 IP 172.23.132.102.64594 > 10.249.51.3.8080: Flags [.], ack 475, win 510, length 0

18 packets captured
18 packets received by filter
0 packets dropped by kernel
```

**Comment by uablrek** [comment]
The iptables rules look ok to me, and the counters show that you hit them as expected. I think that the SNAT/masquerade is not done by rules defined by kube-proxy but "something else". Maybe `kubespray` or some configuration in Calico, it is wery hard for me to say since I can't recreate the fault.

Since this fault does not seem like a bug in K8s I set triage/support.

/remove-triage unresolved
/triage support

**Comment by ssasso** [comment]
@uablrek after a deeper investigation, I found the issue in docker(d).
Even if started with `--bridge=none --iptables=false` I still have the docker chains&rules in iptables/nat for the default docker subnet: :-|
```
root@k-worker-3:/etc# iptables -t nat -S | grep -i docker
-N DOCKER
-A PREROUTING -m addrtype --dst-type LOCAL -j DOCKER
-A OUTPUT ! -d 127.0.0.0/8 -m addrtype --dst-type LOCAL -j DOCKER
-A POSTROUTING -s 172.17.0.0/16 ! -o docker0 -j MASQUERADE
-A DOCKER -i docker0 -j RETURN
```
And, in fact, the issue is caused by:
```
-A POSTROUTING -s 172.17.0.0/16 ! -o docker0 -j MASQUERADE
```
(my source ip is _172.17.252.x_)

I am really sorry I wasted your time.
