### ISSUE TITLE
one pod cannot access clusterIP of another pod that running on the same node after running a while

### ISSUE THREAD

**Issue by luckydogxf** [kubernetes/kubernetes#116453]
### What happened?

```
$ kubectl get po -o wide | grep worker-5
prometheus-blackbox-7bd4db7d6f-64ntz               1/1     Running     1 (3h12m ago)   20h     10.244.1.207     k8s-worker-5.pacific-textiles.com   <none>           <none>
prometheus-node-exporter-d9tlh                     1/1     Running     0               158m    172.16.215.143   k8s-worker-5.pacific-textiles.com   <none>           <none>
prometheus-server-75874d8877-db62l                 2/2     Running     2 (3h12m ago)   20h     10.244.1.210     k8s-worker-5.pacific-textiles.com   <none>           <none>
```
Here is svc IP.
```
 kubectl get svc
NAME                                    TYPE        CLUSTER-IP       EXTERNAL-IP   PORT(S)                       AGE
collabora                               ClusterIP   10.102.193.116   <none>        9980/TCP                      156d
grafana                                 ClusterIP   10.100.245.190   <none>        3000/TCP                      267d
prometheus-blackbox                     ClusterIP   10.107.44.90     <none>        9115/TCP                      2d16h
prometheus-node-exporter                ClusterIP   None             <none>        9100/TCP                      2d16h
prometheus-pushgateway                  ClusterIP   10.102.95.181    <none>        9091/TCP                      2d16h
prometheus-server                       ClusterIP   10.96.213.216    <none>        8087/TCP                      2d16h
```
I cannot acess ` prometheus-blackbox` from ` prometheus-server`, as we can see they're both running actively on ` k8s-worker-5.pacific-textiles.com`. The weird thing is that it Was OKay in the beginning.  And it turns not okay overnight.
Here it is.
```
$ kubectl exec -it prometheus-server-75874d8877-db62l /bin/sh

/ $ telnet 10.107.44.90 9115

telnet: can't connect to remote host (10.107.44.90): Connection timed out
```
However, it could be accessed from other pods that isn't running on ` k8s-worker-5.pacific-textiles.com`
Here it is
```
 kubectl get po -o wide | grep master-3
grafana-b7d8b778-9zwnn                             1/1     Running     0              26d     10.244.10.50     k8s-master-3.pacific-textiles.com   <none>           <none>
prometheus-node-exporter-k86ph                     1/1     Running     0              2d15h   172.16.215.155   k8s-master-3.pacific-textiles.com   <none>           <none>
redis-85fdfd4bb7-8z6sg                             2/2     Running     0              26d     10.244.10.47     k8s-master-3.pacific-textiles.com   <none>           <none>

kubectl exec -it redis-85fdfd4bb7-8z6sg /bin/sh
# telnet 10.100.245.190 3000
Trying 10.100.245.190...
Connected to 10.100.245.190.
Escape character is '^]'.
^]
telnet> quit

# telnet 10.107.44.90 9115
Trying 10.107.44.90...
Connected to 10.107.44.90.
Escape character is '^]'.
^]
telnet> quit
```
As we can see from `redis` pod, it could access clusterIP of same node(grafana) , and clusterIP of another node(prometheus-blackbox)

### What did you expect to happen?

pod could access clusterIP freely, regardless of nodes it resides.

### How can we reproduce it (as minimally and precisely as possible)?

1. deploy k8s either 1.25.6 or 1.26.0
2. deploy prometheus-server and blackbox on the sam node. Set many targets in ICMP /HTTP probe.
3. Run it for a while. It may okay in the beginning, then it's not okay.
4. You'll see it.

### Anything else we need to know?

I'm using flannel + kube-proxy IPVS

### Kubernetes version

<details>

```console
$ kubectl version
kubectl version
WARNING: This version information is deprecated and will be replaced with the output from kubectl version --short.  Use --output=yaml|json to get the full version.
Client Version: version.Info{Major:"1", Minor:"26", GitVersion:"v1.26.0", GitCommit:"b46a3f887ca979b1a5d14fd39cb1af43e7e5d12d", GitTreeState:"clean", BuildDate:"2022-12-08T19:58:30Z", GoVersion:"go1.19.4", Compiler:"gc", Platform:"linux/amd64"}
Kustomize Version: v4.5.7
Server Version: version.Info{Major:"1", Minor:"26", GitVersion:"v1.26.0", GitCommit:"b46a3f887ca979b1a5d14fd39cb1af43e7e5d12d", GitTreeState:"clean", BuildDate:"2022-12-08T19:51:45Z", GoVersion:"go1.19.4", Compiler:"gc", Platform:"linux/amd64"}
```

</details>

### Cloud provider

<details>
N/A
</details>

### OS version

<details>

```console
# On Linux:
$ cat /etc/os-release
NAME="Ubuntu"
VERSION="20.04.5 LTS (Focal Fossa)"
ID=ubuntu
ID_LIKE=debian
PRETTY_NAME="Ubuntu 20.04.5 LTS"
VERSION_ID="20.04"
HOME_URL="https://www.ubuntu.com/"
SUPPORT_URL="https://help.ubuntu.com/"
BUG_REPORT_URL="https://bugs.launchpad.net/ubuntu/"
PRIVACY_POLICY_URL="https://www.ubuntu.com/legal/terms-and-policies/privacy-policy"
VERSION_CODENAME=focal
UBUNTU_CODENAME=focal
$ uname -a
5.4.0-144-generic

```

</details>

### Install tools

<details>
kubeadm
</details>

### Container runtime (CRI) and version (if applicable)

<details>
containerd
</details>

### Related plugins (CNI, CSI, ...) and versions (if applicable)

<details>
flannel + kube-proxy IPVS
</details>

**Comment by luckydogxf** [comment]
Here is tcpdump from the node where prometheus-server and blackbox are running on.
Basically the traffic should be:

 prometheus-server --->cni0 -(kernel)-->ipvs --->  prometheus-blackbox

Here is ipvsadm logs on that node. It keep flushing something like `SYN_RECV `.  
```
ubuntu@k8s-worker-5:~$ sudo ipvsadm -Lc | grep 9115
TCP 00:21  SYN_RECV    10.244.1.210:46740 k8s-worker-5.pacific-textiles.com:9115 10.244.1.207:9115
TCP 00:19  SYN_RECV    10.244.1.210:46530 k8s-worker-5.pacific-textiles.com:9115 10.244.1.207:9115
TCP 00:48  SYN_RECV    10.244.1.210:52904 k8s-worker-5.pacific-textiles.com:9115 10.244.1.207:9115
TCP 00:54  SYN_RECV    10.244.1.210:51918 k8s-worker-5.pacific-textiles.com:9115 10.244.1.207:9115
TCP 00:14  SYN_RECV    10.244.1.210:54868 k8s-worker-5.pacific-textiles.com:9115 10.244.1.207:9115
TCP 00:42  SYN_RECV    10.244.1.210:45168 k8s-worker-5.pacific-textiles.com:9115 10.244.1.207:9115
TCP 00:03  SYN_RECV    10.244.1.210:52646 k8s-worker-5.pacific-textiles.com:9115 10.244.1.207:9115
TCP 00:41  SYN_RECV    10.244.1.210:45106 k8s-worker-5.pacific-textiles.com:9115 10.244.1.207:9115
TCP 00:37  SYN_RECV    10.244.1.210:44806 k8s-worker-5.pacific-textiles.com:9115 10.244.1.207:9115
TCP 00:05  SYN_RECV    10.244.1.210:54198 k8s-worker-5.pacific-textiles.com:9115 10.244.1.207:9115
TCP 00:36  SYN_RECV    10.244.1.210:44600 k8s-worker-5.pacific-textiles.com:9115 10.244.1.207:9115
TCP 00:24  SYN_RECV    10.244.1.210:47004 k8s-worker-5.pacific-textiles.com:9115 10.244.1.207:9115
TCP 00:55  SYN_RECV    10.244.1.210:52074 k8s-worker-5.pacific-textiles.com:9115 10.244.1.207:9115
TCP 00:29  SYN_RECV    10.244.1.210:46928 k8s-worker-5.pacific-textiles.com:9115 10.244.1.207:9115
TCP 00:55  SYN_RECV    10.244.1.210:51386 k8s-worker-5.pacific-textiles.com:9115 10.244.1.207:9115
TCP 00:57  SYN_RECV    10.244.1.210:41730 k8s-worker-5.pacific-textiles.com:9115 10.244.1.207:9115
```

**Comment by luckydogxf** [comment]
Here is tcpdump against `cni0`.
---
```
15:13:29.058110 IP 10.244.1.210.44176 > k8s-worker-5.pacific-textiles.com.9115: Flags [S], seq 3474550248, win 62370, options [mss 8910,sackOK,TS val 2708363818 ecr 0,nop,wscale 7], length 0
15:13:29.058181 IP 10.244.1.210.44176 > 10.244.1.207.9115: Flags [S], seq 3474550248, win 62370, options [mss 8910,sackOK,TS val 2708363818 ecr 0,nop,wscale 7], length 0
15:13:29.058205 IP 10.244.1.207.9115 > 10.244.1.210.44176: Flags [S.], seq 3137226590, ack 3474550249, win 62286, options [mss 8910,sackOK,TS val 2831675513 ecr 2708363818,nop,wscale 7], length 0
15:13:29.058219 IP 10.244.1.210.44176 > 10.244.1.207.9115: Flags [R], seq 3474550249, win 0, length 0
---
```

**Comment by luckydogxf** [comment]
weird thing is 
1. 210(prom-server IP) syns with clusterIP.
2. 210 syns with 207(blackbox ip), this may be the proof that ipvs works.
3. 207 returns SYN/ACK to 210.
4. 210 send a RST.

Here is the problem,  in step 4,  210 should connect to clusterIP, not 207 directly. I know in `flannel`, 210 and 207 are in the same node, they could connect directly.
But in this step, it should go through clusterIP. 
---
If it isn't go though clusterIP, why other nodes are okay? See my test above.

**Comment by luckydogxf** [comment]
It has nothing to do with resources, my node have enough CPU/Memory.

**Comment by luckydogxf** [comment]
grafana cannot access prom-server, either through clusterIP if they're running on the same nodes.
So it has nothing to do with application that you're running.

**Comment by luckydogxf** [comment]
All nodes are deployed by `ansible`, so the basic environment should be the same.
Why it's okay in some nodes, while it's not okay in other ones ?

**Comment by sondinht** [comment]
> ## Here is tcpdump against `cni0`.
> ```
> 15:13:29.058110 IP 10.244.1.210.44176 > k8s-worker-5.pacific-textiles.com.9115: Flags [S], seq 3474550248, win 62370, options [mss 8910,sackOK,TS val 2708363818 ecr 0,nop,wscale 7], length 0
> 15:13:29.058181 IP 10.244.1.210.44176 > 10.244.1.207.9115: Flags [S], seq 3474550248, win 62370, options [mss 8910,sackOK,TS val 2708363818 ecr 0,nop,wscale 7], length 0
> 15:13:29.058205 IP 10.244.1.207.9115 > 10.244.1.210.44176: Flags [S.], seq 3137226590, ack 3474550249, win 62286, options [mss 8910,sackOK,TS val 2831675513 ecr 2708363818,nop,wscale 7], length 0
> 15:13:29.058219 IP 10.244.1.210.44176 > 10.244.1.207.9115: Flags [R], seq 3474550249, win 0, length 0
> ---
> ```
@luckydogxf 
I am not able to reproduce the fault. Perhaps it is intermittent issue as you said.

Normally the replies from the server pod .207 to the client pod .210 must pass through ipvs and ipvs performs SNAT to replace srcIP of the replies with cluster IP before sending them back the client pod .210 

I suspect the SYN_ACK did not pass ipvs in this particular case, and thus its srcIP was kept as .207. TCP connection on the client pod returned RST because it did not expect to receive SYN_ACK from srcIP .207.

Though it is not possible to confirm the suspicion by looking the packet trace as capturing packets on the cni0 interface does not show the SNATed reply packets.

For further troubleshooting, you can try 
- Capture packet on the interface linked to the client pod to see if SNAT is performed.
- Compare packet trace between the working and non-working case to see if any difference (pods on both cases should be the same worker node).

**Comment by luckydogxf** [comment]
I used `ksniff` to capture packets against po1 and locate the root cause, yet I don't how how to fix it.
The correct steps of three way  handshake would be
1. po1 -->clusterIp, then DNAT--->pod2,   SYN 
2.  clusterIp-->po1,  SYN +ACK.
3. pod--->clusterIP, ACK

But in step 2, I  can see the connection is po2 --->po1, NOT clusterIP --->po1. That's why the connection is reset.

 In step 2, there is a task called SNAT that changes src IP of packet replied from pod2 to clusterIP, which was skipped.

I captured packet against pod2, too. 
1. po1 --->pod2 (No problem, DNAT'ed),  SYN.
2.  po2 -->po1,  SYN/ACK
3.  po1 ---> po2 , RST.

All shows that kube-proxy sometimes may not function well.
` working one`
https://drive.google.com/file/d/1c-fD42_M9GHPFdog0X4DWp580_etp7EZ/view?usp=sharing, 
` non-working one, capture packets on pod2.`

https://drive.google.com/file/d/1eXJzl7DnLBn7t6MC3h_hghA1NNJPgwSv/view?usp=sharing, 
`non-working on, captured on pod1.`
https://drive.google.com/file/d/1m5IilI5nJEpXv440_93QDNDbJ6tU8ULF/view?usp=sharing

**Comment by sondinht** [comment]
> 
> 1. po1 -->clusterIp, then DNAT--->pod2,   SYN
> 2. clusterIp-->po1,  SYN +ACK.  (Here the non-working one is pod2 --->pod1 with SYN/ACK)
> 3. pod--->clusterIP, ACK
> 
> But in step 2, I can see the connection is po2 --->po1, NOT clusterIP --->po1. That's why the connection was reset.
> https://drive.google.com/file/d/1eXJzl7DnLBn7t6MC3h_hghA1NNJPgwSv/view?usp=sharing, `non-working on, captured on pod1.` https://drive.google.com/file/d/1m5IilI5nJEpXv440_93QDNDbJ6tU8ULF/view?usp=sharing

@luckydogxf it looks weird when seeing SYN+ACK without having clusterIP in the non-working case.

It could be that:
- Due to an incorrect route setting, SYN+ACK was forwarded directly from pod2 to pod1 without passing through ipvs.
- An ipvs bug in handling SNAT if the packet was actually received by ipvs.

You can check statistics of ipvs to confirm if all packets of the non-working are handled by ipvs or not. For example: 

```
1. Reset ipvs counters before doing the test
node-01 ~ # ipvsadm -Z

node-01 ~ # ipvsadm -Ln --stats
IP Virtual Server version 1.2.1 (size=4096)
Prot LocalAddress:Port               Conns   InPkts  OutPkts  InBytes OutBytes
  -> RemoteAddress:Port
TCP  12.0.45.255:7002                    0        0        0        0        0
  -> 11.0.2.5:5002                       0        0        0        0        0

2. Start a tcpdump to capture packets sent/received on pod1 (not sure if ksniff captures on for the interface linking to pod1 or not!?)
node-01 ~ # tcpdump -n -i vethfacd8776


3. Open a TCP connection between pod1 and pod2


4. Double check the ipvs stats. ipvs received 5 packets from pod1 and 4 replies from pod2 
node-01 ~ # ipvsadm -Ln --stats
IP Virtual Server version 1.2.1 (size=4096)
Prot LocalAddress:Port               Conns   InPkts  OutPkts  InBytes OutBytes
  -> RemoteAddress:Port
TCP  12.0.45.255:7002                    1        5        4      268      249
  -> 11.0.2.5:5002                       1        5        4      268      249

5. tcpdump shows 5 out and 4 in packets accordingly. Note: clusterIP is 12.0.45.255 in this example
node-01 ~ # tcpdump -n -i vethfacd8776
tcpdump: verbose output suppressed, use -v[v]... for full protocol decode
listening on vethfacd8776, link-type EN10MB (Ethernet), snapshot length 262144 bytes
09:34:33.993479 IP 11.0.2.4.45533 > 12.0.45.255.7002: Flags [S], seq 2463124901, win 64860, options [mss 1410,sackOK,TS val 1073410462 ecr 0,nop,wscale 7], length 0
09:34:33.993862 IP 12.0.45.255.7002 > 11.0.2.4.45533: Flags [S.], seq 3504982866, ack 2463124902, win 64308, options [mss 1410,sackOK,TS val 3133798802 ecr 1073410462,nop,wscale 7], length 0
09:34:33.993920 IP 11.0.2.4.45533 > 12.0.45.255.7002: Flags [.], ack 1, win 507, options [nop,nop,TS val 1073410462 ecr 3133798802], length 0
09:34:33.995887 IP 12.0.45.255.7002 > 11.0.2.4.45533: Flags [P.], seq 1:34, ack 1, win 503, options [nop,nop,TS val 3133798804 ecr 1073410462], length 33
09:34:33.995965 IP 11.0.2.4.45533 > 12.0.45.255.7002: Flags [.], ack 34, win 507, options [nop,nop,TS val 1073410464 ecr 3133798804], length 0
09:34:33.996159 IP 12.0.45.255.7002 > 11.0.2.4.45533: Flags [F.], seq 34, ack 1, win 503, options [nop,nop,TS val 3133798805 ecr 1073410464], length 0
09:34:34.039282 IP 11.0.2.4.45533 > 12.0.45.255.7002: Flags [.], ack 35, win 507, options [nop,nop,TS val 1073410508 ecr 3133798805], length 0
09:34:36.324050 IP 11.0.2.4.45533 > 12.0.45.255.7002: Flags [F.], seq 1, ack 35, win 507, options [nop,nop,TS val 1073412793 ecr 3133798805], length 0
09:34:36.324212 IP 12.0.45.255.7002 > 11.0.2.4.45533: Flags [.], ack 2, win 503, options [nop,nop,TS val 3133801133 ecr 1073412793], length 0
```

**Comment by sondinht** [comment]
> ```
> ubuntu@k8s-master-3:~$ sudo tcpdump -i 'veth3d65181c@if2' -vvv
> tcpdump: veth3d65181c@if2: No such device exists
> (SIOCGIWMODE failed: No such device)
> ```
> 
> Seems it cannot perform tcpdump against veth pair devices on a node.

Your interface name should be `veth3d65181c` without "@if2"

**Comment by luckydogxf** [comment]
Same here.

po1: 10.244.10.115
po2: 10.244.10.125,clusterIP of po2:  10.111.235.114

```

# nodes.
ubuntu@k8s-master-3:~$ sudo ipvsadm -Ln --stats | grep 9115
TCP  10.111.235.114:9115              3181    16886        0  1013160        0
  -> 10.244.10.125:9115               3181    16885        0  1013100        0

 
Tcpdump against po1on k8s-master-3

10.244.10.115.44508 > 10.111.235.114.9115: Flags [S], cksum 0x0b77 (incorrect -> 0xad6d), seq 4274510521, win 62370, options [mss 8910,sackOK,TS val 2670867553 ecr 0,nop,wscale 7], length 0
11:21:48.342831 IP (tos 0x0, ttl 64, id 2739, offset 0, flags [DF], proto TCP (6), length 60)
  
    10.244.10.125.9115 > 10.244.10.115.44508: Flags [S.], cksum 0x2b06 (incorrect -> 0xa07e), seq 1606456924, ack 4274510522, win 62286, options [mss 8910,sackOK,TS val 4281137240 ecr 2670867553,nop,wscale 7], length 0
11:21:48.343720 IP (tos 0x0, ttl 64, id 0, offset 0, flags [DF], proto TCP (6), length 60)
 
    10.244.10.115.44508 > 10.244.10.125.9115: Flags [R], cksum 0xda0e (correct), seq 4274510522, win 0, length 0
11:21:48.343745 IP (tos 0x0, ttl 64, id 0, offset 0, flags [DF], proto TCP (6), length 40)
  
```

**Comment by aojea** [comment]
> mss 8910

why do your pods announce so bigs mss?

**Comment by luckydogxf** [comment]
> > mss 8910
> 
> why do your pods announce so bigs mss?

Our MTU is 9000 bytes.
```
4: flannel.1: <BROADCAST,MULTICAST,UP,LOWER_UP> mtu 8950 qdisc noqueue state UNKNOWN group default
    link/ether 6e:77:73:2c:42:02 brd ff:ff:ff:ff:ff:ff
    inet 10.244.10.0/32 scope global flannel.1
       valid_lft forever preferred_lft forever
    inet6 fe80::6c77:73ff:fe2c:4202/64 scope link
       valid_lft forever preferred_lft forever
5: cni0: <BROADCAST,MULTICAST,UP,LOWER_UP> mtu 8950 qdisc noqueue state UP group default qlen 1000
    link/ether ce:a8:e4:8a:1d:d9 brd ff:ff:ff:ff:ff:ff
    inet 10.244.10.1/24 brd 10.244.10.255 scope global cni0
       valid_lft forever preferred_lft forever
    inet6 fe80::cca8:e4ff:fe8a:1dd9/64 scope link
       valid_lft forever preferred_lft forever
7: veth334c2a85@if2: <BROADCAST,MULTICAST,UP,LOWER_UP> mtu 8950 qdisc noqueue master cni0 state UP group default
    link/ether 02:01:dc:f5:32:61 brd ff:ff:ff:ff:ff:ff link-netns cni-29966bd9-eb8d-7c96-5fbe-e46051338c88
    inet6 fe80::1:dcff:fef5:3261/64 scope link
       valid_lft forever preferred_lft forever
8: veth7dcb91b6@if2: <BROADCAST,MULTICAST,UP,LOWER_UP> mtu 8950 qdisc noqueue master cni0 state UP group default
    link/ether d6:4f:79:b9:8d:4a brd ff:ff:ff:ff:ff:ff link-netns cni-8e8b5f20-9053-0fd1-447a-421daff70ff2
    inet6 fe80::d44f:79ff:feb9:8d4a/64 scope link
       valid_lft forever preferred_lft forever
```
8910 is the length that gets rid of vXLAN and other headers. Does it make sense ?

**Comment by sondinht** [comment]
> Same here.
> 
> po1: 10.244.10.115 po2: 10.244.10.125,clusterIP of po2: 10.111.235.114
> 
> ```
> # reset  for a while
> 
> ubuntu@k8s-master-3:~$ sudo ipvsadm -Ln --stats | grep 9115
> TCP  10.111.235.114:9115              1819     9463        0   567780        0
>   -> 10.244.10.125:9115               1819     9463        0   567780        0
> 
> Run again.
> 
> # nodes.
> ubuntu@k8s-master-3:~$ sudo ipvsadm -Ln --stats | grep 9115
> TCP  10.111.235.114:9115              3181    16886        0  1013160        0
>   -> 10.244.10.125:9115               3181    16885        0  1013100        0
> 
>  
> ## We can see SYN/ACK is replied from 10.244.10.125.9115 > 10.244.10.115.44508, instead of clusterIP(235.114).
> And we can see with time passing by , IPVS connection is increasing accordingly. this is probably because `An ipvs bug in handling SNAT if the packet was actually received by ipvs.`

This is obviously not ipvs bug. The column OutPkts (3rd column) of the ipvsadm printout is always 0 in your test. It means that SYN-ACK was not routed through ipvs on the way back to pod1, and thus ipvs did not have chance to perform SNAT for the packet. That's why it has pod2 (instead of clusterIP) as srcIP.

This is a clear indication of route setting issue, not ipvs bug. You can compare the ipvs stats between working and non-working case for confirmation. 

As you mentioned the same traffic case ran ok from the begging, I guess, the route configuration in `kube-proxy` perhaps was manipulated due to some changes in your k8s cluster during runtime, leading to this problem.

For further troubleshooting, you can check kube-proxy.log to see if any new events that could trigger the problem. You can also capture the printouts below and compare the same printout between working and non-working case to see if any route entries or iptables rules are missing:
```
iptables -t nat -S 
iptables -t filter -S
ip route show
ipset list
ip rule show
```

**Comment by luckydogxf** [comment]
```
-P PREROUTING ACCEPT
-P INPUT ACCEPT
-P OUTPUT ACCEPT
-P POSTROUTING ACCEPT
-N FLANNEL-POSTRTG
-N KUBE-KUBELET-CANARY
-N KUBE-LOAD-BALANCER
-N KUBE-MARK-DROP
-N KUBE-MARK-MASQ
-N KUBE-NODE-PORT
-N KUBE-POSTROUTING
-N KUBE-SERVICES
-A PREROUTING -m comment --comment "kubernetes service portals" -j KUBE-SERVICES
-A OUTPUT -m comment --comment "kubernetes service portals" -j KUBE-SERVICES
-A POSTROUTING -m comment --comment "flanneld masq" -j FLANNEL-POSTRTG
-A POSTROUTING -m comment --comment "kubernetes postrouting rules" -j KUBE-POSTROUTING
-A FLANNEL-POSTRTG -m mark --mark 0x4000/0x4000 -m comment --comment "flanneld masq" -j RETURN
-A FLANNEL-POSTRTG -s 10.244.10.0/24 -d 10.244.0.0/16 -m comment --comment "flanneld masq" -j RETURN
-A FLANNEL-POSTRTG -s 10.244.0.0/16 -d 10.244.10.0/24 -m comment --comment "flanneld masq" -j RETURN
-A FLANNEL-POSTRTG ! -s 10.244.0.0/16 -d 10.244.10.0/24 -m comment --comment "flanneld masq" -j RETURN
-A FLANNEL-POSTRTG -s 10.244.0.0/16 ! -d 224.0.0.0/4 -m comment --comment "flanneld masq" -j MASQUERADE --random-fully
-A FLANNEL-POSTRTG ! -s 10.244.0.0/16 -d 10.244.0.0/16 -m comment --comment "flanneld masq" -j MASQUERADE --random-fully
-A KUBE-LOAD-BALANCER -j KUBE-MARK-MASQ
-A KUBE-MARK-DROP -j MARK --set-xmark 0x8000/0x8000
-A KUBE-MARK-MASQ -j MARK --set-xmark 0x4000/0x4000
-A KUBE-NODE-PORT -p tcp -m comment --comment "Kubernetes nodeport TCP port for masquerade purpose" -m set --match-set KUBE-NODE-PORT-TCP dst -j KUBE-MARK-MASQ
-A KUBE-POSTROUTING -m comment --comment "Kubernetes endpoints dst ip:port, source ip for solving hairpin purpose" -m set --match-set KUBE-LOOP-BACK dst,dst,src -j MASQUERADE
-A KUBE-POSTROUTING -m mark ! --mark 0x4000/0x4000 -j RETURN
-A KUBE-POSTROUTING -j MARK --set-xmark 0x4000/0x0
-A KUBE-POSTROUTING -m comment --comment "kubernetes service traffic requiring SNAT" -j MASQUERADE --random-fully
-A KUBE-SERVICES -s 127.0.0.0/8 -j RETURN
-A KUBE-SERVICES ! -s 10.244.0.0/16 -m comment --comment "Kubernetes service cluster ip + port for masquerade purpose" -m set --match-set KUBE-CLUSTER-IP dst,dst -j KUBE-MARK-MASQ
-A KUBE-SERVICES -m addrtype --dst-type LOCAL -j KUBE-NODE-PORT
-A KUBE-SERVICES -m set --match-set KUBE-CLUSTER-IP dst,dst -j ACCEPT
+ sudo iptables -t filter -S
-P INPUT ACCEPT
-P FORWARD ACCEPT
-P OUTPUT ACCEPT
-N FLANNEL-FWD
-N KUBE-FIREWALL
-N KUBE-FORWARD
-N KUBE-IPVS-FILTER
-N KUBE-KUBELET-CANARY
-N KUBE-NODE-PORT
-N KUBE-PROXY-FIREWALL
-N KUBE-SOURCE-RANGES-FIREWALL
-A INPUT -m comment --comment "kubernetes ipvs access filter" -j KUBE-IPVS-FILTER
-A INPUT -m comment --comment "kube-proxy firewall rules" -j KUBE-PROXY-FIREWALL
-A INPUT -m comment --comment "kubernetes health check rules" -j KUBE-NODE-PORT
-A INPUT -j KUBE-FIREWALL
-A FORWARD -m comment --comment "flanneld forward" -j FLANNEL-FWD
-A FORWARD -m comment --comment "kube-proxy firewall rules" -j KUBE-PROXY-FIREWALL
-A FORWARD -m comment --comment "kubernetes forwarding rules" -j KUBE-FORWARD
-A OUTPUT -j KUBE-FIREWALL
-A FLANNEL-FWD -s 10.244.0.0/16 -m comment --comment "flanneld forward" -j ACCEPT
-A FLANNEL-FWD -d 10.244.0.0/16 -m comment --comment "flanneld forward" -j ACCEPT
-A KUBE-FIREWALL ! -s 127.0.0.0/8 -d 127.0.0.0/8 -m comment --comment "block incoming localnet connections" -m conntrack ! --ctstate RELATED,ESTABLISHED,DNAT -j DROP
-A KUBE-FIREWALL -m comment --comment "kubernetes firewall for dropping marked packets" -m mark --mark 0x8000/0x8000 -j DROP
-A KUBE-FORWARD -m comment --comment "kubernetes forwarding rules" -m mark --mark 0x4000/0x4000 -j ACCEPT
-A KUBE-FORWARD -m comment --comment "kubernetes forwarding conntrack rule" -m conntrack --ctstate RELATED,ESTABLISHED -j ACCEPT
-A KUBE-IPVS-FILTER -m set --match-set KUBE-LOAD-BALANCER dst,dst -j RETURN

```
`ipset list` ouputs is almost the same.

I don't think there is anything different after comparing outputs.  Nothing useful in kube-proxy log, either.
I'll discard this as it's hard to locate the root cause.
