### ISSUE TITLE
UDP packet loss

### ISSUE THREAD

**Issue by markine** [kubernetes/kubernetes#56706]
Hello. I am trying to characterize UDP packet loss I'm observing in a Kubernetes 1.7.2 cluster on AWS. 

**The main questions to you**: (a) is the UDP loss rate below what you'd expect?; and (b) why does the loss rate change in response to server scale-ups and scale-downs?

This work started in attempts to debug intermittent DNS lookup failures. The DNS failure rate has decreased significantly when I moved apps from dnsPolicy: ClusterFirst to dnsPolicy: Default but I am still occasionally seeing glitches (still no root cause).

**Observing UDP packet loss between multiple clients and a UDP service**

In essence I'm trying to simulate the kube-dns setup without using kube-dns.

Server: a simple UDP server that responds to requests.

```
kubectl run echo --image n0r1skcom/echo --replicas=1 --port=3333 --requests='cpu=100m,memory=50Mi' --limits='cpu=100m,memory=50Mi' -n kube-system --labels='app=echo'
kubectl create service clusterip echo --tcp=3333:3333 -n kube-system

# Now edit both the deployment and the service to change TCP to UDP

# Also edit the deployment to add a readiness TCP readiness probe on port 3333 (the echo server listens for both TCP and UDP on port 3333) and a preStop hook to "sleep 10" before shutting down.
```

Client: send a message to the echo server and record whether it responded
```
# Start client pod (the dnsutils image is just picked for convenience)
kubectl run echoclient$RANDOM --image tutum/dnsutils -n kube-system --restart=Never  --rm -it -- bash

# Run request loop: 
echo requests passes fails; pass=0; fail=0; i=0 ; while true ; do response=$(echo "ping" | netcat -u $ECHO_SERVICE_HOST $ECHO_SERVICE_PORT -q 1 | grep Hostname | wc -l) ; if [ $response == "0" ] ; then fail=$(($fail+1)); else pass=$(($pass+1)); fi ; i=$(($i+1)) ; echo -en "$i $pass $fail       \r" ; done
```

This is a bit crude and slow (each netcat session takes ~1 second time expire) but launching enough of these client loops does the trick. I got ~500,000 requests with 14 failures across 7 loops. 

Setting up a loop to scale the echo server randomly between 1 and 10 replicas every 5 seconds gives an increase in failure rate: 112 errors for about 444,000 requests.

**Is this a BUG REPORT or FEATURE REQUEST?**:

> Uncomment only one, leave it on its own line: 
>
/kind bug
> /kind feature

**What happened**:

Observing UDP traffic loss.

**What you expected to happen**:

Less UDP traffic loss. Error rate shouldn't change with server scale-up/scale-down events.

**How to reproduce it (as minimally and precisely as possible)**:

See above.

**Anything else we need to know?**:

**Environment**:
- Kubernetes version (use `kubectl version`):

```
$ kubectl version
Client Version: version.Info{Major:"1", Minor:"8", GitVersion:"v1.8.3", GitCommit:"f0efb3cb883751c5ffdbe6d515f3cb4fbe7b7acd", GitTreeState:"clean", BuildDate:"2017-11-09T07:26:38Z", GoVersion:"go1.9.2", Compiler:"gc", Platform:"darwin/amd64"}
Server Version: version.Info{Major:"1", Minor:"7", GitVersion:"v1.7.2", GitCommit:"922a86cfcd65915a9b2f69f3f193b8907d741d9c", GitTreeState:"clean", BuildDate:"2017-07-21T08:08:00Z", GoVersion:"go1.8.3", Compiler:"gc", Platform:"linux/amd64"}
```

- Cloud provider or hardware configuration:

AWS

- OS (e.g. from /etc/os-release):

```
$ cat /etc/os-release 
NAME="Ubuntu"
VERSION="16.04.3 LTS (Xenial Xerus)"
ID=ubuntu
ID_LIKE=debian
PRETTY_NAME="Ubuntu 16.04.3 LTS"
VERSION_ID="16.04"
HOME_URL="http://www.ubuntu.com/"
SUPPORT_URL="http://help.ubuntu.com/"
BUG_REPORT_URL="http://bugs.launchpad.net/ubuntu/"
VERSION_CODENAME=xenial
UBUNTU_CODENAME=xenial
```

- Kernel (e.g. `uname -a`):

```
$ uname -a
Linux ip-172-20-48-176 4.4.0-1030-aws #39-Ubuntu SMP Wed Aug 9 09:43:05 UTC 2017 x86_64 x86_64 x86_64 GNU/Linu
```

- Install tools:

kops 1.7.x

- Others:

**Comment by markine** [comment]
Modifying the client loop slightly to timestamp failures let me look at the traffic in more detail:

```
Failure recorded at:

Fri Dec  1 18:28:52 UTC 2017


Capturing traffic in the pod itself:

18:28:49.110873 ARP, Request who-has 100.97.171.222 tell 100.97.171.1, length 28
18:28:49.110923 ARP, Reply 100.97.171.222 is-at 0a:58:64:61:ab:de, length 28
18:28:49.125944 IP 100.97.171.222.59923 > 100.69.119.232.3333: UDP, length 5
18:28:49.127076 IP 100.69.119.232.3333 > 100.97.171.222.59923: UDP, length 202

18:28:50.129776 IP 100.97.171.222.53720 > 100.69.119.232.3333: UDP, length 5
18:28:50.130925 IP 100.69.119.232.3333 > 100.97.171.222.53720: UDP, length 202

18:28:51.133006 IP 100.97.171.222.39590 > 100.69.119.232.3333: UDP, length 5
[ missing the response here ]

18:28:52.137183 IP 100.97.171.222.55229 > 100.69.119.232.3333: UDP, length 5
18:28:52.138306 IP 100.69.119.232.3333 > 100.97.171.222.55229: UDP, length 202

18:28:53.140473 IP 100.97.171.222.33383 > 100.69.119.232.3333: UDP, length 5
18:28:53.141553 IP 100.69.119.232.3333 > 100.97.171.222.33383: UDP, length 202



On some EC2 node in the cluster, capturing cbr0 traffic:

18:28:49.127926 IP 100.97.171.222.59923 > 100.96.68.153.3333: UDP, length 5
18:28:49.128248 IP 100.96.68.153.3333 > 100.97.171.222.59923: UDP, length 202

18:28:50.131809 IP 100.97.171.222.53720 > 100.96.68.153.3333: UDP, length 5
18:28:50.132076 IP 100.96.68.153.3333 > 100.97.171.222.53720: UDP, length 202

[ missing the 18:28:51 request here ]

18:28:52.139198 IP 100.97.171.222.55229 > 100.96.68.153.3333: UDP, length 5
18:28:52.139470 IP 100.96.68.153.3333 > 100.97.171.222.55229: UDP, length 202

18:28:53.142469 IP 100.97.171.222.33383 > 100.96.68.153.3333: UDP, length 5
18:28:53.142732 IP 100.96.68.153.3333 > 100.97.171.222.33383: UDP, length 202
```

**Comment by BradErz** [comment]
Just out of intrest what overlay network system are you using? We were using flannel with the Backed type set to UDP. We were also experiencing a lot of intermittent DNS timeouts.

Changing to vxlan has sempt to have sold our problems.

**Comment by hanikesn** [comment]
We're having the same problems when using calico.

**Comment by markine** [comment]
@BradErz @hanikesn vxlan set up using kops 1.7.x.

**Comment by cmluciano** [comment]
@kubernetes/sig-network-bugs

**Comment by amardomingo** [comment]
We are seeing something similar on AWS
* Cluster version: 1.8.4
  * Upgraded from 1.7.2
* Network System: Calico v1.11.0
* Kops: 1.8.0 
* Node OS:  Debian 8.9 

We have had 11 DNS failures over ~160.000 queries, and we are trying to replicate the error in a controlled maner, but with little luck so far.

**Comment by bowei** [comment]
What is the kernel you are using (`uname -a`)

**Comment by amardomingo** [comment]
Kernel version is 4.4.102-k8s, from kops' ami k8s-1.8-debian-jessie-amd64-hvm-ebs-2017-12-02 (ami-bd229ec4)

```
root@ip-10-0-74-74:~# uname -a
Linux ip-10-0-74-74 4.4.102-k8s #1 SMP Sun Nov 26 23:32:43 UTC 2017 x86_64 GNU/Linux
```

**Comment by amardomingo** [comment]
After doing further testing, we have managed to reproduce the DNS errors, but not the UDP.

We have run 450k UDP echo requests with no failure, but after running 40k dns requests we got 19 dns errors (connection timeout), but we have been unable to pinpoint a common element in the failures.

**Comment by bowei** [comment]
Can you check the linux counters for packet drops?

`netstat -s`

**Comment by amardomingo** [comment]
Here you go:

```
root@ip-10-0-74-74:~# netstat -s
Ip:
    661766917 total packets received
    2 with invalid addresses
    468098965 forwarded
    0 incoming packets discarded
    193431710 incoming packets delivered
    646089809 requests sent out
    12774 fragments failed
Icmp:
    1857294 ICMP messages received
    910168 input ICMP message failed.
    ICMP input histogram:
        destination unreachable: 1857294
    1994677 ICMP messages sent
    0 ICMP messages failed
    ICMP output histogram:
        destination unreachable: 1994677
IcmpMsg:
        InType3: 1857294
        OutType3: 1994677
Tcp:
    2308853 active connections openings
    430 passive connection openings
    1014646 failed connection attempts
    843 connection resets received
    39 connections established
    14472291 segments received
    15938216 segments send out
    1511392 segments retransmited
    0 bad segments received.
    228492 resets sent
Udp:
    12088 packets received
    0 packets to unknown port received.
    0 packet receive errors
    12342 packets sent
UdpLite:
TcpExt:
    5 ICMP packets dropped because socket was locked
    160210 TCP sockets finished time wait in fast timer
    335357 delayed acks sent
    27 delayed acks further delayed because of locked socket
    Quick ack mode was activated 336 times
    4984078 packet headers predicted
    3129804 acknowledgments not containing data payload received
    1961170 predicted acknowledgments
    3 congestion windows recovered without slow start after partial ack
    1010369 other TCP timeouts
    TCPLossProbes: 40
    TCPLossProbeRecovery: 1
    336 DSACKs sent for old packets
    4 DSACKs sent for out of order packets
    31 DSACKs received
    522 connections reset due to unexpected data
    71 connections reset due to early user close
    5436 connections aborted due to timeout
    TCPDSACKIgnoredNoUndo: 22
    TCPSackShiftFallback: 8
    TCPRcvCoalesce: 987880
    TCPOFOQueue: 60736
    TCPOFOMerge: 3
    TCPSpuriousRtxHostQueues: 921744
    TCPAutoCorking: 221680
    TCPWantZeroWindowAdv: 108
    TCPSynRetrans: 1511304
    TCPOrigDataSent: 5668809
    TCPHystartTrainDetect: 22
    TCPHystartTrainCwnd: 536
    TCPKeepAlive: 509932
IpExt:
    InOctets: 524874705753
    OutOctets: 1140988258354
    InNoECTPkts: 870934242
```

I am starting to think we are having a different issue here

**Comment by kprabhak** [comment]
Can you keep an 'ip monitor' running and watch for any interface change events? Do any of you have NetworkManager running?

**Comment by max-rocket-internet** [comment]
We also seem to have a high amount of errors. This is from a host that has been up for 24 days:

```
# netstat -s | egrep 'fail|retra|drop'
    3031 fragments failed
    2824407 input ICMP message failed.
    0 ICMP messages failed
    2955602 failed connection attempts
    6599542 segments retransmited
    5 ICMP packets dropped because they were out-of-window
    1 ICMP packets dropped because socket was locked
    106 fast retransmits
    73 forward retransmits
```

Kubernetes version: 1.8.4
Kops version: 1.8.0
Networking: calico

Is this the same issue?

**Comment by kprabhak** [comment]
@max-rocket-internet The fact that you have fragmentation occurring (from your fragments failed counters) seems to suggest that you've some mtu mismatches. Could you check the mtu in your Calico manifests, both in the cni configuration, as well as in the host (felix) configuration, and check if they are aligned with your interface mtu.

**Comment by max-rocket-internet** [comment]
@kprabhak 

Thanks for the suggestion. I don't think any MTU settings are set by default with a kops cluster. I checked the deployment for `calico-kube-controllers` and the daemonset `calico-node` and the configmap `calico-config`. Nothing about MTU. So I guess it's just using [the default](https://docs.projectcalico.org/v3.0/usage/configuration/mtu).

I checked the MTU of `eth0` on a node and it is `9001`. This was a test cluster and using AWS `t2` instances, which it seems [don't support jumbo frames](https://docs.aws.amazon.com/AWSEC2/latest/UserGuide/network_mtu.html#jumbo_frame_instances).

So I'll create all nodes using `c4` instances and see if the stats improve.

**Comment by jamesmcminn96** [comment]
@max-rocket-internet how did you find upgrading to c4's go? I'm having this same issue, but already using c4's.

**Comment by max-rocket-internet** [comment]
I was wrong, T2 instances do support jumbo frames anyway.

I think our issue was this one: https://github.com/kubernetes/kops/issues/3224
We applied the fix from there and no longer have problems.

I think stats like this are perhaps normal (taken from a k8s node up 5 days):

```
root@ip-10-0-19-226:~# netstat -s | egrep 'fail|retra|drop'
    254 fragments failed
    0 input ICMP message failed.
    0 ICMP messages failed
    62 failed connection attempts
    16932 segments retransmited
    186 fast retransmits
    25 forward retransmits
```
