### ISSUE TITLE
kubernetes 1.13.10 cluster worker node cannot resolve dns

### ISSUE THREAD

**Issue by xwang95054** [kubernetes/kubernetes#83040]
root@da-master:/home/aella# kubectl version
Client Version: version.Info{Major:"1", Minor:"13", GitVersion:"v1.13.10", GitCommit:"37d169313237cb4ceb2cc4bef300f2ae3053c1a2", GitTreeState:"clean", BuildDate:"2019-08-19T10:52:43Z", GoVersion:"go1.11.13", Compiler:"gc", Platform:"linux/amd64"}
Server Version: version.Info{Major:"1", Minor:"13", GitVersion:"v1.13.10", GitCommit:"37d169313237cb4ceb2cc4bef300f2ae3053c1a2", GitTreeState:"clean", BuildDate:"2019-08-19T10:44:49Z", GoVersion:"go1.11.13", Compiler:"gc", Platform:"linux/amd64"}

root@da-master:/home/aella# kubectl get nodes -o wide
NAME        STATUS   ROLES    AGE   VERSION    INTERNAL-IP     EXTERNAL-IP   OS-IMAGE             KERNEL-VERSION      CONTAINER-RUNTIME
da-master   Ready    master   3d    v1.13.10   192.168.123.3   <none>        Ubuntu 16.04.6 LTS   4.4.0-161-generic   docker://18.6.1
da-worker   Ready    <none>   3d    v1.13.10   192.168.123.5   <none>        Ubuntu 16.04.6 LTS   4.4.0-161-generic   docker://18.6.1

Pods on da-worker cannot resolve dns

root@da-master:/home/aella# kubectl get pods -o wide
NAME      READY   STATUS    RESTARTS   AGE   IP             NODE        NOMINATED NODE   READINESS GATES
busybox   1/1     Running   8          8h    10.244.1.195   da-worker   <none>           <none>

root@da-master:/home/aella# kubectl exec busybox cat /etc/resolv.conf
nameserver 10.96.0.10
Gsearch default.svc.cluster.local svc.cluster.local cluster.local
options ndots:5

root@da-master:/home/aella# kubectl exec -ti busybox -- nslookup kubernetes.default
Server:    10.96.0.10
Address 1: 10.96.0.10

nslookup: can't resolve 'kubernetes.default'
command terminated with exit code 1

root@da-master:/home/aella# kubectl get pods --namespace=kube-system -l k8s-app=kube-dns -o wide
NAME                       READY   STATUS    RESTARTS   AGE   IP            NODE        NOMINATED NODE   READINESS GATES
coredns-54ff9cd656-85s9f   1/1     Running   1          3d    10.244.0.41   da-master   <none>           <none>
coredns-54ff9cd656-s9wjr   1/1     Running   2          3d    10.244.0.44   da-master   <none>           <none>

root@da-master:/home/aella# kubectl get svc --namespace=kube-system -o wide
NAME                  TYPE        CLUSTER-IP      EXTERNAL-IP   PORT(S)             AGE   SELECTOR
heapster              ClusterIP   10.109.92.220   <none>        80/TCP              3d    k8s-app=heapster
kube-dns              ClusterIP   10.96.0.10      <none>        53/UDP,53/TCP       3d    k8s-app=kube-dns
monitoring-influxdb   ClusterIP   10.109.35.57    <none>        8083/TCP,8086/TCP   3d    k8s-app=influxdb

root@da-master:/home/aella# kubectl get ep kube-dns --namespace=kube-system
NAME       ENDPOINTS                                                  AGE
kube-dns   10.244.0.41:53,10.244.0.44:53,10.244.0.41:53 + 1 more...   3d

root@da-master:/home/aella# kubectl -n kube-system edit configmap coredns

apiVersion: v1
data:
  Corefile: |
    .:53 {
        log
        errors
        health
        kubernetes cluster.local in-addr.arpa ip6.arpa {
           pods insecure
           upstream
           fallthrough in-addr.arpa ip6.arpa
        }
        prometheus :9153
        proxy . /etc/resolv.conf
        cache 30
        loop
        reload
        loadbalance
    }
kind: ConfigMap
metadata:
  creationTimestamp: "2019-09-21T02:22:10Z"
  name: coredns
  namespace: kube-system
  resourceVersion: "360923"
  selfLink: /api/v1/namespaces/kube-system/configmaps/coredns
  uid: 9d81d76a-dc16-11e9-8873-525400df8117

Do nslookup inside the pod for www.yahoo.com:
root@da-master:/home/aella# kubectl exec -it busybox sh
/ #.
/ # nslookup www.yahoo.com
Server:    10.96.0.10

root@da-worker:/home/aella# tcpdump -i cni0 host 10.244.1.195
tcpdump: verbose output suppressed, use -v or -vv for full protocol decode
listening on cni0, link-type EN10MB (Ethernet), capture size 262144 bytes
02:59:54.820747 IP 10.244.1.195.59917 > 10.244.0.41.domain: 2+ PTR? 10.0.96.10.in-addr.arpa. (41)
02:59:54.820904 IP 10.96.0.10 > 10.244.1.195: ICMP time exceeded in-transit, length 77
02:59:59.823413 ARP, Request who-has 10.244.1.195 tell 10.244.1.1, length 28
02:59:59.823402 ARP, Request who-has 10.244.1.1 tell 10.244.1.195, length 28
02:59:59.823462 ARP, Reply 10.244.1.1 is-at 0a:58:0a:f4:01:01 (oui Unknown), length 28
02:59:59.823469 ARP, Reply 10.244.1.195 is-at ea:d3:c2:41:31:c0 (oui Unknown), length 28
02:59:59.823518 IP 10.244.1.195.54940 > 10.244.0.44.domain: 3+ PTR? 10.0.96.10.in-addr.arpa. (41)
02:59:59.823645 IP 10.96.0.10 > 10.244.1.195: ICMP time exceeded in-transit, length 77
03:00:04.828736 IP 10.244.1.195.49742 > 10.244.0.44.domain: 4+ PTR? 10.0.96.10.in-addr.arpa. (41)
03:00:04.828885 IP 10.96.0.10 > 10.244.1.195: ICMP time exceeded in-transit, length 77
03:00:09.833978 IP 10.244.1.195.58493 > 10.244.0.41.domain: 5+ PTR? 10.0.96.10.in-addr.arpa. (41)
03:00:09.834114 IP 10.96.0.10 > 10.244.1.195: ICMP time exceeded in-transit, length 77

root@da-worker:/home/aella# tcpdump -i flannel.1.
tcpdump: verbose output suppressed, use -v or -vv for full protocol decode
listening on flannel.1, link-type EN10MB (Ethernet), capture size 262144 bytes
02:32:27.361954 IP 10.244.1.0.59841 > 10.244.0.41.domain: 6+ AAAA? www.yahoo.com. (31)
02:32:27.361926 IP 10.244.1.0.59841 > 10.244.0.41.domain: 6+ AAAA? www.yahoo.com. (31)
02:32:27.361968 IP 10.244.1.0.59841 > 10.244.0.41.domain: 6+ AAAA? www.yahoo.com. (31)
02:32:27.361926 IP 10.244.1.0.59841 > 10.244.0.41.domain: 6+ AAAA? www.yahoo.com. (31)
02:32:27.361971 IP 10.244.1.0.59841 > 10.244.0.41.domain: 6+ AAAA? www.yahoo.com. (31)
02:32:27.361926 IP 10.244.1.0.59841 > 10.244.0.41.domain: 6+ AAAA? www.yahoo.com. (31)

root@da-master:/home/aella# iptables -L.
Chain INPUT (policy ACCEPT)
target     prot opt source               destination.........
KUBE-SERVICES  all  --  anywhere             anywhere             ctstate NEW /* kubernetes service portals */
KUBE-EXTERNAL-SERVICES  all  --  anywhere             anywhere             ctstate NEW /* kubernetes externally-visible service portals */
KUBE-SERVICES  all  --  anywhere             anywhere             /* kubernetes service portals */
KUBE-FIREWALL  all  --  anywhere             anywhere............

Chain FORWARD (policy ACCEPT)
target     prot opt source               destination.........
KUBE-FORWARD  all  --  anywhere             anywhere             /* kubernetes forwarding rules */
DOCKER-ISOLATION-STAGE-1  all  --  anywhere             anywhere............
DOCKER-USER  all  --  anywhere             anywhere............
ACCEPT     all  --  anywhere             anywhere             ctstate RELATED,ESTABLISHED
DOCKER     all  --  anywhere             anywhere............
ACCEPT     all  --  anywhere             anywhere............
ACCEPT     all  --  anywhere             anywhere............
KUBE-SERVICES  all  --  anywhere             anywhere             ctstate NEW /* kubernetes service portals */
ACCEPT     all  --  10.244.0.0/16        anywhere............
ACCEPT     all  --  anywhere             10.244.0.0/16.......

Chain OUTPUT (policy ACCEPT)
target     prot opt source               destination.........
KUBE-SERVICES  all  --  anywhere             anywhere             ctstate NEW /* kubernetes service portals */
KUBE-SERVICES  all  --  anywhere             anywhere             /* kubernetes service portals */
KUBE-FIREWALL  all  --  anywhere             anywhere............

Chain DOCKER (1 references)
target     prot opt source               destination.........

Chain DOCKER-ISOLATION-STAGE-1 (1 references)
target     prot opt source               destination.........
DOCKER-ISOLATION-STAGE-2  all  --  anywhere             anywhere............
RETURN     all  --  anywhere             anywhere............

Chain DOCKER-ISOLATION-STAGE-2 (1 references)
target     prot opt source               destination.........
DROP       all  --  anywhere             anywhere............
RETURN     all  --  anywhere             anywhere............

Chain DOCKER-USER (1 references)
target     prot opt source               destination.........
RETURN     all  --  anywhere             anywhere............

Chain KUBE-EXTERNAL-SERVICES (1 references)
target     prot opt source               destination.........

Chain KUBE-FIREWALL (2 references)
target     prot opt source               destination.........
DROP       all  --  anywhere             anywhere             /* kubernetes firewall for dropping marked packets */ mark match 0x8000/0x8000

Chain KUBE-FORWARD (1 references)
target     prot opt source               destination.........
ACCEPT     all  --  anywhere             anywhere             /* kubernetes forwarding rules */ mark match 0x4000/0x4000
ACCEPT     all  --  10.244.0.0/16        anywhere             /* kubernetes forwarding conntrack pod source rule */ ctstate RELATED,ESTABLISHED
ACCEPT     all  --  anywhere             10.244.0.0/16        /* kubernetes forwarding conntrack pod destination rule */ ctstate RELATED,ESTABLISHED

Chain KUBE-SERVICES (5 references)
target     prot opt source               destination.........

root@da-worker:/home/aella# iptables -L.
Chain INPUT (policy ACCEPT)
target     prot opt source               destination.........
KUBE-SERVICES  all  --  anywhere             anywhere             ctstate NEW /* kubernetes service portals */
KUBE-EXTERNAL-SERVICES  all  --  anywhere             anywhere             ctstate NEW /* kubernetes externally-visible service portals */
KUBE-SERVICES  all  --  anywhere             anywhere             /* kubernetes service portals */
KUBE-FIREWALL  all  --  anywhere             anywhere............

Chain FORWARD (policy ACCEPT)
target     prot opt source               destination.........
KUBE-FORWARD  all  --  anywhere             anywhere             /* kubernetes forwarding rules */
DOCKER-USER  all  --  anywhere             anywhere............
DOCKER-ISOLATION-STAGE-1  all  --  anywhere             anywhere............
ACCEPT     all  --  anywhere             anywhere             ctstate RELATED,ESTABLISHED
DOCKER     all  --  anywhere             anywhere............
ACCEPT     all  --  anywhere             anywhere............
ACCEPT     all  --  anywhere             anywhere............
KUBE-SERVICES  all  --  anywhere             anywhere             ctstate NEW /* kubernetes service portals */
ACCEPT     all  --  10.244.0.0/16        anywhere............
ACCEPT     all  --  anywhere             10.244.0.0/16.......

Chain OUTPUT (policy ACCEPT)
target     prot opt source               destination.........
KUBE-SERVICES  all  --  anywhere             anywhere             ctstate NEW /* kubernetes service portals */
KUBE-SERVICES  all  --  anywhere             anywhere             /* kubernetes service portals */
KUBE-FIREWALL  all  --  anywhere             anywhere............

Chain DOCKER (1 references)
target     prot opt source               destination.........

Chain DOCKER-ISOLATION-STAGE-1 (1 references)
target     prot opt source               destination.........
DOCKER-ISOLATION-STAGE-2  all  --  anywhere             anywhere............
RETURN     all  --  anywhere             anywhere............

Chain DOCKER-ISOLATION-STAGE-2 (1 references)
target     prot opt source               destination.........
DROP       all  --  anywhere             anywhere............
RETURN     all  --  anywhere             anywhere............

Chain DOCKER-USER (1 references)
target     prot opt source               destination.........
RETURN     all  --  anywhere             anywhere............

Chain KUBE-EXTERNAL-SERVICES (1 references)
target     prot opt source               destination.........

Chain KUBE-FIREWALL (2 references)
target     prot opt source               destination.........
DROP       all  --  anywhere             anywhere             /* kubernetes firewall for dropping marked packets */ mark match 0x8000/0x8000

Chain KUBE-FORWARD (1 references)
target     prot opt source               destination.........
ACCEPT     all  --  anywhere             anywhere             /* kubernetes forwarding rules */ mark match 0x4000/0x4000
ACCEPT     all  --  10.244.0.0/16        anywhere             /* kubernetes forwarding conntrack pod source rule */ ctstate RELATED,ESTABLISHED
ACCEPT     all  --  anywhere             10.244.0.0/16        /* kubernetes forwarding conntrack pod destination rule */ ctstate RELATED,ESTABLISHED

Chain KUBE-SERVICES (5 references)
target     prot opt source               destination.........

**Comment by xwang95054** [comment]
Found out the configuration issue. Close

**Comment by Timvissers** [comment]
@xwang95054 Could you explain what the configuration issue was?
