### ISSUE TITLE
The UDP entries still in Conntrack tables when Pod is in terminating

### ISSUE THREAD

**Issue by mingqishao** [kubernetes/kubernetes#132635]
### What happened?

I deployed a CoreDNS server with a 5-second lameduck period (graceful shutdown). During this period, the pod enters the terminating state but can still receive in-flight traffic. However, I observed that clients consistently encounter errors during pod rotation.

After investigation, I identified the root cause as a race condition between pod termination and Conntrack table cleanup. KubeProxy only r[emoves Conntrack entries when Serving=false](https://github.com/kubernetes/kubernetes/blob/201325e86913cfff34f5f2146f2ab4e496a2ef6f/pkg/proxy/conntrack/cleanup.go#L75C1-L88C4 ). However, during the lameduck period, the pod is terminating but still reports Serving=true. This mismatch prevents timely cleanup of stale Conntrack entries.

As a result, once the pod fully terminates, there is very short period gap when Conntrack entries clean up. 
Some traffic is still routed to it via stale Conntrack entries, causing request failures. This race condition between pod lifecycle state and Conntrack entries clean up is the underlying issue.

A UDP request with source port 38855 was sent at 05:49:09. The same port was reused 7 seconds later, at 05:49:16, during the interval between the pod’s deletion and the conntrack entry cleanup.

05:49:09.124933 azvb7951d49bd0 In  IP 172.16.0.24.38855 > 10.0.0.11.53: 43523+ A? [www.microsoft.com](http://www.microsoft.com/). (35)
05:49:09.124943 eth0  Out IP 172.16.0.24.38855 > 172.16.0.68.53: 43523+ A? [www.microsoft.com](http://www.microsoft.com/). (35)
05:49:09.124943 enP2636s1 Out IP 172.16.0.24.38855 > 172.16.0.68.53: 43523+ A? [www.microsoft.com](http://www.microsoft.com/). (35)
05:49:16.616441 azvb7951d49bd0 In  IP 172.16.0.24.38855 > 10.0.0.11.53: 37867+ A? [www.microsoft.com](http://www.microsoft.com/). (35)
05:49:16.616450 eth0  Out IP 172.16.0.24.38855 > 172.16.0.68.53: 37867+ A? [www.microsoft.com](http://www.microsoft.com/). (35)
05:49:16.616451 enP2636s1 Out IP 172.16.0.24.38855 > 172.16.0.68.53: 37867+ A? [www.microsoft.com](http://www.microsoft.com/). (35)

### What did you expect to happen?

I expected the Conntrack entries be cleaned up before Pod is in terminating. 

### How can we reproduce it (as minimally and precisely as possible)?

Deploy a CoreDNS and rotate the CoreDNS pod.

### Kubernetes version

<details>

```console
$ kubectl version
# paste output here
```

</details>

### Cloud provider

<details>

</details>

### OS version

<details>

```console
# On Linux:
$ cat /etc/os-release
# paste output here
$ uname -a
# paste output here

# On Windows:
C:\> wmic os get Caption, Version, BuildNumber, OSArchitecture
# paste output here
```

</details>

### Install tools

<details>

</details>

### Container runtime (CRI) and version (if applicable)

<details>

</details>

### Related plugins (CNI, CSI, ...) and versions (if applicable)

<details>

</details>

**Comment by aojea** [comment]
is this a dupe of https://github.com/kubernetes/kubernetes/issues/129617 ?

**Comment by aroradaman** [comment]
It makes more sense to retain conntrack flows till endpoints are serving for connection oriented protocols to allow graceful termination. Since we only do cleanup for UDP, we don't need to support graceful termination.

We do conntrack cleanup after programming the data-plane. kube-proxy doesn't install DNAT rules for endpoint if it is in not ready state (except for [Proxy Terminating Endpoints](https://github.com/kubernetes/enhancements/blob/master/keps/sig-network/1669-proxy-terminating-endpoints/README.md)), It looks like we can safely clear the conntrack flows for UDP when endpoints goes to not ready state instead of not serving state.

https://github.com/kubernetes/kubernetes/pull/119394 introduced the change for considering `serving` instead of `ready` state for cleanup. Will investigate further to confirm on why the change was required.

**Comment by aroradaman** [comment]
/triage accepted

> https://github.com/kubernetes/kubernetes/pull/119394 introduced the change for considering serving instead of ready state for cleanup.

https://github.com/kubernetes/kubernetes/pull/119394 was added to cleanup the conntrack flow only when the endpoint is not programmed in the data plane. It assumed all the endpoints present in the `EndpointsMap` will be programmed. But `CategorizeEndpoints` filters out not ready endpoints, and independent of endpoints being present in the `EndpointsMap` data-plane won't be programmed for the not-ready endpoints. 

https://github.com/kubernetes/kubernetes/blob/5ba3235b1bba202efdf69ce7cbe0a4a9cf875446/pkg/proxy/topology.go#L51-L60

**Comment by danwinship** [comment]
@mingqishao what kubernetes release are you using?

Also, what is the nature of the traffic involved here? (Single-packet request/response, multi-packet request/response, request with streaming response, etc.)

Conntrack cleanup should only be relevant if you are sending multiple requests from the same sourceIP:sourcePort, which would normally suggest some sort of "connection-oriented" protocol, in which case kube-proxy's assumption is that you want packets from a given client to keep going to the same endpoint for as long as they can. So what is your scenario here? Do you have a "connection-like" protocol, but you're fine with forcing the client to reconnect at any point? Or is it not actually "connection-like", but you're just reusing the same sourceIP:sourcePort for unrelated requests? (In which case, could you _not_ do that?)

> It makes more sense to retain conntrack flows till endpoints are serving for connection oriented protocols to allow graceful termination. Since we only do cleanup for UDP, we don't need to support graceful termination.

Explain that? I can believe that maybe we don't want to support graceful termination / ProxyTerminatingEndpoints for UDP, but it doesn't seem like that's related to conntrack cleanup?

**Comment by aroradaman** [comment]
> Explain that? I can believe that maybe we don't want to support graceful termination / ProxyTerminatingEndpoints for UDP, but it doesn't seem like that's related to conntrack cleanup?

At the end, graceful termination behaviour depends on timing of conntrack cleanup, right?
I mean if I delete flow entry for a TCP connection when the endpoint goes to not-ready state we break existing connections instead of allowing them to drain. If the conntrack entry is not present the next incoming packet from the client will be DNATed to some other endpoint which will trigger a RST from server. If we wait till the endpoint goes to not-serving, we allow a small window for graceful termination of the connection.

But since we don't need that for UDP, instead of clearing flow when endpoints goes to not-serving state we can clear when it goes to not-ready state.

**Comment by danwinship** [comment]
If deleting the conntrack record when the endpoint becomes Terminating is OK, then why isn't it OK to delete the conntrack record while the endpoint is still Ready? If the protocol can survive us breaking client/endpoint affinity when a pod is terminating, then does it actually care about client/endpoint affinity at all? Would the service actually be better off if we just `-j NOTRACK`ed it so each new packet got independently load-balanced?

But then, if the protocol can survive us breaking client/endpoint affinity when the pod becomes terminating, then why even have a `terminationGracePeriodSeconds` for the pod? Why not just have the pod exit immediately (or at least become non-Ready immediately) when it's deleted?

**Comment by michelesr** [comment]
I wonder if this could be solved by patching the kernel to clean up conntrack entries automatically when close is called for a UDP socket? That way applications will be able to gracefully close UDP streams but there won't be stale entries after the clients finished sending their packets, and so no chance that a random source port is reused leading to cached NAT entries to ruote the traffic to dead ends?

**Comment by aroradaman** [comment]
> I wonder if this could be solved by patching the kernel to clean up conntrack entries automatically when close is called for a UDP socket? That way applications will be able to gracefully close UDP streams but there won't be stale entries after the clients finished sending their packets, and so no chance that a random source port is reused leading to cached NAT entries to ruote the traffic to dead ends?

The conntrack entries which are stale are present in the host-network namespace, pods in general operate in their own network namespace unless explicitly configured with host network.  I don't think such a patch will fix the problem here.

**Comment by danwinship** [comment]
Also, some of the conntrack entries are on different hosts (eg, if a client on Node A connects to a UDP service with an endpoint on Node B, that creates a conntrack entry on Node A that definitely has no clue about the status of sockets on Node B).

**Comment by michelesr** [comment]
> Also, some of the conntrack entries are on different hosts (eg, if a client on Node A connects to a UDP service with an endpoint on Node B, that creates a conntrack entry on Node A that definitely has no clue about the status of sockets on Node B).

The aim of deleting the client side conntrack entry when the socket is closed client side is to prevent new processes to reuse the same conntrack entry and be routed again to the same endpoint. If an existing UDP socket sends packets through the old conntrack entry, then by all means it should go through the old path. If the socket is closed server side on Node B, then Node A should keep the entry because it has no way to tell it happened (unlike with TCP). But my networking knowledge is very limited so I might be missing something important here.

**Comment by aojea** [comment]
@michelesr the socket belong to a network namespace, in this case to a Pod.
Each Pod has a network namespace (omit hostNetwork namespaces) that is connected to the host network namespace via veth pair interfaces.
Kube-proxy operates on the host network namespace that is not aware of what happens on the Pod network namespaces

**Comment by guicassolato** [comment]
@mingqishao would you say this is still relevant?

**Comment by bowei** [comment]
/close

No further activity. Please open if you are still interested in this issue.
