### ISSUE TITLE
Kubelet v1.8.0 breaks pods talking to services on the same node

### ISSUE THREAD

**Issue by edevil** [kubernetes/kubernetes#53396]
**Is this a BUG REPORT or FEATURE REQUEST?**:

> Uncomment only one, leave it on its own line: 
>
/kind bug
> /kind feature

**What happened**:

When I update the kubelet on a node from 1.7.x to 1.8.0, pods on that node stop being able to connect to services whose pods happen to be on the same node. I use the Kubenet network plugin.

**What you expected to happen**:

Pods should be able to connect to a service even if the services's pods are on the same node.

**How to reproduce it (as minimally and precisely as possible)**:

1. Start a cluster
2. Add the DNS addon
3. Add another pod that runs on the same node as one of the DNS pods
4. DNS resolution starts to fail when the service redirects the requests to the pod that is on the same node.

**Anything else we need to know?**:

I have some packet captures that I can show.

Kubelet: 1.7.5
DNS pod: 10.2.4.76
Origin pod: 10.2.4.64
```
Capturing on 'any'
  1 0.000000000    10.2.4.64 ? 10.3.0.10    TCP 76 32880 ? 53 [SYN] Seq=0 Win=29200 Len=0 MSS=1460 SACK_PERM=1 TSval=3087861067 TSecr=0 WS=128
  2 0.000032200    10.2.4.64 ? 10.2.4.76    TCP 76 32880 ? 53 [SYN] Seq=0 Win=29200 Len=0 MSS=1460 SACK_PERM=1 TSval=3087861067 TSecr=0 WS=128
  3 0.000000000    10.2.4.64 ? 10.2.4.76    TCP 76 [TCP Retransmission] 32880 ? 53 [SYN] Seq=0 Win=29200 Len=0 MSS=1460 SACK_PERM=1 TSval=3087861067 TSecr=0 WS=128
  4 0.000040500    10.2.4.64 ? 10.2.4.76    TCP 76 [TCP Out-Of-Order] 32880 ? 53 [SYN] Seq=0 Win=29200 Len=0 MSS=1460 SACK_PERM=1 TSval=3087861067 TSecr=0 WS=128
  5 0.000063600    10.2.4.76 ? 10.2.4.64    TCP 76 53 ? 32880 [SYN, ACK] Seq=0 Ack=1 Win=28960 Len=0 MSS=1460 SACK_PERM=1 TSval=1635729023 TSecr=3087861067 WS=128
  6 0.000074300    10.3.0.10 ? 10.2.4.64    TCP 76 53 ? 32880 [SYN, ACK] Seq=0 Ack=1 Win=28960 Len=0 MSS=1460 SACK_PERM=1 TSval=1635729023 TSecr=3087861067 WS=128
  7 0.000063600    10.2.4.76 ? 10.2.4.64    TCP 76 [TCP Out-Of-Order] 53 ? 32880 [SYN, ACK] Seq=0 Ack=1 Win=28960 Len=0 MSS=1460 SACK_PERM=1 TSval=1635729023 TSecr=3087861067 WS=128
  8 0.000087900    10.2.4.64 ? 10.3.0.10    TCP 68 32880 ? 53 [ACK] Seq=1 Ack=1 Win=29312 Len=0 TSval=3087861067 TSecr=1635729023
  9 0.000096200    10.2.4.64 ? 10.2.4.76    TCP 68 32880 ? 53 [ACK] Seq=1 Ack=1 Win=29312 Len=0 TSval=3087861067 TSecr=1635729023
 10 0.000087900    10.2.4.64 ? 10.2.4.76    TCP 68 [TCP Dup ACK 9#1] 32880 ? 53 [ACK] Seq=1 Ack=1 Win=29312 Len=0 TSval=3087861067 TSecr=1635729023
 11 0.000099300    10.2.4.64 ? 10.2.4.76    TCP 68 [TCP Dup ACK 9#2] 32880 ? 53 [ACK] Seq=1 Ack=1 Win=29312 Len=0 TSval=3087861067 TSecr=1635729023
```

Kubelet: 1.8.0
DNS pod: 10.2.1.254
Origin pod: 10.2.1.234
```
Capturing on 'any'
  1 0.000000000   10.2.1.234 ? 10.3.0.10    TCP 76 34542?53 [SYN] Seq=0 Win=29200 Len=0 MSS=1460 SACK_PERM=1 TSval=247976308 TSecr=0 WS=128
  2 0.000000000   10.2.1.234 ? 10.3.0.10    TCP 76 [TCP Out-Of-Order] 34542?53 [SYN] Seq=0 Win=29200 Len=0 MSS=1460 SACK_PERM=1 TSval=247976308 TSecr=0 WS=128
  3 0.000034900   10.2.1.234 ? 10.2.1.254   TCP 76 34542?53 [SYN] Seq=0 Win=29200 Len=0 MSS=1460 SACK_PERM=1 TSval=247976308 TSecr=0 WS=128
  4 0.000037200   10.2.1.234 ? 10.2.1.254   TCP 76 [TCP Out-Of-Order] 34542?53 [SYN] Seq=0 Win=29200 Len=0 MSS=1460 SACK_PERM=1 TSval=247976308 TSecr=0 WS=128
  5 0.000055300   10.2.1.254 ? 10.2.1.234   TCP 76 53?34542 [SYN, ACK] Seq=0 Ack=1 Win=28960 Len=0 MSS=1460 SACK_PERM=1 TSval=464258761 TSecr=247976308 WS=128
  6 0.000057501   10.2.1.254 ? 10.2.1.234   TCP 76 [TCP Out-Of-Order] 53?34542 [SYN, ACK] Seq=0 Ack=1 Win=28960 Len=0 MSS=1460 SACK_PERM=1 TSval=464258761 TSecr=247976308 WS=128
  7 0.000055300   10.2.1.254 ? 10.2.1.234   TCP 76 [TCP Out-Of-Order] 53?34542 [SYN, ACK] Seq=0 Ack=1 Win=28960 Len=0 MSS=1460 SACK_PERM=1 TSval=464258761 TSecr=247976308 WS=128
  8 1.033021085   10.2.1.234 ? 10.3.0.10    TCP 76 [TCP Retransmission] 34542?53 [SYN] Seq=0 Win=29200 Len=0 MSS=1460 SACK_PERM=1 TSval=247977341 TSecr=0 WS=128
  9 1.033021085   10.2.1.234 ? 10.3.0.10    TCP 76 [TCP Retransmission] 34542?53 [SYN] Seq=0 Win=29200 Len=0 MSS=1460 SACK_PERM=1 TSval=247977341 TSecr=0 WS=128
 10 1.033101586   10.2.1.234 ? 10.2.1.254   TCP 76 [TCP Spurious Retransmission] 34542?53 [SYN] Seq=0 Win=29200 Len=0 MSS=1460 SACK_PERM=1 TSval=247977341 TSecr=0 WS=128
 11 1.033104086   10.2.1.234 ? 10.2.1.254   TCP 76 [TCP Spurious Retransmission] 34542?53 [SYN] Seq=0 Win=29200 Len=0 MSS=1460 SACK_PERM=1 TSval=247977341 TSecr=0 WS=128
```

We can see that in the requests that fail the DNS IP is correctly DNATed to the DNS POD destination address but the response is not masqueraded, it still carries the DNS POD source (it should have an origin of 10.3.0.10).

**Environment**:
- Kubernetes version (use `kubectl version`):
```
Client Version: version.Info{Major:"1", Minor:"8", GitVersion:"v1.8.0", GitCommit:"0b9efaeb34a2fc51ff8e4d34ad9bc6375459c4a4", GitTreeState:"clean", BuildDate:"2017-09-29T05:56:06Z", GoVersion:"go1.9", Compiler:"gc", Platform:"darwin/amd64"}
Server Version: version.Info{Major:"1", Minor:"8", GitVersion:"v1.8.0+coreos.0", GitCommit:"a65654ef5b593ac19fbfaf33b1a1873c0320353b", GitTreeState:"clean", BuildDate:"2017-09-29T21:51:03Z", GoVersion:"go1.8.3", Compiler:"gc", Platform:"linux/amd64"}
```
- Cloud provider or hardware configuration: Azure Standard_A4
- OS (e.g. from /etc/os-release): "Container Linux by CoreOS 1465.8.0 (Ladybug)"
- Kernel (e.g. `uname -a`): Linux node-1-vm 4.12.14-coreos #1 SMP Wed Sep 20 22:20:05 UTC 2017 x86_64 Intel(R) Xeon(R) CPU E5-2673 v3 @ 2.40GHz GenuineIntel GNU/Linux
- Install tools: https://github.com/edevil/kubernetes-deployment

**Comment by edevil** [comment]
The problem appears when transitioning from kubelet v1.8.0-alpha.2 to v1.8.0-alpha.3.

**Comment by edevil** [comment]
Well, I've found the problem. Starting from v1.8.0-alpha.3 the "modprobe" binary is not included in the image and so the br-netfilter kernel module is not loaded.

I'm using the gcr.io/google_containers/hyperkube:v1.8.0-alpha.3 image, although through "kubelet-wrapper" from CoreOS. Where should this binary reside?

**Comment by dchen1107** [comment]
cc/ @jdumars @kubernetes/kubernetes-release-managers 1.8 release team.

**Comment by rphillips** [comment]
There is PR https://github.com/kubernetes/kubernetes/pull/53642 as well, so it doesn't get lost.
