### ISSUE TITLE
IPVS CI job failures

### ISSUE THREAD

**Issue by Lion-Wei** [kubernetes/kubernetes#56143]
**Is this a BUG REPORT or FEATURE REQUEST?**:
> /kind bug

**What happened**:

There are sever e2e test failed in ipvs CI jobs, the mostly failed e2e test are as follow:
```
Services should create endpoints for unready pods
Services should be able to create a functioning NodePort service
DNS should provide DNS for the cluster [Conformance]
```

I already did some research, the basic reason is **can't access pod in the same node via cluster IP**.

Route table:
```shell
Destination     Gateway         Genmask         Flags Metric Ref    Use Iface
-----------------------------------------------------------------------------
0.0.0.0         10.128.0.1      0.0.0.0         UG    0      0        0 eth0
10.64.3.0       0.0.0.0         255.255.255.0   U     0      0        0 cbr0
10.128.0.1      0.0.0.0         255.255.255.255 UH    0      0        0 eth0
169.254.123.0   0.0.0.0         255.255.255.0   U     0      0        0 docker0
```

When access cluster IP, the iptables trace may looks like:
```shell
#ipvs
pod1-->PREROUTING-->Route(cbr0)-->INPUT-->ipvs(DNAT)-->Route(cbr0)-->OUTPUT-->POSTROUTING-->
#iptables
pod1-->PREROUTING(DNAT)-->Route(cbr0)-->FORWARD-->POSTROUTING-->pod2
#ipvs local up
pod1-->PREROUTING-->Route(docker0)-->INPUT-->ipvs(DNAT)-->Route(docker0)-->pod2
```

Iptables and ipvs mode have different trace, but both did DNAT, got the pod ip, and went to `POSTROUTING`. 

Here are packages grab in `cbr0`
```shell
# ipvs mode, access cluster IP
08:11:17.506485 IP 10.64.3.64.40848 > 10.0.94.106.http: Flags [S], seq 3154060992, win 28400, options [mss 1420,sackOK,TS val 20674197 ecr 0,nop,wscale 7], length 0
08:11:17.506541 IP 10.64.3.64.40848 > 10.64.3.62.9376: Flags [S], seq 3154060992, win 28400, options [mss 1420,sackOK,TS val 20674197 ecr 0,nop,wscale 7], length 0

#iptables mode, access cluster IP
08:16:36.050961 IP 10.64.3.64.41458 > 10.64.3.62.9376: Flags [S], seq 3187885692, win 28400, options [mss 1420,sackOK,TS val 20753834 ecr 0,nop,wscale 7], length 0
08:16:36.051017 IP 10.64.3.64.41458 > 10.64.3.62.9376: Flags [S], seq 3187885692, win 28400, options [mss 1420,sackOK,TS val 20753834 ecr 0,nop,wscale 7], length 0
08:16:36.051050 IP 10.64.3.62.9376 > 10.64.3.64.41458: Flags [S.], seq 2925603549, ack 3187885693, win 28160, options [mss 1420,sackOK,TS val 20753834 ecr 20753834,nop,wscale 7], length 0
08:16:36.051070 IP 10.64.3.64.41458 > 10.64.3.62.9376: Flags [.], ack 1, win 222, options [nop,nop,TS val 20753834 ecr 20753834], length 0
08:16:36.051075 IP 10.64.3.64.41458 > 10.64.3.62.9376: Flags [.], ack 1, win 222, options [nop,nop,TS val 20753834 ecr 20753834], length 0
...
```
 `10.0.94.106` is the cluster IP, `10.64.3.62:9376` is `pod IP:port`. 

****Test information****
```shell
# k get pod -n e2e-tests-services-rdx9d -owide 
NAME             READY     STATUS    RESTARTS   AGE       IP           NODE
execpod-tmfgh    1/1       Running   0          20h       10.64.3.64   bootstrap-e2e-minion-group-lkhj
service1-6qh7d   1/1       Running   0          20h       10.64.2.30   bootstrap-e2e-minion-group-1bd0
service1-72j6n   1/1       Running   0          20h       10.64.3.62   bootstrap-e2e-minion-group-lkhj
service1-lwkrm   1/1       Running   0          20h       10.64.1.29   bootstrap-e2e-minion-group-2g1l
# k get ep -n e2e-tests-services-rdx9d
NAME       ENDPOINTS                                         AGE
service1   10.64.1.29:9376,10.64.2.30:9376,10.64.3.62:9376   20h
# k get svc -n e2e-tests-services-rdx9d
NAME       CLUSTER-IP     EXTERNAL-IP   PORT(S)   AGE
service1   10.0.94.106    <none>        80/TCP    20h
```
Commend:
```shell
# k exec -it -n e2e-tests-services-rdx9d execpod-tmfgh sh
/ # wget -q -T 1 -O - 10.0.94.106:80
wget: download timed out
/ # wget -q -T 4 -O - 10.0.94.106:80
service1-6qh7d
/ # wget -q -T 4 -O - 10.0.94.106:80
service1-lwkrm
```

If anybody know about this problem, have some idea, or want to get more information about this issue, please let me know, thanks!

**How to reproduce it (as minimally and precisely as possible)**:
- Use `/cluster/gce` build a gce cluster
- Set kube-proxy in ipvs mode
- Create a service with one backend
- Create a exec pod in same node
- Access service cluster IP in exec pod.

**Environment**:
- Kubernetes version (use `kubectl version`): master
- Cloud provider or hardware configuration: gce
- OS (e.g. from /etc/os-release): Ubuntu 16.04.3 LTS
- Kernel (e.g. `uname -a`): 4.4.0-1033-gke
- Install tools: /cluster/gce

**Comment by m1093782566** [comment]
cc @thockin @MrHohn @dnardo 

Can we get consult from you?

**Comment by m1093782566** [comment]
btw, @Lion-Wei, I think you should add the information that it works fine in local-up cluster without network plugin.

**Comment by m1093782566** [comment]
@murali-reddy 

I am curious that how kube-router solve the same host pod-to-pod communication via VIP? Any comments are welcome :)

**Comment by murali-reddy** [comment]
@m1093782566 Not sure i understand the problem correctly.
```
pod A -> cluster ip-> pod B
```
When pod A, pod B on same node?

Please see https://github.com/cloudnativelabs/kube-router/issues/151

**Comment by m1093782566** [comment]
@murali-reddy 

> When pod A, pod B on same node?

Yes.

I find kernel module `br_netfilter` is already installed in the GCE host(with kubenet plugin), but it still doesn't work.

**Comment by Lion-Wei** [comment]
@murali-reddy Thanks for replay, but in my situation, seems like pod2 didn't got any  package. 
I have enabled `br_netfilter`, unfortunately didn't work for me...

**Comment by m1093782566** [comment]
fixed.

/close
