### ISSUE TITLE
K8s cluster, issue with access timeout of 1 second

### ISSUE THREAD

**Issue by jimmy535535** [kubernetes/kubernetes#122425]
Background:    Now we are preparing to launch ISIO and have built a new K8S environment. When switching traffic again, we found many 502 and other issues.
The k8s version is 1.26.9
The Istio version is http://docker.io/istio/pilot:1.18.2 And http://docker.io/istio/proxyv2:1.18.2
Containerd is 1.6.26
Calico is http://docker.io/calico/kube-controllers:v3.26.1
Phenomenon: Through shell script loop curl, it is found that there will be a link timeout exceeding 1 second (normally 3-5 milliseconds) (directly curl the nodeport of istio)
Troubleshooting process:
1. Try switching to different virtual machines, changing the host of the virtual machine, upgrading the kernel, upgrading the operating system, and adjusting kernel parameters; Some machines have been restored after adjustment, but the same operation cannot be performed on other machines.
2. So, in the development and testing environment, containerd was downgraded to version 1.6.10, and it was found that the development environment was improved, with 1.8 million attempts without any timeout. The frequency of timeout in the testing environment has decreased, to 1.5 million times, with approximately 2000 timeouts.
3. I tested the SVC Nodeport of the internal services of the cluster without using Istio, and found that there were no issues with me
I don't know if it's an issue with Istio, because some machines can pass through Istio without any problems.
4. When testing different nodes in the cluster, it was found that the timeout frequency of limited nodes was relatively high, and some did not find timeouts.
5. The packet capture has been reset, as detailed below:
101 2023-12-15 15:53:47.534642 172.128.9.24 172.129.9.102 TCP 74 58572 → 31896 [SYN] Seq=0 Win=64240 Len=0 MSS=1460 SACK_ Perm=1 TSval=3255928425 TSecr=0 WS=128
102 2023-12-15 15:53:47.535058 172.129.9.102 172.128.9.24 TCP 66 31896 → 58572 [ACK] Seq=1 Ack=2246793900 Win=64128 Len=0 TSval=242533004 TSecr=276815163
103 2023-12-15 15:53:47.535074 172.128.9.24 172.129.9.102 TCP 54 58572 → 31896 [RST] Seq=2246793900 Win=0 Len=0
The above testing methods all use a loop of curl nodeIP: nodeport (the port is the isio port, except for the third point, which is through the nodeport of the service)
thanks

**Comment by jimmy535535** [comment]
My operating system environment is Centos7 2009
The kernel version is "Linux ds test k8smaster-01 5.15.2-1. el7. elrepo. x86_64 # 1 SMP Wed Nov 10 18:06:14 EST 2021 x86_64 x86_64 GNU/Linux"

**Comment by jimmy535535** [comment]
Or recommend me a version of k8s, isio, containerd, or calico that everyone is using, and I will set it up for testing
thanks

**Comment by neolit123** [comment]
we have issue template that must be filled:
https://raw.githubusercontent.com/kubernetes/kubernetes/master/.github/ISSUE_TEMPLATE/bug-report.yaml
you must provide reproduction steps, otherwise maintainers can't do anything with this ticket.

also, this seems more like a support ticket in the lines of "why is this happening" and support forums are better suited for that:
https://github.com/kubernetes/kubernetes/blob/master/SUPPORT.md

/kind support
/sig network

**Comment by MikeZappa87** [comment]
@jimmy535535 did you resolve this? If possible could you update this issue with the format? I did notice you mention that changing containerd to 1.6.26 to 1.6.10 had less issues. Did you happen to test with containerd 1.7? That shouldn't impact anything just stood out.

**Comment by thockin** [comment]
Any updates here?
