### ISSUE TITLE
calico tunnel seems not working

### ISSUE THREAD

**Issue by gogeof** [kubernetes/kubernetes#55113]
**Is this a BUG REPORT or FEATURE REQUEST?**:
/kind bug

**What happened**:
> I start a 3 masters clusters, and one of them can't  send request to the real pod(here is prometheus, but other service is same), but other's work. 
> connect by host ip
>> connect other node except 192.168.17.201:
![image](https://user-images.githubusercontent.com/13129099/32411798-4da403c2-c21f-11e7-8579-184ce7454860.png)
>> connect 192.168.17.201, can not connect:
![image](https://user-images.githubusercontent.com/13129099/32411803-7f834c86-c21f-11e7-987d-c63d9e12e290.png)
>>

> connect by pod ip:
>> 192.168.17.203:
```
root@m-clustera-192-168-17-203:~# kubectl get endpoints
NAME                 ENDPOINTS                                 AGE
kubernetes           192.168.17.203:6443                       2d
prometheus-monitor   10.244.145.193:3000,10.244.145.193:9090   2d
root@m-clustera-192-168-17-203:~# wget http://10.244.145.193:3000
--2017-11-04 23:53:53--  http://10.244.145.193:3000/
Connecting to 10.244.145.193:3000... connected.
HTTP request sent, awaiting response... 302 Found
Location: /login [following]
--2017-11-04 23:53:53--  http://10.244.145.193:3000/login
Reusing existing connection to 10.244.145.193:3000.
HTTP request sent, awaiting response... 200 OK
Length: unspecified [text/html]
Saving to: 'index.html.3'

index.html.3                                             [ <=>                                                                                                                  ]   8.09K  --.-KB/s    in 0s      

2017-11-04 23:53:53 (83.2 MB/s) - 'index.html.3' saved [8289]

root@m-clustera-192-168-17-203:~#
```
>> 192.168.17.201:
```
root@m-clustera-192-168-17-201:~# kubectl get endpoints
NAME                 ENDPOINTS                                 AGE
kubernetes           192.168.17.204:6443                       2d
prometheus-monitor   10.244.145.193:3000,10.244.145.193:9090   2d
root@m-clustera-192-168-17-201:~# wget http://10.244.145.193:3000
--2017-11-05 11:51:44--  http://10.244.145.193:3000/
Connecting to 10.244.145.193:3000... ^C
root@m-clustera-192-168-17-201:~#
```
>> 

> check tunnel:
>> 192.168.17.203:
```
root@m-clustera-192-168-17-203:~# ifconfig
...
tunl0     Link encap:IPIP Tunnel  HWaddr   
          inet addr:10.244.55.192  Mask:255.255.255.255
          UP RUNNING NOARP  MTU:1440  Metric:1
          RX packets:2012 errors:0 dropped:0 overruns:0 frame:0
          TX packets:2472 errors:0 dropped:0 overruns:0 carrier:0
          collisions:0 txqueuelen:1 
          RX bytes:9590548 (9.5 MB)  TX bytes:155050 (155.0 KB)
```
>> 192.168.17.201:(RX packets:0, TX packets:0)
```
root@m-clustera-192-168-17-201:~# ifconfig 
...
tunl0     Link encap:IPIP Tunnel  HWaddr   
          inet addr:10.244.206.64  Mask:255.255.255.255
          UP RUNNING NOARP  MTU:1440  Metric:1
          RX packets:0 errors:0 dropped:0 overruns:0 frame:0
          TX packets:0 errors:0 dropped:0 overruns:0 carrier:0
          collisions:0 txqueuelen:1 
          RX bytes:0 (0.0 B)  TX bytes:0 (0.0 B)
```
>>

> catch package:
>> 192.168.17.203:
```
root@m-clustera-192-168-17-203:~# ip addr
...
694: tunl0@NONE: <NOARP,UP,LOWER_UP> mtu 1440 qdisc noqueue state UNKNOWN group default qlen 1
    link/ipip 0.0.0.0 brd 0.0.0.0
    inet 10.244.55.192/32 brd 10.244.55.192 scope global tunl0
       valid_lft forever preferred_lft forever
root@m-clustera-192-168-17-203:~# tcpdump -i tunl0
tcpdump: verbose output suppressed, use -v or -vv for full protocol decode
listening on tunl0, link-type RAW (Raw IP), capture size 262144 bytes
00:14:52.768349 IP 10.244.55.192.34194 > 10.244.145.193.3000: Flags [S], seq 2661811686, win 29200, options [mss 1460,sackOK,TS val 1832358105 ecr 0,nop,wscale 7], length 0
00:14:52.768625 IP 10.244.145.193.3000 > 10.244.55.192.34194: Flags [S.], seq 2672977960, ack 2661811687, win 28960, options [mss 1460,sackOK,TS val 384239381 ecr 1832358105,nop,wscale 7], length 0
00:14:52.768817 IP 10.244.55.192.34194 > 10.244.145.193.3000: Flags [.], ack 1, win 229, options [nop,nop,TS val 1832358105 ecr 384239381], length 0
00:14:52.768931 IP 10.244.55.192.34196 > 10.244.145.193.3000: Flags [S], seq 1163632063, win 29200, options [mss 1460,sackOK,TS val 1832358105 ecr 0,nop,wscale 7], length 0
00:14:52.768961 IP 10.244.55.192.34202 > 10.244.145.193.3000: Flags [S], seq 711556203, win 29200, options [mss 1460,sackOK,TS val 1832358105 ecr 0,nop,wscale 7], length 0
00:14:52.768972 IP 10.244.55.192.34204 > 10.244.145.193.3000: Flags [S], seq 4270383347, win 29200, options [mss 1460,sackOK,TS val 1832358105 ecr 0,nop,wscale 7], length 0
00:14:52.768993 IP 10.244.55.192.34200 > 10.244.145.193.3000: Flags [S], seq 984818515, win 29200, options [mss 1460,sackOK,TS val 1832358105 ecr 0,nop,wscale 7], length 0
00:14:52.770175 IP 10.244.55.192.34194 > 10.244.145.193.3000: Flags [P.], seq 1:513, ack 1, win 229, options [nop,nop,TS val 1832358105 ecr 384239381], length 512
00:14:52.770324 IP 10.244.145.193.3000 > 10.244.55.192.34194: Flags [.], ack 513, win 235, options [nop,nop,TS val 384239381 ecr 1832358105], length 0
```
>> 192.168.17.201:(catch nothing)
```
root@m-clustera-192-168-17-201:~# ip addr
...
480: tunl0@NONE: <NOARP,UP,LOWER_UP> mtu 1440 qdisc noqueue state UNKNOWN group default qlen 1
    link/ipip 0.0.0.0 brd 0.0.0.0
    inet 10.244.206.64/32 brd 10.244.206.64 scope global tunl0
       valid_lft forever preferred_lft forever
...
root@m-clustera-192-168-17-201:~# tcpdump -i tunl0
tcpdump: verbose output suppressed, use -v or -vv for full protocol decode
listening on tunl0, link-type RAW (Raw IP), capture size 262144 bytes


```
> route:
>> 192.168.17.203:
```
root@m-clustera-192-168-17-203:~# route -n
Kernel IP routing table
Destination     Gateway         Genmask         Flags Metric Ref    Use Iface
0.0.0.0         192.168.17.1    0.0.0.0         UG    0      0        0 eno1
10.244.55.192   0.0.0.0         255.255.255.192 U     0      0        0 *
10.244.66.192   192.168.3.205   255.255.255.192 UG    0      0        0 tunl0
10.244.145.192  192.168.3.204   255.255.255.192 UG    0      0        0 tunl0
172.17.0.0      0.0.0.0         255.255.0.0     U     0      0        0 docker0
192.168.3.0     0.0.0.0         255.255.255.0   U     0      0        0 eno1
192.168.17.0    0.0.0.0         255.255.255.0   U     0      0        0 eno1
```
>> 192.168.17.201:
```
root@m-clustera-192-168-17-201:~# route -n
Kernel IP routing table
Destination     Gateway         Genmask         Flags Metric Ref    Use Iface
0.0.0.0         192.168.17.1    0.0.0.0         UG    0      0        0 eno1
10.244.134.192  192.168.4.115   255.255.255.192 UG    0      0        0 tunl0
10.244.199.192  192.168.4.116   255.255.255.192 UG    0      0        0 tunl0
10.244.206.64   0.0.0.0         255.255.255.192 U     0      0        0 *
10.244.206.65   0.0.0.0         255.255.255.255 UH    0      0        0 caliaf79382733c
172.17.0.0      0.0.0.0         255.255.0.0     U     0      0        0 docker0
192.168.17.0    0.0.0.0         255.255.255.0   U     0      0        0 eno1
```

**cluster and prometheus service information:**
```
root@m-clustera-192-168-17-201:~# kubectl get nodes
NAME                        STATUS    ROLES     AGE       VERSION
m-clustera-192-168-17-201   Ready     master    2d        v1.8.2
m-clustera-192-168-17-203   Ready     master    2d        v1.8.2
m-clustera-192-168-17-204   Ready     master    2d        v1.8.2
n-clustera-192-168-17-205   Ready     <none>    1d        v1.8.2
n-clustera-192-168-4-115    Ready     <none>    1d        v1.8.2
n-clustera-192-168-4-116    Ready     <none>    1d        v1.8.2
```

> create prometheus service 
```
root@m-clustera-192-168-17-201:~# kubectl get pods -n kube-system
...
prometheus-node-exporter-8pqdw                            1/1       Running   0          2d
prometheus-node-exporter-b7qrx                            1/1       Running   0          1d
prometheus-node-exporter-fnpvl                            1/1       Running   0          1d
prometheus-node-exporter-jsbxt                            1/1       Running   0          2d
prometheus-node-exporter-pcrm2                            1/1       Running   0          2d
prometheus-node-exporter-wqjcx                            1/1       Running   0          1d
root@m-clustera-192-168-17-201:~# kubectl get pods 
NAME                                  READY     STATUS    RESTARTS   AGE
prometheus-monitor-6b7d598c57-562wv   2/2       Running   0          2d
```
>>

**What you expected to happen**:
> can access by all node:nodePort 

**How to reproduce it (as minimally and precisely as possible)**:
> I generate certs and configs, the copy to those three masters, create one etcd cluster in masters' host, waiting for etcd ready and then install kubeadm and kubectl, kubelet, run this command in three master the same time:  kubeadm init -f kubeadm.yaml --skip-checks, one of kubeadm.yaml show fellow, 192.168.17.254 is the vip:
```
apiVersion: kubeadm.k8s.io/v1alpha1
kind: MasterConfiguration
api:
  advertiseAddress: 192.168.17.254
etcd:
  endpoints:
  infra-192.168.17.201=http://192.168.17.201:12379,infra-192.168.17.203=http://192.168.17.203,infra-192.168.17.204=http://192.168.17.204:12379
kubernetesVersion: v1.8.2
networking:
  dnsDomain: cluster.local
  serviceSubnet: 10.96.0.0/16
  podSubnet: 10.244.0.0/16
nodeName: m-clustera-192-168-17-203
certificatesDir: /etc/kubernetes/pki
```

**Anything else we need to know?**:
> any thing you want to know, just ask me, please.
> here is what I have try:
>> I have try disable and close firewalld(by ufw stop and ufw disable), check the iptables nat and filter table, is the same, run modprobe ipip and modprobe ip_vs to load ipip and ip_vs module. 

**Environment**:
- Kubernetes version (use `kubectl version`):
```
Client Version: version.Info{Major:"1", Minor:"8", GitVersion:"v1.8.2", GitCommit:"bdaeafa71f6c7c04636251031f93464384d54963", GitTreeState:"clean", BuildDate:"2017-10-24T19:48:57Z", GoVersion:"go1.8.3", Compiler:"gc", Platform:"linux/amd64"}
Server Version: version.Info{Major:"1", Minor:"8", GitVersion:"v1.8.2", GitCommit:"bdaeafa71f6c7c04636251031f93464384d54963", GitTreeState:"clean", BuildDate:"2017-10-24T19:38:10Z", GoVersion:"go1.8.3", Compiler:"gc", Platform:"linux/amd64"}
```
- Cloud provider or hardware configuration:none
- OS (e.g. from /etc/os-release):ubuntu 16.04.3 LTS
- Kernel (e.g. `uname -a`):Linux m-clustera-192-168-17-203 4.4.0-87-generic #110-Ubuntu SMP Tue Jul 18 12:55:35 UTC 2017 x86_64 x86_64 x86_64 GNU/Linux
- Install tools:kubeadm
- Others:

/sig network

**Comment by gogeof** [comment]
After check calico default configuration, found that I have put one old config there, but calico has read it and then cni generate a new replace it. So I think maybe it's this problem cause calico not run in the right way. I will close this issue soon.
