### ISSUE TITLE
Issue accessing LB service from pods on same node as the service's pod

### ISSUE THREAD

**Issue by adamcooke** [kubernetes/kubernetes#87263]
**What happened**:

I've identified a problem with accessing external Load Balancer IPs from within the cluster - specifically those provided by MetalLB. I believe this should work (as implemented in #77523).

I have a service (ingress-nginx in this case but it should apply to any service) set up as `type: LoadBalancer` and `externalTrafficPolicy: Local`. MetalLB has announced the IP from one of our nodes and is forwarding traffic to one of the service's pod on that node.

From outside the cluster, this works exactly as desired.

However, from pods within the cluster, things are not doing what I'd expect.

If you access the service's external IP from a pod located on different node to that used by the service's pod, it works as expected. 

If you access the service's external IP from a pod located on the same node as the service pod, traffic is DNAT'd but the return traffic comes directly to the pod and not via. the iptables firewall and therefore the NAT fails. 

**What you expected to happen**:

I expect to be able to reliably access services on Load Balancer IPs from any pod in the cluster.

**How to reproduce it (as minimally and precisely as possible)**:

1. Set up a cluster
2. Install/configure MetalLB & Cilium
3. Run a pod which exposes a web service (nginx?)
4. Create a `type: LoadBalancer` and `externalTrafficPolicy: Local` service which exposes the pod above. Obtain the external IP address and verify that it works.
5. From another utility pod running on the same node as the web pod, try to `curl` the external IP. It should fail.

If anyone wants to play with a live installation, I can provide them with access to a test installation.

**Anything else we need to know?**:

This shows the traffic being DNAT'd correctly but the reply coming back and not going through the iptables firewall and not being SNAT'd back.

```
16:09:02.374566 IP 10.217.2.189.43154 > 185.53.57.74.80: Flags [S], seq 3061047081, win 28200, options [mss 1410,sackOK,TS val 811125824 ecr 0,nop,wscale 7], length 0
16:09:02.374673 IP 10.217.2.189.43154 > 10.217.2.15.80: Flags [S], seq 3061047081, win 28200, options [mss 1410,sackOK,TS val 811125824 ecr 0,nop,wscale 7], length 0
16:09:02.374743 IP 10.217.2.15.80 > 10.217.2.189.43154: Flags [S.], seq 2507625530, ack 3061047082, win 27960, options [mss 1410,sackOK,TS val 1118464900 ecr 811125824,nop,wscale 7], length 0
```

For completeness, this next tcpdump shows success when you try to access the service from a pod on a different node.

```
16:07:37.903797 IP 10.217.2.189.42796 > 185.53.57.74.80: Flags [S], seq 643972119, win 28200, options [mss 1410,sackOK,TS val 811041362 ecr 0,nop,wscale 7], length 0
16:07:37.903860 IP 10.217.2.213.42796 > 10.217.3.143.80: Flags [S], seq 643972119, win 28200, options [mss 1410,sackOK,TS val 811041362 ecr 0,nop,wscale 7], length 0
16:07:37.904195 IP 10.217.3.143.80 > 10.217.2.213.42796: Flags [S.], seq 3125016250, ack 643972120, win 27960, options [mss 1410,sackOK,TS val 1823794420 ecr 811041362,nop,wscale 7], length 0
16:07:37.904234 IP 185.53.57.74.80 > 10.217.2.189.42796: Flags [S.], seq 3125016250, ack 643972120, win 27960, options [mss 1410,sackOK,TS val 1823794420 ecr 811041362,nop,wscale 7], length 0
```

I believe that this should have been fixed by lines 2 & 3 of the following extract from iptables but they are never reached because line 1 jumps straight into the service pod.

```
-A KUBE-XLB-REQ4FPVT7WYF4VLA -s 10.217.0.0/16 -m comment --comment "Redirect pods trying to reach external loadbalancer VIP to clusterIP" -j KUBE-SVC-REQ4FPVT7WYF4VLA
-A KUBE-XLB-REQ4FPVT7WYF4VLA -m comment --comment "masquerade LOCAL traffic for ingress-nginx/ingress-nginx:http LB IP" -m addrtype --src-type LOCAL -j KUBE-MARK-MASQ
-A KUBE-XLB-REQ4FPVT7WYF4VLA -m comment --comment "route LOCAL traffic for ingress-nginx/ingress-nginx:http LB IP to service chain" -m addrtype --src-type LOCAL -j KUBE-SVC-REQ4FPVT7WYF4VLA
-A KUBE-XLB-REQ4FPVT7WYF4VLA -m comment --comment "Balancing rule 0 for ingress-nginx/ingress-nginx:http" -j KUBE-SEP-OGY4Q4QJJESTCZPB
```

**Environment**:
- Kubernetes version (use `kubectl version`): Server Version: version.Info{Major:"1", Minor:"17", GitVersion:"v1.17.0", GitCommit:"70132b0f130acc0bed193d9ba59dd186f0e634cf", GitTreeState:"clean", BuildDate:"2019-12-07T21:12:17Z", GoVersion:"go1.13.4", Compiler:"gc", Platform:"linux/amd64"}
- Cloud provider or hardware configuration: "Bare metal" VMs
- OS (e.g: `cat /etc/os-release`):

```
NAME="Ubuntu"
VERSION="18.04.2 LTS (Bionic Beaver)"
ID=ubuntu
ID_LIKE=debian
PRETTY_NAME="Ubuntu 18.04.2 LTS"
VERSION_ID="18.04"
HOME_URL="https://www.ubuntu.com/"
SUPPORT_URL="https://help.ubuntu.com/"
BUG_REPORT_URL="https://bugs.launchpad.net/ubuntu/"
PRIVACY_POLICY_URL="https://www.ubuntu.com/legal/terms-and-policies/privacy-policy"
VERSION_CODENAME=bionic
UBUNTU_CODENAME=bionic
```
- Kernel (e.g. `uname -a`): `Linux k8s-node02 4.15.0-45-generic #48-Ubuntu SMP Tue Jan 29 16:28:13 UTC 2019 x86_64 x86_64 x86_64 GNU/Linux`
- Install tools: `kubeadm init`
- Network plugin and version (if this is a network-related bug): `Cilium 1.6.5`
- Others:

**Comment by athenabot** [comment]
/triage unresolved

Comment `/remove-triage unresolved` when the issue is assessed and confirmed.

🤖 I am a bot run by vllry. 👩‍🔬

**Comment by andrewsykim** [comment]
@adamcooke can you share your entire iptables rule set please?

/assign

**Comment by adamcooke** [comment]
Absolutely.

https://gist.github.com/adamcooke/696ccad10559ab6650cbefc0113a5f9e

**Comment by andrewsykim** [comment]
I tested this on the latest v1.17.0 version using Kind and  it seems to work as expected. My test:
```
$ kubectl get po -o wide
NAME                     READY   STATUS    RESTARTS   AGE    IP           NODE          NOMINATED NODE   READINESS GATES
curl-5cf8957b9f-2d88q    1/1     Running   0          4m6s   10.244.2.5   xlb-worker3   <none>           <none>
nginx-86459dc98d-zb6c5   1/1     Running   0          19m    10.244.3.2   xlb-worker3    <none>           <none>
```
 
```
---
apiVersion: v1
kind: Service
metadata:
  name: nginx
  labels:
    app: nginx
spec:
  type: LoadBalancer
  externalTrafficPolicy: Local
  selector:
    app: nginx
  ports:
  - port: 80
    protocol: TCP
```

```
$ kubectl exec -ti curl-5cf8957b9f-2d88q sh
/ # 
/ # 
/ # curl 1.1.1.1
<!DOCTYPE html>
<html>
<head>
<title>Welcome to nginx!</title>
<style>
    body {
        width: 35em;
        margin: 0 auto;
        font-family: Tahoma, Verdana, Arial, sans-serif;
    }
</style>
</head>
<body>
<h1>Welcome to nginx!</h1>
<p>If you see this page, the nginx web server is successfully installed and
working. Further configuration is required.</p>
<p>For online documentation and support please refer to
<a href="http://nginx.org/">nginx.org</a>.<br/>
Commercial support is available at
<a href="http://nginx.com/">nginx.com</a>.</p>
<p><em>Thank you for using nginx.</em></p>
</body>
</html>
```

I'm curious if there's a conflicting rule from Cilium that could be causing this. Can you try v1.17.0 with another CNI plugin and see if you can reproduce the same issue?

**Comment by uablrek** [comment]
> I'm curious if there's a conflicting rule from Cilium that could be causing this.

Please note that a main feature of `cilium` is that it takes over the service load-balancing from `kube-proxy` using eBPF. This may make this issue a `cilium` problem. IMHO you should make a cross-post to cilium.

**Comment by andrewsykim** [comment]
> Please note that a main feature of cilium is that it takes over the service load-balancing from kube-proxy using eBPF. This may make this issue a cilium problem. IMHO you should make a cross-post to cilium.

I had thought this was an optional feature, @adamcooke can you confirm if you have Cillium's service proxy enabled?

**Comment by uablrek** [comment]
> I had thought this was an optional feature

@andrewsykim Yes I think so too, but don't know what is the default on installation (hence the "may" in "This may make this issue a cilium problem.")

If kube-proxy is used then my guess is that `cilium` provides L2 connectivity between PODs on the same node. Then you must use the `--masquerade-all` or `masqueradeAll` in the kube-proxy config. Please see  https://github.com/kubernetes/kubernetes/issues/87426

**Comment by brb** [comment]
@adamcooke Your failing case should work with Cilium v1.7.1 and `--kube-proxy-replacement=strict`.

**Comment by uablrek** [comment]
I asked on the cilium slack https://cilium.slack.com/archives/C53TG4J4R/p1585126139004400 and got a link from @tgraf to https://github.com/cilium/cilium/issues/9784 which may be the cause.

In any way I conclude that this is a `cilium` issue refering to the above and https://github.com/kubernetes/kubernetes/issues/87263#issuecomment-603745779. Since this problem can't be solved by K8s I close this issue.

/close
