### ISSUE TITLE
iscsi volume cannot attach

### ISSUE THREAD

**Issue by wenjun93** [kubernetes/kubernetes#54376]
I compare the code of iscsi volume plugin in k8s and openstack nova volume code, in `AttachDisk()`, 
I've tried on a VM node, and we actually need to run steps:
1. update iscsiNode: 
    "node.session.auth.authmethod",
    "node.session.auth.username",
    "node.session.auth.password",
2. iscsiadm -m node -T Iqn -p tp --op new
3. iscsiadm -m node -T Iqn -p tp --login
however, seems steps 2 is missing in kubelet code, and I cannot attach iscsi volume to node, not sure if there is anything wrong.

**Comment by wenjun1** [comment]
@mtanino

**Comment by dixudx** [comment]
> steps 2 is missing in kubelet code

@wenjun1 It is not missing. Please refer [here](https://github.com/kubernetes/kubernetes/blob/master/pkg/volume/iscsi/iscsi_util.go#L252).

Any detailed logs that would help us find what causes the volume failing to detach?

**Comment by wenjun1** [comment]
Thanks. The steps I mentioned is nova or os-brick code's volume attach flow, it's a little bit different from k8s, `"iscsiadm", "-m", "discoverydb", "-t", "sendtargets", "-p", tp, "-I", b.Iface, "-o", "new")`, when I run the command manually, error `iscsiadm: No portals found` and exit code `21`.
I think there maybe some misconfigurations on my node, in the link [http://www.server-world.info/en/note?os=Fedora_21&p=iscsi&f=2],  I didn't set `/etc/iscsi/initiatorname.iscsi` correctly because I can't get this information.

**Comment by rootfs** [comment]
@wenjun1 `-m discoverydb` module is to set up discover level CHAP config, and `-m node` is for session level CHAP. 

Nova doesn't support target discovery CHAP? @mtanino

**Comment by mtanino** [comment]
@wenjun1 @rootfs 

>>Nova doesn't support target discovery CHAP? @mtanino

I suppose @wenjun1 is using Libvirt/QEMU built-in iSCSI initiator supported by Nova.
From quick glance of the code, chap authentication is supported for this initiator function but it may be node level and not for target discovery level.
But this functionality provides iSCSI initiator function into Nova itself without iscsiadm, and admin still needs iSCSI target on to another Nova node. Therefore, I 'm not sure if Nova directly relates to this problem. 

- libvirt: add QEMU built-in iSCSI initiator support
  https://review.openstack.org/#/c/135854/

- Libvirt Storage Management
https://libvirt.org/storage.html#StorageBackendISCSI

When I try to discover iSCSI target node, I saw following protocols were send to target node from Initiator node. 
@wenjun1 Can your check if the discovery packet properly reaches to target node? 

- Initiator node
```
% iscsiadm -m discoverydb -p 192.168.122.85:3260 -I default -t sendtargets
# BEGIN RECORD 6.2.0.873-33
discovery.startup = manual
discovery.type = sendtargets
discovery.sendtargets.address = 192.168.122.85
discovery.sendtargets.port = 3260
discovery.sendtargets.auth.authmethod = None
discovery.sendtargets.auth.username = <empty>
discovery.sendtargets.auth.password = <empty>
discovery.sendtargets.auth.username_in = <empty>
discovery.sendtargets.auth.password_in = <empty>
discovery.sendtargets.timeo.login_timeout = 15
discovery.sendtargets.use_discoveryd = No
discovery.sendtargets.discoveryd_poll_inval = 30
discovery.sendtargets.reopen_max = 5
discovery.sendtargets.timeo.auth_timeout = 45
discovery.sendtargets.timeo.active_timeout = 30
discovery.sendtargets.iscsi.MaxRecvDataSegmentLength = 32768
# END RECORD

% iscsiadm -m discoverydb -p 192.168.122.85:3260 -I default -t sendtargets --discover
```

- Target node
```
$ sudo tcpdump -nn -i eth0 src 192.168.122.55
tcpdump: verbose output suppressed, use -v or -vv for full protocol decode
listening on eth0, link-type EN10MB (Ethernet), capture size 65535 bytes
11:28:44.734885 IP 192.168.122.55.33230 > 192.168.122.85.3260: Flags [S], seq 77805163, win 29200, options [mss 1460,sackOK,TS val 2913489870 ecr 0,nop,wscale 7], length 0
11:28:44.735102 IP 192.168.122.55.33230 > 192.168.122.85.3260: Flags [.], ack 3144414905, win 229, options [nop,nop,TS val 2913489871 ecr 601110774], length 0
11:28:44.735183 IP 192.168.122.55.33230 > 192.168.122.85.3260: Flags [P.], seq 0:48, ack 1, win 229, options [nop,nop,TS val 2913489871 ecr 601110774], length 48
11:28:44.735202 IP 192.168.122.55.33230 > 192.168.122.85.3260: Flags [P.], seq 48:304, ack 1, win 229, options [nop,nop,TS val 2913489871 ecr 601110774], length 256
11:28:44.735445 IP 192.168.122.55.33230 > 192.168.122.85.3260: Flags [.], ack 225, win 237, options [nop,nop,TS val 2913489871 ecr 601110774], length 0
11:28:44.735517 IP 192.168.122.55.33230 > 192.168.122.85.3260: Flags [P.], seq 304:352, ack 225, win 237, options [nop,nop,TS val 2913489871 ecr 601110774], length 48
11:28:44.735520 IP 192.168.122.55.33230 > 192.168.122.85.3260: Flags [P.], seq 352:368, ack 225, win 237, options [nop,nop,TS val 2913489871 ecr 601110774], length 16
11:28:44.737868 IP 192.168.122.55.33230 > 192.168.122.85.3260: Flags [F.], seq 368, ack 669, win 245, options [nop,nop,TS val 2913489874 ecr 601110774], length 0
11:28:46.738629 IP 192.168.122.55.33230 > 192.168.122.85.3260: Flags [.], ack 670, win 245, options [nop,nop,TS val 2913491874 ecr 601112777], length 0
^C
```

**Comment by wenjun93** [comment]
sorry for the late reply. @mtanino Yes, I'm using Libvirt/QEMU. I see there are node level and target discovery level, while I'm using old version k8s code(release-1.6), with `iscsiadm -m discovery` in iscsi_util.go, and after I change the code from `discovery` to `discoverydb`, it works. Thanks

**Comment by mtanino** [comment]
>> while I'm using old version k8s code(release-1.6),

Now I understand the reason. iSCSI plugin k8s v1.6 doesn't support Chap authentication.
Chap authentication was introduced from v1.7 via following commit.

```
commit 92982171260ac2370515d14f5ec362726a3c3434
Author: Huamin Chen <hchen@redhat.com>
Date:   Fri Mar 17 16:42:15 2017 -0400
    Add iSCSI CHAP authentication
    Signed-off-by: Huamin Chen <hchen@redhat.com>
```
