### ISSUE TITLE
--etcd-servers-overrides in apiserver do not work

### ISSUE THREAD

**Issue by garyyang85** [kubernetes/kubernetes#57440]
/kind support
/sig docs
/sig node

I am trying to redirect events to another etcd with --etcd-servers-overrides in apiserver.
I tried below two ways: 
--etcd-servers-overrides=/registry/events#http://xyz:2379
--etcd-servers-overrides=/events#http://xyz:2379
**both of them do not work, the apiserver can be restarted up but write nothing to the new etcd.**

Another question is that if we support an **https** etcd here? I serached from the usage doc it only point out the **http** use.

I am using the kubernetes 1.5.7 version

**Comment by dims** [comment]
Duh!

/remove-sig node

**Comment by liggitt** [comment]
`--etcd-servers-overrides=/events#http://xyz:2379` should work

@gmarek did this change with the event API group addition? there was a question about this as part of that review:

* https://github.com/kubernetes/kubernetes/pull/49112#discussion_r148718411
* https://github.com/kubernetes/kubernetes/pull/49112#issuecomment-342259970

> Another question is that if we support an https etcd here?

it is supported, but only a single set of credentials is supported (the same --etcd-cafile/--etcd-certfile/--etcd-keyfile is used for all servers)

**Comment by dims** [comment]
@liggitt seems to be in `/registry/events`

```
[dims@bigbox 08:37] /opt/stack/logs ⟩ ETCDCTL_API=3 etcdctl get "/registry/events" --prefix=true
/registry/events/default/private-reg.15021562dfef2a53
k8s


v1Event�
a
private-reg.15021562dfef2a53default"*$e7aa456c-e5b6-11e7-acdc-26804d7083862����zs
Poddefault
          private-reg"$e4bc7fd3-e5b6-11e7-acdc-26804d708386*v125735:&spec.containers{private-reg-container}BackOff"$Back-off restarting failed container*
kubelet
       192.168.0.4�������@�'JWarningRbrz"
```

**Comment by liggitt** [comment]
That's the etcd key prefix, but not the command line flag to control etcd server for events

**Comment by dims** [comment]
@liggitt ah! looks like the command line flag is parsed here:
https://github.com/dims/kubernetes/blob/master/cmd/kube-apiserver/app/server.go#L584

**Comment by jennybuckley** [comment]
cc @jpbetz

**Comment by garyyang85** [comment]
I confirmed two things just now:
1. events are stored under /registry/events in etcd in my env before the redirect events configured. 
2. There are no strings like "invalid value of etcd server overrides" or "invalid resource definition" in my apiserver log.

**Comment by joejulian** [comment]
`--etcd-servers-overrides=/events#https://etcdEvents.etcd.jj-rc.internal:2381`

Does work with 1.7.11 but does not work with any 1.8.x. There is no attempt at all to connect to any of the etcd nodes under that hostname.

**Comment by joejulian** [comment]
If I replace the url with a list of urls using the ip addresses that hostname resolves to, it works:
```
--etcd-servers-overrides=/events#https://10.0.63.59:2381,https://10.0.119.48:2381,https://10.0.246.128:2381
```

The expectation was that it would follow the <=1.7 behavior of resolving the hostname and building the list from that.
```
; <<>> DiG 9.10.2-P4 <<>> etcdEvents.etcd.jj-rc.internal
;; global options: +cmd
;; Got answer:
;; ->>HEADER<<- opcode: QUERY, status: NOERROR, id: 62565
;; flags: qr rd ra; QUERY: 1, ANSWER: 4, AUTHORITY: 0, ADDITIONAL: 1

;; OPT PSEUDOSECTION:
; EDNS: version: 0, flags:; udp: 4096
;; QUESTION SECTION:
;etcdEvents.etcd.jj-rc.internal.	IN	A

;; ANSWER SECTION:
etcdEvents.etcd.jj-rc.internal.	60 IN	CNAME	etcdevents.jj-rc.internal.
etcdevents.jj-rc.internal. 60	IN	A	10.0.63.59
etcdevents.jj-rc.internal. 60	IN	A	10.0.119.48
etcdevents.jj-rc.internal. 60	IN	A	10.0.246.128
```

**Comment by dims** [comment]
@joejulian " ip addresses that hostname resolves to, it works" <<< is this in 1.9?

**Comment by joejulian** [comment]
Just checked. Works in 1.9.0.

**Comment by joejulian** [comment]
No, I take that back. There was a brief bit of network activity (which didn't happen at all with 1.8) but after that there's still nothing. Event queries still time out without any further network activity between the apiserver and the etcdevents nodes.

**Comment by gmarek** [comment]
Events changes went in 1.9, so if anything is broken since 1.8 it's not that.

**Comment by dims** [comment]
I've tested this scenario by starting a second etcd server and specifying additional parameter in api server (`hack/local-up-cluster.sh`). Works fine in master.

```
--etcd-servers-overrides="/events#http://192.168.0.42:2381"
```
you should see this line logged with the correct ip address: https://github.com/kubernetes/kubernetes/blob/master/staging/src/k8s.io/apiserver/pkg/server/storage/storage_factory.go#L278 mine looked like as follows:

```
I1228 11:48:42.116800   13098 storage_factory.go:278] storing { events} in v1, reading as __internal from storagebackend.Config{Type:"etcd3", Prefix:"/registry", ServerList:[]string{"http://192.168.0.42:2381"}, KeyFile:"", CertFile:"", CAFile:"", Quorum:true, Paging:true, DeserializationCacheSize:1000, Codec:runtime.Codec(nil), Transformer:value.Transformer(nil), CompactionInterval:300000000000}
```

The etcd log on 2381 looked like this:
http://paste.openstack.org/show/632652/

i could verify that the following was empty:
```
ETCDCTL_API=3 etcdctl get "/registry/events" --prefix=true
```

and the events were present when i tried:
```
ETCDCTL_API=3 etcdctl get "/registry/events" --prefix=true --endpoints="[192.168.0.42:2381]"
```

Thanks,
Dims

**Comment by joejulian** [comment]
Correct, but if you use a dns entry that points to a cluster of etcd servers that's what causes the failure.

For instance, if you had a cluster of 3 etcd nodes instead of just the one and created these entries (obvious assumptions made):
```
etcdevents.cluster.internal IN A 300 192.168.0.42
etcdevents.cluster.internal IN A 300 192.168.0.43
etcdevents.cluster.internal IN A 300 192.168.0.44
```
then change your flag to 
```
--etcd-servers-overrides="/events#http://etcdevents.cluster.internal:2381"
```
That will cause the failure.

**Comment by dims** [comment]
@joejulian what are the symptoms?

- Are there any traces in the kube api log?
- does say `kubectl get events` work? (or `kubectl describe po/xyz --show-events` - where xyz is one of your pods)
- Do you see any 504 errors in the kube api log?

Thanks,
Dims

**Comment by joejulian** [comment]
Just timeout backtraces followed by 504s. There's nothing useful.

get events or show-events hangs until it times out.

During this time I have a tcpdump running on every etcdevents node ("host <master1> or host <master2> ..." etc) so I could see if there was any attempt. There is not.

**Comment by joejulian** [comment]
This was after upgrading a cluster I noticed namespaces were stuck deleting.

**Comment by dims** [comment]
@joejulian right, one last data point. what does the log corresponding to this line look in your actual logs?

https://github.com/kubernetes/kubernetes/blob/release-1.9/staging/src/k8s.io/apiserver/pkg/server/storage/storage_factory.go#L278
ove 
(see my log snippet above)

The 504 and timeout backtraces and the get/show-events hang means that we are actually trying to talk to something and are unable to. So the log snippet above should tell us what we are talking to ...

**Comment by joejulian** [comment]
With `--etcd-servers-overrides=/events#https://etcdEvents.etcd.jj-rc.internal:2381` the line you requested reads:

```
I1229 05:39:56.317106       1 storage_factory.go:278] storing { events} in v1, reading as __internal from storagebackend.Config{Type:"", Prefix:"/registry", ServerList:[]string{"https://etcdevents.etcd.jj-rc.internal:2381"}, KeyFile:"/etc/etcd/ssl/client-key.pem", CertFile:"/etc/etcd/ssl/client.pem", CAFile:"/etc/etcd/ssl/client-ca.pem", Quorum:true, Paging:true, DeserializationCacheSize:1000, Codec:runtime.Codec(nil), Transformer:value.Transformer(nil), CompactionInterval:300000000000}
```

The not-overridden etcd connections look exactly the same except for the hostname and port: `etcd.etcd.jj-rc.internal:2379` and those work fine (also a CNAME referencing a hostname with multiple A records).

**Comment by joejulian** [comment]
```
I1229 05:40:39.278483       1 wrap.go:42] POST /api/v1/namespaces/kube-system/events: (30.00091179s) 504
goroutine 3519 [running]:
k8s.io/kubernetes/vendor/k8s.io/apiserver/pkg/server/httplog.(*respLogger).recordStatus(0xc4235e6b60, 0x1f8)
        /go/src/k8s.io/kubernetes/_output/dockerized/go/src/k8s.io/kubernetes/vendor/k8s.io/apiserver/pkg/server/httplog/httplog.go:207 +0xdd
k8s.io/kubernetes/vendor/k8s.io/apiserver/pkg/server/httplog.(*respLogger).WriteHeader(0xc4235e6b60, 0x1f8)
        /go/src/k8s.io/kubernetes/_output/dockerized/go/src/k8s.io/kubernetes/vendor/k8s.io/apiserver/pkg/server/httplog/httplog.go:186 +0x35
k8s.io/kubernetes/vendor/k8s.io/apiserver/pkg/server/filters.(*baseTimeoutWriter).WriteHeader(0xc426a4c980, 0x1f8)
        /go/src/k8s.io/kubernetes/_output/dockerized/go/src/k8s.io/kubernetes/vendor/k8s.io/apiserver/pkg/server/filters/timeout.go:188 +0xac
k8s.io/kubernetes/vendor/k8s.io/apiserver/pkg/endpoints/metrics.(*ResponseWriterDelegator).WriteHeader(0xc4279771d0, 0x1f8)
        /go/src/k8s.io/kubernetes/_output/dockerized/go/src/k8s.io/kubernetes/vendor/k8s.io/apiserver/pkg/endpoints/metrics/metrics.go:227 +0x45
k8s.io/kubernetes/vendor/k8s.io/apiserver/pkg/endpoints/handlers/responsewriters.SerializeObject(0x49e52ff, 0x23, 0x7f6813c385f8, 0xc42a473a80, 0xa662a00, 0xc426f67f98, 0xc429e41500, 0x1f8, 0xa6436c0, 0xc428ec9ef0)
        /go/src/k8s.io/kubernetes/_output/dockerized/go/src/k8s.io/kubernetes/vendor/k8s.io/apiserver/pkg/endpoints/handlers/responsewriters/writers.go:95 +0x8d
k8s.io/kubernetes/vendor/k8s.io/apiserver/pkg/endpoints/handlers/responsewriters.WriteObjectNegotiated(0x7f6813c4ad10, 0xc425c72660, 0xa666640, 0xc42156e1e0, 0x0, 0x0, 0x495c798, 0x2, 0xa662a00, 0xc426f67f98, ...)
        /go/src/k8s.io/kubernetes/_output/dockerized/go/src/k8s.io/kubernetes/vendor/k8s.io/apiserver/pkg/endpoints/handlers/responsewriters/writers.go:123 +0x32b
k8s.io/kubernetes/vendor/k8s.io/apiserver/pkg/endpoints/handlers/responsewriters.ErrorNegotiated(0x7f6813c4ad10, 0xc425c72660, 0xa62d400, 0xc428ec9e60, 0xa666640, 0xc42156e1e0, 0x0, 0x0, 0x495c798, 0x2, ...)
        /go/src/k8s.io/kubernetes/_output/dockerized/go/src/k8s.io/kubernetes/vendor/k8s.io/apiserver/pkg/endpoints/handlers/responsewriters/writers.go:142 +0x163
k8s.io/kubernetes/vendor/k8s.io/apiserver/pkg/endpoints/handlers.(*RequestScope).err(0xc42538bb80, 0xa62d400, 0xc428ec9e60, 0xa662a00, 0xc426f67f98, 0xc429e41500)
        /go/src/k8s.io/kubernetes/_output/dockerized/go/src/k8s.io/kubernetes/vendor/k8s.io/apiserver/pkg/endpoints/handlers/rest.go:67 +0x10c
k8s.io/kubernetes/vendor/k8s.io/apiserver/pkg/endpoints/handlers.createHandler.func1(0xa662a00, 0xc426f67f98, 0xc429e41500)
        /go/src/k8s.io/kubernetes/_output/dockerized/go/src/k8s.io/kubernetes/vendor/k8s.io/apiserver/pkg/endpoints/handlers/create.go:120 +0x1404
k8s.io/kubernetes/vendor/k8s.io/apiserver/pkg/endpoints.restfulCreateResource.func1(0xc427977140, 0xc429348240)
        /go/src/k8s.io/kubernetes/_output/dockerized/go/src/k8s.io/kubernetes/vendor/k8s.io/apiserver/pkg/endpoints/installer.go:1080 +0xd5
k8s.io/kubernetes/vendor/k8s.io/apiserver/pkg/endpoints/metrics.InstrumentRouteFunc.func1(0xc427977140, 0xc429348240)
        /go/src/k8s.io/kubernetes/_output/dockerized/go/src/k8s.io/kubernetes/vendor/k8s.io/apiserver/pkg/endpoints/metrics/metrics.go:168 +0x208
k8s.io/kubernetes/vendor/github.com/emicklei/go-restful.(*Container).dispatch(0xc4212493b0, 0x7f680b7fd850, 0xc426f67f88, 0xc429e41500)
        /go/src/k8s.io/kubernetes/_output/dockerized/go/src/k8s.io/kubernetes/vendor/github.com/emicklei/go-restful/container.go:277 +0xb18
k8s.io/kubernetes/vendor/github.com/emicklei/go-restful.(*Container).Dispatch(0xc4212493b0, 0x7f680b7fd850, 0xc426f67f88, 0xc429e41500)
        /go/src/k8s.io/kubernetes/_output/dockerized/go/src/k8s.io/kubernetes/vendor/github.com/emicklei/go-restful/container.go:199 +0x57
k8s.io/kubernetes/vendor/k8s.io/apiserver/pkg/server.director.ServeHTTP(0x497603f, 0xe, 0xc4212493b0, 0xc42068c000, 0x7f680b7fd850, 0xc426f67f88, 0xc429e41500)
        /go/src/k8s.io/kubernetes/_output/dockerized/go/src/k8s.io/kubernetes/vendor/k8s.io/apiserver/pkg/server/handler.go:153 +0x4e0
k8s.io/kubernetes/vendor/k8s.io/apiserver/pkg/server.(*director).ServeHTTP(0xc4210b5820, 0x7f680b7fd850, 0xc426f67f88, 0xc429e41500)
        <autogenerated>:1 +0x75
k8s.io/kubernetes/vendor/k8s.io/kube-aggregator/pkg/apiserver.(*proxyHandler).ServeHTTP(0xc427c2ac80, 0x7f680b7fd850, 0xc426f67f88, 0xc429e41500)
        /go/src/k8s.io/kubernetes/_output/dockerized/go/src/k8s.io/kubernetes/vendor/k8s.io/kube-aggregator/pkg/apiserver/handler_proxy.go:91 +0x15f
k8s.io/kubernetes/vendor/k8s.io/apiserver/pkg/server/mux.(*pathHandler).ServeHTTP(0xc4235f8280, 0x7f680b7fd850, 0xc426f67f88, 0xc429e41500)
        /go/src/k8s.io/kubernetes/_output/dockerized/go/src/k8s.io/kubernetes/vendor/k8s.io/apiserver/pkg/server/mux/pathrecorder.go:248 +0x26d
k8s.io/kubernetes/vendor/k8s.io/apiserver/pkg/server/mux.(*PathRecorderMux).ServeHTTP(0xc420ecf7a0, 0x7f680b7fd850, 0xc426f67f88, 0xc429e41500)
        /go/src/k8s.io/kubernetes/_output/dockerized/go/src/k8s.io/kubernetes/vendor/k8s.io/apiserver/pkg/server/mux/pathrecorder.go:234 +0xa1
k8s.io/kubernetes/vendor/k8s.io/apiserver/pkg/server.director.ServeHTTP(0x4979ba3, 0xf, 0xc425bc8b40, 0xc420ecf7a0, 0x7f680b7fd850, 0xc426f67f88, 0xc429e41500)
        /go/src/k8s.io/kubernetes/_output/dockerized/go/src/k8s.io/kubernetes/vendor/k8s.io/apiserver/pkg/server/handler.go:161 +0x6ad
k8s.io/kubernetes/vendor/k8s.io/apiserver/pkg/server.(*director).ServeHTTP(0xc4261292a0, 0x7f680b7fd850, 0xc426f67f88, 0xc429e41500)
        <autogenerated>:1 +0x75
k8s.io/kubernetes/vendor/k8s.io/apiserver/pkg/endpoints/filters.WithAuthentication.func1(0x7f680b7fd850, 0xc426f67f88, 0xc429e41500)
        /go/src/k8s.io/kubernetes/_output/dockerized/go/src/k8s.io/kubernetes/vendor/k8s.io/apiserver/pkg/endpoints/filters/authentication.go:79 +0x2b1
net/http.HandlerFunc.ServeHTTP(0xc4247c4af0, 0x7f680b7fd850, 0xc426f67f88, 0xc429e41500)
        /usr/local/go/src/net/http/server.go:1918 +0x44
k8s.io/kubernetes/vendor/k8s.io/apiserver/pkg/endpoints/request.WithRequestContext.func1(0x7f680b7fd850, 0xc426f67f88, 0xc429e41500)
        /go/src/k8s.io/kubernetes/_output/dockerized/go/src/k8s.io/kubernetes/vendor/k8s.io/apiserver/pkg/endpoints/request/requestcontext.go:110 +0xcb
net/http.HandlerFunc.ServeHTTP(0xc4265ad0a0, 0x7f680b7fd850, 0xc426f67f88, 0xc429e41500)
        /usr/local/go/src/net/http/server.go:1918 +0x44
k8s.io/kubernetes/vendor/k8s.io/apiserver/pkg/server/filters.(*timeoutHandler).ServeHTTP.func1(0xc4265ad120, 0xa669e80, 0xc426f67f88, 0xc429e41500, 0xc425358120)
        /go/src/k8s.io/kubernetes/_output/dockerized/go/src/k8s.io/kubernetes/vendor/k8s.io/apiserver/pkg/server/filters/timeout.go:93 +0x8d
created by k8s.io/kubernetes/vendor/k8s.io/apiserver/pkg/server/filters.(*timeoutHandler).ServeHTTP
        /go/src/k8s.io/kubernetes/_output/dockerized/go/src/k8s.io/kubernetes/vendor/k8s.io/apiserver/pkg/server/filters/timeout.go:92 +0x1ab

logging error output: "k8s\x00\n\f\n\x02v1\x12\x06Status\x12d\n\x06\n\x00\x12\x00\x1a\x00\x12\aFailure\x1a9Timeout: request did not complete within allowed duration\"\aTimeout*\n\n\x00\x12\x00\x1a\x00(\x002\x000\xf8\x03\x1a\x00\"\x00"
 [[hyperkube/v1.8.6 (linux/amd64) kubernetes/6260bb0] 127.0.0.1:44066]
```

**Comment by liggitt** [comment]
And both etcd clusters were set up with certs signed by the same CA and accepting the etcd client cert used by the API server?

**Comment by joejulian** [comment]
Correct.

Of course it wouldn't matter since it never opens a network connection to find out.

**Comment by dims** [comment]
@joejulian ack. thanks. sounds like something changed in the etcd client side. right @liggitt ?

**Comment by liggitt** [comment]
> sounds like something changed in the etcd client side. 

Unclear

> The not-overridden etcd connections look exactly the same except for the hostname and port: etcd.etcd.jj-rc.internal:2379 and those work fine (also a CNAME referencing a hostname with multiple A records).

This is the part that is confusing me. If --etcd-servers and --etcd-servers-overrides are referencing identical styles of etcd cluster urls, I don't see anything in the client wiring that would explain this difference in behavior

**Comment by dims** [comment]
ok, so let's check the DNS lookup then?

@joejulian can you please try the `export GODEBUG=netdns=cgo` ( see https://golang.org/pkg/net/ ) There's a tip in there to print debugging information too.

**Comment by joejulian** [comment]
I set netdns=cgo+1. The debug output confirmed the use of cgo but there was no additional debugging output relating to dns nor was there any change.

I added a sidecar container running tcpdump to the api-server watching port 53. There's never a lookup for `etcdevents.etcd.jj-rc.internal`, only for `etcd.etcd.jj-rc.internal`.

**Comment by joejulian** [comment]
DNS lookups are successful but it's still timing out.
```
21:54:56.727081 IP ip-10-0-107-34.us-west-2.compute.internal.59478 > ip-10-0-0-2.us-west-2.compute.internal.53: 33200+ A? etcdevents.etcd.jj-rc.internal. (48)
21:54:56.727088 IP ip-10-0-107-34.us-west-2.compute.internal.59478 > ip-10-0-0-2.us-west-2.compute.internal.53: 15079+ AAAA? etcdevents.etcd.jj-rc.internal. (48)
21:54:56.727271 IP ip-10-0-0-2.us-west-2.compute.internal.53 > ip-10-0-107-34.us-west-2.compute.internal.59478: 33200 4/0/0 CNAME etcdevents.jj-rc.internal., A 10.0.119.48, A 10.0.246.128, A 10.0.63.59 (121)
21:54:56.727287 IP ip-10-0-0-2.us-west-2.compute.internal.53 > ip-10-0-107-34.us-west-2.compute.internal.59478: 15079 1/1/0 CNAME etcdevents.jj-rc.internal. (160)
```

**Comment by joejulian** [comment]
Although it does it a little differently, The native go lookup also succeeds:
```
22:05:51.657158 IP ip-10-0-0-2.us-west-2.compute.internal.53 > ip-10-0-107-34.us-west-2.compute.internal.38974: 54171 4/0/0 CNAME etcd.jj-rc.internal., A 10.0.70.102, A 10.0.214.255, A 10.0.8.108 (104)
22:05:51.677027 IP ip-10-0-107-34.us-west-2.compute.internal.41373 > ip-10-0-0-2.us-west-2.compute.internal.53: 9413+ AAAA? etcdevents.etcd.jj-rc.internal. (48)
22:05:51.677183 IP ip-10-0-0-2.us-west-2.compute.internal.53 > ip-10-0-107-34.us-west-2.compute.internal.41373: 9413 1/1/0 CNAME etcdevents.jj-rc.internal. (160)
22:05:51.677715 IP ip-10-0-107-34.us-west-2.compute.internal.43605 > ip-10-0-0-2.us-west-2.compute.internal.53: 19884+ A? etcdevents.etcd.jj-rc.internal. (48)
22:05:51.677845 IP ip-10-0-0-2.us-west-2.compute.internal.53 > ip-10-0-107-34.us-west-2.compute.internal.43605: 19884 4/0/0 CNAME etcdevents.jj-rc.internal., A 10.0.246.128, A 10.0.63.59, A 10.0.119.48 (121)
```

**Comment by liggitt** [comment]
Just as a sanity check, does using the events etcd cluster as the main etcd cluster work? (`https://etcdEvents.etcd.jj-rc.internal:2381`)

**Comment by joejulian** [comment]
Bingo. Good suggestion.

So the problem was, indeed, with the certificate (I feel dumb) and also my method of testing for connection attempts. 

My expectation was that when an attempt was made to get the event data from an etcd cluster - if a connection was not established the etcd client would attempt to create one. Since I was not seeing any connection attempts when I was doing queries, I thought that a failure.

I was wrong in that it only attempts to connect once and, since the server had a cert that didn't match its new hostname (A new hostname was the reason I created a CNAME. Why I didn't think of that from the very first  moment I blame on too much eggnog.) the initial connection failed and apiserver never tried to connect ever again. Shouldn't it try again? Should I file a bug?

Now I'm pretty sure this whole issue is invalid and can be closed.

**Comment by dims** [comment]
LOL all's well that ends well @joejulian :)

**Comment by workhardcc** [comment]
May I ask why not `--etcd-servers-overrides=/registry/events#http://1.1.1.1:2379` work but `--etcd-servers-overrides=/events#http://1.1.1.1:2379` work?

**Comment by dixudx** [comment]
> May I ask why not --etcd-servers-overrides=/registry/events#http://1.1.1.1:2379 work but --etcd-servers-overrides=/events#http://1.1.1.1:2379 work?

@workhardcc  Refer to @liggitt 's [comment above](https://github.com/kubernetes/kubernetes/issues/57440#issuecomment-353354056).
