### ISSUE TITLE
IPVS shortcut the network policies when src pod and dst pod are on the same node

### ISSUE THREAD

**Issue by primeroz** [kubernetes/kubernetes#68055]
**Is this a BUG REPORT or FEATURE REQUEST?**:

/kind bug

**What happened**:
When using IPVS mode for kube-proxy and network-policy with calico-node the iptables rules applied to the nodes don't manage to block unwanted traffic when the source pod and destination pod are on the same node.

**What you expected to happen**:
Unwanted traffic to be blocked regardless of which node host the src and dst pod.

**How to reproduce it (as minimally and precisely as possible)**:
- Start a kubernetes cluster v1.11.2 with kube-proxy in ipvs mode and calico-node as network overlay
- create a namespace and apply a deny all policy
- create a busybox client pod 
- create an httpd server pod with an associated `type: ClusterIP` service
- When client and server pod are on different nodes the network policy work and a `wget http://clusterip` from the busybox client pod will hangs and eventually timeout
- When client and server pod are on the same node the `wget` command will succed in fetching index.html

**Anything else we need to know?**:

From my investigation this is caused by the fact that calico-node ( all network fabrics ? ) fw rules are using the FORWARD chain of iptables , when a connection is load balanced through IPVS on the local node though then the traffic to the destination pod is emmited from host rather than simply forwarded and as such uses the OUTPUT chain which does not have the network-policy rules.

**Simple example**
namespace: testfc
network policy: drop all

Pods running on same node
```
master01 ~ $ kubectl get pods -n testfc -o wide
NAME                       READY     STATUS    RESTARTS   AGE       IP           NODE              NOMINATED NODE
busybox-79ffd444bc-4bnwj   1/1       Running   1          17h       10.244.5.5   worker-hmfour01   <none>
httpd-7b8b64bfd5-kr6dp     1/1       Running   1          17h       10.244.5.6   worker-hmfour01   <none>

master01 ~ $ kubectl get svc -n testfc -o wide
NAME      TYPE        CLUSTER-IP    EXTERNAL-IP   PORT(S)   AGE       SELECTOR
httpd     ClusterIP   10.0.61.128   <none>        80/TCP    17h       run=httpd

master01 ~ $ kubectl exec -t -i -n testfc busybox-79ffd444bc-4bnwj sh
/ # wget http://10.0.61.128
Connecting to 10.0.61.128 (10.0.61.128:80)
index.html           100% |***********************************************************************************************************************************************|    45  0:00:00 ETA

/ # wget http://10.244.5.6
Connecting to 10.244.5.6 (10.244.5.6:80)
^C
```

TCPDUMP and iptables LOGS showing traffic when wget to Service IP
Add a logging line to the output Chain to show the match

```
# iptables -I OUTPUT 1 --dst 10.244.5.6 -j LOG

worker-hmfour01 ~ # tcpdump -i calie3675b0947e -n
listening on calie3675b0947e, link-type EN10MB (Ethernet), capture size 262144 bytes
09:13:40.398135 IP 10.244.5.5.40034 > 10.244.5.6.80: Flags [S], seq 83744726, win 27400, options [mss 1370,sackOK,TS val 2775911139 ecr 0,nop,wscale 7], length 0
09:13:40.398164 IP 10.244.5.6.80 > 10.244.5.5.40034: Flags [S.], seq 3157107829, ack 83744727, win 27160, options [mss 1370,sackOK,TS val 3033806827 ecr 2775911139,nop,wscale 7], length 0
09:13:40.398189 IP 10.244.5.5.40034 > 10.244.5.6.80: Flags [.], ack 1, win 215, options [nop,nop,TS val 2775911139 ecr 3033806827], length 0
09:13:40.398208 IP 10.244.5.5.40034 > 10.244.5.6.80: Flags [P.], seq 1:75, ack 1, win 215, options [nop,nop,TS val 2775911140 ecr 3033806827], length 74: HTTP: GET / HTTP/1.1
09:13:40.398219 IP 10.244.5.6.80 > 10.244.5.5.40034: Flags [.], ack 75, win 213, options [nop,nop,TS val 3033806828 ecr 2775911140], length 0
09:13:40.398853 IP 10.244.5.6.80 > 10.244.5.5.40034: Flags [P.], seq 1:290, ack 75, win 213, options [nop,nop,TS val 3033806828 ecr 2775911140], length 289: HTTP: HTTP/1.1 200 OK
09:13:40.398909 IP 10.244.5.5.40034 > 10.244.5.6.80: Flags [.], ack 290, win 223, options [nop,nop,TS val 2775911140 ecr 3033806828], length 0
```

LOGS showing that the OUTPUT chain is being used rather than the FORWARD one
```
[ 1372.474582] IN= OUT=calie3675b0947e SRC=10.244.5.5 DST=10.244.5.6 LEN=60 TOS=0x00 PREC=0x00 TTL=63 ID=57419 DF PROTO=TCP SPT=40214 DPT=80 WINDOW=27400 RES=0x00 SYN URGP=0
[ 1372.490861] IN= OUT=calie3675b0947e SRC=10.244.5.5 DST=10.244.5.6 LEN=52 TOS=0x00 PREC=0x00 TTL=63 ID=57420 DF PROTO=TCP SPT=40214 DPT=80 WINDOW=215 RES=0x00 ACK URGP=0
[ 1372.499559] IN= OUT=calie3675b0947e SRC=10.244.5.5 DST=10.244.5.6 LEN=126 TOS=0x00 PREC=0x00 TTL=63 ID=57421 DF PROTO=TCP SPT=40214 DPT=80 WINDOW=215 RES=0x00 ACK PSH URGP=0
[ 1372.499983] IN= OUT=calie3675b0947e SRC=10.244.5.5 DST=10.244.5.6 LEN=52 TOS=0x00 PREC=0x00 TTL=63 ID=57422 DF PROTO=TCP SPT=40214 DPT=80 WINDOW=223 RES=0x00 ACK URGP=0
[ 1372.500623] IN= OUT=calie3675b0947e SRC=10.244.5.5 DST=10.244.5.6 LEN=52 TOS=0x00 PREC=0x00 TTL=63 ID=57423 DF PROTO=TCP SPT=40214 DPT=80 WINDOW=223 RES=0x00 ACK FIN URGP=0
[ 1372.554752] IN= OUT=calie3675b0947e SRC=10.244.5.5 DST=10.244.5.6 LEN=40 TOS=0x00 PREC=0x00 TTL=63 ID=7098 DF PROTO=TCP SPT=40214 DPT=80 WINDOW=0 RES=0x00 RST URGP=0
```

When PODS are on different nodes everything works as expected since the destination node will just forward the packet
```
master01 ~ $ kubectl get pods -n testfc -o wide
NAME                       READY     STATUS    RESTARTS   AGE       IP           NODE              NOMINATED NODE
busybox-79ffd444bc-4bnwj   1/1       Running   1          17h       10.244.5.5   worker-hmfour01   <none>
httpd-7b8b64bfd5-m6gfd     1/1       Running   0          14s       10.244.3.4   worker-hmfour03   <none>


/ # wget http://10.0.61.128 -O-
Connecting to 10.0.61.128 (10.0.61.128:80)
^C
```

**Environment**:
- Kubernetes version (use `kubectl version`): v1.11.2
- Cloud provider or hardware configuration: gcp with calico-node network policy using canal deployment , v2.6.10
- OS (e.g. from /etc/os-release): Container Linux by CoreOS 1800.7.0 (Rhyolite)
- Kernel (e.g. `uname -a`): 4.14.63-coreos
- Install tools: none 
- Others: 
  - docker image: gcr.io/google-containers/hyperkube-amd64
  - calico-node version 2.6.10 - quay.io/calico/node:v2.6.10

**Comment by primeroz** [comment]
Closing since , after going through the changelog of calico, i should at least upgrade to version 3 before testing again since that version added ipvs mode support
