### ISSUE TITLE
Bare Metal K8S 63 Second Service Routing Delay - when accessing service via ClusterIP, or ExternalIP

### ISSUE THREAD

**Issue by davesargrad** [kubernetes/kubernetes#88986]
**What happened**:
From a computer (ghana) outside my dev cluster (tonga, spain) I can access a micro service via its NodePort (in the following the service just responds with the string "Im not well. Please restart me!")
![image](https://user-images.githubusercontent.com/48793689/76258380-ce260200-6229-11ea-9fd5-a876d20415e9.png)

But when I try to access the service either via its ClusterIP, or via its EXTERNAL-IP, I see a delay in routing the request to a pod on "the other node". 

I intially thought this might be a problem with MetalLB, however I've now taken MetalLB out of the loop completely, and see this problem when accessing the service via the ClusterIP. 

**Cluster IP curl - (10.96.11.2)**
![image](https://user-images.githubusercontent.com/48793689/76563644-2f461380-647e-11ea-9881-344ce77d690f.png)

 **EXTERNAL-IP curl (192.168.1.241**)
Though the following picture is with the NodePort (30123), I've also tried the PORT(8080)
![image](https://user-images.githubusercontent.com/48793689/76258522-1e04c900-622a-11ea-9409-c3f88b0840c0.png)

**The pictures show**
From a node inside the cluster, I am able to curl to the service using either its ClusterIP:PORT or its EXTERNAL-IP:PORT, but when that curl request is routed to a pod in the cluster, _that is on the other node_, it takes **_63_** seconds for the request to arrive at the pod on that node

This delay (of 1 minute) is seen in the following picture.

![image](https://user-images.githubusercontent.com/48793689/76452938-4ca8ae00-63a8-11ea-8243-2c6140f79ea2.png)

In the following I am running tcpdump on the traffic to the PODS IP (10.244.2.5). 

As soon as I perform the curl I see several packets that flow to port (8080) "webcache" . Its not until 1 minute later that I see the message that triggers the request sent to the pod itself... then the pod responds.

![image](https://user-images.githubusercontent.com/48793689/76454343-df4a4c80-63aa-11ea-9cd7-3bc85c9c2e93.png)

It seems that the first series of SYN packets dont get through.

**Interesting Note**
Its interesting to see that the SYN packets that lead up to the successful request have increasing time delays (in seconds): 1, 2, 4, 8, 16, 32. Then we see the SYN ACK from the kubia service.

It seems that the packet is being sent to the POD IP, however that packet is not routed to the container entrypoint.

I've also posted [this delay problem](https://discuss.kubernetes.io/t/bare-metal-k8s-load-balancer-service-routing-delay/10035) on the k8s forum.

**What you expected to happen**:
curl to EXTERNAL_IP:SERVICE_PORT (192.168.1.241:8080) 
or to 
curl to CLUSTER_IP:SERVICE_PORT (10.96.11.2:8080) 

should succeed, promptly (within just a few msec)

**Update**
Because I've learned a bit and isolated a bit (since first writing this issue), please go to my last comment, and "read up". 

The comments starting with the one that says "Hmmm.. What i find is that I'm able to curl the pod port 8080 sometimes when i run the curl on the master, but not when I run it from outside the cluster." are most informative.

I've captured my latest understanding in those comments. 

**In short, I'm seeing an unexpected 60 second delay in response to service queries that get Load Balanced to the other node. Further, I dont seem to be able to hit the EXTERNAL-IP from outside the cluster (those requests never seem to make it to the pod, though they do make it to the cluster nodes).**

**How to reproduce it (as minimally and precisely as possible)**:
On a bare metal cluster, create and deploy a service such as the one below:
![image](https://user-images.githubusercontent.com/48793689/76312627-d291ff80-62a9-11ea-9066-00ad58830a34.png)

I deployed the micro service using a replicaset.

![image](https://user-images.githubusercontent.com/48793689/76314414-218d6400-62ad-11ea-98c1-1693af54ee4b.png)

Expose the service via a LoadBalancer.

![image](https://user-images.githubusercontent.com/48793689/76315322-da07d780-62ae-11ea-81c7-79a4899616a3.png)

The following service description illustrates the pod EndPoints for the 2 pod replicas
![image](https://user-images.githubusercontent.com/48793689/76319620-de83be80-62b5-11ea-8b49-7f1cf98a5dc8.png)

In the following we see that kube-proxy has properly bound to the NodePort on my k8s nodes
![image](https://user-images.githubusercontent.com/48793689/76316299-bcd40880-62b0-11ea-8fc5-82ff8cfee05e.png)

Install [MetalLB](https://metallb.universe.tf/concepts/layer2/).

I used 
`kubectl apply -f https://raw.githubusercontent.com/google/metallb/v0.8.3/manifests/metallb.yaml`

with layer 2 configuration as depicted [here](https://metallb.universe.tf/configuration/).

![image](https://user-images.githubusercontent.com/48793689/76315451-13404780-62af-11ea-995e-bec4a0a8499d.png)

On a box outside the cluster add a logical network and assign an IP on that network

On ghana (my test client box outside the cluster) I used the following (em1 is a physical interface that can connect to the k8s cluster):
`ifconfig em1:0 192.168.1.243 255.255.255.0`

I also tried 192.168.1.239 (outside the range owned by MetalLB - based on the configuration above)

The following would also work.
`ip addr add 192.168.1.243/24 dev em1 label em1:0`

Now its possible to use that logical network to curl 192.168.1.241 (the EXTERNAL-IP assigned by MetalLB) at port 30123 (the NodePort that kube-proxy binds to associated with the LoadBalancer service.

tcpdump on any of the k8s nodes can verify that the curl request arrives at port 30123 (the port kube-proxy has bound) on the k8s node. 

tcpdump can also be used to verify that kube-proxy does not respond (with SYN-ACK) to the SYN bit found with curls  "synchronize" request. 

**Anything else we need to know?**:

In the following we see my EXTERNAL-IP is 192.168.1.241
![image](https://user-images.githubusercontent.com/48793689/76258118-59eb5e80-6229-11ea-817d-60d098babdb2.png)

The MetalLB load balancer is responding properly to arp. 

A ping or curl (from my test node ghana) to 192.168.1.241 results in an arp table entry that uses the proper physical interface (em1). 

In the following tcpdump on k8s worker spain we see both the ARP request/reply, and the curl request (with SYN set), yet no SYN-ACK in reply

![image](https://user-images.githubusercontent.com/48793689/76258763-93709980-622a-11ea-9fb5-32d7d5d7520f.png)

Notice the arp table (on ghana) before and after my curl to the EXTERNAL-IP, 

![image](https://user-images.githubusercontent.com/48793689/76314873-f8210800-62ad-11ea-826d-4db828d57bb4.png)

My cluster nodes and their IP addresses can be seen below
![image](https://user-images.githubusercontent.com/48793689/76313290-0c173a80-62ab-11ea-8a06-64d378010451.png)

**I've placed additional contextual detail in the first comment below.**

**Environment**:
- Kubernetes version (use `kubectl version`):
1.17
![image](https://user-images.githubusercontent.com/48793689/76318942-d414f500-62b4-11ea-925a-f1b22e195d1c.png)

- Cloud provider or hardware configuration:
Bare Metal
- OS (e.g: `cat /etc/os-release`):
Centos 7
- Kernel (e.g. `uname -a`):
![image](https://user-images.githubusercontent.com/48793689/76318724-85fff180-62b4-11ea-9aa7-1646fa08e206.png)

- Install tools:
- Network plugin and version (if this is a network-related bug):
Flannel
- Others:

/sig network
/sig architecture

**Comment by davesargrad** [comment]
As the following picture shows, the curl makes it through to the worker node "spain" at the assigned NodePort (30123), and kube-proxy should then do the rest

![image](https://user-images.githubusercontent.com/48793689/76300466-22190100-6293-11ea-851e-ff1c3cf6c176.png)

**Comment by davesargrad** [comment]
Hmmm.. What i find is that I'm able to curl the pod port 8080 sometimes when i run the curl on the master, but not when I run it from outside the cluster.


![image](https://user-images.githubusercontent.com/48793689/76325161-65886500-62bd-11ea-934c-ded825631d24.png)

**Comment by davesargrad** [comment]
The curl to 192.168.1.241:8080 from ghana, and the tcpdump on spain.
![image](https://user-images.githubusercontent.com/48793689/76326825-95d10300-62bf-11ea-96ac-7539b4fa83be.png)

**Comment by davesargrad** [comment]
When the curl to 192.168.1.241:8080 succeeds, is consistently the pod on the master (tonga) that responds.

The pod on the other node (spain) is still healthy. It responds if I send the request to spains NodePort

**Comment by davesargrad** [comment]
One thing I find interesting is that I never see the "Assigned IP" event from the metallb-controller. See [here ](https://github.com/metallb/metallb/issues/494) and [here ](https://metallb.universe.tf/concepts/layer2/)for reference

![image](https://user-images.githubusercontent.com/48793689/76338969-e2243f00-62cf-11ea-998c-e229d28d17c5.png)

**Comment by davesargrad** [comment]
I just recreated the service, and logged the MetalLb controller (top) and its 2 speakers
![image](https://user-images.githubusercontent.com/48793689/76341006-cf5f3980-62d2-11ea-8a5e-884bf3123cc0.png)

**Comment by davesargrad** [comment]
Ok.. I think I'm almost understanding whats going on. I do eventually get a response from the service on the other pod, however there is consistently (just over) a 1 minute delay

![image](https://user-images.githubusercontent.com/48793689/76346284-1e10d180-62db-11ea-82f7-722b5ce9d698.png)

**Comment by davesargrad** [comment]
The request from outside the cluster, does indeed timeout (though the metallb "speaker" seems to handle the arp properly).

![image](https://user-images.githubusercontent.com/48793689/76347987-e0fa0e80-62dd-11ea-9d85-88587f7d70b5.png)

**Comment by davesargrad** [comment]
Using [this ](https://community.pivotal.io/s/article/How-to-get-tcpdump-for-containers-inside-Kubernetes-pods)process, I've also located the virtual network interface of the container running in my service pod. I am able to monitor that and verify that the request does not make its way into the pod until the 60 seconds has elpased.

![image](https://user-images.githubusercontent.com/48793689/76432201-07c14f00-6389-11ea-970c-4110c3617a52.png)

**Comment by SataQiu** [comment]
Emm.. Have you tested whether it works without `metallb`? or using some other LB tools?

**Comment by davesargrad** [comment]
> Emm.. Have you tested whether it works without `metallb`? or using some other LB tools?

Yes. I have a fair amount of experience at this point with K8S services. I've only just recently integrated MetalLB since I want to be able to use LoadBalancer services and I am on a bare metal K8S cluster.

**Comment by davesargrad** [comment]
I've now ruled out MetalLB. I've updated the issue, to reflect the fact that I also see this problem when accessing the service via ClusterIP.

**Comment by davesargrad** [comment]
I've closed [the issue](https://github.com/metallb/metallb/issues/539) I wrote in MetalLB

**Comment by davesargrad** [comment]
Ok. I just implemented a configuration work-around in my flannel config. I am now using host-gw, rather than vxlan. 

This fixed my problem. I'm pretty sure this means that the problem is not a k8s bug, that its actually a flannel bug. The only reason I'd not say that for sure relates to my lack of clarity relative to the vxlan pipeline. 

At this point I am inclined to close the k8s issue I wrote. 

The flannel issue, however, is one that others have seen in various forms.

Mine
https://github.com/coreos/flannel/issues/1268

Others
https://github.com/coreos/flannel/issues/1243
https://github.com/coreos/flannel/issues/1245

**Comment by rikatz** [comment]
@davesargrad can you please take a look if this [comment](https://github.com/kubernetes/kubernetes/issues/86507#issuecomment-595227060) helps?

**Comment by davesargrad** [comment]
@rikatz I am trying to figure out how to interpret the chain of comments on the issue you sent me.

Its interesting that there is an issue in calico that also calls out the exact same 63 second delay that I measured.

https://github.com/projectcalico/calico/issues/3145

Now this makes me believe that it may indeed be a k8s issue. The same 63 second delay in both calico and flannel... do they use the same underlying code?

**Comment by davesargrad** [comment]
@rikatz would i run the following command on every node of my cluster?
`sudo ethtool --offload flannel.1 rx off tx off`

**Comment by rikatz** [comment]
@davesargrad yes, the idea is to run the command on every node, at least so we can get a point into what's happening and if this solves the problem.


I though you were using flannel because of the issue description:

> Network plugin and version (if this is a network-related bug):
> Flannel

Was this some kind of migration from flannel to Calico?

**Comment by rikatz** [comment]
@davesargrad also thanks for pointing into that issue, so it helped to have some light if this seems to be more a vxlan problem that flannel problem.

So it seems there's a bug privatelly opened in Red Hat, and we will need to wait the conclusion of this one.

Thanks

**Comment by davesargrad** [comment]
@rikatz Ty Much. I'm glad this has your focus. It seems critical.

**Comment by rikatz** [comment]
@davesargrad did you got some time to take a look and check if disabling the tx and rx offload helps solving the problem?

**Comment by davesargrad** [comment]
Hi @rikatz 

I've not yet looked at that. I've been juggling a number of architectural challenges, and the days I spent isolating this problem were more than I had allocated. I will get back to it however as soon as I have a breather.

As soon as I do, I will update with a comment.

Thanks.
Dave

**Comment by hien** [comment]
I've tested with k8s 1.18.0 on ubuntu 16.04 and i got same problem. Disabling the tx and rx offload  method only works ok with calico not flannel

**Comment by davesargrad** [comment]
Thanks @hien. Its good to see that the community shares my concern.

**Comment by rikatz** [comment]
@hien is your environment virtual? I'll create some labs right now, and try to reproduce this here.

**Comment by rikatz** [comment]
@davesargrad @hien 

Trying not to be annoying (sorry about asking this much) but what's your network card model? There's a similar issue here (https://github.com/kubernetes/kubernetes/issues/87277) which is also baremetal and might be suffering from the same problem.

As a test, is it possible to you to upgrade your kernel to another version, or maybe use another Operating System?

There's some discussion around about the tx/rx offload (as I've commented) and to be honest, I've faced also this problem in a different scenario (not Kubernetes) but with a bug in the kernel.

Anyway I'm installing a CentOS 7.7 with the kernel 3.10.0-1062 to see if this behavior also happens here. 

Thank you

**Comment by davesargrad** [comment]
Thanks for staying on top of this @rikatz

**Comment by davesargrad** [comment]
```
 *-network
             description: Ethernet interface
             product: 82579LM Gigabit Network Connection (Lewisville)
             vendor: Intel Corporation
             physical id: 19
             bus info: pci@0000:00:19.0
             logical name: em1
             version: 04
             serial: 90:b1:1c:9e:a5:53
             size: 1Gbit/s
             capacity: 1Gbit/s
             width: 32 bits
             clock: 33MHz
             capabilities: bus_master cap_list ethernet physical tp 10bt 10bt-fd                                                                                                                                                              100bt 100bt-fd 1000bt-fd autonegotiation
             configuration: autonegotiation=on broadcast=yes driver=e1000e drive                                                                                                                                                             rversion=3.2.6-k duplex=full firmware=0.13-4 ip=10.93.103.236 latency=0 link=yes                                                                                                                                                              multicast=yes port=twisted pair speed=1Gbit/s
             resources: irq:27 memory:f7c00000-f7c1ffff memory:f7c39000-f7c39fff                                                                                                                                                              ioport:f080(size=32)

```

**Comment by 372046933** [comment]
> Well, lets go to the scenarios:
> 
> 
> * CentOS 7.7
> * Kubernetes 1.17.3
> * Flannel 0.11 in VXLAN mode
> * Kernel 3.10.0-1062.12.1.el7
> * Create a service, and call it from some node that's not running the destination Pod. It takes a huge time.
> * Now, in the SOURCE NODE turn off the txoffload only and voilà: `sudo ethtool --offload flannel.1 tx off`
> 
> 
> * CentOS 7.7
> * Kubernetes 1.17.3
> * Flannel 0.11 in host-gw mode
> * Kernel 3.10.0-1062.12.1.el7
> * Everything works fine. But as per #87277 that says that still with host-gw mode it still have issues, my best guess (and it's a guess, as I cannot test right now) is that this might be related to some bug between the network driver and offloading. Maybe disabling the offload also in the network adapters might help. @372046933 can you make this test and disable offloading also in your network card?
> 
> 
> * CentOS 7.7
> * Kubernetes 1.17.3
> * Flannel 0.11 in host-gw mode
> * Kernel 3.10.0-1062.18.1.el7 (all the system updated)
> * The problem still occurs. So the last kernel version still doesn't work in this case, not being possible to ask to test updating the system to check if this solves all the problems (vxlan or hostgw). But still, this might be a problem in the SOURCE of the communication (as proved in scenario 1) so it's confusing per #87277 if this is a problem in the client and not in the destination.
> 
> I don't know if we keep this issue open, as this is a problem between the CNI and the Kernel (and wait for a kernel update) or if should we close this.

Do you mean disable the offload feature on the node where pod is deployed?  I found that `tcp segmentation-offload` is on in all nodes. And each nodes have two NICs that are managed by 802.3ad

**Comment by hien** [comment]
> @hien is your environment virtual? I'll create some labs right now, and try to reproduce this here.

Yes, I'm on kvm with virtio NIC.

**Comment by rikatz** [comment]
OK folks, so the first thing I want to test here is that you all disable all the offloads in the cluster (sudo ethtool --offload interface rx off tx off) so we can remove or confirm this is caused by the offload. Flannel, the e1000e, all of them :)

@hien in your case I need a pretty more descriptive problem, like which tests you've done before hitting the same problem.

Tks

**Comment by 372046933** [comment]
@rikatz Since `host-gw` does not have an interface like `flannel0`. Which interface should I disable offload? Is that `docker0`?

**Comment by rikatz** [comment]
no, the physical network interfaces

**Comment by hien** [comment]
@rikatz It's just new k8s cluster that was created by kubeadm. I ran `curl`  test to both Service type NodePort and ClusterIP, 4/5 requests was slow to response when I `curl` from other node in cluster ( not the node that pod scheduled)

**Comment by rikatz** [comment]
> @rikatz It's just new k8s cluster that was created by kubeadm. I ran `curl` test to both Service type NodePort and ClusterIP, 4/5 requests was slow to response when I `curl` from other node in cluster ( not the node that pod scheduled)

As this is a new k8s cluster, please repeat the test with an OS with newer Kernel, as Ubuntu 16.04 is four years old (and is reaching its EoL now). Ubuntu 19.10 (or 18.04 LTS) would be better. I think in your case we might also have some variables as some problem with KVM, the virtio NIC from your current kernel not understanding vxlan correctly, etc.

Tks

**Comment by athenabot** [comment]
@rikatz
If this issue has been triaged, please comment `/remove-triage unresolved`.

If you aren't able to handle this issue, consider unassigning yourself and/or adding the `help-wanted` label.

🤖 I am a bot run by vllry. 👩‍🔬

**Comment by rikatz** [comment]
/remove-sig architecture
/remove-triage unresolved
/triage needs-information

@vllry as this needs to be checked against different Kernels and it seems more an OS and CNI issue than k8s, WDYT? Otherwise I can return into triage unresolved.

Tks!

**Comment by LuckySB** [comment]
https://github.com/kubernetes/kubernetes/issues/87852
https://github.com/kubernetes/kubernetes/issues/90084

**Comment by LuckySB** [comment]
my system: 
centos 7.7 
flannel from 0.7 to 0.11
kernel 4.20.13-1.el7.elrepo.x86_64
test from pod with hostnetwork true and simple from node 
```
dig @10.96.0.10 kubernetes.default.svc.cluster.local
```
any of the following actions helped me
`route add 10.96.0.0/16 cni0`

**Comment by LuckySB** [comment]
https://github.com/kubernetes/kubernetes/issues/87852#issuecomment-597248793

**Comment by 372046933** [comment]
@rikatz I have disabled offloading on both `bond0` on host node and `eth0` on container. Considerable latency exist nevertheless.

**Comment by ryanc-me** [comment]
I was having a similar issue with an Nginx Ingress running as a `DaemonSet`, with `hostNetwork: true` and `dnsPolicy: ClusterFirstWithHostNet`. My ingress was passing requests to a `Service` that was using `ExternalName` (i.e. pointing to a DNS name like _some-service.some-namespace.svc.cluster.local_).

Attempting to look up a domain would fail approximately 50% of the time.

After some digging, I found that requests to the CoreDNS `Service` were failing when they were travelling between nodes. The requests worked fine if both Nginx and CoreDNS were on the same node.

For example:
- DNS Requests from `NodeA - Nginx` -> `NodeB - CoreDNS` would time out, but
- DNS Requests from `NodeA - Nginx` -> `NodeA - CoreDNS` would succeed.

Running `ethtool --offload flannel.1 rx off tx off` fixed the issue completely for me - thank you for the suggest @rikatz!

**Comment by aojea** [comment]
I went ahead and submit a patch to flannel to fix/alleviate the problem, however I can't reproduce it nor test it, can somebody try my patch and report back in the PR?

https://github.com/coreos/flannel/pull/1282

**Comment by rikatz** [comment]
@aojea I'm on it

**Comment by rikatz** [comment]
No success with the PR.

```
vxlan.go:123] VXLAN config: VNI=1 Port=0 GBP=false Learning=false DirectRouting=false Checksum=false
```

Rebooted everything so flannel.1 should be recreated, the problem still occurs. Disabling the tx offload on the client side everything goes well

**Comment by rikatz** [comment]
@aojea newer patch works.

For those asking what Antonio's patch does, it basically creates the flannel.1 interface with tx and rx offloading off.

So this 'automates' the workaround.

**Comment by davesargrad** [comment]
@rikatz I've been monitoring the progress on this issue that I've written, and have appreciated the activity. So is it your  perspective that a flannel patch is what I need to get past this problem?

**Comment by davesargrad** [comment]
Can someone highlight the performance implications associated with turning tx and rx offloading off on the flannel interface. It seems like the performance implications can be high for high throughput environments: 1gbps, 10gbps. My application is quite high throughput.

**Comment by rikatz** [comment]
In my point of view this would be better corrected with a patch into CentOS7/RH7 kernel. The patch in Flannel is a workaround to disable tx and rx offload before creating the interface

**Comment by davesargrad** [comment]
@rikatz I appreciate your point of view. Is there an issue on the kernel that highlights this need? Can you point me to that issue, if you know which?

**Comment by rikatz** [comment]
There's a bugzilla link but it's internal to Red Hat employees and I don't have access

**Comment by davesargrad** [comment]
I find it odd that a kernel bug is owned by redhat, rather than properly open (as any opensourced things should be).

:)

**Comment by rikatz** [comment]
@372046933 is this related? https://github.com/kubernetes/kubernetes/issues/90042

This might be helpful, as your case is 'different' but it seems there are some other kernel issues happening around there

**Comment by 372046933** [comment]
@rikatz In my scenarios, two pods run tf-serving. I found that they used 25% CPU when idle(no requests are sent to the pod). `perf` shows that there are a lot of context switches. I changed serving's batching parameter and the CPU utilization falls to 5%. Delay in of requests by ClusterIP also falls dramatically. Maybe it is due to tf-serving? I cannot give a conclusion now. I will check TF-serving's doc about batching parameter

**Comment by dcbw** [comment]
Proposed kernel patch for some configurations: https://marc.info/?l=netfilter-devel&m=158742974931309&w=2

**Comment by davesargrad** [comment]
@dcbw Thanks much for letting us know. Do you have a sense of when that patch will be released with a kernel update?

**Comment by jhohertz** [comment]
I left a note on coreos/flannel#1243... I suspect this has something to do with kubernetes/kubernetes#83576, as there are changes relating to vxlan and checksums within it, and is unique to the 1.17 version.

**Comment by dcbw** [comment]
https://marc.info/?l=netfilter-devel&m=158742974931309&w=2 was accepted. I suspect it will be in the 5.8 kernel, but could also be backported to earlier releases once it lands in mainline.

**Comment by davesargrad** [comment]
@dcbw Ty Dan.

**Comment by rikatz** [comment]
Red Hat released the kernel 3.10.0-1127.8.2.el7.x86_64 but the problem still persists. Let's wait until a new kernel release arrives

**Comment by MarkRose** [comment]
Stable kernels 5.6.13, 5.4.41, 4.19.123, 4.14.181 and later have the checksum patch included.

**Comment by rikatz** [comment]
Just as a follow up from our sig-network meeting, I'll post the tests results from disabling --random-fully scenarios in kube-proxy and flannel, and also the generated rules for each scenario.

This is the same environment I could use to confirm that disabling tx offload solves (CentOS 7 + Flannel 0.11), but in this case I'm enabling tx offload again in everything:

* Before each test, iptables rules are cleaned in the hosts so flannel and kube-proxy recreate them
* In NodePort scenarios, I'm calling my own IP:Port as part of the cluster to reach a Pod running outside of it

**Scenario 1 - Both kube-proxy and flannel with MASQUERADE rules created with --random-fully**

NodePort: Exactly 63s
ClusterIP: Exactly 63s

IPTables rules containing --random-fully:
```
-A POSTROUTING -s 10.244.0.0/16 ! -d 224.0.0.0/4 -j MASQUERADE --random-fully
-A POSTROUTING ! -s 10.244.0.0/16 -d 10.244.0.0/16 -j MASQUERADE --random-fully
-A KUBE-POSTROUTING -m comment --comment "kubernetes service traffic requiring SNAT" -m mark --mark 0x4000/0x4000 -j MASQUERADE --random-fully
```


**Scenario 2 - Original kube-proxy  with random-fully and flannel recompiled without it**
NodePort: Exactly 63s
ClusterIP: Exactly 63s

IPTables rules containing --random-fully:
```
-A KUBE-POSTROUTING -m comment --comment "kubernetes service traffic requiring SNAT" -m mark --mark 0x4000/0x4000 -j MASQUERADE --random-fully
```

**Scenario 3 -  kube-proxy  without random-fully and original flannel with random-fully enabled**
NodePort: 0.03s
ClusterIP: 0.007s

IPTables rules containing --random-fully:
```
-A POSTROUTING -s 10.244.0.0/16 ! -d 224.0.0.0/4 -j MASQUERADE --random-fully
-A POSTROUTING ! -s 10.244.0.0/16 -d 10.244.0.0/16 -j MASQUERADE --random-fully
```

**Scenario 4 -  kube-proxy and flannel without random-fully**
NodePort: 0.005s
ClusterIP: 0.03s

IPTables rules containing --random-fully: NONE

---
This way, we can almost for sure say that the insertion of --random-fully in the MASQUERADE rules triggered an already existing Kernel Bug in vxlan, so this always existed in the Kernel but got visible with the --random-fully being applied

**Comment by zhangguanzhang** [comment]
@rikatz  nick work

**Comment by MarkRose** [comment]
For what it's worth, @jhohertz pointed out to me a relevant issue elsewhere regarding the same bug with `--fully-random` and `--random` ignoring ip_local_port_range: https://github.com/aws/amazon-vpc-cni-k8s/issues/509

**Comment by davesargrad** [comment]
Great Job @rikatz so glad to see you reproduce the exact 63 second delay that i saw.

**Comment by danwinship** [comment]
> For what it's worth, @jhohertz pointed out to me a relevant issue elsewhere regarding the same bug with `--random-fully` and `--random` ignoring `ip_local_port_range`: [aws/amazon-vpc-cni-k8s#509](https://github.com/aws/amazon-vpc-cni-k8s/issues/509)

Aha!... Well, actually, I don't think that bug report is related to this problem at all :smile:, but it pointed me in the right direction at least. `iptables-extensions(8)` says, regarding SNAT source port modification:

> ... If no port range is specified, then source ports  below  512 will be mapped to other ports below 512: those between 512 and 1023 inclusive will be mapped to ports below 1024, and other ports will be mapped to 1024  or  above.  **Where possible,  no  port alteration will occur.**

Emphasis added. But checking [the source](https://github.com/torvalds/linux/blob/v5.6/net/netfilter/nf_nat_core.c#L543), that last part is only true if you _don't_ pass `--random` or `--random-fully`:

```
	if (maniptype == NF_NAT_MANIP_SRC &&
	    !(range->flags & NF_NAT_RANGE_PROTO_RANDOM_ALL)) {
		/* try the original tuple first */
```

So with the old non-`--random-fully` code, most of the time, the NATted packet will have the same source port as the original packet, but if you _do_ use `--random-fully`, then it's guaranteed that the NAT code will have to change the source port in the packet, which means it will have to fix up its checksum after NATting it, which means it hits the checksum offload bug. BOOM.

OK, so this is good. It confirms that `--random-fully` isn't itself buggy, it's just that it causes us to reliably hit the other bug. Now to figure out what to do about this...

**Comment by danwinship** [comment]
So... @kubernetes/sig-network-misc it seems that using `iptables --random-fully` definitely triggers the udp checksum / vxlan bug, just because of the nature of how it works, not because `--random-fully` is buggy. And there's no workaround other than not using `--random-fully` or avoiding the checksum bug. At the moment, there are probably more people being hurt by our use of `--random-fully` than are being helped by it, but over time that will change, as people get the kernel updates that fix the checksum bug.

So...

1. We could do nothing and just require affected users to either upgrade their kernels or disable checksum offload. (There is not yet a RHEL 7 kernel with the checksum bug fix and I'm not sure when there will be.)
2. Revert `--random-fully` entirely, at least for now, possibly breaking users who were depending on it (eg, #76699, though FTR it's not actually confirmed that `--random-fully` fixed things for them)
3. Only use `--random-fully` when there are no VXLAN interfaces on the system (so non-VXLAN-using network plugins can get the benefits of `--random-fully`, while VXLAN-using plugins don't, but continue working with older kernels).
4. Only use `--random-fully` when the kernel is of a version known to have the checksum fix
5. Add a kube-proxy arg saying whether to use `--random-fully`.

I kind of like 4, and #91137 already has some of the infrastructure for deciding whether to use the flag based on the kernel version.

**Comment by rikatz** [comment]
+1 for the item 4, relying on #91137. This seems to bring the less impact than the other solutions.

Solution 3 could also be used but IMO it's pretty tricky to detect which interface uses or not vxlan. We could detect if the vxlan module is loaded by looking into /proc/modules but this might lead into some false positive (the module might be loaded but not used by any k8s / cni component), or if we got someone with some really specific use case, as vxlan being compiled as built-in and not module, this wont work.

Also, if #91337 gets shipped it would be great to leave some 'track' for this into the future, so when the bugfix for the kernel package in RHEL 7 is available we might have another new direction, maybe reverting this again and directing users to update the kernel.

WDYT?

And thanks for leading this Dan, your point with the --random-fully lead me to the right tests.

**Comment by Capitrium** [comment]
@danwinship @rikatz I don't think option 4 will work for myself or @jhohertz at the very least - we're both using Flatcar Linux, and I can confirm that the latest stable version with kernel 4.19.124-flatcar did not fix this issue in my cluster.

Personally I'd be fine with option 5 since `--random-fully` just appears completely broken on my cluster and I barely use NodePort services at all, much less the way they're used as described in #76699.

I think option 2 should be given some serious thought though; given that this issue still exists on some systems despite having a recent kernel with the checksum fix, it seems like there are other factors that determine the impact of using `--random-fully`.

**Comment by rikatz** [comment]
For the solution 3 maybe this can be checked in /sys/class/net/*/uevent to see if there's someone using DEVTYPE=vxlan and this will work if this is a builtin or a module BUT the amount of directories inside this grow as much as Pods and virtual interfaces you've in it, so this might bring a huge performance impact.

5 might be applicable, but this might lead to a question if we really want to add another flag into kube-proxy. I'm not able to answer this, so will wait for the experts :)

**Comment by danwinship** [comment]
> Solution 3 could also be used but IMO it's pretty tricky to detect which interface uses or not vxlan.

Oh? I was assuming everything that didn't use OVS was just using kernel interfaces of type `vxlan`. Is that not what weave and flannel do?

> I can confirm that the latest stable version with kernel 4.19.124-flatcar did not fix this issue in my cluster.

Hm... we'll need more testing then. If the alleged fix doesn't actually fix it then that's a problem.

Does disabling offload with `ethtool` (while leaving `--random-fully` in place) fix things? If so, that suggests that either your kernel doesn't actually have the fix, or else that the patch that was committed doesn't actually fix the bug.

> 5 might be applicable, but this might lead to a question if we really want to add another flag into kube-proxy. I'm not able to answer or decide into this, so will wait for the experts :)

we don't, unless all of the other choices are worse

**Comment by rikatz** [comment]
> Oh? I was assuming everything that didn't use OVS was just using kernel interfaces of type `vxlan`. Is that not what weave and flannel do?

If I get the question correctly the answer is no. Calico, for instance might or might not use vxlan. The default behavior is to not use but there're some cases where it might be enabled by the cluster admin.

A quick search lead me to Cilium being able to use vxlan or geneve (https://docs.cilium.io/en/v1.7/intro/#simple-networking) so I think it's pretty hard to detect. 

We still can take the 'fast path' of checking if the vxlan module is loaded and if so, disable --random-fully by now. But this might lead to incorrect behavior for those who have this module built-in into the kernel and I really don't know how much of the clusters around there are using builtin modules (maybe IoT/Edge cases are the majority).

> @danwinship @rikatz I don't think option 4 will work for myself or @jhohertz at the very least - we're both using Flatcar Linux, and I can confirm that the latest stable version with kernel 4.19.124-flatcar did not fix this issue in my cluster.

@Capitrium  About this, it's worth trying the Flatcar Alpha which is already with Kernel 5.4.41  to check if the future versions of Flatcar still have this behavior.

**Comment by danwinship** [comment]
but 4.19.124 should have the fix... (it's in the release notes for 4.19.123)

**Comment by rikatz** [comment]
OK so the behavior of Flatcar / newer kernels is almost the same, except it's a 1s delay instead of 63s, but I can confirm:

* Disabling tx offloads eliminates the delay
* Enabling tx offloads and disabling --random-fully only from kube-proxy also eliminates the delay

Tested in Flatcar with Kernel 4.19.124

**Comment by rikatz** [comment]
Still about Flatcar Linux with the updated kernel, it seems the 1s delay occurs in the following cases

- NodeA - 172.16.155.175
- NodeB - 172.16.155.177 - Where a NGINX container is running with ServiceIP 10.108.228.135 and also a NodePort 32054

* With the NodeA (outside the container) as the source, it happens when calling the ServiceIP 10.108.228.135 or the NodePort 172.16.155.175:32054. When calling directly the Node running the Pod (172.16.155.177:32054) no delay is found


* From a Pod running in NodeA calling the service of a Pod running in NodeB, the delay only happens when calling the NodePort in NodeA (172.16.155.175:32054) or other node not running the Pod. So here it's strange, **when calling the ServiceIP from inside the Pod running in NodeA that points to a Pod in NodeB no delay is found**

My goal now (if someone gots a better idea) is to check if we might be putting the --random-fully in the wrong place or maybe skipping places that shouldn't be skipped, try to track the difference of the path between the scenario that works that the scenario that doesn't. The question here is: why from inside the Pod to the ClusterIP everything goes fine (even going through a VXLAN interface) and directly from the node it doesn't. It might also explain why from the Pod to the NodePort it gets the delay.

Also here's a tcpdump from source and destination, when the delay occurs. It seems there's a retransmission within 1s and then everything goes fine. 

* source
```
**18:42:06.134524** Out 2a:38:54:62:76:a1 ethertype IPv4 (0x0800), length 76: 192.168.0.0.36943 > 192.168.1.4.80: Flags [S], seq 1501086752, win 64240, options [mss 1460,sackOK,TS val 3512471750 ecr 0,nop,wscale 7], length 0
**18:42:07.174038** Out 2a:38:54:62:76:a1 ethertype IPv4 (0x0800), length 76: 192.168.0.0.36943 > 192.168.1.4.80: Flags [S], seq 1501086752, win 64240, options [mss 1460,sackOK,TS val 3512472790 ecr 0,nop,wscale 7], length 0
18:42:07.175027  In 36:39:b6:17:f1:80 ethertype IPv4 (0x0800), length 76: 192.168.1.4.80 > 192.168.0.0.36943: Flags [S.], seq 1920700001, ack 1501086753, win 64308, options [mss 1410,sackOK,TS val 1573454347 ecr 3512472790,nop,wscale 7], length 0
18:42:07.175209 Out 2a:38:54:62:76:a1 ethertype IPv4 (0x0800), length 68: 192.168.0.0.36943 > 192.168.1.4.80: Flags [.], ack 1, win 502, options [nop,nop,TS val 3512472791 ecr 1573454347], length 0
18:42:07.176350 Out 2a:38:54:62:76:a1 ethertype IPv4 (0x0800), length 146: 192.168.0.0.36943 > 192.168.1.4.80: Flags [P.], seq 1:79, ack 1, win 502, options [nop,nop,TS val 3512472792 ecr 1573454347], length 78: HTTP: GET / HTTP/1.1
18:42:07.177482  In 36:39:b6:17:f1:80 ethertype IPv4 (0x0800), length 68: 192.168.1.4.80 > 192.168.0.0.36943: Flags [.], ack 79, win 502, options [nop,nop,TS val 1573454349 ecr 3512472792], length 0
18:42:07.177797  In 36:39:b6:17:f1:80 ethertype IPv4 (0x0800), length 307: 192.168.1.4.80 > 192.168.0.0.36943: Flags [P.], seq 1:240, ack 79, win 502, options [nop,nop,TS val 1573454350 ecr 3512472792], length 239: HTTP: HTTP/1.1 200 OK
18:42:07.177901 Out 2a:38:54:62:76:a1 ethertype IPv4 (0x0800), length 68: 192.168.0.0.36943 > 192.168.1.4.80: Flags [.], ack 240, win 501, options [nop,nop,TS val 3512472794 ecr 1573454350], length 0
18:42:07.179549  In 36:39:b6:17:f1:80 ethertype IPv4 (0x0800), length 680: 192.168.1.4.80 > 192.168.0.0.36943: Flags [P.], seq 240:852, ack 79, win 502, options [nop,nop,TS val 1573454352 ecr 3512472794], length 612: HTTP
18:42:07.179702 Out 2a:38:54:62:76:a1 ethertype IPv4 (0x0800), length 68: 192.168.0.0.36943 > 192.168.1.4.80: Flags [.], ack 852, win 501, options [nop,nop,TS val 3512472795 ecr 1573454352], length 0
18:42:07.181054 Out 2a:38:54:62:76:a1 ethertype IPv4 (0x0800), length 68: 192.168.0.0.36943 > 192.168.1.4.80: Flags [F.], seq 79, ack 852, win 501, options [nop,nop,TS val 3512472797 ecr 1573454352], length 0
18:42:07.182195  In 36:39:b6:17:f1:80 ethertype IPv4 (0x0800), length 68: 192.168.1.4.80 > 192.168.0.0.36943: Flags [F.], seq 852, ack 80, win 502, options [nop,nop,TS val 1573454355 ecr 3512472797], length 0
18:42:07.182270 Out 2a:38:54:62:76:a1 ethertype IPv4 (0x0800), length 68: 192.168.0.0.36943 > 192.168.1.4.80: Flags [.], ack 853, win 501, options [nop,nop,TS val 3512472798 ecr 1573454355], length 0
```

* destination
```
**18:42:07.156193**  In 2a:38:54:62:76:a1 ethertype IPv4 (0x0800), length 76: 192.168.0.0.36943 > 192.168.1.4.80: Flags [S], seq 1501086752, win 64240, options [mss 1460,sackOK,TS val 3512472790 ecr 0,nop,wscale 7], length 0
18:42:07.156414 Out 6a:2d:1c:ab:17:ab ethertype IPv4 (0x0800), length 76: 192.168.0.0.36943 > 192.168.1.4.80: Flags [S], seq 1501086752, win 64240, options [mss 1460,sackOK,TS val 3512472790 ecr 0,nop,wscale 7], length 0
18:42:07.156434 Out 6a:2d:1c:ab:17:ab ethertype IPv4 (0x0800), length 76: 192.168.0.0.36943 > 192.168.1.4.80: Flags [S], seq 1501086752, win 64240, options [mss 1460,sackOK,TS val 3512472790 ecr 0,nop,wscale 7], length 0
18:42:07.156493   P 1e:74:aa:f3:b7:96 ethertype IPv4 (0x0800), length 76: 192.168.1.4.80 > 192.168.0.0.36943: Flags [S.], seq 1920700001, ack 1501086753, win 64308, options [mss 1410,sackOK,TS val 1573454347 ecr 3512472790,nop,wscale 7], length 0
18:42:07.156493  In 1e:74:aa:f3:b7:96 ethertype IPv4 (0x0800), length 76: 192.168.1.4.80 > 192.168.0.0.36943: Flags [S.], seq 1920700001, ack 1501086753, win 64308, options [mss 1410,sackOK,TS val 1573454347 ecr 3512472790,nop,wscale 7], length 0
18:42:07.156534 Out 36:39:b6:17:f1:80 ethertype IPv4 (0x0800), length 76: 192.168.1.4.80 > 192.168.0.0.36943: Flags [S.], seq 1920700001, ack 1501086753, win 64308, options [mss 1410,sackOK,TS val 1573454347 ecr 3512472790,nop,wscale 7], length 0
18:42:07.157285  In 2a:38:54:62:76:a1 ethertype IPv4 (0x0800), length 68: 192.168.0.0.36943 > 192.168.1.4.80: Flags [.], ack 1, win 502, options [nop,nop,TS val 3512472791 ecr 1573454347], length 0
18:42:07.157492 Out 6a:2d:1c:ab:17:ab ethertype IPv4 (0x0800), length 68: 192.168.0.0.36943 > 192.168.1.4.80: Flags [.], ack 1, win 502, options [nop,nop,TS val 3512472791 ecr 1573454347], length 0
18:42:07.157509 Out 6a:2d:1c:ab:17:ab ethertype IPv4 (0x0800), length 68: 192.168.0.0.36943 > 192.168.1.4.80: Flags [.], ack 1, win 502, options [nop,nop,TS val 3512472791 ecr 1573454347], length 0
18:42:07.158361  In 2a:38:54:62:76:a1 ethertype IPv4 (0x0800), length 146: 192.168.0.0.36943 > 192.168.1.4.80: Flags [P.], seq 1:79, ack 1, win 502, options [nop,nop,TS val 3512472792 ecr 1573454347], length 78: HTTP: GET / HTTP/1.1
18:42:07.158518 Out 6a:2d:1c:ab:17:ab ethertype IPv4 (0x0800), length 146: 192.168.0.0.36943 > 192.168.1.4.80: Flags [P.], seq 1:79, ack 1, win 502, options [nop,nop,TS val 3512472792 ecr 1573454347], length 78: HTTP: GET / HTTP/1.1
18:42:07.158533 Out 6a:2d:1c:ab:17:ab ethertype IPv4 (0x0800), length 146: 192.168.0.0.36943 > 192.168.1.4.80: Flags [P.], seq 1:79, ack 1, win 502, options [nop,nop,TS val 3512472792 ecr 1573454347], length 78: HTTP: GET / HTTP/1.1
18:42:07.158574   P 1e:74:aa:f3:b7:96 ethertype IPv4 (0x0800), length 68: 192.168.1.4.80 > 192.168.0.0.36943: Flags [.], ack 79, win 502, options [nop,nop,TS val 1573454349 ecr 3512472792], length 0
18:42:07.158574  In 1e:74:aa:f3:b7:96 ethertype IPv4 (0x0800), length 68: 192.168.1.4.80 > 192.168.0.0.36943: Flags [.], ack 79, win 502, options [nop,nop,TS val 1573454349 ecr 3512472792], length 0
18:42:07.158599 Out 36:39:b6:17:f1:80 ethertype IPv4 (0x0800), length 68: 192.168.1.4.80 > 192.168.0.0.36943: Flags [.], ack 79, win 502, options [nop,nop,TS val 1573454349 ecr 3512472792], length 0
18:42:07.159054   P 1e:74:aa:f3:b7:96 ethertype IPv4 (0x0800), length 307: 192.168.1.4.80 > 192.168.0.0.36943: Flags [P.], seq 1:240, ack 79, win 502, options [nop,nop,TS val 1573454350 ecr 3512472792], length 239: HTTP: HTTP/1.1 200 OK
18:42:07.159054  In 1e:74:aa:f3:b7:96 ethertype IPv4 (0x0800), length 307: 192.168.1.4.80 > 192.168.0.0.36943: Flags [P.], seq 1:240, ack 79, win 502, options [nop,nop,TS val 1573454350 ecr 3512472792], length 239: HTTP: HTTP/1.1 200 OK
18:42:07.159117 Out 36:39:b6:17:f1:80 ethertype IPv4 (0x0800), length 307: 192.168.1.4.80 > 192.168.0.0.36943: Flags [P.], seq 1:240, ack 79, win 502, options [nop,nop,TS val 1573454350 ecr 3512472792], length 239: HTTP: HTTP/1.1 200 OK
18:42:07.159926  In 2a:38:54:62:76:a1 ethertype IPv4 (0x0800), length 68: 192.168.0.0.36943 > 192.168.1.4.80: Flags [.], ack 240, win 501, options [nop,nop,TS val 3512472794 ecr 1573454350], length 0
18:42:07.160801 Out 6a:2d:1c:ab:17:ab ethertype IPv4 (0x0800), length 68: 192.168.0.0.36943 > 192.168.1.4.80: Flags [.], ack 240, win 501, options [nop,nop,TS val 3512472794 ecr 1573454350], length 0
18:42:07.160818 Out 6a:2d:1c:ab:17:ab ethertype IPv4 (0x0800), length 68: 192.168.0.0.36943 > 192.168.1.4.80: Flags [.], ack 240, win 501, options [nop,nop,TS val 3512472794 ecr 1573454350], length 0
18:42:07.160894   P 1e:74:aa:f3:b7:96 ethertype IPv4 (0x0800), length 680: 192.168.1.4.80 > 192.168.0.0.36943: Flags [P.], seq 240:852, ack 79, win 502, options [nop,nop,TS val 1573454352 ecr 3512472794], length 612: HTTP
18:42:07.160894  In 1e:74:aa:f3:b7:96 ethertype IPv4 (0x0800), length 680: 192.168.1.4.80 > 192.168.0.0.36943: Flags [P.], seq 240:852, ack 79, win 502, options [nop,nop,TS val 1573454352 ecr 3512472794], length 612: HTTP
18:42:07.160939 Out 36:39:b6:17:f1:80 ethertype IPv4 (0x0800), length 680: 192.168.1.4.80 > 192.168.0.0.36943: Flags [P.], seq 240:852, ack 79, win 502, options [nop,nop,TS val 1573454352 ecr 3512472794], length 612: HTTP
18:42:07.161926  In 2a:38:54:62:76:a1 ethertype IPv4 (0x0800), length 68: 192.168.0.0.36943 > 192.168.1.4.80: Flags [.], ack 852, win 501, options [nop,nop,TS val 3512472795 ecr 1573454352], length 0
18:42:07.162099 Out 6a:2d:1c:ab:17:ab ethertype IPv4 (0x0800), length 68: 192.168.0.0.36943 > 192.168.1.4.80: Flags [.], ack 852, win 501, options [nop,nop,TS val 3512472795 ecr 1573454352], length 0
18:42:07.162116 Out 6a:2d:1c:ab:17:ab ethertype IPv4 (0x0800), length 68: 192.168.0.0.36943 > 192.168.1.4.80: Flags [.], ack 852, win 501, options [nop,nop,TS val 3512472795 ecr 1573454352], length 0
18:42:07.163086  In 2a:38:54:62:76:a1 ethertype IPv4 (0x0800), length 68: 192.168.0.0.36943 > 192.168.1.4.80: Flags [F.], seq 79, ack 852, win 501, options [nop,nop,TS val 3512472797 ecr 1573454352], length 0
18:42:07.163305 Out 6a:2d:1c:ab:17:ab ethertype IPv4 (0x0800), length 68: 192.168.0.0.36943 > 192.168.1.4.80: Flags [F.], seq 79, ack 852, win 501, options [nop,nop,TS val 3512472797 ecr 1573454352], length 0
18:42:07.163325 Out 6a:2d:1c:ab:17:ab ethertype IPv4 (0x0800), length 68: 192.168.0.0.36943 > 192.168.1.4.80: Flags [F.], seq 79, ack 852, win 501, options [nop,nop,TS val 3512472797 ecr 1573454352], length 0
18:42:07.163653   P 1e:74:aa:f3:b7:96 ethertype IPv4 (0x0800), length 68: 192.168.1.4.80 > 192.168.0.0.36943: Flags [F.], seq 852, ack 80, win 502, options [nop,nop,TS val 1573454355 ecr 3512472797], length 0
18:42:07.163653  In 1e:74:aa:f3:b7:96 ethertype IPv4 (0x0800), length 68: 192.168.1.4.80 > 192.168.0.0.36943: Flags [F.], seq 852, ack 80, win 502, options [nop,nop,TS val 1573454355 ecr 3512472797], length 0
18:42:07.163782 Out 36:39:b6:17:f1:80 ethertype IPv4 (0x0800), length 68: 192.168.1.4.80 > 192.168.0.0.36943: Flags [F.], seq 852, ack 80, win 502, options [nop,nop,TS val 1573454355 ecr 3512472797], length 0
18:42:07.164240  In 2a:38:54:62:76:a1 ethertype IPv4 (0x0800), length 68: 192.168.0.0.36943 > 192.168.1.4.80: Flags [.], ack 853, win 501, options [nop,nop,TS val 3512472798 ecr 1573454355], length 0
18:42:07.164415 Out 6a:2d:1c:ab:17:ab ethertype IPv4 (0x0800), length 68: 192.168.0.0.36943 > 192.168.1.4.80: Flags [.], ack 853, win 501, options [nop,nop,TS val 3512472798 ecr 1573454355], length 0
18:42:07.164430 Out 6a:2d:1c:ab:17:ab ethertype IPv4 (0x0800), length 68: 192.168.0.0.36943 > 192.168.1.4.80: Flags [.], ack 853, win 501, options [nop,nop,TS val 3512472798 ecr 1573454355], length 0
```

**Comment by MikeSpreitzer** [comment]
@MikeSpreitzer

**Comment by zigmund** [comment]
I've checked if workaround `ethtool --offload flannel.1 rx off tx off` is applicable for my issue (https://github.com/kubernetes/kubernetes/issues/76699, flannel, host-gw) - no difference.

**Comment by tommasopozzetti** [comment]
We have also been wrestling with this bug. We use calico with VXLAN, but the issue is precisely the same and seems to be related mostly to the vxlan interface and not really to flannel/calico. I did some digging and I found the following info, hopefully it can be useful to figure out a solution:

As others have mentioned, the 1 second delay seems to derive from a retransmission of the SYN packet when setting up the TCP connection to a service clusterIP.

By inspecting the packets on the network and in the hosts, I found that the packet actually makes it to the other end of the VXLAN tunnel (the encapsulated packet is received by the destination host) but gets dropped by the receiving vxlan interface, most likely due to the UDP checksum issue.

The reason why this is only seen on certain configurations (for example when hitting a nodePort or when establishing the connection from within a host networked pod/a host node but not from within a non-host networked pod) is due to the source IP and the following iptables rules in the `nat` table (these are for a system with kube-proxy set in ipvs mode but similar rules are present for kube-proxy in iptables mode, they are just less aggregated):
```
-A KUBE-NODE-PORT -p tcp -m comment --comment "Kubernetes nodeport TCP port for masquerade purpose" -m set --match-set KUBE-NODE-PORT-TCP dst -j KUBE-MARK-MASQ
-A KUBE-SERVICES ! -s <pod_ip_range> -m comment --comment "Kubernetes service cluster ip + port for masquerade purpose" -m set --match-set KUBE-CLUSTER-IP dst,dst -j KUBE-MARK-MASQ
```

The `KUBE-MARK-MASQ` target marks the packet so that it will perform SNAT in the `POSTROUTING` table using the `--random-fully` flag.

What seems to be happening, is that when such rules are hit for a packet that will need to go through a VXLAN tunnel, the `0x4000` mark is attached to the packet and persists with it in the kernel even after the packet has been routed to the vxlan interface and incapsulated in the UDP packet from source host to destination host. This causes the `POSTROUTING` rules to actually perform a further SNAT operation on the UDP packet leaving the host.
Here is when things seem to line up to create the issue: because the packet actually already has as source IP the IP of the host, this SNAT should not be needed (and the source IP will not change if it is performed). The source port could be changed, but normally the same original port is tried first and, given that it will normally be available, it is not changed so the SNAT becomes a no-op. Because of `--random-fully`, however, the port is always changed, which causes this SNAT to actually only change the source port. This is however enough to require recalculation of the UDP checksum, which seems to hit the bug that will cause the packet to be discarded by the receiving vxlan interface.

A few changes which seem to have eliminated the 1 second delay:
1) Disabling offload on the vxlan interface, which seems to cause the UDP checksum to be recalculated correctly without hitting this bug
2) Adding an iptables rule at the top of the `OUTPUT` chain in the `nat` table to clear the `0x4000` mark for VXLAN UDP packets leaving the host. This seems to avoid the useless SNAT which changes the source port and forces a UDP checksum recalculation, and it seems to remove the 1 second delay. This is the solution we have adopted for now and it seems to be working correctly:
```
-A OUTPUT -p udp -m udp --dport 8472 -j MARK --set-xmark 0x0
```
3) Modify the iptables rules that set the `0x4000` mark on packets to avoid doing so not only for source IPs in the pod ip range but also from the host IP itself. I'm not sure if this can have further implications on other functionalities, but it seems reasonable that if the source IP is that of the host itself, there should be no reason to mark the packet for performing SNAT to begin with. This would allow treating host-networked pods the same way non-host-networked pods are treated. I have only quickly tested this solution by creating an ipset and using it in the rule for clusterIPs and it seems to have eliminated the delay, but I did not test it cluster-wide nor for nodePort (even though I assume it would be the same applied to the other iptables rule).

**Comment by danwinship** [comment]
> What seems to be happening, is that when such rules are hit for a packet that will need to go through a VXLAN tunnel, the `0x4000` mark is attached to the packet and persists with it in the kernel even after the packet has been routed to the vxlan interface and incapsulated in the UDP packet from source host to destination host. This causes the `POSTROUTING` rules to actually perform a further SNAT operation on the UDP packet leaving the host.

Great catch.

I've filed #92035, which changes `KUBE-POSTROUTING` to remove the mark before masquerading the packet, which I think should also fix this. Are you able to test that PR out?

**Comment by rikatz** [comment]
To everybody following this issue, @danwinship made a PR that solved the problem (thank you Dan!)

I'm asking SIG Release to cherry pick this to current supported versions (1.18, 1.17 and 1.16) so soon, if approved there will be a new Kubernetes minor release for each of them solving this problem.

Thank you all for the patience, for providing information and helping solving this!

**Comment by therealbubbasour** [comment]
thx @rikatz @davesargrad . I experience a very similar issue on K3s and I've tried to report it (https://www.reddit.com/r/rancher/comments/hcfnkv/k3s_64s_delay_accessing_a_service_on_nodeport/). Is there a way I can incorporate this fix, or would I have to wait for the K3s community to build a new release?

**Comment by MarkRose** [comment]
It looks like it won't be part of a release until mid-July.

**Comment by davesargrad** [comment]
@therealbubbasour glad to see you found this issue.. @rikatz and others have done an excellent job of consolidating all many disparate reports that relate to this, under this. I've been monitoring the progress all along. I feel that we are close. 

I found that I spent a lot of time up front isolating the problem and eliminating elements. It took me a lot of learning about k8s, to finally get to the point where I knew I had found and reasonably isolated that crucial problem.

Stay tuned.

**Comment by therealbubbasour** [comment]
Hi @davesargrad, I'm not 100pct sure this is my problem, but I suspect it as the behavior with delay with requests to NodePorts is in the same roundabouts. However, I haven't seen or experienced anything alike in the past.

I had a quick look at the patch and it seems rather complicated, is there any temporary solution/workaround I can do to be able to proceed with my metallb/k3s learnings? If I'm not mistaken the K3s dist is binaries, so it may not be possible to patch for testing purposes unless there's a nightly build or similar that I can install.

**Comment by davesargrad** [comment]
@rikatz I am not sure it actually makes sense to close this issue, until a test is run to verify that it truly is gone. I do see the other issue that has been written, that hopefully will drive the resolution. However, I'd recommend closing this issue, only once a final test has proven the fix.

**Comment by therealbubbasour** [comment]
I deleted the SVC of type LoadBalancer and tried to hit both direct PodIP and ClusterIP.

Directly hitting **PodIP** is obviously the fastest: **0m0.019s** to render nginx landing page.
Given a service with type **ClusterIP** 5 endpoints (nodes) all on the same LAN, it takes significantly more time: **0m1.044s**.

Even if a forwarding may happen in iptables by kube-proxy, still 1.sec+ seems too high. Could this also have been caused by this bug? The traffic will need to traverse the tunnel to hit the endpoints, and if I'm not mistaken its Flannel with VXLAN on K3s by default.
Is this something you've tested on your end?
@davesargrad

**Comment by therealbubbasour** [comment]
I changed Flannel backend from vxlan to host-gw and the problems with floods of checksum errors and delay in svc/nodeport responses seem to be completely gone now.
Hitting a service/nodeport now to render nginx landing page takes 0.03s.

**Comment by danwinship** [comment]
Note that the problem can also be (mostly) worked around by upgrading to a kernel with the checksum fix (https://github.com/kubernetes/kubernetes/issues/88986#issuecomment-635367089) or by disabling checksum offload on the relevant network interfaces (eg, https://github.com/kubernetes/kubernetes/issues/88986#issuecomment-601506516 gives the command for flannel; some of the other xref'ed bugs may give the exact commands for other plugins if you can't figure it out).

**Comment by brettjenkins** [comment]
Could this be the cause of this issue I'm seeing? I'm new to K8s/flannel/MetalLB so it's possible I've done something stupid

OS: Freshly installed Ubuntu 18.04 LS

MetalLB: v0.9.3

Fresh installation of k8s via kubeadm - 3 node cluster, 1 master, 2 nodes.
BCP mode connected to pfsense using openbgpd

Flannel: v0.12.0-amd64

K8s version: v.1.18.4

Kube-Proxy has been set to ipvs mode with strict on

I've also switched off offloading, which hasn't fixed my issue. CURLing the service cluster IP from within a node is instant (after the offloading fix, before it could take up to a second)

I have deployed ngnix-hello with a replica of 3, which is a simple app which shows the current server and allows constant refreshing - but I have also checked with latest ngnix and had the same issue.

As can be seen from fiddler, most requests are fast. But every 20 or so requests it can take 20-30 seconds to respond. Usually when it has responded the page is then reporting it's coming from a different pod. Accessing the pods via NodePort works fine, not seeing this slowdown once, even when the request gets routed to a different pod from the previous request.

![image](https://user-images.githubusercontent.com/1395855/85585537-fe0ddf80-b637-11ea-9618-7ab7844c1291.png)

Is this related to this bug or is it something else? Any advice on what I could try?

**Comment by therealbubbasour** [comment]
Does it help to change Flannel backend from vxlan to to host-gw in your deployment? In my case that was a workaround that resolved the problem at hand with delays. @brettjenkins

**Comment by brettjenkins** [comment]
What are the steps to do this @therealbubbasour ?

**Comment by therealbubbasour** [comment]
I don't have a PhD in Kubernetes, so I use K3s which is very easy to get up and running. Please have a look [here](https://rancher.com/docs/k3s/latest/en/installation/network-options/). You just set this on the master for deployment which is one liner discussed [here](https://rancher.com/docs/k3s/latest/en/quick-start/).

These arguments may be relevant:
```
$ export K3S_KUBECONFIG_MODE="644"
$ export INSTALL_K3S_EXEC="--no-deploy servicelb --no-deploy traefik --flannel-backend=host-gw"
```

**Comment by raz3k** [comment]
Unfortunately for me, running on centos 8 the issue still reproduces with a delay of 63 seconds.
I'm using the latest centos 8.2 qcow image, upgraded to latest and Kubernetes 1.18.8, i can immediately access the nodeport (using flannel 0.12 btw) after running `/sbin/ethtool -K flannel.1 tx-checksum-ip-generic off`

**Comment by danwinship** [comment]
hm... did you reboot after updating kubernetes? I guess if you just stopped the old kubelet and then started the new kubelet (without rebooting), then the new kubelet would append the new iptables rules after the existing bad old iptables rules so they wouldn't have any effect...

If so, then stopping kubelet, running `iptables -F KUBE-POSTROUTING`, and then starting kubelet again should fix it. (Let us know... we might want to do another update. Or at least a release note.)

**Comment by raz3k** [comment]
It's a scratch install.

**Comment by davesargrad** [comment]
I also still have the problem with the centos 8 and the latest k8s. Still not sure why this issue has been closed.

**Comment by danwinship** [comment]
can you do `iptables-save` on a system experiencing the problem and put it in a pastebin or a gist. (Or I guess you can attach files to github issues? Just don't paste the whole thing into a comment)

Also, is this with iptables kube-proxy or something else?

**Comment by raz3k** [comment]
Sure, https://pastebin.com/fHzrU0bT

I noticed the last line and the fact that I don't have the tool; installed is `iptables v1.8.4 (nf_tables)`
`# Warning: iptables-legacy tables present, use iptables-legacy-save to see them` not sure if that is a problem or not.

**Comment by hakman** [comment]
@raz3k Having both legacy and nft rules it's a problem. From the nftables [wiki](https://wiki.nftables.org/wiki-nftables/index.php/Moving_from_iptables_to_nftables):
> Beware of using both the nft and the legacy tools at the same time. That means using both x_tables and nf_tables kernel subsystems at the same time, and could lead to unexpected results.

I am not sure the [script](https://github.com/kubernetes/release/blob/master/images/build/debian-iptables/buster/iptables-wrapper) that detects the iptables flavour correctly in this case. There is a case there where in the end it defaults to legacy if no rules exist.

One of the workarounds I had to do at one point was to enable Docker iptables so that it adds some rules in the NFT table.

**Comment by raz3k** [comment]
To be honest, it was a scratch install on a centos 8.2 qcow image, so I did not do anything special to iptables.

**Comment by hakman** [comment]
I did a bit of digging and tracked the issue to flannel. kube-proxy adds the rules correctly to NFT, but flannel adds them its rules to the Legacy table, hence the message you are seeing.

I think the issue is on the flannel side and this issue for it https://github.com/coreos/flannel/issues/1306.

**Comment by raz3k** [comment]
Thanks! I can confirm that running on centos 8 with flannel-git:v0.12.0-34-g8936e90-amd64 (which is the latest build from master) nodeport now works correctly.

**Comment by jiuchen1986** [comment]
Hi, we had similar issues recently, and one thing I don't understand is that why the packet finally gets through after 63 sec, instead of blocked forever. What kind of vxlan bug is it here? Many thanks!

**Comment by davesargrad** [comment]
@danwinship 

Hi Dan. I see that the [1.18 release](https://github.com/kubernetes/kubernetes/blob/master/CHANGELOG/CHANGELOG-1.18.md#changes-by-kind) had a fix that relates to this issue. 

I've just set up a new 1.20 cluster, and I see problems that remind me of the flakiness that led me to spending about a week of time isolating this. I fear diving into another week long investigation and am looking for some guidance before I do.

I'd love your [comments and guidance](https://github.com/projectcalico/calico/issues/3145#issuecomment-815731147), since it seems to me like this issue still lurks, and its not clear how to avoid the problem.

I have the flexibility to reconfigure my entire cluster. I can use a different operating system. I can use any CNI. I can follow whatever guidance I am provided. Right now its just not clear to me where to go to avoid this problem without significant investment in time.
