### ISSUE TITLE
calico plugin kube-dns can't access api-server

### ISSUE THREAD

**Issue by gogeof** [kubernetes/kubernetes#54922]
**Is this a BUG REPORT or FEATURE REQUEST?**:
/kind bug

**What happened**:
> k8s_kubedns_kube-dns container keep restart
>> kube-dns-545bc4bfd4-dv78m                         1/3       CrashLoopBackOff   55         1h
>>
> the host calico interface show this message: 
```
# tcpdump -i cali1d722ccd663
tcpdump: verbose output suppressed, use -v or -vv for full protocol decode
listening on cali1d722ccd663, link-type EN10MB (Ethernet), capture size 262144 bytes
16:06:49.289194 ARP, Request who-has 169.254.1.1 tell bogon, length 28
16:06:50.285878 ARP, Request who-has 169.254.1.1 tell bogon, length 28
16:06:51.489123 ARP, Request who-has 169.254.1.1 tell bogon, length 28
16:06:52.385843 ARP, Request who-has 169.254.1.1 tell bogon, length 28
``` 
>>
> kube-dns logs is like this:
>> docker logs -f 6f397e2677f4
```
I1101 08:54:52.699258       1 dns.go:174] Waiting for services and endpoints to be initialized from apiserver...
I1101 08:54:53.199184       1 dns.go:174] Waiting for services and endpoints to be initialized from apiserver...
E1101 08:54:53.210286       1 reflector.go:199] k8s.io/dns/vendor/k8s.io/client-go/tools/cache/reflector.go:94: Failed to list *v1.Service: Get https://10.96.0.1:443/api/v1/services?resourceVersion=0: dial tcp 10.96.0.1:443: getsockopt: no route to host
E1101 08:54:53.210308       1 reflector.go:199] k8s.io/dns/vendor/k8s.io/client-go/tools/cache/reflector.go:94: Failed to list *v1.Endpoints: Get https://10.96.0.1:443/api/v1/endpoints?resourceVersion=0: dial tcp 10.96.0.1:443: getsockopt: no route to host
I1101 08:54:53.699174       1 dns.go:174] Waiting for services and endpoints to be initialized from apiserver...
I1101 08:54:54.199199       1 dns.go:174] Waiting for services and endpoints to be initialized from apiserver...
```

**What you expected to happen**:
> kube-dns is working
>> kube-dns-545bc4bfd4-dv78m                         3/3       0   0         1h

**How to reproduce it (as minimally and precisely as possible)**:
> I use kubeadm to install k8s, and install calico plugin by this command:
>> "kubectl apply -f https://docs.projectcalico.org/v2.6/getting-started/kubernetes/installation/hosted/kubeadm/1.6/calico.yaml"
>>
> have already disable firewalld, enable bridge, accept forward in iptables
>> ufw status
>> Status: inactive
>>
>> sysctl -p
>> ... 
>> net.bridge.bridge-nf-call-iptables = 1
>> net.bridge.bridge-nf-call-ip6tables = 1
>>
>> iptables -L
>> ...
>> Chain FORWARD (policy ACCEPT)
>> ...

**Anything else we need to know?**:
> I have check calico document, and it says that container will use  169.254.1.1 as default eth0 ip, and open calico interface proxy_arp as true, then the message from container will send to host interface as default, but it seems not working sometimes.
> I compare the working's container and not workings', but they're same:
>> cat /proc/sys/net/ipv4/conf/caliXXX/proxy_arp 
>> 1

**Environment**:
- Kubernetes version (use `kubectl version`): v1.8.2
- Cloud provider or hardware configuration:none
- OS (e.g. from /etc/os-release):ubuntu 16.04
- Kernel (e.g. `uname -a`):Linux m-usingle-192-168-4-107 4.4.0-96-generic #119-Ubuntu SMP Tue Sep 12 14:59:54 UTC 2017 x86_64 x86_64 x86_64 GNU/Linux
- Install tools:kubeadm
- Others:calico v1.6

**sig**:
/sig network

**Comment by gogeof** [comment]
@kubernetes/sig-network

**Comment by cmluciano** [comment]
cc @caseydavenport

**Comment by gogeof** [comment]
@cmluciano @caseydavenport
I'm sorry, it's my mistake. I have copy one old 10-calico.conf into /etc/cni/net.d/10-calico.conf befault create calico plugin. It seems calico plugin has initialised by reading this old one sometimes. After calico pod start, it will generate a new one 10-calico.conf and overwrite the old one, so I have spent a long time to find out my mistake.
