### ISSUE TITLE
Not all pods can connect each other from defferent nodes

### ISSUE THREAD

**Issue by SmartLyu** [kubernetes/kubernetes#72422]
Each node and pod are capable of running normally, and all nodes can be connected to the pod_IP of dns. The nginx service utilizes NodePort, but only a few nodes can have access to nginx through their ports.

**What happened**:
kubectl get svc
default service/nginx NodePort 10.96.78.39 80:31781/TCP 63m app=nginx,tier=backend

curl -v --connect-timeout 10 http://hostname:31781
172.16.0.216 : ok=2 changed=1 unreachable=0 failed=0
172.16.0.217 : ok=1 changed=0 unreachable=0 failed=1
172.16.0.218 : ok=1 changed=0 unreachable=0 failed=1
172.16.0.219 : ok=2 changed=1 unreachable=0 failed=0
172.16.0.220 : ok=2 changed=1 unreachable=0 failed=0
172.16.0.223 : ok=1 changed=0 unreachable=0 failed=1
172.16.0.224 : ok=2 changed=1 unreachable=0 failed=0
172.16.0.237 : ok=1 changed=0 unreachable=0 failed=1

As we can see, only a few nodes can be accessed through the specified Node_Port, which is apparently abnormal, thus I utilize the type of Node Port

**What you expected to happen**:
All nodes can be accessed through the specified Node_Port, rather than just a few irregular nodes.
**How to reproduce it (as minimally and precisely as possible)**:

**Anything else we need to know?**:
ssh 172.16.0.237 'tcpdump -i tunl0'
tcpdump: verbose output suppressed, use -v or -vv for full protocol decode
listening on tunl0, link-type RAW (Raw IP), capture size 262144 bytes

11:12:23.449434 IP JH-Api-JHCloudSH-Kubernate-Master1.38116 > 10.96.75.5.http: Flags [S], seq 532698513, win 43690, options [mss 65495,sackOK,TS val 5635621 ecr 0,nop,wscale 7], length 0
11:12:24.451578 IP JH-Api-JHCloudSH-Kubernate-Master1.38116 > 10.96.75.5.http: Flags [S], seq 532698513, win 43690, options [mss 65495,sackOK,TS val 5636624 ecr 0,nop,wscale 7], length 0
11:12:26.455585 IP JH-Api-JHCloudSH-Kubernate-Master1.38116 > 10.96.75.5.http: Flags [S], seq 532698513, win 43690, options [mss 65495,sackOK,TS val 5638628 ecr 0,nop,wscale 7], length 0

ssh 172.16.0.220 'tcpdump -i tunl0'
tcpdump: verbose output suppressed, use -v or -vv for full protocol decode
listening on tunl0, link-type RAW (Raw IP), capture size 65535 bytes

Through package capturing analysis, we can find that the data package was sent from the tunnel, but the other server system cannot receive it. In this case, there are only a few servers systems suffering from this condition. Oddly, it is unsuccessful from server A to server B, but from server B to server A can actually work properly. According to these operating problems, I think that it is not reasonable.

After a package is sent through a tunnel and forwarded through iptables, The node with specified IP should be able to make the response.
**Environment**:
- Kubernetes version (use `kubectl version`):
kubernetes version: 1.13.1
- Cloud provider or hardware configuration:
- OS (e.g. from /etc/os-release):
CentOS Linux release 7.3.1611
- Kernel (e.g. `uname -a`):
Linux Kubernate-Master2 3.10.0-514.el7.x86_64 #1 SMP Tue Nov 22 16:42:41 UTC 2016 x86_64 x86_64 x86_64 GNU/Linux
- Install tools:
- Others:
Calico version
version: 3.4.0
Image: quay.io/calico/cni:v3.4.0

/kind bug

**Comment by Shnatsel** [comment]
@kubernetes/sig-network-bugs

**Comment by himanshurajput32** [comment]
@SmartLyu 
I am facing a similar issue with NodePort. 
https://github.com/kubernetes/kubernetes/issues/72712

Any help would be appreciated.
