### ISSUE TITLE
[sig-network] Conntrack proxy implementation should not be vulnerable to the invalid conntrack state bug [Privileged] failing due to bug in test

### ISSUE THREAD

**Issue by arkadeepsen** [kubernetes/kubernetes#134116]
### Description

`[sig-network] Conntrack proxy implementation should not be vulnerable to the invalid conntrack state bug [Privileged]` has been historically flaking in downstream OpenShift CI jobs. However, the flakes were very random and couldn't be easily reproduced for debugging.

### Details

As per the test [details](https://github.com/kubernetes/kubernetes/blob/f9a55d78c773fb4fa4a586919d4eff6b4a59c4f9/test/e2e/network/conntrack.go#L544-L668), the test should pass if `nf_conntrack_tcp_be_liberal` is enforced. The test expects that when the server sends an out-of-window TCP packet, it should either be dropped or should be correctly NAT-ed and forwarded to the client. The test fails when the server receives an RST packet from the client which is expected happen when the out-of-window packet is not dropped and also not correctly NAT-ed.

OpenShift uses OVN-Kubernetes CNI and `nf_conntrack_tcp_be_liberal` is always [enforced](https://github.com/torvalds/linux/blob/5aca7966d2a7255ba92fd5e63268dd767b223aa5/net/openvswitch/conntrack.c#L832). Thus, the issue of incorrect NAT should not arise. However, the test still randomly flaked because the server had received an RST packet from the client.

Recently, we took an effort to understand the reason why the test was flaking. For reproducing the issue, the test was run for longer duration of time and packets were captured. The test eventually did fail, however looking at the packet captures it became evident the test failed due to an incorrect logic in the server code, instead of incorrect packet NAT.

Packet capture at the client side:
```
9715    2025-09-09 16:58:37.217654    10.129.0.42    172.30.47.170    TCP    74    36955 → 9000 [SYN] Seq=0 Win=62027 Len=0 MSS=8861 SACK_PERM TSval=3989781034 TSecr=0 WS=128
9716    2025-09-09 16:58:37.217933    172.30.47.170    10.129.0.42    TCP    74    9000 → 36955 [SYN, ACK] Seq=0 Ack=1 Win=61943 Len=0 MSS=8861 SACK_PERM TSval=1962462568 TSecr=3989781034 WS=128
9717    2025-09-09 16:58:37.217952    10.129.0.42    172.30.47.170    TCP    66    36955 → 9000 [ACK] Seq=1 Ack=1 Win=62080 Len=0 TSval=3989781034 TSecr=1962462568
9718    2025-09-09 16:58:37.217965    10.129.0.42    172.30.47.170    TCP    66    36955 → 9000 [FIN, ACK] Seq=1 Ack=1 Win=62080 Len=0 TSval=3989781034 TSecr=1962462568
9719    2025-09-09 16:58:37.218255    172.30.47.170    10.129.0.42    TCP    61    [TCP Spurious Retransmission] 9000 → 36955 [PSH, ACK] Seq=4294867297 Ack=1 Win=62080 Len=7
9720    2025-09-09 16:58:37.218262    10.129.0.42    172.30.47.170    TCP    78    [TCP Dup ACK 9717#1] 36955 → 9000 [ACK] Seq=2 Ack=1 Win=62080 Len=0 TSval=3989781035 TSecr=1962462568 SLE=4294867297 SRE=4294867304
9721    2025-09-09 16:58:37.218435    172.30.47.170    10.129.0.42    TCP    66    9000 → 36955 [ACK] Seq=1 Ack=2 Win=61952 Len=0 TSval=1962462569 TSecr=3989781034
9802    2025-09-09 16:58:47.218027    10.129.0.42    172.30.47.170    TCP    74    38949 → 9000 [SYN] Seq=0 Win=62027 Len=0 MSS=8861 SACK_PERM TSval=3989791034 TSecr=0 WS=128
9803    2025-09-09 16:58:47.218454    172.30.47.170    10.129.0.42    TCP    66    9000 → 36955 [FIN, ACK] Seq=1 Ack=2 Win=61952 Len=0 TSval=1962472569 TSecr=3989781034
9804    2025-09-09 16:58:47.218469    10.129.0.42    172.30.47.170    TCP    66    36955 → 9000 [ACK] Seq=2 Ack=2 Win=62080 Len=0 TSval=3989791035 TSecr=1962472569
9805    2025-09-09 16:58:47.218507    172.30.47.170    10.129.0.42    TCP    74    9000 → 38949 [SYN, ACK] Seq=0 Ack=1 Win=61943 Len=0 MSS=8861 SACK_PERM TSval=1962472569 TSecr=3989791034 WS=128
9806    2025-09-09 16:58:47.218520    10.129.0.42    172.30.47.170    TCP    66    38949 → 9000 [ACK] Seq=1 Ack=1 Win=62080 Len=0 TSval=3989791035 TSecr=1962472569
9807    2025-09-09 16:58:47.218538    10.129.0.42    172.30.47.170    TCP    66    38949 → 9000 [FIN, ACK] Seq=1 Ack=1 Win=62080 Len=0 TSval=3989791035 TSecr=1962472569
9808    2025-09-09 16:58:47.218956    172.30.47.170    10.129.0.42    TCP    61    [TCP Spurious Retransmission] 9000 → 36955 [PSH, ACK] Seq=4294867298 Ack=2768753007 Win=62080 Len=7
9809    2025-09-09 16:58:47.218972    10.129.0.42    172.30.47.170    TCP    66    [TCP Dup ACK 9804#1] 36955 → 9000 [ACK] Seq=2 Ack=2 Win=62080 Len=0 TSval=3989791035 TSecr=1962472569
9810    2025-09-09 16:58:47.219013    172.30.47.170    10.129.0.42    TCP    66    9000 → 38949 [ACK] Seq=1 Ack=2 Win=61952 Len=0 TSval=1962472570 TSecr=3989791035
9816    2025-09-09 16:58:47.219432    172.30.47.170    10.129.0.42    TCP    54    9000 → 36955 [RST] Seq=2 Win=0 Len=0
9817    2025-09-09 16:58:47.219435    172.30.47.170    10.129.0.42    TCP    61    [TCP Spurious Retransmission] 9000 → 36955 [PSH, ACK] Seq=4294867298 Ack=2567795282 Win=62080 Len=7
9818    2025-09-09 16:58:47.219445    10.129.0.42    172.30.47.170    TCP    54    36955 → 9000 [RST] Seq=2567795282 Win=0 Len=0
9888    2025-09-09 16:58:57.219418    172.30.47.170    10.129.0.42    TCP    66    9000 → 38949 [FIN, ACK] Seq=1 Ack=2 Win=61952 Len=0 TSval=1962482570 TSecr=3989791035
9889    2025-09-09 16:58:57.219444    10.129.0.42    172.30.47.170    TCP    66    38949 → 9000 [ACK] Seq=2 Ack=2 Win=62080 Len=0 TSval=3989801036 TSecr=1962482570
```
9719 16:58:37 - Invalid packet injected as part of the test(should be the only one) to the client on port 36955
9802 16:58:47 - The client initiates a new connection on port 38949
9803 16:58:47 - The server closes the connection with 36955 after 10s as part of the test and the client ACKs it in 9804
9808 16:58:47 - Invalid packet injected to the client on port 36955 - BUG, this should not happen, it should be sent to 38949
9817 16:58:47 - Same thing happens again
9818 16:58:47 - The client is not happy with that because the connection was already closed, it sends RST to the server (using the clusterIP) because the connection was already closed

Looking at the [server code](https://github.com/kubernetes/kubernetes/blob/f9a55d78c773fb4fa4a586919d4eff6b4a59c4f9/test/images/regression-issue-74839/main.go) the bugs becomes apparent:
1. SYN from 36955 adds 10.129.0.42 to the `pending` map
2. ACK from 36955 causes the invalid packet to be injected to that connection and 10.129.0.42 is removed from the `pending` map
3. SYN from 38949 adds 10.129.0.42 to the `pending` map again
4. ACK to from 36955(pkt 9804)  causes the invalid packet to be injected again which is not correct

### Expected behavior

The server should not re-inject the out-of-window packet for an already closed connection.

### Expected fix

The fix should be to key the `pending` map by IP+ClientPort instead of the only the IP. This will ensure that packets are not injected for any closed connections.

Thanks to @kyrtapz for reproducing the issue and debugging it.

/kind bug

/sig network

**Comment by aojea** [comment]
/triage accepted

great analysis. please send the fix so we can release a new image of agnhost without this problem

**Comment by tssurya** [comment]
@arkadeepsen : Thanks for driving this forward!
Please add  @kyrtapz as a co-author to the commit.
Thanks both for taking care of this flake
