### ISSUE TITLE
ClusterIP connections Reset (RST) after SYN-ACK

### ISSUE THREAD

**Issue by andreas-ibm** [kubernetes/kubernetes#122174]
### What happened?

First off, apologies if this is due a n00b error, but I've now spent a whole day trying to debug and it's smelling more and more like a bug.
So my cluster was rebooted over the weekend (1 main, 4 worker nodes) and now pods can't talk to each other via a ClusterIP. At first I thought it was an iptables issue so I enabled TRACE on one of the connections and saw the rewrites ok, I then took a closer look at the tcpdump and saw:
```
08:27:37.285092 2a:c7:37:d7:2e:07 > 4e:7d:69:53:97:61, ethertype IPv4 (0x0800), length 74: 10.244.1.192.41934 > 10.103.175.29.7800: Flags [S], seq 1909400407, win 64860, options [mss 1410,sackOK,TS val 1284243871 ecr 0,nop,wscale 7], length 0
08:27:37.285153 4e:7d:69:53:97:61 > 92:dc:e0:5d:fb:15, ethertype IPv4 (0x0800), length 74: 10.244.1.192.41934 > 10.244.1.189.7800: Flags [S], seq 1909400407, win 64860, options [mss 1410,sackOK,TS val 1284243871 ecr 0,nop,wscale 7], length 0
08:27:37.285181 92:dc:e0:5d:fb:15 > 2a:c7:37:d7:2e:07, ethertype IPv4 (0x0800), length 74: 10.244.1.189.7800 > 10.244.1.192.41934: Flags [S.], seq 85460671, ack 1909400408, win 64308, options [mss 1410,sackOK,TS val 579217548 ecr 1284243871,nop,wscale 7], length 0
08:27:37.285196 2a:c7:37:d7:2e:07 > 92:dc:e0:5d:fb:15, ethertype IPv4 (0x0800), length 54: 10.244.1.192.41934 > 10.244.1.189.7800: Flags [R], seq 1909400408, win 0, length 0
```
this is a conversation between pod 1 (2a:c7:37:d7:2e:07 / 10.244.1.192) and pod 2 (92:dc:e0:5d:fb:15 / 10.244.1.189) via a ClusterIP service (10.103.175.29). Port 7800 is an http service that pod 2 is listening on.
They are both on worker-3 which has :
```
 ip -o l | grep 4e:7d:69:53:97:61
4: cni0: <BROADCAST,MULTICAST,UP,LOWER_UP> mtu 1450 qdisc noqueue state UP mode DEFAULT group default qlen 1000\    link/ether 4e:7d:69:53:97:61 brd ff:ff:ff:ff:ff:ff
```
i.e. the initial SYN between pod 1 and ClusterIP went to the cni0 on the worker, this gets bounced to pod 2, which SYN-ACKs direct to pod 1.  Which from reading lots of other issues (there were all closed with no resolution...) is apparently a Bad Thing and is what's causing pod 1 to RST the connection.

### What did you expect to happen?

I expected pod 1 -> ClusterIP -> pod 2 conversation to work.
Note external ingress -> ClusterIP -> pod 2 does work (standard HTTP traffic)

### How can we reproduce it (as minimally and precisely as possible)?

I don't know, it wasn't like this before but after a reboot of all the nodes in the cluster it started. Rebooting again doesn't fix it. (note that this is a dev cluster, so I can trash it if I like..)

### Anything else we need to know?

I'm familiar with networking tools such as iptables and the like, but I'm still not entirely comfortable with kube!

```console
root@dre-worker-3:~# iptables -t nat -L PREROUTING
Chain PREROUTING (policy ACCEPT)
target     prot opt source               destination
KUBE-SERVICES  all  --  anywhere             anywhere             /* kubernetes service portals */
root@dre-worker-3:~# iptables -t nat -L KUBE-SERVICES --line-numbers -n | grep 10.103.175.29.*7800
35   KUBE-SVC-SO2FSRZN7LX374CM  tcp  --  0.0.0.0/0            10.103.175.29       tcp dpt:7800
root@dre-worker-3:~# iptables -t nat -L KUBE-SVC-SO2FSRZN7LX374CM -n --line-numbers
Chain KUBE-SVC-SO2FSRZN7LX374CM (1 references)
num  target     prot opt source               destination
1    KUBE-MARK-MASQ  tcp  -- !10.244.0.0/16        10.103.175.29        tcp dpt:7800
2    KUBE-SEP-TZHJ4X6QNLZKPZYH  all  --  0.0.0.0/0            0.0.0.0/0           
root@dre-worker-3:~# iptables -t nat -L KUBE-MARK-MASQ -n --line-numbers
Chain KUBE-MARK-MASQ (126 references)
num  target     prot opt source               destination
1    MARK       all  --  0.0.0.0/0            0.0.0.0/0            MARK or 0x4000
root@dre-worker-3:~# iptables -t nat -L KUBE-SEP-TZHJ4X6QNLZKPZYH -n --line-numbers
Chain KUBE-SEP-TZHJ4X6QNLZKPZYH (1 references)
num  target     prot opt source               destination
1    KUBE-MARK-MASQ  all  --  10.244.1.189         0.0.0.0/0            
2    DNAT       tcp  --  0.0.0.0/0            0.0.0.0/0            tcp to:10.244.1.189:7800
```
Now there's no SNAT in there, so it's entirely reasonable that pod 2 responds direct to pod 1, but is it *meant* to‽

### Kubernetes version

<details>

```console
$kubectl version
Client Version: v1.28.2
Kustomize Version: v5.0.4-0.20230601165947-6ce0bf390ce3
Server Version: v1.28.3
```

</details>

### Cloud provider

In house, 5 Ubuntu 20.04.6 LTS VMs.

### OS version

<details>

```console
# On Linux:
$cat /etc/os-release
NAME="Ubuntu"
VERSION="20.04.6 LTS (Focal Fossa)"
ID=ubuntu
ID_LIKE=debian
PRETTY_NAME="Ubuntu 20.04.6 LTS"
VERSION_ID="20.04"
HOME_URL="https://www.ubuntu.com/"
SUPPORT_URL="https://help.ubuntu.com/"
BUG_REPORT_URL="https://bugs.launchpad.net/ubuntu/"
PRIVACY_POLICY_URL="https://www.ubuntu.com/legal/terms-and-policies/privacy-policy"
VERSION_CODENAME=focal
UBUNTU_CODENAME=focal
$uname -a
Linux dre-cluster.fyre.ibm.com 5.4.0-167-generic #184-Ubuntu SMP Tue Oct 31 09:21:49 UTC 2023 x86_64 x86_64 x86_64 GNU/Linux
```

</details>

### Install tools

<details>

</details>

### Container runtime (CRI) and version (if applicable)

<details>
CRI-O version 1.25.4-0
</details>

### Related plugins (CNI, CSI, ...) and versions (if applicable)

<details>
```
$dpkg -l kube\*
Desired=Unknown/Install/Remove/Purge/Hold
| Status=Not/Inst/Conf-files/Unpacked/halF-conf/Half-inst/trig-aWait/Trig-pend
|/ Err?=(none)/Reinst-required (Status,Err: uppercase=bad)
||/ Name           Version      Architecture Description
+++-==============-============-============-=====================================
hi  kubeadm        1.28.2-00    amd64        Kubernetes Cluster Bootstrapping Tool
hi  kubectl        1.28.2-00    amd64        Kubernetes Command Line Tool
hi  kubelet        1.28.2-00    amd64        Kubernetes Node Agent
ii  kubernetes-cni 1.2.0-00     amd64        Kubernetes CNI
```
cluster set up with:
```
kubeadm init  --pod-network-cidr=10.244.0.0/16
kubectl apply -f https://github.com/coreos/flannel/raw/master/Documentation/kube-flannel.yml
```
[sequence shortened]

</details>

**Comment by neolit123** [comment]
> I don't know, it wasn't like this before but after a reboot of all the nodes in the cluster it started. Rebooting again doesn't fix it. (note that this is a dev cluster, so I can trash it if I like..)

i think you should use the support forums to ask other users for feedback, unless you really think there is a k8s bug here.
if this is purely a support ticket it should go there regardless.

https://github.com/kubernetes/kubernetes/blob/master/SUPPORT.md

**Comment by aroradaman** [comment]
> Now there's no SNAT in there, so it's entirely reasonable that pod 2 responds direct to pod 1, but is it meant to‽

We don't need SNAT here, `conntrack` handles the reverse translation (dest_pod_ip -> VIP).  Can you also share logs/events for `conntrack` table ?

**Comment by andreas-ibm** [comment]
I'm pretty sure it's a bug *somewhere*, since before the reboot my kafka cluster worked and now it doesn't (though I'm using a different set of services to generate debug info as the containers are easier to use to generate flows).

Good call on conntrack.

grabbing the most recent tcpdump from `cni0`:
```
03:26:08.830155 2a:c7:37:d7:2e:07 > 4e:7d:69:53:97:61, ethertype IPv4 (0x0800), length 74: 10.244.1.192.38530 > 10.103.175.29.7800: Flags [S], seq 1582609996, win 64860, options [mss 1410,sackOK,TS val 1438955416 ecr 0,nop,wscale 7], length 0
03:26:08.830319 4e:7d:69:53:97:61 > 92:dc:e0:5d:fb:15, ethertype IPv4 (0x0800), length 74: 10.244.1.192.38530 > 10.244.1.189.7800: Flags [S], seq 1582609996, win 64860, options [mss 1410,sackOK,TS val 1438955416 ecr 0,nop,wscale 7], length 0
03:26:08.830392 92:dc:e0:5d:fb:15 > 2a:c7:37:d7:2e:07, ethertype IPv4 (0x0800), length 74: 10.244.1.189.7800 > 10.244.1.192.38530: Flags [S.], seq 1420487994, ack 1582609997, win 64308, options [mss 1410,sackOK,TS val 733929093 ecr 1438955416,nop,wscale 7], length 0
03:26:08.830458 2a:c7:37:d7:2e:07 > 92:dc:e0:5d:fb:15, ethertype IPv4 (0x0800), length 54: 10.244.1.192.38530 > 10.244.1.189.7800: Flags [R], seq 1582609997, win 0, lengt
h 0
```
or more simply:
```
10.244.1.192.38530 > 10.103.175.29.7800: Flags [S]
10.244.1.192.38530 > 10.244.1.189.7800: Flags [S]
10.244.1.189.7800 > 10.244.1.192.38530: Flags [S.]
10.244.1.192.38530 > 10.244.1.189.7800: Flags [R]
```
Whilst that was running I had `conntrack -E  |  grep 7800` running:
```
    [NEW] tcp      6 120 SYN_SENT src=10.244.1.192 dst=10.103.175.29 sport=38530 dport=7800 [UNREPLIED] src=10.244.1.189 dst=10.244.1.192 sport=7800 dport=38530
[DESTROY] tcp      6 src=10.244.1.192 dst=10.103.175.29 sport=38530 dport=7800 [UNREPLIED] src=10.244.1.189 dst=10.244.1.192 sport=7800 dport=38530
```
and checking the tables shortly afterwards (within a few seconds):
```
# conntrack -L conntrack | grep 7800
tcp      6 77 SYN_SENT src=10.244.1.192 dst=10.103.175.29 sport=38530 dport=7800 [UNREPLIED] src=10.244.1.189 dst=10.244.1.192 sport=7800 dport=38530 mark=0 use=1
```
(`expect` was empty)

which makes me think that conntrack missed the reply that I see on the tcpdump?

I've enabled trace on the OUTPUT and PREROUTING tables again, just to see if I missed the reply hitting conntrack.  So this is from a different run from above:
```
raw:    PREROUTING:policy:2              IN=cni0 OUT=     MAC=<cni0>:<pod1>:08:00 SRC=<pod1> DST=<svc>  ID=57194 SPT=50254 DPT=7800 SEQ=3351776223  SYN
mangle: PREROUTING:policy:1              IN=cni0 OUT=     MAC=<cni0>:<pod1>:08:00 SRC=<pod1> DST=<svc>  ID=57194 SPT=50254 DPT=7800 SEQ=3351776223  SYN
nat:    PREROUTING:rule:1                IN=cni0 OUT=     MAC=<cni0>:<pod1>:08:00 SRC=<pod1> DST=<svc>  ID=57194 SPT=50254 DPT=7800 SEQ=3351776223  SYN
nat:    KUBE-SERVICES:rule:57            IN=cni0 OUT=     MAC=<cni0>:<pod1>:08:00 SRC=<pod1> DST=<svc>  ID=57194 SPT=50254 DPT=7800 SEQ=3351776223  SYN
nat:    KUBE-SVC-SO2FSRZN7LX374CM:rule:2 IN=cni0 OUT=     MAC=<cni0>:<pod1>:08:00 SRC=<pod1> DST=<svc>  ID=57194 SPT=50254 DPT=7800 SEQ=3351776223  SYN
nat:    KUBE-SEP-TZHJ4X6QNLZKPZYH:rule:2 IN=cni0 OUT=     MAC=<cni0>:<pod1>:08:00 SRC=<pod1> DST=<svc>  ID=57194 SPT=50254 DPT=7800 SEQ=3351776223  SYN
mangle: FORWARD:policy:1                 IN=cni0 OUT=cni0 MAC=<cni0>:<pod1>:08:00 SRC=<pod1> DST=<pod2> ID=57194 SPT=50254 DPT=7800 SEQ=3351776223  SYN
filter: FORWARD:rule:1                   IN=cni0 OUT=cni0 MAC=<cni0>:<pod1>:08:00 SRC=<pod1> DST=<pod2> ID=57194 SPT=50254 DPT=7800 SEQ=3351776223  SYN
filter: KUBE-PROXY-FIREWALL:return:1     IN=cni0 OUT=cni0 MAC=<cni0>:<pod1>:08:00 SRC=<pod1> DST=<pod2> ID=57194 SPT=50254 DPT=7800 SEQ=3351776223  SYN
filter: FORWARD:rule:2                   IN=cni0 OUT=cni0 MAC=<cni0>:<pod1>:08:00 SRC=<pod1> DST=<pod2> ID=57194 SPT=50254 DPT=7800 SEQ=3351776223  SYN
filter: KUBE-FORWARD:return:4            IN=cni0 OUT=cni0 MAC=<cni0>:<pod1>:08:00 SRC=<pod1> DST=<pod2> ID=57194 SPT=50254 DPT=7800 SEQ=3351776223  SYN
filter: FORWARD:rule:3                   IN=cni0 OUT=cni0 MAC=<cni0>:<pod1>:08:00 SRC=<pod1> DST=<pod2> ID=57194 SPT=50254 DPT=7800 SEQ=3351776223  SYN
filter: KUBE-SERVICES:return:21          IN=cni0 OUT=cni0 MAC=<cni0>:<pod1>:08:00 SRC=<pod1> DST=<pod2> ID=57194 SPT=50254 DPT=7800 SEQ=3351776223  SYN
filter: FORWARD:rule:4                   IN=cni0 OUT=cni0 MAC=<cni0>:<pod1>:08:00 SRC=<pod1> DST=<pod2> ID=57194 SPT=50254 DPT=7800 SEQ=3351776223  SYN
filter: KUBE-EXTERNAL-SERVICES:return:7  IN=cni0 OUT=cni0 MAC=<cni0>:<pod1>:08:00 SRC=<pod1> DST=<pod2> ID=57194 SPT=50254 DPT=7800 SEQ=3351776223  SYN
filter: FORWARD:rule:5                   IN=cni0 OUT=cni0 MAC=<cni0>:<pod1>:08:00 SRC=<pod1> DST=<pod2> ID=57194 SPT=50254 DPT=7800 SEQ=3351776223  SYN
filter: FLANNEL-FWD:rule:1               IN=cni0 OUT=cni0 MAC=<cni0>:<pod1>:08:00 SRC=<pod1> DST=<pod2> ID=57194 SPT=50254 DPT=7800 SEQ=3351776223  SYN
mangle: POSTROUTING:policy:1             IN=     OUT=cni0                         SRC=<pod1> DST=<pod2> ID=57194 SPT=50254 DPT=7800 SEQ=3351776223  SYN
nat:    POSTROUTING:rule:1               IN=     OUT=cni0                         SRC=<pod1> DST=<pod2> ID=57194 SPT=50254 DPT=7800 SEQ=3351776223  SYN
nat:    KUBE-POSTROUTING:rule:1          IN=     OUT=cni0                         SRC=<pod1> DST=<pod2> ID=57194 SPT=50254 DPT=7800 SEQ=3351776223  SYN
nat:    POSTROUTING:rule:2               IN=     OUT=cni0                         SRC=<pod1> DST=<pod2> ID=57194 SPT=50254 DPT=7800 SEQ=3351776223  SYN
nat:    FLANNEL-POSTRTG:rule:2           IN=     OUT=cni0                         SRC=<pod1> DST=<pod2> ID=57194 SPT=50254 DPT=7800 SEQ=3351776223  SYN
nat:    POSTROUTING:policy:3             IN=     OUT=cni0                         SRC=<pod1> DST=<pod2> ID=57194 SPT=50254 DPT=7800 SEQ=3351776223  SYN
```
So all I've caught in my little dragnet is the initial SYN packet
for the record, these are the TRACE rules:
```
root@dre-worker-3:~# iptables -t raw -L PREROUTING | grep TRACE
TRACE      tcp  --  anywhere             10.103.175.29
TRACE      tcp  --  anywhere             10.244.1.192
TRACE      tcp  --  anywhere             10.244.1.189
root@dre-worker-3:~# iptables -t raw -L OUTPUT | grep TRACE
TRACE      tcp  --  anywhere             10.103.175.29
TRACE      tcp  --  anywhere             10.244.1.189
TRACE      tcp  --  anywhere             10.244.1.192
```
I would expect the OUTPUT table to get a look at the packet before it hit conntrack on the way back, but I see no trace for it.
I don't know how to connect veth devices to their pods with CRI-o runtime, but there are 16 pods in Running state on this worker with 14 veth devices defined, can they share?

**Comment by andreas-ibm** [comment]
right, you can almost *see* me learning more as the comments progress... I'll have forgotten this all next week.

So I've figured out how to grab the netns and link it to a veth pair.  So 
pod1 = veth30f692a5
pod2 = vethedbd8260

attaching tcpdump to those rather than `cni0` gives me the following for pod2 (the target pod):
```
08:39:34.085147 4e:7d:69:53:97:61 > 92:dc:e0:5d:fb:15, ethertype IPv4 (0x0800), length 74: 10.244.1.192.42232 > 10.244.1.189.7800: Flags [S], seq 605291326, win 64860, options [mss 1410,sackOK,TS val 1457760671 ecr 0,nop,wscale 7], length 0
08:39:34.085195 92:dc:e0:5d:fb:15 > 2a:c7:37:d7:2e:07, ethertype IPv4 (0x0800), length 74: 10.244.1.189.7800 > 10.244.1.192.42232: Flags [S.], seq 2053326278, ack 605291327, win 64308, options [mss 1410,sackOK,TS val 752734348 ecr 1457760671,nop,wscale 7], length 0
08:39:34.085218 2a:c7:37:d7:2e:07 > 92:dc:e0:5d:fb:15, ethertype IPv4 (0x0800), length 54: 10.244.1.192.42232 > 10.244.1.189.7800: Flags [R], seq 605291327, win 0, length 0
```
Which is what we've seen already.
pod 1:
```
08:44:28.997084 2a:c7:37:d7:2e:07 > 4e:7d:69:53:97:61, ethertype IPv4 (0x0800), length 74: 10.244.1.192.42240 > 10.103.175.29.7800: Flags [S], seq 2433400811, win 64860, options [mss 1410,sackOK,TS val 1458055583 ecr 0,nop,wscale 7], length 0
08:44:28.997309 92:dc:e0:5d:fb:15 > 2a:c7:37:d7:2e:07, ethertype IPv4 (0x0800), length 74: 10.244.1.189.7800 > 10.244.1.192.42240: Flags [S.], seq 344692660, ack 2433400812, win 64308, options [mss 1410,sackOK,TS val 753029260 ecr 1458055583,nop,wscale 7], length 0
08:44:28.997325 2a:c7:37:d7:2e:07 > 92:dc:e0:5d:fb:15, ethertype IPv4 (0x0800), length 54: 10.244.1.192.42240 > 10.244.1.189.7800: Flags [R], seq 2433400812, win 0, length 0
```
which reflects what we expect there, it sends a packet to the ClusterIP and gets a response from pod2 and confusion ensues. (you'll note that the two traces have different ports and sequence numbers... originally I traced the wrong veth and got nothing, then realised I was looking at the wrong netns)

**Comment by uablrek** [comment]
Is this a one-node cluster? Or a one-worker cluster? So pod1 and pod2 are on the same node?

**Comment by uablrek** [comment]
Please check:
```
sysctl -w net.bridge.bridge-nf-call-iptables=1
```
this is very important!

**Comment by whc9527** [comment]
I ran into the same problem, and with the help of an AWS architect I found the reason and failed to load the package.
modprobe br_netfilter
