### ISSUE TITLE
`externalTrafficPolicy=Local` incorrectly rewrites client IP on traffic coming through SingleStack IPv6 loadbalancer services on a dual-stack cluster

### ISSUE THREAD

**Issue by growse** [kubernetes/kubernetes#102527]
#### What happened:

IPv6 network traffic to a pod via a `SingleStack` IPv6 loadbalancer service with `externalTrafficPolicy=Local` have their source IP addresses rewritten to a seemingly random service cluster IPv6 address. This rewriting is reversed for the return traffic, so traffic flows normally, but the pod ends up not seeing the client IP.

`tcpdump -i any` on the cluster host showing the initial SYN packets shows that the source IP (`2001:8b0:c8f:e8b0:3183:17af:7df2:f096`) is being rewritten to `fd5a:1111:1111::536a` before being passed to the pod (`fd5a:5555:5555:b0a2:a3e9:33ee:7385:7a10`):

```
12:08:06.023093 IP6 2001:8b0:c8f:e8b0:3183:17af:7df2:f096.62644 > 2001:8b0:c8f:e8b1:beef:f00d:0:11.80: Flags [SEW], seq 288030416, win 65535, options [mss 1440,nop,wscale 6,nop,nop,TS val 1688241656 ecr 0,sackOK,eol], length 0
12:08:06.023272 IP6 fd5a:1111:1111::536a.62644 > fd5a:5555:5555:b0a2:a3e9:33ee:7385:7a10.80: Flags [SEW], seq 288030416, win 65535, options [mss 1440,nop,wscale 6,nop,nop,TS val 1688241656 ecr 0,sackOK,eol], length 0
12:08:06.023438 IP6 fd5a:5555:5555:b0a2:a3e9:33ee:7385:7a10.80 > fd5a:1111:1111::536a.62644: Flags [S.E], seq 1460675109, ack 288030417, win 62496, options [mss 8940,sackOK,TS val 1922047512 ecr 1688241656,nop,wscale 7], length 0
12:08:06.023481 IP6 2001:8b0:c8f:e8b1:beef:f00d:0:11.80 > 2001:8b0:c8f:e8b0:3183:17af:7df2:f096.62644: Flags [S.E], seq 1460675109, ack 288030417, win 62496, options [mss 8940,sackOK,TS val 1922047512 ecr 1688241656,nop,wscale 7], length 0
```

If I set the service `externalTrafficPolicy` to be `Cluster`, the behaviour is the same.

#### What you expected to happen:

The source IP address from the client as seen by the pod should be preserved. This behaviour works correctly on IPv4.

`tcpdump -i any` shows that the host is preserving the incoming source IP `192.168.2.132` on the connection to the pod `10.244.176.178`

```
11:59:41.070448 IP 192.168.2.132.62366 > 192.168.254.11.80: Flags [SEW], seq 2177333562, win 65535, options [mss 1460,nop,wscale 6,nop,nop,TS val 3983919184 ecr 0,sackOK,eol], length 0
11:59:41.070601 IP 192.168.2.132.62366 > 10.244.176.178.80: Flags [SEW], seq 2177333562, win 65535, options [mss 1460,nop,wscale 6,nop,nop,TS val 3983919184 ecr 0,sackOK,eol], length 0
11:59:41.070659 IP 10.244.176.178.80 > 192.168.2.132.62366: Flags [S.E], seq 3762765636, ack 2177333563, win 62636, options [mss 8960,sackOK,TS val 894911894 ecr 3983919184,nop,wscale 7], length 0
11:59:41.070689 IP 192.168.254.11.80 > 192.168.2.132.62366: Flags [S.E], seq 3762765636, ack 2177333563, win 62636, options [mss 8960,sackOK,TS val 894911894 ecr 3983919184,nop,wscale 7], length 0
```

#### How to reproduce it (as minimally and precisely as possible):

Using the following manifest, curl first the IPv4 endpoint to see the nginx pod log the correct client IP (`192.168.2.132`):
```
192.168.2.132 - - [02/Jun/2021:12:01:33 +0000] "GET / HTTP/1.1" 200 612 "-" "curl/7.64.1" "-"
```
Then curl the IPv6 loadbalancer address and notice that nginx logs an IP address in the `serviceSubnet` endpoint (`fd5a:1111:1111::/112`). In this case, the IP logged `fd5a:1111:1111::536a` is the cluster IP of a completely unrelated service:
```
fd5a:1111:1111::536a - - [02/Jun/2021:11:58:53 +0000] "GET / HTTP/1.1" 200 612 "-" "curl/7.64.1" "-"
```

```
---
apiVersion: v1
kind: Service
metadata:
  name: test-service-source-ip-v4
  namespace: default
  labels:
    k8s-app: test-service-source-ip
spec:
  selector:
    k8s-app: test-service-source-ip
  type: LoadBalancer
  ipFamilies:
    - IPv4
  ipFamilyPolicy: SingleStack
  loadBalancerIP: 192.168.254.11
  externalTrafficPolicy: "Local"
  ports:
    - name: http-tcp
      protocol: TCP
      port: 80
---
apiVersion: v1
kind: Service
metadata:
  name: test-service-source-ip-v6
  namespace: default
  labels:
    k8s-app: test-service-source-ip
spec:
  selector:
    k8s-app: test-service-source-ip
  type: LoadBalancer
  ipFamilies:
    - IPv6
  ipFamilyPolicy: SingleStack
  loadBalancerIP: 2001:8b0:c8f:e8b1:beef:f00d::11
  externalTrafficPolicy: "Local"
  ports:
    - name: http-tcp
      protocol: TCP
      port: 80

---
apiVersion: apps/v1
kind: Deployment
metadata:
  namespace: default
  name: test-service-source-ip
  labels:
    k8s-app: test-service-source-ip
spec:
  replicas: 1
  selector:
    matchLabels:
      k8s-app: test-service-source-ip
  template:
    metadata:
      labels:
        k8s-app: test-service-source-ip
    spec:
      containers:
        - name: test-service-source-ip
          image: nginx:1
          ports:
            - containerPort: 80
              protocol: TCP
```

#### Anything else we need to know?:

Calico announces the load-balancer IPs to the local off-cluster router via BGP.

This is a dual-stack cluster, so uses `kube-proxy` in `ipvs` mode. I can't see anything obvious from either `ipvsadm` or `iptables` that would indicate why `ipvs` is rewriting the IP.

#### Environment:
- Kubernetes version (use `kubectl version`): v1.21.1
- Cloud provider or hardware configuration: Bare metal. Debian buster hosts.
- OS (e.g: `cat /etc/os-release`): `"Debian GNU/Linux 10 (buster)"`
- Kernel (e.g. `uname -a`): Both buster `4.19.0-16-amd64 #1 SMP Debian 4.19.181-1 (2021-03-19) x86_64 GNU/Linux` and backported `5.10.0-0.bpo.5-amd64 #1 SMP Debian 5.10.24-1~bpo10+1 (2021-03-29) x86_64 GNU/Linux`
- Install tools: `kubeadm`
- Network plugin and version (if this is a network-related bug): Calico v3.19.1. Also seen on v3.18.
- Others: MetalLB for loadbalancer IP address assignment

**Comment by uablrek** [comment]
A seemingly weird question; can you check if the "seemingly random service cluster IPv6 address" happens to be the firsts ipv6 address on the `kube-ipvs0` device?
```
ip -6 addr show dev kube-ipvs0
```

**Comment by uablrek** [comment]
Are you using the "normal" backend for Calico? I.e. not ePBF or VPP?

**Comment by growse** [comment]
> A seemingly weird question; can you check if the "seemingly random service cluster IPv6 address" happens to be the firsts ipv6 address on the kube-ipvs0 device?

It is.

```
ip -6 addr show dev kube-ipvs0
3: kube-ipvs0: <BROADCAST,NOARP> mtu 1500 state DOWN
    inet6 fd5a:1111:1111::536a/128 scope global
       valid_lft forever preferred_lft forever
```

> Are you using the "normal" backend for Calico? I.e. not ePBF or VPP?

I believe so.

**Comment by uablrek** [comment]
I have upgraded my Calico to `v3.19.1` and run on K8s `v1.21.1` but I can't reproduce this problem. The external source is preserved. Here is a trace with `tcpdump -ni any port 80` similar to the one in this issue;
```
11:59:04.781981 IP6 1000::1:c0a8:1c9.58206 > 1000::82.80: Flags [S], seq 3767886493, win 64800, options [mss 1440,sackOK,TS val 3484676948 ecr 0,nop,wscale 6], length 0
11:59:04.782197 IP6 1000::1:c0a8:1c9.58206 > 1100::b00:f641.80: Flags [S], seq 3767886493, win 64800, options [mss 1440,sackOK,TS val 3484676948 ecr 0,nop,wscale 6], length 0
```
The external source address `1000::1:c0a8:1c9` is preserved. The loadBalancerIP `1000::82` is DNAT'ed to the POD address `1100::b00:f641`, as it should.

**Comment by uablrek** [comment]
SNAT is not done by `ipvs` it is done by `ip6tables -t nat`. That the SNAT'ed address is the first on `kube-ipvs0` indicates that the packet is actually routed to `kube-ipvs0` and the source is masqueraded. This is very weird :confused: 

Can you do a route query on the K8s node that receives the traffic on your POD address, like;
```
ip -6 ro get fd5a:5555:5555:b0a2:a3e9:33ee:7385:7a10
```
The result should be a "cali*" device. Example on my system;
```
$ ip -6 ro get 1100::b00:f641
1100::b00:f641 from :: dev cali156de29358e src 1000::1:c0a8:4 metric 1024 pref medium
$ ip link show dev cali156de29358e
18: cali156de29358e@if12: <BROADCAST,MULTICAST,UP,LOWER_UP> mtu 1480 qdisc noqueue state UP mode DEFAULT group default 
    link/ether ee:ee:ee:ee:ee:ee brd ff:ff:ff:ff:ff:ff link-netnsid 1
```

**Comment by growse** [comment]
I've done some restarting in the interim, so the addresses are now different (confusingly. Sorry! I'll try not to reboot / restart things again)

So, to recap, the client IP is now being rewritten to `fd5a:1111:1111::5854`. This is the cluster IP of an unrelated service. As previously, this is the first address on `kube-ipvs0`:

```
$ ip -6 addr show dev kube-ipvs0| head -n 3
3: kube-ipvs0: <BROADCAST,NOARP> mtu 1500 state DOWN
    inet6 fd5a:1111:1111::5854/128 scope global
       valid_lft forever preferred_lft forever
```

The pod ip is now `fd5a:5555:5555:b0a2:a3e9:33ee:7385:7a37`.

```
$ ip -6 ro get fd5a:5555:5555:b0a2:a3e9:33ee:7385:7a37
fd5a:5555:5555:b0a2:a3e9:33ee:7385:7a37 from :: dev cali0d8661320dc src fd5a:1111:1111::5854 metric 1024 pref medium
```

It is a cali* device, but the `src` is that `fd5a:1111:1111::5854` service address. This value is the same for other unrelated pods on the same host too, e.g.

```
$ ip -6 ro get fd5a:5555:5555:b0a2:a3e9:33ee:7385:7a3f
fd5a:5555:5555:b0a2:a3e9:33ee:7385:7a3f from :: dev cali75c6c087747 src fd5a:1111:1111::5854 metric 1024 pref medium
```

**Comment by uablrek** [comment]
Ok, the `src fd5a:1111:1111::5854` explains why you get that address as source. IMHO it shouldn't be there! This may be a `Calico` thing.

**Comment by uablrek** [comment]
I set;
```
            - name: IP_AUTODETECTION_METHOD
              value: "interface=eth1"
            - name: IP6_AUTODETECTION_METHOD
              value: "interface=eth1"
```
in my calico config. I think that's something you should try also. The device should be the one used for K8s traffic. I have eth0, eth1 and sometimes eth2,3,4. So I _must_ give Calico a hint.

**Comment by uablrek** [comment]
That can probably explain the incorrect address since the incorrect source will not prevent masquerading. I leave this for `Calico` folks to investigate for now. I can't triage it as a bug in K8s, at least not yet.

**Comment by uablrek** [comment]
> Sorry! I'll try not to reboot / restart things again

@growse Shouldn't be a problem. Go ahead and reboot/restart. Nobody can expect you to keep a fulty cluster running.

**Comment by growse** [comment]
> I set;
> 
> ```
>             - name: IP_AUTODETECTION_METHOD
>               value: "interface=eth1"
>             - name: IP6_AUTODETECTION_METHOD
>               value: "interface=eth1"
> ```
> 
> in my calico config. I think that's something you should try also. The device should be the one used for K8s traffic. I have eth0, eth1 and sometimes eth2,3,4. So I _must_ give Calico a hint.

Aha, I have

```
            - name: IP6_AUTODETECTION_METHOD
              value: cidr=2001:8b0:c8f:e8b0::/112
```

Because I wanted calico to choose the DHCPv6 address assigned to the host, rather than the `mngtmpaddr noprefixroute` IPv6 addresses that come from accepting the IPv6 router advert.

I dropped this from the calico config and repdeployed, but I see the same behaviour.

> That can probably explain the incorrect address since the incorrect source will not prevent masquerading. I leave this for Calico folks to investigate for now. I can't triage it as a bug in K8s, at least not yet.

Sure thing, I think I agree.

**Comment by aojea** [comment]
> Sure thing, I think I agree.

If this is not Kubernetes, can we close this issue?
You can open a new one in Calico and follow up with them there

**Comment by growse** [comment]
I'm happy to cross-post this to the calico project. I've just found another related issue that I was going to file there directly anyway, so will combine.

**Comment by uablrek** [comment]
I think Calico faultly select an address from the `kube-ipvs0` device as beeing the node address and use it as "src" for routes. This happens to be a service ip (_which was most confusing_).

This must be fixed by configuration of Calico. I still think
```
            - name: IP6_AUTODETECTION_METHOD
              value: "interface=eth1"
```
is the way (your interface instead of "eth1" of course). To avoid SLAAC addresses do;
```
sysctl -w net.ipv6.conf.eth1.accept_ra=0
```
Hopefully this will leave only the DHCP6 (and link-local) address on your interface. Below is the kernel doc;
```
accept_ra - INTEGER
        Accept Router Advertisements; autoconfigure using them.

        It also determines whether or not to transmit Router
        Solicitations. If and only if the functional setting is to
        accept Router Advertisements, Router Solicitations will be
        transmitted.

        Possible values are:

                ==  ===========================================================
                 0  Do not accept Router Advertisements.
                 1  Accept Router Advertisements if forwarding is disabled.
                 2  Overrule forwarding behaviour. Accept Router Advertisements
                    even if forwarding is enabled.
                ==  ===========================================================

        Functional default:

                - enabled if local forwarding is disabled.
                - disabled if local forwarding is enabled.
```

I close this issue now as not beeing a fault in K8s. Please reopen if neccessary.

/close
